id,abstract
https://openalex.org/W2005618630,"Background To improve retention on ART, Médecins Sans Frontières, the Ministry of Health and patients piloted a community-based antiretroviral distribution and adherence monitoring model through Community ART Groups (CAG) in Tete, Mozambique. By December 2012, almost 6000 patients on ART had formed groups of whom 95.7% were retained in care. We conducted a qualitative study to evaluate the relevance, dynamic and impact of the CAG model on patients, their communities and the healthcare system. Methods Between October 2011 and May 2012, we conducted 16 focus group discussions and 24 in-depth interviews with the major stakeholders involved in the CAG model. Audio-recorded data were transcribed verbatim and analysed using a grounded theory approach. Results Six key themes emerged from the data: 1) Barriers to access HIV care, 2) CAG functioning and actors involved, 3) Benefits for CAG members, 4) Impacts of CAG beyond the group members, 5) Setbacks, and 6) Acceptance and future expectations of the CAG model. The model provides cost and time savings, certainty of ART access and mutual peer support resulting in better adherence to treatment. Through the active role of patients, HIV information could be conveyed to the broader community, leading to an increased uptake of services and positive transformation of the identity of people living with HIV. Potential pitfalls included limited access to CAG for those most vulnerable to defaulting, some inequity to patients in individual ART care and a high dependency on counsellors. Conclusion The CAG model resulted in active patient involvement and empowerment, and the creation of a supportive environment improving the ART retention. It also sparked a reorientation of healthcare services towards the community and strengthened community actions. Successful implementation and scalability requires (a) the acceptance of patients as partners in health, (b) adequate resources, and (c) a well-functioning monitoring and management system."
https://openalex.org/W1965339681,"Background Individuals with anorexia nervosa (AN) are often cognitively rigid and behaviorally over-controlled. We previously showed that adult females recovered from AN relative to healthy comparison females had less prefrontal activation during an inhibition task, which suggested a functional brain correlate of altered inhibitory processing in individuals recovered from AN. However, the degree to which these functional brain alterations are related to disease state and whether error processing is altered in AN individuals is unknown. Methodology/Principal Findings In the current study, ill adolescent AN females (n = 11) and matched healthy comparison adolescents (CA) with no history of an eating disorder (n = 12) performed a validated stop signal task (SST) during functional magnetic resonance imaging (fMRI) to explore differences in error and inhibitory processing. The groups did not differ on sociodemographic variables or on SST performance. During inhibitory processing, a significant group x difficulty (hard, easy) interaction was detected in the right dorsal anterior cingulate cortex (ACC), right middle frontal gyrus (MFG), and left posterior cingulate cortex (PCC), which was characterized by less activation in AN compared to CA participants during hard trials. During error processing, a significant group x accuracy (successful inhibit, failed inhibit) interaction in bilateral MFG and right PCC was observed, which was characterized by less activation in AN compared to CA participants during error (i.e., failed inhibit) trials. Conclusion/Significance Consistent with our prior findings in recovered AN, ill AN adolescents, relative to CA, showed less inhibition-related activation within the dorsal ACC, MFG and PCC as inhibitory demand increased. In addition, ill AN adolescents, relative to CA, also showed reduced activation to errors in the bilateral MFG and left PCC. These findings suggest that altered prefrontal and cingulate activation during inhibitory and error processing may represent a behavioral characteristic in AN that is independent of the state of recovery."
https://openalex.org/W1984194161,"Background Many tardigrade species are capable of anhydrobiosis; however, mechanisms underlying their extreme desiccation resistance remain elusive. This study attempts to quantify the anhydrobiotic transcriptome of the limno-terrestrial tardigrade Milnesium tardigradum. Results A prerequisite for differential gene expression analysis was the generation of a reference hybrid transcriptome atlas by assembly of Sanger, 454 and Illumina sequence data. The final assembly yielded 79,064 contigs (>100 bp) after removal of ribosomal RNAs. Around 50% of them could be annotated by SwissProt and NCBI non-redundant protein sequences. Analysis using CEGMA predicted 232 (93.5%) out of the 248 highly conserved eukaryotic genes in the assembly. We used this reference transcriptome for mapping and quantifying the expression of transcripts regulated under anhdydrobiosis in a time-series during dehydration and rehydration. 834 of the transcripts were found to be differentially expressed in a single stage (dehydration/inactive tun/rehydration) and 184 were overlapping in two stages while 74 were differentially expressed in all three stages. We have found interesting patterns of differentially expressed transcripts that are in concordance with a common hypothesis of metabolic shutdown during anhydrobiosis. This included down-regulation of several proteins of the DNA replication and translational machinery and protein degradation. Among others, heat shock proteins Hsp27 and Hsp30c were up-regulated in response to dehydration and rehydration. In addition, we observed up-regulation of ployubiquitin-B upon rehydration together with a higher expression level of several DNA repair proteins during rehydration than in the dehydration stage. Conclusions Most of the transcripts identified to be differentially expressed had distinct cellular function. Our data suggest a concerted molecular adaptation in M. tardigradum that permits extreme forms of ametabolic states such as anhydrobiosis. It is temping to surmise that the desiccation tolerance of tradigrades can be achieved by a constitutive cellular protection system, probably in conjunction with other mechanisms such as rehydration-induced cellular repair."
https://openalex.org/W2081094686,"Previous studies suggest that fracture healing is impaired in diabetes; however, the underlying mechanism remains unclear. Here, we investigated the roles of plasminogen activator inhibitor-1 (PAI-1) in the impaired bone repair process by using streptozotocin (STZ)-induced diabetic female wild-type (PAI-1+/+) and PAI-1-deficient (PAI-1-/-) mice. Bone repair and the number of alkaline phosphatase (ALP)-positive cells at the site of a femoral bone damage were comparable in PAI-1+/+ and PAI-1-/- mice without STZ treatment. Although the bone repair process was delayed by STZ treatment in PAI-1+/+ mice, this delayed bone repair was blunted in PAI-1-/- mice. The reduction in the number of ALP-positive cells at the site of bone damage induced by STZ treatment was attenuated in PAI-1-/- mice compared to PAI-1+/+ mice. On the other hand, PAI-1 deficiency increased the levels of ALP and type I collagen mRNA in female mice with or without STZ treatment, and the levels of Osterix and osteocalcin mRNA, suppressed by diabetic state in PAI-1+/+ mice, were partially protected in PAI-1-/- mice. PAI-1 deficiency did not affect formation of the cartilage matrix and the levels of types II and X collagen and aggrecan mRNA suppressed by STZ treatment, although PAI-1 deficiency increased the expression of chondrogenic markers in mice without STZ treatment. The present study indicates that PAI-1 is involved in the impaired bone repair process induced by the diabetic state in part through a decrease in the number of ALP-positive cells."
https://openalex.org/W1964242955,"The effects of single or multiple concordant HPV infections at various anatomical sites on type-specific HPV seropositivity are currently unknown. In this cross-sectional study we assessed whether high-risk HPV infections at various anatomical sites (i.e., anal canal, penile shaft, and oral cavity), as well as concordant infections at multiple anatomical sites, were associated with type-specific seropositivity in HIV-positive and HIV-negative MSM. MSM aged ≥18 years were recruited in Amsterdam, the Netherlands (2010–2011). Baseline anal, penile, and oral samples were analyzed for HPV DNA and genotyped using a highly sensitive PCR and reverse line blot assay. Virus-like particle (VLP) based multiplex immunoassay was used to asses HPV-specific serum antibodies against L1 VLPs. The associations between HPV infections and type-specific seropositivity of seven high-risk HPV types (7-hrHPV: types 16, 18, 31, 33, 45, 52, 58) were estimated using logistic regression analyses with generalized estimating equations. We found that 86% of 306 HIV-positive MSM and 62% of 441 HIV-negative MSM were seropositive for at least one 7-hrHPV type. 69% of HIV-positive and 41% of HIV-negative MSM were infected with at least one 7-hrHPV type at the anus, penis, or oral cavity. In multivariable analyses, 7-hrHPV seropositivity was associated with type-specific anal (and not penile) 7-hrHPV infection, and did not significantly increase with a higher number of infected anatomical sites. Oral 7-hrHPV infection showed a positive, albeit non-significant, association with seropositivity. In conclusion, seropositivity among MSM appears to be largely associated with anal HPV infection, irrespective of additionally infected anatomical sites."
https://openalex.org/W2042280256,"Background Deregulation of canonical Wnt/CTNNB1 (beta-catenin) pathway is one of the earliest events in the pathogenesis of colon cancer. Mutations in APC or CTNNB1 are highly frequent in colon cancer and cause aberrant stabilization of CTNNB1, which activates the transcription of Wnt target genes by binding to chromatin via the TCF/LEF transcription factors. Here we report an integrative analysis of genome-wide chromatin occupancy of CTNNB1 by chromatin immunoprecipitation coupled with high-throughput sequencing (ChIP-seq) and gene expression profiling by microarray analysis upon RNAi-mediated knockdown of CTNNB1 in colon cancer cells. Results We observed 3629 CTNNB1 binding peaks across the genome and a significant correlation between CTNNB1 binding and knockdown-induced gene expression change. Our integrative analysis led to the discovery of a direct Wnt target signature composed of 162 genes. Gene ontology analysis of this signature revealed a significant enrichment of Wnt pathway genes, suggesting multiple feedback regulations of the pathway. We provide evidence that this gene signature partially overlaps with the Lgr5+ intestinal stem cell signature, and is significantly enriched in normal intestinal stem cells as well as in clinical colorectal cancer samples. Interestingly, while the expression of the CTNNB1 target gene set does not correlate with survival, elevated expression of negative feedback regulators within the signature predicts better prognosis. Conclusion Our data provide a genome-wide view of chromatin occupancy and gene regulation of Wnt/CTNNB1 signaling in colon cancer cells."
https://openalex.org/W2016796496,"Virgin olive oil phenolic compounds are responsible for its nutritional and sensory quality. The synthesis of phenolic compounds occurs when enzymes and substrates meet as olive fruit is crushed during the industrial process to obtain the oil. The genetic variability of the major phenolic compounds of virgin olive oil was studied in a progeny of the cross of Picual x Arbequina olive cultivars (Olea europaea L.). They belong to four different groups: compounds that included tyrosol or hydroxytyrosol in their molecules, lignans, flavonoids, and phenolic acids. Data of phenolics in the oils showed that the progeny displayed a large degree of variability, widely transgressing the genitor levels. This high variability can be of interest on breeding programs. Thus, multivariate analysis allowed to identify genotypes within the progeny particularly interesting in terms of phenolic composition and deduced organoleptic and nutritional quality. The present study has demonstrated that it is possible to obtain enough degree of variability with a single cross of olive cultivars for compounds related to the nutritional and organoleptic properties of virgin olive oil."
https://openalex.org/W2064399578,"The pathogenesis of abdominal aortic aneurysm (AAA) is characterized to be inflammation-associated degeneration of vascular wall. Neovascularization is regularly found in human AAA and considered to play critical roles in the development and rupture of AAA. However, little is known about lymphangiogenesis in AAA. The purpose of this study was to demonstrate both angiogenesis and lymphangiogenesis in AAA. Abdominal aortic tissue was harvested either from autopsy (control group) and during open-repair surgery for AAA (AAA group). Adventitial lymphatic vasa vasorum was observed in both groups, but seemed to be no significant morphological changes in AAA. Immunohistochemical studies identified infiltration of lymphatic vessel endothelial hyaluronan receptor (LYVE) -1, vascular endothelial growth factor (VEGF)-C, and matrix metalloproteinase (MMP)-9-positive macrophages and podoplanin and Prox-1-positive microvessels in the intima/media in AAA wall, where hypoxia-inducible factors (HIF)-1α was expressed. VEGF-C and MMP-9 were not expressed in macrophages infiltrating in the adventitia. Intraoperative indocyanine green fluorescence lymphography revealed lymph stasis in intima/medial in AAA. Fluorescence microscopy of the collected samples also confirmed the accumulation of lymph in the intima/media but not in adventitia. These results demonstrate that infiltration of macrophages in intima/media is associated with lymphangiogenesis and angiogenesis in AAA. Lymph-drainage appeared to be insufficient in the AAA wall."
https://openalex.org/W1967756972,"While estimates of connectivity are important for effective management, few such estimates are available for reef invertebrates other than for corals. Barrel sponges are one of the largest and most conspicuous members of the coral reef fauna across the Indo-Pacific and given their large size, longevity and ability to process large volumes of water, they have a major role in reef functioning. Here we used a panel of microsatellite markers to characterise the genetic structure of two barrel sponge species, Xestospongia testudinaria and a currently undescribed Xestospongia species. We sampled across seven populations in the Wakatobi Marine National Park, SE Sulawesi (Indonesia) spanning a spatial scale of approximately 2 to 70 km, and present the first estimates of demographic connectivity for coral reef sponges. Genetic analyses showed high levels of genetic differentiation between all populations for both species, but contrasting patterns of genetic structuring for the two species. Autocorrelation analyses showed the likely dispersal distances of both species to be in the order of 60 and 140 m for Xestopongia sp. and Xestospongia testudinaria, respectively, which was supported by assignment tests that showed high levels of self-recruitment (>80%). We also found consistently high inbreeding coefficients across all populations for both species. Our study highlights the potential susceptibility of barrel sponges to environmental perturbations because they are generally long-lived, slow growing, have small population sizes and are likely to be reliant on self-recruitment. Surprisingly, despite these features we actually found the highest abundance of both barrel sponge species (although they were generally smaller) at a site that has been severely impacted by humans over the last fifty years. This suggests that barrel sponges exhibit environmental adaptation to declining environmental quality and has important implications for the management and conservation of these important reef species."
https://openalex.org/W2106700773,"The orexinergic neurons of the lateral hypothalamus (Orx) are essential for regulating sleep-wake dynamics, and their loss causes narcolepsy, a disorder characterized by severe instability of sleep and wake states. However, the mechanisms through which Orx stabilize sleep and wake are not well understood. In this work, an explanation of the stabilizing effects of Orx is presented using a quantitative model of important physiological connections between Orx and the sleep-wake switch. In addition to Orx and the sleep-wake switch, which is composed of mutually inhibitory wake-active monoaminergic neurons in brainstem and hypothalamus (MA) and the sleep-active ventrolateral preoptic neurons of the hypothalamus (VLPO), the model also includes the circadian and homeostatic sleep drives. It is shown that Orx stabilizes prolonged waking episodes via its excitatory input to MA and by relaying a circadian input to MA, thus sustaining MA firing activity during the circadian day. During sleep, both Orx and MA are inhibited by the VLPO, and the subsequent reduction in Orx input to the MA indirectly stabilizes sustained sleep episodes. Simulating a loss of Orx, the model produces dynamics resembling narcolepsy, including frequent transitions between states, reduced waking arousal levels, and a normal daily amount of total sleep. The model predicts a change in sleep timing with differences in orexin levels, with higher orexin levels delaying the normal sleep episode, suggesting that individual differences in Orx signaling may contribute to chronotype. Dynamics resembling sleep inertia also emerge from the model as a gradual sleep-to-wake transition on a timescale that varies with that of Orx dynamics. The quantitative, physiologically based model developed in this work thus provides a new explanation of how Orx stabilizes prolonged episodes of sleep and wake, and makes a range of experimentally testable predictions, including a role for Orx in chronotype and sleep inertia."
https://openalex.org/W1996171649,"Spontaneous fluctuations in blood oxygenation level-dependent (BOLD) images are the basis of resting-state fMRI and frequently used for functional connectivity studies. However, there may be intrinsic information in the amplitudes of these fluctuations. We investigated the possibility of using the amplitude of spontaneous BOLD signal fluctuations as a biomarker for cerebral vasomotor reactivity. We compared the coefficient of variation (CV) of the time series (defined as the temporal standard deviation of the time series divided by the mean signal intensity) in two populations: 1) Ten young healthy adults and 2) Ten hypertensive elderly subjects with chronic kidney disease (CKD). We found a statistically significant increase (P<0.01) in the CV values for the CKD patients compared with the young healthy adults in both gray matter (GM) and white matter (WM). The difference was independent of the exact segmentation method, became more significant after correcting for physiological signals using RETROICOR, and mainly arose from very low frequency components of the BOLD signal fluctuation (f<0.025 Hz). Furthermore, there was a strong relationship between WM and GM signal fluctuation CV's (R2 = 0.87) in individuals, with a ratio of about 1∶3. These results suggest that amplitude of the spontaneous BOLD signal fluctuations may be used to assess the cerebrovascular reactivity mechanisms and provide valuable information about variations with age and different disease states."
https://openalex.org/W2059486263,"The objective of the present investigation was to evaluate the effect of L-glutamine on cardiac myopathy in streptozotocin-nicotinamide induced diabetic rats. Diabetes was induced in overnight fasted Sprague Dawely rats by using intraperitonial injection of streptozotocin (55 mg/kg). Nicotinamide (100 mg/kg, i.p.) was administered 20 min before administration of streptozotocin. Experimental rats were divided into Group I: non-diabetic control (distilled water; 10 ml/kg, p.o.), II: diabetic control (distilled water, 10 ml/kg, p.o.), III: L-glutamine (500 mg/kg, p.o.) and IV: L-glutamine (1000 mg/kg, p.o.). All groups were diabetic except group I. The plasma glucose level, body weight, electrocardiographic abnormalities, hemodynamic changes and left ventricular contractile function, biological markers of cardiotoxicity, antioxidant markers were determined after 4 months after STZ with nicotinamide injection. Histopathological changes of heart tissue were carried out by using H and E stain. L-glutamine treatment improved the electrocardiographic, hemodynamic changes; LV contractile function; biological markers; oxidative stress parameters and histological changes in STZ induced diabetic rats. Results from the present investigation demonstrated that L-glutamine has seemed a cardioprotective activity."
https://openalex.org/W2068920815,"Non-healing foot ulcers are the most common cause of non-traumatic amputation and hospitalization amongst diabetics in the developed world. Impaired wound neovascularization perpetuates a cycle of dysfunctional tissue repair and regeneration. Evidence implicates defective mobilization of marrow-derived progenitor cells (PCs) as a fundamental cause of impaired diabetic neovascularization. Currently, there are no FDA-approved therapies to address this defect. Here we report an endogenous PC strategy to improve diabetic wound neovascularization and closure through a combination therapy of AMD3100, which mobilizes marrow-derived PCs by competitively binding to the cell surface CXCR4 receptor, and PDGF-BB, which is a protein known to enhance cell growth, progenitor cell migration and angiogenesis.Wounded mice were assigned to 1 of 5 experimental arms (n = 8/arm): saline treated wild-type, saline treated diabetic, AMD3100 treated diabetic, PDGF-BB treated diabetic, and AMD3100/PDGF-BB treated diabetic. Circulating PC number and wound vascularity were analyzed for each group (n = 8/group). Cellular function was assessed in the presence of AMD3100. Using a validated preclinical model of type II diabetic wound healing, we show that AMD3100 therapy (10 mg/kg; i.p. daily) alone can rescue diabetes-specific defects in PC mobilization, but cannot restore normal wound neovascularization. Through further investigation, we demonstrate an acquired trafficking-defect within AMD3100-treated diabetic PCs that can be rescued by PDGF-BB (2 μg; topical) supplementation within the wound environment. Finally, we determine that combination therapy restores diabetic wound neovascularization and accelerates time to wound closure by 40%.Combination AMD3100 and PDGF-BB therapy synergistically improves BM PC mobilization and trafficking, resulting in significantly improved diabetic wound closure and neovascularization. The success of this endogenous, cell-based strategy to improve diabetic wound healing using FDA-approved therapies is inherently translatable."
https://openalex.org/W1978940554,"Vermiwash (VW), a liquid extract obtained from vermicomposting beds, is used as an organic fertilizer for crop plants. The current study investigated the effect of a vermiwash foliar spray on the response of bhut jolokia (Capsicum assamicum) exposed to two different arbuscular mycorrhizal fungi (AMF: Rhizophagus irregularis, RI and G. mosseae, GM) in acidic soil under naturally ventilated greenhouse conditions. The VW spray significantly influenced the growth of plants receiving the dual treatment of AMF+VW. Plant growth was more prominent in the GM+VW treatment group than that in the RI+VW treatment group. The plant-AMF interactions in relation to growth and nutrient requirements were also significantly influenced by the application of VW. Interestingly, the VW treatment appeared to contribute more N to plants when compared to that under the AMF treatment, which led to changes in the C:N:P stoichiometry in plant shoots. Furthermore, the increased potassium dependency, as observed in the case of the dual treatments, suggests the significance of such treatments for improving crop conditions under salt stress. Overall, our study shows that the VW foliar spray modifies the response of a crop to inoculations of different AMF with regard to growth and nutrient utilization, which has implications for the selection of an efficient combination of nutrient source for improving crop growth."
