id,abstract
https://openalex.org/W2125044105,"Background Colorectal cancer (CRC) has a high prevalence in western countries. Diagnosis and treatment of CRC is complex and requires multidisciplinary collaboration across the interface of health care sectors. In Germany, a new nationwide established program aims to provide quality information of healthcare delivery across different sectors. Within this context, this study describes the development of a set of quality indicators charting the whole pathway of CRC-care including data specifications that are necessary to operationalize these indicators before practice testing. Methods Indicators were developed following a systematic 10 step modified ‘RAND/UCLA Appropriateness Method’ which involved a multidisciplinary panel of thirteen participants. For each indicator in the final set, data specifications relating to sources of quality information, data collection procedures, analysis and feedback were described. Results The final indicator set included 52 indicators covering diagnostic procedures (11 indicators), therapeutic management (28 indicators) and follow-up (6 indicators). In addition, 7 indicators represented patient perspectives. Primary surgical tumor resection and pre-operative radiation (rectum carcinoma only) were perceived as most useful tracer procedures initiating quality data collection. To assess the quality of CRC care across sectors, various data sources were identified: medical records, administrative inpatient and outpatient data, sickness-funds billing code systems and patient survey. Conclusion In Germany, a set of 52 quality indicators, covering necessary aspects across the interfaces and pathways relevant to CRC-care has been developed. Combining different sectors and sources of health care in quality assessment is an innovative and challenging approach but reflects better the reality of the patient pathway and experience of CRC-care."
https://openalex.org/W2154528603,"Impaired L-arginine transport has been reported in cardiovascular diseases, providing a possible mechanism for reduced nitric oxide (NO) production. Given that cardiovascular diseases are also associated with insulin resistance, and insulin is known to induce vasodilation via a NO-dependent pathway, we hypothesised that abnormal insulin modulation of L-arginine transport may contribute to vascular dysfunction in diabetes.Forearm blood flow (FBF) responses to insulin and sodium nitroprusside (SNP) were measured in control and type 2 diabetic volunteers using venous occlusion plethysmography. Effects of intra-arterial insulin on the forearm veno-arterial flux of arginine and related amino acids were determined by HPLC. The effect of locally delivered insulin on arginine transport was assessed during an intra-arterial infusion of [4,5-(3)H] L-arginine.In controls, intrabrachial infusion of 5 mUnits/min insulin lead to a progressive rise in FBF (p<0.001) while this was not evident in diabetics. In support of this observation, we observed a concomitant, significant increase in the flux of N-hydroxy-L-arginine (the NO precursor) in controls (baseline vs. 60 mins insulin: 16.2±12.2 vs. 33.0±13.1 nmol/100 ml tissue/min; p<0.01), whilst no increase was observed in diabetics. Moreover, insulin augmented the clearance of [(3)H]L-arginine from the forearm circulation in controls (baseline vs insulin: 123±22 vs. 150±28 ml/min; p<0.05) but not in diabetics.These findings suggest that insulin resistance may contribute substantially to the onset and development of cardiovascular disease in type 2 diabetics via abnormal insulin-mediated regulation of L-arginine transport."
https://openalex.org/W2029706091,"Chagas disease, or American trypanosomiasis, is a parasitic disease caused by the protozoan Trypanosoma cruzi and is transmitted by insects from the Triatominae subfamily. To identify components involved in the protozoan-vector relationship, we constructed and analyzed cDNA libraries from RNA isolated from the midguts of uninfected and T. cruzi-infected Triatoma infestans, which are major vectors of Chagas disease. We generated approximately 440 high-quality Expressed Sequence Tags (ESTs) from each T. infestans midgut cDNA library. The sequences were grouped in 380 clusters, representing an average length of 664.78 base pairs (bp). Many clusters were not classified functionally, representing unknown transcripts. Several transcripts involved in different processes (e.g., detoxification) showed differential expression in response to T. cruzi infection. Lysozyme, cathepsin D, a nitrophorin-like protein and a putative 14 kDa protein were significantly upregulated upon infection, whereas thioredoxin reductase was downregulated. In addition, we identified several transcripts related to metabolic processes or immunity with unchanged expressions, including infestin, lipocalins and defensins. We also detected ESTs encoding juvenile hormone binding protein (JHBP), which seems to be involved in insect development and could be a target in control strategies for the vector. This work demonstrates differential gene expression upon T. cruzi infection in the midgut of T. infestans. These data expand the current knowledge regarding vector-parasite interactions for Chagas disease."
https://openalex.org/W1979371608,"The microtubular motor Kinesin-2 and its subunit Kif3a are essential for the formation of primary cilia, an organelle implicated in a wide spectrum of developmental abnormalities. Outside cilia, Kinesin-2 mediated transport has been implicated in vesicle and N-cadherin transport, but it is unknown if and how extraciliary Kif3a affects basic cellular functions such as migration or the formation of multicellular structures. Here we show that tetracycline inducible depletion of Kif3a in MDCK cells slows epithelial cell migration. Microtubules at the leading edge of Kif3a depleted cells failed to grow perpendicularly into the leading edge and microtubular dynamics were dampened in Kif3a depleted cells. Loss of Kif3a retarded lateral membrane specification and completely prevented the formation of three-dimensional spheres in collagen. These data uncover that Kif3a regulates the microtubular cytoskeleton in the cell periphery and imply that extra-ciliary Kif3a has an unexpected function in morphogenesis."
https://openalex.org/W2082041853,"Despite the proven efficacy of warfarin, its use in patients with Atrial Fibrillation (AF) is reportedly low. We investigated the underuse and overuse of warfarin in the management of AF in general practices in the United Kingdom (UK) against the National Institute of Clinical Excellence (NICE, UK) guidelines whilst seeking to identify subgroups of AF patients to inform efforts to optimise warfarin use.A retrospective database analysis to determine warfarin prescribing using tree models based on 50,361 patients with AF (classified as low, moderate and high risk of stroke using CHADS2) from 430 general practices in the UK.Over one-third (37.0%, 4573/12,351) of low risk AF patients were on warfarin, compared with 47.1% (8349/17,709) moderate risk AF patients and 54.9% (11,142/20,301) high risk AF patients. Clinical subgroups (n = 15 low risk subgroups, n = 15 medium risk subgroups, n = 22 high risk subgroups) were identified. Several factors not supported by current guidelines (age, BMI, dementia, gender) were associated with the use of warfarin. Gender and BMI were associated with warfarin use in low and medium risk AF patients but not in high risk AF patients.Whilst NICE guidelines suggest that all high risk AF patients should be on warfarin, half of those at moderate risk should be on warfarin and none of those at low risk should be on warfarin, we found evidence of over and under use of warfarin. Interventions to optimise warfarin therapy tailored to and targeting specific subgroups of AF patients identified by the tree models are required."
https://openalex.org/W2003529123,"Ganoderma lucidum (G. lucidum) is a medicinal mushroom renowned in East Asia for its potential biological effects. To enable a systematic exploration of the genes associated with the various phenotypes of the fungus, the genome consortium of G. lucidum has carried out an expressed sequence tag (EST) sequencing project. Using a Sanger sequencing based approach, 47,285 ESTs were obtained from in vitro cultures of G. lucidum mycelium of various durations. These ESTs were further clustered and merged into 7,774 non-redundant expressed loci. The features of these expressed contigs were explored in terms of over-representation, alternative splicing, and natural antisense transcripts. Our results provide an invaluable information resource for exploring the G. lucidum transcriptome and its regulation. Many cases of the genes over-represented in fast-growing dikaryotic mycelium are closely related to growth, such as cell wall and bioactive compound synthesis. In addition, the EST-genome alignments containing putative cassette exons and retained introns were manually curated and then used to make inferences about the predominating splice-site recognition mechanism of G. lucidum. Moreover, a number of putative antisense transcripts have been pinpointed, from which we noticed that two cases are likely to reveal hitherto undiscovered biological pathways. To allow users to access the data and the initial analysis of the results of this project, a dedicated web site has been created at http://csb2.ym.edu.tw/est/."
https://openalex.org/W2110043467,"Heterotrimeric G-protein-mediated signaling pathways play a pivotal role in transmembrane signaling in eukaryotes. Our main aim was to identify signaling pathways regulated by A. nidulans GprB and GprD G-protein coupled receptors (GPCRs). When these two null mutant strains were compared to the wild-type strain, the ΔgprB mutant showed an increased protein kinase A (PKA) activity while growing in glucose 1% and during starvation. In contrast, the ΔgprD has a much lower PKA activity upon starvation. Transcriptomics and 1H NMR-based metabolomics were performed on two single null mutants grown on glucose. We noted modulation in the expression of 11 secondary metabolism gene clusters when the ΔgprB and ΔgprD mutant strains were grown in 1% glucose. Several members of the sterigmatocystin-aflatoxin gene cluster presented down-regulation in both mutant strains. The genes of the NR-PKS monodictyphenone biosynthesis cluster had overall increased mRNA accumulation in ΔgprB, while in the ΔgprD mutant strain the genes had decreased mRNA accumulation. Principal component analysis of the metabolomic data demonstrated that there was a significant metabolite shift in the ΔgprD strain. The 1H NMR analysis revealed significant expression of essential amino acids with elevated levels in the ΔgprD strain, compared to the wild-type and ΔgprB strains. With the results, we demonstrated the differential expression of a variety of genes related mainly to secondary metabolism, sexual development, stress signaling, and amino acid metabolism. We propose that the absence of GPCRs triggered stress responses at the genetic level. The data suggested an intimate relationship among different G-protein coupled receptors, fine-tune regulation of secondary and amino acid metabolisms, and fungal development."
https://openalex.org/W2117482151,"In reverberant rooms with multiple-people talking, spatial separation between speech sources improves recognition of attended speech, even though both the head-shadowing and interaural-interaction unmasking cues are limited by numerous reflections. It is the perceptual integration between the direct wave and its reflections that bridges the direct-reflection temporal gaps and results in the spatial unmasking under reverberant conditions. This study further investigated (1) the temporal dynamic of the direct-reflection-integration-based spatial unmasking as a function of the reflection delay, and (2) whether this temporal dynamic is correlated with the listeners’ auditory ability to temporally retain raw acoustic signals (i.e., the fast decaying primitive auditory memory, PAM). The results showed that recognition of the target speech against the speech-masker background is a descending exponential function of the delay of the simulated target reflection. In addition, the temporal extent of PAM is frequency dependent and markedly longer than that for perceptual fusion. More importantly, the temporal dynamic of the speech-recognition function is significantly correlated with the temporal extent of the PAM of low-frequency raw signals. Thus, we propose that a chain process, which links the earlier-stage PAM with the later-stage correlation computation, perceptual integration, and attention facilitation, plays a role in spatially unmasking target speech under reverberant conditions."
https://openalex.org/W1996605612,"Recent advancement of technologies has now made it routine to obtain and compare gene orders within genomes. Rearrangements of gene orders by operations such as reversal and transposition are rare events that enable researchers to reconstruct deep evolutionary histories. An important application of genome rearrangement analysis is to infer gene orders of ancestral genomes, which is valuable for identifying patterns of evolution and for modeling the evolutionary processes. Among various available methods, parsimony-based methods (including GRAPPA and MGR) are the most widely used. Since the core algorithms of these methods are solvers for the so called median problem, providing efficient and accurate median solver has attracted lots of attention in this field. The “double-cut-and-join” (DCJ) model uses the single DCJ operation to account for all genome rearrangement events. Because mathematically it is much simpler than handling events directly, parsimony methods using DCJ median solvers has better speed and accuracy. However, the DCJ median problem is NP-hard and although several exact algorithms are available, they all have great difficulties when given genomes are distant. In this paper, we present a new algorithm that combines genetic algorithm (GA) with genomic sorting to produce a new method which can solve the DCJ median problem in limited time and space, especially in large and distant datasets. Our experimental results show that this new GA-based method can find optimal or near optimal results for problems ranging from easy to very difficult. Compared to existing parsimony methods which may severely underestimate the true number of evolutionary events, the sorting-based approach can infer ancestral genomes which are much closer to their true ancestors. The code is available at http://phylo.cse.sc.edu."
https://openalex.org/W1982073271,"Background Tuberculosis (TB) is a serious public health problem in China, and within China, Inner Mongolia has a high prevalence area of TB. Though studies on the genetic diversity of Mycobacterium tuberculosis (MTB) have been reported in many provinces, there are no such studies to date in Inner Mongolia. In this study, we investigated the genetic diversity of MTB in Inner Mongolia. Methodology/Principal Findings In this study, we analyzed 372 clinical MTB isolates with 22-loci mycobacterial interspersed repetitive unit and variable-number tandem repeats (MIRU-VNTR), spoligotyping, large sequence polymorphism (LSP), and NTF region analysis to understand the TB genotypes prevalent in Inner Mongolia. We found that the Beijing family was the most prevalent genotype (85.48%, 318/372), and the “modern” sublineage accounted for 76.73% (244/318) of the isolates. Our data also showed that there was no statistically significant association between the two major nationalities and the Beijing genotype (χ2 = 3.612, P = 0.057; P>0.05). Conclusion/Significance The Beijing genotype is the most prevalent family of M. tuberculosis in Inner Mongolia, and we do not find any correlation between the Beijing genotype and the major nationalities."
https://openalex.org/W2001800524,"Unconsciously presented information can influence our behavior in an experimental context. However, whether these effects can be translated to a daily life context, such as advertising, is strongly debated. What hampers this translation is the widely accepted notion of the short-livedness of unconscious representations. The effect of unconscious information on behavior is assumed to rapidly vanish within a few hundreds of milliseconds. Using highly familiar brand logos (e.g., the logo of McDonald's) as subliminal and supraliminal primes in two priming experiments, we assessed whether these logos were able to elicit behavioral effects after a short (e.g., 350 ms), a medium (e.g., 1000 ms), and a long (e.g., 5000 ms) interval. Our results demonstrate that when real-life information is presented minimally consciously or even unconsciously, it can influence our subsequent behavior, even when more than five seconds pass between the presentation of the minimally conscious or unconscious information and the behavior on which it exerts its influence."
https://openalex.org/W1980357915,"In previous studies, we found a strong reduction in contrast perception and retinal contrast gain in patients with major depression, which normalized after remission of depression. We also identified a possible role of the dopaminergic system in this effect, because visual contrast perception depends on dopaminergic neurotransmission. Dopamine is also known to play an important role in the pathogenesis of attention deficit hyperactivity disorder (ADHD). Therefore, in order to explore the specificity of retinal contrast gain as a marker of depression in comparison with other psychiatric diseases, we recorded the pattern electroretinogram (PERG) in patients with ADHD. Twenty patients diagnosed with ADHD and 20 matched healthy subjects were studied. Visual pattern electroretinograms were recorded from both eyes. The contrast gain of the patients with attention deficit disorder (ADD) did not differ from the control group, nor did the contrast gain of any ADHD subgroup (predominantly inattentive or combined patients). In the healthy subjects, a significant correlation between depression score and contrast gain was found. As the contrast gain in an earlier study clearly separated the patients with depression from the controls, we assume that retinal contrast gain might be a specific marker in depression."
https://openalex.org/W1977264940,"Objective Delayed or impaired reendothelialization is a major cause of stent thrombosis in the interventional treatment of coronary heart disease. T cells are involved in neointima formation of injured arteries. However, the regulated mechanism of reendothelialization and the role of CD8 T cell in reendothelialization are unclear. Methods and Results Immunofluorescence staining showed that CD8 positive cells were increased in wire injured femoral artery of mice. On day 21 after injury, elastin staining showed that knockout of CD8 (CD8−/−) significantly increased intimal thickness and a ratio of intima to media by 1.8 folds and 1.9 folds respectively in injured arteries. Evans blue staining showed that knockout of CD8 delayed the reendothelialization area on day 7 after injury (18.8±0.5% versus 42.1±5.6%, p<0.05). In vitro, a migration assay revealed that CD8−/− T cells co-cultured with WT macrophages significantly inhibited the migration of the endothelial cells (ECs); compared to CD4+ T cells, and CD8+ T cells could promote the ECs migration. Furthermore, real-time PCR analysis showed that knockout of CD8 increased the level of tumor necrosis factor α (TNF-α) in injured arteries and cytometric bead cytokine array showed that TNF-α was elevated in cultured CD8−/− T cells. Finally, a wound-healing assay showed that recombinant TNF-α significantly inhibited the migration of ECs. Conclusion Our study suggested that CD8+ T cells could promote the reendothelialization and inhibit the neointima formation after the artery wire injury, and this effect is at least partly dependent on decreasing TNF-α production promoting ECs migration."
https://openalex.org/W2074516279,"A middle base number sulphonate-modified nano calcium carbonate (SMC) with an average size of 35 nm was synthesized, and its tribological and antioxidation synergistic behaviors with ashless antioxidant N-phenyl-α-naphthylamine (T531) in hydrogenated oil (5Cst) were evaluated. The results demonstrate that adding this synthesized additive even at a low amount (<2.0 wt.%) can evidently improve its load-carrying capacity by 1.5 times and enhance its antiwear performance; in addition, the friction-reducing effect of additive in the high load was better than that in low load. The SMC have a good synergistic antioxidation effect with T531, which verifies the nano calcium carbonate compound was a kind of multifunctional and high-performance additive. The chemical composition of the rubbing surface which formed on the boundary film was analyzed by using scanning electron microscopy (SEM) and X-ray photoelectron spectroscopy (XPS). The results indicating that the excellent antiwear and load-carrying performance could be attributed to the forming of boundary lubrication film which composed of calcium carbonate, oxides, ferrites, sulphide and FeSO4, and so on. Its ability to increase oxidation free energy of base oil is the main reason for increasing its antioxidant collaboration property with ashless antioxidant T531."
https://openalex.org/W2026071138,"For a given multi-agent system where the local interaction rule of the existing agents can not be re-designed, one way to intervene the collective behavior of the system is to add one or a few special agents into the group which are still treated as normal agents by the existing ones. We study how to lead a Vicsek-like flocking model to reach synchronization by adding special agents. A popular method is to add some simple leaders (fixed-headings agents). However, we add one intelligent agent, called ‘shill’, which uses online feedback information of the group to decide the shill's moving direction at each step. A novel strategy for the shill to coordinate the group is proposed. It is strictly proved that a shill with this strategy and a limited speed can synchronize every agent in the group. The computer simulations show the effectiveness of this strategy in different scenarios, including different group sizes, shill speed, and with or without noise. Compared to the method of adding some fixed-heading leaders, our method can guarantee synchronization for any initial configuration in the deterministic scenario and improve the synchronization level significantly in low density groups, or model with noise. This suggests the advantage and power of feedback information in intervention of collective behavior."
https://openalex.org/W1996321694,"Few studies of global diversity gradients in plants exist, largely because the data are not available for all species involved. Instead, most global studies have focussed on vertebrates, as these taxa have historically been associated with the most complete data. Here, we address this shortfall by first investigating global diversity gradients in monocots, a morphologically and functionally diverse clade representing a quarter of flowering plant diversity, and then assessing congruence between monocot and vertebrate diversity patterns. To do this, we create a new dataset that merges biome-level associations for all monocot genera with country-level associations for almost all ∼70,000 species. We then assess the evidence for direct versus indirect effects of this plant diversity on vertebrate diversity using a combination of linear regression and structural equation modelling (SEM). Finally, we also calculate overlap of diversity hotspots for monocots and each vertebrate taxon. Monocots follow a latitudinal gradient although with pockets of extra-tropical diversity, mirroring patterns in vertebrates. Monocot diversity is positively associated with vertebrate diversity, but the strength of correlation varies depending on the clades being compared. Monocot diversity explains marginal amounts of variance (<10%) after environmental factors have been accounted for. However, correlations remain among model residuals, and SEMs apparently reveal some direct effects of monocot richness. Our results suggest that collinear responses to environmental gradients are behind much of the congruence observed, but that there is some evidence for direct effects of producer diversity on consumer diversity. Much remains to be done before broad-scale diversity gradients among taxa are fully explained. Our dataset of monocot distributions will aid in this endeavour."
