id,abstract
https://openalex.org/W2895082412,"Malaria is a major infectious disease that still affects nearly half of the world’s population. Information on spatial distribution of malaria vector species is needed to improve malaria control efforts. In this study we used Maximum Entropy Model (MaxEnt) to estimate the potential distribution of Anopheles gambiae sensu lato and its siblings: Anopheles gambiae sensu stricto, and Anopheles arabiensis in Nigeria. Species occurrence data collected during the period 1900–2010 was used together with 19 bioclimatic, landuse and terrain variables. Results show that these species are currently widespread across all ecological zones. Temperature fluctuation from mean diurnal temperature range, extreme temperature and precipitation conditions, high humidity in dry season from precipitation during warm months, and land use and land cover dynamics have the greatest influence on the current seasonal distribution of the Anopheles species. MaxEnt performed statistically significantly better than random with AUC approximately 0.7 for estimation of the Anopheles species environmental suitability, distribution and variable importance. This model result can contribute to surveillance efforts and control strategies for malaria eradication."
https://openalex.org/W2895177478,"Oxidative stress triggers and exacerbates neurodegeneration in Alzheimer’s disease (AD). Various antioxidants reduce oxidative stress, but these agents have little efficacy due to poor blood–brain barrier (BBB) permeability. Additionally, single-modal antioxidants are easily overwhelmed by global oxidative stress. Activating nuclear factor erythroid 2 (NF-E2)-related factor 2 (Nrf2) and its downstream antioxidant system are considered very effective for reducing global oxidative stress. Thus far, only a few BBB-permeable agents activate the Nrf2-dependent antioxidant system. Here, we discovered a BBB-bypassing Nrf2-activating polysaccharide that may attenuate AD pathogenesis. Mini-GAGR, a 0.7-kDa cleavage product of low-acyl gellan gum, increased the levels and activities of Nrf2-dependent antioxidant enzymes, decreased reactive oxygen species (ROS) under oxidative stress in mouse cortical neurons, and robustly protected mitochondria from oxidative insults. Moreover, mini-GAGR increased the nuclear localization and transcriptional activity of Nrf2 similarly to known Nrf2 activators. Mechanistically, mini-GAGR increased the dissociation of Nrf2 from its inhibitor, Kelch-like ECH-associated protein 1 (Keap1), and induced phosphorylation and nuclear translocation of Nrf2 in a protein kinase C (PKC)- and fibroblast growth factor receptor (FGFR1)-dependent manner. Finally, 20-day intranasal treatment of 3xTg-AD mice with 100 nmol of mini-GAGR increased nuclear p-Nrf2 and growth-associated protein 43 (GAP43) levels in hippocampal neurons, reduced p-tau and β-amyloid (Aβ) peptide–stained neurons, and improved memory. The BBB-bypassing Nrf2-activating polysaccharide reported here may be effective in reducing oxidative stress and neurodegeneration in AD. Oxidative stress triggers and exacerbates neurodegeneration in Alzheimer’s disease (AD). Various antioxidants reduce oxidative stress, but these agents have little efficacy due to poor blood–brain barrier (BBB) permeability. Additionally, single-modal antioxidants are easily overwhelmed by global oxidative stress. Activating nuclear factor erythroid 2 (NF-E2)-related factor 2 (Nrf2) and its downstream antioxidant system are considered very effective for reducing global oxidative stress. Thus far, only a few BBB-permeable agents activate the Nrf2-dependent antioxidant system. Here, we discovered a BBB-bypassing Nrf2-activating polysaccharide that may attenuate AD pathogenesis. Mini-GAGR, a 0.7-kDa cleavage product of low-acyl gellan gum, increased the levels and activities of Nrf2-dependent antioxidant enzymes, decreased reactive oxygen species (ROS) under oxidative stress in mouse cortical neurons, and robustly protected mitochondria from oxidative insults. Moreover, mini-GAGR increased the nuclear localization and transcriptional activity of Nrf2 similarly to known Nrf2 activators. Mechanistically, mini-GAGR increased the dissociation of Nrf2 from its inhibitor, Kelch-like ECH-associated protein 1 (Keap1), and induced phosphorylation and nuclear translocation of Nrf2 in a protein kinase C (PKC)- and fibroblast growth factor receptor (FGFR1)-dependent manner. Finally, 20-day intranasal treatment of 3xTg-AD mice with 100 nmol of mini-GAGR increased nuclear p-Nrf2 and growth-associated protein 43 (GAP43) levels in hippocampal neurons, reduced p-tau and β-amyloid (Aβ) peptide–stained neurons, and improved memory. The BBB-bypassing Nrf2-activating polysaccharide reported here may be effective in reducing oxidative stress and neurodegeneration in AD."
https://openalex.org/W2978532343,"This study applied the non-parametric four-stage data envelopment analysis method (Four-Stage DEA) to measure the relative efficiencies of Chinese public hospitals from 2010 to 2016, and to determine how efficiencies were affected by eight factors. A sample of public hospitals (n = 84) was selected from Chongqing, China, including general hospitals and traditional Chinese medicine hospitals graded level 2 or above. The Four-Stage-DEA method was chosen since it enables the control of the impact of environment factors on efficiency evaluation results. Data on the number of staff, government financial subsidies, the number of beds and fixed assets were used as input whereas the number of out-patients and emergency department patients and visits, the number of discharged patients, medical and health service income and hospital bed utilization rate were chosen as study outputs. As relevant environmental variables, we selected GDP per capita, permanent population, population density, number of hospitals and number of available sickbeds in local medical institutions. The relative efficiencies (i.e. technical, pure technical, scale) of sample hospitals were also calculated to analyze the change between the first stage and fourth stage every year. The study found that Four-Stage-DEA can effectively filter the impact of environmental factors on evaluation results, which sets it apart from other models commonly used in existing studies."
https://openalex.org/W2894668894,"This study investigates possible variation in post-mortem histories during the Neolithic period in southwestern Sweden based on microscopic studies of human bone. Numerous megalithic graves were built in this region and good preservation conditions have left a rich skeletal record. After more than a hundred years of research, it is still a controversy whether or not these skeletal assemblages were the result of primary burials, or ossuaries where skeletonized remains were deposited. In this study we apply histological analysis to obtain insights into post-mortem histories and taphonomic processes affecting the human remains, potentially including funerary rituals. This type of analysis records the condition and traces of degradation found in skeletal material at a microscopic level. Human skeletal material from four different megalithic tombs in the Falbygden area has been sampled and analysed by thin-section light microscopy, and by scanning electron microscopy. The results of the study provide evidence of variation and changes in burial conditions for skeletal remains from the different graves, also for remains from the same grave. Extent of bioerosion varied, from extensive to moderate/arrested, to none. Bone samples from the same graves also differed in the type of staining and mineral inclusions, showing that the non-bioeroded samples relatively early post-mortem must have experienced an anoxic environment, and later a change to an aerated environment. This could be taken as an indication of primary burial somewhere else, but more likely reflect a special micro-environment occurring temporarily in some graves and parts of graves after the tombs were filled with soil and sealed by roof slabs. The study illustrates the usefulness of bone histological analysis in the reconstruction of post-mortem histories, revealing variations not discernible at macro-level that may aid in the interpretations of funerary rituals. However, the results also highlight the issues of equifinality. Based on current data and knowledge, several scenarios are possible. Further histotaphonomic work is advisable, including archaeological remains from megalithic tombs, and bones from taphonomic experiments."
https://openalex.org/W2894842027,"Background Hypertension is a globally recognized threat to social and economic development with premature morbidity and mortality. In middle and low-income countries hypertension appears to be increasing. However, sufficient data on this silent-killer is not available in Ethiopia. Therefore, this study examined the magnitude and risk factors for hypertension among public servants in Tigray, Ethiopia. Methods We used a cross-sectional survey from May-June 2016 among 1525 public servants in Tigray region. Field workers collected data using a pre-tested, standardized questionnaire. A multivariate logistic regression analysis conducted to identify risk factors for hypertension. Statistical significance was declared using a p-value&lt;0.05 and 95% of confidence interval (CI) for an adjusted odds ratio (AOR). Results The overall prevalence of hypertension was 16% (95% CI: 13.10–21.9) and the proportion of awareness (96.7%), treatment (31.3%) and control of hypertension (40.1%) among employees. Being male [AOR = 2.06, 95%CI:1.49, 2.84], ages groups of 30–49 years [AOR = 2.21, 95%CI:1.25, 3.89] and &gt;50years [AOR = 3.61, 95% CI:1.93, 6.69], Body Mass Index(BMI); underweight [AOR = 0.40, 95% CI; 0.20, 0.78], overweight [AOR = 1.70, 95%CI; 1.22, 2.33] and obesity [AOR = 3.20, 95% CI; 1.78, 5.78] were determinants for hypertension. Conclusion The prevalence of hypertension is relatively high in Mekelle city compared with previous reports. This study revealed that male sex, age-group, and BMI were evidenced as risk factors for hypertension. Policy makers need to consider sector wise integrating prevention and control of hypertension. Skilled based information, education and communication strategies should be designed and implemented to avoid unhealthy lifestyles, investing in workforces to eliminate the modifiable risk factors for non-communicable diseases and promote healthy practices."
https://openalex.org/W2895315179,"The Cancer Genome Atlas (TCGA) provides a genetic characterization of more than ten thousand tumors, enabling the discovery of novel driver mutations, molecular subtypes, and enticing drug targets across many histologies. Here we investigated why some mutations are common in particular cancer types but absent in others. As an example, we observed that the gene CCDC168 has no mutations in the stomach adenocarcinoma (STAD) cohort despite its common presence in other tumor types. Surprisingly, we found that the lack of called mutations was due to a systematic insufficiency in the number of sequencing reads in the STAD and other cohorts, as opposed to differential driver biology. Using strict filtering criteria, we found similar behavior in four other genes across TCGA cohorts, with each gene exhibiting systematic sequencing depth issues affecting the ability to call mutations. We identified the culprit as the choice of exome capture kit, as kit choice was highly associated with the set of genes that have insufficient reads to call a mutation. Overall, we found that thousands of samples across all cohorts are subject to some capture kit problems. For example, for the 6353 samples using the Broad Institute’s Custom capture kit there are undercalling biases for at least 4833 genes. False negative mutation calls at these genes may obscure biological similarities between tumor types and other important cancer driver effects in TCGA datasets."
https://openalex.org/W2895305804,"Background Clinical practice guidelines contain recommendations for physicians to determine the most appropriate care for patients. These guidelines systematically combine scientific evidence and clinical judgment, culminating in recommendations intended to optimize patient care. The recommendations in CPGs are supported by evidence which varies in quality. We aim to survey the clinical practice guidelines created by the American College of Gastroenterology, report the level of evidence supporting their recommendations, and identify areas where evidence can be improved with additional research. Methods We extracted 1328 recommendations from 39 clinical practice guidelines published by the American College of Gastroenterology. Several of the clinical practice guidelines used the differing classifications of evidence for their recommendations. To standardize our results, we devised a uniform system for evidence. Results A total of 39 clinical practice guidelines were surveyed in our study. Together they account for 1328 recommendations. 693 (52.2%) of the recommendations were based on low evidence, indicating poor evidence or expert opinion. Among individual guidelines, 13/39 (33.3%) had no recommendations based on high evidence. Conclusion Very few recommendations made by the American College of Gastroenterology are supported by high levels of evidence. More than half of all recommendations made by the American College of Gastroenterology are based on low-quality evidence or expert opinion."
https://openalex.org/W2895647282,"Fragility fractures are a well-known complication following oncologic radiotherapy, and it is suspected that radiation-induced embrittlement of bone within the treatment field may contribute to fracture risk. To explore this phenomenon, a mouse model (BALB/cJ) of fractionated, limited field, bilateral hindlimb irradiation (4x5 Gy) was used. The effects of radiation on femoral (cortical) bone fracture toughness, morphology, and biochemistry-including advanced glycation end products (AGEs)-were quantified and compared to Sham group samples prior to irradiation and at 0, 4, 8, and 12 weeks post-irradiation. Additionally, alterations to bone fracture toughness mediated directly by radiation (independent of cellular mechanisms) were determined using devitalized mouse cadaver femurs. Finally, the contribution of AGEs to reduced fracture toughness was examined by artificially ribosylating mouse femurs ex vivo. These data demonstrate that in vivo irradiation results in an immediate (-42% at 0 weeks, p < 0.001) and sustained (-28% at 12 weeks, p < 0.001) decrease in fracture toughness with small changes in morphology (-5% in cortical area at 12 weeks), and minimal changes in bone composition (tissue mineral density, mineral:matrix ratio, and AGE content). Irradiation of devitalized femurs also reduced fracture toughness (-29%, p < 0.001), but to a lesser extent than was seen in vivo. While artificial ribosylation decreased fracture toughness with time, the extent of glycation needed to induce this effect exceeded the AGE accumulation that occurred in vivo. Overall, hindlimb irradiation induced a substantial and sustained decrease in bone fracture toughness. Approximately half of this decrease in fracture toughness is due to direct radiation damage, independent of cellular remodeling. Collagen glycation in vivo was not substantially altered, suggesting other matrix changes may contribute to post-radiotherapy bone embrittlement."
https://openalex.org/W2895658729,"Naturally occurring entomopathogenic fungi such as Conidiobolus coronatus are important regulatory factors of insect populations. GC-MS analysis of fungal cell-free filtrates showed that C. coronatus synthesizes two β- carboline alkaloids: harman and norharman. Significantly higher levels of both alkaloids are produced by C. coronatus in minimal postincubation medium than in rich medium. The beta-carboline alkaloids may have an effect on the nervous system of insects and their behavior. Harman and norharman were applied to Galleria mellonella larvae (a parasite of honeybees) either topically or mixed with food. Larvae received alkaloids in three concentrations: 750, 1000 or 1250 ppm. The effect on the survival and further development of larvae was examined. Both harman and norharman delayed pupation and adult eclosion, and inhibit total monoamine oxidase activity. In addition, they increased the serotonin concentration and decreased the monoamine oxidase A level in the heads of the moths. It is likely that the alkaloids were metabolized by the insects, as their effect wore off 24 hours after topical application. This is the first study to show that C. coronatus produces alkaloids. Its aim was to identify the actions of β-carboline alkaloids on insect development and serotonin-regulating enzymes. Knowledge of the potential role of harman and norharman in the process of fungal infection might lead to the development of more effective and environmentally-friendly means of controlling insect pests."
https://openalex.org/W2895692674,"Ovarian cancer is a heterogeneous disease. Data regarding familial risks for specific proband, age at diagnosis and histology are limited. Such data can assist genetic counseling and help elucidate etiologic differences among various histologic types of ovarian malignancies. By using the Swedish Family-Cancer Database, we calculated relative risks (RRs) for detailed family histories using a two-way comparison, which implied e.g. estimation of RRs for overall ovarian cancer when family history was histology-specific ovarian cancer, and conversely, RRs for histology-specific ovarian cancer when family history was overall ovarian cancer. In families of only mother, only sisters or both mother and sisters diagnosed with ovarian cancer, cancer risks for ovary were 2.40, 2.59 and 10.40, respectively; and were higher for cases diagnosed before the age of 50 years. All histological types showed a familial risk in two-way analyses, except mucinous and sex cord-stromal tumors. RRs for concordant histology were found for serous (2.47), endometrioid (3.59) and mucinous ovarian cancers (6.91). Concordant familial risks were highest for mucinous cancer; for others, some discordant associations, such as endometrioid-undifferentiated (9.27) and serous-undifferentiated (4.80), showed the highest RRs. Familial risks are high for early-onset patients and for those with multiple affected relatives. Sharing of different histological types of ovarian cancer is likely an indication of the complexity of the underlying mechanisms."
https://openalex.org/W2895701161,"Introduction Exposure to hypoxic conditions is reported to impair cognitive performance. Further, moderate physical exercise improves cognitive function, but little is known about the influence of exercise on cognitive function in hypoxia. Therefore, the current study aimed to examine the influence of hypoxia (HYP) and prolonged exercise (EX) on attentional performance. Methods A total of 80 participants (female: n = 29; male: n = 51) were assigned to four groups: HYP + EX (n = 15), HYP (n = 25), EX (n = 21) and normoxia (NOR) (n = 21). The Frankfurt Attention Inventory—2 (FAIR-2) was performed at four testing points (day 1, 14, 16 and 18) to assess attentional performance. All groups completed a pretest (D1) and a follow-up test (D18). In HYP + EX conditions, the cognitive task was performed in a hypoxic state after prolonged exercise (D14: 3950 m, D16: 5739 m) during a mountain climb on Mt. Kilimanjaro. Participants in HYP were tested under intermittent hypoxia at rest in a hypoxic chamber (D14: 3500 m, D16: 5800 m), and those in EX were tested under normoxia after prolonged exercise during a 7-day backcountry ski hiking tour. NOR was a control group, and participants completed all tests under normoxia and at rest. Results Hypoxia impaired the attentional functions performance value (PV) and continuity value (CV) for the HYP + EX (p = 0.000) and HYP (L: p = 0.025; K: p = 0.043) groups at 5739 m and 5800 m, respectively, but not the function quality value (QV). In contrast, the EX group did not exhibit changes in attentional function. Conclusion The current results suggest that attentional performance is impaired during extreme normobaric and hypobaric hypoxic exposure. We further conclude that greater cognitive impairment under hypobaric hypoxia during a mountain climb compared with normobaric hypoxia at rest is not caused by prolonged exercise, but may be influenced by other factors (e.g. low temperatures, dehydration, or sleep deprivation) that remain to be verified."
https://openalex.org/W2895047333,"Wind and temperature data are important parameters in aircraft performance studies. The lack of accurate measurements of these parameters forces researchers to rely on numerical weather prediction models, which are often filtered for a larger area with decreased local accuracy. Aircraft, however, also transmit information related to weather conditions, in response to interrogation by air traffic controller surveillance radars. Although not intended for this purpose, aircraft surveillance data contains information that can be used for weather models. This paper presents a method that can be used to reconstruct a weather field from surveillance data that can be received with a simple 1090 MHz receiver. Throughout the paper, we answer two main research questions: how to accurately infer wind and temperature from aircraft surveillance data, and how to reconstruct a real-time weather grid efficiently. We consider aircraft as moving sensors that measure wind and temperature conditions indirectly at different locations and flight levels. To address the first question, aircraft barometric altitude, ground velocity, and airspeed are decoded from down-linked surveillance data. Then, temperature and wind observations are computed based on aeronautical speed conversion equations. To address the second question, we propose a novel Meteo-Particle (MP) model for constructing the wind and temperature fields. Short-term local prediction is also possible by employing a predictor layer. Using an unseen observation test dataset, we are able to validate that the mean absolute errors of inferred wind and temperature using MP model are 67% and 26% less than using the interpolated model based on GFS reanalysis data."
https://openalex.org/W2894766171,"Iron deficiency anaemia (IDA) worsens the prognosis and outcomes of chronic kidney disease (CKD). However, while the haemoglobin level is unreliable for early detection of IDA, reticulocyte haemoglobin content (CHr) and hypochromic red cells (%HYPO) are early markers of IDA.This was a cross sectional study of black adult participants (n = 258) with CKD and apparently healthy members of staff and patients' relatives (n = 141) at the Charlotte Maxeke Johannesburg Academic Hospital, South Africa, between 1 June 2016 and 31 December 2016. Serum iron, serum ferritin and transferrin were measured using standard laboratory methods, while the haematology analyser was employed to measure CHr and %HYPO. The validity of CHr and %HYPO as markers of IDA were evaluated. Multivariable binary logistic regression was conducted to determine predictors of the relationship between IDA, CHr and %HYPO. The area under the receiver operator characteristics (ROC) curve (AUC) of the final models were utilised to evaluate the discriminatory value of CHr and %HYPO respectively.About one-quarter (26.1%) of the participants had IDA which was more than three times more frequent among CKD patients, compared to controls (35.3% vs 9.2%); 32.3% (95%CI: 27.90%- 37.10%) of the study population had iron deficiency without anaemia and the prevalence of iron deficiency without anaemia was lower in CKD patients compared to controls (29.5% vs 37.6%). The mean age of CKD patients was higher than in controls (52.7 ±14.3 vs 40.4 ±12.6 years, P-value<0.001). The sensitivity and specificity for diagnosing IDA among CKD participants was 62.6% and 80.2% respectively for CHr (at a cut-off value of <28pg) and 63.3% and 79.8% respectively for %HYPO. CKD participants with CHr levels >28pg were 82% less likely to be diagnosed as having IDA as compared to those with CHr levels ≤ 28pg) (adj odds ratio = 0.18, 95% CI: 0.09-0.37). The AUC of CHr (0.81, 95% CI: 0.76-0.87) was higher than the AUC of %HYPO (0.76, 95%CI: 0.70-0.82).The diagnostic usefulness of CHr and the screening performance of %HYPO in predicting IDA among CKD patients are high. Their lower cost compared to conventional markers of ID recommend their use in clinical practice. Further cost effectiveness studies of these parameters are warranted."
