id,abstract
https://openalex.org/W2908712667,"Even very young children are adept at linking property to owners (Gelman, Manczak, & Noles, 2012). However, some studies report that children systematically conserve property with the first possessors (Blake & Harris, 2009; Friedman & Neary, 2008). The present study seeks to integrate these two findings by testing for the presence of a first possessor bias in older children (ages 7–10) using a broader array of property transfers, and by investigating how manipulations of context–from third-person to first-person–yield ownership attributions that are more or less biased. Seven- and 8-year-olds, but not older children, exhibited a first possessor bias when property transfers were presented in a third-person context. This finding suggests that the first possessor bias persists longer in childhood than previously suspected. However, the bias was greatly attenuated or absent when property transfers were presented in a first-person context, rather than a third-person context."
https://openalex.org/W2909445333,"The massive genomic data from The Cancer Genome Atlas (TCGA), including proteomics data from Clinical Proteomic Tumor Analysis Consortium (CPTAC), provides a unique opportunity to study cancer systematically. While most observations are made from a single type of genomics data, we apply big data analytics and systems biology approaches by simultaneously analyzing DNA amplification, mRNA and protein abundance. Using multiple genomic profiles, we have discovered widespread dosage compensation for the extensive aneuploidy observed in TCGA breast cancer samples. We do identify 11 genes that show strong correlation across all features (DNA/mRNA/protein) analogous to that of the well-known oncogene HER2 (ERBB2). These genes are generally less well-characterized regarding their role in cancer and we advocate their further study. We also discover that shRNA knockdown of these genes has an impact on cancer cell growth, suggesting a vulnerability that could be used for cancer therapy. Our study shows the advantages of systematic big data methodologies and also provides future research directions."
https://openalex.org/W2910591315,"A long shelf life of onions (Allium cepa L.) is of high importance in the onion industry. Onions are dried and stored in large wooden boxes that are difficult to access. Monitoring temperature and relative humidity during these processes is challenging. Moreover, quality may change in storage without being noticed. Therefore, there is a need to find alternative methods for monitoring and controlling the drying and storage processes of onions and to identify early changes in quality during storage. The potential use of online measurements of temperature and relative humidity (RH) in the vicinity of onions was evaluated during drying and long-term storage of six onion batches (four cultivars and three selections of one of the cultivars) in commercial storage. The batches varied in bulb weight, dry matter content, firmness and disease incidence. The dry matter content and firmness decreased during storage, while the respiration rate and incidences of individual and total disease increased. Two of the batches had low storability with high disease incidences and high average temperatures and variations in the RH. The results showed that tracking the temperature and RH in the vicinity of the onions is a promising tool for improving the drying and storage processes in commercial storage and for identifying onion batches with reduced storability early in storage."
https://openalex.org/W2909626813,"Sildenafil is a pulmonary vasodilator that has potential to mitigate the decrement in endurance performance caused by hypoxic pulmonary vasoconstriction. The purpose of this study was to determine the effects of sildenafil on pulmonary artery pressure, cardiac output, pulse oxygen saturation, and exercise performance at moderate simulated altitude. We hypothesized that sildenafil would reduce the decline in exercise performance in hypoxia by blunting the rise in pulmonary artery pressure and causing a relative increase in cardiac output and oxygen saturation. Twelve endurance trained men performed three experimental cycling trials at sea level and simulated moderate altitude of 3,000m (FIO2 = 0.147) after ingesting either a placebo or sildenafil 50 mg capsule in a double blinded fashion. Each test consisted of a warmup period, a 15-minute steady state period at 60% of peak power output, and a 16.1 km time-trial. All subjects experienced a decline in maximal exercise capacity in hypoxia that ranged from 6% to 24%. This decline was correlated with the reduction in pulse oxygen saturation in hypoxic maximal exercise. Sildenafil had no effect on pulmonary artery pressure, cardiac output, or pulse oxygen saturation measured during steady state exercise. There was no effect of sildenafil on mean power output during the time-trial. During high intensity cycle exercise in acute, moderate hypoxia pulmonary artery pressure is unaffected by sildenafil and does not appear to influence cardiovascular function or exercise performance."
https://openalex.org/W2909839337,"Soy protein and fish oil are food components that decrease the risk of cardiovascular disease. Previous studies demonstrated that these food components reduced serum cholesterol levels and suppressed hepatic lipogenesis. However, the underlying mechanisms of action of these food components remain unclear. Ten classes of serum lipoprotein profiles showed that dietary tofu, a soybean curd, suppressed cholesterol absorption, while fish oil reduced most of the lipoprotein classes in rats. Tofu and fish oil both halved the level of the lipoprotein class LAC1 (LDL-anti-protease complex), a 15-nm LDL-anti-protease complex, which is speculated to be a cause of atherosclerosis. Moreover, a global transcriptome analysis revealed that tofu inhibited the mRNA expression of genes involved in hepatic lipogenesis, while fish oil stimulated that of genes related to fatty acid degradation. Therefore, tofu and fish oil independently regulate lipid metabolism. The decrease observed in LAC1 may have been due to reduced cholesterol absorption in the tofu diet group and the interference of lipogenesis via the activation of polyunsaturated fatty acid detoxification in the fish oil group."
https://openalex.org/W2910083313,"Development of biocompatible and functional scaffolds for tissue engineering is a major challenge, especially for development of polarised epithelia that are critical structures in tissue homeostasis. Different in vitro models of the lung epithelial barrier have been characterized using non-degradable polyethylene terephthalate membranes which limits their uses for tissue engineering. Although poly-L-lactic acid (PLLA) membranes are biodegradable, those prepared via conventional Diffusion Induced Phase Separation (DIPS) lack open-porous geometry and show limited permeability compromising their use for epithelial barrier studies. Here we used PLLA membranes prepared via a modification of the standard DIPS protocol to control the membrane surface morphology and permeability. These were bonded to cell culture inserts for use in barrier function studies. Pulmonary epithelial cells (H441) readily attached to the PLLA membranes and formed a confluent cell layer within two days. This was accompanied by a significant increase in trans-epithelial electrical resistance and correlated with the formation of tight junctions and vectorial cytokine secretion in response to TNFα. Our data suggest that a structurally polarized and functional epithelial barrier can be established on PLLA membranes produced via a non-standard DIPS protocol. Therefore, PLLA membranes have potential utility in lung tissue engineering applications requiring bio-absorbable membranes."
https://openalex.org/W2910360247,"The incidence of acute myocardial infarction (AMI) in healthy patients undergoing noncardiac surgery is <1%. When patients with chronic kidney disease (CKD) undergo orthopedic surgery, AMI incidence can be expected to be relatively high. However, data on a population-wide scale is lacking.To investigate AMI incidence in patients with CKD (with and without dialysis) undergoing orthopedic surgery.A population-based study covering the period from January 1, 1997, to December 31, 2011.Data from the Taiwan National Health Insurance Research Database.Participants were 219,195 patients with CKD who underwent surgery between January 1, 1997, and December 31, 2011.AMI occurred in 2,708 participants (1.24%). The AMI incidence rate in the dialyzed group was 1.52%, which was higher than that in the nondialyzed group after propensity score matching. Dialysis (odds ratio [OR]: 1.79; 95% confidence interval [CI]: 1.62-1.98), male (OR: 1.42; 95% CI: 1.28-1.57), diabetes mellitus (OR: 1.61; 95% CI: 1.44-1.80), hyperlipidemia (OR: 1.88; 95% CI: 1.68-2.11), old myocardial infarction (OR: 18.87; 95% CI: 16.26-1.21.90), and cerebral vascular disease (CVA) (OR: 1.29; 95% CI: 1.30-1.47) were all associated with AMI in the patients with CKD.The AMI risk was higher in the patients with CKD undergoing orthopedic surgery than in the general population, and the dialyzed group had a higher risk of AMI than did the nondialyzed group."
https://openalex.org/W2909272806,"The identification of elite individuals is a critical component of most breeding programs. However, the achievement of this goal is limited by the high cost of phenotyping and experimental research. A significant benefit of genomic selection (GS) to plant breeding is the identification of elite individuals without the need for phenotyping. This study aimed to propose different calibration strategies using combinations between generations from different genetic backgrounds to improve the reliability of GS and to investigate the effects of LD in different types of mating systems: outcrossing (An) self-pollination (Sn) and hybridization (Hn). For this purpose, we simulated a genome with 10 linkage groups. In each group, two QTL were simulated. Subsequently, an F2 population was created, followed by four generations of inbreeding (S1 to S4, H1 to H 4, A1, to A4,). Quantitative traits were simulated in three scenarios considering three degrees of dominance (d/a = 0, 0.5 and 1) and two broad sense heritabilities (h2 = 0.30 and 0.70), totaling six genetic architectures. To evaluate prediction reliability, a model (RR-BLUP) was trained in one generation and used to predict the following generations of mating systems. For example, the marker effects estimated in the F2 population were used to estimate the expected genomic breeding value (GEBV) in populations S1 through A4. The squared correlation between the GEBV and the true genetic value were used to measure the reliability of the predictions. Independently of the population used to estimate the marker effect, reliability showed the lowest values in the scenario where d = 1. For any scenario, the use of the multigenerational prediction methodology improved the reliability of GS."
https://openalex.org/W2910917882,"In high-income countries, individual- and community-level factors are associated with increased contact with the criminal justice system. However, little is known about how these factors contribute to the risk of arrest in South Africa, which has one of the highest rates of arrests globally. We examine both individual- and community-level factors associated with arrests among young men living in the townships of Cape Town.Data were collected from a stratified community sample of 906 young men aged 18-29 years old living in 18 township neighborhoods. Communities with high and low rates of arrest were identified. Logistic regression models were used to assess which individual-level (such as substance use and mental health status) and community-level (such as infrastructure and presence of bars and gangs) factors predict arrests.Significant predictors of arrests were substance use, gang activity, being older, more stressed, and less educated. Living in communities with better infrastructure and in more recently established communities populated by recent immigrants was associated with having a history of arrests.When considering both individual- and community-level factors, substance use and gang violence are the strongest predictors of arrests among young men in South Africa. Unexpectedly, communities with better infrastructure have higher arrest rates. Community programs are needed to combat substance use and gang activity as a pathway out of risk among South African young men.ClinicalTrials.gov registration #NCT02358226, registered Nov 24, 2014."
