id,abstract
https://openalex.org/W1997870466,"During biosynthesis, a globular protein folds into a tight particle with an interior core that is shielded from the surrounding solvent. The hydrophobic effect is thought to play a key role in mediating this process: nonpolar residues expelled from water engender a molecular interior where they can be buried. Paradoxically, results of earlier quantitative analyses have suggested that the tendency for nonpolar residues to be buried within proteins is weak. However, such analyses merely classify residues as either ""exposed"" or ""buried."" In the experiment reported in this article proteins of known structure were used to measure the average area that each residue buries upon folding. This characteristic quantity, the average area buried, is correlated with residue hydrophobicity."
https://openalex.org/W2027598863,"The sequence of the entire RNA genome of the type flavivirus, yellow fever virus, has been obtained. Inspection of this sequence reveals a single long open reading frame of 10,233 nucleotides, which could encode a polypeptide of 3411 amino acids. The structural proteins are found within the amino-terminal 780 residues of this polyprotein; the remainder of the open reading frame consists of nonstructural viral polypeptides. This genome organization implies that mature viral proteins are produced by posttranslational cleavage of a polyprotein precursor and has implications for flavivirus RNA replication and for the evolutionary relation of this virus family to other RNA viruses."
https://openalex.org/W2093589943,"The size of the midsagittal area of the human corpus callosum obtained from postmortem measurement varied with tested hand preference. The corpus callosum, the main fiber tract connecting the two cerebral hemispheres, was larger by about 0.75 square centimeter, or 11 percent, in left-handed and ambidextrous people than in those with consistent right-hand preference. The difference was present in both the anterior and posterior halves, but not in the region of the splenium itself. This callosal morphology, which varied with hand preference, may also be related to individual differences in the pattern of hemispheric functional specialization. The greater bihemispheric representation of cognitive functions in left- and mixed-handers may be associated with greater anatomical connection between the hemispheres. The naturally occurring regressive events in neurogenesis, such as neuronal cell death and axonal elimination, may be factors in the individual differences in brain morphology and in functional lateralization. Specifically, right-handers may be those with more extensive early elimination of neural components."
https://openalex.org/W2002673255,"The spinal nucleus of the bulbocavernosus (SNB) contains many more motoneurons in adult male rats than in females. Androgens establish this sex difference during a critical perinatal period, which coincides with normally occurring cell death in the SNB region. Sex differences in SNB motoneuron number arise primarily because motoneuron loss is greater in females than in males during the early postnatal period. Perinatal androgen treatment in females attenuates cell death in the SNB region, reducing motoneuron loss to levels typical of males. The results suggest that steroid hormones determine sex differences in neuron number by regulating normally occurring cell death and that the timing of this cell death may therefore define critical periods for steroid effects on neuron number."
https://openalex.org/W2047944520,"(+/-)-3,4-Methylenedioxyamphetamine (MDA), an amphetamine analog with hallucinogenic activity, produced selective long-lasting reductions in the level of serotonin, the number of serotonin uptake sites, and the concentration of 5-hydroxyindoleacetic acid in rat brain. Morphological studies suggested that these neurochemical deficits were due to serotonin nerve terminal degeneration. These results show that MDA has toxic activity for serotonin neurons in rats and raise the question of whether exposure to MDA and related hallucinogenic amphetamines can produce serotonin neurotoxicity in the human brain."
https://openalex.org/W165264657,"The amphipathic helix hypothesis for the lipid-associating domains of exchangeable plasma apolipoproteins has been further studied by analysis of the structure of the complexes formed between four synthetic peptide analogs of the amphipathic helix and dimyristoyl phosphatidylcholine (DMPC). Density gradient ultracentrifugation, negative stain electron microscopy, nondenaturing gradient gel electrophoresis, 1H NMR, high sensitivity differential scanning calorimetry, and circular dichroism were the techniques used in these studies. The two analogs Asp-Trp-Leu-Lys-Ala-Phe-Tyr-Asp-Lys-Val-Ala-Glu-Lys-Leu-Lys-Glu-Ala-Phe (18A) and 18A-Pro-18A whose sequences most strongly mimic native amphipathic sequences were found also most strongly to mimic apolipoprotein A-I in DMPC complex structure. The covalently linked dimer of the prototype amphipathic analog 18A, 18A-Pro-18A, appears to have greater lipid affinity than 18A. This presumably is the result of the cooperativity provided by two covalently linked lipid-associating domains in 18A-Pro-18A. The studies further suggest that the charge-reversed analog of the prototype 18A, reverse-18A, has the lowest lipid affinity of the four analogs studied and forms only marginally stable discoidal DMPC complexes. We postulate that this low lipid affinity is due predominantly, but not necessarily exclusively, to the lack of a hydrophobic contribution of lysine residues at the polar-nonpolar interface of reverse-18A versus 18A. The intermediate lipid affinity of des-Val10-18A, the fourth analog peptide, to produce a rank order of 18A-Pro-18A greater than 18A greater than des-Val10-18A greater than reverse-18A, supports this interpretation. Des-Val10-18A which has Val deleted from 18A has an amphipathic helical structure partially disrupted by the shift of 2 lysine residues away from the polar-nonpolar interface."
https://openalex.org/W2081088219,"The hsp 70 gene of Drosophila contains three domains to which a heat shock gene specific transcription factor (HSTF) binds. In addition to the previously described 55 bp binding domain proximal to the TAT homology, there are two 25 bp binding sites farther upstream. Footprinting studies with 5' and 3' deletion mutations show two contiguous HSTF binding sites of different intrinsic affinities within the 55 bp binding domain. Determinations made with an agarose-acrylamide gel assay suggest that the HSTF possesses a 12.5-fold higher intrinsic affinity for the site closest to the TATA homology than for the more distal site. Binding of HSTF to the distal site thus appears cooperative, requiring occupancy of the first site. Transcription studies in vitro on the 5' deletions with nuclear extracts and reconstitution experiments show that the TATA proximal site alone, is insufficient for maximal transcriptional activation of the hsp 70 gene."
https://openalex.org/W2002527385,
https://openalex.org/W2053810188,"Hemocyanins are large multi-subunit copper proteins that transport oxygen in many arthropods and molluscs. Comparison of the amino acid sequence data for seven different subunits of arthropod hemocyanins from crustaceans and chelicerates shows many highly conserved residues and extensive regions of near identity. This correspondence can be matched closely with the three domain structure established by x-ray crystallography for spiny lobster hemocyanin. The degree of identity is particularly striking in the second domain of the subunit that contains the six histidines which ligate the two oxygen-binding copper atoms. The polypeptide architecture of spiny lobster hemocyanin appears to be the same in all arthropods. This structure must therefore be at least as old as the estimated time of divergence of crustaceans and chelicerates, about 540 to 600 million years ago."
https://openalex.org/W2079037879,
https://openalex.org/W2086332154,Phosphorus-31 nuclear magnetic resonance (NMR) spectra showing the relative concentrations of high-energy phosphate metabolites have been recorded noninvasively from the human heart in vivo. Spectral data were spatially localized by combining a pulsed magnetic field gradient with surface NMR excitation-detection coils. The location of the selected spectral region was determined by conventional proton NMR imaging immediately before examination by phosphorus-31 NMR spectroscopy.
https://openalex.org/W2041869897,
https://openalex.org/W1966565972,"The c-fms proto-oncogene was shown to be expressed in human bone marrow and in differentiated blood mononuclear cells, suggesting that its gene product plays a role in hematopoietic maturation. The c-fms mRNA was not detected in HL-60 cells, an established promyelocytic line, whereas c-fms expression appeared 48 hr after induction when most cells had differentiated into macrophages. An acquired deletion of chromosome 5 (5q−) in bone marrow cells is associated with abnormalities in blood cell production. The normal 5 and 5q− chromosomes were segregated by construction of cell hybrids between bone marrow and rodent cells. A selective system was used that requires retention of the structural gene for dihydrofolate reductase, located on human chromosome 5. Analysis of DNA from individual hybrid clones revealed that the 5q− deletion had removed the c-fms gene. We postulate that hemizygosity at the c-fms locus leads to abnormalities in hematopoietic maturation."
https://openalex.org/W2087480868,A specific fibrinolytic agent was synthesized by covalently coupling urokinase to a monoclonal antibody that was fibrin-specific and did not cross-react with fibrinogen. The antibody was raised against a synthetic peptide representing the seven amino-terminal residues of the beta chain of human fibrin. The urokinase-antifibrin conjugate retained the original binding specificity of the antibody and showed 100-fold increased fibrinolysis in vitro when compared to unmodified urokinase. The presence of human fibrinogen at plasma concentration did not influence these properties.
https://openalex.org/W2077367379,"Arterial blood nitrogen tensions of free-diving Weddell seals (Leptonychotes weddelli) were measured by attaching a microprocessor-controlled blood pump and drawing samples at depth to determine how these marine mammals dive to great depths and ascend rapidly without developing decompression sickness. Forty-seven samples of arterial blood were obtained from four Weddell seals during free dives lasting up to 23 minutes to depths of 230 meters beneath the sea ice of McMurdo Sound, Antarctica. Peak arterial blood nitrogen tensions of between 2000 and 2500 millimeters of mercury were recorded at depths of 40 to 80 meters during descent, indicating that the seal's lung collapses by 25 to 50 meters. Then arterial blood nitrogen tensions slowly decreased to about 1500 millimeters of mercury at the surface. In a single dive, alveolar collapse and redistribution of blood nitrogen allow the seal to avoid nitrogen narcosis and decompression sickness."
https://openalex.org/W2002907404,"Soon after infection, retroviruses synthesize a DNA copy of the genomic RNA and insert that DNA into the cellular genome by recombination at inverted repeat sequences at the termini of the viral genome. We have generated mutations that alter one terminus of the genome of Moloney murine leukemia virus (M-MuLV). Some mutations did not prevent integration of the viral DNA even though the very terminal bases were disrupted. Other mutations had dramatic effects on the efficiency of infection; in these cases the formation of preintegrative DNA was normal but the establishment of the productive provirus was prevented. One of these defective mutants gave rise to a pseudorevertant which differed from the wild type but displayed normal infectivity. An unusual number of bases of viral DNA were removed during the integration reaction carried out by this virus."
https://openalex.org/W1487236423,"The time dependence of the release of fibrinopeptides from fibrinogen was studied as a function of the concentration of fibrinogen, thrombin, and Gly-Pro-Arg-Pro, an inhibitor of fibrin polymerization. The release of fibrinopeptides during fibrin assembly was shown to be a highly ordered process. Rate constants for individual steps in the formation of fibrin were evaluated at pH 7.4, 37 degrees C, gamma/2 = 0.15. The initial event, thrombin-catalyzed proteolysis at Arg-A alpha 16 to release fibrinopeptide A (kcat/Km = 1.09 X 10(7) M-1s-1) was followed by association of the resulting fibrin I monomers. Association of fibrin I was found to be a reversible process with rate constants of 1 X 10(6) M-1s-1 and 0.064 s-1 for association and dissociation, respectively. Assuming random polymerization of fibrin I monomer, the equilibrium constant for fibrin I association (1.56 X 10(7) M-1) indicates that greater than 80% of the fibrin I protofibrils should contain more than 10 monomeric units at 37 degrees C, pH 7.4, when the fibrin I concentration is 1.0 mg/ml. Association of fibrin I monomers was shown to result in a 6.5-fold increase in the susceptibility of Arg-B beta 14 to thrombin-mediated proteolysis. The 6.5-fold increase in the observed specificity constant from 6.5 X 10(5) M-1s-1 to 4.2 X 10(6) M-1s-1 upon association of fibrin I monomers and the rate constant for fibrin association indicates that most of the fibrinopeptide B is released after association of fibrin I monomers. The interaction between a pair of polymerization sites in fibrin I dimer was found to be weaker than the interaction of fibrin I with Gly-Pro-Arg-Pro and weaker than the interaction of fibrin I with fibrinogen."
https://openalex.org/W1595344075,"The stoichiometry of antithrombin III (AT) inhibition of alpha-thrombin (T) has been investigated in the presence and absence of heparin as a function of ionic strength by quantitative titration of enzyme active sites. In contrast to the ionic strength-independent stoichiometry of 1.0 mol of AT/mol of T observed in the absence of heparin, the presence of high-affinity heparin (HAH) resulted in an ionic strength-dependent increase in the apparent stoichiometry of inhibition from a molar ratio of 1.1 AT/T at an ionic strength of 0.3 to 9.8 mol of AT/T when the ionic strength was lowered to 0.01. Reduced sodium dodecyl sulfate-polyacrylamide gel electrophoresis of the reaction products revealed that the increased AT/T stoichiometry was due to preferential formation of a specific proteolytically cleaved form of AT that was indistinguishable from the previously characterized reactive site-cleaved AT (ATM). Using high-performance liquid chromatography and sodium dodecyl sulfate-polyacrylamide gel electrophoresis to quantitate ATM, the cleaved inhibitor was shown to be formed rapidly and concomitant with the stable thrombin-antithrombin complex (TAT) and quantitatively accounted for the apparent increase in reaction stoichiometry at low ionic strength in the presence of HAH. The levels of HAH required to produce maximum ATM were catalytic at mu greater than or equal to 0.15, but became stoichiometric as the ionic strength decreased below 0.1. Substantially less ATM was produced in the presence of low-affinity heparin, while a low molecular weight HAH, virtually inactive in accelerating T inhibition by AT, was unable to promote significant ATM formation. These results indicate competition between substrate and inhibition reactions of AT with T which are affected by an ionic strength-dependent heparin interaction. A reaction mechanism accounting for these observations is proposed."
https://openalex.org/W2048121987,"Melanocytes derived from fetal or adult skin do not propagate in vitro unless cultured in the presence of factors such as 12-O-tetradecanoylphorbol 13-acetate (TPA). In a search for physiological factors regulating the growth of melanocytes, extracts of various cultured cell types were tested. Factors produced by melanoma and astrocytoma cell lines support continued proliferation of melanocytes in the absence of TPA. WI-38, a fibroblast cell line derived from human embryonic lung, was the most active source of melanocyte growth factors. No melanocyte growth-promoting activity was found in extracts of cultured neuroblastoma, renal cancer, normal keratinocytes, or renal epithelium. Nerve growth factor, epidermal growth factor, melanocyte-stimulating hormone, transforming growth factor-beta, and platelet-derived growth factor did not have growth-promoting activity for melanocytes. The presence of melanocyte growth factors and TPA together resulted in the strongest mitogenic activity for melanocytes, permitting the recovery (at 20 days) of 4 to 20 times as many cells as in growth factor or TPA alone."
https://openalex.org/W2020231679,"Picosecond time-resolved Raman spectra of hemoglobin generated with blue pulses (20 to 30 picoseconds) that were resonant with the Soret band and of sufficient intensity to completely photodissociate the starting liganded sample are reported. For both R- and T-state liganded hemoglobins, the peak frequencies in the spectrum of the deoxy transient were the same at approximately 25 picoseconds as those observed at 10 nanoseconds subsequent to photodissociation. In particular, the large R-T differences in the frequency of the stretching mode for the iron-proximal histidine bond (VFe-His) detected in previously reported nanosecond-resolved spectra were also evident in the picosecond-resolved spectra. The implications of this finding with respect to the distribution of strain energy in the liganded protein and the origin of the time course for geminate recombination are discussed. On the basis of these results, a microscopic model is proposed in which delocalization of strain energy is strongly coupled to the coordinate of the iron. The model is used to explain the origin of the R-T differences in the rates of ligand dissociation."
https://openalex.org/W1844686547,"A somatic cell mutant (Mev-1) auxotrophic for mevalonate by virtue of a complete lack of detectable 3-hydroxy-3-methylglutaryl coenzyme A (HMG-CoA) synthase activity has been shown to demonstrate a requirement for a non-sterol mevalonate-derived product for regulation of synthesis of HMG-CoA reductase. A comparison of the effects of 25-hydroxycholesterol and the combination of 25-hydroxycholesterol and mevalonate on HMG-CoA reductase activity, synthesis, and mRNA levels in Mev-1 is presented in this report. The results show a close correlation between activity, rate of synthesis, and mRNA levels for Mev-1 cells treated with 25-hydroxycholesterol alone. Under the conditions of these experiments these effects are relatively small (approximately a 4-fold decrease). A much larger inhibition of HMG-CoA reductase activity and rate of synthesis (approximately 50-fold) is observed upon treatment of Mev-1 cells with a combination of 25-hydroxycholesterol and mevalonate. Yet, under these conditions mRNA levels are still reduced by only a factor of 4. These results are interpreted to suggest that the non-sterol mevalonate-derived regulatory product of HMG-CoA reductase acts by a translational control mechanism."
https://openalex.org/W2130692096,"The mitochondrial dicarboxylate carrier has been substantially purified from rat liver mitoplasts by extraction with Triton X-114 in the presence of cardiolipin followed by chromatography on hydroxylapatite. Upon incorporation of the hydroxylapatite eluate into phospholipid vesicles, an n-butylmalonate-sensitive malonate/malate exchange has been demonstrated. This exchange activity is enhanced 226-fold relative to the starting material (i.e. detergent-extracted mitoplasts). Silver-stained sodium dodecyl sulfate-polyacrylamide gradient gels verify the high purity of this fraction relative to the starting material. Nonetheless, the banding pattern indicates that several protein species are still present. As isolated, the dicarboxylate transporter is rather unstable but can be stabilized either by the addition of 10% ethylene glycol and subsequent storage at -20 degrees C or by incorporation into phospholipid vesicles in the presence of malate followed by freezing in liquid nitrogen. Such proteoliposomes catalyze a [14C]malonate uptake which is characterized by a first order rate constant of 1.02 min-1 and a t 1/2 of 41 s. This uptake can be inhibited by dicarboxylates (e.g. succinate, malate, unlabeled malonate) but not by either alpha-ketoglutarate or by tricarboxylates (e.g. citrate, threo-Ds-isocitrate). Furthermore, the reconstituted malonate transport is dependent on internal malate and can be inhibited by n-butylmalonate, mersalyl, p-chloromercuribenzoate, and Pi, but not by N-ethylmaleimide. It is concluded that this highly purified fraction contains a reconstitutively active dicarboxylate transporter which, based on its substrate specificity and inhibitor sensitivity, appears to be identical to the native dicarboxylate transport system found in intact rat liver mitochondria."
https://openalex.org/W2008871930,"Salamanders of the genus Thorius (Plethodontidae) are among the smallest tetrapods. Hypotheses of limb skeletal evolution in these vertebrates were evaluated on the basis of estimates of natural variation, comparisons of skeletal homology, and analysis of molecular phylogeny. Nine carpal arrangements occur in Thorius, more than in all twelve related genera of typically larger salamanders; six of these arrangements are unique. They represent a trend toward a decrease in the number of separate cartilages that is independent of locomotor and ecological specialization. Miniaturization may be an important source of morphological novelty, distinct from local adaptation, in vertebrates."
https://openalex.org/W2069644095,"The spectral sensitivities and color of oil droplets of cone photoreceptors in the retina of the red-eared turtle (Pseudemys scripta elegans) were investigated by intracellular recording and injections of Lucifer yellow dye. Six morphological types of cones could be distinguished by the color of the oil droplets located in the outermost inner segments. Single cones containing either red or pale green oil droplets were sensitive to red light, cones with yellow oil droplets to green, and cones with clear oil droplets to blue. Contrary to previous reports, both principal and accessory members of double cones were sensitive to red, and no diffusion of dye was detected between the two apposed members. Thus, the oil droplets provide a reliable morphological basis for further investigation of the neuroanatomical networks underlying the processing of color information in the vertebrate retina."
https://openalex.org/W1597626465,"It has been established that the horseradish peroxidase/O2/isobutyraldehyde (IBAL) system leads to triplet acetone and formic acid formation followed by phosphorescence of the triplet acetone (see, for example, Bechara, E.J.H., Faria Oliveira, O.M.M., Duran, N., Casadei de Baptista, R., and Cilento, G. (1979) Photochem. Photobiol. 30, 101-110). In this paper many of the mechanistic details are established. The reaction is initiated by the autoxidation of IBAL to form the peracid (CH3)2CHC = O(OOH). The peracid converts horseradish peroxidase into compound I which in turn is converted into compound II by abstracting the alcoholic hydrogen atom from the enol form of IBAL. This creates a free radical with two resonance forms. (Formula: see text) Addition of molecular oxygen to the latter resonance form creates a peroxy radical which abstracts a hydrogen atom near the active site of the enzyme. The newly formed alpha-peroxide in turn forms a dioxetane-type of intermediate which rapidly decomposes into triplet acetone and formic acid. Compound II reacts with the enol by the same pathway as compound I. Thus native horseradish peroxidase is regenerated. The hydrogen atom abstraction near the enzyme active site may occur directly from ethanol, present to solubilize IBAL or from a group on the enzyme, in which case ethanol participates in a repair mechanism. Phosphate buffer is necessary because it catalyzes the keto-enol conversion of IBAL. Thus horseradish peroxidase participates in a normal peroxidatic cycle. The only chain reaction is the uncatalyzed autoxidation of IBAL, most of which occurs prior to the mixing of IBAL with the oxygenated horseradish peroxidase solution."
https://openalex.org/W2039534337,"The complete nucleotide sequence of the coding region of the circumsporozoite antigen gene (CS gene) of the Nuri strain of the malarial parasite Plasmodium knowlesi is presented. The gene from the Nuri strain exhibits a novel form of sequence diversity when compared to the CS gene from the H strain. Instead of the 12 tandem repeating 36-base pair units of the H strain, the Nuri strain contains 16 tandem repeating 27-base pair units of a different nucleotide sequence that encodes a different repeating peptide. In contrast, the 5' and 3' coding and noncoding sequences flanking the repeats are 98 percent conserved in both strains."
