id,abstract
https://openalex.org/W2056152579,"Background Recent functional studies have demonstrated that the microRNAs (miRNAs) play critical roles in ovarian gonadal development, steroidogenesis, apoptosis, and ovulation in mammals. However, little is known about the involvement of miRNAs in the ovarian function of fowl. The goose (Anas cygnoides) is a commercially important food that is cultivated widely in China but the goose industry has been hampered by high broodiness and poor egg laying performance, which are influenced by ovarian function. Methodology/Principal Findings In this study, the miRNA transcriptomes of ovaries from laying and broody geese were profiled using Solexa deep sequencing and bioinformatics was used to determine differential expression of the miRNAs. As a result, 11,350,396 and 9,890,887 clean reads were obtained in laying and broodiness goose, respectively, and 1,328 conserved known miRNAs and 22 novel potential miRNA candidates were identified. A total of 353 conserved microRNAs were significantly differentially expressed between laying and broody ovaries. Compared with miRNA expression in the laying ovary, 127 miRNAs were up-regulated and 126 miRNAs were down-regulated in the ovary of broody birds. A subset of the differentially expressed miRNAs (G-miR-320, G-miR-202, G-miR-146, and G-miR-143*) were validated using real-time quantitative PCR. In addition, 130,458 annotated mRNA transcripts were identified as putative target genes. Gene ontology annotation and KEGG (Kyoto Encyclopedia of Genes and Genomes) pathway analysis suggested that the differentially expressed miRNAs are involved in ovarian function, including hormone secretion, reproduction processes and so on. Conclusions The present study provides the first global miRNA transcriptome data in A. cygnoides and identifies novel and known miRNAs that are differentially expressed between the ovaries of laying and broody geese. These findings contribute to our understanding of the functional involvement of miRNAs in the broody period of goose."
https://openalex.org/W2034274612,"Expression of matrix metalloproteinase-1 (MMP-1), an interstitial collagenase, plays a major role in cellular invasion during development of gastric cancer, a leading cause of death worldwide. A single-nucleotide polymorphism (SNP) −1607 1G/2G site of the MMP-1 gene promoter has been reported to alter transcription level. While the importance’s of other SNPs in the MMP-1 promoter have not yet been studied in gastric cancer, our aim was to investigate MMP-1 gene promoter polymorphisms and gastric cancer susceptibility in eastern Indian population. A total of 145 gastric cancer patients and 145 healthy controls were genotyped for MMP-1 −1607 1G/2G (rs1799750) by PCR-restriction fragment length polymorphism (RFLP), while MMP-1 −519 A/G (rs1144393), MMP-1 −422 T/A (rs475007), MMP-1 −340 T/C (rs514921) and MMP-1 −320 T/C (rs494379) were genotyped by DNA sequencing. A positive association was found with MMP-1 −422 T/A SNP that showed significant risk for regional lymph node metastasis (P = 0.021, Odd’s ratio (OR) = 3.044, Confidence intervals (CI) = 1.187–7.807). In addition, we found a significant association with lower stomach tumor formation among gastric cancer patients for three adjacent polymorphisms near the transcriptional start sites of [MMP-1 −422 T/A (P = 0.043, OR = 2.182, CI = 1.03–4.643), MMP-1 −340 T/C (P = 0.075, OR = 1.97, CI = 0.94–4.158) and MMP-1 −320 T/C (P = 0.034, OR = 2.224, CI = 1.064–40731)]. MMP-1 level in patients’ serum was correlated with MMP-1 promoter haplotypes conferring these three SNPs to evaluate the functional importance of these polymorphisms in lower stomach tumor formation and significant correlation was observed. Furthermore, MMP-1 −519 A/G polymorphism displayed poor cellular differentiation (P = 0.024, OR = 3.8, CI = 1.69–8.56) attributing a higher risk of cancer progression. In conclusion, MMP-1 proximal promoter SNPs are associated with the risk of lower stomach tumor formation and node metastasis in eastern Indian population."
https://openalex.org/W2066026585,"Background Studies in murine models and human populations have indicated that the collagen-rich granulomatous response against parasite eggs trapped in the liver is associated with the development of severe hepatosplenic schistosomiasis, characterized by periportal fibrosis and portal hypertension. The role of the humoral response in parasite susceptibility has been well established, but its participation in disease severity remains poorly understood. In this work, we evaluated the relationship between parasite-reactive IgE and IgG levels and schistosomiasis morbidity in infected patients with similar parasite burdens. Methodology/Principal Findings Ninety-seven Schistosoma mansoni-infected individuals were subjected to clinical examination and abdominal ultrasound analysis. IgG reactivity and IgE concentration against Schistosoma mansoni soluble egg antigens (SEA) and adult worm antigen preparation (SWAP) were evaluated by ELISA assay. Multivariable linear regression models were used to evaluate the relationship between parasite-reactive antibodies and the co-variables investigated. The study population showed low parasite burden (median 30 eggs/g feces), constant re-infection, and signs of fibrosis was detected in more than 30% of individuals. Most infected individuals showed IgG reactivity, and the median concentrations of IgE anti-SEA and anti-SWAP antibodies were 1,870 and 1,375 ng/mL, respectively. There was no association between parasite burden and antibody response or any parameter of disease severity. However, IgG anti-SWAP level was positively associated with morbidity parameters, such as spleen size and thickness of portal vein at the entrance and secondary branch. In contrast, the data also revealed independent inverse correlations between concentration of parasite-reactive IgE and gallbladder wall thickness, a marker of fibrosis in schistosomiasis. Conclusions/Significance The data indicate that IgG anti-SWAP is positively associated with severe schistosomiasis, independently of parasite burden, while high production of parasite-specific IgE is associated with mild disease in the human population. Antibody profiles are good correlates for schistosomiasis severity and could be tested as biomarkers of disease severity."
https://openalex.org/W2013137592,"The reductively activated nitroaromatic class of antimicrobials, which include nitroimidazole and the more metabolically labile nitrofuran antitubercular agents, have demonstrated some potential for development as therapeutics against dormant TB bacilli. In previous studies, the pharmacokinetic properties of nitrofuranyl isoxazolines were improved by incorporation of the outer ring elements of the antitubercular nitroimidazole OPC-67683. This successfully increased stability of the resulting pentacyclic nitrofuran lead compound Lee1106 (referred to herein as 9a). In the current study, we report the synthesis and antimicrobial properties of 9a and panel of 9a analogs, which were developed to increase oral bioavailability. These hybrid nitrofurans remained potent inhibitors of Mycobacterium tuberculosis with favorable selectivity indices (>150) and a narrow spectrum of activity. In vivo, the pentacyclic nitrofuran compounds showed long half-lives and high volumes of distribution. Based on pharmacokinetic testing and lack of toxicity in vivo, 9a remained the series lead. 9a exerted a lengthy post antibiotic effect and was highly active against nonreplicating M. tuberculosis grown under hypoxia. 9a showed a low potential for cross resistance to current antitubercular agents, and a mechanism of activation distinct from pre-clinical tuberculosis candidates PA-824 and OPC-67683. Together these studies show that 9a is a nanomolar inhibitor of actively growing as well as nonreplicating M. tuberculosis."
https://openalex.org/W2057168674,"Historical records of species are compared with current records to elucidate effects of recent climate change. However, confounding variables such as succession, land-use change, and species invasions make it difficult to demonstrate a causal link between changes in biota and changes in climate. Experiments that manipulate temperature can overcome this issue of attribution, but long-term impacts of warming are difficult to test directly. Here we combine historical and experimental data to explore effects of warming on ant assemblages in southeastern US. Observational data span a 35-year period (1976-2011), during which mean annual temperatures had an increasing trend. Mean summer temperatures in 2010-2011 were ∼ 2.7 °C warmer than in 1976. Experimental data come from an ongoing study in the same region, for which temperatures have been increased ∼ 1.5-5.5 °C above ambient from 2010 to 2012. Ant species richness and evenness decreased with warming under natural but not experimental warming. These discrepancies could have resulted from differences in timescales of warming, abiotic or biotic factors, or initial species pools. Species turnover tended to increase with temperature in observational and experimental datasets. At the species level, the observational and experimental datasets had four species in common, two of which exhibited consistent patterns between datasets. With natural and experimental warming, collections of the numerically dominant, thermophilic species, Crematogaster lineolata, increased roughly two-fold. Myrmecina americana, a relatively heat intolerant species, decreased with temperature in natural and experimental warming. In contrast, species in the Solenopsis molesta group did not show consistent responses to warming, and Temenothorax pergandei was rare across temperatures. Our results highlight the difficulty of interpreting community responses to warming based on historical records or experiments alone. Because some species showed consistent responses to warming based on thermal tolerances, understanding functional traits may prove useful in explaining responses of species to warming."
https://openalex.org/W1971319463,"Food shortage is a common situation in nature but little is known about the strategies animals use to overcome it. This lack of knowledge is especially true for outbreaking insects, which commonly experience nutritional stress for several successive generations when they reach high population densities. The aim of this study is to evaluate the life history consequences of chronic nutritional stress in the outbreaking moth Choristoneura fumiferana. Larvae were reared on two different artificial diets that emulate nutritional conditions larvae face during their natural population density cycle (low and medium quality artificial diets). After four generations, a subset of larvae was fed on the same diet as their parents, and another on the opposite diet. We explored larval life-history strategies to cope with nutritional stress, its associated costs and the influence of nutritional conditions experienced in the parental generation. We found no evidence of nutritional stress in the parental generation increasing offspring ability to feed on low quality diet, but the contrary: compared to offspring from parents that were fed a medium quality diet, larvae from parents fed a low quality diet had increased mortality, reduced growth rate and reduced female reproductive output. Our results support a simple stress hypothesis because the negative effects of malnutrition accumulated over successive generations. Density-dependent deterioration in plant quality is thought to be an important factor governing the population dynamics of outbreaking insects and we hypothesize that chronic nutritional stress can be a driver of outbreak declines of C. fumiferana, and of forest insects in general."
https://openalex.org/W2067115871,"The epithelial mesenchymal transition (EMT) is an important process in tumor development. Despite previous investigations, it remains unclear how p120-catenin (p120ctn) isoforms 1A and 3A affect the EMT of tumor cells. Here we investigated expression of p120ctn, E-cadherin and vimentin in 78 human non-small cell lung cancer (NSCLC) samples by immunohistochemistry and found that p120ctn membrane expression positively correlated with E-cadherin expression (P<0.001) and negatively correlated with vimentin expression and lymph node metastasis (P<0.05). Meanwhile, p120ctn cytoplasmic expression negatively correlated with E-cadherin expression (P<0.001) and positively correlated with vimentin expression and lymph node metastasis (P<0.05). Cells expressing high (H460 and SPC) and low (H1299 and LK2) levels of p120ctn were screen to investigate its impact on EMT. E-cadherin was restricted to the cell membrane in H460 and H1299 cells, whereas it was expressed in the cytoplasm of SPC and LK2 cells. Ablation of endogenous p120ctn isoform 1A in cells expressing high levels of the protein resulted in decreased E-cadherin expression, increased N-cadherin, vimentin and snail expression and enhanced invasiveness in H460 cells. Meanwhile, completely opposite results were observed in SPC cells. Furthermore, transfection of in H1299 cells expressing low p120ctn levels with the p120ctn isoform 1A plasmid resulted in increased E-cadherin expression, decreased N-cadherin, vimentin and snail expression and weakened invasiveness, while LK2 cells showed completely opposite results. Both cell lines expressing low p120ctn levels and transfected with the p120ctn isoform 3A plasmid appeared to have increased E-cadherin expression, decreased N-cadherin, vimentin and snail expression and weakened invasiveness. In conclusion, in cells with membrane E-cadherin, both p120ctn isoforms 1A and 3A inhibited EMT and decreased cell invasiveness. In cells with cytoplasmic E-cadherin, p120ctn isoform 1A promoted EMT and increased cell invasiveness, while p120ctn isoform 3A inhibited the EMT and decreased cell invasiveness."
https://openalex.org/W2072722863,"The efficacy of Vectobac GR (potency 200 ITU/mg), a new formulation of bacterial larvicide Bacillus thuringiensis var. israelensis Strain AM65-52, was evaluated against Anopheles gambiae and Culex quinquefasciatus in simulated field and natural habitats in Benin.In simulated field conditions, Vectobac GR formulation was tested at 3 dosages (0.6, 0.9, 1.2 g granules/m² against An. gambiae and 1, 1.5, 2 g granules/m² against Cx. quinquefasciatus) according to manufacturer's product label recommendations. The dosage giving optimum efficacy under simulated field conditions were evaluated in the field. The efficacy of Vectobac GR in terms of emergence inhibition in simulated field conditions and of reduction of larval and pupal densities in rice fields and urban cesspits was measured following WHO guidelines for testing and evaluation of mosquito larvicides.Vectobac GR caused emergence inhibition of ≥80% until 21 [20]-[22] days for An. gambiae at 1.2 g/m² dose and 28 [27-29] days for Cx. quinquefasciatus at 2 g/m² in simulated field habitats. The efficacy of Vectobac GR in natural habitats was for 2 to 3 days against larvae and up to 10 days against pupae.Treatment with Vectobac GR caused complete control of immature mosquito within 2-3 days but did not show prolonged residual action. Larviciding can be an option for malaria and filariasis vector control particularly in managing pyrethroid-resistance in African malaria vectors. Since use of larvicides among several African countries is being emphasized through Economic Community of West Africa States, their epidemiological impact should be carefully investigated."
https://openalex.org/W2087476152,"Varicose veins are elongated and dilated saphenous veins. Despite the high prevalence of this disease, its pathogenesis remains unclear.In this study, we investigated the control of matrix metalloproteinases (MMPs) expression by prostaglandin (PG)E₂ during the vascular wall remodeling of human varicose veins.Varicose (small (SDv) and large diameter (LDv)) and healthy saphenous veins (SV) were obtained after surgery. Microsomal and cytosolic PGE-synthases (mPGES and cPGES) protein and mRNA responsible for PGE₂ metabolism were analyzed in all veins. cPGES protein was absent while its mRNA was weakly expressed. mPGES-2 expression was similar in the different saphenous veins. mPGES-1 mRNA and protein were detected in healthy veins and a significant decrease was found in LDv. Additionally, 15-hydroxyprostaglandin dehydrogenase (15-PGDH), responsible for PGE₂ degradation, was over-expressed in varicose veins. These variations in mPGES-1 and 15-PGDH density account for the decreased PGE₂ level observed in varicose veins. Furthermore, a significant decrease in PGE₂ receptor (EP4) levels was also found in SDv and LDv. Active MMP-1 and total MMP-2 concentrations were significantly decreased in varicose veins while the tissue inhibitors of metalloproteinases (TIMP -1 and -2), were significantly increased, probably explaining the increased collagen content found in LDv. Finally, the MMP/TIMP ratio is restored by exogenous PGE₂ in varicose veins and reduced in presence of an EP4 receptor antagonist in healthy veins.In conclusion, PGE₂ could be responsible for the vascular wall thickening in human varicose veins. This mechanism could be protective, strengthening the vascular wall in order to counteract venous stasis."
https://openalex.org/W2014006385,"Introduction Excessive alcohol consumption increases the risk of many diseases and injuries, and the Global Burden of Disease 2010 study estimated that 6% of the burden of disease in Denmark is due to alcohol consumption. Alcohol consumption thus places a considerable economic burden on society. Methods We analysed the cost-effectiveness of six interventions aimed at preventing alcohol abuse in the adult Danish population: 30% increased taxation, increased minimum legal drinking age, advertisement bans, limited hours of retail sales, and brief and longer individual interventions. Potential health effects were evaluated as changes in incidence, prevalence and mortality of alcohol-related diseases and injuries. Net costs were calculated as the sum of intervention costs and cost offsets related to treatment of alcohol-related outcomes, based on health care costs from Danish national registers. Cost-effectiveness was evaluated by calculating incremental cost-effectiveness ratios (ICERs) for each intervention. We also created an intervention pathway to determine the optimal sequence of interventions and their combined effects. Results Three of the analysed interventions (advertising bans, limited hours of retail sales and taxation) were cost-saving, and the remaining three interventions were all cost-effective. Net costs varied from € -17 million per year for advertisement ban to € 8 million for longer individual intervention. Effectiveness varied from 115 disability-adjusted life years (DALY) per year for minimum legal drinking age to 2,900 DALY for advertisement ban. The total annual effect if all interventions were implemented would be 7,300 DALY, with a net cost of € -30 million. Conclusion Our results show that interventions targeting the whole population were more effective than individual-focused interventions. A ban on alcohol advertising, limited hours of retail sale and increased taxation had the highest probability of being cost-saving and should thus be first priority for implementation."
https://openalex.org/W2021244640,"Highly active antiretroviral therapy (HAART) can reduce levels of human immunodeficiency virus type 1 (HIV-1) to undetectable levels in infected individuals, but the virus is not eradicated. The mechanisms of viral persistence during HAART are poorly defined, but some reservoirs have been identified, such as latently infected resting memory CD4⁺ T cells. During latency, in addition to blocks at the initiation and elongation steps of viral transcription, there is a block in the export of viral RNA (vRNA), leading to the accumulation of multiply-spliced transcripts in the nucleus. Two of the genes encoded by the multiply-spliced transcripts are Tat and Rev, which are essential early in the viral replication cycle and might indicate the state of infection in a given population of cells. Here, the levels of multiply-spliced transcripts were compared to the levels of gag-containing RNA in tissue samples from RT-SHIV-infected rhesus macaques treated with HAART. Splice site sequence variation was identified during development of a TaqMan PCR assay. Multiply-spliced transcripts were detected in gastrointestinal and lymphatic tissues, but not the thymus. Levels of multiply-spliced transcripts were lower than levels of gag RNA, and both correlated with plasma virus loads. The ratio of multiply-spliced to gag RNA was greatest in the gastrointestinal samples from macaques with plasma virus loads <50 vRNA copies per mL at necropsy. Levels of gag RNA and multiply-spliced mRNA in tissues from RT-SHIV-infected macaques correlate with plasma virus load."
https://openalex.org/W1971466932,"Angiotensin I-converting enzyme (ACE) has two functional N- and C-domain active centers that display differences in the metabolism of biologically-active peptides including the hemoregulatory tetrapeptide, Ac-SDKP, hydrolysed preferentially by the N domain active center. Elevated Ac-SDKP concentrations are associated with reduced tissue fibrosis.We identified a patient of African descent exhibiting unusual blood ACE kinetics with reduced relative hydrolysis of two synthetic ACE substrates (ZPHL/HHL ratio) suggestive of the ACE N domain center inactivation. Inhibition of blood ACE activity by anti-catalytic mAbs and ACE inhibitors and conformational fingerprint of blood ACE suggested overall conformational changes in the ACE molecule and sequencing identified Ser333Trp substitution in the N domain of ACE. In silico analysis demonstrated S333W localized in the S1 pocket of the active site of the N domain with the bulky Trp adversely affecting binding of ACE substrates due to steric hindrance. Expression of mutant ACE (S333W) in CHO cells confirmed altered kinetic properties of mutant ACE and conformational changes in the N domain. Further, the S333W mutant displayed decreased ability (5-fold) to cleave the physiological substrate AcSDKP compared to wild-type ACE.A novel Ser333Trp ACE mutation results in dramatic changes in ACE kinetic properties and lowered clearance of Ac-SDKP. Individuals with this mutation (likely with significantly increased levels of the hemoregulatory tetrapeptide in blood and tissues), may confer protection against fibrosis."
https://openalex.org/W2069032397,"This paper aims to establish evidence for available phosphorous (AP) binding with total nitrogen (N) in subtropical forest soils. Soil organic carbon (SOC), total N, total phosphorous (P) and AP concentration were measured for three contrasting forest types in southern China: Masson pine forest (MPF), coniferous and broadleaved mixed forest (CBMF) and monsoon evergreen broadleaved forest (MEBF). A pot experiment with N addition was conducted to confirm the dominant factor to affect on soil AP concentration. The results showed that mean soil total N concentration in 0–10 cm soil layer was 440±50 for MPF, 840±80 for CBMF and 1020±50 mg kg−1 for MEBF, respectively. The mean soil AP concentration in 0–10 cm soil layer was 2.67±0.87 for MPF, 2.65±0.58 for CBMF, 4.10±0.29 mg kg−1 for MEBF, respectively. The soil total N concentration could explain about 70% of the variations in soil AP concentration in the top 20 cm soil layers in the three forest types. A pot experiment with N addition also showed an increase of AP concentration from 2.56 to 5.63 mg kg−1, when N addition increased from 5 g to 17 g NH4NO3. Our results therefore suggested that N addition significantly increased soil AP concentration, which might be beneficial for stabilizing the net primary production of subtropical forests that were limited by soil AP. This finding may provide a theory basis for tropical and subtropical forests management."
