id,abstract
https://openalex.org/W2063975298,"The Akt - GSK3 signaling pathway has been recently implicated in psychostimulant-induced behavioral and cellular effects. Here, the ability of cocaine to regulate the activity of Akt and GSK3 was investigated by measuring the phosphorylation states of the two kinases. The anatomical specificity of the response was determined, as was the contributions of dopamine and NMDA receptors to the actions of cocaine. As GSK3 activity was found to be increased by cocaine, subsequent experiments investigated the importance of GSK3 activation in cocaine conditioned reward. Adult male CD-1 mice were injected with cocaine or saline, and levels of phosphorylated Akt and GSK3α/β were measured 30 minutes later. Acute administration of cocaine significantly decreased the phosphorylation of Akt-Thr308 (pAkt-Thr308) and GSK3β in the caudate putamen and nucleus accumbens core, without altering pAkt-Ser473 and pGSK3α. To investigate the role of dopamine and NMDA receptors in the regulation of Akt and GSK3 by cocaine, specific receptor antagonists were administered prior to cocaine. Blockade of dopamine D2 receptors with eticlopride prevented the reduction of pAkt-Thr308 produced by cocaine, whereas antagonists at dopamine D1, dopamine D2 or glutamatergic NMDA receptors each blocked cocaine-induced reductions in pGSK3β. The potential importance of GSK3 activity in the rewarding actions of cocaine was determined using a cocaine conditioned place preference procedure. Administration of the selective GSK3 inhibitor, SB 216763, prior to cocaine conditioning sessions blocked the development of cocaine place preference. In contrast, SB 216763 did not alter the acquisition of a contextual fear conditioning response, demonstrating that SB 216763 did not globally inhibit contextual learning processes. The results of this study indicate that phosphorylation of GSK3β is reduced, hence GSK3β activity is increased following acute cocaine, an effect that is contingent upon both dopaminergic and glutamatergic receptors. Further, GSK3 activity is required for the development of cocaine conditioned reward."
https://openalex.org/W2045511088,"Objective To evaluate the effectiveness of whole-genome array comparative genomic hybridization (aCGH) in prenatal diagnosis in Hong Kong. Methods Array CGH was performed on 220 samples recruited prospectively as the first-tier test study. In addition 150 prenatal samples with abnormal fetal ultrasound findings found to have normal karyotypes were analyzed as a ‘further-test’ study using NimbleGen CGX-135K oligonucleotide arrays. Results Array CGH findings were concordant with conventional cytogenetic results with the exception of one case of triploidy. It was found in the first-tier test study that aCGH detected 20% (44/220) clinically significant copy number variants (CNV), of which 21 were common aneuploidies and 23 had other chromosomal imbalances. There were 3.2% (7/220) samples with CNVs detected by aCGH but not by conventional cytogenetics. In the ‘further-test’ study, the additional diagnostic yield of detecting chromosome imbalance was 6% (9/150). The overall detection for CNVs of unclear clinical significance was 2.7% (10/370) with 0.9% found to be de novo. Eleven loci of common CNVs were found in the local population. Conclusion Whole-genome aCGH offered a higher resolution diagnostic capacity than conventional karyotyping for prenatal diagnosis either as a first-tier test or as a ‘further-test’ for pregnancies with fetal ultrasound anomalies. We propose replacing conventional cytogenetics with aCGH for all pregnancies undergoing invasive diagnostic procedures after excluding common aneuploidies and triploidies by quantitative fluorescent PCR. Conventional cytogenetics can be reserved for visualization of clinically significant CNVs."
https://openalex.org/W1980720175,"Introduced hosts populations may benefit of an ""enemy release"" through impoverishment of parasite communities made of both few imported species and few acquired local ones. Moreover, closely related competing native hosts can be affected by acquiring introduced taxa (spillover) and by increased transmission risk of native parasites (spillback). We determined the macroparasite fauna of invasive grey squirrels (Sciurus carolinensis) in Italy to detect any diversity loss, introduction of novel parasites or acquisition of local ones, and analysed variation in parasite burdens to identify factors that may increase transmission risk for native red squirrels (S. vulgaris). Based on 277 grey squirrels sampled from 7 populations characterised by different time scales in introduction events, we identified 7 gastro-intestinal helminths and 4 parasite arthropods. Parasite richness is lower than in grey squirrel's native range and independent from introduction time lags. The most common parasites are Nearctic nematodes Strongyloides robustus (prevalence: 56.6%) and Trichostrongylus calcaratus (6.5%), red squirrel flea Ceratophyllus sciurorum (26.0%) and Holarctic sucking louse Neohaematopinus sciuri (17.7%). All other parasites are European or cosmopolitan species with prevalence below 5%. S. robustus abundance is positively affected by host density and body mass, C. sciurorum abundance increases with host density and varies with seasons. Overall, we show that grey squirrels in Italy may benefit of an enemy release, and both spillback and spillover processes towards native red squirrels may occur."
https://openalex.org/W2093332495,"Introduction Abnormality in distal lung function may occur in obesity due to reduction in resting lung volume; however, airway inflammation, vascular congestion and/or concomitant intrinsic airway disease may also be present. The goal of this study is to 1) describe the phenotype of lung function in obese subjects utilizing spirometry, plethysmography and oscillometry; and 2) evaluate residual abnormality when the effect of mass loading is removed by voluntary elevation of end expiratory lung volume (EELV) to predicted FRC. Methods 100 non-smoking obese subjects without cardio-pulmonary disease and with normal airflow on spirometry underwent impulse oscillometry (IOS) at baseline and at the elevated EELV. Results FRC and ERV were reduced (44±22, 62±14% predicted) with normal RV/TLC (29±9%). IOS demonstrated elevated resistance at 20 Hz (R20, 4.65±1.07 cmH2O/L/s); however, specific conductance was normal (0.14±0.04). Resistance at 5–20 Hz (R5−20, 1.86±1.11 cmH2O/L/s) and reactance at 5 Hz (X5, −2.70±1.44 cmH2O/L/s) were abnormal. During elevation of EELV, IOS abnormalities reversed to or towards normal. Residual abnormality in R5−20 was observed in some subjects despite elevation of EELV (1.16±0.8 cmH2O/L/s). R5−20 responded to bronchodilator at baseline but not during elevation of EELV. Conclusions This study describes the phenotype of lung dysfunction in obesity as reduction in FRC with airway narrowing, distal respiratory dysfunction and bronchodilator responsiveness. When R5−20 normalized during voluntary inflation, mass loading was considered the predominant mechanism. In contrast, when residual abnormality in R5−20 was demonstrable despite return of EELV to predicted FRC, mechanisms for airway dysfunction in addition to mass loading could be invoked."
https://openalex.org/W2033278026,"Background Amid numerous outbreaks of hand, foot and mouth disease (HFMD) in Asia over the past decade, studies on spatio-temporal clustering are limited. Without this information the distribution of severe cases assumed to be sporadic. We analyzed surveillance data with onset dates between 1 May 2008 to 31 October 2013 with the aim to document the spatio-temporal clustering of HFMD cases and severe cases at the county level. Methods Purely temporal and purely spatial descriptive analyses were done. These were followed by a space-time scan statistic for the whole study period and by year to detect the high risk clusters based on a discrete Poisson model. Results The annual incidence rate of HFMD in Guangxi increased whereas the severe cases peaked in 2010 and 2012. EV71 and CoxA16 were alternating viruses. Both HFMD cases and severe cases had a seasonal peak in April to July. The spatio-temporal cluster of HFMD cases were mainly detected in the northeastern, central and southwestern regions, among which three clusters were observed in Nanning, Liuzhou, Guilin city and their neighbouring areas lasting from 1.2 to 2.5 years. The clusters of severe cases were less consistent in location and included around 40–70% of all severe cases in each year. Conclusions Both HFMD cases and severe cases occur in spatio-temporal clusters. The continuous epidemic in Nanning, Liuzhou, Guilin cities and their neighbouring areas and the clusters of severe cases indicate the need for further intensive surveillance."
https://openalex.org/W2051396151,"Peritoneal invasion in colon cancer is an important prognostic factor. Peritoneal invasion can be objectively identified as periotoneal elastic laminal invasion (ELI) by using elastica stain, and the cancer microenvironment formed by the peritoneal invasion (CMPI) can also be observed. Cases with ELI more frequently show distant metastasis and recurrence. Therefore, CMPI may represent a particular milieu that facilitates tumor progression. Pathological and biological investigations into CMPI may shed light on this possibly distinctive cancer microenvironment.We analyzed area-specific tissue microarrays to determine the pathological features of CMPI, and propagated subperitoneal fibroblasts (SPFs) and submucosal fibroblasts (SMFs) from human colonic tissue. Biological characteristics and results of gene expression profile analyses were compared to better understand the peritoneal invasion of colon cancer and how this may form a special microenvironment through the interaction with SPFs. Mouse xenograft tumors, derived by co-injection of cancer cells with either SPFs or SMFs, were established to evaluate their active role on tumor progression and metastasis.We found that fibrosis with alpha smooth muscle actin (α-SMA) expression was a significant pathological feature of CMPI. The differences in proliferation and gene expression profile analyses suggested SPFs and SMFs were distinct populations, and that SPFs were characterized by a higher expressions of extracellular matrix (ECM)-associated genes. Furthermore, compared with SMFs, SPFs showed more variable alteration in gene expressions after cancer-cell-conditioned medium stimulation. Gene ontology analysis revealed that SPFs-specific upregulated genes were enriched by actin-binding or contractile-associated genes including α-SMA encoding ACTA2. Mouse xenograft tumors derived by co-injection of cancer cells with SPFs showed enhancement of tumor growth, metastasis, and capacity for tumor formation compared to those derived from co-injection with cancer cells and SMFs.CMPI is a special microenvironment, and interaction of SPFs and cancer cells within CMPI promote tumor growth and metastasis."
https://openalex.org/W2000476134,"Oxalic acid is a prevalent fungal metabolite with versatile roles in growth and nutrition, including degradation of plant biomass. However, the toxicity of oxalic acid makes regulation of its intra- and extracellular concentration crucial. To increase the knowledge of fungal oxalate metabolism, a transcriptional level study on oxalate-catabolising genes was performed with an effective lignin-degrading white-rot fungus Dichomitus squalens, which has demonstrated particular abilities in production and degradation of oxalic acid. The expression of oxalic-acid decomposing oxalate decarboxylase (ODC) and formic-acid decomposing formate dehydrogenase (FDH) encoding genes was followed during the growth of D. squalens on its natural spruce wood substrate. The effect of high proton concentration on the regulation of the oxalate-catabolising genes was determined after addition of organic acid (oxalic acid) and inorganic acid (hydrochloric acid) to the liquid cultures of D. squalens. In order to evaluate the co-expression of oxalate-catabolising and manganese peroxidase (MnP) encoding genes, the expression of one MnP encoding gene, mnp1, of D. squalens was also surveyed in the solid state and liquid cultures. Sequential action of ODC and FDH encoding genes was detected in the studied cultivations. The odc1, fdh2 and fdh3 genes of D. squalens showed constitutive expression, whereas ODC2 and FHD1 most likely are the main responsible enzymes for detoxification of high concentrations of oxalic and formic acids. The results also confirmed the central role of ODC1 when D. squalens grows on coniferous wood. Phylogenetic analysis revealed that fungal ODCs have evolved from at least two gene copies whereas FDHs have a single ancestral gene. As a conclusion, the multiplicity of oxalate-catabolising genes and their differential regulation on wood and in acid-amended cultures of D. squalens point to divergent physiological roles for the corresponding enzymes."
https://openalex.org/W2062547223,"Spatial patterns of relatedness within animal populations are important in the evolution of mating and social systems, and have the potential to reveal information on species that are difficult to observe in the wild. This study examines the fine-scale genetic structure and connectivity of groups within African forest elephants, Loxodonta cyclotis, which are often difficult to observe due to forest habitat. We tested the hypothesis that genetic similarity will decline with increasing geographic distance, as we expect kin to be in closer proximity, using spatial autocorrelation analyses and Tau K(r) tests. Associations between individuals were investigated through a non-invasive genetic capture-recapture approach using network models, and were predicted to be more extensive than the small groups found in observational studies, similar to fission-fusion sociality found in African savanna (Loxodonta africana) and Asian (Elephas maximus) species. Dung samples were collected in Lopé National Park, Gabon in 2008 and 2010 and genotyped at 10 microsatellite loci, genetically sexed, and sequenced at the mitochondrial DNA control region. We conducted analyses on samples collected at three different temporal scales: a day, within six-day sampling sessions, and within each year. Spatial autocorrelation and Tau K(r) tests revealed genetic structure, but results were weak and inconsistent between sampling sessions. Positive spatial autocorrelation was found in distance classes of 0-5 km, and was strongest for the single day session. Despite weak genetic structure, individuals within groups were significantly more related to each other than to individuals between groups. Social networks revealed some components to have large, extensive groups of up to 22 individuals, and most groups were composed of individuals of the same matriline. Although fine-scale population genetic structure was weak, forest elephants are typically found in groups consisting of kin and based on matrilines, with some individuals having more associates than observed from group sizes alone."
https://openalex.org/W1966918560,"In mice, peripheral 5-HT induces an increase in the plasma concentrations of glucose, insulin and bile acids, and a decrease in plasma triglyceride, NEFA and cholesterol concentrations. However, given the unique characteristics of the metabolism of ruminants relative to monogastric animals, the physiological role of peripheral 5-HT on glucose and lipid metabolism in sheep remains to be established. Therefore, in this study, we investigated the effect of 5-HT on the circulating concentrations of metabolites and insulin using five 5-HT receptor (5HTR) antagonists in sheep. After fasting for 24 h, sheep were intravenously injected with 5-HT, following which-, plasma glucose, insulin, triglyceride and NEFA concentrations were significantly elevated. In contrast, 5-HT did not affect the plasma cholesterol concentration, and it induced a decrease in bile acid concentrations. Increases in plasma glucose and insulin concentrations induced by 5-HT were attenuated by pre-treatment with Methysergide, a 5HTR 1, 2 and 7 antagonist. Additionally, decreased plasma bile acid concentrations induced by 5-HT were blocked by pre-treatment with Ketanserin, a 5HTR 2A antagonist. However, none of the 5HTR antagonists inhibited the increase in plasma triglyceride and NEFA levels induced by 5-HT. On the other hand, mRNA expressions of 5HTR1D and 1E were observed in the liver, pancreas and skeletal muscle. These results suggest that there are a number of differences in the physiological functions of peripheral 5-HT with respect to lipid metabolism between mice and sheep, though its effect on glucose metabolism appears to be similar between these species."
https://openalex.org/W1996115956,"Increased expression of mineral dust-induced gene (mdig, also named as mina53, MINA, or NO52) has been observed in a number of human cancers. The mechanism of how mdig contribute to the pathogenesis of cancer remains to be fully elucidated. In this report, we demonstrated that overexpression of mdig decreased the nuclear staining signal by 4',6-diamidino-2-phenylindole (DAPI), along with a considerable enhancement in cell proliferation. Silencing mdig by shRNA resulted in a statistically significant decrease of cell proliferation. Intriguingly, mdig overexpression reduced the capacity of the cells in migration and invasion in vitro, whereas silencing mdig by shRNA/siRNA enhanced migration and invasion. Clinically, we found that increased expression of mdig in cancer tissues correlates with poorer overall survival of the lung cancer patients, esp., for those without lymph node metastasis. Taken together, our results suggest that mdig plays opposite roles on cell growth and motility, which possibly indicates the paradoxical effect of mdig at the different stages of carcinogenesis."
https://openalex.org/W1983738607,"Pumpkinseed Lepomis gibbosus (L.) are successful invaders in Europe, where this species exerts multiple ecological effects, mainly through trophic interactions. Behavioural interference represents a potential impact for native fauna and this is of particular conservation concern in the Iberian Peninsula because of the highly valuable endemic fauna inhabiting streams of this region. However, aggressive interactions have not previously been examined under natural conditions in Iberian fresh waters. To address this gap in knowledge, the aim of the present study was to assess the effect of pumpkinseed aggression on endemic fauna of an Iberian stream, the River Bullaque (central Spain). In September 2009, we analysed the aggression and environmental contexts of these behavioural interactions by snorkelling: aggressor size, aggression type, shoal size, previous activity to aggression, recipient species, response to aggression, microhabitat structure and prey availability. Small pumpkinseed displayed more threat and fewer pursuit behaviours relative to medium and large individuals, reflecting an ontogenetic behavioural shift from low to high aggression intensity. Small aggressors came from large shoals, with bottom feeding being the most frequently observed activity prior to an aggressive interaction; whereas large pumpkinseed were less gregarious and they were mostly ambulating within the water column prior to aggression. Recipient species of aggression included non-native crayfish and fishes, and more importantly, endemic fishes and frogs. Retreat was the most common response to aggression, irrespective of aggressor size. Small pumpkinseed displayed aggressive behaviours over coarse substrata containing elevated macrobenthos biomass; whereas aggression by large individuals was observed in deeper waters. These findings suggest that small and large pumpkinseed exert a high impact on other stream residents through aggression in competition for food and territory defence, respectively. This study highlights the usefulness of direct observations in the wild for assessing the effects of behavioural interference of invasive fishes on Iberian aquatic communities."
https://openalex.org/W2019945295,"Steroid synthesis and metabolic pathways play important roles in the pathophysiology of PCOS, but until now there have been no studies on the methylation profiles of specific genes in steroid synthesis pathways that are known to be associated with PCOS. Here we used MassARRAY quantitative methylation analysis to determine the methylation levels of each CpG site or cluster in the promoters of EPHX1, SRD5A1, and CYP11A1 in 64 peripheral blood samples. We further examined the methylation level of EPHX1 in an independent cohort consisting of 116 people. Finally, we investigated the role of EPHX1 in steroidogenesis in the KGN cell line. For SRD5A1 and CYP11A1, there was no significant difference in methylation level between patients and controls. For EPHX1, however, the methylation levels of a few consecutive CpG sites and clusters were found to be significantly associated with PCOS. The methylation levels of a number of CpG clusters or sites were significantly lower in patients than in controls in the first cohort consisting of 64 people, such as clusters 13-14 (P<0.05), 15-16 (P<0.001), and 19-24 (P<0.001) and sites CpG_53 (P<0.01) and CpG_54 (P<0.05). Among differentiated methylation sites and clusters, the methylation levels of the CpG cluster 13-14 and CpG cluster 19-24 in PCOS patients were significantly lower than in controls in the second cohort of 116 people (P<0.05 for both). In addition, knockdown and overexpression experiments in KGN cells showed that EPHX1 can regulate estradiol concentrations, and this indicates a role for EPHX1 in steroidogenesis. Our study has demonstrated that methylation of the EPHX1 promoter might be associated with PCOS. This study provides direct evidence that methylation plays an important role in PCOS and demonstrates a novel role for EPHX1 in female reproduction."
https://openalex.org/W2072938966,"Purpose Crossed cerebellar diaschisis (CCD) is a state of neural depression caused by loss of connections to injured neural structures remote from the cerebellum usually evaluated by positron emission tomography. Recently it has been shown that dynamic susceptibility contrast perfusion weighted MRI (PWI) may also be feasible to detect the phenomenon. In this study we aimed to assess the frequency of CCD on PWI in patients with acute thalamic infarction. Methods From a MRI report database we identified patients with acute isolated thalamic infarction. Contralateral cerebellar hypoperfusion was identified by inspection of time to peak (TTP) maps and evaluated quantitatively on TTP, mean transit time (MTT), cerebral blood flow and volume (CBF, CBV) maps. A competing cerebellar pathology or an underlying vascular pathology were excluded. Results A total of 39 patients was included. Common symptoms were hemiparesis (53.8%), hemihypaesthesia (38.5%), dysarthria (30.8%), aphasia (17.9%), and ataxia (15.4%). In 9 patients (23.1%) PWI showed hypoperfusion in the contralateral cerebellar hemisphere. All of these had lesions in the territory of the tuberothalamic, paramedian, or inferolateral arteries. Dysarthria was observed more frequently in patients with CCD (6/9 vs. 6/30; OR 8.00; 95%CI 1.54–41.64, p = 0.01). In patients with CCD, the median ischemic lesion volume on DWI (0.91 cm3, IQR 0.49–1.54 cm3) was larger compared to patients with unremarkable PWI (0.51 cm3, IQR 0.32–0.74, p = 0.05). The most pronounced changes were found in CBF (0.94±0.11) and MTT (1.06±0.13) signal ratios, followed by TTP (1.05±0.02). Conclusions Multimodal MRI demonstrates CCD in about 20% of acute isolated thalamic infarction patients. Lesion size seems to be a relevant factor in its pathophysiology."
