id,abstract
https://openalex.org/W1112655644,"Autophagy is a vital pathway for the removal of β-amyloid peptide (Aβ) and the aggregated proteins that cause Alzheimer’s disease (AD). We previously found that cilostazol induced SIRT1 expression and its activity in neuronal cells, and thus, we hypothesized that cilostazol might stimulate clearances of Aβ and C-terminal APP fragment β subunit (APP-CTFβ) by up-regulating autophagy.When N2a cells were exposed to soluble Aβ1–42, protein levels of beclin-1, autophagy-related protein5 (Atg5), and SIRT1 decreased significantly. Pretreatment with cilostazol (10–30 μM) or resveratrol (20 μM) prevented these Aβ1–42 evoked suppressions. LC3-II (a marker of mammalian autophagy) levels were significantly increased by cilostazol, and this increase was reduced by 3-methyladenine. To evoke endogenous Aβ overproduction, N2aSwe cells (N2a cells stably expressing human APP containing the Swedish mutation) were cultured in medium with or without tetracycline (Tet+ for 48 h and then placed in Tet- condition). Aβ and APP-CTFβ expressions were increased after 12~24 h in Tet- condition, and these increased expressions were significantly reduced by pretreating cilostazol. Cilostazol-induced reductions in the expressions of Aβ and APP-CTFβ were blocked by bafilomycin A1 (a blocker of autophagosome to lysosome fusion). After knockdown of the SIRT1 gene (to ~40% in SIRT1 protein), cilostazol failed to elevate the expressions of beclin-1, Atg5, and LC3-II, indicating that cilostazol increases these expressions by up-regulating SIRT1. Further, decreased cell viability induced by Aβ was prevented by cilostazol, and this inhibition was reversed by 3-methyladenine, indicating that the protective effect of cilostazol against Aβ induced neurotoxicity is, in part, ascribable to the induction of autophagy. In conclusion, cilostazol modulates autophagy by increasing the activation of SIRT1, and thereby enhances Aβ clearance and increases cell viability."
https://openalex.org/W1855568823,"Beta-defensins (hBDs) provide antimicrobial and chemotactic defense against bacterial, viral and fungal infections. Human β-defensin-2 (hBD-2) acts against gram-negative bacteria and chemoattracts immature dendritic cells, thus regulating innate and adaptive immunity. Immunosuppression due to hyperglycemia underlies chronic infection in Type 2 diabetes. Hyperglycemia also elevates production of dicarbonyls methylgloxal (MGO) and glyoxal (GO).The effect of dicarbonyl on defensin peptide structure was tested by exposing recombinant hBD-2 (rhBD-2) to MGO or GO with subsequent analysis by MALDI-TOF MS and LC/MS/MS. Antimicrobial function of untreated rhBD-2 vs. rhBD-2 exposed to dicarbonyl against strains of both gram-negative and gram-positive bacteria in culture was determined by radial diffusion assay. The effect of dicarbonyl on rhBD-2 chemotactic function was determined by chemotaxis assay in CEM-SS cells.MGO or GO in vitro irreversibly adducts to the rhBD-2 peptide, and significantly reduces antimicrobial and chemotactic functions. Adducts derive from two arginine residues, Arg22 and Arg23 near the C-terminus, and the N-terminal glycine (Gly1). We show by radial diffusion testing on gram-negative E. coli and P. aeruginosa, and gram-positive S. aureus, and a chemotaxis assay for CEM-SS cells, that antimicrobial activity and chemotactic function of rhBD-2 are significantly reduced by MGO.Dicarbonyl modification of cationic antimicrobial peptides represents a potential link between hyperglycemia and the clinical manifestation of increased susceptibility to infection, protracted wound healing, and chronic inflammation in undiagnosed and uncontrolled Type 2 diabetes."
https://openalex.org/W1084046362,"Sunitinib is a tyrosine kinase inhibitor used as first-line treatment for metastatic renal cell carcinoma (mRCC). Asian ethnicity has been previously associated with lower clearance and greater toxicities for sunitinib treatment, relative to Caucasian ethnicity. Research focusing on identifying corresponding biomarkers of efficacy and toxicity has been hitherto conducted in Caucasian populations, and few of the reported associations have been externally validated. Our work thus aims to investigate candidate biomarkers in Asian patients receiving sunitinib, comparing the observed genotype effects with those reported in Caucasian populations. Using data from 97 Asian mRCC patients treated with sunitinib, we correlated 7 polymorphisms in FLT3, ABCB1, VEGFR2, ABCG2 and BIM with patient toxicities, response, and survival. We observed a stronger association of FLT3 738T genotype with leucopenia in our Asian dataset than that previously reported in Caucasian mRCC patients (odds ratio [OR]=8.0; P=0.03). We observed significant associations of FLT3 738T (OR=2.7), ABCB1 1236T (OR=0.3), ABCB1 3435T (OR=0.1), ABCB1 2677T (OR=0.4), ABCG2 421A (OR=0.3) alleles and ABCB1 3435, 1236, 2677 TTT haplotype (OR=0.1) on neutropenia. Primary resistance (OR=0.1, P=0.004) and inferior survival (progression-free: hazard ratio [HR]=5.5, P=0.001; overall: HR=5.0, P=0.005) were associated with the ABCB1 3435, 1236, 2677 TTT haplotype. In conclusion, ABCB1 and FLT3 polymorphisms may be helpful in predicting sunitinib toxicities, response and survival benefit in Asian mRCC patients. We have also validated the association between FLT3 738T and sunitinib-induced leucopenia previously reported in Caucasian populations, but have not validated other reported genetic associations."
https://openalex.org/W1536975405,"Inference by exclusion, the ability to base choices on the systematic exclusion of alternatives, has been studied in many nonhuman species over the past decade. However, the majority of methodologies employed so far are hard to integrate into a comparative framework as they rarely use controls for the effect of neophilia. Here, we present an improved approach that takes neophilia into account, using an abstract two-choice task on a touch screen, which is equally feasible for a large variety of species. To test this approach we chose Goffin cockatoos (Cacatua goffini), a highly explorative Indonesian parrot species, which have recently been reported to have sophisticated cognitive skills in the technical domain. Our results indicate that Goffin cockatoos are able to solve such abstract two-choice tasks employing inference by exclusion but also highlight the importance of other response strategies."
https://openalex.org/W1859164428,"Introduction Insights into the diurnal patterns of sedentary behavior and the identification of subgroups that are at increased risk for engaging in high levels of sedentary behavior are needed to inform potential interventions for reducing older adults’ sedentary time. Therefore, we examined the diurnal patterns and sociodemographic correlates of older adults’ sedentary behavior(s). Methods Stratified cluster sampling was used to recruit 508 non-institutionalized Belgian older adults (≥ 65 years). Morning, afternoon, evening and total sedentary time was assessed objectively using accelerometers. Specific sedentary behaviors, total sitting time and sociodemographic attributes were assessed using an interviewer-administered questionnaire. Results Participants self-reported a median of 475 (Q1-Q3 = 383–599) minutes/day of total sitting time and they accumulated a mean of 580 ± 98 minutes/day of accelerometer-derived sedentary time. Sedentary time was lowest during the morning and highest during the evening. Older participants were as sedentary as younger participants during the evening, but they were more sedentary during daytime. Compared to married participants, widowers were more sedentary during daytime. Younger participants (< 75 years), men and the higher educated were more likely to engage in (high levels of) sitting while driving a car and using the computer. Those with tertiary education viewed 29% and 22% minutes/day less television compared to those with primary or secondary education, respectively. Older participants accumulated 35 sedentary minutes/day more than did younger participants and men accumulated 32 sedentary minutes/day more than did women. Conclusion These findings highlight diurnal variations and potential opportunities to tailor approaches to reducing sedentary time for subgroups of the older adult population."
https://openalex.org/W1107610895,"Histone deacetylases (HDAC’s) became increasingly important targets for therapy of various diseases, resulting in a pressing need to develop HDAC class- and isoform-selective inhibitors. Class IIa deacetylases possess only minimal deacetylase activity against acetylated histones, but have several other client proteins as substrates through which they participate in epigenetic regulation. Herein, we report the radiosyntheses of the second generation of HDAC class IIa–specific radiotracers: 6-(di-fluoroacetamido)-1-hexanoicanilide (DFAHA) and 6-(tri-fluoroacetamido)-1-hexanoicanilide ([18F]-TFAHA). The selectivity of these radiotracer substrates to HDAC class IIa enzymes was assessed in vitro, in a panel of recombinant HDACs, and in vivo using PET/CT imaging in rats. [18F]TFAHA showed significantly higher selectivity for HDAC class IIa enzymes, as compared to [18F]DFAHA and previously reported [18F]FAHA. PET imaging with [18F]TFAHA can be used to visualize and quantify spatial distribution and magnitude of HDAC class IIa expression-activity in different organs and tissues in vivo. Furthermore, PET imaging with [18F]TFAHA may advance the understanding of HDACs class IIa mediated epigenetic regulation of normal and pathophysiological processes, and facilitate the development of novel HDAC class IIa-specific inhibitors for therapy of different diseases."
https://openalex.org/W2198218567,"Atopic dermatitis (AD) is a chronic inflammatory pruritic skin disease in which the pathogenic mechanism is complicated and not completely understood. Reports on the role of regulated cells in AD have recently evolved to regulate B cells, which may play a role in allergic inflammation as well. In the present study, we examined the frequency and regulatory function of CD5+CD19+CD1dhi B10 cells in an AD-like mouse model. Our results showed that the percentage of CD5+CD19+CD1dhi B10 cells increased while the frequency of IL-10-producing B cells in CD19+B cells decreased in the mice of AD group. Moreover, no difference in the percentage of B10pro + B10 cells was observed between the AD and control groups. Strikingly, B10 cells from control mice effectively inhibited IgE secretion, whereas the suppressive function of B10 cells from the AD mice was significantly decreased, which was similar to that observed in the group without B10. Altogether, these results suggest that the number of IL-10-producing B cells decreased in the AD group and these cells showed a defective regulatory function on IgE secretion."
https://openalex.org/W2281540859,"MicroRNAs (miRNAs) regulate many physiological processes through post-transcriptional control of gene expression and are a major part of the small noncoding RNAs (snRNA). As hibernators can survive at low body temperatures (Tb) for many months without suffering tissue damage, understanding the mechanisms that enable them to do so are of medical interest. Because the brain integrates peripheral physiology and white adipose tissue (WAT) is the primary energy source during hibernation, we hypothesized that both of these organs play a crucial role in hibernation, and thus, their activity would be relatively increased during hibernation. We carried out the first genomic analysis of small RNAs, specifically miRNAs, in the brain and WAT of a hibernating bat (Myotis ricketti) by comparing deeply torpid with euthermic individual bats using high-throughput sequencing (Solexa) and qPCR validation of expression levels. A total of 196 miRNAs (including 77 novel bat-specific miRNAs) were identified, and of these, 49 miRNAs showed significant differences in expression during hibernation, including 33 in the brain and 25 in WAT (P≤0.01 &│logFC│≥1). Stem-loop qPCR confirmed the miRNA expression patterns identified by Solexa sequencing. Moreover, 31 miRNAs showed tissue- or state-specific expression, and six miRNAs with counts >100 were specifically expressed in the brain. Putative target gene prediction combined with KEGG pathway and GO annotation showed that many essential processes of both organs are significantly correlated with differentially expressed miRNAs during bat hibernation. This is especially evident with down-regulated miRNAs, indicating that many physiological pathways are altered during hibernation. Thus, our novel findings of miRNAs and Interspersed Elements in a hibernating bat suggest that brain and WAT are active with respect to the miRNA expression activity during hibernation."
https://openalex.org/W1109749069,"Neisseria gonorrhoeae (GC) establishes infection at the mucosal surface of the human genital tract, most of which is lined with polarized epithelial cells. GC can cause localized as well as disseminated infections, leading to various complications. GC constantly change their surface structures via phase and antigenic variation, which has been implicated as a means for GC to establish infection at various anatomic locations of male and female genital tracks. However, the exact contribution of each surface molecule to bacterial infectivity remains elusive due to their phase variation. Using a GC derivative that is genetically devoid of all opa genes (MS11∆Opa), this study shows that Opa expression interferes with GC transmigration across polarized human epithelial cells. MS11∆Opa transmigrates across polarized epithelial cells much faster and to a greater extent than MS11Opa+, while adhering at a similar level as MS11Opa+. When MS11Opa+, able to phase vary Opa expression, was inoculated, only those bacteria that turn off Opa expression transmigrate across the polarized epithelial monolayer. Similar to bacteria alone or co-cultured with non-polarized epithelial cells, MS11∆Opa fails to form large microcolonies at the apical surface of polarized epithelial cells. Apical inoculation of MS11Opa+, but not MS11∆Opa, induces the recruitment of the Opa host-cell receptor carcinoembryonic antigen–related cell adhesion molecules (CEACAMs) to the apical junction and the vicinity of bacterial adherent sites. Our results suggest that Opa expression limits gonococcal ability to invade into subepithelial tissues by forming tight interactions with neighboring bacteria and by inducing CEACAM redistribution to cell junctions."
https://openalex.org/W1925763477,"To elucidate the mechanism of the induction of peroxisome proliferator-activated receptor γ coactivator-1α (PGC-1α) by photoreceptor outer segments (POS) and its effects on retinal pigment epithelium (RPE).PGC-1α upregulation by POS was confirmed in ARPE-19 cells and in RPE ex vivo. To elucidate the mechanism, siRNAs against β5 integrin, CD36, Mer tyrosine kinase (MerTK), and Atg5, blocking antibodies against CD36 and MerTK, and a specific inhibitor for focal adhesion kinase (FAK) were used. We examined the effect of POS-induced PGC-1α upregulation on the levels of reactive oxygen species (ROS), mitochondrial biogenesis, senescence-associated β-galactosidase (SA-β-gal) after H2O2 treatment, and lysosomal activity. Lysosomal activity was evaluated through transcriptional factor EB and its target genes, and the activity of cathepsin D. Lipid metabolism after POS treatment was assessed using Oil Red O and BODIPY C11. RPE phenotypes of PGC-1α-deficient mice were examined.POS-induced PGC-1α upregulation was suppressed by siRNA against β5 integrin and a FAK inhibitor. siRNAs and blocking antibodies against CD36 and MerTK enhanced the effect of POS on PGC-1α. The upregulation of PGC-1α increased the levels of mRNA for antioxidant enzymes and stimulated mitochondrial biogenesis, decreased ROS levels, and reduced SA-β-gal staining in H2O2-treated ARPE-19 cells. PGC-1α was critical for lysosomal activity and lipid metabolism after POS treatment. PGC-1α-deficient mice demonstrated an accumulation of type 2 lysosomes in RPE, thickening of Bruch's membrane, and poor choriocapillaris vasculature.The binding, but not the internalization of POS confers protective effects on RPE cells through the αvβ5 integrin/FAK/PGC-1α pathway."
https://openalex.org/W1931784417,"Although rodenticides are increasingly regulated, they nonetheless cause poisonings in many non-target wildlife species. Second-generation anticoagulant rodenticide use is common in agricultural and residential landscapes. Here, we use an individual-based population model to assess potential population-wide effects of rodenticide exposures on the endangered San Joaquin kit fox (Vulpes macrotis mutica). We estimate likelihood of rodenticide exposure across the species range for each land cover type based on a database of reported pesticide use and literature. Using a spatially-explicit population model, we find that 36% of modeled kit foxes are likely exposed, resulting in a 7-18% decline in the range-wide modeled kit fox population that can be linked to rodenticide use. Exposures of kit foxes in low-density developed areas accounted for 70% of the population-wide exposures to rodenticides. We conclude that exposures of non-target kit foxes could be greatly mitigated by reducing the use of second-generation anticoagulant rodenticides in low-density developed areas near vulnerable populations."
https://openalex.org/W1045509541,"Supplementary feeding of ungulates, being widely used in game management, may have unwanted consequences. Its role in agricultural damage is well-studied, but few studies have considered the potential for the practice to attract ground nest predators. Our goal was to identify the factors influencing ground nest predation in the vicinity of year-round supplementary feeding sites for wild boar and to characterise their spatiotemporal scope. We conducted two separate artificial ground nest experiments in five different hunting districts in south-eastern Estonia. The quantity of food provided and distance of a nest from the feeding site were the most important factors determining predation risk. Larger quantities of food resulted in higher predation risk, while predation risk responded in a non-linear fashion to distance from the feeding site. Although predation risk eventually decreases if supplementary feeding is ceased for at least four years, recently abandoned feeding sites still pose a high predation risk."
https://openalex.org/W1069646196,"In everyday life we quickly build and maintain associations between stimuli and behavioral responses. This is governed by rules of varying complexity and past studies have identified an underlying fronto-parietal network involved in cognitive control processes. However, there is only limited knowledge about the neuronal activations during more natural settings like game playing. We thus assessed whether near-infrared spectroscopy recordings can reflect different demands on cognitive control during a simple game playing task. Sixteen healthy participants had to catch falling objects by pressing computer keys. These objects either fell randomly (RANDOM task), according to a known stimulus-response mapping applied by players (APPLY task) or according to a stimulus-response mapping that had to be learned (LEARN task). We found an increased change of oxygenated and deoxygenated hemoglobin during LEARN covering broad areas over right frontal, central and parietal cortex. Opposed to this, hemoglobin changes were less pronounced for RANDOM and APPLY. Along with the findings that fewer objects were caught during LEARN but stimulus-response mappings were successfully identified, we attribute the higher activations to an increased cognitive load when extracting an unknown mapping. This study therefore demonstrates a neuronal marker of cognitive control during gaming revealed by near-infrared spectroscopy recordings."
https://openalex.org/W1932021663,"Road mortality is the leading source of biodiversity loss in the world, especially due to fragmentation of natural habitats and loss of wildlife. The survey of the main species victims of roadkill is of fundamental importance for the better understanding of the problem, being necessary, for this, the correct species identification. The aim of this study was to verify if DNA barcodes can be applied to identify road-killed samples that often cannot be determined morphologically. For this purpose, 222 vertebrate samples were collected in a stretch of the BR-101 highway that crosses two Discovery Coast Atlantic Forest Natural Reserves, the Sooretama Biological Reserve and the Vale Natural Reserve, in Espírito Santo, Brazil. The mitochondrial COI gene was amplified, sequenced and confronted with the BOLD database. It was possible to identify 62.16% of samples, totaling 62 different species, including Pyrrhura cruentata, Chaetomys subspinosus, Puma yagouaroundi and Leopardus wiedii considered Vulnerable in the National Official List of Species of Endangered Wildlife. The most commonly identified animals were a bat (Molossus molossus), an opossum (Didelphis aurita) and a frog (Trachycephalus mesophaeus) species. Only one reptile was identified using the technique, probably due to lack of reference sequences in BOLD. These data may contribute to a better understanding of the impact of roads on species biodiversity loss and to introduce the DNA barcode technique to road ecology scenarios."
https://openalex.org/W1040406447,"The prediction of conformational b-cell epitopes plays an important role in immunoinformatics. Several computational methods are proposed on the basis of discrimination determined by the solvent-accessible surface between epitopes and non-epitopes, but the performance of existing methods is far from satisfying. In this paper, depth functions and the k-th surface convex hull are used to analyze epitopes and exposed non-epitopes. On each layer of the protein, we compute relative solvent accessibility and four different types of depth functions, i.e., Chakravarty depth, DPX, half-sphere exposure and half space depth, to analyze the location of epitopes on different layers of the proteins. We found that conformational b-cell epitopes are rich in charged residues Asp, Glu, Lys, Arg, His; aliphatic residues Gly, Pro; non-charged residues Asn, Gln; and aromatic residue Tyr. Conformational b-cell epitopes are rich in coils. Conservation of epitopes is not significantly lower than that of exposed non-epitopes. The average depths (obtained by four methods) for epitopes are significantly lower than that of non-epitopes on the surface using the Wilcoxon rank sum test. Epitopes are more likely to be located in the outer layer of the convex hull of a protein. On the benchmark dataset, the cumulate 10th convex hull covers 84.6% of exposed residues on the protein surface area, and nearly 95% of epitope sites. These findings may be helpful in building a predictor for epitopes."
https://openalex.org/W1093988844,"Human hemoglobin (Hb), which is an α2β2 tetramer and binds four O2 molecules, changes its O2-affinity from low to high as an increase of bound O2, that is characterized by ‘cooperativity’. This property is indispensable for its function of O2 transfer from a lung to tissues and is accounted for in terms of T/R quaternary structure change, assuming the presence of a strain on the Fe-histidine (His) bond in the T state caused by the formation of hydrogen bonds at the subunit interfaces. However, the difference between the α and β subunits has been neglected. To investigate the different roles of the Fe-His(F8) bonds in the α and β subunits, we investigated cavity mutant Hbs in which the Fe-His(F8) in either α or β subunits was replaced by Fe-imidazole and F8-glycine. Thus, in cavity mutant Hbs, the movement of Fe upon O2-binding is detached from the movement of the F-helix, which is supposed to play a role of communication. Recombinant Hb (rHb)(αH87G), in which only the Fe-His in the α subunits is replaced by Fe-imidazole, showed a biphasic O2-binding with no cooperativity, indicating the coexistence of two independent hemes with different O2-affinities. In contrast, rHb(βH92G), in which only the Fe-His in the β subunits is replaced by Fe-imidazole, gave a simple high-affinity O2-binding curve with no cooperativity. Resonance Raman, 1H NMR, and near-UV circular dichroism measurements revealed that the quaternary structure change did not occur upon O2-binding to rHb(αH87G), but it did partially occur with O2-binding to rHb(βH92G). The quaternary structure of rHb(αH87G) appears to be frozen in T while its tertiary structure is changeable. Thus, the absence of the Fe-His bond in the α subunit inhibits the T to R quaternary structure change upon O2-binding, but its absence in the β subunit simply enhances the O2-affinity of α subunit."
