id,abstract
https://openalex.org/W2178086146,"Ischemia reperfusion injury is a common cause of acute kidney injury and is characterized by tubular damage. Mitochondrial DNA is released upon severe tissue injury and can act as a damage-associated molecular pattern via the innate immune receptor TLR9. Here, we investigated the role of TLR9 in the context of moderate or severe renal ischemia reperfusion injury using wild-type C57BL/6 mice or TLR9KO mice. Moderate renal ischemia induced renal dysfunction but did not decrease animal well-being and was not regulated by TLR9. In contrast, severe renal ischemia decreased animal well-being and survival in wild-type mice after respectively one or five days of reperfusion. TLR9 deficiency improved animal well-being and survival. TLR9 deficiency did not reduce renal inflammation or tubular necrosis. Rather, severe renal ischemia induced hepatic injury as seen by increased plasma ALAT and ASAT levels and focal hepatic necrosis which was prevented by TLR9 deficiency and correlated with reduced circulating mitochondrial DNA levels and plasma LDH. We conclude that TLR9 does not mediate renal dysfunction following either moderate or severe renal ischemia. In contrast, our data indicates that TLR9 is an important mediator of hepatic injury secondary to ischemic acute kidney injury."
https://openalex.org/W2179267297,"Africanized honey bees entered California in 1994 but few accounts of their northward expansion or their frequency relative to European honey bees have been published. We used mitochondrial markers and morphometric analyses to determine the prevalence of Africanized honeybees in San Diego County and their current northward progress in California west of the Sierra Nevada crest. The northernmost African mitotypes detected were approximately 40 km south of Sacramento in California's central valley. In San Diego County, 65% of foraging honey bee workers carry African mitochondria and the estimated percentage of Africanized workers using morphological measurements is similar (61%). There was no correlation between mitotype and morphology in San Diego County suggesting Africanized bees result from bidirectional hybridization. Seventy percent of feral hives, but only 13% of managed hives, sampled in San Diego County carried the African mitotype indicating that a large fraction of foraging workers in both urban and rural San Diego County are feral. We also found a single nucleotide polymorphism at the DNA barcode locus COI that distinguishes European and African mitotypes. The utility of this marker was confirmed using 401 georeferenced honey bee sequences from the worldwide Barcode of Life Database. Future censuses can determine whether the current range of the Africanized form is stable, patterns of introgression at nuclear loci, and the environmental factors that may limit the northern range of the Africanized honey bee."
https://openalex.org/W2252723120,"Fish farming in the Amazon has been stimulated as a solution to increase economic development. However, poorly managed fish ponds have been sometimes associated with the presence of Anopheles spp. and consequently, with malaria transmission. In this study, we analyzed the spatial and temporal dynamics of malaria in the state of Acre (and more closely within a single county) to investigate the potential links between aquaculture and malaria transmission in this region. At the state level, we classified the 22 counties into three malaria endemicity patterns, based on the correlation between notification time series. Furthermore, the study period (2003–2013) was divided into two phases (epidemic and post-epidemic). Higher fish pond construction coincided both spatially and temporally with increased rate of malaria notification. Within one malaria endemic county, we investigated the relationship between the geolocation of malaria cases (2011–2012) and their distance to fish ponds. Entomological surveys carried out in these ponds provided measurements of anopheline abundance that were significantly associated with the abundance of malaria cases within 100 m of the ponds (P < 0.005; r = 0.39). These results taken together suggest that fish farming contributes to the maintenance of high transmission levels of malaria in this region."
https://openalex.org/W2190343157,"The design of hybrid poly-ε-caprolactone (PCL)-self-assembling peptides (SAPs) matrices represents a simple method for the surface functionalization of synthetic scaffolds, which is essential for cell compatibility. This study investigates the influence of increasing concentrations (2.5%, 5%, 10% and 15% w/w SAP compared to PCL) of three different SAPs on the physico-chemical/mechanical and biological properties of PCL fibers. We demonstrated that physico-chemical surface characteristics were slightly improved at increasing SAP concentrations: the fiber diameter increased; surface wettability increased with the first SAP addition (2.5%) and slightly less for the following ones; SAP-surface density increased but no change in the conformation was registered. These results could allow engineering matrices with structural characteristics and desired wettability according to the needs and the cell system used. The biological and mechanical characteristics of these scaffolds showed a particular trend at increasing SAP concentrations suggesting a prevailing correlation between cell behavior and mechanical features of the matrices. As compared with bare PCL, SAP enrichment increased the number of metabolic active h-osteoblast cells, fostered the expression of specific osteoblast-related mRNA transcripts, and guided calcium deposition, revealing the potential application of PCL-SAP scaffolds for the maintenance of osteoblast phenotype."
https://openalex.org/W2175229202,"The transcription factor PU.1 is predominantly expressed in dendritic cells (DCs) and is essential for DC differentiation. Although there are several reports that PU.1 positively regulates the expression of DC-specific genes, whether PU.1 also has a suppressive effect on DCs is largely unknown. Here we demonstrate that PU.1 suppresses the expression of Th2 cytokines including IL-13 and IL-5 in bone marrow-derived DCs (BMDCs), through repression of the expression of GATA3, which is a master regulator of Th2 differentiations. When PU.1 siRNA was introduced into BMDCs, LPS-induced expression of IL-13 and IL-5 was increased along with upregulation of the constitutive expression of GATA2 and GATA3. The additional introduction of GATA3 siRNA but not of GATA2 siRNA abrogated PU.1 siRNA-mediated upregulation of IL-13 and IL-5. A chromatin immunoprecipitation assay showed that PU.1 bound to Gata3 proximal promoter region, which is more dominant than the distal promoter in driving GATA3 transcription in DCs. The degree of histone acetylation at the Gata3 promoter was decreased in PU.1 siRNA-introduced DCs, suggesting the involvement of PU.1 in chromatin modification of the Gata3 promoter. Treatment with a histone deacetylase (HDAC) inhibitor, trichostatin A, increased the degree of histone H3 acetylation at the Gata3 promoter and induced the subsequent expression of GATA3. Experiments using HDAC inhibitors and siRNAs showed that HDAC3 suppressed GATA3 expression. The recruitment of HDAC3 to the Gata3 promoter was decreased by PU.1 knockdown. LPS-induced IL-13 expression was dramatically reduced in BMDCs generated from mice lacking the conserved GATA3 response element, termed CGRE, which is an essential site for the binding of GATA3 on the Il-13 promoter. The degree of H3K4me3 at CGRE was significantly increased in PU.1 siRNA-transfected stimulated DCs. Our results indicate that PU.1 plays pivotal roles in DC development and function, serving not only as a transcriptional activator but also as a repressor."
https://openalex.org/W2177532615,"The innate immune system's ability to sense an infection is critical so that it can rapidly respond if pathogenic microorganisms threaten the host, but otherwise maintain a quiescent baseline state to avoid causing damage to the host or to commensal microorganisms. One important mechanism for discriminating between pathogenic and non-pathogenic bacteria is the recognition of cellular damage caused by a pathogen during the course of infection. In Caenorhabditis elegans, the conserved G-protein coupled receptor FSHR-1 is an important constituent of the innate immune response. FSHR-1 activates the expression of antimicrobial infection response genes in infected worms and delays accumulation of the ingested pathogen Pseudomonas aeruginosa. FSHR-1 is central not only to the worm's survival of infection by multiple pathogens, but also to the worm's survival of xenobiotic cadmium and oxidative stresses. Infected worms produce reactive oxygen species to fight off the pathogens; FSHR-1 is required at the site of infection for the expression of detoxifying genes that protect the host from collateral damage caused by this defense response. Finally, the FSHR-1 pathway is important for the ability of worms to discriminate pathogenic from benign bacteria and subsequently initiate an aversive learning program that promotes selective pathogen avoidance."
https://openalex.org/W2335920320,"Indoleamine 2,3-dioxygenase (IDO), which is mainly expressed in activated dendritic cells, is known as a regulator of immune responses. However, the role of IDO in immune responses against fungal corneal infection has not been investigated. To evaluate the regulatory mechanisms of IDO in fungal inflammation, we resorted to human corneal epithelial cells (HCECs), known as the first barrier of cornea against pathogenic microorganisms. We found that IDO was significantly up-regulated in corneal epithelium infected with Aspergillus fumigatus (A. fumigatus) and HCECs incubated with spores of A. fumigatus. Furthermore, IDO inhibitor (1-methyltryptophan, 1-MT) enhanced inflammatory cytokines IL-1β and IL-6 expression which were up-regulated by A. fumigatus spores infection. Dectin-1, as one of the important C-type lectin receptors, can identify β-glucan, and mediate fungal innate immune responses. In the present study, pre-treatment with curdlan, a Dectin-1 agonist, further enhanced IDO expression compared with A. fumigatus stimulation. While laminarin, the Dectin-1 specific inhibitor, partially inhibited IDO expression stimulated by A. fumigatus. Further studies demonstrated inhibition of IDO activity amplified the expressions of inflammatory cytokines IL-1β and IL-6 induced by activation of Dectin-1. These results suggested that IDO was involved in the immune responses of fungal keratitis. The activation of Dectin-1 may contribute to A. fumigatus spores-induced up-regulation of IDO."
https://openalex.org/W2341258549,"The Wangyang River (WYR) basin is a typical wastewater irrigation area in Hebei Province, North China. This study investigated the concentration and distribution of six priority phthalate esters (PAEs) in the agricultural soils in this area. Thirty-nine soil samples (0-20 cm) were collected along the WYR to assess the PAE residues in soils. Results showed that PAEs are ubiquitous environmental contaminants in the topsoil obtained from the irrigation area. The concentrations of Σ6PAEs range from 0.191 μg g-1 dw to 0.457 μg g-1 dw with an average value of 0.294 μg g-1 dw. Di(2-ethylhexyl) phthalate (DEHP) and di-n-butyl phthalate (DnBP) are the dominant PAE species in the agricultural soils. Among the DEHP concentrations, the highest DEHP concentration was found at the sites close to the villages; this result suggested that dense anthropogenic activities and random garbage disposal in the rural area are possible sources of PAEs. The PAE concentrations were weakly and positively correlated with soil organic carbon and soil enzyme activities; thus, these factors can affect the distribution of PAEs. This study further showed that only dimethyl phthalate (DMP) concentrations exceeded the recommended allowable concentrations; no remediation measures are necessary to control the PAEs in the WYR area. However, the PAEs in the topsoil may pose a potential risk to the ecosystem and human health in this area. Therefore, the exacerbating PAE pollution should be addressed."
https://openalex.org/W2238410476,"Rubber trees (Hevea brasiliensis) are susceptible to low temperature and therefore are only planted in the tropical regions. In the past few decades, although rubber trees have been successfully planted in the northern margin of tropical area in China, they suffered from cold injury during the winter. To understand the physiological response under cold stress, we isolated a C-repeat binding factor 1 (CBF1) gene from the rubber tree. This gene (HbCBF1) was found to respond to cold stress but not drought or ABA stress. The corresponding HbCBF1 protein showed CRT/DRE binding activity in gel shift experiment. To further characterize its molecular function, the HbCBF1 gene was overexpressed in Arabidopsis. The HbCBF1 over expression (OE) line showed enhanced cold resistance and relatively slow dehydration, and the expression of Arabidopsis CBF pathway downstream target genes, e.g. AtCOR15a and AtRD29a, were significantly activated under non-acclimation condition. These data suggest HbCBF1 gene is a functional member of the CBF gene family, and may play important regulation function in rubber tree."
https://openalex.org/W2288234968,"Declining large carnivore populations, increased habitat fragmentation, declining interests in fur trapping, and other anthropogenic factors can all lead to increased mesopredator populations and these may negatively impact biodiversity. Lethal mesopredator control potentially mitigates some of these effects but can be controversial, largely because impacts on mesopredator populations have not been evaluated. Estimating these impacts may reduce controversies while increasing our understanding of when lethal control may be beneficial. Therefore, we analyzed published mesopredator removal data to determine if mesopredator removal rates changed over time. Removals of medium,(e.g., raccoons (Procyon lotor) or red foxes (Vulpes vulpes), and large, i.e., bobcats (Lynx rufus) or coyotes (Canis latrans), mesopredators were consistent from year to year and over the duration of study (i.e., number removed during the first and last years of studies were similar). In contrast, removals of small mesopredators, e.g., weasels (Mustela spp.) or spotted skunks (Spilogale putorius), declined over the duration of study. Study area size, number of species targeted for removal, and duration of removal effort were poor predictors of removal rates. Our analyses suggest that: (1) control, as typically implemented, is unlikely to cause negative long-term impacts on populations of medium and large mesopredators but may negatively impact small mesopredators, (2) if mesopredator control benefits prey, recurring removals will generally be needed to maintain benefits, and (3) timing of removals will be important to achieve management goals. We suggest that mesopredator control efforts are frequently spatially structured harvests from continuously distributed populations. This may explain (1) why removal of small mesopredators declined over time; whereas, medium and large mesopredator removals remained consistent, and (2) why some prey failed to respond to mesopredator control efforts."
https://openalex.org/W2175683986,"Difficulties involved in treating drug-resistant pathogens have created a need for new therapies. In this study, we investigated the possibility of using oleanolic acid (OA), a natural pentacyclic triterpenoid, as a natural adjuvant for antibiotics against Acinetobacter baumannii. High concentrations of OA can kill cells, partly because it generates reactive oxygen species. Measurement of the fractional inhibitory concentration (FIC) for OA and time-kill experiments demonstrated that it only synergizes with aminoglycoside antibiotics (e.g., gentamicin, kanamycin). Other classes of antibiotics (e.g., ampicillin, rifampicin, norfloxacin, chloramphenicol, and tetracycline) have no interactions with OA. Microarray and quantitative reverse transcription-PCR analysis indicated that genes involved in ATP synthesis and cell membrane permeability, the gene encoding glycosyltransferase, peptidoglycan-related genes, phage-related genes, and DNA repair genes were upregulated under OA. OA highly induces the expression of adk, which encodes an adenylate kinase, and des6, which encodes a linoleoyl-CoA desaturase, and deletion of these genes increased FICs; these observations indicate that adk and des6 are involved in the synergism of OA with aminoglycosides. Data obtained using 8-anilino-1-naphthalenesulfonic acid, fluorescence-conjugated gentamicin, and membrane fatty acid analysis indicates that adk and des6 are involved in changes in membrane permeability. Proton-motive force and ATP synthesis tests show that those genes are also involved in energy metabolism. Taken together, our data show that OA boosts aminoglycoside uptake by changing membrane permeability and energy metabolism in A. baumannii."
https://openalex.org/W2179164933,"Pseudomonas aeruginosa (PA) and Staphylococcus aureus (SA) are major respiratory pathogens and can concurrently colonize the airways of patients with chronic obstructive diseases, such as cystic fibrosis (CF). Airway epithelial cell signalling is critical to the activation of innate immune responses. In the setting of polymicrobial colonization or infection of the respiratory tract, how epithelial cells integrate different bacterial stimuli remains unknown. Our study examined the inflammatory responses to PA and SA co-stimulations. Immortalised airway epithelial cells (Beas-2B) exposed to bacteria-free filtrates from PA (PAF) induced a robust production of the neutrophil chemoattractant IL-8 while bacteria-free filtrates from SA (SAF) had a minimal effect. Surprisingly, co-stimulation with PAF+SAF demonstrated that SAF strongly inhibited the PAF-driven IL-8 production, showing that SAF has potent anti-inflammatory effects. Similarly SAF decreased IL-8 production induced by the TLR1/TLR2 ligand Pam3CysSK4 but not the TLR4 ligand LPS nor TLR5 ligand flagellin in Beas-2B cells. Moreover, SAF greatly dampened TLR1/TLR2-mediated activation of the NF-κB pathway, but not the p38 MAPK pathway. We observed this SAF-dependent anti-inflammatory activity in several SA clinical strains, as well as in the CF epithelial cell line CFBE41o-. These findings show a novel direct anti-inflammatory effect of SA on airway epithelial cells, highlighting its potential to modulate inflammatory responses in the setting of polymicrobial infections."
https://openalex.org/W2175483283,"Background Accurate assessment of physical activity among coronary artery disease patients is important for assessing adherence to interventions. The study compared moderate-to-vigorous physical intensity activity and relationships with cardiometabolic health/fitness indicators using accelerometer cut-points developed for coronary artery disease patients versus those developed in younger and middle-aged adults. Methods A total of 231 adults with coronary artery disease wore an Actigraph GT3X accelerometer for ≥4 days (≥10 hours/day). Moderate-to-vigorous intensity physical activity between cut-points was compared using Bland-Altman analyses. Partial spearman correlations assessed relationships between moderate-to-vigorous intensity physical activity from each cut-point with markers of cardiometabolic health and fitness while controlling for age and sex. Results Average time spent in bouts of moderate-to-vigorous intensity physical activity using coronary artery disease cut-points was significantly higher than the young (mean difference: 13.0±12.8 minutes/day) or middle-aged (17.0±15.2 minutes/day) cut-points. Young and middle-aged cut-points were more strongly correlated with body mass index, waist circumference and systolic blood pressure, while coronary artery disease cut-points had stronger relationships with triglycerides, high-density and low-density lipoproteins. All were similarly correlated with measures of fitness. Conclusion Researchers need to exert caution when deciding on which cut-points to apply to their population. Further work is needed to validate which cut-points provide a true reflection of moderate-to-vigorous intensity physical activity and to examine relationships among patients with varying fitness."
https://openalex.org/W2264778316,"To assess the period prevalence and severity of dizziness and vertigo in adolescents.In 1661 students in 8th-10th grade in twelve grammar schools in Munich, Germany information on vertigo/dizziness was assessed by a questionnaire in the class room setting. Three month prevalence of dizziness/vertigo was estimated; symptoms were categorized as orthostatic dizziness, spinning vertigo, swaying vertigo or unspecified dizziness. Duration of symptoms and impact on daily life activities were assessed.72.0% (95%-CI = [69.8-74.2]; N = 1196) of the students (mean age 14.5±1.1) reported to suffer from at least one episode of dizziness or vertigo in the last three months. Most adolescents ticked to have symptoms of orthostatic dizziness (52.0%, 95%-CI = [49.5-54.4], N = 863). The period prevalence for the other types of vertigo were spinning vertigo: 11.6%, 95%-CI = [10.1-13.3], N = 193; swaying vertigo: 12.2%, 95%-CI = [10.6-13.8], N = 202; and unspecified dizziness: 15.2%, 95%-CI = [13.5-17.1], N = 253. About 50% of students with spinning vertigo and swaying vertigo also report to have orthostatic dizziness. Most vertigo/dizziness types were confined to less than one minute on average. The proportion of students with any dizziness/vertigo accounting for failure attending school, leisure activities or obliging them to stay in bed were more pronounced for spinning or swaying vertigo.Dizziness and vertigo in grammar school students appear to be as common as in adults. In face of the high period prevalence and clinical relevance of dizziness/vertigo in adolescents there is a need for prevention strategies. Risk factors for dizziness/vertigo need to be assessed to allow for conception of an intervention programme."
https://openalex.org/W2335958426,"To explore a novel method using liposomes to suppress macrophages, we screened food constituents through cell culture assays. Curcumin was one of the strongest compounds exhibiting suppressive effects on macrophages. We subsequently tried various methods to prepare liposomal curcumin, and eventually succeeded in preparing liposomes with sufficient amounts of curcumin to suppress macrophages by incorporating a complex of curcumin and bovine serum albumin. The diameter of the resultant nanoparticles, the liposomes containing curcumin, ranged from 60 to 100 nm. Flow cytometric analyses revealed that after intraperitoneal administration of the liposomes containing curcumin into mice, these were incorporated mainly by macrophages positive for F4/80, CD36, and CD11b antigens. Peritoneal cells prepared from mice injected in vivo with the liposomes containing curcumin apparently decreased interleukin-6-producing activities. Major changes in body weight and survival rates in the mice were not observed after administrating the liposomes containing curcumin. These results indicate that the liposomes containing curcumin are safe and useful for the selective suppression of macrophages in vivo in mice."
https://openalex.org/W1629085110,"Use of natural compounds as antivirulence drugs could be an alternative therapeutic approach to modify the outcome of bacterial infections, particularly in view of growing resistance to available antimicrobials. Here, we show that sub-bactericidal concentration of anethole, a component of sweet fennel seed, could suppress virulence potential in O1 El Tor biotype strains of toxigenic Vibrio cholerae, the causative agent of the ongoing 7th cholera pandemic. The expression of cholera toxin (CT) and toxin coregulated pilus (TCP), the major virulence factors of V. cholerae, is controlled through a regulatory cascade involving activation of ToxT with synergistic coupling interaction of ToxR/ToxS with TcpP/TcpH. We present evidence that anethole inhibits in vitro expression of CT and TCP in a toxT-dependent but toxR/toxS-independent manner and through repression of tcpP/tcpH, by using bead-ELISA, western blotting and quantitative real-time RT-PCR assays. The cyclic AMP (cAMP)-cAMP receptor protein (CRP) is a well-studied global signaling system in bacterial pathogens, and this complex is known to suppress expression of tcpP/tcpH in V. cholerae. We find that anethole influences the virulence regulatory cascade by over-expressing cyaA and crp genes. Moreover, suppression of toxigenic V. cholerae-mediated fluid accumulation in ligated ileum of rabbit by anethole demonstrates its potentiality as an antivirulence drug candidate against the diseases caused by toxigenic V. cholerae. Taken altogether, these results revealing a mechanism of virulence inhibition in V. cholerae by the natural compound anethole, may have relevance in designing antivirulence compounds, particularly against multiple antibiotic resistant bacterial pathogens."
