id,abstract
https://openalex.org/W1999766977,"Genotyping of hepatitis C virus (HCV) plays an important role in the treatment of HCV. As new genotype-specific treatment options become available, it has become increasingly important to have accurate HCV genotype and subtype information to ensure that the most appropriate treatment regimen is selected. Most current genotyping methods are unable to detect mixed genotypes from two or more HCV infections. Next generation sequencing (NGS) allows for rapid and low cost mass sequencing of viral genomes and provides an opportunity to probe the viral population from a single host. In this paper, the possibility of using short NGS reads for direct HCV genotyping without genome assembly was evaluated. We surveyed the publicly-available genetic content of three HCV drug target regions (NS3, NS5A, NS5B) in terms of whether these genes contained genotype-specific regions that could predict genotype. Six genotypes and 38 subtypes were included in this study. An automated phylogenetic analysis based HCV genotyping method was implemented and used to assess different HCV target gene regions. Candidate regions of 250-bp each were found for all three genes that have enough genetic information to predict HCV genotypes/subtypes. Validation using public datasets shows 100% genotyping accuracy. To test whether these 250-bp regions were sufficient to identify mixed genotypes, we developed a random primer-based method to sequence HCV plasma samples containing mixtures of two HCV genotypes in different ratios. We were able to determine the genotypes without ambiguity and to quantify the ratio of the abundances of the mixed genotypes in the samples. These data provide a proof-of-concept that this random primed, NGS-based short-read genotyping approach does not need prior information about the viral population and is capable of detecting mixed viral infection."
https://openalex.org/W2065605926,"Background Opioid use is associated with increased incidence of infectious diseases. Although experimental studies have shown that opioids affect various functions of immune cells, only limited data are available from human studies. Drug use is an important risk factor for HIV transmission; however no data are available whether heroin and/or methadone modulate immune response. Therefore, we examined the effect of heroin and methadone use among HIV-infected individuals on the production of cytokines after ex vivo stimulation with various pathogens. Methods Treatment naïve HIV-infected individuals from Indonesia were recruited. Several cohorts of individuals were recruited: 1) using heroin 2) receiving methadone opioid substitution 3) using heroin over 1 year ago and 4) controls (never used opioids). Whole blood was stimulated with Mycobacterium tuberculosis, Candida albicans and LPS for 24 to 48 hours. Cytokine production (IL-1 β, IL-6, IL-10, IFN-α, IFN-γ and TNF-α) was determined using multiplex beads assay. Results Among 82 individuals, the cytokine levels in unstimulated samples did not differ between groups. Overall, heroin users had significantly lower cytokine response after exposure to LPS (p<0.05). After stimulation with either M. tuberculosis or C. albicans the cytokine production of all groups were comparable. Conclusion The cytokine production after exposure to LPS is significantly down-regulated in HIV-infected heroin users. Interesting, methadone use did not suppress cytokine response, which could have implications guidelines of opioid substitution."
https://openalex.org/W1520337542,"Genotoxicity testing is an important component of toxicity assessment. As illustrated by the European registration, evaluation, authorization, and restriction of chemicals (REACH) directive, it concerns all the chemicals used in industry. The commonly used in vivo mammalian tests appear to be ill adapted to tackle the large compound sets involved, due to throughput, cost, and ethical issues. The somatic mutation and recombination test (SMART) represents a more scalable alternative, since it uses Drosophila, which develops faster and requires less infrastructure. Despite these advantages, the manual scoring of the hairs on Drosophila wings required for the SMART limits its usage. To overcome this limitation, we have developed an automated SMART readout. It consists of automated imaging, followed by an image analysis pipeline that measures individual wing genotoxicity scores. Finally, we have developed a wing score-based dose-dependency approach that can provide genotoxicity profiles. We have validated our method using 6 compounds, obtaining profiles almost identical to those obtained from manual measures, even for low-genotoxicity compounds such as urethane. The automated SMART, with its faster and more reliable readout, fulfills the need for a high-throughput in vivo test. The flexible imaging strategy we describe and the analysis tools we provide should facilitate the optimization and dissemination of our methods."
https://openalex.org/W2026013500,"Ischaemic stroke is caused by occlusive thrombi in the cerebral vasculature. Although tissue-plasminogen activator (tPA) can be administered as thrombolytic therapy, it has major limitations, which include disruption of the blood-brain barrier and an increased risk of bleeding. Treatments that prevent or limit such deleterious effects could be of major clinical importance. Activated protein C (APC) is a natural anticoagulant that regulates thrombin generation, but also confers endothelial cytoprotective effects and improved endothelial barrier function mediated through its cell signalling properties. In murine models of stroke, although APC can limit the deleterious effects of tPA due to its cell signalling function, its anticoagulant actions can further elevate the risk of bleeding. Thus, APC variants such as APC(5A), APC(Ca-ins) and APC(36-39) with reduced anticoagulant, but normal signalling function may have therapeutic benefit. Human and murine protein C (5A), (Ca-ins) and (36-39) variants were expressed and characterised. All protein C variants were secreted normally, but 5-20% of the protein C (Ca-ins) variants were secreted as disulphide-linked dimers. Thrombin generation assays suggested reductions in anticoagulant function of 50- to 57-fold for APC(36-39), 22- to 27-fold for APC(Ca-ins) and 14- to 17-fold for APC(5A). Interestingly, whereas human wt APC, APC(36-39) and APC(Ca-ins) were inhibited similarly by protein C inhibitor (t½ - 33 to 39 mins), APC(5A) was inactivated ~9-fold faster (t½ - 4 mins). Using the murine middle cerebral artery occlusion ischaemia/repurfusion injury model, in combination with tPA, APC(36-39), which cannot be enhanced by its cofactor protein S, significantly improved neurological scores, reduced cerebral infarct area by ~50% and reduced oedema ratio. APC(36-39) also significantly reduced bleeding in the brain induced by administration of tPA, whereas wt APC did not. If our data can be extrapolated to clinical settings, then APC(36-39) could represent a feasible adjunctive therapy for ischaemic stroke."
https://openalex.org/W2050216536,"Background The mechanical characterization of infant porcine cerebellum tissue in tension at high strain rate is crucial for modeling traumatic cerebellum injury, which is in turn helpful for understanding the biomechanics of such injuries suffered in traffic accidents. Material and Method In this study, the infant porcine cerebellum tissue was given three loading velocities, ie, 2s-1, 20s-1 and 100s-1 with up to 30% strain to investigate the tensile properties. At least six tensile tests for each strain rate were validly performed. Fung, Gent, Ogden and exponential models were applied to fit the constitutive equations, so as to obtain material parameters from the experimental data. Results The Lagrange stress of infant porcine cerebellum tissue in tension appeared to be no more than 3000Pa at each loading velocity. More specifically, the Lagrange stress at 30% strain was (393.7±84.4)Pa, (928.3±56.3)Pa and (2582.4±282.2)Pa at strain rates of 2s-1, 20s-1 and 100s-1, respectively. Fung (0.833≤R2≤0.924), Gent (0.797≤R2≤0.875), Ogden (0.859≤R2≤0.944) and exponential (0.930≤R2≤0.972) models provided excellent fitting to experimental data up to 30% strain. Conclusions The infant cerebellum tissue shows a stiffer response with increase of the loading speed, indicating a strong strain-rate sensitivity. This study will enrich the knowledge on the material properties of infant brain tissue, which may augment the biofidelity of finite element model of human pediatric cerebellum."
https://openalex.org/W2057912694,"Dendritic epidermal T cells, which express an invariant Vγ5Vδ1 T-cell receptor and account for 95% of all resident T cells in the mouse epidermis, play a critical role in skin immune surveillance. These γδ T cells are generated by positive selection in the fetal thymus, after which they migrate to the skin. The development of dendritic epidermal T cells is critically dependent on the Skint1 gene expressed specifically in keratinocytes and thymic epithelial cells, suggesting an indispensable role for Skint1 in the selection machinery for specific intraepithelial lymphocytes. Phylogenetically, rodents have functional SKINT1 molecules, but humans and chimpanzees have a SKINT1-like (SKINT1L) gene with multiple inactivating mutations. In the present study, we analyzed SKINT1L sequences in representative primate species and found that all hominoid species have a common inactivating mutation, but that Old World monkeys such as olive baboons, green monkeys, cynomolgus macaques and rhesus macaques have apparently functional SKINT1L sequences, indicating that SKINT1L was inactivated in a common ancestor of hominoids. Interestingly, the epidermis of cynomolgus macaques contained a population of dendritic-shaped γδ T cells expressing a semi-invariant Vγ10/Vδ1 T-cell receptor. However, this population of macaque T cells differed from rodent dendritic epidermal T cells in that their Vγ10/Vδ1 T-cell receptors displayed junctional diversity and expression of Vγ10 was not epidermis-specific. Therefore, macaques do not appear to have rodent-type dendritic epidermal T cells despite having apparently functional SKINT1L. Comprehensive bioinformatics analysis indicates that SKINT1L emerged in an ancestor of placental mammals but was inactivated or lost multiple times in mammalian evolution and that Skint1 arose by gene duplication in a rodent lineage, suggesting that authentic dendritic epidermal T cells are presumably unique to rodents."
https://openalex.org/W2147018140,"Explaining the evolution of human life history traits remains an important challenge for evolutionary anthropologists. Progress is hindered by a poor appreciation of how demographic factors affect the action of natural selection. I review life history theory showing that the quantity maximized by selection depends on whether and how population growth is regulated. I show that the common use of R, a strategy's expected lifetime number of offspring, as a fitness maximand is only appropriate under a strict set of conditions, which are apparently unappreciated by anthropologists. To concretely show how demography-free life history theory can lead to errors, I reanalyze an influential model of human life history evolution, which investigated the coevolution of a long lifespan and late age of maturity. I show that the model's conclusions do not hold under simple changes to the implicitly assumed mechanism of density dependence, even when stated assumptions remain unchanged. This analysis suggests that progress in human life history theory requires better understanding of the demography of our ancestors."
https://openalex.org/W2053379576,"Human embryo invasion and implantation into the inner wall of the maternal uterus, the endometrium, is the pivotal process for a successful pregnancy. Whereas disruption of the endometrial epithelial layer was already correlated with the programmed cell death, the role of apoptosis of the subjacent endometrial stromal cells during implantation is indistinct. The aim was to clarify whether apoptosis plays a role in the stromal invasion and to characterize if the apoptotic susceptibility of endometrial stromal cells to embryonic stimuli is influenced by decidualization and Syndecan-1. Therefore, the immortalized human endometrial stromal cell line St-T1 was used to first generate a new cell line with a stable Syndecan-1 knock down (KdS1), and second to further decidualize the cells with progesterone. As a replacement for the ethically inapplicable embryo all cells were treated with the embryonic factors and secretion products interleukin-1β, interferon-γ, tumor necrosis factor-α, transforming growth factor-β1 and anti-Fas antibody to mimic the embryo contact. Detection of apoptosis was verified via Caspase ELISAs, PARP cleavage and Annexin V staining. Apoptosis-related proteins were investigated via antibody arrays and underlying signaling pathways were analyzed by Western blot. Non-decidualized endometrial stromal cells showed a resistance towards apoptosis which was rescinded by decidualization and Syndecan-1 knock down independent of decidualization. This was correlated with an altered expression of several pro- and anti-apoptotic proteins and connected to a higher activation of pro-survival Akt in non-differentiated St-T1 as an upstream mediator of apoptotis-related proteins. This study provides insight into the largely elusive process of implantation, proposing an important role for stromal cell apoptosis to successfully establish a pregnancy. The impact of Syndecan-1 in attenuating the apoptotic signal is particularly interesting in the light of an already described influence on pregnancy disorders and therefore might provide a useful clinical tool in the future to prevent pregnancy complications provoked by inadequate implantation."
https://openalex.org/W2056755277,"Background Polymorphism in the MBL2 gene lead to MBL deficiency, which has been shown to increase susceptibility to various bacterial, viral and parasitic infections. We assessed role of MBL deficiency in HIV-1 and schistosoma infections in Zimbabwean adults enrolled in the Mupfure Schistosomiasis and HIV Cohort (MUSH Cohort). Methods HIV-1, S. haematobium and S. mansoni infections were determined at baseline. Plasma MBL concentration was measured by ELISA and MBL2 genotypes determined by PCR. We calculated and compared the proportions of plasma MBL deficiency, MBL2 structural variant alleles B (codon 54A>G), C (codon 57A>G), and D (codon 52T>C) as well as MBL2 promoter variants -550(H/L), -221(X/Y) and +4(P/Q) between HIV-1 and schistosoma co-infection and control groups using Chi Square test. Results We assessed 379 adults, 80% females, median age (IQR) 30 (17–41) years. HIV-1, S. haematobium and S. mansoni prevalence were 26%, 43% and 18% respectively in the MUSH baseline survey. Median (IQR) plasma MBL concentration was 800μg/L (192-1936μg/L). Prevalence of plasma MBL deficiency was 18% with high frequency of the C (codon 57G>A) mutant allele (20%). There was no significant difference in median plasma MBL levels between HIV negative (912μg/L) and HIV positive (688μg/L), p = 0.066. However plasma MBL levels at the assay detection limit of 20μg/L were more frequent among the HIV-1 infected (p = 0.007). S. haematobium and S. mansoni infected participants had significantly higher MBL levels than uninfected. All MBL2 variants were not associated with HIV-1 infection but promoter variants LY and LL were significantly associated with S. haematobium infection. Conclusion Our data indicate high prevalence of MBL deficiency, no evidence of association between MBL deficiency and HIV-1 infection. However, lower plasma MBL levels were protective against both S. haematobium and S. mansoni infections and MBL2 promoter and variants LY and LL increased susceptibility to S. haematobium infection."
https://openalex.org/W2031749874,"Cognitive impairments severely affect the quality of life of patients who undergo brain irradiation, and there are no effective preventive strategies. In this study, we examined the therapeutic potential of electroacupuncture (EA) administered immediately after brain irradiation in rats. We detected changes in cognitive function, neurogenesis, and synaptic density at different time points after irradiation, but found that EA could protect the blood-brain barrier (BBB), inhibit neuroinflammatory cytokine expression, upregulate angiogenic cytokine expression, and modulate the levels of neurotransmitter receptors and neuropeptides in the early phase. Moreover, EA protected spatial memory and recognition in the delayed phase. At the cellular/molecular level, the preventative effect of EA on cognitive dysfunction was not dependent on hippocampal neurogenesis; rather, it was related to synaptophysin expression. Our results suggest that EA applied immediately after brain irradiation can prevent cognitive impairments by protecting against the early changes induced by irradiation and may be a novel approach for preventing or ameliorating cognitive impairments in patients with brain tumors who require radiotherapy."
https://openalex.org/W1983827209,"A novel Gram-negative bacterium, designated ZWT, was isolated from a soil sample of the Western Desert of China, and its phenotypic properties and phylogenetic position were investigated using a polyphasic approach. Growth occurred on TGY medium at 5–42°C with an optimum of 30°C, and at pH 7.0–11.0 with an optimum of pH 9.0. The predominant cellular fatty acids were summed feature 3 (C16:1ω7c/C16:1ω6c or C16:1ω6c/C16:1ω7c) (39.22%), iso-C15:0 (27.91%), iso-C17:0 3OH (15.21%), C16:0 (4.98%), iso-C15:0 3OH (3.03%), C16:0 3OH (5.39%) and C14:0 (1.74%). The major polar lipid of strain ZWT is phosphatidylethanolamine. The only menaquinone observed was MK-7. The GC content of the DNA of strain ZWT is 44.9 mol%. rDNA phylogeny, genome relatedness and chemotaxonomic characteristics all indicate that strain ZWT represents a novel species of the genus Sphingobacterium. We propose the name S. deserti sp. nov., with ZWT (= KCTC 32092T = ACCC 05744T) as the type strain. Whole genome optical mapping and next-generation sequencing was used to derive a finished genome sequence for strain ZWT, consisting of a circular chromosome of 4,615,818 bp in size. The genome of strain ZWT features 3,391 protein-encoding and 48 tRNA-encoding genes. Comparison of the predicted proteome of ZWT with those of other sphingobacteria identified 925 species-unique proteins that may contribute to the adaptation of ZWT to its native, extremely arid and inhospitable environment. As the first finished genome sequence for any Sphingobacterium, our work will serve as a useful reference for subsequent sequencing and mapping efforts for additional strains and species within this genus."
https://openalex.org/W2016906387,"The aim of this study is to describe blood lead levels (BLLs) and the prevalence of elevated blood lead levels (EBLLs) in children aged 0-6 years old and to analyze the BLL trend in children from 2009 to 2013 in China.A total of 124,376 children aged 0-6 years old were recruited for this study from January 1st 2009 to December 31st 2013. Their blood lead levels were analyzed using atomic absorption spectrometry.The median BLL was 64.3 μg/L (IQR: 49.6-81.0), and the range was 4.3-799.0 μg/L. Blood lead levels were significantly higher in boys (66.0 μg/L) than in girls (61.9 μg/L) (P<0.001). The overall prevalence of BLLs≥100 μg/L was 10.54% in children aged 0-6 years in Hunan Province. Between 2009 and 2013, the prevalence of EBLLs (≥100 μg/L) decreased from 18.31% to 4.26% in children aged 0-6 years and increased with age. The prevalence of EBLLs has dramatically decreased in two stages (2009-2010 and 2012-2013), with a slight fluctuation in 2010 and 2011.Both BLLs and the prevalence of EBLLs in children aged 0-6 years old declined substantially from 2009 to 2013 in Hunan Province; however, both remain at unacceptably high levels compared to developed countries. Comprehensive strategies are required to further reduce blood lead levels in children."
https://openalex.org/W2077300692,"Male rats were 'pretreated' with phosphate-buffered saline (PBS; i.p.) or LPS (1 mg/kg; i.p.) 24 h prior to HS. Mean arterial pressure (MAP) was maintained at 30 ± 2 mmHg for 90 min or until 25% of the shed blood had to be re-injected to sustain MAP. This was followed by resuscitation with the remaining shed blood. Four hours after resuscitation, parameters of organ dysfunction and systemic inflammation were assessed.HS resulted in renal dysfunction, and liver and muscular injury. At a first glance, LPS preconditioning attenuated organ dysfunction. However, we discovered that HS-rats that had been preconditioned with LPS (a) were not able to sustain a MAP at 30 mmHg for more than 50 min and (b) the volume of blood withdrawn in these animals was significantly less than in the PBS-control group. This effect was associated with an enhanced formation of the nitric oxide (NO) derived from inducible NO synthase (iNOS). Thus, a further control group in which all animals were resuscitated after 50 min of hemorrhage was performed. Then, LPS preconditioning aggravated both circulatory failure and organ dysfunction. Most notably, HS-rats pretreated with LPS exhibited a dramatic increase in NF-κB activation and pro-inflammatory cytokines.In conclusion, LPS preconditioning predisposed animals to an earlier vascular decompensation, which may be mediated by an excess of NO production secondary to induction of iNOS and activation of NF-κB. Moreover, LPS preconditioning increased the formation of pro-inflammatory cytokines, which is likely to have contributed to the observed aggravation of organ injury/dysfunction caused by HS."
https://openalex.org/W2044638152,"The effects of non-lethal parasites may be felt most strongly when hosts engage in intense, energy-demanding behaviors. One such behavior is fighting with conspecifics, which is common among territorial animals, including many beetle species. We examined the effects of parasites on the fighting ability of a saproxylic beetle, the horned passalus (Odontotaenius disjunctus, Family: Passalidae), which is host to a non-lethal nematode, Chondronema passali. We pitted pairs of randomly-chosen (but equally-weighted) beetles against each other in a small arena and determined the winner and aggression level of fights. Then we examined beetles for the presence, and severity of nematode infections. There was a non-significant tendency (p = 0.065) for the frequency of wins, losses and draws to differ between beetles with and without C. passali; non-parasitized individuals (n = 104) won 47% of their fights while those with the parasite (n = 88) won 34%, a 13% difference in wins. The number of nematodes in a beetle affected the outcome of fights between infected and uninfected individuals in an unexpected fashion: fighting ability was lowest in beetles with the lowest (p = 0.033), not highest (p = 0.266), nematode burdens. Within-fight aggression was highest when both beetles were uninfected and lowest when both were infected (p = 0.034). Collectively, these results suggest the nematode parasite, C. passali, is associated with a modest reduction in fighting ability in horned passalus beetles, consistent with the idea that parasitized beetles have lower energy available for fighting. This study adds to a small but growing body of evidence showing how parasites negatively influence fighting behavior in animals."
https://openalex.org/W2084853785,"We propose a new method for aggregating the information of multiple reviewers rating multiple products. Our approach is based on the network relations induced between products by the rating activity of the reviewers. We show that our method is algorithmically implementable even for large numbers of both products and consumers, as is the case for many online sites. Moreover, comparing it with the simple average, which is mostly used in practice, and with other methods previously proposed in the literature, it performs very well under various dimension, proving itself to be an optimal trade--off between computational efficiency, accordance with the reviewers original orderings, and robustness with respect to the inclusion of systematically biased reports."
