id,abstract
https://openalex.org/W2909629686,"Malnutrition, the suboptimal consumption of essential nutrients like zinc, severely affects human health. This burden of malnutrition falls disproportionally heavy on developing countries, directly increasing child mortality and childhood stunting, or reducing people’s ability mending diseases. One option to combat malnutrition is to blend missing nutrients in crop fertilizers, thereby increasing crop yields and possibly the nutrient density in harvested crop products, thus enriching crop products destined for human consumption. But, the effectiveness of so-called agronomic fortification remains ill-understood, primarily due to a paucity of field trials. We hypothesize that, if at all this is an effective strategy, there should exist a causal link between malnutrition and natural variation in the quality of soils to begin with. Until now, data limitations prevented the establishment of such a link, but new soil micronutrient maps for Sub-Saharan Africa allow for a detailed assessment. In doing so, we find statistically significant relations between soil nutrients and child mortality, stunting, wasting and underweight. For instance, a simultaneous increase in soil densities of copper, manganese and zinc by one standard deviation reduces child mortality by 4–6 per mille points, but only when malaria pressure is modest. The effects of soil nutrients on health dissipate when malaria pressure increases. Yet, the effects are fairly small in magnitude suggesting that except for a few regions, agronomic fortification is a relatively cost ineffective means to combat malnutrition."
https://openalex.org/W2908995601,"Adequate provision of safe water, basic sanitation, and hygiene (WASH) facilities and behavior change can reduce pupil absence and infectious disease. Increased drinking water quantity may also improve educational outcomes through the effect of hydration on attention, concentration, and short-term memory. A pilot study was conducted to adapt field measures of short-term cognitive performance and hydration, to evaluate levels of hydration, and to investigate the impact of providing supplementary drinking water on the cognitive performance of pupils attending water-scarce schools in rural Mali. Using a cross-over trial design, data were collected under normal school conditions (control condition) on one visit day; on the other, participants were given a bottle of water that was refilled throughout the day (water condition). Morning and afternoon hydration was assessed using specific gravity and urine color. Cognitive performance was evaluated using six paper-based tests. Three percent of pupils were dehydrated on the morning of each visit. The prevalence of dehydration increased in the afternoon, but was lower under the water condition. Although there was a trend indicating drinking water may improve cognitive test performance, as has been shown in studies in other settings, results were not statistically significant and were masked by a ""practice effect."""
https://openalex.org/W2909055659,"Previous studies revealed that healthy individuals consistently misjudge the size and shape of their hidden hand during a localisation task. Specifically, they overestimate the width of their hand and underestimate the length of their fingers. This would also imply that the same individuals misjudge the actual location of at least some parts of their hand during the task. Therefore, the primary aim of the current study was to determine whether healthy individuals could accurately locate the actual position of their hand when hidden from view, and whether accuracy depends on the type of localisation task used, the orientation of the hidden hand, and whether the left or right hand is tested. Sixteen healthy right-handed participants performed a hand localisation task that involved both pointing to and verbally indicating the perceived position of landmarks on their hidden hand. Hand position was consistently misjudged as closer to the wrist (proximal bias) and, to a lesser extent, away from the thumb (ulnar bias). The magnitude of these biases depended on the localisation task (pointing vs. verbal), the orientation of the hand (straight vs. rotated), and the hand tested (left vs. right). Furthermore, the proximal location bias increased in size as the duration of the experiment increased, while the magnitude of ulnar bias remained stable through the experiment. Finally, the resultant maps of perceived hand location appear to replicate the previously reported overestimation of hand width and underestimation of finger length. Once again, the magnitude of these distortions is dependent on the task, orientation, and hand tested. These findings underscore the need to control and standardise each component of the hand localisation task in future studies."
https://openalex.org/W2910020547,"Patients with primary Sjögren's Syndrome (pSS) have diminished health quality and fatigue, arthralgia along with dryness of the mouth and eyes have major impact on their psychological and social aspects of life. The purpose of this study was to determine psychological features of patients with pSS. We analyzed personality, depression and anxiety of patients with primary Sjögren's Syndrome (pSS) in comparison with patients with rheumatoid arthritis (RA) and healthy controls (HC) and assessed their association with sociodemographic factors and comorbidity.In 105 pSS patients (mean age 51.34 years, mean disease duration 5.98 years), 52 RA patients (mean age 51.37 years, mean disease duration 8.10 years) and 54 HC (mean age 51.35 years) clinical and sociodemographic characteristics were determined and results analyzed. At enrollment patients and controls completed the Revisited NEO Personality Inventory Five-Factor model (NEO-PI-R), the Zung Self-Rating Depression Scale and the Zung Self-Rating Anxiety Scale. Statistical analyses were performed using SPSS [Version 16.0]. The relative size of the effect was assessed based on standardized estimates of effect size (d).Patients with pSS, similarly to RA patients had higher scores of Neuroticism (d = 0.46, p = 0.007) and lower scores of Extraversion (d = 0.51, p = 0.001) and Openness for experience (d = 0.65, p = 0.013) compared to HC. There was no significant differences between pSS group and HC in the depression (d = 0.171, p>0.05). However, patients with pSS had higher anxiety in comparison to HC (p<0.0001). In multivariate models, education and satisfaction with family relationships were significant predictors for psychological characteristics of patients, independently of clinical diagnosis.Our study is the first to show that patients with pSS scored high on neuroticism and anxiety and low on sociability. Education and satisfaction with family relationships predisposed to their psychological profile. Psychological assessment of patients with pSS may improve understanding and treatment of this clinical condition."
https://openalex.org/W2951245036,"Significance Foraged leafy greens are consumed around the globe, including in urban areas, and may play a larger role when food is scarce or expensive. It is thus important to assess the safety and nutritional value of wild greens foraged in urban environments. Methods Field observations, soil tests, and nutritional and toxicology tests on plant tissue were conducted for three sites, each roughly 9 square blocks, in disadvantaged neighborhoods in the East San Francisco Bay Area in 2014–2015. The sites included mixed-use areas and areas with high vehicle traffic. Results Edible wild greens were abundant, even during record droughts. Soil at some survey sites had elevated concentrations of lead and cadmium, but tissue tests suggest that rinsed greens of the tested species are safe to eat. Daily consumption of standard servings comprise less than the EPA reference doses of lead, cadmium, and other heavy metals. Pesticides, glyphosate, and PCBs were below detection limits. The nutrient density of 6 abundant species compared favorably to that of the most nutritious domesticated leafy greens. Conclusions Wild edible greens harvested in industrial, mixed-use, and high-traffic urban areas in the San Francisco East Bay area are abundant and highly nutritious. Even grown in soils with elevated levels of heavy metals, tested species were safe to eat after rinsing in tap water. This does not mean that all edible greens growing in contaminated soil are safe to eat—tests on more species, in more locations, and over a broader range of soil chemistry are needed to determine what is generally safe and what is not. But it does suggest that wild greens could contribute to nutrition, food security, and sustainability in urban ecosystems. Current laws, regulations, and public-health guidance that forbid or discourage foraging on public lands, including urban areas, should be revisited."
https://openalex.org/W2908760954,"Human ageing is accompanied by a progressive decline in leg-extensor power (LEP). LEP is typically measured with specialized and expensive equipment, which limits the large-scale applicability. Previously, sensor-based trunk kinematics have been used to estimate the vertical power required to elevate the body’s center of mass during functional tests, but the link with LEP and age remains to be investigated. Therefore, we investigated whether a body-fixed sensor-based analysis of power during stair ascent (SA) and sit-to-stand (STS) is positively related to LEP and whether its ability to detect age-related declines is similar. In addition, the effect of load during SA and STS was investigated. 98 adults (20–70 years) performed a leg press to assess LEP, SA and 5-repetition STS tests. In SA and STS, two conditions were tested: unloaded and loaded (+10% body mass). An inertial measurement unit was used to analyze (sub)-durations and vertical power. SA and STS power were more related to LEP than duration parameters (i.e. 0.80–0.81 for power and -0.41 –-0.66 for duration parameters, p < 0.05). The average annual age-related percent change was higher in SA power (-1.38%) than in LEP (-0.86%) and STS power (-0.38%) (p < 0.05). Age explained 29% in SA power (p < 0.001), as opposed to 14% in LEP (p < 0.001) and a non-significant 2% in STS power (p = 0.102). The addition of 10% load did not influence the age-related decline of SA and STS power nor the relationship with LEP. These results demonstrate the potential of SA tests to detect age-related deterioration in neuromuscular function. SA seems more sensitive to detect age-related changes than LEP, probably because of the additional balance component and plantar- and dorsiflexor activity. On the contrary, STS is less sensitive to age-related changes because of a ceiling effect in well-functioning adults."
https://openalex.org/W2908780372,"The emergence of bacterial pathogens that are resistant to clinical antibiotics poses an increasing risk to human health. An important reservoir from which bacterial pathogens can acquire resistance is the human gut microbiota. However, thus far, a substantial fraction of the gut microbiota remains uncultivated and has been little-studied with respect to its resistance reservoir-function. Here, we aimed to isolate yet uncultivated resistant gut bacteria by a targeted approach. Therefore, faecal samples from 20 intensive care patients who had received the prophylactic antibiotic treatment selective digestive decontamination (SDD), i.e. tobramycin, polymyxin E, amphotericin B and cefotaxime, were inoculated anaerobically on porous aluminium oxide chips placed on top of poor and rich agar media, including media supplemented with the SDD antibiotics. Biomass growing on the chips was analysed by 16S rRNA gene amplicon sequencing, showing large inter-individual differences in bacterial cultivability, and enrichment of a range of taxonomically diverse operational taxonomic units (OTUs). Furthermore, growth of Ruminococcaceae (2 OTUs), Enterobacteriaceae (6 OTUs) and Lachnospiraceae (4 OTUs) was significantly inhibited by the SDD antibiotics. Strains belonging to 16 OTUs were candidates for cultivation to pure culture as they shared ≤95% sequence identity with the closest type strain and had a relative abundance of ≥2%. Six of these OTUs were detected on media containing SDD antibiotics, and as such were prime candidates to be studied regarding antibiotic resistance. One of these six OTUs was obtained in pure culture using targeted isolation. This novel strain was resistant to the antibiotics metrodinazole and imipenem. It was initially classified as member of the Ruminococcaceae, though later it was found to share 99% nucleotide identity with the recently published Sellimonas intestinalis BR72T. In conclusion, we show that high-throughput cultivation-based screening of microbial communities can guide targeted isolation of bacteria that serve as reservoirs of antibiotic resistance."
https://openalex.org/W2909949289,"Background Data from the UK Infant Feeding Surveys indicate that breastfeeding initiation increased between 1985 and 2010. During this period, societal changes in GB also influenced the sociodemographic characteristics of women in the childbearing population. As breastfeeding behaviour is highly socially patterned in GB, the increasing trend in breastfeeding initiation may have hidden inequalities in breastfeeding practices. This study examines the sociodemographic inequalities in breastfeeding initiation in GB between 1985 and 2010, exploring whether and how this may have been influenced by social and policy changes. Methods Data drawn from the nationally representative 1985, 1990, 1995, 2000, 2005 and 2010 Infant Feeding Surveys were used to estimate changes in the proportion of mothers in selected sociodemographic groups over time. Logistic regression models estimated the independent associations between breastfeeding initiation in each survey year and maternal sociodemographic characteristics. Associations were adjusted for maternal sociodemographic, pregnancy-related and support factors. Evidence of a change in the association between breastfeeding initiation and each sociodemographic characteristic over time was assessed using a test for statistical heterogeneity. Results The sociodemographic characteristics of mothers in GB changed substantially between 1985 and 2010. Mothers were increasingly more likely to be 30 or over; have higher education and socioeconomic status; and be single or cohabiting. An increasing proportion of mothers in GB identified as being of black or minority ethnic origin. Reported smoking in pregnancy declined. These same characteristics independently predicted higher odds of breastfeeding initiation; the associations between these characteristics and breastfeeding initiation did not vary significantly over time. Conclusions Marked inequalities in breastfeeding initiation persisted over the study period, hidden among the increasing initiation rate at the population level. The increasing overall rate of initiation was most likely driven by the rising prevalence of those groups of mothers who were, and remain, characteristically most likely to breastfeed."
https://openalex.org/W2908729136,"Background Cardiovascular disease (CVD) risk among people living with HIV is elevated due to persistent inflammation, hypertension and diabetes comorbidity, lifestyle factors and exposure to antiretroviral therapy (ART). Data from Africa on how CVD risk affects morbidity and mortality among ART patients are lacking. We explored the effect of CVD risk factors and the Framingham Risk Score (FRS) on medium-term ART outcomes. Methods A prospective cohort study of standardized ART outcomes (Dead, Alive on ART, stopped ART, Defaulted and Transferred out) was conducted from July 2014—December 2016 among patients on ART at a rural and an urban HIV clinic in Zomba district, Malawi. The primary outcome was Dead. Active defaulter tracing was not done and patients who transferred out and defaulted were excluded from the analysis. At enrolment, hypertension, diabetes and dyslipidemia were diagnosed, lifestyle data collected and the FRS was determined. Cox-regression analysis was used to determine independent risk factors for the outcome Dead. Results Of 933 patients enrolled, median age was 42 years (IQR: 35–50), 72% were female, 24% had hypertension, 4% had diabetes and 15.8% had elevated total cholesterol. The median follow up time was 2.4 years. Twenty (2.1%) patients died, 50 (5.4%) defaulted, 63 (6.8%) transferred out and 800 (85.7%) were alive on ART care (81.7% urban vs. 89.9% rural). In multivariable survival analysis, male gender (aHR = 3.28; 95%CI: 1.33–8.07, p = 0.01) and total/HDL cholesterol ratio (aHR = 5.77, 95%CI: 1.21–27.32; p = 0.03) were significantly associated with mortality. There was no significant association between mortality and hypertension, body mass index, central obesity, diabetes, FRS, physical inactivity, smoking at enrolment, ART regimen and WHO disease stage. Conclusions Medium-term all-cause mortality among ART patients was associated with male gender and elevated total/HDL cholesterol ratio."
https://openalex.org/W2911022902,"C-reactive proteins (CRPs) are among the faster acute-phase inflammation-responses proteins encoded by one gene (hcrp) in humans and seven genes (crp1-7) in zebrafish (Danio rerio) with importance in bacterial and viral infections. In this study, we described novel preferential bindings of 25-hydroxycholesterol (25HOCh) to CRP1-7 compared with other lipids and explored the antiviral effects of both 25HOCh and CRP1-7 against spring viremia carp virus (SVCV) infection in zebrafish. Both in silico and in vitro results confirmed the antiviral effect of 25HOCh and CRP1-7 interactions, thereby showing that the crosstalk between them differed among the zebrafish isoforms. The presence of oxidized cholesterols in human atherosclerotic plaques amplifies the importance that similar interactions may occur for vascular and/or neurodegenerative diseases during viral infections. In this context, the zebrafish model offers a genetic tool to further investigate these interactions."
https://openalex.org/W2911085564,"There is mounting evidence that associates brain injury and offending behaviour, and there is a need to understand the epidemiology of head injury in prisoners in order to plan interventions to reduce associated disability and risk of reoffending. This is the first study to determine the lifetime prevalence of hospitalised head injury (HHI) in a national population of current prison inmates. In addition characteristics of prisoners with HHI and were compared to prisoners without HHI to discover whether those with HI differed demographically.Whole life hospital records of everyone aged 35 years or younger and resident in a prison in Scotland on a census date in 2015 were electronically linked via their unique NHS identifier and checked for ICD-9 and 10 codes for head injury. Using a case-control design, these data were compared with a sample from the general population matched 3:1 for age, gender and area-based social deprivation. Comparison of demographic variables was made between prisoners with and without HHI.HHI was found in 24.7% (1,080/4,374) of prisoners and was significantly more prevalent than found in the matched general population sample (18.2%; 2394/13122; OR 2.10; 95%CI 1.87, 2.16). The prevalence of HHI in prisoners and controls was similar with the exception of a higher risk of HHI in prisoners in lower deprivation quintiles. Having three or more HHI was more common in prisoners (OR 3.04; 95%CI 2.33, 3.97) as were HHI with ICD codes for intracranial injuries (OR 1.81; 95% CI 1.54, 2.11), suggesting that more severe HHI is more prevalent in prisoners than the general population. The distributions within demographic variables and the characteristics of HHI admissions in prisoners with and without a history of HHI were similar.Prisoners in Scotland aged 35 years or younger have a higher lifetime prevalence of HHI than the general population and are more likely to have had repeated HI or intracranial injuries. Further work is required to elucidate the correspondence between self-report of HI and hospitalised records and to ascertain persisting effects of HI in prisoners and the need for services to reduce associated disability and risk of reoffending."
https://openalex.org/W2911199825,"Metal hypersensitivity has been recognized as an adverse biologic reaction that can compromise total joint arthroplasty (TJA) performance. However, the etiology of metal hypersensitivity responses in TJAs remains unclear. Metal implant debris is known to act as a danger signal that drives NLRP3 inflammasome activation. It remains unknown if implant debris induced inflammasome activation regulates T cell lineage in TJA metal hypersensitivity responses. In this study, we show both in vivo and in vitro that the pathogenesis of metal hypersensitivity responses to implant debris are largely dependent on activation of the inflammasome/caspase-1 pathway and subsequent production of IL-17A/F by CD4+ T cells. Inhibiting either the inflammasome pathway or IL-17A bioactivity in vivo and in vitro (in vivo using NLRP3 and Caspase-1 deficient mice or in vitro using blocking agents such as Capase-1 inhibitor, IL-1Ra and anti-IL-17A), significantly (p<0.05) mitigated metal-DTH paw inflammation as well as lymphocyte cytokine (IFN-γ and IL-17) and proliferation responses in metal-sensitized mice and primary human PBMCs. This study provides mechanistic insight into how in vivo exposure to orthopedic implant debris, and metals in general, elicits NLRP3 inflammasome activation that mediates the generation of IL-17A/F producing CD4+ T cells, leading to metal-delayed type hypersensitivity reactions."
https://openalex.org/W2908983330,"Collective action of resource users is essential for sustainability. Yet, often user groups are socioculturally heterogeneous, which requires cooperation to be established across salient group boundaries. We explore the effect of this type of heterogeneity on resource extraction in lab-in-the-field Common Pool Resource (CPR) experiments in Zanzibar, Tanzania. We create heterogeneous groups by mixing fishers from two neighbouring fishing villages which have distinct social identities, a history of conflict and diverging resource use practices and institutions. Additionally, we analyse between-village differences in extraction behaviour in the heterogeneous setting to assess if out-group cooperation in a CPR dilemma is associated with a community’s institutional scope in the economic realm (e.g., degree of market integration). We find no aggregate effect of heterogeneity on extraction. However, this is because fishers from the two villages behave differently in the heterogeneity treatment. We find support for the hypothesis that cooperation under sociocultural heterogeneity is higher for fishers from the village with larger institutional scope. In line with this explanation, cooperation under heterogeneity also correlates with a survey measure of individual fishers’ radius of trust. We discuss implications for resource governance and collective action research."
https://openalex.org/W2909158552,"Using a head-mounted perimeter imo that can measure monocular sensitivity with both eyes open, we investigated the difference between monocular sensitivities measured with and without occlusion of the fellow eye and if the difference was influenced by eccentricity.Using the perimeter imo, monocular sensitivities with/without occlusion and binocular sensitivity were measured and compared. Three test conditions for monocular sensitivity without occlusion were: with/without a fusional fixation target, and a binocular random single eye test in which the target was randomly presented to either eye and the examinee was not aware of the tested eye. Within the central 25° visual field (VF), 29 points located at the fovea and on the 45°, 135°, 225°, and 315° meridians with 3° intervals were tested. Differences among the four monocular sensitivities with/without occlusion were further evaluated at the fovea, within and beyond the central 5° VF.Sixteen visually normal volunteers (mean age, 28.6 ± 4.6 years) were included in this study. Except at the fovea, monocular sensitivities measured without occlusion were significantly higher than those with occlusion (P < 0.01). No significant difference was seen among the three monocular sensitivities without occlusion (P = 0.82).Except at the fovea, monocular sensitivities measured with and without occlusion significantly differed. This indicates that without occlusion, binocular interaction is activated and affects not only binocular sensitivity but also monocular sensitivity."
