id,abstract
https://openalex.org/W2034044028,"Reactive oxygen species formed as a response to various abiotic and biotic stresses cause an oxidative damage of cellular component such are lipids, proteins and nucleic acids. Lipid peroxidation is considered as one of the major processes responsible for the oxidative damage of the polyunsaturated fatty acid in the cell membranes. Various methods such as a loss of polyunsaturated fatty acids, amount of the primary and the secondary products are used to monitor the level of lipid peroxidation. To investigate the use of ultra-weak photon emission as a non-invasive tool for monitoring of lipid peroxidation, the involvement of lipid peroxidation in ultra-weak photon emission was studied in the unicellular green alga Chlamydomonas reinhardtii. Lipid peroxidation initiated by addition of exogenous linoleic acid to the cells was monitored by ultra-weak photon emission measured with the employment of highly sensitive charged couple device camera and photomultiplier tube. It was found that the addition of linoleic acid to the cells significantly increased the ultra-weak photon emission that correlates with the accumulation of lipid peroxidation product as measured using thiobarbituric acid assay. Scavenging of hydroxyl radical by mannitol, inhibition of intrinsic lipoxygenase by catechol and removal of molecular oxygen considerably suppressed ultra-weak photon emission measured after the addition of linoleic acid. The photon emission dominated at the red region of the spectrum with emission maximum at 680 nm. These observations reveal that the oxidation of linoleic acid by hydroxyl radical and intrinsic lipoxygenase results in the ultra-weak photon emission. Electronically excited species such as excited triplet carbonyls are the likely candidates for the primary excited species formed during the lipid peroxidation, whereas chlorophylls are the final emitters of photons. We propose here that the ultra-weak photon emission can be used as a non-invasive tool for the detection of lipid peroxidation in the cell membranes."
https://openalex.org/W1968892287,"The appearance of cellular cartilage was a defining event in vertebrate evolution because it made possible the physical expansion of the vertebrate ""new head"". Despite its central role in vertebrate evolution, the origin of cellular cartilage has been difficult to understand. This is largely due to a lack of informative evolutionary intermediates linking vertebrate cellular cartilage to the acellular cartilage of invertebrate chordates. The basal jawless vertebrate, lamprey, has long been considered key to understanding the evolution of vertebrate cartilage. However, histological analyses of the lamprey head skeleton suggest it is composed of modern cellular cartilage and a putatively unrelated connective tissue called mucocartilage, with no obvious transitional tissue. Here we take a molecular approach to better understand the evolutionary relationships between lamprey cellular cartilage, gnathostome cellular cartilage, and lamprey mucocartilage. We find that despite overt histological similarity, lamprey and gnathostome cellular cartilage utilize divergent gene regulatory networks (GRNs). While the gnathostome cellular cartilage GRN broadly incorporates Runx, Barx, and Alx transcription factors, lamprey cellular cartilage does not express Runx or Barx, and only deploys Alx genes in certain regions. Furthermore, we find that lamprey mucocartilage, despite its distinctive mesenchymal morphology, deploys every component of the gnathostome cartilage GRN, albeit in different domains. Based on these findings, and previous work, we propose a stepwise model for the evolution of vertebrate cellular cartilage in which the appearance of a generic neural crest-derived skeletal tissue was followed by a phase of skeletal tissue diversification in early agnathans. In the gnathostome lineage, a single type of rigid cellular cartilage became dominant, replacing other skeletal tissues and evolving via gene cooption to become the definitive cellular cartilage of modern jawed vertebrates."
https://openalex.org/W2145366516,"Participants read aloud swear words, euphemisms of the swear words, and neutral stimuli while their autonomic activity was measured by electrodermal activity. The key finding was that autonomic responses to swear words were larger than to euphemisms and neutral stimuli. It is argued that the heightened response to swear words reflects a form of verbal conditioning in which the phonological form of the word is directly associated with an affective response. Euphemisms are effective because they replace the trigger (the offending word form) by another word form that expresses a similar idea. That is, word forms exert some control on affect and cognition in turn. We relate these findings to the linguistic relativity hypothesis, and suggest a simple mechanistic account of how language may influence thinking in this context."
https://openalex.org/W2160287573,"The rupture forces and adhesion frequencies of single recognition complexes between an affinity selected peptide/MHC complex and a TCR at a murine hybridoma surface were measured using Atomic Force Microscopy. When the CD8 coreceptor is absent, the adhesion frequency depends on the nature of the peptide but the rupture force does not. When CD8 is present, no effect of the nature of the peptide is observed. CD8 is proposed to act as a time and distance lock, enabling the shorter TCR molecule to bridge the pMHC and have time to finely read the peptide. Ultimately, such experiments could help the dissection of the sequential steps by which the TCR reads the peptide/MHC complex in order to control T cell activation."
https://openalex.org/W2062887727,"Mitochondrial ferritin (MtF) has been identified as a novel ferritin encoded by an intron-lacking gene with specific mitochondrial localization located on chromosome 5q23.1. MtF has been associated with neurodegenerative disorders such as Friedreich ataxia and restless leg syndrome. However, little information is available about MtF in Alzheimer's disease (AD). In this study, therefore, we investigated the expression and localization of MtF messenger RNA (mRNA) in the cerebral cortex of AD and control cases using real-time polymerase chain reaction (PCR) as well as in situ hybridization histochemistry. We also examined protein expression using western-blot assay. In addition, we used in vitro methods to further explore the effect of oxidative stress and β-amyloid peptide (Aβ) on MtF expression. To do this we examined MtF mRNA and protein expression changes in the human neuroblastoma cell line, IMR-32, after treatment with Aβ, H2O2, or both. The neuroprotective effect of MtF on oxidative stress induced by H2O2 was measured by MTT assay. The in situ hybridization studies revealed that MtF mRNA was detected mainly in neurons to a lesser degree in glial cells in the cerebral cortex. The staining intensity and the number of positive cells were increased in the cerebral cortex of AD patients. Real-time PCR and western-blot confirmed that MtF expression levels in the cerebral cortex were significantly higher in AD cases than that in control cases at both the mRNA and the protein level. Cell culture experiments demonstrated that the expression of both MtF mRNA and protein were increased by treatment with H2O2 or a combination of Aβ and H2O2, but not with Aβ alone. Finally, MtF expression showed a significant neuroprotective effect against H2O2-induced oxidative stress (p<0.05). The present study suggests that MtF is involved in the pathology of AD and may play a neuroprotective role against oxidative stress."
https://openalex.org/W2156192904,"Patients suffering from diabetes show defective bacterial clearance. This study investigates the effects of elevated plasma glucose levels during diabetes on leukocyte recruitment and function in established models of inflammation.Diabetes was induced in C57Bl/6 mice by intravenous alloxan (causing severe hyperglycemia), or by high fat diet (moderate hyperglycemia). Leukocyte recruitment was studied in anaesthetized mice using intravital microscopy of exposed cremaster muscles, where numbers of rolling, adherent and emigrated leukocytes were quantified before and during exposure to the inflammatory chemokine MIP-2 (0.5 nM). During basal conditions, prior to addition of chemokine, the adherent and emigrated leukocytes were increased in both alloxan- (62±18% and 85±21%, respectively) and high fat diet-induced (77±25% and 86±17%, respectively) diabetes compared to control mice. MIP-2 induced leukocyte emigration in all groups, albeit significantly more cells emigrated in alloxan-treated mice (15.3±1.0) compared to control (8.0±1.1) mice. Bacterial clearance was followed for 10 days after subcutaneous injection of bioluminescent S. aureus using non-invasive IVIS imaging, and the inflammatory response was assessed by Myeloperoxidase-ELISA and confocal imaging. The phagocytic ability of leukocytes was assessed using LPS-coated fluorescent beads and flow cytometry. Despite efficient leukocyte recruitment, alloxan-treated mice demonstrated an impaired ability to clear bacterial infection, which we found correlated to a 50% decreased phagocytic ability of leukocytes in diabetic mice.These results indicate that reduced ability to clear bacterial infections observed during experimentally induced diabetes is not due to reduced leukocyte recruitment since sustained hyperglycemia results in increased levels of adherent and emigrated leukocytes in mouse models of type 1 and type 2 diabetes. Instead, decreased phagocytic ability observed for leukocytes isolated from diabetic mice might account for the impaired bacterial clearance."
https://openalex.org/W2061504188,"Neuropeptide Y (NPY) produced by arcuate nucleus (ARC) neurons has a strong orexigenic effect on target neurons. Hypothalamic NPY levels undergo wide-ranging oscillations during the circadian cycle and in response to fasting and peripheral hormones (from 0.25 to 10-fold change). The aim of the present study was to evaluate the impact of a moderate long-term modulation of NPY within the ARC neurons on food consumption, body weight gain and hypothalamic neuropeptides. We achieved a physiological overexpression (3.6-fold increase) and down-regulation (0.5-fold decrease) of NPY in the rat ARC by injection of AAV vectors expressing NPY and synthetic microRNA that target the NPY, respectively. Our work shows that a moderate overexpression of NPY was sufficient to induce diurnal over-feeding, sustained body weight gain and severe obesity in adult rats. Additionally, the circulating levels of leptin were elevated but the immunoreactivity (ir) of ARC neuropeptides was not in accordance (POMC-ir was unchanged and AGRP-ir increased), suggesting a disruption in the ability of ARC neurons to response to peripheral metabolic alterations. Furthermore, a dysfunction in adipocytes phenotype was observed in these obese rats. In addition, moderate down-regulation of NPY did not affect basal feeding or normal body weight gain but the response to food deprivation was compromised since fasting-induced hyperphagia was inhibited and fasting-induced decrease in locomotor activity was absent. These results highlight the importance of the physiological ARC NPY levels oscillations on feeding regulation, fasting response and body weight preservation, and are important for the design of therapeutic interventions for obesity that include the NPY."
https://openalex.org/W2048104051,"The hepatitis E virus (HEV) is a small RNA virus and the cause of acute viral hepatitis E. The open reading frame 3 protein (pORF3) of HEV appears to be a pleiotropic regulatory protein that helps in the establishment, propagation and progression of viral infection. However, the global cellular effects of this protein remain to be explored. In the absence of traditional in vitro viral infection systems or efficient replicon systems, we made an adenovirus based ORF3 protein expression system to study its effects on host cell gene expression. We infected Huh7 hepatoma cells with recombinant adenoviruses expressing pORF3 and performed microarray-based gene expression analyses. Several genes down regulated in pORF3-expressing cells were found to be under regulation of the liver-enriched hepatocyte nuclear factor 4 (HNF4), which regulates hepatocyte-specific gene expression. While HNF4 localizes to the nucleus, its phosphorylation results in impaired nuclear localization of HNF4. Here we report that pORF3 increases HNF4 phosphorylation through the ERK and Akt kinases, which results in impaired nuclear translocation of HNF4 and subsequently the down modulation of HNF4-responsive genes in pORF3-expressing cells. We propose that modulation of several hepatocyte specific genes by pORF3 will create an environment favorable for viral replication and pathogenesis."
https://openalex.org/W2085601945,"Background An estimated 1.86 million people are living with HIV in Latin America and the Caribbean (LAC). The region is comprised of mainly middle-income countries with steady economic growth while simultaneously there are enormous social inequalities and several concentrated AIDS epidemics. This paper describes HIV spending patterns in LAC countries including analysis of the levels and patterns of domestic HIV spending from both public and international sources. Methods and Findings We conducted an extensive analysis of the most recently available data from LAC countries using the National AIDS Spending Assessment tool. The LAC countries spent a total of US$ 1.59 billion on HIV programs and services during the latest reported year. Countries providing detailed information on spending showed that high percentages are allocated to treatment and care (75.1%) and prevention (15.0%). Domestic sources accounted for 93.6 percent of overall spending and 79 percent of domestic funds were directed to treatment and care. International funds represented 5.4 percent of total HIV funding in the region, but they supplied the majority of the effort to reach most-at-risk-populations (MARPs). However, prevalence rates among men who have sex with men (MSM) still reached over 25 percent in some countries. Conclusions Although countries in the region have increasingly sustained their response from domestic sources, still there are future challenges: 1) The growing number of new HIV infections and more people-living-with-HIV (PLWH) eligible to receive antiretroviral treatment (ART); 2) Increasing ART coverage along with high prices of antiretroviral drugs; and 3) The funding for prevention activities among MARPs rely almost exclusively on external donors. These threats call for strengthened actions by civil society and governments to protect and advance gains against HIV in LAC."
https://openalex.org/W2113902206,"To calibrate the intensity of transcranial magnetic stimulation (TMS) at the occipital pole, the phosphene threshold is used as a measure of cortical excitability. The phosphene threshold (PT) refers to the intensity of magnetic stimulation that induces illusory flashes of light (phosphenes) on a proportion of trials. The existing PT estimation procedures lack the accuracy and mathematical rigour of modern threshold estimation methods. We present an improved and automatic procedure for estimating the PT which is based on the well-established Ψ Bayesian adaptive staircase approach. To validate the new procedure, we compared it with another commonly used procedure for estimating the PT. We found that our procedure is more accurate, reliable, and rapid when compared with an existing PT measurement procedure. The new procedure is implemented in Matlab and works automatically with the Magstim Rapid2 stimulator using a convenient graphical user interface. The Matlab program is freely available for download."
https://openalex.org/W1975959985,"Background Patients scheduled for bariatric surgery (BS) are encouraged to chew slowly in order to optimise the digestion process. The influence of dental status on patients' ability to comply with advice on chewing behaviour is poorly documented. This study aims to compare modifications of chewing function before and after BS in three groups of obese patients differing in dental status. Method and Findings A cohort of 46 obese women provided three groups: FD group: fully dentate (7–10 functional dental units [FU]); PD group: partially dentate (4–6 FU) without partial dentures; DW group: partial and complete denture wearers. Chewing time (CT), number of chewing cycles (CC), and chewing frequency (CF) were measured before and after surgery during mastication of standardised samples of raw carrot, peanuts, banana, apple and jelly. The median particle-size distribution (D50) of the pre-swallowed bolus was also evaluated for peanut and carrot. Before surgery, the PD and DW groups exhibited greater mean CCs and CTs than the FD group (SNK p<0.05) and produced a bolus with higher granulometry (SNK, p<0.05) than the FD group. After surgery, CT and CC increased for all groups and for all foods, but not statistically significant for jelly. The resulting changes in bolus granulometry observed depended on both food and dental status. The granulometry of carrot bolus remained as fine or as coarse in FD and DW groups respectively as it was before surgery while it was significantly decreased in the PD group (Student's test, p<0.001). Conclusions After bariatric surgery, all the obese patients, regardless of dental status modified their chewing kinematics. The effects of this chewing behaviour on bolus granulometry depended on dental status and type of food. Further studies are needed to understand better the impact of dental status on feeding behaviour and nutrition in patients with obesity."
https://openalex.org/W2094310327,"During the Neolithic revolution, early farmers altered plant development to domesticate crops. Similar traits were often selected independently in different wild species; yet the genetic basis of this parallel phenotypic evolution remains elusive. Plant architecture ranks among these target traits composing the domestication syndrome. We focused on the reduction of branching which occurred in several cereals, an adaptation known to rely on the major gene Teosinte-branched1 (Tb1) in maize. We investigate the role of the Tb1 orthologue (Pgtb1) in the domestication of pearl millet (Pennisetum glaucum), an African outcrossing cereal.Gene cloning, expression profiling, QTL mapping and molecular evolution analysis were combined in a comparative approach between pearl millet and maize. Our results in pearl millet support a role for PgTb1 in domestication despite important differences in the genetic basis of branching adaptation in that species compared to maize (e.g. weaker effects of PgTb1). Genetic maps suggest this pattern to be consistent in other cereals with reduced branching (e.g. sorghum, foxtail millet). Moreover, although the adaptive sites underlying domestication were not formerly identified, signatures of selection pointed to putative regulatory regions upstream of both Tb1 orthologues in maize and pearl millet. However, the signature of human selection in the pearl millet Tb1 is much weaker in pearl millet than in maize.Our results suggest that some level of parallel evolution involved at least regions directly upstream of Tb1 for the domestication of pearl millet and maize. This was unanticipated given the multigenic basis of domestication traits and the divergence of wild progenitor species for over 30 million years prior to human selection. We also hypothesized that regular introgression of domestic pearl millet phenotypes by genes from the wild gene pool could explain why the selective sweep in pearl millet is softer than in maize."
https://openalex.org/W2148963598,"Nutritional status is a critical element of many aspects of animal ecology, but has proven difficult to measure non-invasively in studies of free-ranging animals. Urinary C-peptide of insulin (UCP), a small polypeptide cleaved in an equimolar ratio from proinsulin when the body converts it to insulin, offers great promise in this regard, and recent studies of several non-human primate species have utilized it with encouraging results. Despite this, there are a number of unresolved issues related to the collection, processing, storage and transport of samples. These include: contamination of samples on collection (most commonly by dirt or faeces), short-term storage before returning to a field station, differences in processing and long-term storage methods (blotting onto filter paper, freezing, lyophilizing), and for frozen samples, transportation while keeping samples frozen. Such issues have been investigated for urine samples in particular with respect to their effects on steroid hormone metabolites, but there has been little investigation of their effects on UCP measurement. We collected samples from captive macaques, and undertook a series of experiments where we systematically manipulated samples and tested the effects on subsequent UCP measurements. We show that contamination of urine samples by faeces led to a decrease in UCP levels by >90%, but that contamination with dirt did not have substantial effects. Short-term storage (up to 12 hours) of samples on ice did not affect UCP levels significantly, but medium-term storage (up to 78 hours) did. Freezing and lyophilization for long-term storage did not affect UCP levels, but blotting onto filter paper did. A transportation simulation showed that transporting frozen samples packed in ice and insulated should be acceptable, but only if it can be completed within a period of a few days and if freeze-thaw can be avoided. We use our data to make practical recommendations for fieldworkers."
https://openalex.org/W2013815207,"Among global changes induced by human activities, association of breakdown of geographical barriers and impoverishered biodiversity of agroecosystems may have a strong evolutionary impact on pest species. As a consequence of trade networks' expansion, secondary contacts between incipient species, if hybrid incompatibility is not yet reached, may result in hybrid swarms, even more when empty niches are available as usual in crop fields and farms. By providing important sources of genetic novelty for organisms to adapt in changing environments, hybridization may be strongly involved in the emergence of invasive populations. Because national and international trade networks offered multiple hybridization opportunities during the previous and current centuries, population structure of many pest species is expected to be the most intricate and its inference often blurred when using fast-evolving markers. Here we show that mito-nuclear sequence datasets may be the most helpful in disentangling successive layers of admixture in the composition of pest populations. As a model we used D. gallinae s. l., a mesostigmatid mite complex of two species primarily parasitizing birds, namely D. gallinae L1 and D. gallinae s. str. The latter is a pest species, considered invading layer farms in Brazil. The structure of the pest as represented by isolates from both wild and domestic birds, from European (with a focus on France), Australian and Brazilian farms, revealed past hybridization events and very recent contact between deeply divergent lineages. The role of wild birds in the dissemination of mites appears to be null in European and Australian farms, but not in Brazilian ones. In French farms, some recent secondary contact is obviously consecutive to trade flows. Scenarios of populations' history were established, showing five different combinations of more or less dramatic bottlenecks and founder events, nearly interspecific hybridizations and recent population mixing within D. gallinae s. str."
https://openalex.org/W2069866488,"Background Matrix metalloproteinases (MMPs) have recently been considered to be involved in the neurogenic response of adult neural stem/progenitor cells. However, there is a lack of information showing direct association between the activation of MMPs and the development of neuronal progenitor cells involving proliferation and/or further differentiation in vulnerable (Cornus Ammoni-CA1) and resistant (dentate gyrus-DG) to ischemic injury areas of the brain hippocampus. Principal Findings We showed that dynamics of MMPs activation in the dentate gyrus correlated closely with the rate of proliferation and differentiation of progenitor cells into mature neurons. In contrast, in the damaged CA1 pyramidal cells layer, despite the fact that some proliferating cells exhibited antigen specific characteristic of newborn neuronal cells, these did not attain maturity. This coincides with the low, near control-level, activity of MMPs. The above results are supported by our in vitro study showing that MMP inhibitors interfered with both the proliferation and differentiation of the human neural stem cell line derived from umbilical cord blood (HUCB-NSCs) toward the neuronal lineage. Conclusion Taken together, the spatial and temporal profiles of MMPs activity suggest that these proteinases could be an important component in neurogenesis-associated processes in post-ischemic brain hippocampus."
