id,abstract
https://openalex.org/W2131282078,"Large numbers of new neurons are born continuously in the adult subventricular zone (SVZ). The molecular niche of SVZ stem cells is poorly understood. Here, we show that the bone morphogenetic protein (BMP) antagonist Noggin is expressed by ependymal cells adjacent to the SVZ. SVZ cells were found to express BMPs as well as their cognate receptors. BMPs potently inhibited neurogenesis both in vitro and in vivo. BMP signaling cell-autonomously blocked the production of neurons by SVZ precursors by directing glial differentiation. Purified mouse Noggin protein promoted neurogenesis in vitro and inhibited glial cell differentiation. Ectopic Noggin promoted neuronal differentiation of SVZ cells grafted to the striatum. We thus propose that ependymal Noggin production creates a neurogenic environment in the adjacent SVZ by blocking endogenous BMP signaling."
https://openalex.org/W1991690400,"The small GTPase Ran, bound to GTP, is required for the induction of spindle formation by chromosomes in M phase. High concentrations of Ran.GTP are proposed to surround M phase chromatin. We show that the action of Ran.GTP in spindle formation requires TPX2, a microtubule-associated protein previously known to target a motor protein, Xklp2, to microtubules. TPX2 is normally inactivated by binding to the nuclear import factor, importin alpha, and is displaced from importin alpha by the action of Ran.GTP. TPX2 is required for Ran.GTP and chromatin-induced microtubule assembly in M phase extracts and mediates spontaneous microtubule assembly when present in excess over free importin alpha. Thus, components of the nuclear transport machinery serve to regulate spindle formation in M phase."
https://openalex.org/W2004864721,"XRCC1 protein is required for DNA single-strand break repair and genetic stability but its biochemical role is unknown. Here, we report that XRCC1 interacts with human polynucleotide kinase in addition to its established interactions with DNA polymerase-beta and DNA ligase III. Moreover, these four proteins are coassociated in multiprotein complexes in human cell extract and together they repair single-strand breaks typical of those induced by reactive oxygen species and ionizing radiation. Strikingly, XRCC1 stimulates the DNA kinase and DNA phosphatase activities of polynucleotide kinase at damaged DNA termini and thereby accelerates the overall repair reaction. These data identify a novel pathway for mammalian single-strand break repair and demonstrate a concerted role for XRCC1 and PNK in the initial step of processing damaged DNA ends."
https://openalex.org/W2028226828,"Analysis of presynaptic determinants of synaptic strength has been difficult at cortical synapses, mainly due to the lack of direct access to presynaptic elements. Here we report patch-clamp recordings from mossy fiber boutons (MFBs) in rat hippocampal slices. The presynaptic action potential is very short during low-frequency stimulation but is prolonged up to 3-fold during high-frequency stimulation. Voltage-gated K(+) channels in MFBs inactivate rapidly but recover from inactivation very slowly, suggesting that cumulative K(+) channel inactivation mediates activity-dependent spike broadening. Prolongation of the presynaptic voltage waveform leads to an increase in the number of Ca(2+) ions entering the terminal per action potential and to a consecutive potentiation of evoked excitatory postsynaptic currents at MFB-CA3 pyramidal cell synapses. Thus, inactivation of presynaptic K(+) channels contributes to the control of efficacy of a glutamatergic synapse in the cortex."
https://openalex.org/W2022613290,"Visual perception of houses, faces, and chairs evoke differential responses in ventral temporal cortex. Using fMRI, we compared activations evoked by perception and imagery of these object categories. We found content-related activation during imagery in extrastriate cortex, but this activity was restricted to small subsets of the regions that showed category-related activation during perception. Within ventral temporal cortex, activation during imagery evoked stronger responses on the left whereas perception evoked stronger responses on the right. Additionally, visual imagery evoked activity in parietal and frontal cortex, but this activity was not content related. These results suggest that content-related activation during imagery in visual extrastriate cortex may be implemented by ""top-down"" mechanisms in parietal and frontal cortex that mediate the retrieval of face and object representations from long-term memory and their maintenance through visual imagery."
https://openalex.org/W2005019117,"Photoreceptor cells utilize ribbon synapses to transmit sensory signals at high resolution. Ribbon synapses release neurotransmitters tonically, with a high release rate made possible by continuous docking of synaptic vesicles on presynaptic ribbons. We have partially purified synaptic ribbons from retina and identified a major protein component called RIBEYE. RIBEYE is composed of a unique A domain specific for ribbons, and a B domain identical with CtBP2, a transcriptional repressor that in turn is related to 2-hydroxyacid dehydrogenases. The A domain mediates assembly of RIBEYE into large structures, whereas the B domain binds NAD(+) with high affinity, similar to 2-hydroxyacid dehydrogenases. Our results define a unique component of synaptic ribbons and suggest that RIBEYE evolved in vertebrates under utilization of a preexisting protein to build a unique scaffold for a specialized synapse."
https://openalex.org/W2036623899,"Mutations in mammalian Lis1 (Pafah1b1) result in neuronal migration defects. Several lines of evidence suggest that LIS1 participates in pathways regulating microtubule function, but the molecular mechanisms are unknown. Here, we demonstrate that LIS1 directly interacts with the cytoplasmic dynein heavy chain (CDHC) and NUDEL, a murine homolog of the Aspergillus nidulans nuclear migration mutant NudE. LIS1 and NUDEL colocalize predominantly at the centrosome in early neuroblasts but redistribute to axons in association with retrograde dynein motor proteins. NUDEL is phosphorylated by Cdk5/p35, a complex essential for neuronal migration. NUDEL and LIS1 regulate the distribution of CDHC along microtubules, and establish a direct functional link between LIS1, NUDEL, and microtubule motors. These results suggest that LIS1 and NUDEL regulate CDHC activity during neuronal migration and axonal retrograde transport in a Cdk5/p35-dependent fashion."
https://openalex.org/W2037835429,"Disruption of one allele of the LIS1 gene causes a severe developmental brain abnormality, type I lissencephaly. In Aspergillus nidulans, the LIS1 homolog, NUDF, and cytoplasmic dynein are genetically linked and regulate nuclear movements during hyphal growth. Recently, we demonstrated that mammalian LIS1 regulates dynein functions. Here we characterize NUDEL, a novel LIS1-interacting protein with sequence homology to gene products also implicated in nuclear distribution in fungi. Like LIS1, NUDEL is robustly expressed in brain, enriched at centrosomes and neuronal growth cones, and interacts with cytoplasmic dynein. Furthermore, NUDEL is a substrate of Cdk5, a kinase known to be critical during neuronal migration. Inhibition of Cdk5 modifies NUDEL distribution in neurons and affects neuritic morphology. Our findings point to cross-talk between two prominent pathways that regulate neuronal migration."
https://openalex.org/W2070516871,"Acetylation of histones by p300/CBP and PCAF is considered to be a critical step in transcriptional regulation. In order to understand the role of cellular activities that modulate histone acetylation and transcription, we have purified and characterized a multiprotein cellular complex that potently inhibits the histone acetyltransferase activity of p300/CBP and PCAF. We have mapped a novel acetyltransferase-inhibitory domain of this INHAT (inhibitor of acetyltransferases) complex that binds to histones and masks them from being acetyltransferase substrates. Endogenous INHAT subunits, which include the Set/TAF-Ibeta oncoprotein, associate with chromatin in vivo and can block coactivatormediated transcription when transfected in cells. We propose that histone masking by INHAT plays a regulatory role in chromatin modification and serves as a novel mechanism of transcriptional regulation."
https://openalex.org/W1986425636,"Postembryonic development of plants depends on the activity of apical meristems established during embryogenesis. The shoot apical meristem (SAM) and the root apical meristem (RAM) have similar but distinct cellular organization. Arabidopsis FASCIATA1 (FAS1) and FAS2 genes maintain the cellular and functional organization of both SAM and RAM, and FAS gene products are subunits of the Arabidopsis counterpart of chromatin assembly factor-1 (CAF-1). fas mutants are defective in maintenance of the expression states of WUSCHEL (WUS) in SAM and SCARECROW (SCR) in RAM. We suggest that CAF-1 plays a critical role in the organization of SAM and RAM during postembryonic development by facilitating stable maintenance of gene expression states."
https://openalex.org/W2018626472,Tight junctions in the cochlear duct are thought to compartmentalize endolymph and provide structural support for the auditory neuroepithelium. The claudin family of genes is known to express protein components of tight junctions in other tissues. The essential function of one of these claudins in the inner ear was established by identifying mutations in CLDN14 that cause nonsyndromic recessive deafness DFNB29 in two large consanguineous Pakistani families. In situ hybridization and immunofluorescence studies demonstrated mouse claudin-14 expression in the sensory epithelium of the organ of Corti.
https://openalex.org/W2089178397,"Anatomical rearrangement of retinogeniculate connections contributes to the refinement of synaptic circuits in the developing visual system, but the underlying changes in synaptic function are unclear. Here, we study such changes in mouse brain slices. Each geniculate cell receives a surprisingly large number of retinal inputs (>20) well after eye-specific zones are formed. All but one to three of these inputs are eliminated over a 3-week period spanning eye opening. Remaining inputs are strengthened approximately 50-fold, in part through an increase in quantal size, but primarily through an increase in the number of release sites. Changes in release probability do not contribute significantly. Thus, a redistribution of release sites from many inputs to few inputs at this late developmental stage contributes to the precise receptive fields of thalamic relay neurons."
https://openalex.org/W1985768427,"Unlike cone photoreceptors, whose light responses have a uniform time course, retinal ganglion cells are tuned to respond to different temporal components in a changing visual scene. The signals in a mammalian cone flow to three to five morphologically distinct ""OFF"" bipolar cells at a sign-conserving, glutamatergic synapse. By recording simultaneously from pairs of synaptically connected cones and OFF bipolar cells, I now show that each morphological type of OFF bipolar cell receives its signal through a different AMPA or kainate receptor. The characteristic rate at which each receptor recovers from desensitization divides the cone signal into temporal components. Temporal processing begins at the first synapse in the visual system."
https://openalex.org/W1999081109,"The GTPase Ran has recently been shown to stimulate microtubule polymerization in mitotic extracts, but its mode of action is not understood. Here we show that the mitotic role of Ran is largely mediated by the nuclear transport factor importin β. Importin β inhibits spindle formation in vitro and in vivo and sequesters an aster promoting activity (APA) that consists of multiple, independent factors. One component of APA is the microtubule-associated protein NuMA. NuMA and other APA components are discharged from importin β by RanGTP and induce spindle-like structures in the absence of centrosomes, chromatin, or Ran. We propose that RanGTP functions in mitosis as in interphase by locally releasing cargoes from transport factors. In mitosis, this promotes spindle assembly by organizing microtubules in the vicinity of chromosomes."
https://openalex.org/W1965745028,"We combined fMRI and EEG recording to study the neurophysiological responses associated with auditory stimulation across the sleep-wake cycle. We found that presentation of auditory stimuli produces bilateral activation in auditory cortex, thalamus, and caudate during both wakefulness and nonrapid eye movement (NREM) sleep. However, the left parietal and, bilaterally, the prefrontal and cingulate cortices and the thalamus were less activated during NREM sleep compared to wakefulness. These areas may play a role in the further processing of sensory information required to achieve conscious perception during wakefulness. Finally, during NREM sleep, the left amygdala and the left prefrontal cortex were more activated by stimuli having special affective significance than by neutral stimuli. These data suggests that the sleeping brain can process auditory stimuli and detect meaningful events."
https://openalex.org/W2069220164,"Fertilization and zygote development are obligate features of the malaria parasite life cycle and occur during parasite transmission to mosquitoes. The surface protein PFS48/45 is expressed by male and female gametes of Plasmodium falciparum and PFS48/45 antibodies prevent zygote development and transmission. Here, gene disruption was used to show that Pfs48/45 and the ortholog Pbs48/45 from a rodent malaria parasite P. berghei play a conserved and important role in fertilization. p48/45− parasites had a reduced capacity to produce oocysts in mosquitoes due to greatly reduced zygote formation. Unexpectedly, only male gamete fertility of p48/45− parasites was affected, failing to penetrate otherwise fertile female gametes. P48/45 is shown to be a surface protein of malaria parasites with a demonstrable role in fertilization."
https://openalex.org/W2060202251,"The NMDA receptor NR1 subunit has four splice variants that differ in their C-terminal, cytoplasmic domain. We investigated the contribution of the C-terminal cassettes, C0, C1, C2, and C2', to trafficking of NR1 in heterologous cells and neurons. We identified an ER retention signal (RRR) in the C1 cassette of NR1, which is similar to the RXR motif in ATP-sensitive K(+) channels (Zerangue et al., 1999). We found that surface expression of NR1-3, which contains C1, is due to a site on the C2' cassette, which includes the terminal 4 amino acid PDZ-interacting domain. This site suppresses ER retention of the C1 cassette and leads to surface expression. These findings suggest a role for PDZ proteins in facilitating the transition of receptors from an intracellular pool to the surface of the neuron."
https://openalex.org/W2023195093,"GABAergic interneurons have major roles in hippocampal function and dysfunction. Here we provide evidence that, in mice, virtually all of these cells originate from progenitors in the basal telencephalon. Immature interneurons tangentially migrate from the basal telencephalon through the neocortex to take up their final positions in the hippocampus. Disrupting differentiation in the embryonic basal telencephalon (lateral and medial ganglionic eminences) through loss of Dlx1/2 homeobox function blocks the migration of virtually all GABAergic interneurons to the hippocampus. On the other hand, disrupting specification of the medial ganglionic eminence through loss of Nkx2.1 homeobox function depletes the hippocampus of a distinct subset of hippocampal interneurons. Loss of hippocampal interneurons does not appear to have major effects on the early development of hippocampal projection neurons nor on the pathfinding of afferrent tracts."
https://openalex.org/W2020476760,"We investigated the role of PDZ proteins (GRIP, ABP, and PICK1) interacting with the C-terminal GluR2 by infusing a ct-GluR2 peptide (“pep2-SVKI”) into CA1 pyramidal neurons in hippocampal slices using whole-cell recordings. Pep2-SVKI, but not a control or PICK1 selective peptide, caused AMPAR-mediated EPSC amplitude to increase in approximately one-third of control neurons and in most neurons following the prior induction of LTD. Pep2-SVKI also blocked LTD; however, this occurred in all neurons. A PKC inhibitor prevented these effects of pep2-SVKI on synaptic transmission and LTD. We propose a model in which the maintenance of LTD involves the binding of AMPARs to PDZ proteins to prevent their reinsertion. We also present evidence that PKC regulates AMPAR reinsertion during dedepression."
https://openalex.org/W2000994765,"Type III secretion for injection of effector proteins into host cells has not been described for Gram-positive bacteria despite their importance in disease. Here, we describe an injection pathway for the Gram-positive pathogen Streptococcus pyogenes that utilizes streptolysin O (SLO), a cholesterol-dependent cytolysin. The data support a model in which an effector is translocated through the SLO pore by a polarized process. The effector, SPN (S. pyogenes NAD-glycohydrolase), is capable of producing the potent second messenger cyclic ADP-ribose, and SLO and SPN act synergistically to trigger cytotoxicity. These data provide a novel paradigm for the function of the cholesterol-dependent cytolysin family and its wide distribution suggests that cytolysin-mediated translocation (CMT) may be the equivalent of type III secretion for Gram-positive pathogens."
https://openalex.org/W2067890396,"LIS1, a microtubule-associated protein, is required for neuronal migration, but the precise mechanism of LIS1 function is unknown. We identified a LIS1 interacting protein encoded by a mouse homolog of NUDE, a nuclear distribution gene in A. nidulans and a multicopy suppressor of the LIS1 homolog, NUDF. mNudE is located in the centrosome or microtubule organizing center (MTOC), and interacts with six different centrosomal proteins. Overexpression of mNudE dissociates gamma-tubulin from the centrosome and disrupts microtubule organization. Missense mutations that disrupt LIS1 function block LIS1-mNudE binding. Moreover, misexpression of the LIS1 binding domain of mNudE in Xenopus embryos disrupts the architecture and lamination of the CNS. Thus, LIS1-mNudE interactions may regulate neuronal migration through dynamic reorganization of the MTOC."
https://openalex.org/W2096059852,"Neuronal process remodeling occurs widely in the construction of both invertebrate and vertebrate nervous systems. During Drosophila metamorphosis, gamma neurons of the mushroom bodies (MBs), the center for olfactory learning in insects, undergo pruning of larval-specific dendrites and axons followed by outgrowth of adult-specific processes. To elucidate the underlying molecular mechanisms, we conducted a genetic mosaic screen and identified one ultraspiracle (usp) allele defective in larval process pruning. Consistent with the notion that USP forms a heterodimer with the ecdysone receptor (EcR), we found that the EcR-B1 isoform is specifically expressed in the MB gamma neurons, and is required for the pruning of larval processes. Surprisingly, most identified primary EcR/USP targets are dispensable for MB neuronal remodeling. Our study demonstrates cell-autonomous roles for EcR/USP in controlling neuronal remodeling, potentially through novel downstream targets."
https://openalex.org/W1967972966,"The von Hippel-Lindau tumour suppressor gene (VHL) targets hypoxia inducible factor (HIF)-α subunits for ubiquitin dependent proteolysis. To better understand the role of this and other putative pathways of gene regulation in VHL function we subjected mRNA from VHL defective renal carcinoma cells and transfectants re-expressing a wild type VHL allele to differential expression profiling, and analysed VHL target genes for oxygen regulated expression. Among a group of newly identified VHL target genes the majority but not all were regulated by oxygen, indicating that whilst dysregulation of the HIF system makes a dominant contribution to alterations in transcription, VHL has other influences on patterns of gene expression. Genes newly defined as targets of the VHL/hypoxia pathway (conditionally downregulated by VHL in normoxic cells) include aminopeptidase A, collagen type V, alpha 1, cyclin G2, DEC1/Stra13, endothelin 1, low density lipoprotein receptor-related protein 1, MIC2/CD99, and transglutaminase 2. These genes have a variety of functions relevant to tumour biology. However, not all are connected with the promotion of tumour growth, some being pro-apoptotic or growth inhibitory. We postulate that co-ordinate regulation as part of the HIF pathway may explain this paradox, and that evolution of anti-apoptotic pathways may be required for tumour growth under VHL-dysregulation. Our results indicate that it will be necessary to consider the effects of abnormal activity in integral regulatory pathways, as well as the effects of individual genes to understand the role of abnormal patterns of gene expression in cancer."
https://openalex.org/W2006176820,
https://openalex.org/W2016815862,"Previous studies showed that Roundabout (Robo) in Drosophila is a repulsive axon guidance receptor that binds to Slit, a repellent secreted by midline glia. In robo mutants, growth cones cross and recross the midline, while, in slit mutants, growth cones enter the midline but fail to leave it. This difference suggests that Slit must have more than one receptor controlling midline guidance. In the absence of Robo, some other Slit receptor ensures that growth cones do not stay at the midline, even though they cross and recross it. Here we show that the Drosophila genome encodes three Robo receptors and that Robo and Robo2 have distinct functions, which together control repulsive axon guidance at the midline. The robo,robo2 double mutant is largely identical to slit."
https://openalex.org/W2077814219,"Ionotropic glutamate receptors (iGluRs) bind agonists in a domain that has been crystallized and shown to have a bilobed structure. Eukaryotic iGluRs also possess a second extracellular N-terminal domain related to the bacterial periplasmic binding protein LIVBP. In NMDA receptors, the high-affinity Zn inhibition is eliminated by mutations in the LIVBP-like domain of the NR2A subunit. Using LIVBP structure, we have modeled this domain as two lobes connected by a hinge and show that six residues controlling Zn inhibition form two clusters facing each other across a central cleft. Upon Zn binding the two lobes close tightly around the divalent cation. Thus, the extracellular region of NR2A consists of a tandem of Venus flytrap domains, one binding the agonist and the other a modulatory ligand. Such a functional organization may apply to other eukaryotic iGluRs."
https://openalex.org/W2024966724,"Two vesicle pools, readily releasable (RRP) and reserve (RP) pools, are present at Drosophila neuromuscular junctions. Using a temperature-sensitive mutant, shibirets, we studied pool sizes and vesicle mobilization rates. In shibirets, due to lack of endocytosis at nonpermissive temperatures, synaptic currents continuously declined during tetanic stimulation until they ceased as the result of vesicle depletion. By then, ∼84,000 quanta were released. Vesicles were mobilized from RP at a rate 1/7–1/10 of RRP. Cytochalasin D inhibited mobilization of vesicles from RP, allowing us to estimate the size of RRP as 14%–19% of all vesicles. Vesicle recycling supports synaptic transmission during prolonged tetanic stimulation and the maximum recycling rate was 1000 vesicles/s."
https://openalex.org/W2020035925,"In the Drosophila CNS, the midline repellent Slit acts at short range through its receptor Robo to control midline crossing. Longitudinal axons express high levels of Robo and avoid the midline; commissural axons that cross the midline express only low levels of Robo. Robo levels are in turn regulated by Comm. Here, we show that the Slit receptors Robo2 and Robo3 ensure the fidelity of this crossing decision: rare crossing errors occur in both robo2 and robo3 single mutants. In addition, low levels of either Robo or Robo2 are required to drive commissural axons through the midline: only in robo,robo2 double mutants do axons linger at the midline as they do in slit mutants. Robo2 and Robo3 levels are also tightly regulated, most likely by a mechanism similar to but distinct from the regulation of Robo by Comm."
https://openalex.org/W2086582835,"Axon pathfinding relies on the ability of the growth cone to detect and interpret guidance cues and to modulate cytoskeletal changes in response to these signals. We report that the murine POU domain transcription factor Brn-3.2 regulates pathfinding in retinal ganglion cell (RGC) axons at multiple points along their pathways and the establishment of topographic order in the superior colliculus. Using representational difference analysis, we identified Brn-3.2 gene targets likely to act on axon guidance at the levels of transcription, cell-cell interaction, and signal transduction, including the actin-binding LIM domain protein abLIM. We present evidence that abLIM plays a crucial role in RGC axon pathfinding, sharing functional similarity with its C. elegans homolog, UNC-115. Our findings provide insights into a Brn-3.2-directed hierarchical program linking signaling events to cytoskeletal changes required for axon pathfinding."
