id,abstract
https://openalex.org/W2081948388,"Although Rat-1 fibroblasts expressing c-myc constitutively are unable to arrest growth in low serum, their numbers do not increase in culture because of substantial cell death. We show this cell death to be dependent upon expression of c-myc protein and to occur by apoptosis. Regions of the c-myc protein required for induction of apoptosis overlap with regions necessary for cotransformation, autoregulation, and inhibition of differentiation, suggesting that the apoptotic function of c-myc protein is related to its other functions. Moreover, cells with higher levels of c-myc protein are more prone to cell death upon serum deprivation. Finally, we demonstrate that deregulated c-myc expression induces apoptosis in cells growth arrested by a variety of means and at various points in the cell cycle."
https://openalex.org/W2028263033,"The high mobility group (HMG) domain is a DNA-binding motif that is associated with several eukaryotic regulatory proteins, including the lymphoid enhancer-binding factor LEF-1 and the testis-determining factor SRY. Here, we provide evidence that DNA binding by the HMG domain of LEF-1 involves primarily minor groove contacts and induces a bend of approximately 130 degrees in the DNA helix. Bending was also found to accompany sequence-specific DNA binding by the SRY-HMG domain. Examining possible regulatory roles of HMG domain-induced DNA bends, we found that LEF-1 can function in a manner similar to bacterial integration host factor and facilitate communication between widely separated protein-binding sites in a recombination assay. Together with the previous observation that LEF-1 by itself is unable to augment basal promoter activity, these data suggest that HMG domain proteins can serve as ""architectural"" elements in the assembly of higher-order nucleoprotein structures."
https://openalex.org/W1562216431,"Vascular endothelial growth factor (VEGF) induces the proliferation of endothelial cells and is a potent angiogenic factor that binds to heparin. We have therefore studied the effect of heparin upon the interaction of VEGF with its receptors. Heparin, at concentrations ranging from 0.1 to 10 micrograms/ml, strongly potentiated the binding of 125I-VEGF to its receptors on endothelial cells. Scatchard analysis of 125I-VEGF binding indicates that 1 microgram/ml heparin induces an 8-fold increase in the apparent density of high affinity binding sites for VEGF, but does not significantly affect the dissociation constant of VEGF. Cross-linking experiments showed that heparin strongly potentiates the formation of the 170-, 195- and 225-kDa 125I-VEGF-receptor complexes on endothelial cells. At high 125I-VEGF concentrations (4 ng/ml), heparin preferentially enhanced the formation of the 170- and 195-kDa complexes. Preincubation of the cells with heparin, followed by extensive washes, produced a similar enhancement of subsequent 125I-VEGF binding. The binding of 125I-VEGF was completely inhibited following digestion of endothelial cells with heparinase and could be restored by the addition of exogenous heparin to the digested cells. The enhancing effect of heparin facilitated the detection of VEGF receptors on cell types that were not known previously to express such receptors. Our results suggest that cell surface-associated heparin-like molecules are required for the interaction of VEGF with its cell surface receptors."
https://openalex.org/W1550768646,"An Mr = 524,000 oligomeric protein was isolated from bovine cartilage and designated COMP (Cartilage Oligomeric Matrix Protein). The protein is composed of disulfide-bonded subunits with an apparent Mr of 100,000 each. It is markedly anionic, probably due to its high contents of aspartic acid and glutamic acid, as well as to its substitution with negatively charged carbohydrates. COMP was found in all cartilages analyzed, but could not be detected in other tissues by enzyme-linked immunosorbent assay of guanidine HCl extracts. Within a given cartilage, COMP shows a preferential localization to the territorial matrix surrounding the chondrocytes."
https://openalex.org/W1499384204,"Several approaches were used to test the hypothesis proposing a role for acyl-CoA esters in nutrient-induced insulin release (Prentki, M., and Matschinsky, F. M. (1987) Physiol. Rev. 67, 1185-1248; Corkey, B. E., Glennon, M. C., Chen, K. S., Deeney, J. T., Matschinsky, F. M., and Prentki, M. (1989) J. Biol. Chem. 264, 21608-21612). Exogenous saturated long chain fatty acids markedly potentiated glucose-induced insulin release and elevated long chain acyl-CoA esters in the clonal beta-cell line (HIT). The secretory action depended on the fatty acid chain length, occurred in the range 3-20 microM (free concentration of palmitate), and was reversible and inhibitable by the neuromodulator somatostatin. 2-Bromopalmitate, an inhibitor of carnitine palmitoyl transferase I, suppressed the oxidation of endogenous fatty acids and promoted release of insulin. Only the nutrients or the combination of nutrients that caused secretion elevated malonyl-CoA. The short-chain acyl-CoA profile of HIT cells stimulated by various nutrients was determined in the presence of the nonstimulatory fuel glutamine. Glucose and leucine each provoked similar changes in acyl-CoA compounds. Both secretagogues elevated malonyl-CoA 3-6-fold, whereas succinyl-CoA, free CoASH, acetyl-CoA, and the free CoASH to acetyl-CoA ratio remained unaltered. Furthermore, only when inhibition of fatty acid oxidation was associated with a rise in malonyl-CoA did the total (mitochondrial plus cytoplasmic) content of long chain acyl-CoA esters correlate inversely with insulin release promoted by various nutrients. The results are consistent with the concept that fuel stimuli cause a rise in malonyl-CoA which by inhibiting fatty acid oxidation increase cytosolic long chain acyl-CoA esters. These data provide further support for a model in which malonyl-CoA and long chain acyl-CoAs esters serve as metabolic coupling factors when pancreatic beta-cells are stimulated with glucose and other nutrient secretagogues."
https://openalex.org/W1979505297,"The floor plate is a cell group implicated in the control of neural cell pattern and axonal growth in the developing vertebrate nervous system. To identify molecules that might mediate the functions of the floor plate, we have used subtractive hybridization techniques to isolate floor plate-enriched cDNA clones. One such clone encodes a novel secreted protein, F-spondin, which is expressed at high levels in the floor plate. The C-terminal half of the protein contains six repeats identified previously in thrombospondin and other proteins implicated in cell adhesion. F-spondin is expressed in the floor plate at the time that axons first extend and at lower levels in the peripheral nerve. Recombinant F-spondin promotes the attachment of spinal cord and sensory neuron cells and the outgrowth of neurites in vitro. F-spondin may contribute to the growth and guidance of axons in both the spinal cord and the PNS."
https://openalex.org/W2086284430,"Brefeldin A (BFA) causes a rapid redistribution of coat proteins (e.g., gamma-adaptin) associated with the clathrin-coated vesicles that bud from the trans-Golgi network (TGN), while the clathrin-coated vesicles that bud from the plasma membrane are unaffected. gamma-Adaptin redistributes with the same kinetics as beta-COP, a coat protein associated with the non-clathrin-coated vesicles that bud from the Golgi complex. Upon removal of BFA, however, gamma-adaptin recovers its perinuclear distribution more rapidly. Redistribution of both proteins can be prevented by pretreating cells with AlF4-. Recruitment of adaptors from the cytosol onto the TGN membrane has been reconstituted in a permeabilized cell system and is increased by addition of GTP gamma S and blocked by addition of BFA. These results suggest a role for G proteins in the control of the clathrin-coated vesicle cycle at the TGN and further extend the similarities between clathrin-coated vesicles and non-clathrin-coated vesicles."
https://openalex.org/W2122670476,"Oligosaccharyltransferase catalyzes the N-linked glycosylation of asparagine residues on nascent polypeptides in the lumen of the rough endoplasmic reticulum (RER). A protein complex composed of 66, 63, and 48 kd subunits copurified with oligosaccharyltransferase from canine pancreas. The 66 and 63 kd subunits were shown by protein immunoblotting to be identical to ribophorin I and II, two previously identified RER glycoproteins that colocalize with membrane-bound ribosomes. The transmembrane segment of ribophorin I was found to be homologous to a recently proposed dolichol recognition consensus sequence. Based on a revision of the consensus sequence, we propose a model for the interaction of dolichol with the glycosyltransferases that catalyze the assembly and transfer of lipid-linked oligosaccharides."
https://openalex.org/W1528931356,"cDNA for the epithelial sialomucin episialin encodes a transmembrane molecule with a large extracellular domain, which mainly consists of repeats of 20 amino acids. Here we confirm the existence of a previously proposed proteolytic cleavage of episialin that occurs in the endoplasmic reticulum (Hilkens, J., and Buijs, F. (1988) J. Biol. Chem. 263, 4215-4222) and show that a similar cleavage takes place in in vitro translation systems. Using in vitro translation of truncated mRNAs, we map the cleavage site to a region located between 71 and 53 amino acids upstream of the transmembrane domain. Analysis of a mutant, in which this region has been deleted, indicates that the cleavage sites used in vitro and in vivo are identical or in close proximity. Both cleavage products remain associated although they are not linked through disulfide bonds. Therefore, the subunit derived from the N terminus, which represents the actual mucin-like domain, remains indirectly anchored to the cell membrane as a result of its interaction with the C-terminal subunit."
https://openalex.org/W1589060168,"Previously we had demonstrated that the termini of the arabinan component of mycobacterial cell wall arabinogalactan, the site of mycolic acid location, consists mostly of clusters of a pentaarabinofuranoside, [beta-D-Araf-(1----2)-alpha-D-Araf-(1----]2----(3 and 5)-alpha-D-Araf. Subsequently, the same arrangement was shown to dominate the non-reducing ends of lipoarabinomannan (LAM), a key component in the interaction of mycobacteria with host cell. Accordingly, we had proposed that mycobacteria universally elaborate the same Araf-containing motifs in two settings for different pathophysiological purposes. However, we now report that the termini of LAM from the virulent, Erdman, strain of Mycobacterium tuberculosis, unlike those from the attenuated H37Ra strain, are extensively capped with mannosyl (Manp) residues, either a single alpha-D-Manp, a dimannoside (alpha-D-Manp-(1----2)-alpha-D-Manp), or a trimannoside (alpha-D-Manp-(1----2)-alpha-D-Manp-(1----2)-alpha-D-Manp ). The use of monoclonal antibodies demonstrates a clear difference in the antigenicity of the basic and mannose-capped LAM. The possibility that these structures are a factor in the virulence of some strains of M. tuberculosis and represent an example of carbohydrate mimicry in mycobacterial infections is discussed."
https://openalex.org/W1514161203,"A high glutathione peroxidase activity toward phospholipid hydroperoxides is present in rat testis. The attribution of this activity to the selenoenzyme phospholipid hydroperoxide glutathione peroxidase (PHGPX) was supported by cross-reactivity with antibodies raised against pig heart PHGPX which had been purified and characterized. Rat testis PHGPX is partially cytosolic and partially linked to nuclei and mitochondria. The soluble and organelle-bound enzymes appear identical by Western blot analysis. PHGPX, but neither selenium-dependent nor non-selenium-dependent glutathione peroxidase activity, is expressed in testes only after puberty, disappears after hypophysectomy, and is partially restored by gonadotropin treatment. Specific immunostaining of testes by antiserum against PHGPX appears as a fine granular brown pattern localized throughout the cytoplasm in more immature cells but is confined to the peripheral part of the cytoplasm, the nuclear membrane, and mitochondria in maturating spermatogenic cells. As expected, immunostaining of spermatogenic cells in hypophysectomized animals was negative, but gonadotropin treatment only marginally increased the immunoreactivity. The expression of PHGPX in testes is consistent with the previously described specific requirement for selenium for synthesis of a 15-20-kDa selenoprotein which is related to the production of functional spermatozoa."
https://openalex.org/W1910940147,"Cartilage oligomeric matrix protein was isolated in the native state from the Swarm rat chondrosarcoma. A crucial step was its selective extraction with EDTA-containing buffer. The purified protein was subjected to electron microscopy using rotary shadowing and negative stain. The images allowed the construction of a structural model. The bouquet-like protein consists of five 28-nm-long arms containing a peripheral globular domain, a flexible strand, and a central assembly domain, where the five arms meet in a cylindrical structure."
https://openalex.org/W1547975753,"Exposure of bovine estrogen receptor to the metal chelators EDTA and 1,10-phenanthroline results in a loss of nonspecific DNA binding, presumably because of the removal of zinc. Nonspecific DNA binding, as measured by a DNA-cellulose binding assay, can be restored by dialysis of the aporeceptor against buffer containing zinc, cadmium, and cobalt but not with buffer containing copper or nickel. More detailed studies were carried out using a bacterially expressed polypeptide encompassing the DNA binding domain of the human estrogen receptor. Apopolypeptide fails to bind DNA specifically, as measured by mobility shift assay using a consensus estrogen response element hexamer containing oligonucleotide, but DNA binding was restored by dialysis of the apopolypeptide against buffer containing zinc, cadmium, and cobalt but not with buffer containing copper or nickel. Dissociation constants of zinc- and cadmium-reconstituted polypeptide for the estrogen response element hexamer (66 and 48 nM, respectively) are virtually indistinguishable from native polypeptide (Kd = 48 nM) whereas cobalt-reconstituted polypeptide has a lower affinity (Kd = 720 nM). However, native, zinc-, cadmium-, and cobalt-reconstituted polypeptides gave identical results in a methylation interference assay. Competition experiments with zinc and copper or nickel suggest that copper and nickel are able to bind to zinc finger residues but do so nonproductively. The relative affinities copper greater than cadmium greater than zinc greater than cobalt greater than nickel for the polypeptide were determined by a zinc blot competition assay. The ability of cadmium and cobalt to substitute for zinc in the zinc fingers demonstrates a structural flexibility in the DNA binding domain as each of these metals has slightly different ionic radii. On the other hand, subtle differences in DNA binding affinity and/or specificity could exist, which may not be detectable here. Also, the ability of metals to substitute for zinc in the DNA binding domain suggests that metal substitution in these zinc fingers in vivo may be of relevance to the toxicity and/or carcinogenicity of some of these metals."
https://openalex.org/W1482754145,"In muscle and adipocytes, glucose transport is regulated by the translocation of insulin regulatable glucose transporters (GLUT4) between an intracellular compartment and the cell surface. In these studies we have characterized the cellular compartments containing GLUT4 in rat skeletal muscle. Immunocytochemical studies showed that in unstimulated muscle, GLUT4 was not present in surface membranes. Tubulo-vesicular structures clustered in the trans Golgi reticulum were enriched in GLUT4. GLUT4 underwent translocation to the sarcolemma in response to combined stimulation with insulin and exercise. Using immunoisolation, the intracellular GLUT4 vesicles (IRGTV) were purified 300-fold over the cell homogenate. IRGTV from unstimulated muscle were not enriched in markers specific for the sarcolemma, transverse tubules, sarcoplasmic reticulum or mitochondria; this was confirmed using gel filtration chromatography. Insulin resulted in a 40% decrease in GLUT4 levels in IRGTV confirming that this represents the intracellular compartment of GLUT4. GLUT4 is a major component of the IRGTV, constituting at least 5% of total vesicle protein. A subset of polypeptides are also markedly enriched in the muscle IRGTV. In conclusion, these data suggest that translocation of GLUT4 from intracellular tubulo-vesicular structures is the major mechanism by which insulin and exercise regulate muscle glucose transport."
https://openalex.org/W1582873709,"The lipopolysaccharides of mycobacteria, lipoarabinomannan (LAM) and lipomannan (LM), of key importance in host-pathogen interaction, were recently shown to contain a phosphatidylinositol anchoring domain. We now have established that LAM and LM are based on the phosphatidylinositol mannosides, the characteristic glycophospholipids of mycobacteria. Digestion of the arabinose-free LM with an endo-alpha 1----6-mannosidase yielded evidence for the presence of the 1-(sn-glycerol-3-phospho)-D-myo-inositol-2,6-bis-alpha-D-mannopyranoside unit, indistinguishable from that derived from phosphatidylinositol dimannoside. This same inositol substitution pattern was shown to be present in LAM by methylation analysis before and after dephosphorylation. Positions C-2 and C-6 of the inositol unit of LAM are occupied by mannosyl residues and C-1 by a phosphoryl group. Partial acid hydrolysis of per-O-methylated LAM and comparison by gas chromatography-mass spectrometry of the resulting derivatized oligosaccharides with like products from phosphatidylinositol hexamannoside demonstrated that the C-6 of inositol is the point of attachment of the mannan core of LAM, which consists of an alpha 1----6-linked backbone with considerable alpha-1----2 side chains. Thus, a structural and presumably biosynthetic relationship is established between some of the membranous mannosylphosphatidylinositols described some 25 years ago and the newly emerging, biologically active lipopolysaccharides of mycobacteria."
https://openalex.org/W1522846126,"The separate catalytic roles of Zn2+ and Mg2+ and the specificity of the prenyl pyrophosphate-binding site of the rat brain protein farnesyltransferase were explored using a purified enzyme preparation. The binding of p21Hras to the enzyme was abolished by dialysis against EDTA and restored by addition of ZnCl2, as demonstrated by chemical cross-linking. The binding of the other substrate, farnesyl pyrophosphate, was independent of divalent cations, as demonstrated by gel filtration. Transfer of the enzyme-bound farnesyl group to the bound p21Hras required Mg2+. Geranylgeranyl pyrophosphate bound to the prenyl pyrophosphate-binding site with an affinity equal to that of farnesyl pyrophosphate, but the geranylgeranyl group was not transferred efficiently to p21Hras. It also was not transferred to a modified p21Hras containing COOH-terminal leucine, a protein that was shown previously to be a good substrate for a rat brain geranylgeranyltransferase. We conclude that the protein farnesyltransferase is a metalloenzyme that most likely contains Zn2+ at the peptide-binding site. It thus resembles certain metallopeptidases, including carboxypeptidase A and the angiotensin-converting enzyme. Strategies previously developed to screen for inhibitors of those enzymes may aid in the search for inhibitors of the protein farnesyltransferase."
https://openalex.org/W2041958161,"The 2.2 kb mRNA of the Dictyostelium discoideum prespore gene EB4-PSV is constitutively transcribed during growth and development, but the message is only accumulated when cells form aggregates and establish the prespore-prestalk pattern. Disruption of the pattern by mechanical disaggregation results in a rapid loss of the mRNA, while transcription remains nearly unchanged. In early development and after disaggregation, when the mRNA is unstable, a 1.8 kb antisense transcript originating from the same gene locus is detected. This RNA has apparently no coding capacity and is transcriptionally regulated by a promoter located within the translated region of the gene. Excess transcription of antisense RNA in vegetative cells and after disaggregation suggests its involvement in the control of mRNA stability. In agreement with this assumption, the inhibition of RNA synthesis during disaggregation prevents destabilization of the mRNA. This stability regulation of an endogenous mRNA is reminiscent of the loss of specific mRNAs in cells transformed with antisense constructs."
https://openalex.org/W1978660049,"We have used synchronized HeLa cells to investigate the role of the nuclear membrane in preventing rereplication in a single cell cycle. Nuclei were prepared with intact nuclear membranes using streptolysin-O or digitonin and assayed for replication in Xenopus egg extracts. Intact G1 nuclei replicate semiconservatively, but intact G2 nuclei do not replicate in egg extract. However, permeabilizing the nuclear membranes of G2 nuclei by treatment with NP-40 allows them all to replicate in egg extract under cell cycle control, suggesting that integrity of the nuclear membrane is required to distinguish G2 from G1 human nuclei and to prevent rereplication within a single cell cycle. The results are discussed in terms of the previously proposed licensing factor model."
https://openalex.org/W40584579,"Cell surface proteoglycans help present some polypeptide growth factors such as basic fibroblast growth factor (bFGF) to their receptors and may act as reservoirs for others such as transforming growth factor-beta (TGF-beta). Betaglycan, a cell surface heparan sulfate/chondroitin sulfate proteoglycan that binds TGF-beta via its core protein, is shown here to bind bFGF via its heparan sulfate chains. We investigated the potential for regulation of betaglycan by its ligands in osteoblasts, a system in which bFGF and TGF-beta have complementary effects. We report here that the apparent molecular mass of betaglycan from an osteoblast-enriched primary culture of fetal rat calvaria is decreased in response to bFGF, as detected by an increased electrophoretic migration of betaglycan. The betaglycan forms expressed in bFGF-treated osteoblasts have a reduced content of heparan sulfate GAGs, without detectable changes in the content of chondroitin sulfate GAGs or the size of the core protein. bFGF did not affect the overall population of cell-surface-associated proteins identified by sulfate labeling, which contained primarily heparan sulfate, and had only small effects on the major secreted proteoglycans, which were, by contrast, chondroitin sulfate proteoglycans. The effect of bFGF on betaglycan is therefore a selective one. These results suggest that cells can interact with members of the TGF-beta and FGF families through separate domains of the same membrane proteoglycan, and can selectively regulate the bFGF-binding carbohydrate chains of this proteoglycan in response to bFGF."
https://openalex.org/W1524798848,"The Saccharomyces cerevisiae OLE1 gene encodes the delta-9 fatty acid desaturase, an enzyme which forms the monounsaturated palmitoleic (16:1) and oleic (18:1) fatty acids from palmitoyl (16:0) or stearoyl (18:0) CoA. Previous studies demonstrated that OLE1 mRNA levels and desaturase enzyme activity are repressed when either 16:1 delta-9 and 18:1 delta-9 are added to the growth medium (1). The polyunsaturate, linoleic acid (18:2, delta-9,12), which is not a product of the enzyme, is also a strong repressor. The specificity of the OLE1 transcriptional regulatory sensor was examined by testing the response of OLE1 promoter-lacZ fusion reporter genes to fatty acids that differ in chain length, degree of unsaturation and double bond positions. Monounsaturated and polyunsaturated fatty acids that contain a delta-9 double bond are strong repressors of reporter gene activity and native OLE1 mRNA levels. Monounsaturated fatty acids containing double bonds in the delta-10, delta-11, or delta-5 positions showed no repression of reporter enzyme levels although they were rapidly incorporated into membrane lipids and some supported growth of an OLE1 gene disrupted strain. Although 17:1 delta-10 does not repress OLE1 transcription, lipid analysis showed that it replaces almost all of the endogenous 16:1 delta-9 and 18:1 delta-9 in cellular lipids and OLE1 mRNA levels are strongly repressed. This suggests that additional systems regulate desaturase activity by post-transcriptional mechanisms that differ from the transcriptional sensor in their responses to specific fatty acids."
