id,abstract
https://openalex.org/W1813348106,"Pain perception has evolved as a warning mechanism to alert organisms to tissue damage and dangerous environments. In humans, however, undesirable, excessive or chronic pain is a common and major societal burden for which available medical treatments are currently suboptimal. New therapeutic options have recently been derived from studies of individuals with congenital insensitivity to pain (CIP). Here we identified 10 different homozygous mutations in PRDM12 (encoding PRDI-BF1 and RIZ homology domain-containing protein 12) in subjects with CIP from 11 families. Prdm proteins are a family of epigenetic regulators that control neural specification and neurogenesis. We determined that Prdm12 is expressed in nociceptors and their progenitors and participates in the development of sensory neurons in Xenopus embryos. Moreover, CIP-associated mutants abrogate the histone-modifying potential associated with wild-type Prdm12. Prdm12 emerges as a key factor in the orchestration of sensory neurogenesis and may hold promise as a target for new pain therapeutics."
https://openalex.org/W363554780,"Interdisciplinary research is increasingly recognized as the solution to today's challenging scientific and societal problems, but the relationship between interdisciplinary research and scientific impact is still unclear. This paper studies the association between the degree of interdisciplinarity and the number of citations at the paper level. Different from previous studies compositing various aspects of interdisciplinarity into a single indicator, we use factor analysis to uncover distinct dimensions of interdisciplinarity corresponding to variety, balance, and disparity. We estimate Poisson models with journal fixed effects and robust standard errors to analyze the divergent relationships between these three factors and citations. We find that long-term (13-year) citations (1) increase at an increasing rate with variety, (2) decrease with balance, and (3) increase at a decreasing rate with disparity. Furthermore, interdisciplinarity also affects the process of citation accumulation: (1) although variety and disparity have positive effects on long-term citations, they have negative effects on short-term (3-year) citations, and (2) although balance has a negative effect on long-term citations, its negative effect is insignificant in the short run. These findings have important implications for interdisciplinary research and science policy."
https://openalex.org/W1496487857,"Coordination of stem cell activity with inflammatory responses is critical for regeneration and homeostasis of barrier epithelia. The temporal sequence of cell interactions during injury-induced regeneration is only beginning to be understood. Here we show that intestinal stem cells (ISCs) are regulated by macrophage-like haemocytes during the early phase of regenerative responses of the Drosophila intestinal epithelium. On tissue damage, haemocytes are recruited to the intestine and secrete the BMP homologue DPP, inducing ISC proliferation by activating the type I receptor Saxophone and the Smad homologue SMOX. Activated ISCs then switch their response to DPP by inducing expression of Thickveins, a second type I receptor that has previously been shown to re-establish ISC quiescence by activating MAD. The interaction between haemocytes and ISCs promotes infection resistance, but also contributes to the development of intestinal dysplasia in ageing flies. We propose that similar interactions influence pathologies such as inflammatory bowel disease and colorectal cancer in humans."
https://openalex.org/W1565002540,
https://openalex.org/W1794171218,
https://openalex.org/W1538241732,"Genetic epilepsy and neurodegenerative diseases are two common neurological disorders that are conventionally viewed as being unrelated. A subset of patients with severe genetic epilepsies who have impaired development and often go on to die of their disease respond poorly to anticonvulsant drug therapy, suggesting a need for new therapeutic targets. Previously, we reported that multiple GABAA receptor epilepsy mutations result in protein misfolding and abnormal receptor trafficking. We have now developed a model of a severe human genetic epileptic encephalopathy, the Gabrg2(+/Q390X) knock-in mouse. We found that, in addition to impairing inhibitory neurotransmission, mutant GABAA receptor γ2(Q390X) subunits accumulated and aggregated intracellularly, activated caspase 3 and caused widespread, age-dependent neurodegeneration. These findings suggest that the fundamental protein metabolism and cellular consequences of the epilepsy-associated mutant γ2(Q390X) ion channel subunit are not fundamentally different from those associated with neurodegeneration. Our results have far-reaching relevance for the identification of conserved pathological cascades and mechanism-based therapies that are shared between genetic epilepsies and neurodegenerative diseases."
https://openalex.org/W2119717274,"Cyclophilin A, secreted by bone marrow endothelial cells, acts as a chemotactic factor for myeloma cells, which helps explain their homing to the bone marrow and suggests a potential new therapeutic strategy. B cell malignancies frequently colonize the bone marrow. The mechanisms responsible for this preferential homing are incompletely understood. Here we studied multiple myeloma (MM) as a model of a terminally differentiated B cell malignancy that selectively colonizes the bone marrow. We found that extracellular CyPA (eCyPA), secreted by bone marrow endothelial cells (BMECs), promoted the colonization and proliferation of MM cells in an in vivo scaffold system via binding to its receptor, CD147, on MM cells. The expression and secretion of eCyPA by BMECs was enhanced by BCL9, a Wnt–β-catenin transcriptional coactivator that is selectively expressed by these cells. eCyPA levels were higher in bone marrow serum than in peripheral blood in individuals with MM, and eCyPA-CD147 blockade suppressed MM colonization and tumor growth in the in vivo scaffold system. eCyPA also promoted the migration of chronic lymphocytic leukemia and lymphoplasmacytic lymphoma cells, two other B cell malignancies that colonize the bone marrow and express CD147. These findings suggest that eCyPA-CD147 signaling promotes the bone marrow homing of B cell malignancies and offer a compelling rationale for exploring this axis as a therapeutic target for these malignancies."
https://openalex.org/W1519199517,"The human genome is diploid, and knowledge of the variants on each chromosome is important for the interpretation of genomic information. Here we report the assembly of a haplotype-resolved diploid genome without using a reference genome. Our pipeline relies on fosmid pooling together with whole-genome shotgun strategies, based solely on next-generation sequencing and hierarchical assembly methods. We applied our sequencing method to the genome of an Asian individual and generated a 5.15-Gb assembled genome with a haplotype N50 of 484 kb. Our analysis identified previously undetected indels and 7.49 Mb of novel coding sequences that could not be aligned to the human reference genome, which include at least six predicted genes. This haplotype-resolved genome represents the most complete de novo human genome assembly to date. Application of our approach to identify individual haplotype differences should aid in translating genotypes to phenotypes for the development of personalized medicine."
https://openalex.org/W390434406,"Androgenetic alopecia, known in men as male pattern baldness (MPB), is a very conspicuous condition that is particularly frequent among European men and thus contributes markedly to variation in physical appearance traits amongst Europeans. Recent studies have revealed multiple genes and polymorphisms to be associated with susceptibility to MPB. In this study, 50 candidate SNPs for androgenetic alopecia were analyzed in order to verify their potential to predict MPB. Significant associations were confirmed for 29 SNPs from chromosomes X, 1, 5, 7, 18 and 20. A simple 5-SNP prediction model and an extended 20-SNP model were developed based on a discovery panel of 305 males from various European populations fitting one of two distinct phenotype categories. The first category consisted of men below 50 years of age with significant baldness and the second; men aged 50 years or older lacking baldness. The simple model comprised the five best predictors: rs5919324 near AR, rs1998076 in the 20p11 region, rs929626 in EBF1, rs12565727 in TARDBP and rs756853 in HDAC9. The extended prediction model added 15 SNPs from five genomic regions that improved overall prevalence-adjusted predictive accuracy measured by area under the receiver characteristic operating curve (AUC). Both models were evaluated for predictive accuracy using a test set of 300 males reflecting the general European population. Applying a 65% probability threshold, high prediction sensitivity of 87.1% but low specificity of 42.4% was obtained in men aged <50 years. In men aged ≥50, prediction sensitivity was slightly lower at 67.7% while specificity reached 90%. Overall, the AUC=0.761 calculated for men at or above 50 years of age indicates these SNPs offer considerable potential for the application of genetic tests to predict MPB patterns, adding a highly informative predictive system to the emerging field of forensic analysis of externally visible characteristics."
https://openalex.org/W1495352559,"The character of EGFR signals can influence cell fate but mechanistic insights into intestinal EGFR-Ras signalling are limited. Here we show that two distinct Ras nucleotide exchange factors, RasGRP1 and SOS1, lie downstream of EGFR but act in functional opposition. RasGRP1 is expressed in intestinal crypts where it restricts epithelial growth. High RasGRP1 expression in colorectal cancer (CRC) patient samples correlates with a better clinical outcome. Biochemically, we find that RasGRP1 creates a negative feedback loop that limits proliferative EGFR-SOS1-Ras signals in CRC cells. Genetic Rasgrp1 depletion from mice with either an activating mutation in KRas or with aberrant Wnt signalling due to a mutation in Apc resulted in both cases in exacerbated Ras-ERK signalling and cell proliferation. The unexpected opposing cell biological effects of EGFR-RasGRP1 and EGFR-SOS1 signals in the same cell shed light on the intricacy of EGFR-Ras signalling in normal epithelium and carcinoma."
https://openalex.org/W1511985826,"START-Register – Survey on anTicoagulated pAtients RegisTer – is an independent, inception-cohort, observational, collaborative database aimed at recording prospectively the clinical history of adult patients starting anticoagulant treatment for any reason and using whatever drug. In this article we present the START-Register and give cross section baseline data focusing on non valvular atrial fibrillation (NVAF). Participants are asked to insert prospectively consecutive patients recorded as electronic file on the web-site of the registry. Required data are: demographic and clinical characteristics of patients, associated risk factors for stroke and bleeding, laboratory routine data, clinical indication for treatment, expected therapeutic range (in cases of treatment with vitamin K antagonists -VKAs). The follow-up is carried out to record: quality of treatment (for patients on VKAs), bleeding complications, thrombotic events, and the onset of any type of associated disease. To date 5252 patients have been enrolled; 97.6% were on VKAs because direct oral anticoagulants (DOAC) have been available in Italy only recently. The median age was 74 years [interquartile range (IQR) 64-80]; males 53.7%. This analysis is focused on the 3209 (61.1%) NVAF patients. Mean CHADS2 score was 2.1±1.1, CHADSVASc score was 3.1±1.3;median age was 76 years (IQR 70-81); 168 patients (5.3%) had severe renal failure [Creatinine clearance (CrCl) <30 ml/min]. Moderate renal failure (CrCl 30-59 ml/min) was found in 1265 patients (39.5%). The analysis of the START-Register data shows that two-third of patients who started chronic anticoagulant treatment had NVAF, one-third of them was > 80 years with high prevalence of renal failure."
https://openalex.org/W1578539153,
https://openalex.org/W100447351,"The online activity of Internet users has repeatedly been shown to provide a rich information set for various research fields. We focus on job-related searches on Google and their possible usefulness in the region of the Visegrad Group--the Czech Republic, Hungary, Poland and Slovakia. Even for rather small economies, the online searches of inhabitants can be successfully utilized for macroeconomic predictions. Specifically, we study unemployment rates and their interconnection with job-related searches. We show that Google searches enhance nowcasting models of unemployment rates for the Czech Republic and Hungary whereas for Poland and Slovakia, the results are mixed."
https://openalex.org/W331533279,"Collagen prolyl 4-hydroxylases (C-P4H-I, C-P4H-II, and C-P4H-III) catalyze formation of 4-hydroxyproline residues required to form triple-helical collagen molecules. Vertebrate C-P4Hs are α2β2 tetramers differing in their catalytic α subunits. C-P4H-I is the major isoenzyme in most cells, and inactivation of its catalytic subunit (P4ha1−/−) leads to embryonic lethality in mouse, whereas P4ha1+/− mice have no abnormalities. To study the role of C-P4H-II, which predominates in chondrocytes, we generated P4ha2−/− mice. Surprisingly, they had no apparent phenotypic abnormalities. To assess possible functional complementarity, we established P4ha1+/−;P4ha2−/− mice. They were smaller than their littermates, had moderate chondrodysplasia, and developed kyphosis. A transient inner cell death phenotype was detected in their developing growth plates. The columnar arrangement of proliferative chondrocytes was impaired, the amount of 4-hydroxyproline and the Tm of collagen II were reduced, and the extracellular matrix was softer in the growth plates of newborn P4ha1+/−;P4ha2−/− mice. No signs of uncompensated ER stress were detected in the mutant growth plate chondrocytes. Some of these defects were also found in P4ha2−/− mice, although in a much milder form. Our data show that C-P4H-I can to a large extent compensate for the lack of C-P4H-II in proper endochondral bone development, but their combined partial and complete inactivation, respectively, leads to biomechanically impaired extracellular matrix, moderate chondrodysplasia, and kyphosis. Our mouse data suggest that inactivating mutations in human P4HA2 are not likely to lead to skeletal disorders, and a simultaneous decrease in P4HA1 function would most probably be required to generate such a disease phenotype."
