id,abstract
https://openalex.org/W2909373668,"Across the Mediterranean, conservation programmes often operate concomitantly with hunting interests within game-lands. Carnivore guilds lie at the interface between contrasting management goals, being simultaneously fundamental components of ecosystems and targets of predator control to reduce predation on game species. Here, we evaluate the composition and spatial structure of a mesocarnivore community in a protected area of Southeast Portugal, with high economic investment in conservation and significant hunting activity. Between June and August 2015, we deployed 77 camera-traps across a ~80 km2 area. We report on interspecific disparities in mesocarnivore occupancy and associated environmental determinants. Contrasting occupancy states suggest an unbalanced community, biased towards the widespread occurrence of the red fox Vulpes vulpes () compared to other species (stone marten Martes foina, European badger Meles meles, Egyptian mongoose Herpestes ichneumon, common genet Genetta genetta, and Eurasian otter Lutra lutra) exhibiting spatially-restricted occupancy patterns (). The feral cat Felis silvestris catus was the exception () and, together with the stone marten, exhibited a positive association with human settlements. These findings are consistent with theoretical predictions on how mesocarnivore communities are shaped by the effects of non-selective predator control, paradoxically favouring species with higher population growth rates and dispersal abilities, such as the red fox. Our results reinforce the need to understand the role of predator control as a community structuring agent with potential unintended effects, while exposing issues hindering such attempts, namely non-selective illegal killing or biased/concealed information on legal control measures."
https://openalex.org/W2909692999,"Objectives To assess the occurrence of transient interruption of contrast (TIC) phenomenon in pulmonary computed tomography angiography (CTPA) exams performed in inspiratory breath-hold after patients were told to inspire gently. Methods In this retrospective single-centre study, CTPA exams of 225 consecutive patients scanned on a 16-slice CT scanner system were analysed. A-priori to measurements, exams were screened for inadequate pulmonary artery contrast due to incorrect bolus tracking or failure of i.v. contrast administration. Those exams were excluded. Attenuation values in the thoracic aorta and in the pulmonary trunk were assessed in duplicate measurements (M1 and M2) and the aorto-pulmonary density ratio was calculated. An aorto-pulmonary ratio > 1 with still contrast inflow being visible within the superior vena cava was defined as TIC. Results 3 patients were excluded due to incorrect bolus tracking. Final analysis was performed in 222 patients (mean age 65 ± 19 years, range 18 to 99 years). Mean density in the pulmonary trunk was 275±17 HU, in the aorta 208 ± 15 HU. Mean aorto-pulmonary ratio was 0.81± 0.29. 48 patients (21.6%) had an aorto-pulmonary ratio >1. Correlation of mean aorto-pulmonary ratio and age was: -0.213 (p = 0.001). Age was not significantly different for an aorto-pulmonary ratio >1 vs. ≤1 (p = 0.122). Both in M1 and M2, 33/222 patients presented with absolute HU values of < 200 HU within the pulmonary artery. In M1 measurements, 24 of these 33 patients (72%) fulfilled TIC criteria (M2: 25/33 patients (75%)). Conclusions TIC is a common phenomenon in CTPA studies with inspiratory breath-hold commands after patients were told to inspire gently with an incidence of 22% in our retrospective cohort. Occurrence of TIC shows a significant negative correlation with increasing age and disproportionately often occurs in patients with lower absolute contrast density values within their pulmonary arteries."
https://openalex.org/W2910153147,"Many campaigns targeting pro-environmental behavior combine multiple approaches without properly understanding how these different approaches interact. Here we study the effect of such combinations. We apply construal level theory to classify different intervention approaches, which can either be at a high construal level (abstract and distant) or at a low construal level (concrete and proximal). In a field experiment we recruited 197 students living in one-person apartments in an all-inclusive student housing facility. We objectively measured their individual electricity and warm water use, and measured psychological variables through surveys. We expected that the (commonly considered superior) combination between a high and a low construal level approach would be least effective. Participants were randomly assigned to a 2(Construal Level: low vs. high) × 2(Social Distance: low vs. high) plus control condition mixed-model design targeting a reduction in warm water use. Our findings suggest that a congruent combination at a high construal level (i.e., the high construal level condition combined with the high social distance condition) has the largest effect on warm water use and that spillover to electricity use is most likely to occur when a high construal level is used (i.e., high social distance). Moreover, especially participants who valued nature and the environment less were most strongly influenced by the combination of two high construal level approaches. In sum, our study suggests that when designing interventions one should consider the construal level and when targeting pro-environmental behavior high construal levels appear most appropriate."
https://openalex.org/W2963382481,"A terrestrial laser scanner is a fast, high-precision data acquisition device, which has been applied more and more to the research area of forest inventory. In this study, a type of automated low-cost terrestrial laser scanner was designed and implemented based on a SICK LMS-511 two-dimensional laser scanning sensor and a stepper motor. The new scanner was named BEE(developed by the department of Electronic Engineering, Beijing Forestry University), which can scan the forest trees in three dimensions. The BEE scanner and its supporting software are specifically designed for forest inventory. The specific software was developed to smoothly control the BEE scanner and to acquire the data, including the angular data, range data, and intensity data, and the data acquired by the BEE scanner could be processed into point cloud data, a range map, and an intensity map. Based on the point cloud data, the trees were detected by a single slice of the single scan in a plot, and the local ground plane was fitted for each detected tree. Then the diameter at breast height (DBH), tree height, and tree position could be estimated automatically by using the specific software. The experiments have been performed by using the BEE scanner in an artificial ginkgo forest which was located in the Haidian District of Beijing. Four 10 m × 10 m square plots were selected for the experiments. The BEE scanner scanned in the four plots and acquired the single-scan data, respectively. The DBH, tree height, and tree position of the trees in the four plots were estimated and analyzed. For comparison, manually-measured data was also collected in the four plots. The trunk detection rate for all four plots was 92.75%; the root mean square error of the DBH estimation was 1.27 cm; the root mean square error of the tree height estimation was 0.24 m; and the tree position estimation was in line with the actual position. The scanner also was tested in more natural forest in the JiuFeng Forest Park. Two plots with a radius of 5 meters were scanned. Eleven trees in the plot with a flat ground were detected and DBH were estimated. But tree detection was failed in the other plot because of the undulating ground. Experimental results show that the BEE scanner can efficiently estimate the structure parameters of plantation trees and has good potential in practical applications of forest inventory."
https://openalex.org/W2908914823,"To study if retinopathy increases the risk of stroke recurrence in stroke patients with type 2 diabetes. Also, to study if stroke patients with type 2 diabetes have an increased risk of stroke recurrence compared to non-diabetics and if stroke patients with type 2 diabetes, regardless of retinopathy, have a higher incidence of carotid stenosis. Also, to study if stroke patients with type 2 diabetes retinopathy have increased incidence of carotid stenosis.We included 445 patients with type 2 diabetes mellitus and a matched control group of 445 patients without diabetes, who had all suffered their first stroke or TIA. Information on retinopathy, risk factors and stroke recurrence were obtained from registers and medical records.Retinopathy did not increase the risk of stroke recurrence in diabetes patients, HR 0.89 (0.51-1.53), p = 0.67. The risk of stroke recurrence was not increased in diabetics compared to non-diabetes. Diabetes patients had an increased prevalence of carotid stenosis compared to non-diabetics, 1.69 (1.15-2.48), p = 0.008. The prevalence of carotid stenosis in diabetics with retinopathy was not increased compared to diabetics without retinopathy.Retinopathy is not a predictor of stroke recurrence or carotid stenosis in type 2 diabetes patients."
https://openalex.org/W2911175697,"Study objectives Untreated obstructive sleep apnea (OSA) patients have an increased risk of cardiovascular disease (CVD). Adhesion molecules, including soluble E-selectin (sE-selectin), intercellular adhesion molecule-1 (ICAM-1), and vascular adhesion molecule-1 (VCAM-1), are associated with incident CVD. We hypothesized that specific genetic variants will be associated with plasma levels of adhesion molecules in suspected OSA patients. We also hypothesized that there may be an interaction between these variants and OSA. Methods We measured levels of sE-selectin, sICAM-1 and sVCAM-1 in 491 patients with suspected OSA and genotyped them for 20 polymorphisms. Results The most significant association was between the ABO rs579459 polymorphism and sE-selectin levels (P = 7×10−21), with the major allele T associated with higher levels. The direction of effect and proportion of the variance in sE-selectin levels accounted for by rs579459 (16%) was consistent with estimates from non-OSA cohorts. In a multivariate regression analysis, addition of rs579459 improved the model performance in predicting sE-selectin levels. Three polymorphisms were nominally associated with sICAM-1 levels but none with sVCAM-1 levels. The combination of severe OSA and two rs579459 T alleles identified a group of patients with high sE-selectin levels; however, the increase in sE-selectin levels associated with severe OSA was greater in patients without two T alleles (P = 0.05 test for interaction). Conclusions These genetic polymorphisms may help to identify patients at greatest risk of incident CVD and may help in developing a more precision-based approach to OSA care."
https://openalex.org/W2911203605,"Spaceflight affects the immune system, but the effects on the antibody repertoire, responsible for humoral immunity, has not been well explored. In particular, the complex gene assembly and expression process; including mutations, might make this process vulnerable. Complementarity determining region 3 (CDR3), composed of parts of the V-(D-)J-gene segments, is very important for antigen binding and can be used as an important measure of variability. Skeletal unloading, and the physiological effects of it, parallel many impacts of space flight. Therefore, we explored the impact of skeletal unloading using the antiorthostatic suspension (AOS) model. Animals were experimentally challenged with tetanus toxoid (TT) and/or the adjuvant CpG. Blood was analyzed for anti-TT antibody and corticosterone concentrations. Whole spleen tissue was prepared for repertoire characterization. AOS animals showed higher levels of corticosterone levels, but AOS alone did not affect anti-TT serum antibody levels. Administration of CpG significantly increased the circulating anti-TT antibody concentrations. AOS did alter constant gene usage resulting in higher levels of IgM and lower levels of IgG. CpG also altered constant gene region usage increasing usage of IgA. Significant changes could be detected in multiple V-, D-, and J-gene segments in both the heavy and light chains in response to AOS, TT, and CpG treatments. Analysis of class-switched only transcripts revealed a different pattern of V-gene segment usage than detected in the whole repertoire and also showed significant alterations in gene segment usage after challenge. Alterations in V/J pairing were also detected in response to challenge. CDR3 amino acid sequence overlaps were similar among treatment groups, though the addition of CpG lowered overlap in the heavy chain. We isolated 3,045 whole repertoire and 98 potentially TT-specific CDR3 sequences for the heavy chain and 569 for the light chain. Our results demonstrate that AOS alters the repertoire response to challenge with TT and/or CpG."
https://openalex.org/W2908928672,"Annual movements have been widely described for birds migrating across the Americas and between Eurasia and Africa, yet relatively little information exists for intra-African migrants. Identifying the areas used throughout a species annual cycle by understanding migratory patterns and settlement areas during breeding and non-breeding seasons is essential for conservation initiatives. Here, we describe for the first time, the migratory patterns and settlement areas of an endangered raptor endemic to Southern Africa, the Black Harrier (Circus maurus). From 2008 to 2015, thirteen breeding adult Black Harriers were trapped in south-western South Africa and fitted either with a GPS-GSM or with a PTT tracker device. Adults were monitored for 365 ± 198 days (range: 56–819 days) revealing great individual variability in annual movements. Most Black Harriers performed an unusual West-East migration from their breeding areas, but routes of all migrating individuals covered the entire southern land area of South Africa and Lesotho. The distance travelled averaged 814 ± 324 km, but unlike many other species, migrants travelled faster during post-breeding (i.e. austral summer) (207.8 ± 113.2 km.day-1) than during pre-breeding (i.e. austral winter/spring) migrations (143.8 ± 32.2 km.day-1). Although most marked individuals displayed movements similar to those that bred following pre-breeding migrations, only two of thirteen were confirmed as breeders the year after being tagged. This suggests that individuals may sometimes take a sabbatical year in reproduction, although this requires confirmation. Most tagged birds died on migration or during the non-breeding season. Adults frequently returned to the same non-breeding settlement areas, and often used up to 3 different locations an average of about 200 km apart. On the other hand, there was wide variation in distance between subsequent reproductive events. We discuss the implications of our study for the conservation of Black Harriers and more broadly for intra-African bird migrants."
https://openalex.org/W2910259437,"Objective To characterise perceived household support for female education and the associations between educational support and HIV prevalence, HSV-2 prevalence and sexual risk behaviours. Methods This cross-sectional study used baseline survey data from the Swa Koteka HPTN 068 trial undertaken in Mpumalanga, South Africa. The study included 2533 young women aged 13–20, in grades 8–11 at baseline. HIV and HSV-2 status were determined at baseline. Information about patterns of sexual behaviour and household support for education was collected during the baseline survey. Linear regression and binary logistic regression were used to determine associations between household support for education and both biological and behavioural outcomes. Results High levels of educational support were reported across all measures. HIV prevalence was 3.2% and HSV-2 prevalence was 4.7%, both increasing significantly with age. Over a quarter (26.6%) of young women reported vaginal sex, with 60% reporting condom use at last sex. The median age of sexual debut was 16 years. Household educational support was not significantly associated with HIV or HSV-2; however, the odds of having had vaginal sex were significantly lower in those who reported greater homework supervision (OR 0.82, 95%CI: 0.72–0.94), those who engaged in regular discussion of school marks with a caregiver (OR 0.82, 95%CI: 0.71–0.95) and when caregivers had greater educational goals for the young woman (OR 0.82, 95%CI: 0.71–0.96). In contrast, greater caregiver disappointment at dropout was significantly associated with reported vaginal sex (OR 1.29, 95%CI: 1.14–1.46). Conclusion Young women in rural South Africa report experiencing high levels of household educational support. This study suggests that greater household educational support is associated with lower odds of having vaginal sex and engaging in risky sexual behaviour, though not with HIV or HSV-2 prevalence."
https://openalex.org/W2910630080,"Reconsolidation theory posits that upon retrieval, consolidated memories are destabilized and need to be restabilized in order to persist. It has been suggested that experience with a competitive task immediately after memory retrieval may interrupt these restabilization processes leading to memory loss. Indeed, using a motor sequence learning paradigm, we have recently shown that, in humans, interference training immediately after active task-based retrieval of the consolidated motor sequence knowledge may negatively affect its performance levels. Assessing changes in tapping pattern before and after interference training, we also demonstrated that this performance deficit more likely indicates a genuine memory loss rather than an initial failure of memory retrieval. Here, applying a similar approach, we tested the necessity of the hypothetical retrieval-induced destabilization of motor memory to allow its impairment. The impact of memory retrieval on performance of a new motor sequence knowledge acquired during the interference training was also evaluated. Similar to the immediate post-retrieval interference, interference training alone without the preceding active task-based memory retrieval was also associated with impairment of the pre-established motor sequence memory. Performance levels of the sequence trained during the interference training, on the other hand, were impaired only if this training was given immediately after memory retrieval. Noteworthy, an 8-hour interval between memory retrieval and interference allowed to express intact performance levels for both sequences. The current results suggest that susceptibility of the consolidated motor memory to behavioral interference is independent of its active task-based retrieval. Differential effects of memory retrieval on performance levels of the new motor sequence encoded during the interference training further suggests that memory retrieval may influence the way new information is stored by facilitating its integration within the retrieved memory trace. Thus, impairment of the pre-established motor memory may reflect interference from a competing memory trace rather than involve interruption of reconsolidation."
https://openalex.org/W2908554976,"Tumor-infiltrating immune cells can impact tumor growth and progression. The inhibitory CD200 receptor (CD200R) suppresses the activation of myeloid cells and lack of this pathway results in a reduction of tumor growth, conversely a tumorigenic effect of CD200R triggering was also described. Here we investigated the role of CD200R activation in syngeneic mouse tumor models. We showed that agonistic CD200R antibody reached tumors, but had no significant impact on tumor growth and minor effect on infiltration of immune myeloid cells. These effects were reproduced using two different anti-CD200R clones. In contrast, we showed that CD200-deficiency did decrease melanoma tumor burden. The presence of either endogenous or tumor-expressed CD200 restored the growth of metastatic melanoma foci. On the basis of these findings, we conclude that blockade of the endogenous ligand CD200 prevented the tumorigenic effect of CD200R-expressing myeloid cells in the tumor microenvironment, whereas agonistic anti-CD200R has no effect on tumor development."
https://openalex.org/W2910217950,"FnCel5A from Fervidobacterium nodosum is one of the most thermostable endoglucanases that have phenomenal characteristics, such as high activity, pH stability, and multi-specificity towards various substrates. However, large-scale thermophilic enzyme production is still a challenge. Herein, we focus on an optimization approach based on response surface methodology to improve the production of this enzyme. First, a Box-Behnken design was used to examine physiochemical parameters such as induction temperatures, isopropylβ-D-1-thiogalactopyranoside concentrations and induction times on the heterogeneous expression of FnCel5A gene in E. coli. The best culture was collected after adding 0.56 mM IPTG and incubating it for 29.5 h at 24°C. The highest enzymatic activity observed was 3.31 IU/mL. Second, an economical ""thermolysis"" cell lysis method for the liberation of the enzymes was also optimized using Box-Behnken design. The optimal levels of the variables were temperature 77°C, pH 7.71, and incubation time of 20 min, which gave about 74.3% higher activity than the well-established bead-milling cell disruption method. The maximum productivity of FnCel5A achieved (5772 IU/L) illustrated that its production increased significantly after combining both optimal models. This strategy can be scaled-up readily for overproduction of FnCel5A from recombinant E.coli to facilitate its usage in biomass energy production."
https://openalex.org/W2910504259,"Over the past decade, there has been a substantial increase in the number of beverage products containing added vitamins and minerals. Often viewed as a healthier choice by consumers, the metabolic impacts of excessive vitamin consumption are relatively unknown, especially in children. The aim of this study was to examine the effects of a widely available, vitamin fortified beverage (5h Energy Decaffeinated) on insulin sensitivity, metabolic hormones and serum metabolomic responses in adolescents. Twenty adolescents (13-19y, 10M/10F) completed two randomized trials, consuming either coloured water as placebo (PL) or a vitamin fortified, sugar free beverage (FB, 1.5ml/kg) 40min prior to a modified oral glucose tolerance test (OGTT, 1.75g/kg glucose). Samples were collected at baseline and at 30, 45, 60, 90 and 120min during the OGTT. No differences in blood glucose response were observed between the treatments. However, compared to PL, postprandial plasma C-peptide and insulin excursion was significantly greater with FB, resulting in a 28% decline in the insulin sensitivity index. This was accompanied by elevated GLP-1, glucagon and PYY responses with FB compared to PL. Serum metabolomics (1H-NMR) analysis also revealed perturbations to vitamin B-linked one carbon metabolism flux with FB consumption that became more pronounced over time. These included a transient reduction in homocysteine flux accompanied by increases in betaine, vitamin B6, vitamin B12, choline, folate and taurine. Although these impacts are likely short-lived, results show that beverages fortified with excessive amounts of vitamins are not metabolically inert, but likely result in greater insulin secretion, differential gut hormone secretion and elevated one-carbon flux to process the excessive vitamin loads."
https://openalex.org/W2908554748,"During erythropoiesis, haematopoietic stem cells (HSCs) differentiate in successive steps of commitment and specification to mature erythrocytes. This differentiation process is controlled by transcription factors that establish stage- and cell type-specific gene expression. In this study, we demonstrate that FUSE binding protein 1 (FUBP1), a transcriptional regulator important for HSC self-renewal and survival, is regulated by T-cell acute lymphocytic leukaemia 1 (TAL1) in erythroid progenitor cells. TAL1 directly activates the FUBP1 promoter, leading to increased FUBP1 expression during erythroid differentiation. The binding of TAL1 to the FUBP1 promoter is highly dependent on an intact GATA sequence in a combined E-box/GATA motif. We found that FUBP1 expression is required for efficient erythropoiesis, as FUBP1-deficient progenitor cells were limited in their potential of erythroid differentiation. Thus, the finding of an interconnection between GATA1/TAL1 and FUBP1 reveals a molecular mechanism that is part of the switch from progenitor- to erythrocyte-specific gene expression. In summary, we identified a TAL1/FUBP1 transcriptional relationship, whose physiological function in haematopoiesis is connected to proper erythropoiesis."
