id,abstract
https://openalex.org/W2803275897,"Background 
Radiologic severity may predict adverse outcomes after lower respiratory tract infection (LRI). However, few studies have quantified radiologic severity of LRIs. We sought to evaluate whether a semi-quantitative scoring tool, the Radiologic Severity Index (RSI), predicted mortality after parainfluenza virus (PIV)-associated LRI.


Methods 
We conducted a retrospective review of consecutively-enrolled adult patients with hematologic malignancy or hematopoietic stem cell transplantation and with PIV detected in nasal wash who subsequently developed radiologically-confirmed LRI. We measured RSI (range 0–72) in each chest radiograph during the first 30 days after LRI diagnosis. We used extended Cox proportional hazards models to identify factors associated with mortality after onset of LRI with all-cause mortality as our failure event.


Results 
After adjustment for patient characteristics, each 1-point increase in RSI was associated with an increased hazard of death (HR 1.13, 95% confidence interval [CI] 1.05–1.21, p = 0.0008). Baseline RSI was not predictive of death, but both peak RSI and the change from baseline to peak RSI (delta-RSI) predicted mortality (odds ratio for mortality, peak: 1.11 [95%CI 1.04–1.18], delta-RSI: 1.14 [95%CI 1.06–1.22]). A delta-RSI of ≥19.5 was 89% sensitive and 91% specific in predicting 30-day mortality.


Conclusions 
We conclude that the RSI offers precise, informative and reliable assessments of LRI severity. Progression of RSI predicts 30-day mortality after LRI, but baseline RSI does not. Our results were derived from a cohort of patients with PIV-associated LRI, but can be applied in validated in other populations of patients with LRI."
https://openalex.org/W2804527775,"Peripersonal space is a multisensory representation of the environment around the body in relation to the motor system, underlying the interactions with the physical and social world. Although changing body properties and social context have been shown to alter the functional processing of space, little is known about how changing the value of objects influences the representation of peripersonal space. In two experiments, we tested the effect of modifying the spatial distribution of reward-yielding targets on manual reaching actions and peripersonal space representation. Before and after performing a target-selection task consisting of manually selecting a set of targets on a touch-screen table, participants performed a two-alternative forced-choice reachability-judgment task. In the target-selection task, half of the targets were associated with a reward (change of colour from grey to green, providing 1 point), the other half being associated with no reward (change of colour from grey to red, providing no point). In Experiment 1, the target-selection task was performed individually with the aim of maximizing the point count, and the distribution of the reward-yielding targets was either 50%, 25% or 75% in the proximal and distal spaces. In Experiment 2, the target-selection task was performed in a social context involving cooperation between two participants to maximize the point count, and the distribution of the reward-yielding targets was 50% in the proximal and distal spaces. Results showed that changing the distribution of the reward-yielding targets or introducing the social context modified concurrently the amplitude of self-generated manual reaching actions and the representation of peripersonal space. Moreover, a decrease of the amplitude of manual reaching actions caused a reduction of peripersonal space when resulting from the distribution of reward-yielding targets, while this effect was not observed in a social interaction context. In that case, the decreased amplitude of manual reaching actions was accompanied by an increase of peripersonal space representation, which was not due to the mere presence of a confederate (control experiment). We conclude that reward-dependent modulation of objects values in the environment modifies the representation of peripersonal space, when resulting from either self-generated motor actions or observation of motor actions performed by a confederate."
https://openalex.org/W2803846766,"Among various genome editing tools available for functional genomic studies, reagents based on clustered regularly interspersed palindromic repeats (CRISPR) have gained popularity due to ease and versatility. CRISPR reagents consist of ribonucleoprotein (RNP) complexes formed by combining guide RNA (gRNA) that target specific genomics regions and a CRISPR associated nuclease (Cas). The gRNA targeting specific gene sequences may be delivered as a plasmid construct that needs to be transcribed or as a synthetic RNA. The Cas nuclease can be introduced as a plasmid construct, mRNA, or purified protein. The efficiency of target editing is dependent on intrinsic factors specific to each species, the target gene sequence, and the delivery methods of CRISPR gRNA and the Cas nuclease. Although intrinsic factors affecting genome editing may not be altered in most experiments, the delivery method for CRISPR/Cas reagents can be optimized to produce the best results. In this study, the efficiency of genome editing by CRISPR/Cas system in the bollworm, Helicoverpa zea (Boddie), was evaluated using ribonucleoprotein (RNP) complexes assembled by binding synthetic gRNA with purified Cas9 nuclease engineered with nuclear localization signals to target the vermillion (eye color) gene. Mutation rates of adults emerging from embryos microinjected with 1, 2, or 4 μM RNP complexes were compared using replicated experiments. Embryos injected with 2 or 4 μM RNP complexes displayed significantly higher mutation rates (>88%) in surviving adults compared to those injected with 1 μM. The hatch rate in embryos injected with RNP complexes and with injection buffer only (mock injections) was reduced by 19.8(±5.2)% compared to noninjected control embryos, but did not differ significantly between injected embryos. Evaluation of potential off-target sites in H. zea genome did not identify any mutations. This study demonstrates that in vitro assembled synthetic RNP complexes can be used to obtain high genome editing rates in a reproducible manner in functional genomics or genetic manipulation studies."
https://openalex.org/W2803310278,"Background Growth differentiation factor-15 (GDF-15), Cystatin C and C-reactive protein (CRP) have been discussed as biomarkers for prediction of cardiac diseases. The aim of this study was to investigate the predictive value of single and repeated measurements of GDF-15 compared to Cystatin C and CRP for incidence of heart failure (HF) and death due to coronary heart disease (CHD) in the general population. Methods and results Levels of GDF-15, CRP and Cystatin C were determined in three repeated measurements collected 5 years apart in the DAN-MONICA (Danish-Multinational MONitoring of trends and determinants in Cardiovascular disease) cohort (participants at baseline n = 3785). Cox regression models adjusted for cardiovascular risk factors revealed significantly increased hazard ratios (HR) for GDF-15 for incident HF 1.36 (HR per interquartile range (IQR) increase, 95% confidence interval (CI): 1.16; 1.59) and for death from CHD 1.51 (HR per IQR increase, 95% CI: 1.31, 1.75) (both with p<0.001). Joint modeling of time-to-event and longitudinal GDF-15 over a median 27-year follow-up period showed that the marker evolution was positively associated with death of CHD (HR per IQR increase 3.02 95% CI: (2.26, 4.04), p < 0.001) and HF (HR per IQR increase 2.12 95% CI: (1.54, 2.92), p<0.001). However using Cox models with follow-up time starting at the time of the third examination, serial measurement of GDF-15, modeled as changes between the measurements, did not improve prediction over that of the most recent measurement. Conclusions GDF-15 is a promising biomarker for prediction of HF and death due to CHD in the general population, which may provide prognostic information to already established clinical biomarkers. Repeated measurements of GDF-15 displayed only a slight improvement in the prediction of these endpoints compared to a single measurement."
https://openalex.org/W2804388633,"Cystic echinococcosis (CE), a parasitic disease caused by the cestode Echinococcus granulosus sensu lato (s.l.), is a worldwide zoonotic infection. Although endemic in Chile, information on the molecular characteristics of CE in livestock remains scarce. Therefore we aimed to describe the status of infection with E. granulosus s.l. in cattle from central Chile and also to contribute to the study of the molecular epidemiology of this parasite. According to our results, the prevalence of CE is 18.84% in cattle, similar to previous reports from Chile, suggesting that the prevalence in Santiago Metropolitan area has not changed in the last 30 years. Most of the cysts were found only in lungs (51%), followed by concurrent infection in liver and lungs (30%), and only liver (19%). Molecular characterization of the genetic diversity and population structure of E. granulosus s.l. from cattle in central Chile was performed using a section of the cytochrome c oxidase subunit 1 (cox1) mitochondrial gene. E. granulosus sensu stricto (s.s.) (G1-G3 genotypes) was confirmed by RFLP-PCR to be the dominant species affecting cattle (284 samples/290 samples); we also report for the first time in Chile the presence of E. ortleppi (G5 genotype) (2 samples/61 samples). The Chilean E. granulosus s.s. parsimony network displayed 1 main haplotype. Additional studies using isolates from many locations across Chile and different intermediate hosts will provide more data on the molecular structure of E. granulosus s.s. within this region. Likewise, investigations of the importance of E. ortleppi in human infection in Chile deserve future attention."
https://openalex.org/W2803430423,"Antimicrobial peptides (AMPs) are a diverse group of molecules which play an important role in the innate immune response. Bovine NK-lysins, a type of AMP, have been predominantly found in the granules of cytotoxic T-lymphocytes and NK-cells. Bovine NK-lysin-derived peptides demonstrate antimicrobial activity against various bacterial pathogens, including several involved in bovine respiratory disease complex (BRDC) in cattle; however, such studies are yet to be performed with one important contributor to the BRDC, Mycoplasma bovis. Therefore, the goal of this study was to assess the antimicrobial activity of bovine NK-lysin-derived peptides on M. bovis. Thirty-mer synthetic peptides corresponding to the functional region helices 2 and 3 of bovine NK-lysins NK1, NK2A, NK2B, and NK2C were evaluated for killing activity on M. bovis isolates. Among four peptides, NK2A and NK2C showed the highest antimicrobial activity against the M. bovis isolates tested. All four NK-lysin peptides induced rapid plasma membrane depolarization in M. bovis at two concentrations tested. However, based on propidium iodide uptake, only NK2A and NK2C appeared capable of causing structural damage to M. bovis plasma membrane. Confocal microscopy, flow cytometry, and transmission electron microscopy further suggested NK-lysin-induced damage to the plasma membrane. Taken together, the findings in this study suggest that plasma membrane depolarization alone was insufficient to induce lethality, but disruption/permeabilization of the M. bovis plasma membrane was the cause of lethality."
https://openalex.org/W2804818985,"Objective To investigate variables associated at baseline (cross-sectional design) and at one year (longitudinal design) with the quality of sleep in chronic tension-type headache (CTTH). Methods One hundred and eighty (n = 180) and 135 individuals with CTTH participated in the cross-sectional and longitudinal design respectively. Clinical features were collected with a 4-weeks headache diary at baseline and one-year follow-up. Sleep quality was assessed at baseline and 1-year follow-up with the Pittsburgh Sleep Quality Index. Anxiety and depression (Hospital Anxiety and Depression Scale-HADS), burden of headache (Headache Disability Inventory-HDI), quality of life (SF-36 questionnaire), and pressure pain thresholds (PPTs) at trigeminal, extra-trigeminal and widespread area were assessed at baseline. Hierarchical regression analyses were conducted to determine the associations between variables at baseline and 1-year follow-up with sleep quality. Results At baseline positive correlations between sleep quality and headache intensity, headache frequency, headache duration, emotional and physical burden of headache and depression were observed. The regression analyses found that depression and emotional burden of headache explained 27.5% of the variance in sleep quality at baseline (r2 = .262; F = 23.72 P < .001). At one-year, sleep quality was significantly associated with baseline burden of headache, depression, widespread PPTs, vitality and mental health domains. Regression analyses revealed that vitality, PPT over the second metacarpal and PPT over the neck explained 30.0% of the variance of sleep quality at one-year (r2 = .269, F = 9.71, P < .001). Conclusions It seems that sleep quality exhibits a complex interaction in individuals with CTTH since depression and the emotional burden were associated with sleep quality at baseline, but vitality and PPTs over extra-trigeminal areas were associated with the quality of sleep at one-year."
https://openalex.org/W2804676851,"The essential oils of Cymbopogon citratus (CC), Pelargonium graveolens (PG) and Vetiveria zizanioides (VZ) are commonly used topically to prevent mosquito bites and thus the risk of infection by their vectored pathogens such as arboviruses. However, since mosquito bites are not fully prevented, the effect of these products on the level of viral infection remains unknown.To evaluate in vitro the essentials oils from Reunion Island against one archetypal arbovirus, the Ross River virus (RRV), and investigate the viral cycle step that was impaired by these oils.The essential oils were extracted by hydrodistillation and analyzed by a combination of GC-FID and GC×GC-TOF MS techniques. In vitro studies were performed on HEK293T cells to determine their cytotoxicity, their cytoprotective and virucidal capacities on RRV-T48 strain, and the level of their inhibitory effect on the viral replication and residual infectivity prior, during or following viral adsorption using the reporter virus RRV-renLuc.Each essential oil was characterized by an accurate quantification of their terpenoid content. PG yielded the least-toxic extract (CC50 > 1000 μg.mL-1). For the RRV-T48 strain, the monoterpene-rich CC and PG essential oils reduced the cytopathic effect but did not display virucidal activity. The time-of-addition assay using the gene reporter RRV-renLuc showed that the CC and PG essential oils significantly reduced viral replication and infectivity when applied prior, during and early after viral adsorption. Overall, no significant effect was observed for the low monoterpene-containing VZ essential oil.The inhibitory profiles of the three essential oils suggest the high value of the monoterpene-rich essential oils from CC and PG against RRV infection. Combined with their repellent activity, the antiviral activity of the essential oils of CC and PG may provide a new option to control arboviral infection."
https://openalex.org/W2463946586,"Cooperative breeding is an excellent example of cooperation in social groups. Domestic dogs have evolved from cooperatively hunting and breeding ancestors but have adapted to a facultatively social scavenging lifestyle on streets, and solitary living in human homes. Pets typically breed and reproduce under human supervision, but free-ranging dogs can provide insights into the natural breeding ecology of dogs. We conducted a five year-long field based behavioural study on parental care of free-ranging dogs in India. 23 mother-litter units, belonging to 15 groups were observed, which revealed the presence of widespread allo-parenting by both adult males and females. While all the females were known to be related to the pups receiving care, the relatedness with the males could not be determined. Hence, we coined the term “putative father” for caregiving males. Allomothers provided significantly less care than the mothers, but the putative fathers showed comparable levels of care with the mothers. Mothers invested more effort in nursing and allogrooming, while the putative fathers played and protected more. Our observations provide support for both the “benefit-of-philopatry” and “assured fitness returns” hypotheses. Free-ranging dogs are not cooperative breeders like wolves but are rather communal breeders; their breeding biology bearing interesting similarities with the human joint family system. This breeding strategy is likely to have played an important role in increasing pup survival in a stochastic environment and helping to adapt to living among humans during the domestication of dogs."
https://openalex.org/W2803560285,"Production of the iron regulatory peptide hepcidin is tightly controlled by a network of proteins in hepatocytes that sense levels of iron in the circulation (as diferric-transferrin) and in tissues (in ferritin). Human studies show high variability in the normal range of serum hepcidin levels. We have postulated that this may, in part, be related to inter-individual variability in the expression of genes in the iron sensing pathway, potentially governed by epigenetic factors. Here, we have investigated whether genes encoding hepatic iron sensing proteins and hepcidin are regulated by DNA methylation. Experiments were performed on two human hepatoma cell lines, HepG2 cells and Huh7 cells. Basal expression of TFR2 and HAMP was significantly lower in Huh7 cells compared with HepG2 cells. Analysis of bisulphite-converted DNA from Huh7 cells revealed partial methylation of TFR2 (alpha transcript), which could result in gene silencing. Demethylation using 5-aza-2’-deoxycitidine (AZA) increased TFR2 mRNA expression in Huh7. PCR analysis of bisulphite-converted HAMP promoter DNA, using methylation-specific primers, revealed no differences between cell lines. However, HAMP mRNA expression in Huh7 was increased by AZA treatment, suggesting that methylation of one or more iron sensing genes may indirectly influence HAMP expression. Our study provides evidence that DNA methylation might control expression of HAMP and other hepatic iron sensing genes, and indicates that epigenetic influences on iron homeostasis warrant further investigation."
https://openalex.org/W2803959572,"The mammalian secretoglobin (SCGB) superfamily contains functionally diverse members, among which the major cat allergen Fel d 1 and mouse salivary androgen-binding protein (ABP) display similar subunits. We searched for molecular similarities between Fel d 1 and ABP to examine the possibility that they play similar roles. We aimed to i) cluster the evolutionary relationships of the SCGB superfamily; ii) identify divergence patterns, structural overlap, and protein-protein docking between Fel d 1 and ABP dimers; and iii) explore the residual interaction between ABP dimers and steroid binding in chemical communication using computational approaches. We also report that the evolutionary tree of the SCGB superfamily comprises seven unique palm-like clusters, showing the evolutionary pattern and divergence time tree of Fel d 1 with 28 ABP paralogs. Three ABP subunits (A27, BG27, and BG26) share phylogenetic relationships with Fel d 1 chains. The Fel d 1 and ABP subunits show similarities in terms of sequence conservation, identical motifs and binding site clefts. Topologically equivalent positions were visualized through superimposition of ABP A27:BG27 (AB) and ABP A27:BG26 (AG) dimers on a heterodimeric Fel d 1 model. In docking, Fel d 1-ABP dimers exhibit the maximum surface binding ability of AG compared with that of AB dimers and the several polar interactions between ABP dimers with steroids. Hence, cat Fel d 1 is an ABP-like molecule in which monomeric chains 1 and 2 are the equivalent of the ABPA and ABPBG monomers, respectively. These findings suggest that the biological and molecular function of Fel d 1 is similar to that of ABP in chemical communication, possibly via pheromone and/or steroid binding."
https://openalex.org/W2803523730,"The elaborate anatomy of hands and feet is shaped by coordinated formation of digits and regression of the interdigital mesenchyme (IM). A failure of this process causes persistence of interdigital webbing and consequently cutaneous syndactyly. Bone morphogenetic proteins (BMPs) are key inductive factors for interdigital cell death (ICD) in vivo. NOGGIN (NOG) is a major BMP antagonist that can interfere with BMP-induced ICD when applied exogenously, but its in vivo role in this process is unknown. We investigated the physiological role of NOG in ICD and found that Noggin null mice display cutaneous syndactyly and impaired interdigital mesenchyme specification. Failure of webbing regression was caused by lack of cell cycle exit and interdigital apoptosis. Unexpectedly, Noggin null mutants also exhibit increased Indian hedgehog (Ihh) expression within cartilage condensations that leads to aberrant extension of IHH downstream signaling into the interdigital mesenchyme. A converse phenotype with increased apoptosis and reduced cell proliferation was found in the interdigital mesenchyme of Ihh mutant embryos. Our data point towards a novel role for NOG in balancing Ihh expression in the digits impinging on digit-interdigit cross talk. This suggests a so far unrecognized physiological role for IHH in interdigital webbing biology."
https://openalex.org/W2804325655,"There is considerable interest in the ex vivo propagation of primary human basal epithelial stem/progenitor cells with a view to their use in drug development, toxicity testing and regenerative medicine. These cells can be expanded in co-culture with mitotically inactivated 3T3-J2 murine embryonic feeder cells but, similar to other epithelial cell culture systems employing 3T3-J2 cells, the aspects of cross-talk between 3T3-J2 cells and human airway basal cells that are critical for their expansion remain largely unknown. In this study, we investigated secreted growth factors that are produced by 3T3-J2 cells and act upon primary human airway basal cells. We found robust production of hepatocyte growth factor (HGF) from fibroblast feeder cells following mitotic inactivation. Consistent with the limited cross-species reactivity of murine HGF on the human HGF receptor (MET; HGFR), MET inhibition did not affect proliferative responses in human airway basal cells and HGF could not replace feeder cells in this culture system. However, we found that murine HGF is not completely inactive on human airway epithelial cells or cancer cell lines but stimulates the phosphorylation of GRB2-associated-binding protein 2 (GAB2) and signal transducer and activator of transcription 6 (STAT6). Although HGF induces phosphorylation of STAT6 tyrosine 641 (Y641), there is no subsequent STAT6 nuclear translocation or STAT6-driven transcriptional response. Overall, these findings highlight the relevance of cross-species protein interactions between murine feeder cells and human epithelial cells in 3T3-J2 co-culture and demonstrate that STAT6 phosphorylation occurs in response to MET activation in epithelial cells. However, STAT6 nuclear translocation does not occur in response to HGF, precluding the transcriptional activity of STAT6."
https://openalex.org/W2804458254,"Electromagnetic field (EMF) technology has the potential to improve scientific data capture and welfare assessment by allowing automated data collection from individual cages. However, it is important to determine any impact that a new technology itself may have on animal welfare, and previous studies have found contrasting results of EMF on laboratory rodent anxiety-like behaviour and cognition. We therefore investigated whether there was an effect of low frequency EMF experienced continuously over a six-week period, as an integral part of the animal housing system, on measures of mouse anxiety-related behaviour, cognition and welfare. We housed mice (N = 80) of two strains (BALB/cAnNCrl and C57BL/6NCrl) separately in Individually Ventilated Cages (IVCs) in groups of four, either with the EMF plate turned ‘on’ or ‘off’ (n = 5). Some measures, e.g. food and water utilisation, were collected at regular intervals, whereas measures of anxiety-like behaviour (e.g. open field test) and cognitive performance (novel-object recognition test) were collected only at the end of the study. We found expected strong strain differences in most measures, e.g. latency to leave the starting square in an open field test, with C57BL/6NCrl mice moving away sooner, and interactions between strain and time for those measures recorded at more than one time point, e.g. significant weight gain over time for both strains, but with BALB/cAnNCrl mice weighing more. However, we found no significant effects of treatment (EMF ‘on’/‘off’) for any of the measures collected. These results indicate that, for the measures recorded here, there was no measurable impact on the behaviour and welfare of low frequency EMF exposure experienced continuously over a six-week period. Housing systems that include EMF monitoring technology may therefore be suitable for use without influencing either animal welfare or scientific outcomes."
