id,abstract
https://openalex.org/W3176951453,"Skin and soft tissue infections (SSTI) caused by Panton-Valentine leukocidin (PVL)-producing strains of Staphylococcus aureus (PVL-SA) are associated with recurrent skin abscesses. Secondary prevention, in conjunction with primary treatment of the infection, focuses on topical decolonization. Topical decolonization is a standard procedure in cases of recurrent PVL-SA skin infections and is recommended in international guidelines. However, this outpatient treatment is often not fully reimbursed by health insurance providers, which may interfere with successful PVL-SA decolonization.Our goal was to estimate the cost effectiveness of outpatient decolonization of patients with recurrent PVL-SA skin infections. We calculated the average cost of treatment for PVL-SA per outpatient decolonization procedure as well as per in-hospital stay.The study was conducted between 2014 and 2018 at a German tertiary care university hospital. The cohort analyzed was obtained from the hospital's microbiology laboratory database. Data on medical costs, DRG-based diagnoses, and ICD-10 patient data was obtained from the hospital's financial controlling department. We calculated the average cost of treatment for patients admitted for treatment of PVL-SA induced skin infections. The cost of outpatient treatment is based on the German regulations of drug prices for prescription drugs.We analyzed a total of n = 466 swabs from n = 411 patients with recurrent skin infections suspected of carrying PVL-SA. PVL-SA was detected in 61.3% of all patients included in the study. Of those isolates, 80.6% were methicillin-susceptible, 19.4% methicillin-resistant. 89.8% of all patients were treated as outpatients. In 73.0% of inpatients colonized with PVL-SA the main diagnosis was SSTI. The median length of stay was 5.5 days for inpatients colonized with PVL-SA whose main diagnosis SSTI; the average cost was €2,283. The estimated costs per decolonization procedure in outpatients ranged from €50-€110, depending on the products used.Our data shows that outpatient decolonization offers a highly cost-effective secondary prevention strategy, which may prevent costly inpatient treatments. Therefore, health insurance companies should consider providing coverage of outpatient treatment of recurrent PVL-SA skin and soft tissue infections."
https://openalex.org/W3177190867,"A living-donor kidney transplant (LDKT) is one of the best treatments for kidney failure. The UK's LDKT activity falls behind that of many other countries, and there is evidence of socioeconomic inequity in access. We aimed to develop a UK-specific multicomponent intervention to support eligible individuals to access a LDKT. The intervention was designed to support those who are socioeconomically-deprived and currently disadvantaged, by targeting mediators of inequity identified in earlier work. We identified three existing interventions in the literature which target these mediators: a) the Norway model (healthcare practitioners contact patients' family with information about kidney donation), b) a home education model, and c) a Transplant candidate advocate model. We undertook intervention development using the Person-Based Approach (PBA). We performed in-depth qualitative interviews with people with advanced kidney disease (n = 13), their family members (n = 4), and renal and transplant healthcare practitioners (n = 15), analysed using thematic analysis. We investigated participant views on each proposed intervention component. We drafted intervention resources and revised these in light of comments from qualitative 'think-aloud' interviews. Four general themes were identified: i) Perceived cultural and societal norms; ii) Influence of family on decision-making; iii) Resource limitation, and iv) Evidence of effectiveness. For each intervention discussed, we identified three themes: for the Norway model: i) Overcoming communication barriers and assumptions; ii) Request from an official third party, and iii) Risk of coercion; for the home education model: i) Intragroup dynamics; ii) Avoidance of hospital, and iii) Burdens on participants; and for the transplant candidate advocates model: i) Vested interest of advocates; ii) Time commitment, and iii) Risk of misinformation. We used these results to develop a multicomponent intervention which comprises components from existing interventions that have been adapted to increase acceptability and engagement in a UK population. This will be evaluated in a future randomised controlled trial."
https://openalex.org/W3173759037,"Common mental disorders present the main reason for registered sick leave in Sweden today, and women are at a higher risk of such sick leave than men. The aim of this paper is to explore how employees on sick leave for common mental disorders experience interventions and rehabilitation activities during return-to-work, as well as to explore similarities and differences between the experiences of the interviewed women and men.A qualitative design was applied with semi-structured focus group interviews. Seven focus groups were conducted with a total of 28 participants (13 women and 15 men). The focus group discussions were audiotaped and transcribed verbatim, and data analyzed with conventional content analysis. Similarities and differences in the women's and men's experiences were written down in reflective notes during all steps of the analysis.The results comprise of one main category, ""To be met with respect and recognition"", and subcategories at two levels. Both similarities and differences emerged in how women and men sick-listed because of common mental disorders experienced return-to-work interventions and rehabilitation activities. It was important for both women and men to be met with respect and recognition, which was essential to all forms of help that the participants discussed during the focus group interviews. Women expressed a need for home-related interventions, whereas men expressed a need for organizational interventions to counter feelings of resignation at work. Women could also more easily understand their mental health condition as compared with men.A key implication of this study is that research on interventions and rehabilitation activities during return-to-work among employees on sick leave for common mental disorders should consider whether the findings are relevant equally to both women and men. Similarly, return-to-work professionals may need to consider possible differences among women and men on sick leave for common mental disorders, and to further customize offered interventions and rehabilitation activities. Doing so may help enhance the effectiveness of such interventions."
https://openalex.org/W3174016831,"ABCC multidrug resistance-associated proteins (ABCCs/MRPs), a subfamily of ABC transporters, are involved in multiple physiological processes. Although these proteins have been characterized in some plants, limited efforts have been made to address their possible roles in Rehmannia glutinosa, a medicinal plant. Here, we scanned R. glutinosa transcriptome sequences and identified 18 RgABCC genes by in silico analysis. Sequence alignment revealed that the RgABCCs were closely phylogenetically related and highly conserved with other plant ABCCs/MRPs. Subcellular localization revealed that most of the RgABCCs were deposited in vacuoles and a few in plasma membranes. Tissue-specific expression of the RgABCCs indicated significant specific accumulation patterns, implicating their roles in the respective tissues. Differential temporal expression patterns of the RgABCCs exhibited their potential roles during root development. Various abiotic stress and hormone treatment experiments indicated that some RgABCCs could be transcriptionally regulated in roots. Furthermore, the transcription of several RgABCCs in roots was strongly activated by cadmium (Cd), suggesting possible roles under heavy metal stresses. Functional analysis of RgABCC1 heterologous expression revealed that it may increase the tolerance to Cd in yeast, implying its Cd transport activity. Our study provides a detailed inventory and molecular characterization of the RgABCCs and valuable information for exploring their functions in R. glutinosa."
https://openalex.org/W3174119090,"To address the need for simple, safe, sensitive, and scalable SARS-CoV-2 tests, we validated and implemented a PCR test that uses a saliva collection kit use at home. Individuals self-collected 300 μl saliva in vials containing Darnell Rockefeller University Laboratory (DRUL) buffer and extracted RNA was assayed by RT-PCR (the DRUL saliva assay). The limit of detection was confirmed to be 1 viral copy/μl in 20 of 20 replicate extractions. Viral RNA was stable in DRUL buffer at room temperature up to seven days after sample collection, and safety studies demonstrated that DRUL buffer immediately inactivated virus at concentrations up to 2.75x106 PFU/ml. Results from SARS-CoV-2 positive nasopharyngeal (NP) swab samples collected in viral transport media and assayed with a standard FDA Emergency Use Authorization (EUA) test were highly correlated with samples placed in DRUL buffer. Direct comparison of results from 162 individuals tested by FDA EUA oropharyngeal (OP) or NP swabs with co-collected saliva samples identified four otherwise unidentified positive cases in DRUL buffer. Over six months, we collected 3,724 samples from individuals ranging from 3 months to 92 years of age. This included collecting weekly samples over 10 weeks from teachers, children, and parents from a pre-school program, which allowed its safe reopening while at-risk pods were quarantined. In sum, we validated a simple, sensitive, stable, and safe PCR-based test using a self-collected saliva sample as a valuable tool for clinical diagnosis and screening at workplaces and schools."
https://openalex.org/W3174629244,"We investigated circulatory dynamics in patients with vasodepressor type neurally mediated syncope (VT-NMS) by performing high-resolution Holter electrocardiography and a correlation analysis of changes in adenylate cyclase activity, blood pressure, and pulse during the head-up tilt test. Holter electrocardiography was performed for 30 patients. Adenylate cyclase activity was evaluated in lymphocytes from blood samples taken at rest and during the head-up tilt test. There was no change in autonomic nerve fluctuation during electrocardiography in VT-NMS patients, but our results showed a significant difference in blood pressure and adenylate cyclase activity between VT-NMS patients and healthy volunteers; the systolic blood pressure of VT-NMS patients decreased after 5 min, while at 10 min, the adenylate cyclase activity was the highest (0.53%) and the systolic blood pressure was the lowest (111.8 mm Hg). Pulse rates increased after 10 min. VT-NMS patients showed higher blood pressure, pulse rate, and adenylate cyclase activity during the tilt test than did healthy volunteers. In patients with syncope, standing for longer than 10 minutes may increase the risk of VT-NMS. From our results, we consider it likely that high systolic blood pressure and adenylate cyclase activity at rest cause fainting in VT-NMS patients. Our findings may be helpful for identifying individuals with a high risk of developing NMS in the healthy population."
https://openalex.org/W3175902202,"The risk for outdoor falls tends to increase during winter due to icy road conditions. Several Swedish municipalities have introduced programs that provide their senior citizens with a pair of ice cleats in an attempt to tackle this problem. In this paper, we perform a process evaluation to identify potential barriers to the success of these programs and analyze the logic of their design.We sent a survey to all 290 Swedish municipalities to collect data on the characteristics of ice cleat distribution programs. We also performed focus-group interviews with older adults to gain insight into their thoughts about ice cleat programs. We synthesized our data with existing literature on ice cleats and behavior change theory to populate a logic model to identify and analyze hidden assumptions and potential flaws using program theory analysis.On average, about 40% of the eligible population living in the intervention municipalities collected a pair of ice cleats. While we identified some other, but mostly minor, barriers to implementation, the main barrier appears to be a lack of scale (i.e., insufficient procurement and distribution of ice cleats), as 90% of all purchased ice cleats were eventually distributed. While previous research suggests that ice cleats can decrease injury risks if worn, we find that there is limited evidence on the effects of distribution on ice cleat use. Our interviewees emphasized the potential utility of ice cleats for staying safe and active during winter but stressed that ice cleats need to be user-friendly and of high-quality to increase the likelihood that a distribution program encourages behavior change.Existing ice cleat distribution programs appear to have reached a meaningful share of the targeted population. Additional research is required to assess their effects on ice cleat use and injury rates."
https://openalex.org/W3176011160,"Two studies explored whether and how mindfulness relates with citizens’ tax evasion intentions and support for progressive tax rates. Based on theoretical and empirical grounds, in Study 1 ( N = 1,175) we proposed that mindfulness would be negatively related with tax evasion intentions through decreased social dominance orientation. Drawing on Duckitt’s dual-process motivational model, in Study 2 ( N = 722) we proposed that mindfulness would be positively related with support for progressive taxation through the mediation of lower competitive-jungle beliefs, and then lower social dominance orientation. Instead, we did not expect to find mediation of the link between mindfulness and support for progressive taxation through dangerous-world beliefs and right-wing authoritarianism. These studies inform about the motivational pathways through which mindfulness relates with tax evasion intentions and support for progressive taxation."
https://openalex.org/W3174790315,"Background Allogeneic hematopoietic stem cell transplantation (HCT) is an often curative intent treatment, however it is associated with significant gastrointestinal (GI) toxicity and treatment related mortality. Graft-versus-host disease is a significant contributor to transplant-related mortality. We performed a phase 2 trial of the somatostatin analog pasireotide to prevent gastrointestinal toxicity and GVHD after myeloablative allogeneic HCT. Methods Patients received 0.9mg pasireotide every 12 hours from the day prior to conditioning through day +4 after HCT (or a maximum of 14 days). The primary outcomes were grade 3–4 gastrointestinal toxicity through day 30 and acute GVHD. Secondary outcomes were chronic GVHD, overall survival and relapse free survival at one year. Stool and blood samples were collected from before and after HCT for analyses of stool microbiome, local inflammatory markers, and systemic inflammatory and metabolic markers. Results were compared with matched controls. Results Twenty-six patients received pasireotide and were compared to 52 matched contemporaneous controls using a 1–2 match. Grade 3–4 GI toxicity occurred in 21 (81%) patients who received pasireotide and 35 (67%) controls (p = 0.33). Acute GVHD occurred in 15 (58%) patients in the pasireotide group and 28 (54%) controls (p = 0.94). Chronic GVHD occurred in 16 patients in the pasireotide group (64%) versus 22 patients in the control group (42%) (p = 0.12). Overall survival at 1 year in the pasireotide group was 63% (95% CI: 47%,86%) versus 82% (95% CI: 72%, 93%) in controls (log-rank p = 0.006). Relapse-free survival rate at one year was 40% (95% CI: 25%, 65%) in the pasireotide group versus 78% (95% CI: 68%, 91%) in controls (log-rank p = 0.002). After controlling for the effect of relevant covariates, patients in the pasireotide group had attenuated post-HCT loss of microbial diversity. Analysis of systemic inflammatory markers and metabolomics demonstrated feasibility of such analyses in patients undergoing allogeneic HCT. Baseline level and pre-to-post transplant changes in several inflammatory markers (including MIP1a, MIP1b, TNFa, IL8Pro, and IL6) correlated with likelihood of survival. Conclusions Pasireotide did not prevent gastrointestinal toxicity or acute GVHD compared to contemporaneous controls. Pasireotide was associated with numerically higher chronic GVHD and significantly decreased OS and RFS compared to contemporaneous controls. Pasireotide may provide a locally protective effect in the stool microbiome and in local inflammation as measured by stool calprotectin, stool beta-defensin, and stool diversity index."
https://openalex.org/W3175312738,"Son preference and sex selective practices have resulted in a deficit of girls in several countries, primarily across Asia. Emerging evidence indicates that son preference survives migration to Western high-income countries. The objective of this study was to assess male-to-female (M/F) ratios at birth per mother's country of birth in Australia 1997-2016, in total and by parity, and by states/territories and over time.Data for this national population-based cross-sectional study were obtained from the National Perinatal Data Collection (NPDC) and included all live births in Australia 1997-2016 (N = 5 614 847). M/F ratios with 95% Confidence Intervals were estimated.The M/F ratio for births to Australian-born mothers was within the expected range (1.03-1.07) regardless of parity and time period. M/F ratios were elevated above the expected range for births to mothers born in China in the total sample (M/F ratio 1.084, 95% confidence interval 1.071-1.097) and at parity 2 (1.175, 1.120-1.231), and for births to mothers born in India at parity 2 (1.146, 1.090-1.204). Parity 2 births were the most consistently male-biased across time. Across states, elevated M/F ratios were identified for both groups in New South Wales (China parity 2: 1.182, 1.108-1.260; India parity 2: 1.182, 1.088-1.285), for births to Chinese-born mothers in Victoria (total births: 1.097, 1.072-1.123; parity 1: 1.115, 1.072-1.159) and Australian Capital Territory (total births: 1.189, 1.085-1.302) and births to Indian-born mothers Western Australia (parity 2: 1.307, 1.122-1.523).Son preference persists in some immigrant communities after migration to Australia. The consistent pattern of elevated M/F ratios across the larger states indicates that sex imbalances at birth are largely independent of restrictiveness of local abortion laws. Drivers and consequences of son preference in Western high-income settings should be explored to further promote gender equality, and to strengthen support for women who may be vulnerable to reproductive coercion."
https://openalex.org/W3177094574,"The goal is to examine the risk of conception mode-type-1 diabetes using different survival analysis modelling approaches and examine if there are differentials in the risk of type-1 diabetes between children from fresh and frozen-thawed embryo transfers. We aimed to compare the performances and fitness of different survival analysis regression models with the Cox proportional hazard (CPH) model used in an earlier study. The effect of conception modes and other prognostic factors on type-1 diabetes among children conceived either spontaneously or by assisted reproductive technology (ART) and its sub-groups was modelled in the earlier study. We used the information on all singleton children from the Swedish Medical Birth Register hosted by the Swedish National Board of Health and Welfare, 1985 to 2015. The main explanatory variable was the mode of conception. We applied the CPH, parametric and flexible parametric survival regression (FPSR) models to the data at 5% significance level. Loglikelihood, Akaike and Bayesian information criteria were used to assess model fit. Among the 3,138,540 singletons, 47,938 (1.5%) were conceived through ART (11,211 frozen-thawed transfer and 36,727 fresh embryo transfer). In total, 18,118 (0.58%) of the children had type-1 diabetes, higher among (0.58%) those conceived spontaneously than the ART-conceived (0.42%). The median (Interquartile range (IQR)) age at onset of type-1 diabetes among spontaneously conceived children was 10 (14-6) years, 8(5-12) for ART, 6 (4-10) years for frozen-thawed embryo transfer and 9 (5-12) years for fresh embryo transfer. The estimates from the CPH, FPSR and parametric PH models are similar. There was no significant difference in the risk of type-1 diabetes among ART- and spontaneously conceived children; FPSR: (adjusted Hazard Ratio (aHR) = 1.070; 95% Confidence Interval (CI):0.929-1.232, p = 0.346) vs CPH: (aHR = 1.068; 95%CI: 0.927-1.230, p = 0.361). A sub-analysis showed that the adjusted hazard of type-1 diabetes was 37% (aHR = 1.368; 95%CI: 1.013-1.847, p = 0.041) higher among children from frozen-thawed embryo transfer than among children from spontaneous conception. The hazard of type-1 diabetes was higher among children whose mothers do not smoke (aHR = 1.296; 95%CI:1.240-1.354, p<0.001) and of diabetic mothers (aHR = 6.419; 95%CI:5.852-7.041, p<0.001) and fathers (aHR = 8.808; 95%CI:8.221-9.437, p<0.001). The estimates from the CPH, parametric models and the FPSR model were close. This is an indication that the models performed similarly and any of them can be used to model the data. We couldn't establish that ART increases the risk of type-1 diabetes except when it is subdivided into its two subtypes. There is evidence of a greater risk of type-1 diabetes when conception is through frozen-thawed transfer."
https://openalex.org/W3175920838,"Determine the association between physician-deemed and patient-reported appropriateness and prioritization for cataract surgery.Prospective cohort study of 471 patients of 7 ophthalmologists referred for cataract surgery. Ophthalmologists rated patients for cataract surgery appropriateness and prioritization using a visual analogue scale of 0-10 preoperatively. All patients completed the eCAPS Quality of Life (QoL), while 313 completed the Catquest-9SF and EQ-5D questionnaires. Regression analyses were applied to determine demographic, clinical and patient-reported outcome measures (PROMs) associated with appropriateness and prioritization.Two clinical factors (study eye and fellow eye best-corrected visual acuity (BCVA)), 2 eCAPS (night driving difficulty, ability to take care of local errands), and 2 Catquest-9SF PROMs (recognizing faces, seeing to walk on uneven ground) were associated with appropriateness. In multivariable regression, the rating physician, 2 clinical criteria (study eye BCVA, anticipated postoperative BCVA) and 1 eCAPS QoL (night driving difficulty) were associated with appropriateness. Prioritization was associated with low income, 8 clinical criteria, 9 eCAPS, 5 Catquest-9SF, and 1 EQ-5D PROMs. In multivariable regression, 1 clinical criterion (study eye BCVA), 2 eCAPS QoL (night driving difficulty, ability to take care of local errands), and 2 Catquest-9SF PROMs (seeing prices, seeing to walk on uneven ground) were significantly associated.The eCAPS and Catquest-9SF questionnaires show some concordance with physician-deemed appropriateness, and more with prioritization. Binary conversions of PROM scales provide similar modelling, with minimal loss of explanatory power. As physician-deemed appropriateness and prioritization do not completely capture the patient perspective, PROMs may have a role in cataract surgery decision-making frameworks."
https://openalex.org/W3176930291,"Metabolic reprogramming occurs in cancer cells and is regulated partly by the opposing actions of tyrosine kinases and tyrosine phosphatases. Several members of the protein tyrosine phosphatase (PTP) superfamily have been linked to cancer as either pro-oncogenic or tumor-suppressive enzymes. In order to investigate which PTPs can modulate the metabolic state of cancer cells, we performed an shRNA screen of PTPs in HCT116 human colorectal cancer cells. Among the 72 PTPs efficiently targeted, 24 were found to regulate mitochondrial respiration, 8 as negative and 16 as positive regulators. Of the latter, we selected TC-PTP (PTPN2) for further characterization since inhibition of this PTP resulted in major functional defects in oxidative metabolism without affecting glycolytic flux. Transmission electron microscopy revealed an increase in the number of damaged mitochondria in TC-PTP-null cells, demonstrating the potential role of this PTP in regulating mitochondrial homeostasis. Downregulation of STAT3 by siRNA-mediated silencing partially rescued the mitochondrial respiration defect observed in TC-PTP-deficient cells, supporting the role of this signaling axis in regulating mitochondrial activity. In addition, mitochondrial stress prevented an increased expression of electron transport chain-related genes in cells with TC-PTP silencing, correlating with decreased ATP production, cellular proliferation, and migration. Our shRNA-based metabolic screen revealed that PTPs can serve as either positive or negative regulators of cancer cell metabolism. Taken together, our findings uncover a new role for TC-PTP as an activator of mitochondrial metabolism, validating this PTP as a key target for cancer therapeutics."
