id,abstract
https://openalex.org/W3174731125,"Severe acute respiratory syndrome coronavirus 2 (SARS-CoV-2) variants with multiple spike mutations enable increased transmission and antibody resistance. We combined cryo-electron microscopy (cryo-EM), binding, and computational analyses to study variant spikes, including one that was involved in transmission between minks and humans, and others that originated and spread in human populations. All variants showed increased angiotensin-converting enzyme 2 (ACE2) receptor binding and increased propensity for receptor binding domain (RBD)-up states. While adaptation to mink resulted in spike destabilization, the B.1.1.7 (UK) spike balanced stabilizing and destabilizing mutations. A local destabilizing effect of the RBD E484K mutation was implicated in resistance of the B.1.1.28/P.1 (Brazil) and B.1.351 (South Africa) variants to neutralizing antibodies. Our studies revealed allosteric effects of mutations and mechanistic differences that drive either interspecies transmission or escape from antibody neutralization."
https://openalex.org/W3177428124,"Several fast-spreading variants of severe acute respiratory syndrome coronavirus 2 (SARS-CoV-2) have become the dominant circulating strains in the COVID-19 pandemic. We report here cryo-electron microscopy structures of the full-length spike (S) trimers of the B.1.1.7 and B.1.351 variants, as well as their biochemical and antigenic properties. Amino acid substitutions in the B.1.1.7 protein increase both the accessibility of its receptor binding domain and the binding affinity for receptor angiotensin-converting enzyme 2 (ACE2). The enhanced receptor engagement may account for the increased transmissibility. The B.1.351 variant has evolved to reshape antigenic surfaces of the major neutralizing sites on the S protein, making it resistant to some potent neutralizing antibodies. These findings provide structural details on how SARS-CoV-2 has evolved to enhance viral fitness and immune evasion."
https://openalex.org/W3175906056,"Healthcare professionals are at higher risk of contracting the new coronavirus disease 2019 (COVID-19). Although appropriate preventive measures are the most important interventions to prevent coronavirus infection among healthcare workers, they are also highly concerned about the consequences of the pandemic. The aim of this cross-sectional study was to assess preventive practices, perceived risk and worry about COVID-19 crisis among healthcare professionals at six public hospitals in Addis Ababa, Ethiopia. A systematic random sampling technique was used to select 1,134 respondents (52.6% females). Data were collected between 9 th and 20 th June 2020 using self-administered questionnaires. Descriptive statistics were used to summarize the data. A multiple linear regression analysis was performed to identify factors associated with worry about COVID-19 crisis. The highest percentage of respondents were nurses (39.3%) and physicians (22.2%), followed by interns (10.8%) and midwives (10.3%). Wearing facemask (93%) and frequent hand washing (93%) were the commonly reported preventive practices. Perceived risk of becoming infected with coronavirus (88%) and the potential risk of infection to their family (91%) were very high. The mean (median) worry score about COVID-19 crisis was 2.37 (3.0), on 1 to 3 scale, with 1 (not worried) and 3 (highly worried). The majority worried a lot about the health system being overwhelmed by COVID-19 patients (92%), the health of their loved ones (90%) and losing someone due to COVID-19 (89%). Respondents who had previously provided clinical care to Ebola, SARS and cholera patients had significantly lower levels of worry about COVID-19 crisis than participants who had not (β = -1.38, P &lt;0.001). Our findings reveal respondents’ widespread practice of preventive measures, highest levels of perceived risk and worry about the COVID-19 crisis. Increased perceived risk and worry about COVID-19 might enable healthcare workers to adopt appropriate preventive measures more effectively against the disease."
https://openalex.org/W3174588745,
https://openalex.org/W3176264499,"The predominant approach for antibody generation remains animal immunization, which can yield exceptionally selective and potent antibody clones owing to the powerful evolutionary process of somatic hypermutation. However, animal immunization is inherently slow, not always accessible and poorly compatible with many antigens. Here, we describe 'autonomous hypermutation yeast surface display' (AHEAD), a synthetic recombinant antibody generation technology that imitates somatic hypermutation inside engineered yeast. By encoding antibody fragments on an error-prone orthogonal DNA replication system, surface-displayed antibody repertoires continuously mutate through simple cycles of yeast culturing and enrichment for antigen binding to produce high-affinity clones in as little as two weeks. We applied AHEAD to generate potent nanobodies against the SARS-CoV-2 S glycoprotein, a G-protein-coupled receptor and other targets, offering a template for streamlined antibody generation at large."
https://openalex.org/W3176317418,"In classical theories of cerebellar cortex, high-dimensional sensorimotor representations are used to separate neuronal activity patterns, improving associative learning and motor performance. Recent experimental studies suggest that cerebellar granule cell (GrC) population activity is low-dimensional. To examine sensorimotor representations from the point of view of downstream Purkinje cell ‘decoders’, we used three-dimensional acousto-optic lens two-photon microscopy to record from hundreds of GrC axons. Here we show that GrC axon population activity is high dimensional and distributed with little fine-scale spatial structure during spontaneous behaviors. Moreover, distinct behavioral states are represented along orthogonal dimensions in neuronal activity space. These results suggest that the cerebellar cortex supports high-dimensional representations and segregates behavioral state-dependent computations into orthogonal subspaces, as reported in the neocortex. Our findings match the predictions of cerebellar pattern separation theories and suggest that the cerebellum and neocortex use population codes with common features, despite their vastly different circuit structures. By recording from hundreds of cerebellar granule cell axons with three-dimensional two-photon calcium imaging, Lanore et al. show that population activity is high-dimensional and that quiet wakeful and active states are orthogonally arranged in neuronal activity space."
https://openalex.org/W3176637190,"Black people living in Africa must be involved in setting the priorities for global health research, policies and programs that affect their daily lives, in order to move away from a funding culture that fosters colonialism, racism and white supremacy."
https://openalex.org/W3177289604,"The clinical benefits of pan-mTOR active-site inhibitors are limited by toxicity and relief of feedback inhibition of receptor expression. To address these limitations, we designed a series of compounds that selectively inhibit mTORC1 and not mTORC2. These 'bi-steric inhibitors' comprise a rapamycin-like core moiety covalently linked to an mTOR active-site inhibitor. Structural modification of these components modulated their affinities for their binding sites on mTOR and the selectivity of the bi-steric compound. mTORC1-selective compounds potently inhibited 4EBP1 phosphorylation and caused regressions of breast cancer xenografts. Inhibition of 4EBP1 phosphorylation was sufficient to block cancer cell growth and was necessary for maximal antitumor activity. At mTORC1-selective doses, these compounds do not alter glucose tolerance, nor do they relieve AKT-dependent feedback inhibition of HER3. Thus, in preclinical models, selective inhibitors of mTORC1 potently inhibit tumor growth while causing less toxicity and receptor reactivation as compared to pan-mTOR inhibitors."
https://openalex.org/W3175205011,
https://openalex.org/W3174909509,"Oligonucleotide-based aptamers, which have a three-dimensional structure with a single-stranded fragment, feature various characteristics with respect to size, toxicity, and permeability. Accordingly, aptamers are advantageous in terms of diagnosis and treatment and are materials that can be produced through relatively simple experiments. Systematic evolution of ligands by exponential enrichment (SELEX) is one of the most widely used experimental methods for generating aptamers; however, it is highly expensive and time-consuming. To reduce the related costs, recent studies have used in silico approaches, such as aptamer-protein interaction (API) classifiers that use sequence patterns to determine the binding affinity between RNA aptamers and proteins. Some of these methods generate candidate RNA aptamer sequences that bind to a target protein, but they are limited to producing candidates of a specific size. In this study, we present a machine learning approach for selecting candidate sequences of various sizes that have a high binding affinity for a specific sequence of a target protein. We applied the Monte Carlo tree search (MCTS) algorithm for generating the candidate sequences using a score function based on an API classifier. The tree structure that we designed with MCTS enables nucleotide sequence sampling, and the obtained sequences are potential aptamer candidates. We performed a quality assessment using the scores of docking simulations. Our validation datasets revealed that our model showed similar or better docking scores in ZDOCK docking simulations than the known aptamers. We expect that our method, which is size-independent and easy to use, can provide insights into searching for an appropriate aptamer sequence for a target protein during the simulation step of SELEX."
https://openalex.org/W3177080859,"More than half of the world's population lives in areas at risk for dengue virus infection. A vaccine will be pivotal to controlling spread, however, the only licensed vaccine, Dengvaxia, has been shown to increase the risk of severe disease in a subset of individuals. Vaccine efforts are hampered by a poor understanding of antibody responses, including those generated by vaccines, and whether antibody titers can be used as a marker of protection from infection or disease. Here we present the results of an ancillary study to a phase III vaccine study (n = 611). All participants received three doses of either Dengvaxia or placebo and were followed for 6 years. We performed neutralization tests on annual samples and during confirmed dengue episodes (n = 16,508 total measurements). We use mathematical models to reconstruct long-term antibody responses to vaccination and natural infection, and to identify subclinical infections. There were 87 symptomatic infections reported, and we estimated that there were a further 351 subclinical infections. Cumulative vaccine efficacy was positive for both subclinical and symptomatic infection, although the protective effect of the vaccine was concentrated in the first 3 years following vaccination. Among individuals with the same antibody titer, we found no difference between the risk of subsequent infection or disease between placebo and vaccine recipients, suggesting that antibody titers are a good predictor of both protection and disease risk."
https://openalex.org/W3177085171,"There is high level policy consensus in India that community engagement (CE) improves vaccination uptake and reduces burden of vaccine preventable diseases. However, to date, vaccination studies in the country have not explicitly focused on CE as an outcome in and of itself. Therefore, this study sought to examine the barriers and enablers of community engagement for vaccination in India.Employing qualitative methods, twenty-five semi-structured elite interviews among vaccine decisionmakers' were triangulated with twenty-four national-level vaccine policy documents and researcher field notes (December 2017 to February 2018). Data collected for this study included perceptions and examples of enablers of and barriers to CE for vaccination uptake. Concepts, such as the absence of formal procedures or data collection approaches related to CE, were confirmed during document review, and a final convening to review study results was conducted with study respondents in December 2018 and January 2019 to affirm the general set of findings from this study. The Social Ecological Model (SEM) was used to organize and interpret the study findings.Although decisionmakers and policy documents generally supported CE, there were more CE barriers than facilitators in the context of vaccination, which were identified at all social-ecological levels. Interviews with vaccine decisionmakers in India revealed complex systemic and structural factors which affect CE for vaccination and are present across each of the SEM levels, from individual to policy. Policy-level enablers included decisionmakers' political will for CE and policy documents and interviews highlighted social mobilization, whereas barriers were lack of a CE strategy document and a broad understanding of CE by decisionmakers. At the community level, dissemination of Social-behavioral Change Communication (SBCC) materials from the national-level to the states was considered a CE facilitator, while class, and caste-based power relations in the community, lack of family-centric CE strategies, and paternalistic attitude of decisionmakers toward communities (the latter reported by some NGO heads) were considered CE barriers. At the organizational level, partnerships with local organizations were considered CE enablers, while lack of institutionalized support to formalize and incentivize these partnerships highlighted by several decisionmakers, were barriers. At the interpersonal level, SBCC training for healthcare workers, sensitive messaging to communities with low vaccine confidence, and social media messaging were considered CE facilitators. The lack of strategies to manage vaccine related rumors or replicate successful CE interventions during the during the introduction and rollout of new vaccines were perceived as CE barriers by several decisionmakers.Data obtained for this study highlighted national-level perceptions of the complexities and challenges of CE across the entire SEM, from individual to systemic levels. Future studies should attempt to associate these enablers and barriers with actual CE outcomes, such as participation or community support in vaccine policy-making, CE implementation for specific vaccines and situations (such as disease outbreaks), or frequency of sub-population-based incidents of community resistance and community facilitation to vaccination uptake. There would likely be value in developing a population-based operational definition of CE, with a step-by-step manual on 'how to do CE.' The data from this study also indicate the importance of including CE indicators in national datasets and developing a compendium documenting CE best-practices. Doing so would allow more rigorous analysis of the evidence-base for CE for vaccination in India and other countries with similar immunization programs."
https://openalex.org/W3174757338,"Ammonia is considered the main pathogenic toxin in hepatic encephalopathy (HE). However, the molecular mechanisms involved have been disputed. As altered glutamatergic and GABAergic neurotransmission has been reported in HE, we investigated whether four members of the solute carrier 38 (Slc38) family of amino acid transporters—involved in the replenishment of glutamate and GABA—contribute to ammonia neurotoxicity in HE. We show that ammonium ion exerts multiple actions on the Slc38 transporters: It competes with glutamine for the binding to the system N transporters Slc38a3 and Slc38a5, consequently inhibiting bidirectional astroglial glutamine transport. It also competes with H+, Na+, and K+ for uncoupled permeation through the same transporters, which may perturb astroglial intracellular pH, membrane potential, and K+-buffering. Knockdown of Slc38a3 in mice results in cerebral cortical edema and disrupted neurotransmitter synthesis mimicking events contributing to HE development. Finally, in a mouse model of acute liver failure (ALF), we demonstrate the downregulation of Slc38a3 protein, impeded astroglial glutamine release, and cytotoxic edema. Altogether, we demonstrate contribution of Slc38 transporters to the ammonia-induced impairment of glutamine recycling between astrocytes and neurons, a phenomenon underlying acute ammonia neurotoxicity in the setting of ALF."
https://openalex.org/W3175382711,"Since 2014, stony coral tissue loss disease (SCTLD) has contributed to substantial declines of reef-building corals in Florida. The emergence of this disease, which impacts over 20 scleractinian coral species, has generated a need for widespread reef monitoring and the implementation of novel survey and disease mitigation strategies. This study paired SCTLD prevalence assessments with colony-level monitoring to help improve understanding of disease dynamics on both individual coral colonies and at reef-wide scales. Benthic surveys were conducted throughout the northern Florida Reef Tract to monitor the presence/absence of disease, disease prevalence, and coral species affected by SCTLD. Observed SCTLD prevalence was lower in Jupiter and Palm Beach than in Lauderdale-by-the-Sea or St. Lucie Reef, but there were no significant changes in prevalence over time. To assess colony-level impacts of the disease, we optimized a low-cost, rapid 3D photogrammetry technique to fate-track infected Montastraea cavernosa coral colonies over four time points spanning nearly four months. Total colony area and healthy tissue area on fate-tracked colonies decreased significantly over time. However disease lesion area did not decrease over time and was not correlated with total colony area. Taken together these results suggest that targeted intervention efforts on larger colonies may maximize preservation of coral cover. Traditional coral surveys combined with 3D photogrammetry can provide greater insights into the spatiotemporal dynamics and impacts of coral diseases on individual colonies and coral communities than surveys or visual estimates of disease progression alone."
https://openalex.org/W3176524753,"In areas of low and unstable transmission, malaria cases occur in populations with lower access to malaria services and interventions, and in groups with specific malaria risk exposures often away from the household. In support of the Namibian National Vector Borne Disease Program's drive to better target interventions based upon risk, we implemented a health facility-based case control study aimed to identify risk factors for symptomatic malaria in Zambezi Region, northern Namibia. A total of 770 febrile individuals reporting to 6 health facilities and testing positive by rapid diagnostic test (RDT) between February 2015 and April 2016 were recruited as cases; 641 febrile individuals testing negative by RDT at the same health facilities through June 2016 were recruited as controls. Data on socio-demographics, housing construction, overnight travel, use of malaria prevention and outdoor behaviors at night were collected through interview and recorded on a tablet-based questionnaire. Remotely-sensed environmental data were extracted for geo-located village residence locations. Multivariable logistic regression was conducted to identify risk factors and latent class analyses (LCA) used to identify and characterize high-risk subgroups. The majority of participants (87% of cases and 69% of controls) were recruited during the 2016 transmission season, an outbreak year in Southern Africa. After adjustment, cases were more likely to be cattle herders (Adjusted Odds Ratio (aOR): 4.46 95%CI 1.05-18.96), members of the police or other security personnel (aOR: 4.60 95%CI: 1.16-18.16), and pensioners/unemployed persons (aOR: 2.25 95%CI 1.24-4.08), compared to agricultural workers (most common category). Children (aOR 2.28 95%CI 1.13-4.59) and self-identified students were at higher risk of malaria (aOR: 4.32 95%CI 2.31-8.10). Other actionable risk factors for malaria included housing and behavioral characteristics, including traditional home construction and sleeping in an open structure (versus modern structure: aOR: 2.01 95%CI 1.45-2.79 and aOR: 4.76 95%CI: 2.14-10.57); cross border travel in the prior 30 days (aOR: 10.55 95%CI 2.94-37.84); and outdoor agricultural work at night (aOR: 2.09 95%CI 1.12-3.87). Malaria preventive activities were all protective and included personal use of an insecticide treated net (ITN) (aOR: 0.61 95%CI 0.42-0.87), adequate household ITN coverage (aOR: 0.63 95%CI 0.42-0.94), and household indoor residual spraying (IRS) in the past year (versus never sprayed: (aOR: 0.63 95%CI 0.44-0.90). A number of environmental factors were associated with increased risk of malaria, including lower temperatures, higher rainfall and increased vegetation for the 30 days prior to diagnosis and residing more than 5 minutes from a health facility. LCA identified six classes of cases, with class membership strongly correlated with occupation, age and select behavioral risk factors. Use of ITNs and IRS coverage was similarly low across classes. For malaria elimination these high-risk groups will need targeted and tailored intervention strategies, for example, by implementing alternative delivery methods of interventions through schools and worksites, as well as the use of specific interventions that address outdoor transmission."
https://openalex.org/W3175727668,"Globally, about 810 women die every day due to pregnancy and its related complications. Although the death of women during pregnancy or childbirth has declined from 342 deaths to 211 deaths per 100,000 live births between 2000 and 2017, maternal mortality is still higher, particularly in sub-Saharan Africa and South Asia, where 86% of all deaths occur.A secondary analysis was carried out using the 2014 Ghana Demographic and Health Survey. A sample total of 4,290 women who had a live birth in the 5 years preceding the survey was included in the analysis. GIS software was used to explore the spatial distribution of unskilled birth attendance in Ghana. The Geographic Weighted Regression (GWR) was employed to model the spatial relationship of some predictor of unskilled birth attendance. Moreover, a multilevel binary logistic regression model was fitted to identify factors associated with unskilled birth attendance.In this study, unskilled birth attendance had spatial variations across the country. The hotspot, cluster and outlier analysis identified the concerned districts in the north-eastern part of Ghana. The GWR analysis identified different predictors of unskilled birth attendance across districts of Ghana. In the multilevel analysis, mothers with no education, no health insurance coverage, and mothers from households with lower wealth status had higher odds of unskilled birth attendance. Being multi and grand multiparous, perception of distance from the health facility as not a big problem, urban residence, women residing in communities with medium and higher poverty level had lower odds of unskilled birth attendance.Unskilled birth attendance had spatial variations across the country. Areas with high levels of unskilled birth attendance had mothers who had no formal education, not health insured, mothers from poor households and communities, primiparous women, mothers from remote and border districts could get special attention in terms of allocation of resources including skilled human power, and improved access to health facilities."
https://openalex.org/W3175255638,"Lung inflammation and impaired alveolarization are hallmarks of bronchopulmonary dysplasia (BPD). We hypothesize that human amnion epithelial cells (hAECs) are anti-inflammatory and reduce lung injury in preterm lambs born after antenatal exposure to inflammation.Pregnant ewes received either intra-amniotic lipopolysaccharide (LPS, from E.coli 055:B5; 4mg) or saline (Sal) on day 126 of gestation. Lambs were delivered by cesarean section at 128 d gestation (term ~150 d). Lambs received intravenous hAECs (LPS/hAECs: n = 7; 30x106 cells) or equivalent volumes of saline (LPS/Sal, n = 10; or Sal/Sal, n = 9) immediately after birth. Respiratory support was gradually de-escalated, aimed at early weaning from mechanical ventilation towards unassisted respiration. Lung tissue was collected 1 week after birth. Lung morphology was assessed and mRNA levels for inflammatory mediators were measured.Respiratory support required by LPS/hAEC lambs was not different to Sal/Sal or LPS/Sal lambs. Lung tissue:airspace ratio was lower in the LPS/Sal compared to Sal/Sal lambs (P<0.05), but not LPS/hAEC lambs. LPS/hAEC lambs tended to have increased septation in their lungs versus LPS/Sal (P = 0.08). Expression of inflammatory cytokines was highest in LPS/hAECs lambs.Postnatal administration of a single dose of hAECs stimulates a pulmonary immune response without changing ventilator requirements in preterm lambs born after intrauterine inflammation."
