id,abstract
https://openalex.org/W2069693955,It is currently not known whether caffeine has an enhancing effect on long-term memory in humans. We used post-study caffeine administration to test its effect on memory consolidation using a behavioral discrimination task. Caffeine enhanced performance 24 h after administration according to an inverted U-shaped dose-response curve; this effect was specific to consolidation and not retrieval. We conclude that caffeine enhanced consolidation of long-term memories in humans.
https://openalex.org/W2149236471,Self-renewal circuitry in embryonic stem cells (ESCs) is increasingly defined. How the robust pluripotency program is dissolved to enable fate transition is less appreciated. Here we develop a forward genetic approach using haploid ESCs. We created libraries of transposon integrations and screened for persistent self-renewal in differentiation-permissive culture. This yielded multiple mutants in the Fgf/Erk and GSK3/Tcf3 modules known to drive differentiation and in epigenetic modifiers implicated in lineage commitment. We also identified and validated factors not previously considered. These include the conserved small zinc finger protein Zfp706 and the RNA binding protein Pum1. Pum1 targets several mRNAs for naive pluripotency transcription factors and accelerates their downregulation at the onset of differentiation. These findings indicate that the dismantling of pluripotent circuitry proceeds at multiple levels. More broadly they exemplify the power of haploid ESCs for genetic interrogation of developmental processes.
https://openalex.org/W2037921624,"The measurement of metabolites such as creatine, which are involved in the tissue creatine kinase reaction, enable the study of the effects of energy deprivation on the heart. Haris and colleagues introduce a new magnetic resonance imaging technique that maps the distribution of creatine in the heart that does not use radiation or exogenous contrast agents and offers higher sensitivity compared to proton (1H) magnetic resonance spectroscopy methods. Feasibility is demonstrated in vivo in infarcted swine myocardium using a standard clinical MRI scanner. ATP derived from the conversion of phosphocreatine to creatine by creatine kinase provides an essential chemical energy source that governs myocardial contraction. Here, we demonstrate that the exchange of amine protons from creatine with protons in bulk water can be exploited to image creatine through chemical exchange saturation transfer (CrEST) in myocardial tissue. We show that CrEST provides about two orders of magnitude higher sensitivity compared to 1H magnetic resonance spectroscopy. Results of CrEST studies from ex vivo myocardial tissue strongly correlate with results from 1H and 31P magnetic resonance spectroscopy and biochemical analysis. We demonstrate the feasibility of CrEST measurement in healthy and infarcted myocardium in animal models in vivo on a 3-T clinical scanner. As proof of principle, we show the conversion of phosphocreatine to creatine by spatiotemporal mapping of creatine changes in the exercised human calf muscle. We also discuss the potential utility of CrEST in studying myocardial disorders."
https://openalex.org/W2126120986,
https://openalex.org/W2010216204,
https://openalex.org/W1990850819,"During meiotic prophase, telomere-mediated chromosomal movement along the nuclear envelope is crucial for homologue pairing and synapsis. However, how telomeres are modified to mediate chromosome movement is largely elusive. Here we show that mammalian meiotic telomeres are fundamentally modified by a meiosis-specific Myb-domain protein, TERB1, that localizes at telomeres in mouse germ cells. TERB1 forms a heterocomplex with the canonical telomeric protein TRF1 and binds telomere repeat DNA. Disruption of Terb1 in mice abolishes meiotic chromosomal movement and impairs homologous pairing and synapsis, causing infertility in both sexes. TERB1 promotes telomere association with the nuclear envelope and deposition of the SUN-KASH complex, which recruits cytoplasmic motor complexes. TERB1 also binds and recruits cohesin to telomeres to develop structural rigidity, strikingly reminiscent of centromeres. Our study suggests that TERB1 acts as a central hub for the assembly of a conserved meiotic telomere complex required for chromosome movements."
https://openalex.org/W2084203294,"Interleukin-6 (IL-6) is a pleiotropic cytokine that regulates immune and inflammatory responses, and its overproduction is a hallmark of inflammatory diseases. Inhibition of IL-6 signaling with the anti-IL-6 receptor antibody tocilizumab has provided some clinical benefit to patients; however, direct cytokine inhibition may be a more effective option. We used the systematic evolution of ligands by exponential enrichment (SELEX) process to discover slow off-rate modified aptamers (SOMAmers) with hydrophobic base modifications that inhibit IL-6 signaling in vitro. Two classes of IL-6 SOMAmers were isolated from modified DNA libraries containing 40 random positions and either 5-(N-benzylcarboxamide)-2'-deoxyuridine (Bn-dU) or 5-[N-(1-naphthylmethyl)carboxamide]-2'-deoxyuridine (Nap-dU) replacing dT. These modifications facilitate the high affinity binding interaction with IL-6 and provide resistance against degradation by serum endonucleases. Post-SELEX optimization of one Bn-dU and one Nap-dU SOMAmer led to improvements in IL-6 binding (10-fold) and inhibition activity (greater than 20-fold), resulting in lead SOMAmers with sub-nanomolar affinity (Kd = 0.2 nm) and potency (IC50 = 0.2 nm). Although similar in inhibition properties, the two SOMAmers have unique sequences and different ortholog specificities. Furthermore, these SOMAmers were stable in human serum in vitro for more than 48 h. Both SOMAmers prevented IL-6 signaling by blocking the interaction of IL-6 with its receptor and inhibited the proliferation of tumor cells in vitro as effectively as tocilizumab. This new class of IL-6 inhibitor may be an effective therapeutic alternative for patients suffering from inflammatory diseases."
