id,abstract
https://openalex.org/W4306247982,"The Opioid Overdose Knowledge Scale (OOKS) is widely used as an adjunct to opioid education and naloxone distribution (OEND) for assessing pre- and post-training knowledge. However, the extent to which the OOKS performs comparably for bystander and first responder groups has not been well determined. We used exploratory structural equation modeling (ESEM) to assess the measurement invariance of an OOKS item subset when used as an OEND training pre-test. We used secondary analysis of pre-test data collected from 446 first responders and 1,349 bystanders (N = 1,795) attending OEND trainings conducted by two county public health departments. Twenty-four items were selected by practitioner/trainer consensus from the original 45-item OOKS instrument with an additional 2 removed owing to low response variation. We used exploratory factor analysis (EFA) followed by ESEM to identify a factor structure, which we assessed for configural, metric, and scalar measurement invariance by participant group using the 22 dichotomous items (correct/incorrect) as factor indicators. EFA identified a 3-factor model consisting of items assessing: basic overdose risk information, signs of an overdose, and rescue procedures/advanced overdose risk information. Model fit by ESEM estimation versus confirmatory factor analysis showed the ESEM model afforded a better fit. Measurement invariance analyses indicated the 3-factor model fit the data across all levels of invariance per standard fit statistic metrics. The reduced set of 22 OOKS items appears to offer comparable measurement of pre-training knowledge on opioid overdose risks, signs of an overdose, and rescue procedures for both bystanders and first responders."
https://openalex.org/W4306248015,"Background Millions of workers are potentially exposed to respirable crystalline silica (RCS) which has been associated with several diseases. We updated the mortality experience of a cohort of 2,650 mine and mill workers at four manufacturing facilities to assess cause-specific mortality risks associated with estimated cumulative RCS exposure. Methods Study eligibility was defined as any employee who had ≥1 year of service by 2000, with work history experience available from 1945 through 2004. Vital status and cause of death were ascertained from 1945 through 2015. RCS exposure was estimated across plant-, department-, job-, and time-dependent categories using historic industrial hygiene sampling data and professional judgment. Associations between cumulative RCS (mg/m 3 -years) and cause-specific mortality were examined using Cox proportional hazard regression models. Results In the exposure-response analysis defined on quartiles of cumulative RCS exposure, no increasing trend (p trend = 0.37) in lung cancer mortality (n = 116 deaths) was observed (Hazard ratio (HR) = 1.00 (referent), 1.20, 1.85, 0.92). Mortality risk for non-malignant respiratory disease was increased across quartiles (HR = 1.00, 1.35, 1.89, 1.70; p trend = 0.15), based on 83 deaths. Non-malignant renal disease mortality was increased across quartiles (HR = 1.00, 6.64, 3.79, 3.29; p trend = 0.11), based on 26 deaths. Conclusions After nearly seven decades of follow-up, the exposure-response analyses showed no evidence of a positive trend for lung cancer, and limited evidence of a trend for non-malignant respiratory disease, and non-malignant renal disease mortality as a result of cumulative RCS exposure in this occupational cohort."
https://openalex.org/W4306248180,"We study risk-averse equilibrium bidding in first-price and second-price sealed-bid auctions where bidders have signalling concerns, i.e., they care about how the auction outcome is interpreted by an outside observer. We find that when the winner’s identity and her payment are revealed to the outside observer, risk aversion yields less aggressive bidding behaviour in the second-price sealed-bid auction than in the risk-neutral case. Our analysis explains various revenue ranking reversals relative to the risk-neutral equilibrium observed in a recent experiment by Bos (2021)."
https://openalex.org/W4306248188,"This paper investigates the impact of financial Inclusion on household poverty and vulnerability by constructing a household financial inclusion index using the China Household Finance Survey 2015. It is found that financial Inclusion significantly reduces the probability of poverty and vulnerability of households and has a more significant impact on vulnerable groups such as rural and urban low-income people. Further, financial Inclusion has a more significant effect on poor families that do not receive government support for poverty alleviation and can complement co-insurance mechanisms to help families better cope with vulnerabilities caused by synergistic community shocks. Finally, promoting entrepreneurship and improving risk management capabilities are the main channels of financial Inclusion."
https://openalex.org/W4306248194,"Background Iron deficiency is the commonest cause of anaemia worldwide. Serum ferritin is the most sensitive non-invasive indicator of iron stores but its utility is compromised in inflammatory states as it is an acute phase reactant. This study sought to estimate the burden of iron deficiency in a healthy adult population residing in Kenya and to determine the association between various ferritin cut-offs and anaemia in a population known to have chronic low-grade inflammation. Methods Healthy adults aged 18–65 years were recruited from urban towns in 4 counties in Kenya at average altitudes of 1683-2099m above sea level as part of a global study conducted by the International Federation of Clinical Chemistry (IFCC) to determine reference intervals (RIs) for common laboratory tests. We analyzed complete blood count (CBC), C-reactive protein, iron, transferrin, transferrin saturation and ferritin data. Results We obtained data from 528 participants. There were 254 (48.1%) males and 274 females (51.9%). Based on a ferritin cut-off of 15 μg/L and Hb cut-offs of 14.5 g/dL and 12 g/dL, the prevalence of iron deficiency anaemia was 0.8% and 7.3% in males and females respectively. The odds of having anaemia was highest if one had a ferritin value less than 15 μg/L with a sensitivity of 28.6% and specificity of 98.4% in males, and sensitivity of 83.3% and specificity of 78.0% in females. Conclusion Only the ferritin cut-off of 15 ug/L had an association with anaemia where it can be used for ruling out iron deficiency as the cause. Sex specific ferritin cut-offs for diagnosing iron deficiency in adults in sub-Saharan Africa need to be derived by comparing ferritin levels to stainable iron in bone marrow aspirates and trephines in order to ensure that we are using appropriate clinical decision limits."
