id,abstract
https://openalex.org/W2087638855,"We developed a chemical route to produce graphene nanoribbons (GNR) with width below 10 nanometers, as well as single ribbons with varying widths along their lengths or containing lattice-defined graphene junctions for potential molecular electronics. The GNRs were solution-phase–derived, stably suspended in solvents with noncovalent polymer functionalization, and exhibited ultrasmooth edges with possibly well-defined zigzag or armchair-edge structures. Electrical transport experiments showed that, unlike single-walled carbon nanotubes, all of the sub–10-nanometer GNRs produced were semiconductors and afforded graphene field effect transistors with on-off ratios of about 10 7 at room temperature."
https://openalex.org/W1996568337,"We have synthesized a 582,970–base pair Mycoplasma genitalium genome. This synthetic genome, named M. genitalium JCVI-1.0, contains all the genes of wild-type M. genitalium G37 except MG408, which was disrupted by an antibiotic marker to block pathogenicity and to allow for selection. To identify the genome as synthetic, we inserted “watermarks” at intergenic sites known to tolerate transposon insertions. Overlapping “cassettes” of 5 to 7 kilobases (kb), assembled from chemically synthesized oligonucleotides, were joined by in vitro recombination to produce intermediate assemblies of approximately 24 kb, 72 kb (“1/8 genome”), and 144 kb (“1/4 genome”), which were all cloned as bacterial artificial chromosomes in Escherichia coli . Most of these intermediate clones were sequenced, and clones of all four 1/4 genomes with the correct sequence were identified. The complete synthetic genome was assembled by transformation-associated recombination cloning in the yeast Saccharomyces cerevisiae , then isolated and sequenced. A clone with the correct sequence was identified. The methods described here will be generally useful for constructing large DNA molecules from chemically synthesized pieces and also from combinations of natural and synthetic DNA segments."
https://openalex.org/W1991883784,"Many developmental processes in plants are regulated jointly by light and by the gibberellins, yet the molecular basis of cross-talk between the two is not fully understood. Two groups now report results that reveal a signalling cascade that contributes to coordinated plant growth regulation by light and gibberellins. In the absence of gibberellins, DELLA proteins inhibit the binding of the transcription factor PIF3 (a phytochrome-interacting protein) to gene promoters. Gibberellins trigger the degradation of DELLA proteins, thereby allowing PIFs to bind to their target promoters and regulate gene expression. Light acts via a photoreceptor to destabilize PIF4. Thus the DELLA proteins, and competitive interactions between members of the PIF family, appear to key components linking light to the gibberellins. Light and gibberellins (GA) regulate multiple aspects of plant development, and this paper is one of two studies that provide molecular insights into the connection between these pathways. Without GA, DELLA proteins (GA-signalling repressors) interact with PIFs (phytochrome-interacting proteins) and inhibit their binding to gene promoters. GA triggers degradation of DELLA proteins, thereby allowing PIFs to bind to their target promoters and regulate gene expression. These results reveal a signalling cascade that contributes to coordinated plant growth regulation by light and gibberellins. Cell elongation during seedling development is antagonistically regulated by light and gibberellins (GAs)1,2. Light induces photomorphogenesis, leading to inhibition of hypocotyl growth, whereas GAs promote etiolated growth, characterized by increased hypocotyl elongation. The mechanism underlying this antagonistic interaction remains unclear. Here we report on the central role of the Arabidopsis thaliana nuclear transcription factor PIF4 (encoded by PHYTOCHROME INTERACTING FACTOR 4)3 in the positive control of genes mediating cell elongation and show that this factor is negatively regulated by the light photoreceptor phyB (ref. 4) and by DELLA proteins that have a key repressor function in GA signalling5. Our results demonstrate that PIF4 is destabilized by phyB in the light and that DELLAs block PIF4 transcriptional activity by binding the DNA-recognition domain of this factor. We show that GAs abrogate such repression by promoting DELLA destabilization, and therefore cause a concomitant accumulation of free PIF4 in the nucleus. Consistent with this model, intermediate hypocotyl lengths were observed in transgenic plants over-accumulating both DELLAs and PIF4. Destabilization of this factor by phyB, together with its inactivation by DELLAs, constitutes a protein interaction framework that explains how plants integrate both light and GA signals to optimize growth and development in response to changing environments."
https://openalex.org/W1994700942,"Many developmental processes in plants are regulated jointly by light and by the gibberellins, yet the molecular basis of cross-talk between the two is not fully understood. Two groups now report results that reveal a signalling cascade that contributes to coordinated plant growth regulation by light and gibberellins. In the absence of gibberellins, DELLA proteins inhibit the binding of the transcription factor PIF3 (a phytochrome-interacting protein) to gene promoters. Gibberellins trigger the degradation of DELLA proteins, thereby allowing PIFs to bind to their target promoters and regulate gene expression. Light acts via a photoreceptor to destabilize PIF4. Thus the DELLA proteins, and competitive interactions between members of the PIF family, appear to key components linking light to the gibberellins. Light and gibberellins (GA) regulate multiple aspects of plant development, and this paper is one of two studies that provide molecular insights into the connection between these pathways. Without GA, DELLA proteins (GA-signalling repressors) interact with PIFs (phytochrome-interacting proteins) and inhibit their binding to gene promoters. GA triggers degradation of DELLA proteins, thereby allowing PIFs to bind to their target promoters and regulate gene expression. These results reveal a signalling cascade that contributes to coordinated plant growth regulation by light and gibberellins. Light and gibberellins (GAs) mediate many essential and partially overlapping plant developmental processes. DELLA proteins are GA-signalling repressors that block GA-induced development1. GA induces degradation of DELLA proteins via the ubiquitin/proteasome pathway2, but light promotes accumulation of DELLA proteins by reducing GA levels3. It was proposed that DELLA proteins restrain plant growth largely through their effect on gene expression4,5. However, the precise mechanism of their function in coordinating GA signalling and gene expression remains unknown. Here we characterize a nuclear protein interaction cascade mediating transduction of GA signals to the activity regulation of a light-responsive transcription factor. In the absence of GA, nuclear-localized DELLA proteins accumulate to higher levels, interact with phytochrome-interacting factor 3 (PIF3, a bHLH-type transcription factor) and prevent PIF3 from binding to its target gene promoters and regulating gene expression, and therefore abrogate PIF3-mediated light control of hypocotyl elongation. In the presence of GA, GID1 proteins (GA receptors) elevate their direct interaction with DELLA proteins in the nucleus, trigger DELLA protein’s ubiquitination and proteasome-mediated degradation, and thus release PIF3 from the negative effect of DELLA proteins."
https://openalex.org/W2019703934,"Although commensalism with gut microbiota exists in all metazoans, the host factors that maintain this homeostatic relationship remain largely unknown. We show that the intestinal homeobox gene Caudal regulates the commensal-gut mutualism by repressing nuclear factor kappa B–dependent antimicrobial peptide genes. Inhibition of Caudal expression in flies via RNA interference led to overexpression of antimicrobial peptides, which in turn altered the commensal population within the intestine. In particular, the dominance of one gut microbe, Gluconobacter sp. strain EW707, eventually led to gut cell apoptosis and host mortality. However, restoration of a healthy microbiota community and normal host survival in the Caudal-RNAi flies was achieved by reintroduction of the Caudal gene. These results reveal that a specific genetic deficiency within a host can profoundly influence the gut commensal microbial community and host physiology."
https://openalex.org/W1997595402,"The hippocampus is an area of the brain involved in learning and memory. It contains parallel excitatory pathways referred to as the trisynaptic pathway (which carries information as follows: entorhinal cortex --> dentate gyrus --> CA3 --> CA1 --> entorhinal cortex) and the monosynaptic pathway (entorhinal cortex --> CA1 --> entorhinal cortex). We developed a generally applicable tetanus toxin-based method for transgenic mice that permits inducible and reversible inhibition of synaptic transmission and applied it to the trisynaptic pathway while preserving transmission in the monosynaptic pathway. We found that synaptic output from CA3 in the trisynaptic pathway is dispensable and the short monosynaptic pathway is sufficient for incremental spatial learning. In contrast, the full trisynaptic pathway containing CA3 is required for rapid one-trial contextual learning, for pattern completion-based memory recall, and for spatial tuning of CA1 cells."
