id,abstract
https://openalex.org/W3176693591,"Volumetric muscle loss (VML) injuries result in a non-recoverable loss of muscle tissue and function due to trauma or surgery. Reductions in physical activity increase the risk of metabolic comorbidities over time, and it is likely that VML may reduce whole-body activity. However, these aspects remain uncharacterized following injury. Our goal was to characterize the impact of VML on whole-body physical activity and metabolism, and to further investigate possible muscle-specific metabolic changes. Adult male C57Bl/6J (n = 28) mice underwent a standardized VML injury to the posterior compartment of the hind limb, or served as injury naïve controls. Mice underwent longitudinal evaluation of whole-body physical activity and metabolism in specialized cages up to three times over the course of 8 weeks. At terminal time points of 4- and 8-weeks post-VML in vivo muscle function of the posterior compartment was evaluated. Additionally, the gastrocnemius muscle was collected to understand histological and biochemical changes in the muscle remaining after VML. The VML injury did not alter the physical activity of mice. However, there was a noted reduction in whole-body metabolism and diurnal fluctuations between lipid and carbohydrate oxidation were also reduced, largely driven by lower carbohydrate utilization during active hours. Following VML, muscle-specific changes indicate a decreased proportion of fast (i.e., type IIb and IIx) and a greater proportion of slow (i.e., type I and IIa) fibers. However, there were minimal changes in the capillarity and metabolic biochemical activity properties of the gastrocnemius muscle, suggesting a miss-match in capacity to support the physiologic needs of the fibers. These novel findings indicate that following VML, independent of changes in physical activity, there is whole-body diurnal metabolic inflexibility. Supporting future investigations into the chronic and overlooked co-morbidities of VML injury."
https://openalex.org/W3176814876,"Without treatment, prediabetic women with a history of gestational diabetes mellitus (GDM) are at greater risk for developing type 2 diabetes compared with women without a history of GDM. Both intensive lifestyle intervention and metformin can reduce risk. To predict risk and treatment response, we developed a risk prediction model specifically for women with prior GDM.The Diabetes Prevention Program was a randomized controlled trial to evaluate the effectiveness of intensive lifestyle intervention, metformin (850mg twice daily), and placebo in preventing diabetes. Data from the Diabetes Prevention Program (DPP) was used to conduct a secondary analysis to evaluate 11 baseline clinical variables of 317 women with prediabetes and a self-reported history of GDM to develop a 3-year diabetes risk prediction model using Cox proportional hazards regression. Reduced models were explored and compared with the main model.Within three years, 82 (25.9%) women developed diabetes. In our parsimonious model using 4 of 11 clinical variables, higher fasting glucose and hemoglobin A1C were each associated with greater risk for diabetes (each hazard ratio approximately 1.4), and there was an interaction between treatment arm and BMI suggesting that metformin was more effective relative to no treatment for BMI ≥ 35kg/m2 than BMI < 30kg/m2. The model had fair discrimination (bias corrected C index = 0.68) and was not significantly different from our main model using 11 clinical variables. The estimated incidence of diabetes without treatment was 37.4%, compared to 20.0% with intensive lifestyle intervention or metformin treatment for women with a prior GDM.A clinical prediction model was developed for individualized decision making for prediabetes treatment in women with prior GDM."
https://openalex.org/W3175584485,"Background Evidence for optimal hemostatic resuscitation in postpartum hemorrhage (PPH) is lacking. Liberal fluid administration may result in acidosis, hypothermia and coagulopathy. Objective We hypothesize that in early PPH a restrictive fluid administration results in less progression to moderate PPH. Study design In four Dutch hospitals we recruited women of 18 years and over, and more than 24 weeks pregnant. Exclusion criteria were: anticoagulant therapy, known coagulation disorders, pre-eclampsia, antenatal diagnosis of abnormally adhesive placenta, and a contraindication for liberal fluid therapy. We blindly randomized participants at 500 mL and ongoing blood loss in the third stage of labor between restrictive fluid administration (clear fluids 0.75–1.0 times the volume of blood lost) and liberal fluid administration (clear fluids 1.5–2.0 times the volume of blood lost). The primary outcome was progression to more than 1000 mL blood loss. Analyses were according to the intention-to-treat principle. Results From August 2014 till September 2019, 5190 women were informed of whom 1622 agreed to participate. A total of 252 women were randomized of which 130 were assigned to the restrictive group and 122 to the liberal group. In the restrictive management group 51 of the 130 patients (39.2%) progressed to more than 1000 mL blood loss versus 61 of the 119 patients (51.3%) in the liberal management group (difference, -12.0% [95%-CI -24.3% to 0.3%], p = 0.057). There was no difference in the need for blood transfusion, coagulation parameters, or in adverse events between the groups. Conclusions Although a restrictive fluid resuscitation in women with mild PPH could not been proven to be superior, it does not increase the need for blood transfusion, alter coagulation parameters, or cause a rise in adverse events. It can be considered as an alternative treatment option to liberal fluid resuscitation. Trial registration NTR3789 ."
https://openalex.org/W3176029908,"Maternal Cytomegalovirus (CMV) infection in the first trimester (T1) of pregnancy is a public health concern, as it increases the risk of severe neurodevelopmental outcomes associated with congenital infection compared to infections occurring later during pregnancy.To determine CMV seroprevalence in T1 of pregnancy, its trend, risk factors and the incidence rate of primary infection during pregnancy.Using the biobank of the prospective cohort ""Grossesse en Santé de Québec"" collected between April 2005 and March 2010 at the Québec-Laval Hospital, Québec, Canada, maternal CMV serology was determined using Abbott Architect Chemiluminescence microparticle immunoassays for immunoglobulin G(IgG), immunoglobulin M(IgM) titration and IgG avidity testing. Changepoint detection analysis was used to assess temporal trends. Risk factors associated with seropositivity were determined by multivariable logistic regression.CMV seroprevalence in T1 of pregnancy was 23.4% (965/4111, 95% CI, 22.1-24.7%). The incidence rate for CMV primary infection during pregnancy was 1.8 (95% CI, 1.2-2.6) per 100 person-years. No changepoint was identified in the maternal CMV-seroprevalence trend. Multivariable analyses showed that T1 maternal CMV seropositivity was associated with having one child OR 1.3 (95% CI, 1.10-1.73) or two or more children OR 1.5 (95%CI, 1.1-2.1), ethnicity other than Caucasian OR 2.1 (95% CI, 1.1-3.8) and country of birth other than Canada and the USA OR 2.8 (95% CI, 1.5-4.9).In this cohort, maternal seroprevalence in T1 of pregnancy and seroconversion rate were low. This information and identified risk factors could help guide the development and implementation of preventive actions and evidence-based health policies to prevent CMV infection during pregnancy."
https://openalex.org/W3177343775,"Saliva contains diverse bacteria shed from various oral sites, including subgingival plaque. It is reasonable to focus on the total occupancy of subgingival plaque-specific bacteria (SUBP bacteria), which live in subgingival environments, in the saliva for detecting periodontitis using salivary testing. This study aimed to validate the clinical utility of SUBP bacteria in the salivary microbiota for the detection of periodontitis. We examined stimulated saliva samples collected from 125 subjects who visited three dental clinics. The relative abundances of previously identified 11 SUBP bacteria were determined using 16S ribosomal RNA gene sequencing and a reference-based approach. The prediction performance was evaluated using a receiver operating characteristic (ROC) curve. The SUBP bacteria accounted for 0-15.4% of the salivary microbiota, and the percentage distinguished periodontitis patients with at least 15 sites with probing depth ≥4 mm with a sensitivity of 0.90 (95% confidence interval [CI], 0.81-0.98) and specificity of 0.70 (95% CI, 0.60-0.80) (area under the ROC curve [AUC], 0.87). Among 2,047 combinations of 11 SUBP bacteria, combinations including Streptococcus constellatus, Porphyromonas gingivalis, and Fusobacterium nucleatum subsp. vincentii demonstrated significantly higher AUC values in their detection. These results suggest that examining SUBP bacteria in saliva may be useful for detecting periodontitis patients in mass screening."
https://openalex.org/W3174955911,
https://openalex.org/W3175503601,"To eliminate mother-to-child transmission of HIV (EMTCT), scalable strategies to enhance antiretroviral adherence for both antiretroviral therapy (ART) and pre-exposure prophylaxis (PrEP) are needed as part of integrated HIV and maternal-child health services. We developed Tonse Pamodzi (""all of us together""), an adaptable intervention integrating biomedical and behavioral components to support HIV treatment and prevention. We describe our intervention development process, which comprised formative qualitative research, a review of the literature, and technical input from stakeholders representing the community, health systems, and policymakers. The resulting intervention, described herein, integrates patient-centered counseling and engagement of a patient-selected adherence supporter for pregnant and breastfeeding women initiating ART or PrEP. Patients receiving the intervention engage in Integrated Next Step Counseling (iNSC) sessions delivered by trained counselors to build and maintain adherence skills. Each patient also has the option of selecting an adherence supporter (partner, family member, or friend) who may participate in iNSC sessions and provide adherence support outside of these sessions. This flexible intervention is adaptable not only to ART or PrEP use, but also to the needs and preferences of each woman and the clinical context. If shown to be acceptable and feasible, the Tonse Pamodzi intervention may be an important tool in continuing efforts for EMTCT."
https://openalex.org/W3176213502,"The lack of sufficient knowledge of mother to child transmission (MTCT) of human immunodeficiency virus (HIV) among pregnant women is considered a major contributor to new pediatric HIV infections globally, and increasing HIV related infant mortality especially in developing countries. Nigeria has the highest number of new HIV infections among children in the world. This study was designed to examine the spatial pattern and determinants of acquisition of sufficient knowledge of MTCT and prevention of mother to child transmission (PMTCT) in Nigeria. The data used in the study were extracted from the 2018 Nigeria Democratic Health Survey. The spatial modeling was through a Bayesian approach with appropriate prior distributions assigned to the different parameters of the model and inference was through the integrated nested Laplace approximation technique (INLA). Results show considerable spatial variability in the acquisition of sufficient knowledge of MTCT and its prevention with women in the southwestern and southeastern part of the country having higher likelihood. The nonlinear effects findings show that acquisition of sufficient knowledge of MTCT and PMTCT increased with age of women and peaked at around age 35yearswhere it thereafter dropped drastically among the older women. Furthermore, sufficient knowledge of MTCT and PMTCT was found to be driven by ethnicity, respondents' education and wealth status."
https://openalex.org/W3174840564,"The environment where people live, work or play can influence health and disability outcomes. People with spinal cord injury are at risk for secondary health conditions, with this increasing readmission rates and decreasing quality of life. Studies on preventative care for secondary health conditions and factors influencing the prevention of secondary health conditions are scarce in low to middle-income countries.To explore environmental factors influencing the prevention of secondary health conditions in people with spinal cord injury.This study was based at a public rehabilitation hospital, South Africa.Explorative qualitative design was used. Semi-structured interviews were conducted with 21 therapists, 17 people with a spinal cord injury and six caregivers. The interviews were transcribed verbatim. Analysis was conducted using content analysis.The categories that emerged included the impact of social support, inaccessible built environment and transport system, and an inefficient health care system. Sub-categories for the inefficient health care systems were: Shortage of resources, health workers lack of knowledge on prevention of secondary health conditions and inadequate patient care approach.Environmental factors influencing the prevention of secondary health conditions are complex and multifactorial. When developing rehabilitation and prevention programmes, environmental factors must be considered."
https://openalex.org/W3176543396,"Student's academic performance is the point of interest for both the student and the academic institution in higher education. This performance can be affected by several factors and one of them is student absences. This is mainly due to the missed lectures and other class activities. Studies related to university timetabling investigate the different techniques and algorithms to design course timetables without analyzing the relationship between student attendance behavior and timetable design. This article first aimed at demonstrating the impact of absences and timetabling design on student's academic performance. Secondly, this study showed that the number of absences can be caused by three main timetable design factors: namely, (1) the number of courses per semester, (2) the average number of lectures per day and (3) the average number of free timeslots per day. This was demonstrated using Educational Data Mining on a large dataset collected from Prince Sultan University. The results showed a high prediction performance reaching 92% when predicting student's GPA based on absences and the factors related to timetabling design. High prediction performance reaching 87% was also obtained when predicting student absences based on the three timetable factors mentioned above. The results demonstrated the importance of designing course timetables in view of student absence behavior. Some suggestions were reported such as limiting the number of enrolled courses based on student's GPA, avoiding busy and almost free days and using automated timetabling to minimize the number of predicted absences. This in turn will help in generating balanced student timetables, and thus improving student academic performance."
https://openalex.org/W3176988950,"Type 2 diabetes is a leading cause of death and disability worldwide and pre-diabetes is a strong predictor of diabetes development. To date, studies estimating the prevalence of pre-diabetes in the Irish population are sparse and conflicting. Monitoring the prevalence of pre-diabetes and a knowledge of associated factors is required to inform policies and to prevent development of type 2 diabetes. Therefore, this research examined the prevalence and correlates of pre-diabetes in a sample of middle- to older-aged Irish adults using three different methods for diagnosis.The Mitchelstown Cohort Rescreen (2016/17) was a follow-up, cross-sectional study of the Mitchelstown Cohort Study (2010/11). 1,378 participants were recruited from a random sample of patients attending a single primary care centre. Pre-diabetes was defined using three diagnostic criteria: American Diabetes Association (ADA) glycated haemoglobin A1c (HbA1c) cut-offs between 5.7%-6.4% (39-46 mmol/mol), World Health Organization International Expert Committee (WHO-IEC) HbA1c cut-offs between 6.0%-6.4% (42-46 mmol/mol) and ADA fasting plasma glucose (FPG) cut-offs between 5.6-6.9 mmol/l. Univariate and multivariable logistic regression analyses were used to determine factors associated with pre-diabetes.The prevalence of pre-diabetes was found to be 43.9% (95% CI: 41.2%─46.5%), 14.5% (95% CI: 12.7%─16.5%) and 15.8% (95% CI: 13.9%─17.8%) according to HbA1c ADA, HbA1c WHO-IEC and FPG ADA definitions, respectively. Depending on diagnostic method, factors associated with pre-diabetes in univariate analyses included sex, age, marital status, health rating, education and poor diet quality. In multivariable analysis, subjects classified by the FPG ADA pre-diabetes criterion displayed the least optimal metabolic profile defined by overweight and obesity (OR = 2.88, 95% CI: 1.53-5.43), hypertension (OR = 2.27, 95% CI: 1.51-3.40) and low high-density lipoprotein cholesterol concentrations (OR = 1.75, 95% CI: 1.07-2.87).The discordance between prevalence estimates according to method of diagnosis is concerning. A National Diabetes Prevention Programme is currently being developed in Ireland. Monitoring the prevalence of pre-diabetes over time will be important to assess the effectiveness of this programme. This study will inform national decision-makers on which definition of pre-diabetes to use for monitoring purposes."
https://openalex.org/W3173425108,"Seasonal influenza vaccination uptake among young children in Thailand is low despite national recommendation for vaccination. We implemented a knowledge, attitude/perception, and practice survey to understand determinants of influenza vaccination in children aged six months to two years.Using a cross-sectional design, we interviewed caregivers of 700 children in seven hospitals using a structured questionnaire to collect information on caregivers' and children's demographic characteristics, and caregivers' knowledge of influenza illness and national vaccine recommendation, attitude/perception toward influenza vaccine, and information sources. We verified children's influenza vaccination status against medical records (vaccinated vs. unvaccinated). Logistic regression was used to examine factors independently associated with children receiving influenza vaccination in the 2018 season using the dataset restricted to only children's parents. Variables associated with vaccination at p-value ≤0.20 were included in subsequent multivariable logistic models. Significant independent determinants of children's influenza vaccination and collinearity of covariates were assessed. The final model was constructed using a stepwise backward elimination approach with variables significant at p-value <0.05 retained in the model.During August 2018-February 2019, 700 children's caregivers completed the questionnaire; 61 (9%) were caregivers of vaccinated children. Caregivers of the vaccinated children were statistically more likely to have higher education (61% vs. 38%; p-value<0.01) and to know of influenza illness (93% vs. 76%; p-value = 0.03) than those of the unvaccinated group. Factors associated with children receiving influenza vaccination were identifying healthcare providers as a primary source of information about influenza illness for parents (adjusted odds ratio [aOR], 2.8; 95% confidence interval [CI], 1.3-6.0), parents' strongly agreeing with the national recommendation for influenza vaccination in young children (aOR, 2.9; 95% CI, 1.5-5.9), using health insurance provided by the government or parent's employer for children's doctor visits (aOR, 2.6; 95% CI, 1.1-6.6), and the children's history of receiving influenza vaccination in the 2017 season or earlier (aOR, 3.2; 95% CI, 1.4-7.8).The majority of caregivers of children in this study had knowledge of influenza illness and influenza vaccine. Caregivers reported various sources of information regarding influenza illness and the vaccine, but healthcare providers remained the most trusted source. Children's history of influenza vaccination in prior season(s) was the strongest determinant of children being vaccinated for influenza in the current season."
https://openalex.org/W3174087715,"Although R&D internationalization plays an important role in enterprises' globalization, few studies explore the mechanism of R&D internationalization and emerging market companies' innovation, or the relationship between R&D internationalization, domestic technology alliances and absorptive capacity. How does the R&D internationalization of emerging market enterprises affect the innovation of those enterprises? Under fierce market competition, do absorption capacity and domestic technology alliances have a significant impact on enterprise innovation? From the perspective of the knowledge-based view, this paper studies 185 enterprises undergoing R&D internationalization in China from 2012 to 2017, using high-dimensional Poisson fixed effects model, we use instrumental (HDFE IV) estimation to explain the impact of R&D internationalization on the innovation of the parent company and the mechanism behind it. The study finds that R&D internationalization positively promotes the parent company's innovation, and domestic technology alliances and absorptive capacity play a partial mediator role in R&D internationalization. In the face of fierce market competition, domestic technical alliances play a significant role in promoting enterprise innovation, while absorptive capacity plays a negative role in promoting enterprise innovation with the moderating effect of market competition."
https://openalex.org/W3175230223,"Hospitalization for acute decompensated heart failure (ADHF) remains a major source of morbidity and mortality. The current study aimed to investigate the feasibility, safety, and efficacy of outpatient furosemide intravenous (IV) infusion following hospitalization for ADHF.In a single center, prospective, randomized, double-blind study, 100 patients were randomized to receive standard of care (Group 1), IV placebo infusion (Group 2), or IV furosemide infusion (Group 3) over 3h, biweekly for a one-month period following ADHF hospitalization. Patients in Groups 2/3 also received a comprehensive HF-care protocol including bi-weekly clinic visits for dose-adjusted IV-diuretics, medication adjustment and education. Echocardiography, quality of life and depression questionnaires were performed at baseline and 30-day follow-up. The primary outcome was 30-day re-hospitalization for ADHF.Overall, a total of 94 patients were included in the study (mean age 64 years, 56% males, 69% African American). There were a total of 14 (15%) hospitalizations for ADHF at 30 days, 6 (17.1%) in Group 1, 7 (22.6%) in Group 2, and 1 (3.7%) in Group 3 (overall p = 0.11; p = 0.037 comparing Groups 2 and 3). Patients receiving IV furosemide infusion experienced significantly greater urine output and weight loss compared to those receiving placebo without any significant increase creatinine and no significant between group differences in echocardiography parameters, KCCQ or depression scores.The use of a standardized protocol of outpatient IV furosemide infusion for a one-month period following hospitalization for ADHF was found to be safe and efficacious in reducing 30-day re-hospitalization."
https://openalex.org/W3176355942,"Here we report the first complete mitochondrial genome of the semi-slug Omalonyx unguis (d'Orbigny, 1836) (Gastropoda: Succineidae). Sequencing was performed on a specimen from Argentina. Assembly was performed using Sanger data and Illumina next generation sequencing (NGS). The mitogenome was 13,984 bp in length and encoded the 37 typical Metazoan genes. A potential origin for mitochondrial DNA replication was found in a non-coding intergenic spacer (49 bp) located between cox3 and tRNA-Ile genes, and its secondary structure was characterized. Secondary structure models of the tRNA genes of O. unguis largely agreed with those proposed for other mollusks. Secondary structure models for the two rRNA genes were also obtained. To our knowledge, the 12S-rRNA model derived here is the first complete one available for mollusks. Phylogenetic analyses based on the mitogenomes of O. unguis and 37 other species of Stylommatophora were performed using amino acid sequences from the 13 protein-coding genes. Our results located Succineoidea as a sister group of Helicoidea + Urocoptoidea, similar to previous studies based on mitochondrial genomes. The gene arrangement of O. unguis was identical to that reported for another species of Succineoidea. The unique rearrangements observed for this group within Stylommatophora, may constitute synapomorphies for the superfamily."
