id,abstract
https://openalex.org/W2807088446,"The invasive yellow-legged hornet, Vespa velutina nigrithorax Lepeletier, 1836 (Hymenoptera: Vespidae), is native to Southeast Asia. It was first detected in France (in the southwest) in 2005. It has since expanded throughout Europe and has caused significant harm to honeybee populations. We must better characterize the hornet's flight capacity to understand the species' success and develop improved control strategies. Here, we carried out a study in which we quantified the flight capacities of V. velutina workers using computerized flight mills. We observed that workers were able to spend around 40% of the daily 7-hour flight tests flying. On average, they flew 10km to 30km during each flight test, although there was a large amount of variation. Workers sampled in early summer had lower flight capacities than workers sampled later in the season. Flight capacity decreased as workers aged. However, in the field, workers probably often die before this decrease becomes significant. During each flight test, workers performed several continuous flight phases of variable length that were separated by rest phases. Based on the length of those continuous flight phases and certain key assumptions, we estimated that V. velutina colony foraging radius is at least 700 m (half that in early summer); however, some workers are able to forage much farther. While these laboratory findings remain to be confirmed by field studies, our results can nonetheless help inform V. velutina biology and control efforts."
https://openalex.org/W2806277318,"We have developed a very simple method, termed absorbance summation (AS), for comparing protein concentrations between samples in ELISA assays without a standard. This method sums the observed absorbance values from all dilutions to obtain one data point for each sample to be used for comparison. AS is less computationally intensive than fitting sigmoidal curves, and it avoids the difficulty of parameter estimation for samples with absorbance values lying primarily at the lower tail of the curve. Our simulation studies showed that it performs much better than the sigmoidal curve fitting method and the conventional endpoint titer method. The power of this simple method is as high as the formal curve fitting followed by the estimation of area under the curve (AUC)."
https://openalex.org/W4236328627,"Plasmodium falciparum PfRH5 protein binds Ripr, CyRPA and Pf113 to form a complex that is essential for merozoite invasion of erythrocytes. The inter-genomic conservation of the PfRH5 complex proteins makes them attractive blood stage vaccine candidates. However, little is known about how antibodies to PfRH5, CyRPA and Pf113 are acquired and maintained in naturally exposed populations, and the role of PfRH5 complex proteins in naturally acquired immunity. To provide such data, we studied 206 Ghanaian children between the ages of 1–12 years, who were symptomatic, asymptomatic or aparasitemic and healthy. Plasma levels of antigen-specific IgG and IgG subclasses were measured by ELISA at several time points during acute disease and convalescence. On the day of admission with acute P. falciparum malaria, the prevalence of antibodies to PfRH5-complex proteins was low compared to other merozoite antigens (EBA175, GLURP-R0 and GLURP-R2). At convalescence, the levels of RH5-complex-specific IgG were reduced, with the decay of PfRH5-specific IgG being slower than the decay of IgG specific for CyRPA and Pf113. No correlation between IgG levels and protection against P. falciparum malaria was observed for any of the PfRH5 complex proteins. From this we conclude that specific IgG was induced against proteins from the PfRH5-complex during acute P. falciparum malaria, but the prevalence was low and the IgG levels decayed rapidly after treatment. These data indicate that the levels of IgG specific for PfRH5-complex proteins in natural infections in Ghanaian children were markers of recent exposure only."
https://openalex.org/W2805269773,"Until now, all known fossils of tetrapods (limbed vertebrates with digits) and near-tetrapods (such as Elpistostege, Tiktaalik, and Panderichthys) from the Devonian period have come from localities in tropical to subtropical paleolatitudes. Most are from Laurussia, a continent incorporating Europe, Greenland, and North America, with only one body fossil and one footprint locality from Australia representing the southern supercontinent Gondwana. Here we describe two previously unknown tetrapods from the Late Devonian (late Famennian) Gondwana locality of Waterloo Farm in South Africa, then located within the Antarctic Circle, which demonstrate that Devonian tetrapods were not restricted to warm environments and suggest that they may have been global in distribution."
https://openalex.org/W2806812693,"Using data provided by a ride-hailing platform, this paper examines the factors that affect taxi driver response behavior to ride-hailing requests. The empirical investigation from a driver's perspective is of great importance for ride-hailing service providers, given that approximately 40% of the hailing requests receive no response from any driver. To comprehensively understand taxi driver response behavior, we use a rich dataset to generate variables related to the spatio-temporal supply-demand intensities, the economic incentives, the requests' and the drivers' characteristics. The results show that drivers are more likely to respond to requests with economic incentives (especially a firm subsidy), and those with a lower spatio-temporal demand intensity or a higher spatio-temporal supply intensity. In addition, drivers are more likely to respond to requests involving rides covering a greater geographical distance and to those with a smaller number of repeated submissions. The drivers' characteristics, namely, the number of requests received and the number of requests responded, however, have relatively little impacts on their response probability to the current request. Our findings contribute to the related literature and provide managerial implications for ride-hailing service providers."
https://openalex.org/W2807106277,"Postoperative atrial fibrillation (POAF) is a common complication following cardiac surgery associated with increased morbidity and mortality. Although sustained hyperglycemia is a known risk factor of AF and poor ICU outcomes, emerging in-vitro studies reveal acute glycemic fluctuations to be an additional independent predictor of AF. The effect of acute glycemic fluctuations on the incidence of POAF in the clinical setting remains unclear. We aim to investigate the effect of the magnitude of acute perioperative glycemic fluctuations on the incidence of POAF in a multi-ethnic Southeast-Asian population.We obtained data from1743 patients who underwent elective CABG in a tertiary heart centre from 2009-2011. Patients were kept to a tight baseline glycemic control in accordance with hospital protocol. The magnitude of the difference between the highest and lowest perioperative glucose levels up till the first 48 postoperative hours was employed as a measure of glycemic fluctuation. Patients were divided into 4 groups for analysis based on the magnitude of glycemic fluctuation:A)0-2mmol/L(N = 147); B)>2-4mmol/L(N = 426); C)>4-6mmol/L(N = 513); D)>6mmol/L(N = 657).Our primary outcome was the incidence of POAF. Secondary outcomes included ICU and 30-day mortality and length of stay.The overall incidence of POAF was 14.7%. This increased as the magnitude of glycemic fluctuation increased, and was statistically highest in Group D(16.4%) as compared with the other 3 sub-groups. Multivariate logistic regression revealed the magnitude of perioperative glycemic fluctuation to be an independent risk factor of POAF(O.R.1.06, 95% C.I.1.01-1.11, p = 0.014).ICU length of stay was statistically highest in Group D(63.1 hours, p = < .001). However, ICU and 30 day mortality rates were similar among the 4 groups.Increased magnitudes of acute perioperative glycemic fluctuations are associated with a significantly increased risk of POAF and length of ICU stay; and should therefore be minimised but balanced against the risks of hypoglycemia so as to avoid POAF and optimise patient outcomes."
https://openalex.org/W2807582825,"Exposure to light and accumulation of aberrant visual cycle by-products causes stress in the retina. The physical and chemical properties of carotenoids may provide protection against such scenario. These pigments exist in retinas of many vertebrates, including humans. However, the absence of carotenoids in mice, the preferred ophthalmologic animal model, hindered molecular and biochemical examination of the pigments′ role in vision. We established a mouse model that accumulates significant amounts of carotenoids in the retina due to inactivating mutations in the Isx and Bco2 genes. We introduced a robust light damage protocol for the mouse retina using green (532 nm) and blue (405 nm) low-energy lasers. We observed that blue but not green laser light treatment triggered the formation of aberrant retinaldehyde isomers in the retina. The production of these visual cycle by-products was accompanied by morphologic damage in inferior parts of the mouse retina. Zeaxanthin supplementation of mice shielded retinoids from these photochemical modifications. These pigments also reduced the extent of the damage to the retina after the blue laser light insult. Thus, our study discovered a novel role of carotenoids in the visual cycle and indicated that vertebrates accumulate carotenoids to shield photoreceptors from short-wavelength light- induced damage.—Widjaia-Adhi, M. A. K., Ramkumar, S., von Lintig, J. Protective role of carotenoids in the visual cycle. 32, 6305–6315 (2018). www.fasebj.org"
https://openalex.org/W2805546680,"The allocation of time and energy to different behaviours can impact survival and fitness, and ultimately influence population dynamics. Intrinsically, the rate at which animals expend energy is a key component in understanding how they interact with surrounding environments. Activity, derived through locomotion and basic metabolism, represents the principal energy cost for most animals, although it is rarely quantified in the field. We examined some abiotic drivers of variability in locomotor activity of a free-ranging freshwater predatory fish, Murray cod (Maccullochella peelii), for six months using tri-axial accelerometers. Murray cod (n = 20) occupied discrete river reaches and generally exhibited small-scale movements (<5 km). Activity was highest during crepuscular and nocturnal periods when water temperatures were warmest (19-30°C; January-March). As water temperatures cooled (9-21°C; April-June) Murray cod were active throughout the full diel cycle and dormant periods were rarely observed. Light level, water temperature and river discharge all had a significant, non-linear effect on activity. Activity peaked during low light levels, at water temperatures of ~20°C, and at discharge rates of ~400 ML d-1. The temporal changes observed in the behaviour of Murray cod likely reflect the complex interactions between physiological requirements and prey resource behaviour and availability in driving activity, and highlight the importance of empirical field data to inform bioenergetics models."
https://openalex.org/W2805585026,"As a crucial living environment, the Internet shapes cognition. The Internet provides massive information that can be accessed quickly via hyperlinks, but the information is typically fragmentary and concrete rather than integrative. According to construal level theory, the processing of this concrete and fragmentary information, should reduce attentional scope. Two experiments were conducted to test this hypothesis. In Experiment 1, three groups of participants were asked to shop online, read magazines or have a rest respectively, and a divided attention Navon-letter task was employed to measure the attentional scope before and after the assigned activity. It was found that the difference between reaction times in response to local vs. global targets was decreased only after Internet use, while there was no decrease in either the reading or resting group. In Experiment 2, the same procedure was used, and EEG/ERP methods were used to record both behavioral response and neural activity. Results showed that before the assigned activity, there was no significant difference in N2 amplitude in response to local vs. global targets in any of the three groups; during the activity, the lower-alpha activity induced by Internet use was significantly lower than that induced by reading or resting; after the activity, correspondingly, a more negative N2 wave was induced by the global than local targets only in the Internet group, while there were no significant differences in the other groups. Consistent with construal level theory, the results suggest that when surfing the Internet, attentional scope is reduced, and this effect might continue after Internet activity."
https://openalex.org/W2807700350,"The Central American nations of Guatemala, Honduras and Nicaragua are among the poorest in the Americas. While the fraction of population dependent on solid fuels has declined in these nations over the last 25 years, the number of people using them has risen. Here, we first assess current patterns of cooking energy use in these nations. We then apply a discrete model of household cooking choices and demand to simulate future pathways of clean cooking uptake and the outlook for achieving target 7.1 of the Sustainable Development Goals (SDG), which aims to ensure universal access to affordable, reliable and modern energy services by 2030. We find that by 2030, ensuing income growth is likely to enable 90% of urban populations in these nations to switch to using modern cooking energy services. However, without supporting policies, between 40% to 50% of rural Guatemalans and Hondurans, while over two-thirds of rural Nicaraguans, are likely to find clean fuels or stoves unaffordable in 2030. A targeted subsidy on modern fuels, like liquid petroleum gas (LPG), is the most effective policy mechanism we studied that could provide such support. A 50% subsidy policy on LPG targeted to the rural and urban poor population could, by 2030, make cooking with LPG affordable to an additional 7.3 million people in these countries. We estimate that such a policy would cost about $250 million per year and would have negligible greenhouse gas emissions impacts. Such a policy could also have significant health benefits, preventing about 8,890 premature deaths annually from reduced exposure to cooking-related household pollution in 2030."
https://openalex.org/W2807577281,"Laterality can be observed as side biases in locomotory behaviour which, in the horse, manifest inter alia as forelimb preferences, most notably in the gallop. The current study investigated possible leading-leg preferences at the population and individual level in Thoroughbred racehorses (n = 2095) making halt-to-gallop transitions. Videos of flat races in the UK (n = 350) were studied to record, for each horse, the lead-leg preference of the initial stride into gallop from the starting stalls. Races from clockwise (C) and anti-clockwise (AC) tracks were chosen alternately at random to ensure equal representation. Course direction, horse age and sex, position relative to the inside rail and finishing position were also noted. On C courses, the left/right ratio was 1.15, which represents a significant bias to the left (z = –2.29, p = 0.022), while on AC courses it was 0.92 (z = 0.51, p = 0.610). In both course directions, there was no significant difference between winning horses that led with the left leading leg versus the right (C courses, z = –1.32, p = 0.19 and AC courses, z = –0.74, p = 0.46). Of the 2,095 horses studied 51.26% led with their L fore and 48.74% with their R, with no statistically significant difference (z = -1.16, p = 0.25). Therefore, there was no evidence of a population level motor laterality. Additionally, 22 male and 22 female horses were randomly chosen for repeated measures of leading leg preference. A laterality index was calculated for each of the 44 horses studied using the repeated measures: 22 exhibited right laterality (of which two were statistically significant) and 21 exhibited left laterality (eight being statistically significant); one horse was ambilateral. Using these data, left lateralized horses were more strongly lateralized on an individual level than the right lateralized horses (t = 2.28, p = 0.03, DF = 34) and mares were more left lateralized than males (t = 2.4, p = 0.03, DF = 19)."
https://openalex.org/W2805823304,"Leprosy is a complex chronic, infectious dermato-neurological disease that affects the skin and peripheral nerves especially during immuno-inflammatory episodes known as type 1/T1R and type 2/T2R reactions. This study investigated the in situ expression of CD25+Foxp3+ Treg cells and TGF-β1, IFN-γ, IL-17 in leprosy T1R and T2R. Tregs were evaluated in 114 skin biopsies from 74 leprosy patients: 56 T1R (28-paired reaction-free/reactional biopsies, 28 unpaired T1R), 18 T2R (12 paired reaction-free/reactional biopsies, 6 unpaired T2R). Double CD25+Foxp3+immunostained Treg cells obtained by automated platform (Ventana BenchMark XT, Roche, Mannheim, Germany) were counted (Nikon Eclipse E400 2mm2). Cytokine expression was evaluated by immunostaining in 96 biopsies (48 paired reaction-free/reactional lesions, 24 T1R, 24 T2R) using rabbit polyclonal anti human TGF-β1, IFN-γ, IL-17 antibodies (Santa Cruz Biotechnology CA, USA). Treg cell counts in leprosy reactional lesions were higher compared to reaction-free (p = 0.002). Treg numbers were higher in T1R compared to paired unreactional T1R lesions (p = 0.001). Similar frequency of Treg was seen in paired reactional versus unreactional T2R lesions. Higher expression of TGF-β, IFN-γ and IL-17 was seen in T2R lesions compared to T1R and reaction-free lesions. The increase in Treg cells during T1R suggests a suppressive role to control the exacerbated cellular immune response during T1R that can cause tissue and nerve damage. Evidences of upregulated Treg cells in TR1, which usually occurs in patients with Th1-Th17 immunity and the indications of the expression of Th17/IL-17 in T2R, which develops in patients with Th2-Treg profile, suggest plasticity of Treg-Th17 cells populations and a potential role for these cell populations in the immunopathogenesis of leprosy reactions."
https://openalex.org/W2806729437,"The pathophysiology of arteriovenous fistula (AVF) maturation failure is not completely understood but impaired outward remodeling (OR) and intimal hyperplasia are thought to be contributors. This adverse vascular response after AVF surgery results from interplay between vascular smooth muscle cells (VSMCs), the extracellular matrix (ECM), and inflammatory cells. Relaxin (RLN) is a hormone that acts on the vasculature via interaction with RLN/insulin-like peptide family receptor 1 (RXFP1), resulting in vasodilata-tion, ECM remodeling, and decreased inflammation. In the present study, we evaluated the consequences of RXFP1 knockout (Rxfp1-/-)onAVF maturationinamurine modelofAVF failure. Rxfp1-/- mice showed a 22% decrease in vessel size at the venous outflow tract 14 d after AVF surgery. Furthermore, a 43% increase in elastin content was observed in the lesions of Rxfp1-/- mice and coincided with a 41% reduction in elastase activity. In addition, Rxfp1-/- mice displayed a 6-fold increase in CD45+ leukocytes, along with a 2-fold increase in monocyte chemoattractant protein 1 (MCP1) levels, when compared with wild-type mice. In vitro,VSMCs from Rxfp1-/- mice exhibited a synthetic phenotype, as illustrated by augmentation of collagen, fibronectin, TGF-β, and platelet-derived growth factor mRNA. In addition, VSMCs derived from Rxfp1-/- mice showed a 5-fold increase in cell migration. Finally, RXFP1 and RLN expression levels were increased in human AVFs when compared with unoperated cephalic veins. In conclusion, RXFP1 deficiency hampers elastin degradation and results in induced vascular inflammation after AVF surgery. These processes impair OR in murine AVF, suggesting that the RLN axis could be a potential therapeutic target for promoting AVF maturation.—Bezhaeva T., de Vries M. R., Geelhoed W. J., van der Veer E. P., Versteeg S., van Alem C. M. A., Voorzaat B. M., Eijkelkamp N., van derBogt K.E., Agoulnik A.I., van Zonneveld A.-J., Quax P.H.A., Rotmans J.I. Relaxinreceptor deficiency promotes vascular inflammation and impairs outward remodeling in arteriovenous fistulas. FASEB J. 32, 6293–6304 (2018). www.fasebj.org"
https://openalex.org/W2806209365,"The genus Anthroherpon Reitter, 1889 exhibits the most pronounced troglomorphic characters among Coleoptera, and represents one of the most spectacular radiations of subterranean beetles. However, radiation, diversification, and biogeography of this genus have never been studied in a phylogenetic context. This study provides a comprehensive evolutionary analysis of the Anthroherpon radiation, using a dated molecular phylogeny as a framework for understanding Anthroherpon diversification, reconstructing the ancestral range, and exploring troglomorphic diversity. Based on 16 species and 22 subspecies, i.e. the majority of Anthroherpon diversity, we reconstructed the phylogeny using Bayesian analysis of six loci, both mitochondrial and nuclear, comprising a total of 4143 nucleotides. In parallel, a morphometric analysis was carried out with 79 landmarks on the body that were subjected to geometric morphometrics. We optimized morphometric features to phylogeny, in order to recognize the way troglomorphy was expressed in different clades of the tree, and did character evolution analyses. Finally, we reconstructed the ancestral range of the genus using BioGeoBEARS. Besides further elucidating the suprageneric classification of the East-Mediterranean Leptodirini, our main findings also show that Anthroherpon dates back to the Early Miocene (ca. 22 MYA) and that the genus diversified entirely underground. Biogeographic reconstruction of the ancestral range shows the origin of the genus in the area comprising three high mountains in western Montenegro, which is in the accordance with the available data on the paleogeography of the Balkan Peninsula. Character evolution analysis indicates that troglomorphic morphometric traits in Anthroherpon mostly evolve neutrally but may diverge adaptively under syntopic competition."
https://openalex.org/W2807056462,"Slaughterhouse surveillance through post-mortem meat inspection provides an important mechanism for detecting bovine tuberculosis (bTB) infections in cattle herds in Great Britain (GB), complementary to the live animal skin test based programme. We explore patterns in the numbers of herd breakdowns detected through slaughterhouse surveillance and develop a Bayesian hierarchical regression model to assess the associations of animal-level factors with the odds of an infected animal being detected in the slaughterhouse, allowing us to highlight slaughterhouses that show atypical patterns of detection. The analyses demonstrate that the numbers and proportions of breakdowns detected in slaughterhouses increased in GB over the period of study (1998-2013). The odds of an animal being a slaughterhouse case was strongly associated with the region of the country that the animal spent most of its life, with animals living in high-frequency testing areas of England having on average 21 times the odds of detection compared to animals living in Scotland. There was also a strong effect of age, with animals slaughtered at > 60 months of age having 5.3 times the odds of detection compared to animals slaughtered between 0-18 months of age. Smaller effects were observed for cattle having spent time on farms with a history of bTB, quarter of the year that the animal was slaughtered, movement and test history. Over-and-above these risks, the odds of detection increased by a factor of 1.1 for each year of the study. After adjustment for these variables, there were additional variations in risk between slaughterhouses and breed. Our framework has been adopted into the routine annual surveillance reporting carried out by the Animal Plant Health Agency and may be used to target more detailed investigation of meat inspection practices."
