id,abstract
https://openalex.org/W3049535451,"Inflammaging is associated with poor tissue regeneration observed in advanced age. Specifically, protracted inflammation after acute injury has been associated with decreased bone fracture healing and increased rates of nonunion in elderly patients. Here, we investigated the efficacy of using Maresin 1 (MaR1), an omega-3 fatty acid-derived pro-resolving agent, to resolve inflammation after tibial fracture injury and subsequently improving aged bone healing. Aged (24-month-old mice) underwent tibial fracture surgery and were either treated with vehicle or MaR1 3 days after injury. Fracture calluses were harvested 7 days, 14 days, 21 days, and 28 days after injury to investigate inflammatory response, cartilage development, bone deposition, and mechanical integrity, respectively. Healing bones from MaR1-treated mice displayed decreased cartilage formation and increased bone deposition which resulted in increased structural stiffness and increased force to fracture in the later stages of repair. In the early stages, MaR1 treatment decreased the number of pro-inflammatory macrophages within the fracture callus and decreased the level of inflammatory biomarkers in circulation. In tissue culture models, MaR1 treatment of bone marrow-derived macrophages from aged mice protected cells form a pro-inflammatory phenotype and induced an anti-inflammatory fate. Furthermore, the secretome of MaR1-treated bone marrow-derived macrophages was identified as osteoinductive, enhancing osteoblast differentiation of bone marrow stromal cells. Our findings here identify resolution of inflammation, and MaR1 itself, to be a point of intervention to improve aged bone healing."
https://openalex.org/W3100351242,"The superconductivity of high transition temperature (Tc) occurs in copper oxides with carrier-doping to an antiferromagnetic (AF) Mott insulator. This discovery more than thirty years ago immediately led to a prediction about the formation of a small Fermi pocket. This structure, however, has not yet been detected, while it could be a key element in relating high-Tc superconductivity to Mott physics. To address this long-standing issue, we investigate the electronic structure of a five-layered Ba2Ca4Cu5O10(F,O)2 with inner CuO2 planes demonstrated to be cleanest ever in cuprates. Most surprisingly, we find small Fermi surface (FS) pockets closed around (pi/2,pi/2) consistently by angle-resolved photoemission spectroscopy (ARPES) and quantum oscillation measurements. The d-wave superconducting gap opens along the pocket, revealing the coexistence between the superconductivity and AF order in the same CuO2 sheet. Our data further indicate that the superconductivity can occur without contribution from the states near the antinodal region, which are shared by other competing excitations such as the charge density wave (CDW) and pseudogap states. This will have significant implications for understanding the superconductivity and puzzling Fermi arc phenomena in cuprates."
https://openalex.org/W3048791277,"Replication protein A (RPA), a major eukaryotic ssDNA-binding protein, is essential for all metabolic processes that involve ssDNA, including DNA replication, repair, and damage signaling. To perform its functions, RPA binds ssDNA tightly. In contrast, it was presumed that RPA binds RNA weakly. However, recent data suggest that RPA may play a role in RNA metabolism. RPA stimulates RNA-templated DNA repair in vitro and associates in vivo with R-loops, the three-stranded structures consisting of an RNA-DNA hybrid and the displaced ssDNA strand. R-loops are common in the genomes of pro- and eukaryotes, including humans, and may play an important role in transcription-coupled homologous recombination and DNA replication restart. However, the mechanism of R-loop formation remains unknown. Here, we investigated the RNA-binding properties of human RPA and its possible role in R-loop formation. Using gel-retardation and RNA/DNA competition assays, we found that RPA binds RNA with an unexpectedly high affinity (KD ≈ 100 pm). Furthermore, RPA, by forming a complex with RNA, can promote R-loop formation with homologous dsDNA. In reconstitution experiments, we showed that human DNA polymerases can utilize RPA-generated R-loops for initiation of DNA synthesis, mimicking the process of replication restart in vivo These results demonstrate that RPA binds RNA with high affinity, supporting the role of this protein in RNA metabolism and suggesting a mechanism of genome maintenance that depends on RPA-mediated DNA replication restart."
https://openalex.org/W3049706820,"Patients with large iris defects not only suffer from functional disadvantages but also from aesthetic limitations. The aim of this study was to evaluate the aesthetic outcome of iris reconstruction using an artificial iris (AI). In this study, 82 eyes of 79 consecutive patients with mostly traumatic partial or total aniridia that underwent iris reconstruction surgery using a custom-made silicone AI (HumanOptics, Erlangen, Germany). Pre- and postoperative photographs of 66 patients were analysed subjectively and objectively. Subjective evaluation was based questionnaires. Objective evaluation included measurement of pupil centration and iris colour analysis. Averaged hues from iris areas were transferred to numerical values using the LAB-colour-system. Single parameters and overall difference value (ΔE) were compared between AI and remaining iris (RI), as well as AI and fellow eye iris (FI). Patients, eye doctors and laymen rated the overall aesthetic outcome with 8.9 ±1.4, 7.7 ±1.1 and 7.3 ±1.1 out of 10 points, respectively. Mean AI decentration was 0.35 ±0.24 mm. Better pupil centration correlated with a higher overall score for aesthetic outcome (p<0.05). The AI was on average 4.65 ±10 points brighter than RI and FI. Aniridia treatment using a custom-made artificial iris prosthesis offers a good aesthetic outcome. Pupil centration was a key factor that correlated with the amount of aesthetic satisfaction. The AI was on average slightly brighter than the RI and FI."
https://openalex.org/W3049378075,"Objective The ALS Functional Rating Scale–Revised (ALSFRS-R) is the most commonly utilized instrument to index bulbar function in both clinical and research settings. We therefore aimed to evaluate the diagnostic utility of the ALSFRS-R bulbar subscale and swallowing item to detect radiographically confirmed impairments in swallowing safety (penetration or aspiration) and global pharyngeal swallowing function in individuals with ALS. Methods Two-hundred and one individuals with ALS completed the ALSFRS-R and the gold standard videofluoroscopic swallowing exam (VFSE). Validated outcomes including the Penetration-Aspiration Scale (PAS) and Dynamic Imaging Grade of Swallowing Toxicity (DIGEST) were assessed in duplicate by independent and blinded raters. Receiver operator characteristic curve analyses were performed to assess accuracy of the ALSFRS-R bulbar subscale and swallowing item to detect radiographically confirmed unsafe swallowing (PAS > 3) and global pharyngeal dysphagia (DIGEST >1). Results Although below acceptable screening tool criterion, a score of ≤ 3 on the ALSFRS-R swallowing item optimized classification accuracy to detect global pharyngeal dysphagia (sensitivity: 68%, specificity: 64%, AUC: 0.68) and penetration/aspiration (sensitivity: 79%, specificity: 60%, AUC: 0.72). Depending on score selection, sensitivity and specificity of the ALSFRS-R bulbar subscale ranged between 34–94%. A score of < 9 optimized classification accuracy to detect global pharyngeal dysphagia (sensitivity: 68%, specificity: 68%, AUC: 0.76) and unsafe swallowing (sensitivity:78%, specificity:62%, AUC: 0.73). Conclusions The ALSFRS-R bulbar subscale or swallowing item did not demonstrate adequate diagnostic accuracy to detect radiographically confirmed swallowing impairment. These results suggest the need for alternate screens for dysphagia in ALS."
https://openalex.org/W3048376576,
https://openalex.org/W3048665493,"Surface-exposed Toll-like receptors (TLRs) such as TLR2 and TLR4 survey the extracellular environment for pathogens. TLR activation initiates the production of various cytokines and chemokines, including type I interferons (IFN-I). Downstream of TLR4, IFNβ secretion is only vigorously triggered in macrophages when the receptor undergoes endocytosis and switches signaling adaptor; surface TLR4 engagement predominantly induces proinflammatory cytokines via the signaling adaptor MyD88. It is unclear whether this dichotomy is generally applicable to other TLRs, cell types, or differentiation states. Here, we report that diverse TLR2 ligands induce an IFN-I response in human monocyte-like cells, but not in differentiated macrophages. This TLR2-dependent IFN-I signaling originates from the cell surface and depends on MyD88; it involves combined activation of the transcription factors IRF3 and NF-κB, driven by the kinases TBK1 and TAK1-IKKβ, respectively. TLR2-stimulated monocytes produced modest IFNβ levels that caused productive downstream signaling, reflected by STAT1 phosphorylation and expression of numerous interferon-stimulated genes. Our findings reveal that the outcome of TLR2 signaling includes an IFN-I response in human monocytes, which is lost upon macrophage differentiation, and differs mechanistically from IFN-I-induction through TLR4. These findings point to molecular mechanisms tailored to the differentiation state of a cell and the nature of receptors activated to control and limit TLR-triggered IFN-I responses."
https://openalex.org/W3048586480,"Resistin is a cysteine-rich adipokine that promotes the release of inflammatory cytokines, particularly interleukin 1 beta (IL-1β) and tumor necrosis factor alpha (TNF-α), which are critical pro-inflammatory mediators in osteoarthritis (OA) pathogenesis. We describe evidence of significantly higher levels of resistin, IL-1β, and TNF-α expression in OA knee synovial tissue compared with that from non-OA knees. Resistin-induced enhancement of IL-1β and TNF-α expression in human OA synovial fibroblasts (OASFs) were attenuated by MEK and ERK inhibitors, as well as their respective siRNAs. Our data reveal that resistin enhances the expression of TNF-α and IL-1β in OASFs by inhibiting miR-149 expression via MEK and ERK signaling. Our findings elucidate the inter-relationships between resistin and pro-inflammatory mediators during OA pathogenesis and could help to facilitate the development of synovium-targeted therapy in OA."
https://openalex.org/W3049395143,"Due to substantial population decline, the Korean orchid P. scolopendrifolia is considered endangered and highly threatened. Like many endangered species, it is vulnerable to biological and anthropogenic threats that can lead to the loss of genetic diversity and, ultimately, extinction. Therefore, the assessment of genetic diversity and population genetic structure is imperative for conservation. In this study, we newly developed 15 polymorphic microsatellite markers. Analyses of genetic diversity and population genetic structure that included 182 samples from 11 populations were conducted using microsatellite markers and four noncoding regions of chloroplast DNA. Our study revealed a relatively low level of genetic diversity (Ho = 0.529, He = 0.356), albeit harboring with private alleles based on microsatellite genotyping data, and high haplotype diversities based on chloroplast DNA sequences data. The results of STRUCTURE and PCoA based on microsatellite genotyping data showed population differentiations. An AMOVA based on chloroplast DNA sequence data further corroborated these conclusions, indicating about 70% of variations found among populations. Low genetic diversity and divergence among the population might have been caused by factors, such as asexual reproduction, demographic events (bottleneck and population expansion), geographic isolation, and low gene flow. The development and implication of conservation strategies and management of P. scolopendrifolia are proposed based on these results."
https://openalex.org/W3048789188,"Abstract BRAF V600E confers poor prognosis and is associated with a distinct subtype of colorectal cancer (CRC). Little is known, however, about the genetic events driving the initiation and progression of BRAF V600E mutant CRCs. Recent genetic analyses of CRCs indicate that BRAF V600E often coexists with alterations in the WNT- and p53 pathways, but their cooperation remains ill-defined. Therefore, we systematically compared small and large intestinal organoids from mice harboring conditional Braf floxV600E , Trp53 LSL-R172H , and/or Apc flox/flox alleles. Using these isogenic models, we observe tissue-specific differences toward sudden BRAF V600E expression, which can be attributed to different ERK-pathway ground states in small and large intestinal crypts. BRAF V600E alone causes transient proliferation and suppresses epithelial organization, followed by organoid disintegration. Moreover, BRAF V600E induces a fetal-like dedifferentiation transcriptional program in colonic organoids, which resembles human BRAF V600E -driven CRC. Co-expression of p53 R172H delays organoid disintegration, confers anchorage-independent growth, and induces invasive properties. Interestingly, p53 R172H cooperates with BRAF V600E to modulate the abundance of transcripts linked to carcinogenesis, in particular within colonic organoids. Remarkably, WNT-pathway activation by Apc deletion fully protects organoids against BRAF V600E -induced disintegration and confers growth/niche factor independence. Still, Apc- deficient BRAF V600E -mutant organoids remain sensitive toward the MEK inhibitor trametinib, albeit p53 R172H confers partial resistance against this clinically relevant compound. In summary, our systematic comparison of the response of small and large intestinal organoids to oncogenic alterations suggests colonic organoids to be better suited to model the human situation. In addition, our work on BRAF-, p53-, and WNT-pathway mutations provides new insights into their cooperation and for the design of targeted therapies."
https://openalex.org/W3048979007,"We have previously described a novel temporal encoding mechanism in the somatosensory system, where mechanical pulses grouped into periodic bursts create a perceived tactile frequency based on the duration of the silent gap between bursts, rather than the mean rate or the periodicity. This coding strategy may offer new opportunities for transmitting information to the brain using various sensory neural prostheses and haptic interfaces. However, it was not known whether the same coding mechanisms apply when using electrical stimulation, which recruits a different spectrum of afferents. Here, we demonstrate that the predictions of the burst gap coding model for frequency perception apply to burst stimuli delivered with electrical pulses, re-emphasising the importance of the temporal structure of spike patterns in neural processing and perception of tactile stimuli. Reciprocally, the electrical stimulation data confirm that the results observed with mechanical stimulation do indeed depend on neural processing mechanisms in the central nervous system, and are not due to skin mechanical factors and resulting patterns of afferent activation."
https://openalex.org/W3049746328,"Anthropogenic activities in catchments used for drinking water production largely contaminates source waters, and this may impact the quality of the final drinking water product. These contaminants may also affect taxonomic and functional profiles of the bacterial communities in the drinking water. Here, we report an integrated insight into the microbiome and water quality of four water treatment plants (NWC, NWE, WCA and NWG) that supply portable water to communities in South Africa. A new scoring system based on combined significant changes of physicochemical parameters and microbial abundance from raw to treated water was used to evaluate the effectiveness of the treatment plants at water purification. Physicochemical parameters which include total soluble solids, turbidity, pH, nitrites and phosphorus among others, were measured in source, treated, and distributed water. There were general statistically significant (P ≤ 0.05) differences between raw and treated water, demonstrating the effectiveness of the purification process. Illumina sequencing of the 16S rRNA gene was used for taxonomic profiling of the microbial communities and this data was used to infer functional attributes of the communities. Structure and composition of the bacterial communities differed significantly (P < 0.05) among the treatment plants, only NWE and NWG showed no significant differences (P > 0.05), this correlated with the predicted functional profile of the microbial communities obtained from Phylogenetic Investigation of Communities by Reconstruction of Observed States (PICRUSt), as well as the likely pollutants of source water. Bacteroidetes, Chlorobi and Fibrobacteres significantly differed (P < 0.05) between raw and distributed water. PICRUSt inferred a number of pathways involved in the degradation of xenobiotics such as Dichlorodiphenyltrichloroethane, atrazine and polycyclic aromatic hydrocarbons. More worryingly, was the presence of pathways involved in beta-lactam resistance, potential pathogenic Escherichia coli infection, Vibrio cholerae infection, and Shigellosis. Also present in drinking and treated water were OTUs associated with a number of opportunistic pathogens."
https://openalex.org/W3049248537,"Elastic fibers containing elastin play an important role in tendon functionality, but the knowledge on presence and function of elastin during tendon healing is limited. The aim of this study was to investigate elastin content and distribution in intact and healing Achilles tendons and to understand how elastin influence the viscoelastic properties of tendons. The right Achilles tendon was completely transected in 81 Sprague-Dawley rats. Elastin content was quantified in intact and healing tendons (7, 14, and 28 days post-surgery) and elastin distribution was visualized by immunohistochemistry at 14 days post-surgery. Degradation of elastin by elastase incubation was used to study the role of elastin on viscoelastic properties. Mechanical testing was either performed as a cyclic test (20× 10 N) or as a creep test. We found significantly higher levels of elastin in healing tendons at all time-points compared to intact tendons (4% in healing tendons 28 days post-surgery vs 2% in intact tendons). The elastin was more widely distributed throughout the extracellular matrix in the healing tendons in contrast to the intact tendon where the distribution was not so pronounced. Elastase incubation reduced the elastin levels by approximately 30% and led to a 40%-50% reduction in creep. This reduction was seen in both intact and healing tendons. Our results show that healing tendons contain more elastin and is more compliable than intact tendons. The role of elastin in tendon healing and tissue compliance indicates a protective role of elastic fibers to prevent re-injuries during early tendon healing. Plain Language Summary Tendons transfer high loads from muscles to bones during locomotion. They are primarily made by the protein collagen, a protein that provide strength to the tissues. Besides collagen, tendons also contain other building blocks such as, for example, elastic fibers. Elastic fibers contain elastin and elastin is important for the extensibility of the tendon. When a tendon is injured and ruptured the tissue heals through scar formation. This scar tissue is different from a normal intact tendon and it is important to understand how the tendons heal. Little is known about the presence and function of elastin during healing of tendon injuries. We have shown, in animal experiments, that healing tendons have higher amounts of elastin compared to intact tendons. The elastin is also spread throughout the tissue. When we reduced the levels of this protein, we discovered altered mechanical properties of the tendon. The healing tendon can normally extend quite a lot, but after elastin removal this extensibility was less obvious. The ability of the healing tissue to extend is probably important to protect the tendon from re-injuries during the first months after rupture. We therefore propose that the tendons heal with a large amount of elastin to prevent re-ruptures during early locomotion."
https://openalex.org/W3049518094,"Objective As native cartilage consists of different phenotypical zones, this study aims to fabricate different types of neocartilage constructs from collagen hydrogels and human mesenchymal stromal cells (MSCs) genetically modified to express different chondrogenic factors. Design Human MSCs derived from bone-marrow of osteoarthritis (OA) hips were genetically modified using adenoviral vectors encoding sex-determining region Y-type high-mobility-group-box (SOX) 9, transforming growth factor beta (TGFB) 1 or bone morphogenetic protein (BMP) 2 cDNA, placed in type I collagen hydrogels and maintained in serum-free chondrogenic media for three weeks. Control constructs contained unmodified MSCs or MSCs expressing GFP. The respective constructs were analyzed histologically, immunohistochemically, biochemically, and by qRT-PCR for chondrogenesis and hypertrophy. Results Chondrogenesis in MSCs was consistently and strongly induced in collagen I hydrogels by the transgenes SOX9, TGFB1 and BMP2 as evidenced by positive staining for proteoglycans, chondroitin-4-sulfate (CS4) and collagen (COL) type II, increased levels of glycosaminoglycan (GAG) synthesis, and expression of mRNAs associated with chondrogenesis. The control groups were entirely non-chondrogenic. The levels of hypertrophy, as judged by expression of alkaline phosphatase (ALP) and COL X on both the protein and mRNA levels revealed different stages of hypertrophy within the chondrogenic groups (BMP2>TGFB1>SOX9). Conclusions Different types of neocartilage with varying levels of hypertrophy could be generated from human MSCs in collagen hydrogels by transfer of genes encoding the chondrogenic factors SOX9, TGFB1 and BMP2. This technology may be harnessed for regeneration of specific zones of native cartilage upon damage."
https://openalex.org/W3048987312,"Preeclampsia, especially early-onset severe preeclampsia is one of the leading causes of maternal and fetal morbidity and mortality. Although it has been well known that the pathophysiology of early-onset severe preeclampsia begins with abnormal placentation and aberrant activation of TGF-β signaling inhibits trophoblast cell invasion, the mechanisms underlying dysregulation of TGF-β signaling in early-onset severe preeclampsia remain elusive to date. Here, we revealed that induction of TGFBR1/TGF-β signaling mediated by DNMT3A downregulation plays a critical role in early-onset severe preeclampsia. Our results show that DNMT3A downregulation elevates TGFBR1 expression in trophoblast cells. Moreover, inhibition of TGFBR1 and TGF-β/Smad signaling can rescue the deficiencies of trophoblast cell migration and invasion caused by DNMT3A knockdown. Mechanistically, DNMT3A suppresses the transcription of TGFBR1 through recruiting EZH2 to its promoter but not changing DNA methylation of TGFBR1 promoter. In human samples, we detected lowly expressed DNMT3A, highly expressed TGFBR1 and hyperactivation of TGF-β/Smad signaling in decidua-embedded extravillous trophoblasts in early-onset severe preeclampsia, which provides the clinical evidence for the correlation between DNMT3A and TGFBR1. Collectively, our findings demonstrate that DNA methylation-independent induction of TGFBR1 mediated by DNMT3A downregulation is relevant to the development of early-onset severe preeclampsia."
https://openalex.org/W3049621735,"We established that Endosidin2 (ES2) affected the trafficking routes of both newly synthesized and endocytic pools of PIN-FORMED2 (PIN2) in Arabidopsis root epidermal cells. PIN2 populations accumulated in separated patches, which gradually merged into large and compact ES2 aggregates (ES2As). FM4-64 endocytic tracer labeled ES2As as well. Both PIN2 pools also appeared in vacuoles. Accelerated endocytosis of PIN2, its aggregation in the cytoplasm, and redirection of PIN2 flows to vacuoles led to a substantial reduction of the abundance of this protein in the plasma membrane. Whereas PIN-FORMED3 and PIN-FORMED4 also aggregated in the cytoplasm, SYT1 was not sensitive to ES2 treatment and did not appear either in the cytoplasmic aggregates or vacuoles. Ultrastructural analysis revealed that ES2 affects the Golgi apparatus so that stacks acquired cup-shape and even circular shape surrounded by several vesicles. Abnormally shaped Golgi stacks, stack remnants, multi-lamellar structures, separated Golgi cisterna rings, tubular structures, and vesicles formed discrete clusters."
