id,abstract
https://openalex.org/W2054865674,"In 1979, Gibson first advanced the idea that the sight of graspable objects automatically activates in the observer the repertoire of actions necessary to interact with them, even in the absence of any intention to act (“affordance effect”). The neurophysiological substrate of this effect was later identified in a class of bimodal neurons, the so-called ""canonical"" neurons, located within monkey premotor cortex. In humans, even if different behavioral studies supported the existence of affordance effect, neurophysiological investigations exploring its neural substrates showed contradictory results. Here, by means of Transcranial Magnetic Stimulation (TMS), we explored the time-course of the “affordance effect” elicited by the observation of everyday-life graspable objects on motor cortex of resting observers. We recorded motor evoked potentials (MEP) from three intrinsic hand muscles (two ""synergic"" for grasping, OP and FDI and one ""neutral"", ADM). We found that objects’ vision determined an increased excitability at 120 milliseconds after their presentation. Moreover, this modulation was proved to be specific to the cortical representations of synergic muscles. From an evolutionary perspective, this timing perfectly fits with a fast recruitment of the motor system aimed at rapidly and accurately choosing the appropriate motor plans in a competitive environment filled with different opportunities."
https://openalex.org/W1972055489,"The nanoparticle industry is expected to become a trillion dollar business in the near future. Therefore, the unintentional introduction of nanoparticles into the environment is increasingly likely. However, currently applied risk-assessment practices require further adaptation to accommodate the intrinsic nature of engineered nanoparticles. Combining a chronic flow-through exposure system with subsequent acute toxicity tests for the standard test organism Daphnia magna, we found that juvenile offspring of adults that were previously exposed to titanium dioxide nanoparticles exhibit a significantly increased sensitivity to titanium dioxide nanoparticles compared with the offspring of unexposed adults, as displayed by lower 96 h-EC50 values. This observation is particularly remarkable because adults exhibited no differences among treatments in terms of typically assessed endpoints, such as sensitivity, number of offspring, or energy reserves. Hence, the present study suggests that ecotoxicological research requires further development to include the assessment of the environmental risks of nanoparticles for the next and hence not directly exposed generation, which is currently not included in standard test protocols."
https://openalex.org/W2045188595,"Hydrogen is a highly promising energy source with important social and economic implications. The ability of green algae to produce photosynthetic hydrogen under anaerobic conditions has been known for years. However, until today the yield of production has been very low, limiting an industrial scale use. In the present paper, 73 years after the first report on H2-production from green algae, we present a combinational biological system where the biodegradation procedure of one meta-substituted dichlorophenol (m-dcp) is the key element for maintaining continuous and high rate H2-production (>100 times higher than previously reported) in chloroplasts and mitochondria of the green alga Scenedesmus obliquus. In particular, we report that reduced m-dcps (biodegradation intermediates) mimic endogenous electron and proton carriers in chloroplasts and mitochondria, inhibit Photosystem II (PSII) activity (and therefore O2 production) and enhance Photosystem I (PSI) and hydrogenase activity. In addition, we show that there are some indications for hydrogen production from sources other than chloroplasts in Scenedesmus obliquus. The regulation of these multistage and highly evolved redox pathways leads to high yields of hydrogen production and paves the way for an efficient application to industrial scale use, utilizing simple energy sources and one meta-substituted dichlorophenol as regulating elements."
https://openalex.org/W1996326547,"Mercury is an environmental pollutant that reduces nitric oxide (NO) bioavailability and increases oxidative stress, having a close link with cardiovascular diseases, as carotid atherosclerosis, myocardial infarction, coronary heart disease and hypertension. One of the main sites affected by oxidative stress, which develops atherosclerosis, is the aorta. Under acute exposure to low mercury concentrations reactive oxygen species (ROS) production were only reported for resistance vessels but if low concentrations of mercury also affect conductance arteries it is still unclear. We investigated the acute effects of 6 nM HgCl2 on endothelial function of aortic rings measuring the reactivity to phenylephrine in rings incubated, or not, with HgCl2 for 45 min, the protein expression for cyclooxygenase 2 (COX-2) and the AT1 receptor. HgCl2 increased Rmax and pD2 to phenylephrine without changing the vasorelaxation induced by acetylcholine and sodium nitroprusside. Endothelial damage abolished the increased reactivity to phenylephrine. The increase of Rmax and pD2 produced by L-NAME was smaller in the presence of HgCl2. Enalapril, losartan, indomethacin, furegrelate, the selective COX-2 inhibitor NS 398, superoxide dismutase and the NADPH oxidase inhibitor apocynin reverted HgCl2 effects on the reactivity to phenylephrine, COX-2 protein expression was increased, and AT1 expression reduced. At low concentration, below the reference values, HgCl2 increased vasoconstrictor activity by reducing NO bioavailability due to increased ROS production by NADPH oxidase activity. Results suggest that this is due to local release of angiotensin II and prostanoid vasoconstrictors. Results also suggest that acute low concentration mercury exposure, occurring time to time could induce vascular injury due to endothelial oxidative stress and contributing to increase peripheral resistance, being a high risk factor for public health."
https://openalex.org/W2084897870,"Chronic activation of Wnt/ß-catenin signaling is found in a variety of human malignancies including melanoma, colorectal and hepatocellular carcinomas. Interestingly, expression of the HCMV-encoded chemokine receptor US28 in intestinal epithelial cells promotes intestinal neoplasia in transgenic mice, which is associated with increased nuclear accumulation of ß-catenin. In this study we show that this viral receptor constitutively activates ß-catenin and enhances ß-catenin-dependent transcription. Our data illustrate that this viral receptor does not activate ß-catenin via the classical Wnt/Frizzled signaling pathway. Analysis of US28 mediated signaling indicates the involvement of the Rho-Rho kinase (ROCK) pathway in the activation of ß-catenin. Moreover, cells infected with HCMV show significant increases in ß-catenin stabilization and signaling, which is mediated to a large extent by expression of US28. The modulation of the ß-catenin signal transduction pathway by a viral chemokine receptor provides alternative regulation of this pathway, with potential relevance for the development of colon cancer and virus-associated diseases."
https://openalex.org/W2036289879,"Preeclampsia (PE) is a heterogeneous syndrome affecting 2% to 8% of all pregnancies and is the world's leading cause of fetal and maternal morbidity and mortality. In many cases of PE, shallow trophoblast invasion results in inappropriate maternal spiral artery remodeling and impaired placental function. Multiple genes have been implicated in trophoblast invasion, among which are KiSS-1 and GPR54. The gene product of KiSS-1 is metastin, which is a ligand for the receptor GPR54. Both metastin and GPR54 are expressed in the placenta of normal pregnancy and have been implicated in modulating trophoblast invasion through inhibiting migration of trophoblast cells. We have previously reported that the expression level of KiSS-1 was higher in trophoblasts from women with preeclampsia as compared to normal controls. Here, using quantitative RT-PCR, Western blot analysis and immunohistochemistry, we extend our analysis to demonstrate that elevated KiSS-1 expression occurs only in early-onset preeclampsia (ePE) and not late-onset preeclampsia (lPE). However, no difference in the expression levels of GPR54 is observed between ePE, lPE, and normal controls. Further, we show that KiSS-1 expression is also increased in placenta of intrauterine death and birth asphyxia in comparison to normal newborns of ePE and lPE. Our findings suggest that aberrant upregulation of KiSS-1 expression may contribute to the underlying mechanism of ePE as well as birth asphyxia."
https://openalex.org/W2021865270,"The U.S. Food and Drug Administration recently issued new rules for using ceftiofur in food animals in part because of an increasing prevalence of enteric bacteria that are resistant to 3(rd)-generation cephalosporins. Parenteral ceftiofur treatment, however, has limited effects on enteric bacteria so we tested the hypothesis that excreted ceftiofur metabolites exert significant selection pressure for ceftiofur-resistant Escherichia coli in soil. Test matrices were prepared by mixing soil with bovine feces and adding urine containing ceftiofur metabolites (CFM) (0 ppm, ∼50 ppm and ∼100 ppm). Matrices were incubated at 23°C or 4°C for variable periods of time after which residual CFM was quantified using a bioassay. Bla(CMY-2) plasmid-bearing ceftiofur resistant (cef(R)) E. coli and one-month old calves were used to study the selection effects of CFM and transmission of cef(R) bacteria from the environment back to animals. Our studies showed that urinary CFM (∼13 ppm final concentration) is biologically degraded in soil within 2.7 days at 23°C, but persists up to 23.3 days at 4°C. Even short-term persistence in soil provides a >1 log(10) advantage to resistant E. coli populations, resulting in significantly prolonged persistence of these bacteria in the soil (∼two months). We further show that resistant strains readily colonize calves by contact with contaminated bedding and without antibiotic selection pressure. Ceftiofur metabolites in urine amplify resistant E. coli populations and, if applicable to field conditions, this effect is far more compelling than reported selection in vivo after parenteral administration of ceftiofur. Because ceftiofur degradation is temperature dependent, these compounds may accumulate during colder months and this could further enhance selection as seasonal temperatures increase. If cost-effective engineered solutions can be developed to limit ex vivo selection, this may limit proliferation for ceftiofur resistant enteric bacteria while preserving the ability to use this important antibiotic in food animal production."
https://openalex.org/W1988931853,"An easier assessment model would be helpful for high-throughput screening of Aeromonas virulence. The previous study indicated the potential of Tetrahymena as a permissive model to examine virulence of Aeromonas hydrophila. Here our aim was to assess virulence of Aeromonas spp. using two model hosts, a zebrafish assay and Tetrahymena-Aeromonas co-culture, and to examine whether data from the Tetrahymena thermophila model reflects infections in the well-established animal model. First, virulence of 39 Aeromonas strains was assessed by determining the 50% lethal dose (LD(50)) in zebrafish. LD(50) values ranging from 1.3×10(2) to 3.0×10(7) indicated that these strains represent a high to moderate degree of virulence and could be useful to assess virulence in the Tetrahymena model. In Tetrahymena-Aeromonas co-culture, we evaluated the virulence of Aeromonas by detecting relative survival of Aeromonas and Tetrahymena. An Aeromonas isolate was considered virulent when its relative survival was greater than 60%, while the Aeromonas isolate was considered avirulent if its relative survival was below 40%. When relative survival of T. thermophila was lower than 40% after co-culture with an Aeromonas isolate, the bacterial strain was regarded as virulent. In contrast, the strain was classified as avirulent if relative survival of T. thermophila was greater than 50%. Encouragingly, data from the 39 Aeromonas strains showed good correlation in zebrafish and Tetrahymena-Aeromonas co-culture models. The results provide sufficient data to demonstrate that Tetrahymena can be a comparable alternative to zebrafish for determining the virulence of Aeromonas isolates."
https://openalex.org/W2137824047,"The Fe(II)- and 2-oxoglutarate (2OG)-dependent dioxygenase AlkB from E. coli is a demethylase which repairs alkyl lesions in DNA, as well as RNA, through a direct reversal mechanism. Humans possess nine AlkB homologs (ALKBH1-8 and FTO). ALKBH2 and ALKBH3 display demethylase activities corresponding to that of AlkB, and both ALKBH8 and FTO are RNA modification enzymes. The biochemical functions of the rest of the homologs are still unknown. To increase our knowledge on the functions of ALKBH4 and ALKBH7 we have here performed yeast two-hybrid screens to identify interaction partners of the two proteins. While no high-confidence hits were detected in the case of ALKBH7, several proteins associated with chromatin and/or involved in transcription were found to interact with ALKBH4. For all interaction partners, the regions mediating binding to ALKBH4 comprised domains previously reported to be involved in interaction with DNA or chromatin. Furthermore, some of these partners showed nuclear co-localization with ALKBH4. However, the global gene expression pattern was only marginally altered upon ALKBH4 over-expression, and larger effects were observed in the case of ALKBH7. Although the molecular function of both proteins remains to be revealed, our findings suggest a role for ALKBH4 in regulation of gene expression or chromatin state."
https://openalex.org/W1986821329,"The continuous emergence of virus that are resistant to current anti-viral drugs, combined with the introduction of new viral pathogens for which no therapeutics are available, creates an urgent need for the development of novel broad spectrum antivirals. Type I interferon (IFN) can, by modulating the cellular expression profile, stimulate a non-specific antiviral state. The antiviral and adjuvant properties of IFN have been extensively demonstrated; however, its clinical application has been so far limited. We have developed a human cell-based assay that monitors IFN-β production for use in a high throughput screen. Using this assay we screened 94,398 small molecules and identified 18 compounds with IFN-inducing properties. Among these, 3 small molecules (C3, E51 and L56) showed activity not only in human but also in murine and canine derived cells. We further characterized C3 and showed that this molecule is capable of stimulating an anti-viral state in human-derived lung epithelial cells. Furthermore, the IFN-induction by C3 is not diminished by the presence of influenza A virus NS1 protein or hepatitis C virus NS3/4A protease, which make this molecule an interesting candidate for the development of a new type of broad-spectrum antiviral. In addition, the IFN-inducing properties of C3 also suggest its potential use as vaccine adjuvant."
https://openalex.org/W1976551983,"Our previous research results showed that both Ras homolog family member C (RhoC) and IQ-domain GTPase-activating protein 1 (IQGAP1) were over-expressed in gastric cancer tissues and cells, but their role in tumorigenensis has not been addressed clearly. Herein we reported the proliferation stimulating effect of RhoC and IQGAP1 on gastric cancer cells and the interaction between two proteins in regulating the proliferation of gastric cancer cells. Plasmids and viral constructs encoding target siRNA and DNA were used to alter the expression of RhoC and IQGAP1. MTT method and BrdU incorporation assay were used for analyzing the effect of RhoC and different structures of IQGAP1 on proliferation. Protein levels of IQGAP1 and RhoC in cell lines were detected by Western blotting. Immunofluorescence and Co-Immunoprecipitation assays were applied to investigate the localization and binding between RhoC and IQGAP1. The results showed that RhoC, IQGAP1 and the C-terminal fragment of IQGAP1 significantly stimulated the proliferation of gastric cancer cells, and enhanced the expression of cyclin E and cyclin D1. By contrast, reduction of endogenous IQGAP1 or RhoC by siRNA attenuated cell proliferation. The depletion of IQGAP1 expression by siRNA significantly blocked the proliferative activity of constitutively active RhoC, while RhoC silencing by siRNA had no effect on IQGAP1-induced proliferation in gastric cancer cells. Co-immunoprecipitation and Immunofluorescence assays showed that RhoC and IQGAP1 bound each other. In conclusion, our results suggest that RhoC stimulates the proliferation of gastric cancer cells through recruiting IQGAP1 as an effector."
https://openalex.org/W1994266871,"Heat-shock is an acute insult to the mammalian proteome. The sudden elevation in temperature has far-reaching effects on protein metabolism, leads to a rapid inhibition of most protein synthesis, and the induction of protein chaperones. Using heat-shock in cells of neuronal (SH-SY5Y) and glial (CCF-STTG1) lineage, in conjunction with detergent extraction and sedimentation followed by LC-MS/MS proteomic approaches, we sought to identify human proteins that lose solubility upon heat-shock. The two cell lines showed largely overlapping profiles of proteins detected by LC-MS/MS. We identified 58 proteins in detergent insoluble fractions as losing solubility in after heat shock; 10 were common between the 2 cell lines. A subset of the proteins identified by LC-MS/MS was validated by immunoblotting of similarly prepared fractions. Ultimately, we were able to definitively identify 3 proteins as putatively metastable neural proteins; FEN1, CDK1, and TDP-43. We also determined that after heat-shock these cells accumulate insoluble polyubiquitin chains largely linked via lysine 48 (K-48) residues. Collectively, this study identifies human neural proteins that lose solubility upon heat-shock. These proteins may represent components of the human proteome that are vulnerable to misfolding in settings of proteostasis stress."
https://openalex.org/W2074071321,"The transcription factor gene Sox2 is expressed in embryonic neural stem/progenitor cells and previous evidence suggests that it is also expressed in adult neural stem cells. To target Sox2-expressing neural stem/progenitor cells in a temporal manner, we generated a bacterial artificial chromosome (BAC) transgenic mouse line, in which an inducible form of Cre, CreER™, is expressed under Sox2 regulatory elements. Inducible Cre activity in these mice was characterized using floxed reporters. During development, the Sox2-CreER transgenic mice show inducible Cre activity specifically in CNS stem/progenitor cells, making them a useful tool to regulate the expression of floxed genes temporally in embryonic neural stem/progenitor cells. In the adult, we examined the cell-specific expression of Sox2 and performed long-term lineage tracing. Four months after the transient induction of Cre activity, recombined GFAP+ stem-like cells and DCX+ neuroblasts were still abundant in the neurogenic regions including the subventricular zone (SVZ), rostral migratory stream (RMS), and subgranular zone (SGZ) of the dentate gyrus. These results provide definitive in vivo evidence that Sox2 is expressed in neural stem cells (NSC) in both the SVZ and SGZ that are capable of self-renewal and long-term neurogenesis. Therefore, Sox2-CreER mice should be useful in targeting floxed genes in adult neural stem cells."
https://openalex.org/W2008451830,"Gram-positive bacteria assemble pili through class C sortase enzymes specialized in polymerizing pilin subunits into covalently linked, high-molecular-weight, elongated structures. Here we report the crystal structures of two class C sortases (SrtC1 and SrtC2) from Group B Streptococcus (GBS) Pilus Island 1. The structures show that both sortases are comprised of two domains: an 8-stranded β-barrel catalytic core conserved among all sortase family members and a flexible N-terminal region made of two α-helices followed by a loop, known as the lid, which acts as a pseudo-substrate. In vitro experiments performed with recombinant SrtC enzymes lacking the N-terminal portion demonstrate that this region of the enzyme is dispensable for catalysis but may have key roles in substrate specificity and regulation. Moreover, in vitro FRET-based assays show that the LPXTG motif common to many sortase substrates is not the sole determinant of sortase C specificity during pilin protein recognition."
https://openalex.org/W1975445229,"Androgen receptor (AR) is involved in the development and progression of prostate cancers. However, the mechanisms by which this occurs remain incompletely understood. In previous reports, chicken ovalbumin upstream promoter-transcription factor II (COUP-TF II) has been suggested to play a role in the development of cancers. In the present study, we explored a putative role of COUP-TF II in prostate cancers by investigating its effect on cell proliferation and a cross-talk between COUP-TF II and AR. Overexpression of COUP-TF II results in the inhibition of androgen-dependent proliferation of prostate cancer cells. Further studies show that COUP-TF II functions as a corepressor of AR. It represses AR transactivation on target promoters containing the androgen response element (ARE) in a dose-dependent manner. In addition, COUP-TF II interacts physically with AR in vitro and in vivo. It binds to both the DNA binding domain (DBD) and the ligand-binding domain (LBD) of AR and disrupts the N/C terminal interaction of AR. Furthermore, COUP-TF II competes with coactivators such as ARA70, SRC-1, and GRIP1 to modulate AR transactivation as well as inhibiting the recruitment of AR to its ARE-containing target promoter. Taken together, our findings suggest that COUP-TF II is a novel corepressor of AR, and provide an insight into the role of COUP-TF II in prostate cancers."
https://openalex.org/W2018191400,"Epigenetic modifications may occur during in vitro manipulations of stem cells but these effects have remained unexplored in the context of cell and gene therapy protocols. In an experimental model of ex vivo gene modification for hematopoietic gene therapy, human CD34(+) cells were cultured shortly in the presence of cytokines then with a gene transfer lentiviral vector (LV) expected to transduce cells but to have otherwise limited biological effects on the cells. At the end of the culture, the population of cells remained largely similar at the phenotypic level but some epigenetic changes were evident. Exposure of CD34(+) cells to cytokines increased nuclear expression of epigenetic regulators SIRT1 or DNMT1 and caused genome-wide DNA methylation changes. Surprisingly, the LV caused additional and distinct effects. Large-scale genomic DNA methylation analysis showed that balanced methylation changes occurred in about 200 genes following culture of CD34(+) cells in the presence of cytokines but 900 genes were modified following addition of the LV, predominantly increasing CpG methylation. Epigenetic effects resulting from ex vivo culture and from the use of LV may constitute previously unsuspected sources of biological effects in stem cells and may provide new biomarkers to rationally optimize gene and cell therapy protocols."
https://openalex.org/W2027952526,"According to life-history theory, the allocation of limiting resources to one trait has negative consequences for other traits requiring the same resource, resulting in trade-offs among life-history traits, such as reproduction and survival. In vertebrates, oxidative stress is increasingly being considered among the physiological mechanisms forming the currency of life-history trade-offs. In this study of the barn swallow (Hirundo rustica), we focus on the oxidative costs of reproduction, especially egg laying, by investigating the effects of breeding stage (pre- vs. post-laying) and progression of the season on three biomarkers of oxidative damage (OD) to plasma proteins, namely the concentration of malondialdehyde (MDA)-protein adducts and of protein thiol groups (PSH), and the protein carbonyl (PCO) content. Moreover, we investigated whether males and females differed in plasma OD levels, because the inherent sex differences in reproductive roles and physiology may originate sex-specific patterns of OD during breeding. We found that MDA-protein adduct levels were higher in the pre-laying than in the post-laying phase, that males had lower levels of MDA-modified proteins than females, and that the decline of MDA-protein adduct concentration between the pre- and the post-laying phase was more marked for females than males. In addition, MDA-protein adduct levels declined with sampling date, but only during the pre-laying phase. On the other hand, plasma PCO levels increased from the pre- to the post-laying phase in both sexes, and females had higher levels of PCO than males. PSH concentration was unaffected by breeding stage, sex or sampling date. On the whole, our findings indicate that biomarkers of protein oxidation closely track the short-term variation in breeding stage of both male and female barn swallows. Moreover, the higher protein OD levels observed among females compared to males suggest that egg laying entails oxidative costs, which might negatively affect female residual reproductive value."
