id,abstract
https://openalex.org/W2806035797,"Background Huntington disease (HD) is an autosomal dominant neurodegenerative disorder caused by a mutation in the huntingtin (HTT) gene, which results in brain neurodegeneration and peripheral pathology affecting different organs including testis. Patients with HD suffer from motor and cognitive impairment, and multiple psychiatric symptoms. Among behavioral abnormalities in HD, sexual disturbances have often been reported, but scarcely investigated in animal models. The BACHD rat model of HD carries the human full-length mutated HTT (mHTT) genomic sequence with 97 CAG-CAA repeats and displays HD-like alterations at neuropathological and behavioral level. Objective This study aims to phenotype the BACHD rats’ sexual behavior and performance as well as testis morphology because alterations in these aspects have been associated to HD. Methods Two rat cohorts at the age of 3 and 7 months were subjected to mating tests to assess different parameters of sexual behavior. Histological analyses for testis morphology were performed in different rat cohorts at 1.5, 7 and 12 months of age whereas immunohistochemical analyses were carried out at 7 and 12 months of age to visualize the presence of mHTT in testicular tissue. Furthermore, western blot analyses were used to assess HTT and mHTT expression levels in striatum and testis at three months of age. Results At 3 months, BACHD rats showed a decreased time exploring the female anogenital area (AGA), decreased latency to mount, increased number of intromissions and ejaculations and enhanced hit rate. At 7 months, all sexual parameters were comparable between genotypes with the exception that BACHD rats explored the AGA less than wild type rats. Testis analyses did not reveal any morphological alteration at any of the examined ages, but showed presence of mHTT limited to Sertoli cells in transgenic rats at both 7 and 12 months. BACHD rat HTT and mHTT expression levels in testis were lower than striatum at 3 months of age. Conclusions The testis phenotype in the BACHD rat model does not mimic the changes observed in human HD testis. The altered sexual behavior in BACHD rats at three months of age could be to a certain extent representative of and share common underlying pathways with some of the sexual disturbances in HD patients. Further investigating the biological causes of the sexual phenotype in BACHD rats may therefore contribute to clarifying the mechanisms at the base of sexual behavior changes in HD."
https://openalex.org/W2805964336,"Mast cells, in addition to endocrine cells and neurons, are typical secretory cells. Their function in allergic inflammation is to secrete inflammatory mediators from secretory vesicles. Intracellular synthesized inflammatory mediators are transported by vesicular monoamine transporters (VMATs) to vesicles where they are stored. After stimulation, the contents of the secretory vesicles are released via exocytosis. This study established a high throughput imaging screening system to monitor the functions of secretory vesicles in mast cells, including molecular uptake via VMAT2 and the exocytotic process, by using a novel fluorescent probe, FFN206, which was developed as a VMAT2 substrate. After loading with FFN206, the rapid uptake of FFN206 was observed and secretory vesicles in mouse bone marrow derived mast cells and a cultured mast cell line were clearly visualized. FFN206 uptake by secretory vesicles was time-dependent and was blocked by reserpine. Furthermore, exocytotic trafficking was monitored dynamically by real-time high-throughput fluorescence quantitation. In the present study, we verified the application of FFN206 for the monitoring of functional vesicles. This high-throughput screening system may benefit instinctive drug evaluation."
https://openalex.org/W2805312371,"The freshwater crustacean Daphnia have a long history in water quality assessments and now lend themselves to detection of targeted chemicals using genetically encoded reporter gene due to recent progress in the development of genome editing tools. By introducing human genes into Daphnia, we may be able to detect chemicals that affect the human system, or even apply it to screening potentially useful chemicals. Here, we aimed to develop a transgenic line of Daphnia magna that contains the human estrogen receptor alpha (hERα) and shows a fluorescence response to exposure of estrogens. We designed plasmids to express hERα in Daphnia (EF1α1:esr1) and to report estrogenic activity via red fluorescence (ERE:mcherry) under the control of estrogen response element (ERE). After confirmation of functionality of the plasmids by microinjection into embryos, the two plasmids were joined, a TALE site was added and integrated into the D. magna genome using TALEN. When the resulting transgenic Daphnia named the ES line was exposed to Diethylstilbestrol (DES) or 17β-Estradiol (E2), the ES line could reliably expressed red fluorescence derived from mCherry in a ligand-dependent manner, indicating that an estrogen-responsive line of D. magna was established. This is the first time a human gene was expressed in Daphnia, showcasing potential for further research."
https://openalex.org/W2806064287,"In the Speech-to-Song Illusion, repetition of a spoken phrase results in it being perceived as if it were sung. Although a number of previous studies have examined which characteristics of the stimulus will produce the illusion, there is, until now, no description of the cognitive mechanism that underlies the illusion. We suggest that the processes found in Node Structure Theory that are used to explain normal language processing as well as other auditory illusions might also account for the Speech-to-Song Illusion. In six experiments we tested whether the satiation of lexical nodes, but continued priming of syllable nodes may lead to the Speech-to-Song Illusion. The results of these experiments provide evidence for the role of priming, activation, and satiation as described in Node Structure Theory as an explanation of the Speech-to-Song Illusion."
https://openalex.org/W2806174757,"The bacterial species Campylobacter jejuni RM1221 (CjR) is the primary cause of campylobacteriosis which poses a global threat for human health. Over the years the efficacy of antibiotic treatment is becoming more fruitless due to the development of multiple drug resistant strains. Therefore, identification of new drug targets is a valuable tool for the development of new treatments for affected patients and can be obtained by targeting essential protein(s) of CjR. We conducted this in silico study in order to identify therapeutic targets by subtractive CjR proteome analysis. The most important proteins of the CjR proteome, which includes chokepoint enzymes, plasmid, virulence and antibiotic resistant proteins were annotated and subjected to subtractive analyses to filter out the CjR essential proteins from duplicate or human homologous proteins. Through the subtractive and characterization analysis we have identified 38 eligible therapeutic targets including 1 potential vaccine target. Also, 12 potential targets were found in interactive network, 5 targets to be dealt with FDA approved drugs and one pathway as potential pathway based drug target. In addition, a comprehensive database 'CampyNIBase' has also been developed. Besides the results of this study, the database is enriched with other information such as 3D models of the identified targets, experimental structures and Expressed Sequence Tag (EST) sequences. This study, including the database might be exploited for future research and the identification of effective therapeutics against campylobacteriosis. URL: (http://nib.portal.gov.bd/site/page/4516e965-8935-4129-8c3f-df95e754c562#Banner)."
https://openalex.org/W2806404262,"There is an interest in identifying Anaphase Promoting-Complex/Cyclosome (APC/C) inhibitors that lead to sensitivity to microtubule poisons as a strategy for targeting cancer cells. Using budding yeast Saccharomyces cerevisiae, peptides derived from the Mitotic Arrest Deficient 2 (Mad2)-binding motif of Cell Division Cycle 20 (Cdc20) were observed to inhibit both Cdc20- and CDC20 Homology 1 (Cdh1)-dependent APC/C activity. Over expression of peptides in vivo led to sensitivity to a microtubule poison and, in a recovery from a microtubule poison arrest, delayed degradation of yeast Securin protein Precocious Dissociation of Sisters 1 (Pds1). Peptides with mutations in the Cdc20 activating KILR-motif still bound APC/C, but lost the ability to inhibit APC/C in vitro and lost the ability to induce sensitivity to a microtubule poison in vivo. Thus, an APC/C binding and activation motif that promotes mitotic progression, namely the Cdc20 KILR-motif, can also function as an APC/C inhibitor when present in excess. Another activator for mitotic progression after recovery from microtubule poison is p31comet, where a yeast predicted open-reading frame YBR296C-A encoding a 39 amino acid predicted protein was identified by homology to p31comet, and named Tiny Yeast Comet 1 (TYC1). Tyc1 over expression resulted in sensitivity to microtubule poison. Tyc1 inhibited both APC/CCdc20 and APC/CCdh1 activities in vitro and bound to APC/C. A homologous peptide derived from human p31comet bound to and inhibited yeast APC/C demonstrating evolutionary retention of these biochemical activities. Cdc20 Mad2-binding motif peptides and Tyc1 disrupted the ability of the co-factors Cdc20 and Cdh1 to bind to APC/C, and co-over expression of both together in vivo resulted in an increased sensitivity to microtubule poison. We hypothesize that Cdc20 Mad2-binding motif peptides, Tyc1 and human hp31 peptide can serve as novel molecular tools for investigating APC/C inhibition that leads to sensitivity to microtubule poison in vivo."
https://openalex.org/W2805808463,"Chemoradiotherapy (CRT) has improved organ preservation or overall survival (OS) of locoregionally advanced head and neck squamous cell cancer (LAHNSCC), but in clinical trials of conventional CRT, increasing CRT intensity has not been shown to improve OS. In the Adjuvant ChemoTherapy with S-1 after curative treatment in patients with Head and Neck Cancer (ACTS-HNC) phase III study, OS of curative locoregional treatments improved more with adjuvant chemotherapy with S-1 (tegafur gimeracil oteracil potassium) than with tegafur/uracil (UFT). ACTS HNC study showed the significant efficacy of S-1 after curative radiotherapy in sub-analysis. We explored the efficacy of S-1 after curative CRT in a subset of patients from the ACTS-HNC study.Patients with stage III, IVA, or IVB LAHNSCC were enrolled in this study to evaluate the efficacy of S-1 compared with UFT as adjuvant chemotherapy after curative CRT in the ACTS-HNC study. Patients received S-1 at 80-120 mg/day in two divided doses for 2 weeks, followed by a 1-week rest, or UFT 300 or 400 mg/day in two or three divided doses daily, for 1 year. The endpoints were OS, disease-free survival, locoregional relapse-free survival, distant metastasis-free survival (DMFS), and post-locoregional relapse survival.One hundred eighty patients (S-1, n = 87; UFT, n = 93) were included in this study. Clinical characteristics of the S-1 and UFT arms were similar. S-1 after CRT significantly improved OS (hazard ratio [HR], 0.46; 95% confidence interval [CI], 0.22-0.93) and DMFS (HR, 0.50; 95% CI, 0.26-0.97) compared with UFT.As adjuvant chemotherapy, S-1 demonstrated better efficacy for OS and DMFS than UFT in patients with LAHNSCC after curative CRT and may be considered a treatment option following curative CRT. For this study was not preplanned in the ACTS-HNC study, the results is hypothesis generating but not definitive."
https://openalex.org/W2806876700,"Studies show that young children are vulnerable to burn injuries. We aimed to investigate the characteristics of thermal injuries in this population. We included children below 6 years of age who visited the emergency department (ED) after thermal injuries who were registered in the Korean Emergency Department-based Injury In-Depth Surveillance (2011-2016) database. Demographic characteristics, injury-related factors, and factors associated with ED treatment were gathered from the data. Then, we divided all children into two groups according to the ED discharge status: discharge versus admission (including cases transferred to other hospitals). The characteristics of the two groups were compared, and factors associated with admission were investigated. During the study period, 11,667 children with thermal injuries visited the ED. The number of boys was higher than the number of girls, and children aged 1 year accounted for the largest proportion. Most cases occurred in spring and indoors; the home was found to be the most common place. The most common type of burn was scald burns (69%), followed by contact burns (25.9%), and the most commonly burnt body area was the upper limbs (43.7%), followed by the lower limbs (16.8%). Most children (95.8%) were discharged home. The odds for hospital admission were lower for 2-3 and 4-5 year olds than for 0-1 year olds. The odds for hospital admission for contact burns were lower and those for electrical burns were higher than odds for hospital admission for scald burns. In summary, those aged 0-1 showed the largest incidence of thermal injuries and the most common burn mechanism was scald burns. Upper limbs were the most commonly affected body area, but their odds for requiring admission was lowest. Our results could be used as baseline data for prospective interventional studies investigating ways to reduce the incidence of childhood thermal injuries."
https://openalex.org/W2806398257,"The transdermal fentanyl patch is widely used to treat cancer-related pain despite its wide inter- and intrapatient variability in pharmacokinetics. The aim of this study was to investigate whether smoking and body size (i.e. body mass index) influence fentanyl exposure in patients with cancer. These are factors that typically change during treatment and disease trajectories. We performed an explorative cohort study in patients with cancer using transdermal fentanyl patches (Durogesic®), by taking a blood sample for pharmacokinetic analysis one day after applying a patch in patients with a stable fentanyl dose. A total of 88 patients were evaluable. Although no statistically significant difference was found, the plasma concentrations of non-smokers was 28% (95% CI [-14%; +89-%]) higher than those of smokers normalizing for a dose of 25μg/min. Patients with a low BMI (< 20 kg/m2) had almost similar (10% (95% CI [-39%; +97%]) higher) plasma concentrations compared to patients with a high BMI (> 25 kg/m2). A wider variation in fentanyl plasma concentrations was found in this study than anticipated. Due to this variation, studies in larger patient cohorts are needed to further investigate the effect of smoking on plasma concentration of fentanyl and thereby clarify the clinical significance of our findings."
https://openalex.org/W2805393779,"Source analyses on event related potentials (ERPs) derived from the electroencephalogram (EEG) were performed to examine the respective roles of cortical areas preceding exogenously triggered saccades, combined convergences, and combined divergences. All eye movements were triggered by the offset of a central fixation light emitting diode (LED) and the onset of a lateral LED at various depths in an otherwise fully darkened room. Our analyses revealed that three source pairs, two located in the frontal lobe-the frontal eye fields (FEF) and an anterior frontal area-, and one located within the occipital cortex, can account for 99.2% of the observed ERPs. Overall, the comparison between source activities revealed the largest activity in the occipital cortex, while no difference in activity between FEF and the anterior frontal area was obtained. For all sources, increased activity was observed for combined vergences, especially combined convergences, relative to saccades. Behavioral results revealed that onset latencies were longest for combined convergences, intermediate for combined divergences, and the shortest for saccades. Together, these findings fit within a perspective in which both occipital and frontal areas play an important role in retinal disparity detection. In the case of saccades and combined divergences stimulus-locked activity was larger than response-locked activity, while no difference between stimulus- and response-locked activity was observed for combined convergences. These findings seem to imply that the electrophysiological activity preceding exogenous eye movements consists of a sensory-related part that is under cortical control, while subcortical structures may be held responsible for final execution."
https://openalex.org/W2805397465,"Summary In this report we introduce a weak-model approach for examination of the intrinsic time-varying properties of the hemoglobin signal, with the aim of advancing the application of functional near infrared spectroscopy (fNIRS) for the detection of breast cancer, among other potential uses. The developed methodology integrates concepts from stochastic network theory with known modulatory features of the vascular bed, and in doing so provides access to a previously unrecognized dense feature space that is shown to have promising diagnostic potential. Notable features of the methodology include access to this information solely from measures acquired in the resting state, and analysis of these by treating the various components of the hemoglobin (Hb) signal as a co-varying interacting system. Approach The principal data-transform kernel projects Hb state-space trajectories onto a coordinate system that constitutes a finite-state representation of covariations among the principal elements of the Hb signal (i.e., its oxygenated (ΔoxyHb) and deoxygenated (ΔdeoxyHb) forms and the associated dependent quantities: total hemoglobin (ΔtotalHb = ΔoxyHb + ΔdeoxyHb), hemoglobin oxygen saturation (ΔHbO2Sat = 100Δ(oxyHb/totalHb)), and tissue-hemoglobin oxygen exchange (ΔHbO2Exc = ΔdeoxyHb-ΔoxyHb)). The resulting ten-state representation treats the evolution of this signal as a one-space, spatiotemporal network that undergoes transitions from one state to another. States of the network are defined by the algebraic signs of the amplitudes of the time-varying components of the Hb signal relative to their temporal mean values. This assignment produces several classes of coefficient arrays, most with a dimension of 10×10. Biological motivation Motivating our approach is the understanding that effector mechanisms that modulate blood delivery to tissue operate on macroscopic scales, in a spatially and temporally varying manner. Also recognized is that this behavior is sensitive to nonlinear actions of these effectors, which include the binding properties of hemoglobin. Accessible phenomenology includes measures of the kinetics and probabilities of network dynamics, which we treat as surrogates for the actions of feedback mechanisms that modulate tissue-vascular coupling. Findings Qualitative and quantitative features of this space, and their potential to serve as markers of disease, have been explored by examining continuous-wave fNIRS 3D tomographic time series obtained from the breasts of women who do and do not have breast cancer. Inspection of the coefficient arrays reveals that they are governed predominantly by first-order rate processes, and that each array class exhibits preferred structure that is mainly independent of the others. Discussed are strategies that may serve to extend evaluation of the accessible feature space and how the character of this information holds potential for development of novel clinical and preclinical uses."
https://openalex.org/W2806112239,"After months of intense planning, I was finally ready to set up my dissertation research equipment in a patch of urban forest. It was such a perfect summer day that it was hard to imagine anything going wrong. But while installing the first of my stemflow collars—odd-looking devices that I was"
https://openalex.org/W2806204276,"Researchers must improve ways to verify weapons declarations and collaborate on nuclear power, argues R. Scott Kemp. Researchers must improve ways to verify weapons declarations and collaborate on nuclear power, argues R. Scott Kemp."
