id,abstract
https://openalex.org/W2039964833,"We used affinity chromatography to probe for a direct binding interaction between cytoplasmic dynein and dynactin. Purified cytoplasmic dynein was found to bind to an affinity column of p150<sup>Glued</sup>, the largest polypeptide in the dynactin complex. To test the specificity of the interaction, we loaded rat brain cytosol onto the p150<sup>Glued</sup> affinity column and observed that cytoplasmic dynein from cytosol was specifically retained on the column. Preincubation of the p150<sup>Glued</sup> affinity matrix with excess exogenous dynein intermediate chain resulted in a significant reduction of dynein binding, suggesting that p150<sup>Glued</sup> may be interacting with dynein via this polypeptide. Therefore we constructed an affinity column of recombinant dynein intermediate chain and observed that dynactin was retained from rat brain cytosol. These results demonstrate that the native dynein and dynactin complexes are capable of direct <i>in vitro</i> interaction mediated by a direct binding of the dynein intermediate chain to the p150<sup>Glued</sup>component of the dynactin complex. We have mapped the site of this interaction to the amino-terminal region of p150<sup>Glued</sup>, which is predicted to form an α-helical coiled-coil. Regulation of the dynein-dynactin interaction may prove to be key in the control mechanism for cytoplasmic dynein-mediated vesicular transport."
https://openalex.org/W2087139802,"Four cDNA-encoding G-activated inwardly rectifying K+ channels have been cloned recently (Kubo, Y., Reuveny, E., Slesinger, P. A., Jan, Y. N., and Jan, L. Y.(1993) Nature 364, 802-806; Lesage, F., Duprat, F., Fink, M., Guillemare, E., Coppola, T., Lazdunski, M., and Hugnot, J. P. (1994) FEBS Lett. 353, 37-42; Krapivinsky, G., Gordon, E. A., Wickman, K., Velimirovic, B., Krapivinsky, L., and Clapham, D. E. (1995) Nature 374, 135-141). We report the cloning of a mouse GIRK2 splice variant, noted mGIRK2A. Both channel proteins are functionally expressed in Xenopus oocytes upon injection of their cRNA, alone or in combination with the GIRK1 cRNA. Three GIRK channels, mGIRK1-3, are shown to be present in the brain. Colocalization in the same neurons of mGIRK1 and mGIRK2 supports the hypothesis that native channels are made by an heteromeric subunit assembly. GIRK3 channels have not been expressed successfully, even in the presence of the other types of subunits. However, GIRK3 chimeras with the amino- and carboxyl-terminal of GIRK2 are functionally expressed in the presence of GIRK1. The expressed mGIRK2 and mGIRK1, -2 currents are blocked by Ba2+ and Cs+ ions. They are not regulated by protein kinase A and protein kinase C. Channel activity runs down in inside-out excised patches, and ATP is required to prevent this rundown. Since the nonhydrolyzable ATP analog AMP-PCP is also active and since addition of kinases A and C as well as alkaline phosphatase does not modify the ATP effect, it is concluded that ATP hydrolysis is not required. An ATP binding process appears to be essential for maintaining a functional state of the neuronal inward rectifier K+ channel. A Na+ binding site on the cytoplasmic face of the membrane acts in synergy with the ATP binding site to stabilize channel activity. Four cDNA-encoding G-activated inwardly rectifying K+ channels have been cloned recently (Kubo, Y., Reuveny, E., Slesinger, P. A., Jan, Y. N., and Jan, L. Y.(1993) Nature 364, 802-806; Lesage, F., Duprat, F., Fink, M., Guillemare, E., Coppola, T., Lazdunski, M., and Hugnot, J. P. (1994) FEBS Lett. 353, 37-42; Krapivinsky, G., Gordon, E. A., Wickman, K., Velimirovic, B., Krapivinsky, L., and Clapham, D. E. (1995) Nature 374, 135-141). We report the cloning of a mouse GIRK2 splice variant, noted mGIRK2A. Both channel proteins are functionally expressed in Xenopus oocytes upon injection of their cRNA, alone or in combination with the GIRK1 cRNA. Three GIRK channels, mGIRK1-3, are shown to be present in the brain. Colocalization in the same neurons of mGIRK1 and mGIRK2 supports the hypothesis that native channels are made by an heteromeric subunit assembly. GIRK3 channels have not been expressed successfully, even in the presence of the other types of subunits. However, GIRK3 chimeras with the amino- and carboxyl-terminal of GIRK2 are functionally expressed in the presence of GIRK1. The expressed mGIRK2 and mGIRK1, -2 currents are blocked by Ba2+ and Cs+ ions. They are not regulated by protein kinase A and protein kinase C. Channel activity runs down in inside-out excised patches, and ATP is required to prevent this rundown. Since the nonhydrolyzable ATP analog AMP-PCP is also active and since addition of kinases A and C as well as alkaline phosphatase does not modify the ATP effect, it is concluded that ATP hydrolysis is not required. An ATP binding process appears to be essential for maintaining a functional state of the neuronal inward rectifier K+ channel. A Na+ binding site on the cytoplasmic face of the membrane acts in synergy with the ATP binding site to stabilize channel activity."
https://openalex.org/W2072061824,"The prototype mitogen-activated protein (MAP) kinase module is a three-kinase cascade consisting of the MAP kinase, extracellular signal-regulated protein kinase (ERK) 1 or ERK2, the MAP/ERK kinase (MEK) MEK1 or MEK2, and the MEK kinase, Raf-1 or B-Raf. This and other MAP kinase modules are thought to be critical signal transducers in major cellular events including proliferation, differentiation, and stress responses. To identify novel mammalian MAP kinase modules, polymerase chain reaction was used to isolate a new MEK family member, MEK5, from the rat. MEK5 is more closely related to MEK1 and MEK2 than to the other known mammalian MEKs, MKK3 and MKK4. MEK5 is thought to lie in an uncharacterized MAP kinase pathway, because MEK5 does not phosphorylate the ERK/MAP kinase family members ERK1, ERK2, ERK3, JNK/SAPK, or p38/HOG1, nor will Raf-1, c-Mos, or MEKK1 highly phosphorylate it. Alternative splicing results in a 50-kDa α and a 40-kDa β isoform of MEK5. MEK5β is ubiquitously distributed and primarily cytosolic. MEK5α is expressed most highly in liver and brain and is particulate. The 23 amino acids encoded by the 5′ exon in the larger α isoform are similar to a sequence found in certain proteins believed to associate with the actin cytoskeleton; this alternatively spliced modular domain may lead to the differential subcellular localization of MEK5α. The prototype mitogen-activated protein (MAP) kinase module is a three-kinase cascade consisting of the MAP kinase, extracellular signal-regulated protein kinase (ERK) 1 or ERK2, the MAP/ERK kinase (MEK) MEK1 or MEK2, and the MEK kinase, Raf-1 or B-Raf. This and other MAP kinase modules are thought to be critical signal transducers in major cellular events including proliferation, differentiation, and stress responses. To identify novel mammalian MAP kinase modules, polymerase chain reaction was used to isolate a new MEK family member, MEK5, from the rat. MEK5 is more closely related to MEK1 and MEK2 than to the other known mammalian MEKs, MKK3 and MKK4. MEK5 is thought to lie in an uncharacterized MAP kinase pathway, because MEK5 does not phosphorylate the ERK/MAP kinase family members ERK1, ERK2, ERK3, JNK/SAPK, or p38/HOG1, nor will Raf-1, c-Mos, or MEKK1 highly phosphorylate it. Alternative splicing results in a 50-kDa α and a 40-kDa β isoform of MEK5. MEK5β is ubiquitously distributed and primarily cytosolic. MEK5α is expressed most highly in liver and brain and is particulate. The 23 amino acids encoded by the 5′ exon in the larger α isoform are similar to a sequence found in certain proteins believed to associate with the actin cytoskeleton; this alternatively spliced modular domain may lead to the differential subcellular localization of MEK5α."
https://openalex.org/W1981073334,"The obese gene product, leptin, regulates adiposity. Mice homozygous for a nonfunctional obese gene become massively obese and develop diabetes mellitus due to overeating and increased metabolic efficiency. The cDNA sequence of obese was recently reported (Zhang, Y., Proenca, R., Maffei, M., Barone, M., Leopold, L., and Friedman, J. L.(1994) Nature 372, 425-432; Correction: (1995 Nature 374, 479). We have determined the genomic organization of the 5′ end of the mouse obese gene. The coding sequence is in exons 2 and 3. A single TATA-containing promoter was found upstream of exon 1. A minority (probably ~5%) of the obese mRNA contained an extra, untranslated exon between exons 1 and 2. Transcription of the obese gene was detected only in adipose cells. A 762-base pair obese gene promoter driving a luciferase gene yielded abundant activity in transiently transfected rat adipose cells in primary culture. The obese promoter was inactive in erythroid K562 cells. Deletion of bases from -762 downstream to -161 did not affect promoter activity in transfected adipose cells. The -161 minimal promoter contained consensus Sp1 and CCAAT/enhancer-binding protein (C/EBP) motifs. Cotransfection with C/EBPα (a transcription factor important in adipose cell differentiation) caused 23-fold activation. These data suggest that the obese promoter is a natural target of C/EBPα. The obese gene product, leptin, regulates adiposity. Mice homozygous for a nonfunctional obese gene become massively obese and develop diabetes mellitus due to overeating and increased metabolic efficiency. The cDNA sequence of obese was recently reported (Zhang, Y., Proenca, R., Maffei, M., Barone, M., Leopold, L., and Friedman, J. L.(1994) Nature 372, 425-432; Correction: (1995 Nature 374, 479). We have determined the genomic organization of the 5′ end of the mouse obese gene. The coding sequence is in exons 2 and 3. A single TATA-containing promoter was found upstream of exon 1. A minority (probably ~5%) of the obese mRNA contained an extra, untranslated exon between exons 1 and 2. Transcription of the obese gene was detected only in adipose cells. A 762-base pair obese gene promoter driving a luciferase gene yielded abundant activity in transiently transfected rat adipose cells in primary culture. The obese promoter was inactive in erythroid K562 cells. Deletion of bases from -762 downstream to -161 did not affect promoter activity in transfected adipose cells. The -161 minimal promoter contained consensus Sp1 and CCAAT/enhancer-binding protein (C/EBP) motifs. Cotransfection with C/EBPα (a transcription factor important in adipose cell differentiation) caused 23-fold activation. These data suggest that the obese promoter is a natural target of C/EBPα."
https://openalex.org/W2095141538,"α4β1 integrin (VLA-4) appears to be unique among the leukocyte integrins in that it can initiate the adhesion of circulating lymphocytes without cellular activation. It is not known how lymphocytes or other cell types maintain constitutive levels of α4β1 integrin activity. The current report describes a monoclonal antibody, 15/7, that recognizes a high affinity or ligand-occupied conformation of β1 integrin. Studies with 15/7 revealed that α4β1 integrin-dependent adhesion of leukocytic cell lines is mediated by a population of low affinity receptors that is conformationally responsive to ligand; the 15/7 epitope could be induced by nanomolar concentrations of soluble VCAM-1 or by micromolar concentrations of a peptide derived from the type III connecting segment domain of fibronectin (as ligands for α4β1 integrin). The same receptors were also responsive to adhesion activating reagents, such as Mn2+, activating anti-β1 integrin antibodies, and phorbol myristate acetate, which induced the 15/7 epitope directly and/or decreased the concentration of ligand required for epitope induction. In addition to the responsive receptor pool, cells expressed a second population of α4β1 integrin that was conformationally restrained, failing to respond to ligand or to any of the activating reagents. The relative size of the responsive and inactive receptor pools, as well as the affinity of the responsive receptors, represented a stable phenotype of different cell types and played important roles in defining the cells' adhesive capacity and ligand specificity. Similar receptor populations were measured on lymphocyte subsets in whole blood. These studies provide insight into how cells maintain different constitutive levels of α4β1 integrin activity, and how the activity of β1 integrin can be modulated by activators of cell adhesion. α4β1 integrin (VLA-4) appears to be unique among the leukocyte integrins in that it can initiate the adhesion of circulating lymphocytes without cellular activation. It is not known how lymphocytes or other cell types maintain constitutive levels of α4β1 integrin activity. The current report describes a monoclonal antibody, 15/7, that recognizes a high affinity or ligand-occupied conformation of β1 integrin. Studies with 15/7 revealed that α4β1 integrin-dependent adhesion of leukocytic cell lines is mediated by a population of low affinity receptors that is conformationally responsive to ligand; the 15/7 epitope could be induced by nanomolar concentrations of soluble VCAM-1 or by micromolar concentrations of a peptide derived from the type III connecting segment domain of fibronectin (as ligands for α4β1 integrin). The same receptors were also responsive to adhesion activating reagents, such as Mn2+, activating anti-β1 integrin antibodies, and phorbol myristate acetate, which induced the 15/7 epitope directly and/or decreased the concentration of ligand required for epitope induction. In addition to the responsive receptor pool, cells expressed a second population of α4β1 integrin that was conformationally restrained, failing to respond to ligand or to any of the activating reagents. The relative size of the responsive and inactive receptor pools, as well as the affinity of the responsive receptors, represented a stable phenotype of different cell types and played important roles in defining the cells' adhesive capacity and ligand specificity. Similar receptor populations were measured on lymphocyte subsets in whole blood. These studies provide insight into how cells maintain different constitutive levels of α4β1 integrin activity, and how the activity of β1 integrin can be modulated by activators of cell adhesion."
