id,abstract
https://openalex.org/W1636644833,"Abstract In the presence of catalytic amounts of the β-hydroxy-β-methylglutaric acid coenzyme A-condensing enzyme of yeast, substrate amounts of acetoacetyl acyl carrier protein and acetyl coenzyme A react to form stoichiometric amounts of protein-bound β-hydroxy-β-methylglutaric acid, which is apparently β-hydroxy-β-methylglutaric acid acyl carrier protein. The condensation reaction with acetoacetyl acyl carrier protein proceeds at about one-sixth the rate observed with acetoacetyl coenzyme A. β-Hydroxy-β-methylglutaric acid coenzyme A does not undergo a transacylation reaction with acyl carrier protein, but a nonenzymatic transacylation of β-hydroxy-β-methylglutaric acid acyl carrier protein to coenzyme A does occur. These observations agree with previous suggestions that the thioester bond of the acetoacyl moiety remains intact during the condensation reaction with acetyl coenzyme A and provide a basis for unification of the so called malonate and acetate pathways of β-hydroxy-β-methylglutaric acid synthesis."
https://openalex.org/W1494159471,"Abstract A unique nicotinic acid degradation was devised which permitted the isolation of each individual carbon atom of the pyridine ring. Aspartate-3-14C and malate-3-14C were administered to Nicotiana rustica tobacco plants for 4 hours and found to be incorporated almost exclusively into carbons 2 and 3 of the pyridine ring of nicotine. When aspartate-3-14C was fed, 57% of the tracer resided at carbon 3 and 38% at carbon 2. Malate-3-14C labeled carbon 3 with 61% of the isotope and carbon 2 with 38%. The dilution of incorporation of aspartate-3-14C was 600 and of malate-3-14C, 1260. The incorporation of aspartate and malate with low dilution and the lack of randomization of 14C between carbons 2 and 3 of the pyridine ring indicate either that aspartate or malate is the immediate precursor of the pyridine ring of nicotine, or that they are converted to the immediate precursor without passing through a symmetrical intermediate."
https://openalex.org/W1969607255,"An organism is an integrated system of interdependent structures and functions. An organism is constituted of cells, and a cell consists of molecules which must work in harmony. Each molecule must know what the others are doing. Each one must be capable of receiving messages and must be sufficiently disciplined to obey. You are familiar with the laws which control regulation. You know how our ideas have developed and how the most harmonious and sound of them have been fused into a conceptual whole which is the very foundation of biology and confers on it its unity."
https://openalex.org/W2008705536,Treatment of rats with certain polycyclic hydrocarbons shifts the hydroxylation of dimethylbenzanthracene (DMBA) by liver microsomes from the side-chain to the ring. Protection by these hydrocarbons against dimethylbenzanthracene-induced adrenal necrosis is possibly achieved by decreasing the yield of the 7-hydroxymethyl derivative of dimethylbenzanthracene which may act as the necrotic agent by virtue of its strutctural resemblance to the adrenocortical steroids.
https://openalex.org/W150588716,"Abstract Ribonucleic acid isolated from cerebral cortex of mature male and female rats was fractionated by chromatography on methylated albumin Kieselguhr columns or by sucrose gradient centrifugation. Three principal fractions were obtained with analytical ultracentrifuge s20,w0 values of 4, 17, and 28. By comparison with ribonucleic acid prepared from purified rat brain ribosomes, the 17 S and 28 S fractions were shown to be predominantly ribosomal ribonucleic acid. Differences in base analyses between the three fractions were small but significant. Compositions of all fractions were markedly complementary with G ≈ C and A ≈ U."
https://openalex.org/W1509273247,Abstract Procedures are described for the isolation of large oligonucleotide fragments after partial digestion of a yeast alanine transfer ribonucleic acid with Taka-Diastase ribonuclease T1. Quantitative analyses of the large fragments are presented. This paper completes the description of experimental methods used in the determination of the nucleotide sequence of this alanine transfer ribonucleic acid.
https://openalex.org/W1990100522,"Visual acuity was measured with a grating test object in which alternating bars were matched in brightness but differed in wavelength. If the wavelength difference between adjacent bars was great enough, acuity scores were obtained which were as high as those obtained with test objects in which there was a large brightness difference between adjacent bars."
https://openalex.org/W2068858317,"Unit-cell dimensions and optical data for uric acid and uric acid dihydrate show that there are structural resemblances, but that either can be readily distinguished by x-ray methods or by optical techniques. Density separation may be unsatisfactory because the dihydrate can lose water rather easily. Powder diffraction data are given."
https://openalex.org/W2094790285,"The occurrence of manomary adenocarcinonmas in C3H mice is largely inhibited by prolonged admninistration of 0.1 percent isonicotinic acid hydrazide in drinking water. At the same time that this compound produtced the inhibitory action, it also increased the incidence of pulmonary adenomas."
https://openalex.org/W2012638032,A series of 24 visually evoked potentials was obtained from a normnal human subject under a set of unvarying experimental conditions. The 24 trials were ordered according to the alpha frequency subsequent to presentation of the stimulus. The evoked potentials fromt the 12 higher- and 12 lower-frequency trials were averaged separateb. These two average curves differed significantly at each of the six nodal points.
https://openalex.org/W184338590,"Abstract The incorporation of labeled palmitate into phospholipids in bovine brain mitochondria was compared with fatty acid oxidation under various experimental conditions. The rate of incorporation of palmitate into phospholipids proceeded at 20 to 25% of the rate of palmitate oxidation under optimal conditions and required exogenous adenosine triphosphate and coenzyme A. The addition of coenzyme A was not necessary for fatty acid oxidation. In the presence of ATP, the incorporation into phospholipids was not affected by cyanide, dinitrophenol, or oligomycin, although these agents inhibited fatty acid oxidation. In the absence of exogenous nucleotides, oligomycin inhibited the incorporation of palmitate into phospholipids and stimulated palmitate oxidation. A preincubation with glucose and hexokinase decreased the incorporation of palmitate into phospholipids to a greater extent than palmitate oxidation. The addition of oligomycin after the preincubation further inhibited the incorporation into phospholipids but reversed the inhibition of fatty acid oxidation. These results indicate that in brain mitochondria ATP is necessary for the activation of fatty acids before incorporation into phospholipids and that high energy intermediates are not involved. It is suggested that the activation of fatty acids before oxidation or esterification may involve different energy sources and that these two metabolic processes may occur in separate compartments of the mitochondrion."
https://openalex.org/W1489686110,"Abstract Liver mitochondria from hypo- or hypervitaminotic-A rats exhibited low efficiency for coupled oxidative phosphorylation. Supplementation in vitro or in vivo with retinyl acetate, but not with retinoic acid, restored low phosphorus to oxygen ratios to normal. Uncoupling of oxidative phosphorylation occurred with nicotinamide adenine dinucleotide-linked and non-NAD-linked substrates. Serum albumin added to mitochondrial suspensions from livers of vitamin A-deficient or toxic rats restored normal oxidative phosphorylation efficiencies. Tri-o-cresyl phosphate caused uncoupling which was not restored by the addition of retinyl acetate. An inherent instability of liver mitochondria from vitamin A-deficient and toxic rats is indicated because their endogenous oxidative phosphorylation is lower than that of mitochondria from normal animals. It is suggested that vitamin A is required in mitochondrial membranes at an optimum concentration; variations below or above this concentration cause these membranes to become unstable. Deviation from optimum may induce functional changes in enzymes associated with oxidative phosphorylation."
https://openalex.org/W2091967751,The enzyme mutarotase from mammalian tissues catalyzes interconversion of anomeric forms of glucose and structurally related sugars; it may be involved in transport of sugars. Isolation and species distribution of a similar enzyme in higher plants are described. The enzyme from green pepper (Capsicum frutescens) was purified 230-fold. It differs from the mammalian enzyme in both substrate specificity and lack of inhibition by 1-deoxyglucose and phloridzin.
https://openalex.org/W1531371413,"Abstract A two-phase system in vitro has been developed for studying the bone-mobilizing effects of parathyroid hormone. Phase I consists of the incubation of hormone with ascites cells, and Phase II is the incubation of Phase I supernatant with dead bone powder. The mobilization of labeled calcium from this powder is the index of hormonal activity. The response to hormone is apparent at 10-8 m hormone, appears specific for parathyroid hormone, and has striking analogies to hormone action upon living bone in vivo and in vitro."
https://openalex.org/W2022175524,"Changes in the membrane potential of the S-potential-producing cells (S-cells) in the isolated retina of fish (Gerridae) were correlated with changes in oxygen concentration. During brief hypoxia the changes in potential consisted of initial depolarization and subsequent hyperpolarization to near 70 millivolts. Depolarization occurred when oxygen concentration was reduced to a level of from 13 to 10 percent, and hyperpolarization occurred on reduction from 10 to 2.5 percent; there was yariation from cell to cell. The recovery of S-cell function from anoxia was fast in oxygen but slow in air. The results show that the S-cell stops functioning in seconds without oxygen; hence this kind of cellular element in the nervous system is much more sensitive to oxygen deprivation than other cells studied thus far."
https://openalex.org/W1989730601,Behavior of the middle ear muscle during speaking was observed in five stutterers by means of the Zwislocki acoustic impedance bridge. Change in impedance did not always parallel precisely the changes in speecli sound level. Impedance changed during the initiation and dluring the course of the stuttering block.
https://openalex.org/W2058898984,Stable auxotrophic mutants of a group H streptococcus (strain Challis) were isolated on a modified Mickelson defined medium after exposure to N-methyl-N′-nitro-N-nitrosoguanidine. Such mutants were transformed to both prototrophy and streptomycin-resistance and hence may be used as nutritional markers in the study of streptococcal genetics.
https://openalex.org/W1984452696,
https://openalex.org/W2077235284,
https://openalex.org/W2090019848,
https://openalex.org/W4248379902,
