id,abstract
https://openalex.org/W2083607265,"Background Cluster of differentiation 8 (CD8) is expressed in cytotoxic T cells, where it functions as a co-receptor for the T-cell receptor by binding to major histocompatibility complex class I (MHCI) proteins, which present peptides on the cell surface. CD8A is critical for cell-mediated immune defense and T-cell development. CD8A transcription is controlled by several cis-acting elements and trans-acting elements and is also regulated by DNA methylation. However, the epigenetic regulation of CD8A in the duck and its relationship with virus infection are still unclear. Results We investigated the epigenetic transcriptional regulatory mechanisms, such as DNA methylation, for the expression of the CD8A and further evaluated the contribution of such epigenetic regulatory mechanisms to DHV-I infection in the duck. Real-time quantitative polymerase chain reaction (RT-qPCR) revealed the highest level of CD8A expression to be in the thymus, followed by the lungs, spleen, and liver, and the levels of CD8A expression were very low in the kidney, cerebrum, cerebellum, and muscle in the duck. RT-qPCR also demonstrated that the CD8A mRNA was down-regulated significantly in morbid ducklings treated with DHV-1 and up-regulated significantly in non-morbid ducklings in all the tissues tested. In addition, hypermethylation of CD8A was detected in the morbid ducklings, whereas relatively low methylation of CD8A was evident in the non-morbid ducklings. The CD8A mRNA level was negatively associated with the CpG methylation level of CD8A and global methylation status. Conclusions We concluded that the mRNA level of the CD8A was negatively associated with the CpG methylation level of CD8A and global methylation status in the duck, suggesting that the hypermethylation of CD8A may be associated with DHV-1 infection. The first two CpG sites of the CD8A promoter region could be considered as epigenetic biomarkers for resistance breeding against duckling hepatitis disease in the duck."
https://openalex.org/W2090085640,"Early life events induce alterations in neural function in adulthood. Although rearing in an enriched environment (EE) has a great impact on behavioral development, the effects of enriched rearing on sociosexual behavior remain unclear. In this study, we investigated the effects of rearing in an EE on male copulatory behavior and its underlying neurobiological mechanisms in Wistar-Imamichi rats. Three-week-old, recently weaned rats were continuously subjected to a standard environment (SE) or an EE comprised of a large cage with several objects, such as toys, tunnels, ladders, and a running wheel. After 6 weeks, rats reared in an EE (EE rats) showed decreased sexual activity compared with rats reared in a SE (SE rats). This included a lower number of ejaculations and longer latencies in three consecutive copulatory tests. In addition, EE rats showed decreased emotional responsiveness and less locomotor behavior in an open field. In a runway test, on the other hand, sexual motivation toward receptive females in EE males was comparable to that of SE males. Furthermore, following exposure to a female, increases in serotonin levels in the nucleus accumbens and the striatum were significantly suppressed in EE males, whereas dopaminergic responses were similar between the groups. Female-exposure-induced increases in the levels of plasma corticosterone and testosterone were also suppressed in EE rats compared to SE rats. These data suggest that rearing in an EE decreases male copulatory behavior, and serotonin and hormonal regulating systems may regulate the differences in sociosexual interactions that result from distinct rearing environments."
https://openalex.org/W2087850347,"Bifrequency acoustic data, hydrological measurements and satellite data were used to study the vertical distribution of macrozooplankton in the Bay of Biscay in relation to the hydrological conditions and fish distribution during spring 2009. The most noticeable result was the observation of a ‘biocline’ during the day i.e., the interface where zooplankton biomass changes more rapidly with depth than it does in the layers above or below. The biocline separated the surface layer, almost devoid of macrozooplankton, from the macrozooplankton-rich deeper layers. It is a specific vertical feature which ties in with the classic diel vertical migration pattern. Spatiotemporal correlations between macrozooplankton and environmental variables (photic depth, thermohaline vertical structure, stratification index and chlorophyll-a) indicate that no single factor explains the macrozooplankton vertical distribution. Rather a set of factors, the respective influence of which varies from region to region depending on the habitat characteristics and the progress of the spring stratification, jointly influence the distribution. In this context, the macrozooplankton biocline is potentially a biophysical response to the search for a particular depth range where light attenuation, thermohaline vertical structure and stratification conditions together provide a suitable alternative to the need for expending energy in reaching deeper water without the risk of being eaten."
https://openalex.org/W2094033986,"To investigate the incidence and risk factors of microscopically positive proximal margins in Chinese patients with adenocarcinoma of the gastroesophageal junction.The medical records of 483 patients, who underwent surgical treatment with curative intent for adenocarcinoma of the gastroesophageal junction in a single high-volume tertiary medical center, were reviewed. Demographic, radiographic, endoscopic, pathologic, and treatment-related variables were evaluated. All proximal margins were re-evaluated by two experienced pathologists, and a positive proximal margin was defined as the microscopic presence of invasive tumor cells seen at the esophageal transaction margin submitted en face on final paraffin sections.The incidence of positive proximal margins was 23.81% in this series. Siewert type, depth of tumor invasion, lymph node involvement, presence of vascular or lymphatic invasion, and presence of perineural invasion were significantly associated with positive proximal margins. On multivariate analysis, the presence of vascular or lymphatic invasion and advanced-stage disease were independent risk factors for positive proximal margins in patients with adenocarcinoma of the gastroesophageal junction.Residual cancer at proximal resection margins remains a major issue for the surgical treatment of adenocarcinoma of the gastroesophageal junction in China."
https://openalex.org/W2055484823,"Climatic variations are known to engender life-history diversification of species and populations at large spatial scales. However, the extent to which microgeographic variations in climate (e.g., those occurring within a single large ecosystem) can also drive life-history divergence is generally poorly documented. We exploited a spatial gradient in water temperatures at three sites across a large montane lake in southwest China (Lake Erhai) to examine the extent to which life histories of a short-lived fish species (icefish, Neosalanx taihuensis) diversified in response to thermal regime following introduction 25 y prior. In general, warmwater icefish variants grew faster, had larger adult body size and higher condition and fecundity, but matured at smaller sizes. Conversely, coldwater variants had smaller adult body size and lower condition, but matured at larger sizes and had larger eggs. These life-history differences strongly suggest that key ecological trade-offs exist for icefish populations exposed to different thermal regimes, and these trade-offs have driven relatively rapid diversification in the life histories of icefish within Lake Erhai. Results are surprisingly concordant with current knowledge on life-history evolution at macroecological scales, and suggest that improved conservation management might be possible by focusing on patterns operating at microgeographical, including, within-ecosystem scales."
https://openalex.org/W2137814844,"Diffusion-weighted imaging (DWI) is an important diagnostic tool in the assessment of focal liver lesions and diffuse liver diseases such as cirrhosis and fibrosis. Quantitative DWI parameters such as molecular diffusion, microperfusion and their fractions, are known to be affected when hepatic fat fractions (HFF) are higher than 5.5% (steatosis). However, less is known about the effect on DWI for HFF in the normal non-steatotic range below 5.5%, which can be found in a large part of the population. The aim of this study was therefore to evaluate the diagnostic implications of non-steatotic HFF on quantitative DWI parameters in eight liver segments. For this purpose, eleven healthy volunteers (2 men, mean-age 31.0) were prospectively examined with DWI and three series of in-/out-of-phase dual-echo spoiled gradient-recalled MRI sequences to obtain the HFF and T2*. DWI data were analyzed using the intravoxel incoherent motion (IVIM) model. Four circular regions (ø22.3 mm) were drawn in each of eight liver segments and averaged. Measurements were divided in group 1 (HFF≤2.75%), group 2 (2.75< HFF ≤5.5%) and group 3 (HFF>5.5%). DWI parameters and T2* were compared between the three groups and between the segments. It was observed that the molecular diffusion (0.85, 0.72 and 0.49 ×10−3 mm2/s) and T2* (32.2, 27.2 and 21.0 ms) differed significantly between the three groups of increasing HFF (2.18, 3.50 and 19.91%). Microperfusion and its fraction remained similar for different HFF. Correlations with HFF were observed for the molecular diffusion (r = −0.514, p<0.001) and T2* (−0.714, p<0.001). Similar results were obtained for the majority of individual liver segments. It was concluded that fat significantly decreases molecular diffusion in the liver, also in absence of steatosis (HFF≤5.5%). Also, it was confirmed that fat influences T2*. Determination of HFF prior to quantitative DWI is therefore crucial."
https://openalex.org/W1963952413,"Experimental animal models of Salmonella infections have been widely used to identify genes important in the host immune response to infection. Using an F2 cross between the classical inbred strain C57BL/6J and the wild derived strain MOLF/Ei, we have previously identified Ity3 (Immunity to Typhimurium locus 3) as a locus contributing to the early susceptibility of MOLF/Ei mice to infection with Salmonella Typhimurium. We have also established a congenic strain (B6.MOLF-Ity/Ity3) with the MOLF/Ei Ity3 donor segment on a C57BL/6J background. The current study was designed to fine map and characterize functionally the Ity3 locus. We generated 12 recombinant sub-congenic strains that were characterized for susceptibility to infection, bacterial load in target organs, cytokine profile and anti-microbial mechanisms. These analyses showed that the impact of the Ity3 locus on survival and bacterial burden was stronger in male mice compared to female mice. Fine mapping of Ity3 indicated that two subloci contribute collectively to the susceptibility of B6.MOLF-Ity/Ity3 congenic mice to Salmonella infection. The Ity3.1 sublocus controls NADPH oxidase activity and is characterized by decreased ROS production, reduced inflammatory cytokine response and increased bacterial burden, thereby supporting a role for Ncf2 (neutrophil cytosolic factor 2 a subunit of NADPH oxidase) as the gene underlying this sublocus. The Ity3.2 sub-locus is characterized by a hyperresponsive inflammatory cytokine phenotype after exposure to Salmonella. Overall, this research provides support to the combined action of hormonal influences and complex genetic factors within the Ity3 locus in the innate immune response to Salmonella infection in wild-derived MOLF/Ei mice."
https://openalex.org/W2061025406,"The application of nanopore sensing utilizing the α-hemolysin pore to probe proteins at single-molecule resolution has expanded rapidly. In some studies protein translocation through the α-hemolysin has been reported. However, there is no direct evidence, as yet, that proteins can translocate the α-hemolysin pore. The biggest challenge to obtaining direct evidence is the lack of a highly sensitive assay to detect very low numbers of protein molecules. Furthermore, if an activity based assay is applied then the proteins translocating by unfolding should refold back to an active confirmation for the assay technique to work. To overcome these challenges we selected a model enzyme, ribonuclease A, that readily refolds to an active conformation even after unfolding it with denaturants. In addition we have developed a highly sensitive reverse transcription polymerase chain reaction based activity assay for ribonuclease A. Initially, ribonuclease A, a protein with a positive net charge and dimensions larger than the smallest diameter of the pore, was subjected to nanopore analysis under different experimental conditions. Surprisingly, although the protein was added to the cis chamber (grounded) and a positive potential was applied, the interaction of ribonuclease A with α-hemolysin pore induced small and large blockade events in the presence and the absence of a reducing and/or denaturing agent. Upon measuring the zeta potential, it was found that the protein undergoes a charge reversal under the experimental conditions used for nanopore sensing. From the investigation of the effect of voltage on the interaction of ribonuclease A with the α-hemolysin pore, it was impossible to conclude if the events observed were translocations. However, upon testing for ribonuclease A activity on the trans chamber it was found that ribonuclease A does not translocate the α-hemolysin pore."
https://openalex.org/W2041722140,"Separating CBRN mixed samples that contain both chemical and biological warfare agents (CB mixed sample) in liquid and solid matrices remains a very challenging issue. Parameters were set up to assess the performance of a simple filtration-based method first optimized on separate C- and B-agents, and then assessed on a model of CB mixed sample. In this model, MS2 bacteriophage, Autographa californica nuclear polyhedrosis baculovirus (AcNPV), Bacillus atrophaeus and Bacillus subtilis spores were used as biological agent simulants whereas ethyl methylphosphonic acid (EMPA) and pinacolyl methylphophonic acid (PMPA) were used as VX and soman (GD) nerve agent surrogates, respectively. Nanoseparation centrifugal devices with various pore size cut-off (30 kD up to 0.45 µm) and three RNA extraction methods (Invisorb, EZ1 and Nuclisens) were compared. RNA (MS2) and DNA (AcNPV) quantification was carried out by means of specific and sensitive quantitative real-time PCRs (qPCR). Liquid chromatography coupled to time-of-flight mass spectrometry (LC/TOFMS) methods was used for quantifying EMPA and PMPA. Culture methods and qPCR demonstrated that membranes with a 30 kD cut-off retain more than 99.99% of biological agents (MS2, AcNPV, Bacillus Atrophaeus and Bacillus subtilis spores) tested separately. A rapid and reliable separation of CB mixed sample models (MS2/PEG-400 and MS2/EMPA/PMPA) contained in simple liquid or complex matrices such as sand and soil was also successfully achieved on a 30 kD filter with more than 99.99% retention of MS2 on the filter membrane, and up to 99% of PEG-400, EMPA and PMPA recovery in the filtrate. The whole separation process turnaround-time (TAT) was less than 10 minutes. The filtration method appears to be rapid, versatile and extremely efficient. The separation method developed in this work constitutes therefore a useful model for further evaluating and comparing additional separation alternative procedures for a safe handling and preparation of CB mixed samples."
