id,abstract
https://openalex.org/W2050579879,"The hepatitis B virus (HBV) genome encodes the X protein (HBx), a ubiquitous transactivator that is required for HBV replication. Expression of the HBx protein has been associated with the development of HBV infection-related hepatocellular carcinoma (HCC). Previously, we generated a 3D structure of HBx by combined homology and ab initio in silico modelling. This structure showed a striking similarity to the human thymine DNA glycosylase (TDG), a key enzyme in the base excision repair (BER) pathway. To further explore this finding, we investigated whether both proteins interfere with or complement each other's functions. Here we show that TDG does not affect HBV replication, but that HBx strongly inhibits TDG-initiated base excision repair (BER), a major DNA repair pathway. Inhibition of the BER pathway may contribute substantially to the oncogenic effect of HBV infection."
https://openalex.org/W2036747305,"The ERH gene encodes a highly conserved small nuclear protein with a unique amino acid sequence and three-dimensional structure but unknown function. The gene is present in animals, plants, and protists but to date has only been found in few fungi. Here we report that ERH homologs are also present in all four species from the genus Schizosaccharomyces, S. pombe, S. octosporus, S. cryophilus, and S. japonicus, which, however, are an exception in this respect among Ascomycota and Basidiomycota. The ERH protein sequence is moderately conserved within the genus (58% identity between S. pombe and S. japonicus), but the intron-rich genes have almost identical intron-exon organizations in all four species. In S. pombe, erh1+ is expressed at a roughly constant level during vegetative growth and adaptation to unfavorable conditions such as nutrient limitation and hyperosmotic stress caused by sorbitol. Erh1p localizes preferentially to the nucleus with the exception of the nucleolus, but is also present in the cytoplasm. Cells lacking erh1+ have an aberrant cell morphology and a comma-like shape when cultured to the stationary phase, and exhibit a delayed recovery from this phase followed by slower growth. Loss of erh1+ in an auxotrophic background results in enhanced arrest in the G1 phase following nutritional stress, and also leads to hypersensitivity to agents inducing hyperosmotic stress (sorbitol), inhibiting DNA replication (hydroxyurea), and destabilizing the plasma membrane (SDS); this hypersensitivity can be abolished by expression of S. pombe erh1+ and, to a lesser extent, S. japonicus erh1+ or human ERH. Erh1p fails to interact with the human Ciz1 and PDIP46/SKAR proteins, known molecular partners of human ERH. Our data suggest that in Schizosaccharomyces sp. erh1+ is non-essential for normal growth and Erh1p could play a role in response to adverse environmental conditions and in cell cycle regulation."
https://openalex.org/W2056235771,"From a genetic screen for Drosophila melanogaster mutants with altered ethanol tolerance, we identified intolerant (intol), a novel allele of discs large 1 (dlg1). Dlg1 encodes Discs Large 1, a MAGUK (Membrane Associated Guanylate Kinase) family member that is the highly conserved homolog of mammalian PSD-95 and SAP97. The intol mutation disrupted specifically the expression of DlgS97, a SAP97 homolog, and one of two major protein isoforms encoded by dlg1 via alternative splicing. Expression of the major isoform, DlgA, a PSD-95 homolog, appeared unaffected. Ethanol tolerance in the intol mutant could be partially restored by transgenic expression of DlgS97, but not DlgA, in specific neurons of the fly's brain. Based on co-immunoprecipitation, DlgS97 forms a complex with N-methyl-D-aspartate (NMDA) receptors, a known target of ethanol. Consistent with these observations, flies expressing reduced levels of the essential NMDA receptor subunit dNR1 also showed reduced ethanol tolerance, as did mutants in the gene calcium/calmodulin-dependent protein kinase (caki), encoding the fly homolog of mammalian CASK, a known binding partner of DlgS97. Lastly, mice in which SAP97, the mammalian homolog of DlgS97, was conditionally deleted in adults failed to develop rapid tolerance to ethanol's sedative/hypnotic effects. We propose that DlgS97/SAP97 plays an important and conserved role in the development of tolerance to ethanol via NMDA receptor-mediated synaptic plasticity."
https://openalex.org/W2161299741,"Stem cells are thought to be the cell of origin in malignant transformation in many tissues, but their role in human prostate carcinogenesis continues to be debated. One of the conflicts with this model is that cancer stem cells have been described to lack androgen receptor (AR) expression, which is of established importance in prostate cancer initiation and progression. We re-examined the expression patterns of AR within adult prostate epithelial differentiation using an optimised sensitive and specific approach examining transcript, protein and AR regulated gene expression. Highly enriched populations were isolated consisting of stem (α2β1HI CD133+VE), transiently amplifying (α2β1HI CD133–VE) and terminally differentiated (α2β1LOW CD133–VE) cells. AR transcript and protein expression was confirmed in α2β1HI CD133+VE and CD133–VE progenitor cells. Flow cytometry confirmed that median (±SD) fraction of cells expressing AR were 77% (±6%) in α2β1HI CD133+VE stem cells and 68% (±12%) in α2β1HI CD133–VE transiently amplifying cells. However, 3-fold lower levels of total AR protein expression (peak and median immunofluorescence) were present in α2β1HI CD133+VE stem cells compared with differentiated cells. This finding was confirmed with dual immunostaining of prostate sections for AR and CD133, which again demonstrated low levels of AR within basal CD133+VE cells. Activity of the AR was confirmed in prostate progenitor cells by the expression of low levels of the AR regulated genes PSA, KLK2 and TMPRSS2. The confirmation of AR expression in prostate progenitor cells allows integration of the cancer stem cell theory with the established models of prostate cancer initiation based on a functional AR. Further study of specific AR functions in prostate stem and differentiated cells may highlight novel mechanisms of prostate homeostasis and insights into tumourigenesis."
https://openalex.org/W1988387203,"The NGS (next generation sequencing)-based metagenomic data analysis is becoming the mainstream for the study of microbial communities. Faced with a large amount of data in metagenomic research, effective data visualization is important for scientists to effectively explore, interpret and manipulate such rich information. The visualization of the metagenomic data, especially multi-sample data, is one of the most critical challenges. The different data sample sources, sequencing approaches and heterogeneous data formats make robust and seamless data visualization difficult. Moreover, researchers have different focuses on metagenomic studies: taxonomical or functional, sample-centric or genome-centric, single sample or multiple samples, etc. However, current efforts in metagenomic data visualization cannot fulfill all of these needs, and it is extremely hard to organize all of these visualization effects in a systematic manner. An extendable, interactive visualization tool would be the method of choice to fulfill all of these visualization needs. In this paper, we have present MetaSee, an extendable toolbox that facilitates the interactive visualization of metagenomic samples of interests. The main components of MetaSee include: (I) a core visualization engine that is composed of different views for comparison of multiple samples: Global view, Phylogenetic view, Sample view and Taxa view, as well as link-out for more in-depth analysis; (II) front-end user interface with real metagenomic models that connect to the above core visualization engine and (III) open-source portal for the development of plug-ins for MetaSee. This integrative visualization tool not only provides the visualization effects, but also enables researchers to perform in-depth analysis of the metagenomic samples of interests. Moreover, its open-source portal allows for the design of plug-ins for MetaSee, which would facilitate the development of any additional visualization effects."
https://openalex.org/W2047154731,"During recent years, extensive amounts of data have become available regarding influenza A virus (IAV) in wild birds in northern Europe, while information from southern Europe is more limited. Here, we present an IAV surveillance study conducted in western Portugal 2008–2009, analyzing 1653 samples from six different species of waterfowl, with the majority of samples taken from Mallards (Anas platyrhynchos). Overall 4.4% of sampled birds were infected. The sampling results revealed a significant temporal variation in the IAV prevalence, including a pronounced peak among predominantly young birds in June, indicating that IAV circulate within breeding populations in the wetlands of western Portugal. The H10N7 and H9N2 subtypes were predominant among isolated viruses. Phylogenetic analyses of the hemagglutinin and neuraminidase sequences of H10N7, H9N2 and H11N3 virus showed that sequences from Portugal were closely related to viral sequences from Central Europe as well as to IAVs isolated in the southern parts of Africa, reflecting Portugal’s position on the European-African bird migratory flyway. This study highlights the importance of Portugal as a migratory crossroad for IAV, connecting breeding stationary waterfowl with birds migrating between continents which enable transmission and spread of IAV."
https://openalex.org/W2157928464,"In the light of ongoing land use changes, it is important to understand how multitrophic communities perform at different land use intensities. The paradox of enrichment predicts that fertilization leads to destabilization and extinction of predator-prey systems. We tested this prediction for a land use intensity gradient from natural to highly fertilized agricultural ecosystems. We included multiple aboveground and belowground trophic levels and land use-dependent searching efficiencies of insects. To overcome logistic constraints of field experiments, we used a successfully validated simulation model to investigate plant responses to removal of herbivores and their enemies. Consistent with our predictions, instability measured by herbivore-induced plant mortality increased with increasing land use intensity. Simultaneously, the balance between herbivores and natural enemies turned increasingly towards herbivore dominance and natural enemy failure. Under natural conditions, there were more frequently significant effects of belowground herbivores and their natural enemies on plant performance, whereas there were more aboveground effects in agroecosystems. This result was partly due to the “boom-bust” behavior of the shoot herbivore population. Plant responses to herbivore or natural enemy removal were much more abrupt than the imposed smooth land use intensity gradient. This may be due to the presence of multiple trophic levels aboveground and belowground. Our model suggests that destabilization and extinction are more likely to occur in agroecosystems than in natural communities, but the shape of the relationship is nonlinear under the influence of multiple trophic interactions."
https://openalex.org/W1971353579,"The force-induced unfolding of calmodulin (CaM) was investigated at atomistic details with steered molecular dynamics. The two isolated CaM domains as well as the full-length CaM were simulated in N-C-terminal pulling scheme, and the isolated N-lobe of CaM was studied specially in two other pulling schemes to test the effect of pulling direction and compare with relevant experiments. Both Ca(2+)-loaded CaM and Ca(2+)-free CaM were considered in order to define the Ca(2+) influence to the CaM unfolding. The results reveal that the Ca(2+) significantly affects the stability and unfolding behaviors of both the isolated CaM domains and the full-length CaM. In Ca(2+)-loaded CaM, N-terminal domain unfolds in priori to the C-terminal domain. But in Ca(2+)-free CaM, the unfolding order changes, and C-terminal domain unfolds first. The force-extension curves of CaM unfolding indicate that the major unfolding barrier comes from conquering the interaction of two EF-hand motifs in both N- and C- terminal domains. Our results provide the atomistic-level insights in the force-induced CaM unfolding and explain the observation in recent AFM experiments."
https://openalex.org/W1979338881,"The main objective of the present study was to estimate the uptake to quality indicators that reflect the current evidence-based recommendations and guidelines.A retrospective review of medical records of patients admitted to two hospitals in the South of Italy was conducted. For the purposes of the analysis, a sets of quality indicators has been used from the Joint Commission on Accreditation of Hospital Organizations and Centers for Medicare & Medicaid Services. Four areas of care were selected: acute myocardial infarction (AMI), heart failure (HF), pneumonia (PN), and surgical care improvement project (SCIP). Frequency or median was calculated, as appropriate, for each indicator. A composite score was calculated to estimate the overall performance for each area of care.A total of 1772 medical records were reviewed. The adherence rates showed a wide-ranging variability among the selected indicators. The use of aspirin and angiotensin-converting enzyme inhibitor (ACEI) or angiotensin receptor blocker (ARB) for AMI, the use of ACEI or ARB for HF, the use of appropriate thromboembolism prophylaxis and appropriate hair removal for surgical patients almost approached optimal adherence. At the other extreme, rates regarding adherence to smoking-cessation counseling in AMI and HF patients, discharge instructions in HF patients, and influenza and pneumococcal vaccination in pneumonia patients were noticeably intangible. Overall, the recommended processes of care among eligible patients were provided in 70% for AMI, in 32.4% for HF, in 46.4% for PN, and in 46% for SCIP.The results show that there is still substantial work that lies ahead on the way to improve the uptake to evidence-based processes of care. Improvement initiatives should be focused more on domains of healthcare than on specific conditions, especially on the area of preventive care."
https://openalex.org/W2131684410,"DNA replication is a highly regulated process, with each genomic locus replicating at a distinct time of replication (ToR). Advances in ToR measurement technology enabled several genome-wide profiling studies that revealed tight associations between ToR and general genomic features and a remarkable ToR conservation in mammals. Genome wide studies further showed that at the hundreds kb-to-megabase scale the genome can be divided into constant ToR regions (CTRs) in which the replication process propagates at a faster pace due to the activation of multiple origins and temporal transition regions (TTRs) in which the replication process propagates at a slower pace. We developed a computational tool that assigns a ToR to every measured locus and determines its replication activity type (CTR versus TTR). Our algorithm, ARTO (Analysis of Replication Timing and Organization), uses signal processing methods to fit a constant piece-wise linear curve to the measured raw data. We tested our algorithm and provide performance and usability results. A Matlab implementation of ARTO is available at http://bioinfo.cs.technion.ac.il/people/zohar/ARTO/. Applying our algorithm to ToR data measured in multiple mouse and human samples allowed precise genome-wide ToR determination and replication activity type characterization. Analysis of the results highlighted the plasticity of the replication program. For example, we observed significant ToR differences in 10-25% of the genome when comparing different tissue types. Our analyses also provide evidence for activity type differences in up to 30% of the probes. Integration of the ToR data with multiple aspects of chromosome organization characteristics suggests that ToR plays a role in shaping the regional chromatin structure. Namely, repressive chromatin marks, are associated with late ToR both in TTRs and CTRs. Finally, characterization of the differences between TTRs and CTRs, with matching ToR, revealed that TTRs are associated with compact chromatin and are located significantly closer to the nuclear envelope. Supplementary material is available. Raw and processed data were deposited in Geo (GSE17236)."
https://openalex.org/W2036442714,"A combined ligand and structure-based drug design approach provides a synergistic advantage over either methods performed individually. Present work bestows a good assembly of ligand and structure-based pharmacophore generation concept. Ligand-oriented study was accomplished by employing the HypoGen module of Catalyst in which we have translated the experimental findings into 3-D pharmacophore models by identifying key features (four point pharmacophore) necessary for interaction of the inhibitors with the active site of HIV-1 protease enzyme using a training set of 33 compounds belonging to the cyclic cyanoguanidines and cyclic urea derivatives. The most predictive pharmacophore model (hypothesis 1), consisting of four features, namely, two hydrogen bond acceptors and two hydrophobic, showed a correlation (r) of 0.90 and a root mean square of 0.71 and cost difference of 56.59 bits between null cost and fixed cost. The model was validated using CatScramble technique, internal and external test set prediction. In the second phase of our study, a structure-based five feature pharmacophore hypothesis was generated which signifies the importance of hydrogen bond donor, hydrogen bond acceptors and hydrophobic interaction between the HIV-1 protease enzyme and its inhibitors. This work has taken a significant step towards the full integration of ligand and structure-based drug design methodologies as pharmacophoric features retrieved from structure-based strategy complemented the features from ligand-based study hence proving the accuracy of the developed models. The ligand-based pharmacophore model was used in virtual screening of Maybridge and NCI compound database resulting in the identification of four structurally diverse druggable compounds with nM activities."
https://openalex.org/W1988695822,"Oncogenic mutations leading to persistent kinase activities are implicated in various human malignancies. Thereby, signaling pathway-targeted therapies are powerful customized treatment to eradicate cancer cells. In murine and human leukemia cells harboring mutations in Kit, we previously showed that distinct and independent pathways controlled resistance to apoptosis or cell cycle. A treatment with PI3Kinase inhibitors to reduce cell proliferation combined with inhibitors of Erk1/2 activity to promote apoptosis had synergistic effects allowing eradication of leukemia cell growth. We reported here that Bim(EL), a pro-apoptotic member of the Bcl2 family proteins, is the target of Erk1/2 signaling and that its down-regulation is responsible for the apoptosis resistance of murine and human leukemic cells. Downstream of Kit mutant, the tyrosine phosphatase Shp2 maintains Bim(EL) expression at a low level, through Erk/2 activation and proteosomal Bim(EL) degradation. This process is controlled by Shp2 independently of other signaling pathways activated downstream of oncogenic Kit, demonstrating that Shp2 is a key regulator of Bim expression in the context of an oncogenic signaling. The increase in Bim(EL) expression is associated to an increased apoptosis. Moreover, the depletion of Bim overcomes apoptosis associated with Erk1/2 inactivation in UO126-treated leukemic cells, thereby establishing the contribution of Bim to drug-induced apoptosis. These data provide a molecular rationale for using BH3 mimetics in combination with PI3K inhibitors to treat leukemia, especially in the case of an oncogenic signaling refractory to Tyrosine Kinase inhibitors."
https://openalex.org/W2093293313,"Currently, statins are the only drugs acting on the mammalian isoprenoid pathway. The mammalian genes in this pathway are not easily amenable to genetic manipulation. Thus, it is difficult to study the effects of the inhibition of various enzymes on the intermediate and final products in the isoprenoid pathway. In fission yeast, antifungal compounds such as azoles and terbinafine are available as inhibitors of the pathway in addition to statins, and various isoprenoid pathway mutants are also available. Here in these mutants, treated with statins or antifungals, we quantified the final and intermediate products of the fission yeast isoprenoid pathway using liquid chromatography-mass spectrometry/mass spectrometry. In hmg1-1, a mutant of the gene encoding 3-hydroxy-3-methylglutaryl coenzyme A reductase (HMGR), ergosterol (a final sterol product), and squalene (an intermediate pathway product), were decreased to approximately 80% and 10%, respectively, compared with that of wild-type cells. Consistently in wild-type cells, pravastatin, an HMGR inhibitor decreased ergosterol and squalene, and the effect was more pronounced on squalene. In hmg1-1 mutant and in wild-type cells treated with pravastatin, the decrease in the levels of farnesyl pyrophosphate and geranylgeranyl pyrophosphate respectively was larger than that of ergosterol but was smaller than that of squalene. In Δerg6 or Δsts1 cells, mutants of the genes involved in the last step of the pathway, ergosterol was not detected, and the changes of intermediate product levels were distinct from that of hmg1-1 mutant. Notably, in wild-type cells miconazole and terbinafine only slightly decreased ergosterol level. Altogether, these studies suggest that the pleiotropic phenotypes caused by the hmg1-1 mutation and pravastatin might be due to decreased levels of isoprenoid pyrophosphates or other isoprenoid pathway intermediate products rather than due to a decreased ergosterol level."
https://openalex.org/W2001650727,"Bacterial β-lactamase enzymes are in large part responsible for the decreased ability of β-lactam antibiotics to combat infections. The inability to overcome β-lactamase mediated resistance spurred the development of inhibitors with penems and penam sulfones being amongst the most potent and broad spectrum mechanism-based inactivators. These inhibitors form covalent, “suicide-type” inhibitory intermediates that are attached to the catalytic S70 residue. To further probe the details of the mechanism of β-lactamase inhibition by these novel compounds, we determined the crystal structures of SHV-1 bound with penem 1, and penam sulfones SA1-204 and SA3-53. Comparison with each other and with previously determined crystal structures of members of these classes of inhibitors suggests that the final conformation of the covalent adduct can vary greatly amongst the complex structures. In contrast, a common theme of carbonyl conjugation as a mechanism to avoid deacylation emerges despite that the penem and penam sulfone inhibitors form different types of intermediates. The detailed insights gained from this study could be used to further improve new mechanism-based inhibitors of these common class A serine β-lactamases."
https://openalex.org/W2068442057,"Emerging evidence indicates that CD4(+) T cells possess cytotoxic potential for tumor eradication and perforin/granzyme-mediated cytotoxicity functions as one of the important mechanisms for CD4(+) T cell-triggered cell killing. However, the critical issue is how the cytotoxic CD4(+) T cells are developed. During the course of our work that aims at promoting immunostimulation of APCs by inhibition of negative regulators, we found that A20-silenced Mф drastically induced granzyme B expression in CD4(+) T cells. As a consequence, the granzyme-highly expressing CD4(+) T cells exhibited a strong cytotoxic activity that restricted tumor development. We found that A20-silenced Mф activated cytotoxic CD4(+) T cells by MHC class-II restricted mechanism and the activation was largely dependent on enhanced production of IFN-γ."
