id,abstract
https://openalex.org/W2034677156,"Background Staphylococcus aureus is a major cause of healthcare associated mortality, but like many important bacterial pathogens, it is a common constituent of the normal human body flora. Around a third of healthy adults are carriers. Recent evidence suggests that evolution of S. aureus during nasal carriage may be associated with progression to invasive disease. However, a more detailed understanding of within-host evolution under natural conditions is required to appreciate the evolutionary and mechanistic reasons why commensal bacteria such as S. aureus cause disease. Therefore we examined in detail the evolutionary dynamics of normal, asymptomatic carriage. Sequencing a total of 131 genomes across 13 singly colonized hosts using the Illumina platform, we investigated diversity, selection, population dynamics and transmission during the short-term evolution of S. aureus. Principal Findings We characterized the processes by which the raw material for evolution is generated: micro-mutation (point mutation and small insertions/deletions), macro-mutation (large insertions/deletions) and the loss or acquisition of mobile elements (plasmids and bacteriophages). Through an analysis of synonymous, non-synonymous and intergenic mutations we discovered a fitness landscape dominated by purifying selection, with rare examples of adaptive change in genes encoding surface-anchored proteins and an enterotoxin. We found evidence for dramatic, hundred-fold fluctuations in the size of the within-host population over time, which we related to the cycle of colonization and clearance. Using a newly-developed population genetics approach to detect recent transmission among hosts, we revealed evidence for recent transmission between some of our subjects, including a husband and wife both carrying populations of methicillin-resistant S. aureus (MRSA). Significance This investigation begins to paint a picture of the within-host evolution of an important bacterial pathogen during its prevailing natural state, asymptomatic carriage. These results also have wider significance as a benchmark for future systematic studies of evolution during invasive S. aureus disease."
https://openalex.org/W2091672012,"According to a ""parasite stress"" hypothesis, authoritarian governments are more likely to emerge in regions characterized by a high prevalence of disease-causing pathogens. Recent cross-national evidence is consistent with this hypothesis, but there are inferential limitations associated with that evidence. We report two studies that address some of these limitations, and provide further tests of the hypothesis. Study 1 revealed that parasite prevalence strongly predicted cross-national differences on measures assessing individuals' authoritarian personalities, and this effect statistically mediated the relationship between parasite prevalence and authoritarian governance. The mediation result is inconsistent with an alternative explanation for previous findings. To address further limitations associated with cross-national comparisons, Study 2 tested the parasite stress hypothesis on a sample of traditional small-scale societies (the Standard Cross-Cultural Sample). Results revealed that parasite prevalence predicted measures of authoritarian governance, and did so even when statistically controlling for other threats to human welfare. (One additional threat—famine—also uniquely predicted authoritarianism.) Together, these results further substantiate the parasite stress hypothesis of authoritarianism, and suggest that societal differences in authoritarian governance result, in part, from cultural differences in individuals' authoritarian personalities."
https://openalex.org/W1994433204,"Medication non-adherence frequently leads to suboptimal patient outcomes. Primary non-adherence, which occurs when a patient does not fill an initial prescription, is particularly important at the time of hospital discharge because new medications are often being prescribed to treat an illness rather than for prevention.We studied older adults consecutively discharged from a general internal medicine service at a large urban teaching hospital to determine the prevalence of primary non-adherence and identify characteristics associated with primary non-adherence. We reviewed electronic prescriptions, electronic discharge summaries and pharmacy dispensing data from April to August 2010 for drugs listed on the public formulary. Primary non-adherence was defined as failure to fill one or more new prescriptions after hospital discharge. In addition to descriptive analyses, we developed a logistical regression model to identify patient characteristics associated with primary non-adherence.There were 493 patients eligible for inclusion in our study, 232 of whom were prescribed new medications. In total, 66 (28%) exhibited primary non-adherence at 7 days after discharge and 55 (24%) at 30 days after discharge. Examples of medications to which patients were non-adherent included antibiotics, drugs for the management of coronary artery disease (e.g. beta-blockers, statins), heart failure (e.g. beta-blockers, angiotensin converting enzyme inhibitors, furosemide), stroke (e.g. statins, clopidogrel), diabetes (e.g. insulin), and chronic obstructive pulmonary disease (e.g. long-acting bronchodilators, prednisone). Discharge to a nursing home was associated with an increased risk of primary non-adherence (OR 2.25, 95% CI 1.01-4.95).Primary non-adherence after medications are newly prescribed during a hospitalization is common, and was more likely to occur in patients discharged to a nursing home."
https://openalex.org/W1991701789,"Online social networking usage is growing rapidly, especially among at-risk populations, such as men who have sex with men (MSM). However, little research has studied the relationship between online social networking usage and sexual risk behaviors among at-risk populations. One hundred and eighteen Facebook-registered MSM (60.1% Latino, 28% African American; 11.9% other) were recruited from online (social networking websites and banner advertisements) and offline (local clinics, restaurants and organizations) venues frequented by minority MSM. Inclusion criteria required participants to be men who were 18 years of age or older, had had sex with a man in the past 12 months, were living in Los Angeles, and had a Facebook account. Participants completed an online survey on their social media usage and sexual risk behaviors. Results from a multivariable regression suggest that number of sexual partners met from online social networking technologies is associated with increased: 1) likelihood of having exchanged sex for food, drugs, or a place to stay within the past 3 months; 2) number of new partners within the past 3 months; 3) number of male sex partners within the past 3 months; and 4) frequency of engaging in oral sex within the past 3 months, controlling for age, race, education, and total number of sexual partners. Understanding the relationship between social media sex-seeking and sexual risk behaviors among at-risk populations will help inform population-focused HIV prevention and treatment interventions."
https://openalex.org/W2010244610,"In contrast to generally sparse biological communities in open-ocean settings, seamounts and ridges are perceived as areas of elevated productivity and biodiversity capable of supporting commercial fisheries. We investigated the origin of this apparent biological enhancement over a segment of the North Mid-Atlantic Ridge (MAR) using sonar, corers, trawls, traps, and a remotely operated vehicle to survey habitat, biomass, and biodiversity. Satellite remote sensing provided information on flow patterns, thermal fronts, and primary production, while sediment traps measured export flux during 2007–2010. The MAR, 3,704,404 km2 in area, accounts for 44.7% lower bathyal habitat (800–3500 m depth) in the North Atlantic and is dominated by fine soft sediment substrate (95% of area) on a series of flat terraces with intervening slopes either side of the ridge axis contributing to habitat heterogeneity. The MAR fauna comprises mainly species known from continental margins with no evidence of greater biodiversity. Primary production and export flux over the MAR were not enhanced compared with a nearby reference station over the Porcupine Abyssal Plain. Biomasses of benthic macrofauna and megafauna were similar to global averages at the same depths totalling an estimated 258.9 kt C over the entire lower bathyal north MAR. A hypothetical flat plain at 3500 m depth in place of the MAR would contain 85.6 kt C, implying an increase of 173.3 kt C attributable to the presence of the Ridge. This is approximately equal to 167 kt C of estimated pelagic biomass displaced by the volume of the MAR. There is no enhancement of biological productivity over the MAR; oceanic bathypelagic species are replaced by benthic fauna otherwise unable to survive in the mid ocean. We propose that globally sea floor elevation has no effect on deep sea biomass; pelagic plus benthic biomass is constant within a given surface productivity regime."
https://openalex.org/W2084427613,"The ability to add reagents to drops in a sequential fashion is necessary for numerous applications of microfluidics in biology. An important method for accomplishing this is picoinjection, a technique in which reagents are injected into aqueous drops using an electric field. While picoinjection has been shown to allow the precise addition of reagents to drops, its compatibility with biological reactions is yet to be thoroughly demonstrated. Here, we investigate the compatibility of picoinjection with digital RT-PCR Taqman assays, reactions that incorporate nucleic acids, enzymes, and other common biological reagents. We find that picoinjection is compatible with this assay and enables the detection of RNA transcripts at rates comparable to workflows not incorporating picoinjection. We also find that picoinjection results in negligible transfer of material between drops and that the drops faithfully retain their compartmentalization."
https://openalex.org/W2134327724,"Introduction This study clarifies the trends observed in open access (OA) in the biomedical field between 2006 and 2010, and explores the possible explanations for the differences in OA rates revealed in recent surveys. Methods The study consists of a main survey and two supplementary surveys. In the main survey, a manual Google search was performed to investigate whether full-text versions of articles from PubMed were freely available. Target samples were articles published in 2005, 2007, and 2009; the searches were performed a year after publication in 2006, 2008, and 2010, respectively. Using the search results, we classified the OA provision methods into seven categories. The supplementary surveys calculated the OA rate using two search functions on PubMed: “LinkOut” and “Limits.” Results The main survey concluded that the OA rate increased significantly between 2006 and 2010: the OA rate in 2010 (50.2%) was twice that in 2006 (26.3%). Furthermore, majority of OA articles were available from OA journal (OAJ) websites, indicating that OAJs have consistently been a significant contributor to OA throughout the period. OA availability through the PubMed Central (PMC) repository also increased significantly. OA rates obtained from two supplementary surveys were lower than those found in the main survey. “LinkOut” could find only 40% of OA articles in the main survey. Discussion OA articles in the biomedical field have more than a 50% share. OA has been achieved through OAJs. The reason why the OA rates in our surveys are different from those in recent surveys seems to be the difference in sampling methods and verification procedures."
https://openalex.org/W1977264322,"The ever increasing industrial and consumer applications of titanium dioxide nanoparticles (TiO2 NPs) raise concern over the possible risk associated with their environmental exposure. Still, the knowledge regarding nanoparticle behavior in a freshwater ecosystem is lacking. The current study focuses on the toxicity of TiO2 NPs towards Ceriodaphnia dubia (a dominant daphnid isolated from the freshwater) under two different conditions; (1) light and dark photoperiod (16:8 h) and (2) continuous dark conditions, for a period of 48 h. An increase in toxicity was observed with an increase in the concentration, until a certain threshold level (under both photoperiod and dark conditions), and beyond which, reduction was noted. The decrease in toxicity would have resulted from the aggregation and settling of NPs, making them less bioavailable. The oxidative stress was one of the major contributors towards cytotoxicity under both photoperiod and dark conditions. The slow depuration of TiO2 NPs under the photoperiod conditions confirmed a higher NP bioaccumulation and thus a higher bioconcentration factor (BCF) compared to dark conditions. The transmission electron micrographs confirmed the bioaccumulation of NPs and damage of tissues in the gut lining."
https://openalex.org/W2013679298,"A-type lamins encoded by LMNA form a structural fibrillar meshwork within the mammalian nucleus. How this nuclear organization may influence the execution of biological processes involving DNA transactions remains unclear. Here, we characterize changes in the dynamics and biochemical interactions of lamin A/C after DNA damage. We find that DNA breakage reduces the mobility of nucleoplasmic GFP-lamin A throughout the nucleus as measured by dynamic fluorescence imaging and spectroscopy in living cells, suggestive of incorporation into stable macromolecular complexes, but does not induce the focal accumulation of GFP-lamin A at damage sites. Using a proximity ligation assay and biochemical analyses, we show that lamin A engages chromatin via histone H2AX and its phosphorylated form (γH2AX) induced by DNA damage, and that these interactions are enhanced after DNA damage. Finally, we use three-dimensional time-lapse imaging to show that LMNA inactivation significantly reduces the positional stability of DNA repair foci in living cells. This defect is partially rescued by the stable expression of GFP-lamin A. Thus collectively, our findings suggest that the dynamic structural meshwork formed by A-type lamins anchors sites of DNA repair in mammalian nuclei, providing fresh insight into the control of DNA transactions by nuclear structural organization."
https://openalex.org/W2294783710,"Age is a powerful predictor of survival in glioblastoma multiforme (GBM) yet the biological basis for the difference in clinical outcome is mostly unknown. Discovering genes and pathways that would explain age-specific survival difference could generate opportunities for novel therapeutics for GBM. Here we have integrated gene expression, exon expression, microRNA expression, copy number alteration, SNP, whole exome sequence, and DNA methylation data sets of a cohort of GBM patients in The Cancer Genome Atlas (TCGA) project to discover age-specific signatures at the transcriptional, genetic, and epigenetic levels and validated our findings on the REMBRANDT data set. We found major age-specific signatures at all levels including age-specific hypermethylation in polycomb group protein target genes and the upregulation of angiogenesis-related genes in older GBMs. These age-specific differences in GBM, which are independent of molecular subtypes, may in part explain the preferential effects of anti-angiogenic agents in older GBM and pave the way to a better understanding of the unique biology and clinical behavior of older versus younger GBMs."
https://openalex.org/W2006032721,"Transcriptomic profiles of the serious lepidopteran insect pest Lymantria dispar (gypsy moth) were characterized in the larval midgut in response to infection by Bacillus thuringiensis kurstaki, a biopesticide commonly used for its control. RNA-Seq approaches were used to define a set of 49,613 assembled transcript sequences, of which 838, 1,248 and 3,305 were respectively partitioned into high-, mid- and low-quality tiers on the basis of homology information. Digital gene expression profiles suggested genes differentially expressed at 24 hours post infection, and qRT-PCR analyses were performed for verification. The differentially expressed genes primarily associated with digestive function, including α-amylase, lipase and carboxypeptidase; immune response, including C-type lectin 4; developmental genes such as arylphorin; as well as a variety of binding proteins: cellular retinoic acid binding protein (lipid-binding), insulin-related peptide binding protein (protein-binding) and ovary C/EBPg transcription factor (nucleic acid-binding). This is the first study conducted to specifically investigate gypsy moth response to a bacterial infection challenge using large-scale sequencing technologies, and the results highlight important genes that could be involved in biopesticide resistance development or could serve as targets for biologically-based control mechanisms of this insect pest."
https://openalex.org/W2091680206,"Inhibition of chymase is likely to divulge therapeutic ways for the treatment of cardiovascular diseases, and fibrotic disorders. To find novel and potent chymase inhibitors and to provide a new idea for drug design, we used both ligand-based and structure-based methods to perform the virtual screening(VS) of commercially available databases. Different pharmacophore models generated from various crystal structures of enzyme may depict diverse inhibitor binding modes. Therefore, multiple pharmacophore-based approach is applied in this study. X-ray crystallographic data of chymase in complex with different inhibitors were used to generate four structure–based pharmacophore models. One ligand–based pharmacophore model was also developed from experimentally known inhibitors. After successful validation, all pharmacophore models were employed in database screening to retrieve hits with novel chemical scaffolds. Drug-like hit compounds were subjected to molecular docking using GOLD and AutoDock. Finally four structurally diverse compounds with high GOLD score and binding affinity for several crystal structures of chymase were selected as final hits. Identification of final hits by three different pharmacophore models necessitates the use of multiple pharmacophore-based approach in VS process. Quantum mechanical calculation is also conducted for analysis of electrostatic characteristics of compounds which illustrates their significant role in driving the inhibitor to adopt a suitable bioactive conformation oriented in the active site of enzyme. In general, this study is used as example to illustrate how multiple pharmacophore approach can be useful in identifying structurally diverse hits which may bind to all possible bioactive conformations available in the active site of enzyme. The strategy used in the current study could be appropriate to design drugs for other enzymes as well."
https://openalex.org/W2035959831,"Mycobacterium avium subsp. paratuberculosis (MAP) causes a chronic infection in cattle. MAP infected cattle with humoral immune (HI) reactions with IgG antibodies are usually those where latency of infection has ceased and their infection is progressing towards reduced milk yield, weight loss and significant bacterial excretion in feces. The proportion of detectable infections among all infected animals that will develop disease is often referred to as 'the tip of the iceberg'. The purpose of this study was to estimate this proportion. Test-records from 18,972 Danish dairy cows with MAP specific IgG antibodies on their final test-record were used to estimate age-specific sensitivities (Se). These cows were the infected ones considered to develop disease in a population with a representative age-distribution and were defined as cases. The specificity (Sp) of the test was estimated based on test-results from 166,905 cows, which had no MAP IgG antibodies in their final four test-records. The Sp, age-specific Se and maximum Se were used to estimate the probability of having HI at a given age resulting in the proportion of infected cows with HI at a given age. For cows 2 years of age, the proportion of detectable cases was 0.33, while it was 0.94 for cows 5 years of age. Thus, there was a significant shift in the tip of the iceberg with aging. This study provided a model for estimating the proportion of latent chronic infections that would progress to disease, and the results can be used to model infection dynamics."
https://openalex.org/W2063800664,"Seagrass beds are the foundation species of functionally important coastal ecosystems worldwide. The world’s largest losses of the widespread seagrass Zostera marina (eelgrass) have been reported as a consequence of wasting disease, an infection with the endophytic protist Labyrinthula zosterae. During one of the most extended epidemics in the marine realm, ∼90% of East and Western Atlantic eelgrass beds died-off between 1932 and 1934. Today, small outbreaks continue to be reported, but the current extent of L. zosterae in European meadows is completely unknown. In this study we quantify the abundance and prevalence of the wasting disease pathogen among 19 Z. marina populations in northern European coastal waters, using quantitative PCR (QPCR) with primers targeting a species specific portion of the internally transcribed spacer (ITS1) of L. zosterae. Spatially, we found marked variation among sites with abundances varying between 0 and 126 cells mg−1 Z. marina dry weight (mean: 5.7 L. zosterae cells mg−1 Z. marina dry weight ±1.9 SE) and prevalences ranged from 0–88.9%. Temporarily, abundances varied between 0 and 271 cells mg−1 Z. marina dry weight (mean: 8.5±2.6 SE), while prevalences ranged from zero in winter and early spring to 96% in summer. Field concentrations accessed via bulk DNA extraction and subsequent QPCR correlated well with prevalence data estimated via isolation and cultivation from live plant tissue. L. zosterae was not only detectable in black lesions, a sign of Labyrinthula-induced necrosis, but also occurred in green, apparently healthy tissue. We conclude that L. zosterae infection is common (84% infected populations) in (northern) European eelgrass populations with highest abundances during the summer months. In the light of global climate change and increasing rate of marine diseases our data provide a baseline for further studies on the causes of pathogenic outbreaks of L. zosterae."
https://openalex.org/W2081764680,"The analysis of dietary patterns has become a valuable tool to examine diet-disease relationships but little is known about their effects on quality of life. Our aim was to ascertain the association between major dietary patterns and mental and physical quality of life after 4 years of follow-up.This analysis included 11,128 participants from the ""Seguimiento Universidad de Navarra"" (SUN) cohort. Dietary habits were assessed using a validated food-frequency questionnaire. Factor analysis was used to derive dietary patterns. Quality of life was measured with the validated Spanish version of the SF-36 Health Survey.Two major dietary patterns were identified, the 'Western' dietary pattern (rich in red meats, processed pastries and fast-food) and the ""Mediterranean"" dietary pattern (high in fruits, vegetables and olive oil). After controlling for confounders, the Western dietary pattern was associated with quality of life in all domains. The magnitude of these differences between the subjects in the highest (quintile 5) and the lowest quintile of adherence to the Western pattern ranged from -0.8 (for mental health) to -3.5 (for vitality). On the contrary, the Mediterranean dietary pattern was associated with better quality of life domains: differences ranged from +1.3 (for physical functioning) to +3.4 (for vitality) when comparing extreme quintiles of adherence. Additional sensitivity analyses did not change the reported differences.Whereas baseline adherence to a Western dietary pattern was inversely associated with self-perceived quality of life after 4 years of follow-up, baseline adherence to a Mediterranean dietary pattern was directly associated with better scores in quality of life four years later in the SUN Project."
