id,abstract
https://openalex.org/W2090931660,"Understanding the neurobiological mechanisms of addiction requires an integration of basic neuroscience with social psychology, experimental psychology, and psychiatry. Addiction is presented as a cycle of spiralling dysregulation of brain reward systems that progressively increases, resulting in compulsive drug use and a loss of control over drug-taking. Sensitization and counteradaptation are hypothesized to contribute to this hedonic homeostatic dysregulation, and the neurobiological mechanisms involved, such as the mesolimbic dopamine system, opioid peptidergic systems, and brain and hormonal stress systems, are beginning to be characterized. This framework provides a realistic approach to identifying the neurobiological factors that produce vulnerability to addiction and to relapse in individuals with a history of addiction."
https://openalex.org/W2105470099,"Expression of Agouti protein is normally limited to the skin where it affects pigmentation, but ubiquitous expression causes obesity. An expressed sequence tag was identified that encodes Agouti-related protein, whose RNA is normally expressed in the hypothalamus and whose levels were increased eightfold in ob/ob mice. Recombinant Agouti-related protein was a potent, selective antagonist of Mc3r and Mc4r, melanocortin receptor subtypes implicated in weight regulation. Ubiquitous expression of human AGRP complementary DNA in transgenic mice caused obesity without altering pigmentation. Thus, Agouti-related protein is a neuropeptide implicated in the normal control of body weight downstream of leptin signaling."
https://openalex.org/W2157383890,"Scientific advances over the past 20 years have shown that drug addiction is a chronic, relapsing disease that results from the prolonged effects of drugs on the brain. As with many other brain diseases, addiction has embedded behavioral and social-context aspects that are important parts of the disorder itself. Therefore, the most effective treatment approaches will include biological, behavioral, and social-context components. Recognizing addiction as a chronic, relapsing brain disorder characterized by compulsive drug seeking and use can impact society's overall health and social policy strategies and help diminish the health and social costs associated with drug abuse and addiction."
https://openalex.org/W2085497102,"The first fully automated design and experimental validation of a novel sequence for an entire protein is described. A computational design algorithm based on physical chemical potential functions and stereochemical constraints was used to screen a combinatorial library of 1.9 x 10(27) possible amino acid sequences for compatibility with the design target, a betabetaalpha protein motif based on the polypeptide backbone structure of a zinc finger domain. A BLAST search shows that the designed sequence, full sequence design 1 (FSD-1), has very low identity to any known protein sequence. The solution structure of FSD-1 was solved by nuclear magnetic resonance spectroscopy and indicates that FSD-1 forms a compact well-ordered structure, which is in excellent agreement with the design target structure. This result demonstrates that computational methods can perform the immense combinatorial search required for protein design, and it suggests that an unbiased and quantitative algorithm can be used in various structural contexts."
