id,abstract
https://openalex.org/W2168442336,"Wrapping of carbon nanotubes (CNTs) by single-stranded DNA (ssDNA) was found to be sequence-dependent. A systematic search of the ssDNA library selected a sequence d(GT)n, n = 10 to 45 that self-assembles into a helical structure around individual nanotubes in such a way that the electrostatics of the DNA-CNT hybrid depends on tube diameter and electronic properties, enabling nanotube separation by anion exchange chromatography. Optical absorption and Raman spectroscopy show that early fractions are enriched in the smaller diameter and metallic tubes, whereas late fractions are enriched in the larger diameter and semiconducting tubes."
https://openalex.org/W1965696184,"An array of aligned carbon nanotubes (CNTs) was incorporated across a polymer film to form a well-ordered nanoporous membrane structure. This membrane structure was confirmed by electron microscopy, anisotropic electrical conductivity, gas flow, and ionic transport studies. The measured nitrogen permeance was consistent with the flux calculated by Knudsen diffusion through nanometer-scale tubes of the observed microstructure. Data on Ru(NH3)6(3+) transport across the membrane in aqueous solution also indicated transport through aligned CNT cores of the observed microstructure. The lengths of the nanotubes within the polymer film were reduced by selective electrochemical oxidation, allowing for tunable pore lengths. Oxidative trimming processes resulted in carboxylate end groups that were readily functionalized at the entrance to each CNT inner core. Membranes with CNT tips that were functionalized with biotin showed a reduction in Ru(NH3)6(3+) flux by a factor of 15 when bound with streptavidin, thereby demonstrating the ability to gate molecular transport through CNT cores for potential applications in chemical separations and sensing."
https://openalex.org/W2029388127,"The conserved histone variant H2AZ has an important role in the regulation of gene expression and the establishment of a buffer to the spread of silent heterochromatin. How histone variants such as H2AZ are incorporated into nucleosomes has been obscure. We have found that Swr1, a Swi2/Snf2-related adenosine triphosphatase, is the catalytic core of a multisubunit, histone-variant exchanger that efficiently replaces conventional histone H2A with histone H2AZ in nucleosome arrays. Swr1 is required for the deposition of histone H2AZ at specific chromosome locations in vivo, and Swr1 and H2AZ commonly regulate a subset of yeast genes. These findings define a previously unknown role for the adenosine triphosphate-dependent chromatin remodeling machinery."
https://openalex.org/W1983534546,"Twentieth-century water policies relied on the construction of massive infrastructure in the form of dams, aqueducts, pipelines, and complex centralized treatment plants to meet human demands. These facilities brought tremendous benefits to billions of people, but they also had serious and often unanticipated social, economical, and ecological costs. Many unsolved water problems remain, and past approaches no longer seem sufficient. A transition is under way to a ""soft path"" that complements centralized physical infrastructure with lower cost community-scale systems, decentralized and open decision-making, water markets and equitable pricing, application of efficient technology, and environmental protection."
https://openalex.org/W2093355627,"A hallmark of aging is diminished regenerative potential of tissues, but the mechanism of this decline is unknown. Analysis of injured muscle revealed that, with age, resident precursor cells (satellite cells) had a markedly impaired propensity to proliferate and to produce myoblasts necessary for muscle regeneration. This was due to insufficient up-regulation of the Notch ligand Delta and, thus, diminished activation of Notch in aged, regenerating muscle. Inhibition of Notch impaired regeneration of young muscle, whereas forced activation of Notch restored regenerative potential to old muscle. Thus, Notch signaling is a key determinant of muscle regenerative potential that declines with age."
https://openalex.org/W1989797392,"Vancomycin is usually reserved for treatment of serious infections, including those caused by multidrug-resistant Staphylococcus aureus. A clinical isolate of S. aureus with high-level resistance to vancomycin (minimal inhibitory concentration = 1024 microg/ml) was isolated in June 2002. This isolate harbored a 57.9-kilobase multiresistance conjugative plasmid within which Tn1546 (vanA) was integrated. Additional elements on the plasmid encoded resistance to trimethoprim (dfrA), beta-lactams (blaZ), aminoglycosides (aacA-aphD), and disinfectants (qacC). Genetic analyses suggest that the long-anticipated transfer of vancomycin resistance to a methicillin-resistant S. aureus occurred in vivo by interspecies transfer of Tn1546 from a co-isolate of Enterococcus faecalis."
https://openalex.org/W2006450841,"In order to address the economic and environmental consequences of our global energy system, we consider the availability and consumption of energy resources. Problems arise from our dependence on combustible fuels, the environmental risks associated with their extraction, and the environmental damage caused by their emissions. Yet no primary energy source, be it renewable or nonrenewable, is free of environmental or economic limitations. As developed and developing economies continue to grow, conversion to and adoption of environmentally benign energy technology will depend on political and economic realities."
https://openalex.org/W2112187505,"Models project that land ecosystems may be able take up a considerable proportion of the carbon dioxide released by human activities, thereby counteracting the anthropogenic emissions. In their Perspective,
 Hungate
 et al .
 argue that these carbon uptake estimates are too high because the models do not take other nutrients such as nitrogen into account appropriately. The authors estimate that there will not be enough nitrogen available to sustain the high carbon uptake scenarios. Nutrients other than nitrogen may also affect carbon uptake in ways not captured by most models."
https://openalex.org/W2111622673,"Subfemtosecond light pulses can be obtained by superposing several high harmonics of an intense laser pulse. Provided that the harmonics are emitted simultaneously, increasing their number should result in shorter pulses. However, we found that the high harmonics were not synchronized on an attosecond time scale, thus setting a lower limit to the achievable x-ray pulse duration. We showed that the synchronization could be improved considerably by controlling the underlying ultrafast electron dynamics, to provide pulses of 130 attoseconds in duration. We discuss the possibility of achieving even shorter pulses, which would allow us to track fast electron processes in matter."
https://openalex.org/W2145429486,"Fishes moving through turbulent flows or in formation are regularly exposed to vortices. Although animals living in fluid environments commonly capture energy from vortices, experimental data on the hydrodynamics and neural control of interactions between fish and vortices are lacking. We used quantitative flow visualization and electromyography to show that trout will adopt a novel mode of locomotion to slalom in between experimentally generated vortices by activating only their anterior axial muscles. Reduced muscle activity during vortex exploitation compared with the activity of fishes engaged in undulatory swimming suggests a decrease in the cost of locomotion and provides a mechanism to understand the patterns of fish distributions in schools and riverine environments."
https://openalex.org/W2152074508,"The net ecosystem exchange of carbon dioxide was measured by eddy covariance methods for 3 years in two old-growth forest sites near Santarém, Brazil. Carbon was lost in the wet season and gained in the dry season, which was opposite to the seasonal cycles of both tree growth and model predictions. The 3-year average carbon loss was 1.3 (confidence interval: 0.0 to 2.0) megagrams of carbon per hectare per year. Biometric observations confirmed the net loss but imply that it is a transient effect of recent disturbance superimposed on long-term balance. Given that episodic disturbances are characteristic of old-growth forests, it is likely that carbon sequestration is lower than has been inferred from recent eddy covariance studies at undisturbed sites."
https://openalex.org/W2008479246,"If molecular components are to be used as functional elements in place of the semiconductor-based devices present in conventional microcircuitry, they must compete with semiconductors under the extreme conditions required for processing and operating a practical device. Herein, we demonstrate that porphyrin-based molecules bound to Si(100), which exhibit redox behavior useful for information storage, can meet this challenge. These molecular media in an inert atmosphere are stable under extremes of temperature (400°C) for extended periods (approaching 1 hour) and do not degrade under large numbers of read-write cycles (10 12 )."
https://openalex.org/W2039930764,"Cells undergoing apoptosis during development are removed by phagocytes, but the underlying mechanisms of this process are not fully understood. Phagocytes lacking the phosphatidylserine receptor (PSR) were defective in removing apoptotic cells. Consequently, in PSR-deficient mice, dead cells accumulated in the lung and brain, causing abnormal development and leading to neonatal lethality. A fraction of PSR knockout mice manifested a hyperplasic brain phenotype resembling that of mice deficient in the cell death-associated genes encoding Apaf-1, caspase-3, and caspase-9, which suggests that phagocytes may also be involved in promoting apoptosis. These data demonstrate a critical role for PSR in early stages of mammalian organogenesis and suggest that this receptor may be involved in respiratory distress syndromes and congenital brain malformations."
https://openalex.org/W2078255466,"The early genetic pathway(s) triggering the pathogenesis of coronary artery disease (CAD) and myocardial infarction (MI) remain largely unknown. Here, we describe an autosomal dominant form of CAD/MI ( adCAD1 ) that is caused by the deletion of seven amino acids in transcription factor MEF2A. The deletion disrupts nuclear localization of MEF2A, reduces MEF2A-mediated transcription activation, and abolishes synergistic activation by MEF2A and by the transcription factor GATA-1 through a dominant-negative mechanism. The MEF2A protein demonstrates strong expression in the endothelium of coronary arteries. These results identify a pathogenic gene for a familial vascular disease with features of CAD and implicate the MEF2A signaling pathway in the pathogenesis of CAD/MI."
