id,abstract
https://openalex.org/W2095813743,"In order to characterize the heterogeneity and expression of maize zein genes, we constructed and characterized a cDNA library of endosperm mRNAs. Clones from the library that were of sufficient size to be full-length or near full-length copies of zein mRNA were characterized by restriction enzyme mapping and cross-hybridization analysis. Based on these comparisons we found three classes of zein sequences corresponding to proteins of Mr 22,000, five corresponding to proteins of Mr 19,000, and a single one corresponding to a protein of Mr 15,000. Representative clones from these nine groups were used as probes to measure levels of the corresponding mRNAs in developing endosperms. It was found that these groups represent varying amounts of transcripts that range from 2 to 20% of the total endosperm mRNA population. For the Mr 19,000 and Mr 22,000 zein clones there is a correlation between the amount of mRNAs and the apparent number of genes in the genome. The relative level of mRNA for the Mr 15,000 zein was found to be 3 times that of the Mr 22,000 and Mr 19,000 zeins, suggesting that these genes are transcribed at a higher rate during endosperm development or that their mRNAs are more stable."
https://openalex.org/W1519916343,"5-Methyltryptamine, through a GTP-dependent mechanism, stimulated breakdown of endogenous [3H]inositol-labeled phosphoinositides in membranes prepared from blowfly salivary gland homogenates through a phospholipase C exhibiting a pH optimum of approximately 7.0. Unlabeled membranes, prepared from salivary gland homogenates, hydrolyzed exogenous [3H]phosphatidylinositol 4,5-bisphosphate substrate with generation of labeled inositol phosphates. Inositol trisphosphate formation was increased approximately 200% by 10 microM guanosine 5'-(O-thio)-trisphosphate (GTP gamma S) within 30 s. 5-Methyltryptamine, in the presence of 10 microM GTP gamma S, increased the rate of inositol trisphosphate formation by approximately 500% within 30 s. Half-maximal activation of hormone-stimulated breakdown of exogenous substrate required approximately 0.05 microM GTP gamma S. [3H]Phosphatidylinositol was also hydrolyzed during incubation with membranes, resulting in the generation of inositol, glycerol phosphoinositol, and inositol monophosphate. Formation of inositol monophosphate was stimulated approximately 30% by 10 microM GTP gamma S and 10 microM 5-methyltryptamine. Neither inositol nor glycerol phosphoinositol formation was affected by hormone. These results indicate that in a cell-free system from blowfly salivary glands, 5-methyltryptamine, through a GTP-dependent mechanism, directly activates a phospholipase C which mediates phosphoinositide hydrolysis."
https://openalex.org/W1566548239,"Poly(A)-RNAs were prepared from livers of rats treated with hydrocortisone and cycloheximide, then enriched for large mRNAs by successive sucrose gradients and gel electrophoresis. The size-selected RNAs were used as templates for synthesis of double-stranded cDNAs that were cloned in Escherichia coli using the pBR322 plasmid vector. Recombinant plasmids characterized as carrying inserts of potential interest were further analyzed by differential hybridization to mRNAs from untreated and hydrocortisone-treated rats. Seven of the cloned cDNAs were identified as complementary to mRNAs whose content in liver is sensitive to modulation by the steroid. Further screening for hormonal responsiveness revealed that two of the cloned cDNAs hybridize to a 3.4-kilobase mRNA that is rapidly induced in liver by treatment with insulin or cAMP as well as by hydrocortisone; restriction enzyme analysis demonstrated that the cDNAs from these two clones are derived from the same mRNA. In isolated nuclei, the rate of transcription of this mRNA is increased by each of the inducing hormones. This unusually regulated mRNA codes for a protein of 53 kDa on denaturing gels, undergoes rapid intracellular degradation that is prevented by cycloheximide, and appears to be the product of a single copy gene."
https://openalex.org/W1577707457,"The GlcNAc-1-P transferase was solubilized from pig aorta microsomal fractions using 0.5% Nonidet P-40. The activity of the solubilized enzyme was stimulated by exogeneously added phospholipids in the order phosphatidylglycerol greater than phosphatidylinositol greater than phosphatidylserine. When the enzyme was stored in 20% glycerol containing 20 micrograms of phosphatidylglycerol/mg of protein, more than 80% of the activity remained after storage for 6 days at 0-4 degrees C. On the other hand, in the absence of the stabilizers, the enzyme lost most of its activity within 24 h. The transferase was purified about 68-fold using ammonium sulfate and DEAE-cellulose fractionation. The DEAE-cellulose chromatography separated a heat-stable factor from the enzyme, which when added back to the partially purified enzyme stimulated about 5-fold. With this partially purified enzyme, the Km for UDP-GlcNAc was found to be 1 X 10(-7) M, and that for dolichyl-P about 1 X 10(-6) M. The stimulatory factor increased the Vmax for both UDP-GlcNAc and dolichyl-P 5-10-fold, but the Km values remained the same. The pH optimum for the enzyme was between 7.4 and 7.6, and either Mn2+ (1 mM) or Mg2+ (10 mM) was required for optimum activity. The GlcNAc-1-P transferase was also stimulated by the addition of GDP-mannose (or other purine sugar nucleotides) or dolichyl-phosphoryl-mannose to the incubation mixtures. These two compounds acted in different ways on the enzyme since their stimulatory effects were additive. The effect of GDP-mannose was found to be due to protection of the substrate, UDP-GlcNAc, from degradation, but the effect of dolichyl-P-mannose remains to be established. In addition, the stimulations shown by phosphatidylglycerol, GDP-mannose, and factor, or phosphatidylglycerol, dolichyl-P-mannose, and factor, were all additive, indicating that they were acting at different sites on the enzyme. The transferase was quite sensitive to the action of sulfhydryl reagents such as N-ethylmaleimide or p-chloromercuribenzene sulfonate, and was rapidly inactivated in their presence. The enzyme could be protected to the extent of about 50% when all of the substrates (UDP-GlcNAc, dolichyl-P, Mn2+) were added before the addition of the sulfhydryl reagents."
https://openalex.org/W1516056004,"It is generally thought that formation of inositol 1,2-cyclic phosphate (IcP) on agonist-stimulated of endogenous phosphatidylinositol in intact cells would provide strong evidence for the direct phosphodiesteratic cleavage of phosphatidylinositol. We report here that on ionophoresis of extracts of pancreatic minilobules incubated with the cholecystokinin/pancreozymin congener, caerulein, the usual inositol phosphates, i.e. inositol 1-phosphate (IP), inositol 4,5-bisphosphate (IP2), and inositol 1,4,5-trisphosphate (IP3) were seen. In addition, an [3H]inositol-labeled unknown was present with the correct electrophoretic mobility of IcP. There was only a trace of in the unstimulated pancreatic minilobules. Several lines of evidence indicate that the unknown peak was IcP. 1) It ran on ionophoresis with standard [14C]IcP, and the ratio of 3H to 14C for each point on the peak was a constant within experimental error. 2) The putative IcP peak which had been eluted from the electropherogram also coincided with standard [14C]IcP on paper chromatography. 3) On mild acid hydrolysis in the presence of standard 14C-labeled IP, the putative [3H] IcP peak disappeared and appeared in the exact position of the standard [14C]IP peak, as to be predicted of IcP. The formation of IcP on agonist stimulation supports direct phosphodiesteratic cleavage of phosphatidylinositol on stimulation of phosphoinositide breakdown in pancreatic minilobules."
https://openalex.org/W1523502597,"Diethylstilbestrol is carcinogenic in rodents and in humans and its peroxidatic oxidation in utero has been associated with its carcinogenic activity. Horseradish peroxidase-catalyzed oxidation of [14C]diethylstilbestrol and [14C]diethylstilbestrol analogs induced binding of radiolabel to DNA only when the compound contained a free hydroxy group (Metzler, M., and Epe, B. (1984) Chem. Biol. Interact. 50, 351-360). We have found that horseradish peroxidase or prostaglandin-H synthase-catalyzed oxidation of diethylstilbestrol in the presence of the spin trap 5,5-dimethyl-1-pyrroline-N-oxide caused the generation of an ESR signal indicative of a free radical intermediate (aN = 14.9 G, aH = 18.3 G). The identity of the trapped radical could not be identified on the basis of published hyperfine coupling constants, but the observation that horseradish peroxidase-catalyzed oxidation of 1-naphthol produced an identical ESR signal suggests that the radical was either a phenoxy or phenoxy-derived radical. During horseradish peroxidase-catalyzed oxidation of diethylstilbestrol in the presence of glutathione the thiol reduced the diethylstilbestrol radical to generate a thiyl radical. This was shown by a thiol-dependent oxygen uptake during horseradish peroxidase-catalyzed oxidation of diethylstilbestrol and the observation of an ESR signal consistent with 5,5-dimethylpyrroline-N-oxide-glutathionyl radical adduct formation. A diethylstilbestrol analog devoid of free hydroxy groups, namely diethylstilbestrol dipropionate, did not produce an ESR signal above control levels during horseradish peroxidase-catalyzed metabolism in the presence of 5,5-dimethylpyrroline-N-oxide. Thus, free radicals are formed during peroxidatic oxidation of diethylstilbestrol and must be considered as possible determinants of the genotoxic activity of this compound."
https://openalex.org/W1501848752,"We have studied the effects of tunicamycin and inhibitors of the processing of N-linked glycans including N-methyl-1-deoxynojirimycin, castanospermine, mannodeoxynojirimycin, and swainsonine on the transport of glycoprotein E2 and the intracellular maturation of the coronavirus mouse hepatitis virus A59. Indirect immunofluorescence staining with monoclonal antibodies revealed that glycoprotein E2 exhibits different antigenic properties depending on the presence and on the structure of the N-linked oligosaccharides and that efficient transport of glycoprotein E2 to the plasma membrane requires the removal of glucose residues. In the presence of tunicamycin in the nonglycosylated E2 apoprotein was synthesized in normal amounts and readily acylated throughout the infectious cycle. This E2-species could not be detected on the surface of mouse hepatitis virus A59-infected cells with indirect immunofluorescence staining or lactoperoxidase labeling. N-Methyl-1-deoxynojirimycin and castanospermine, both of which selectively inhibited the processing glucosidases, caused a drop in virion formation by two log steps and a drastic delay in the surface expression of glycoprotein E2. The E2 species synthesized under such conditions was acylated but accumulated intracellularly in a compartment distinct from the Golgi. Concomitantly, synthesis of the matrix glycoprotein E1 of mouse hepatitis virus A59 was drastically impaired. Mannodeoxynojirimycin and swainsonine, which block later stages of the processing pathway, had less or no effect on the transport of glycoprotein E2 and the formation of virus particles."
https://openalex.org/W1524235451,"Abstract We report here the isolation and characterization of cDNA and genomic sequences corresponding to a rat embryonic myosin heavy chain (MHC) protein. This gene, which is present as a single copy in the rat genome, comprises about 25 kilobase pairs of DNA and contains approximately 80% intronic sequences. The embryonic MHC gene belongs to a highly conserved multigene family, and exhibits a high degree of nucleotide and amino acid sequence conservation with other sarcomeric MHC genes from nematode to man. S1 nuclease mapping experiments using cDNA and genomic probes show that this MHC gene is transiently expressed during skeletal muscle development. Its mRNA is detected in fetal skeletal muscle during early development and persists up to 2 weeks after birth with the overlapping expression of neonatal and adult skeletal MHC mRNAs. However, this MHC is not expressed in the adult skeletal muscle with the exception of extraocular muscle fibers. The transient expression during muscle development of the isoform produced by this gene and its sequential replacement by other MHCs raises interesting questions about the mechanism controlling MHC isozyme transitions and the physiological significance of the individual MHCs in muscle fibers."
https://openalex.org/W1537679007,"The intermediate lobe of the pituitary contains the alpha-amidated peptide alpha-melanotropin and high levels of a copper and ascorbate-dependent peptidylglycine alpha-amidating monooxygenase (PAM) capable of converting peptides terminating in -X-Gly into amidated products (-X-NH2). As reported previously, the ability of cultured intermediate pituitary cells to produce alpha-amidated alpha-melanotropin declined rapidly. A decline in PAM activity assayed in vitro under optimized conditions failed to account quantitatively for the lack of production of alpha-amidated product, while a 100-fold decline in cellular levels of ascorbate could account for the lack of production of alpha-amidated product. Incubation of intermediate pituitary cultures with ascorbate partially restored the ability of the cells to produce alpha-amidated product without significantly increasing the level of PAM activity. In intermediate pituitary cultures made competent to produce alpha-melanotropin by addition of ascorbate, the actual extent of amidation occurring was modulated by the presence of specific secretagogues (bromocriptine or corticotropin-releasing factor). Cultured anterior pituitary cells showed a similar rapid 3-fold decline in PAM activity assayed in vitro under optimized conditions. Cellular levels of ascorbate also declined rapidly to levels 100-fold below those in the intact anterior pituitary. The addition of ascorbate to the anterior pituitary cultures rapidly restored the enzyme activity assayed in vitro to the levels in the initial cell suspension. Thus, production of amidated product peptide may be regulated by cellular levels of ascorbate, by cellular levels of PAM activity, and by the concentration of specific secretagogues to which the cells are exposed."
https://openalex.org/W1535427934,"Abstract The nucleotide sequence of 6225 base pairs (bp) of Euglena gracilis chloroplast DNA including the complete DNA sequence of the chloroplast-encoded ribulose-1,5-bisphosphate carboxylase large subunit gene along with the flanking DNA sequences is presented. The gene is greater than 5.5 kilobase pairs in length and is organized as 10 exons coding for 475 amino acids, separated by 9 introns. The exons range in size from 45 to 438 bp, while the introns range in size from 382 to 568 bp. The introns have highly conserved boundary sequences with the consensus, 5'-N GTGTGGATTT...(intron)...TTAATTTTAT N-3'. The introns are 82-85 mol% AT, with a pronounced T greater than A greater than G greater than C base bias in the RNA-like strand. They do not appear to encode any polypeptides. In addition, the introns have a conserved sequence 30-50 bp from their 3'-ends with the consensus, 5'-TACAGTTTGAAAATGA-3'. The 5'-TACA sequence bears some homology to the 5'-end of the TACTAACA sequence found in a similar location in yeast nuclear mRNA introns. The conserved sequences of the Euglena rbcL introns may be indicative of a splicing mechanism similar to that of eucaryotic nuclear mRNA introns and group II mitochondrial introns."
https://openalex.org/W1484047582,"Pantothenate kinase (ATP:D-pantothenate 4'-phosphotransferase, EC 2.7.1.33), the first enzyme in the pathway of CoA synthesis, was partially purified from rat heart. A study of the properties of the kinase showed that it possesses a broad pH optimum between 6 and 9, is activated or inhibited nonspecifically by various anions, and has MgATP as the nucleotide substrate. The Km for MgATP is 0.6 mM and that for pantothenate is 18 microM. CoA and acyl esters of CoA are inhibitors of the kinase with the inhibition by acetyl-CoA being only slightly greater than that by free CoA. The inhibition by free CoA is uncompetitive with respect to pantothenate concentration, with a Ki for inhibition of 0.2 microM. L-Carnitine was found to be a nonessential activator of the kinase. This compound had no effect by itself but specifically reversed the inhibition of the kinase by CoA. The Ka for deinhibition by L-carnitine is 0.27 mM. Free carnitine content was measured in perfused hearts and is found to vary in correlation with perfusion conditions that are known to alter rates of intracellular phosphorylation of pantothenate. These properties of pantothenate kinase provide a potential mechanism for the control of CoA synthesis. The enzyme is regulated by feedback inhibition by CoA and its acyl esters and this inhibition is modified by changes in the concentration of free carnitine."
https://openalex.org/W2431638578,"The enzymes responsible for the phosphorylation of deoxyadenosine and nucleoside analogs are important in the pathogenesis of adenosine deaminase deficiency and in the activation of specific anticancer and antiviral drugs. We examined the role of adenosine kinase in catalyzing these reactions using an enzyme purified 4000-fold (2.1 mumol/min/mg) from human placenta. The Km values of deoxyadenosine and ATP are 135 and 4 microM, respectively. Potassium and magnesium are absolute requirements for deoxyadenosine phosphorylation, and 150 mM potassium and 5 mM MgCl2 are critical for linear kinetics. With only 0.4 mM MgCl2 in excess of ATP levels, the Km for deoxyadenosine is increased 10-fold. ADP is a competitive inhibitor with a Ki of 13 microM with variable MgATP2-, while it is a mixed inhibitor with a Ki and Ki' of 600 and 92 microM, respectively, when deoxyadenosine is variable. AMP is a mixed inhibitor with Ki and Ki' of 177 and 15 microM, respectively, with variable deoxyadenosine; it is a non-competitive inhibitor with a Ki of 17 microM and Ki' of 27 microM with variable ATP. Adenosine kinase phosphorylates adenine arabinoside with an apparent Km of 1 mM using deoxyadenosine kinase assay conditions. The Km values for 6-methylmercaptopurine riboside and 5-iodotubercidin, substrates for adenosine kinase, are estimated to be 4.5 microM and 2.6 nM, respectively. Other nucleoside analogs are potent inhibitors of deoxyadenosine phosphorylation, but their status as substrates remains unknown. These data indicate that deoxyadenosine phosphorylation by adenosine kinase is primarily regulated by its Km and the concentrations of Mg2+, ADP, and AMP. The high Km values for phosphorylation of deoxyadenosine and adenine arabinoside suggest that adenosine kinase may be less likely to phosphorylate these nucleosides in vivo than other enzymes with lower Km values. Adenosine kinase appears to be important for adenosine analog phosphorylation where the Michaelis constant is in the low micromolar range."
https://openalex.org/W1482416066,"A study has been made of the products of a reaction of oxidized ribonucleotides with a primary amine. As a model reaction, periodate-oxidized adenosine was combined with glycine in the presence of NaCNBH3. The purified major product of this reaction, adenine 9,2'-(4'-carboxymethyl-6'-hydroxymethylmorpholine), was characterized by 13C and 1H NMR spectroscopy, ultraviolet spectroscopy, and thin layer chromatography. When used to generate affinity columns, oxidized adenosine or oxidized ATP formed stable products with immobilized diaminohexane when treated with NaCNBH3. Failure to treat with NaCNBH3 yielded an unstable affinity matrix. These results are used in the interpretation of differing results when oxidized nucleotides have been used as affinity labels for different proteins."
https://openalex.org/W1494902244,"A monoclonal antibody capable of inhibiting opioid binding to rat neural membranes has been produced. Spleen cells from a BALB/c mouse, immunized with a partially purified opioid receptor complex, were fused with P3-X63.Ag8.653.3 myeloma cells. The cell line OR-689.2.4 secreted an IgM that was capable of partially inhibiting opioid binding to rat neural membranes under equilibrium binding conditions, while not affecting the binding of nonopioid ligands. Control mouse immunoglobulins and heat-denatured OR-689.2.4 did not inhibit opioid binding to membranes. The purified immunoglobulin inhibited the binding of [3H]dihydromorphine in a titrable, saturable, and reversible manner, as well as the binding of the delta-ligand [3H][D-Ala2,D-Leu5]enkephalin, the kappa-ligand [3H] ethylketocyclazocine, and 3H-labeled antagonists. In addition to blocking the binding of opioids to membranes, the immunoglobulin could also displace bound [3H]dihydromorphine from neural membranes. The 125I-labeled immunoglobulin specifically bound to neural membranes with a Kd of 1.3 nM and a maximal number of binding sites of 41.8 fmol/0.25 mg of membrane protein. In a titrable manner, the immunoglobulin precipitated opioid binding sites from a solubilized preparation of neural membranes. When OR-689.2.4 conjugated to Sepharose was incubated with the partially purified opioid receptor complex, labeled with 125I, a 35,000-dalton protein was specifically bound by the immunoglobulin. This antibody provides a tool for probing the multiple opioid binding sites."
https://openalex.org/W1547248378,"The catecholamine derivatives aminomenthylnorepinephrine (compound 1) and bromoacetylaminomenthylnorepinephrine (compound 2) were synthesized and their interaction with the rat lung beta-adrenoreceptor was characterized. Compared to (-)-isoproterenol, compounds 1 and 2 were 10 and 280 times less potent, respectively, at inhibiting (-)-[3H]dihydroalprenolol binding. At pH 7.4, all 3 compounds induced a loss of receptors (40-60%) which could be recovered by treatment with guanyl-5'-yl imidodiphosphate (Gpp(NH)p). However, at pH 8.1 Gpp(NH)p treatment did not recover those receptors lost by compound 2 only. The compound 2-induced receptor loss at pH 8.1 was time-dependent, prevented by propranolol but unaffected by Gpp(NH)p or after membrane heating at 50 degrees C which prevented the formation of the agonist high affinity binding state. Although, the maximal receptor loss as measured by [3H]dihydroalprenolol was 40-60%, more than 80% of the receptors were lost when measured by direct agonist binding, and the receptors left showed little agonist high affinity binding state formation. In rat reticulocyte membranes, compounds 1 and 2 stimulated adenylate cyclase activity with intrinsic activities of 0.55 and 0.31, respectively. However, at pH 8.1, compound 2 initially stimulated the enzyme followed by a blockade. These data indicated that both compounds 1 and 2 were partial beta-adrenoreceptor agonists and, at pH 8.1, compound 2 appeared to bind irreversibly only to those lung receptors able to form the agonist high affinity binding state. Furthermore, after irreversible binding, compound 2 appeared to act as an antagonist."
https://openalex.org/W1544222254,"Mouse 3T3 cells transformed by a conditional mutant of Rous sarcoma virus (LA90) can assume either a normal or a transformed phenotype, depending on the temperature of cultivation. These cells (LA90) were arrested at the G0/G1 phase of the cell cycle by starvation for serum growth factors at the nonpermissive temperature (39 degrees C). Release from the G0/G1 phase by serum growth factors resulted in a rapid stimulation of Rb+ influx. To investigate whether the stimulation of Rb+ influx is obligatory for cell proliferation, the cultures were released from the G0/G1 phase by a temperature decrease in the absence of serum. A temperature decrease from 39 to 32 degrees C activated the viral pp60src gene mitogenic activity. Under these conditions, no rapid stimulation of Rb+ influx was observed. These results suggest that the rapid stimulation of Rb+ influx induced by serum growth factors is not an essential signal for cell release from the G0/G1 phase. However, a delayed increase in Rb+ influx concomitant with an increase in the cell content of K+ was observed in the cultures released from the G0/G1 phase by temperature decrease in the absence of serum growth factors. We found that the LA90 cells incubated at the permissive temperature (32 degrees C) secreted a mitogenic activity into the medium. Moreover, the conditioned medium from cultures incubated at 32 degrees C, but not at 39 degrees C, stimulate Rb+ influx in G0/G1 cells. These results indicate that Rous sarcoma virus pp60src induces a slow autocrine secretion of a mitogenic activity. This mitogenic activity slowly modulates the K+ content. Therefore, the slow elevation in cellular content of K+ is proposed to be an obligatory event for proliferation in normal and transformed cells."
