id,abstract
https://openalex.org/W2917222032,"Ethiopia’s average life expectancy has improved by more than 18 years from 1990 to 2015. This initiated interest to study the gain in life expectancy with respect to age structure and cause of death. Applying a life expectancy decomposition technique on secondary data obtained from the Institute of Health Metrics and Evaluation, the study found that the burden of disease in Ethiopia has declined from 626.18 in 1990 to 225.69 in 2015 per 1000 population measured in age-standardized rate of life years lost. The major causes of burden in 1990; namely lower respiratory tract infections, neonatal disorders, diarrheal diseases and neglected tropical diseases at rates of 89.2, 63.2, 61.2, and 42.2 age-standardized years of life lost per 1000 population respectively; have shown a fast decline in 2015. Deaths from neglected tropical disease showed 94.95% reduction, contributing to 5.71(27.30%) years gain in life expectancy followed by lower respiratory tract infection and diarrheal disease contributing about 4.65 years (22.23%) and 1.48 years (7.10%) respectively. On the other hand, about 3.3 (15.73%) years and 6.4 (30.71%) years of increase in life expectancy are achieved through improved longevity in infants and children aged 1–4 years respectively. In conclusion, the study found that reductions in under-five child mortality and decline in burden of major communicable diseases could explain the major gain in life expectancy. However, findings also revealed that the prevalence of non-communicable diseases and injuries are on the rise calling for the need to be addressed by the public health system."
https://openalex.org/W2894621797,"Neuroscience investigations are most often focused on the prediction of future perception or decisions based on prior brain states or stimulus presentations. However, the brain can also process information retroactively, such that later stimuli impact conscious percepts of the stimuli that have already occurred (called “postdiction”). Postdictive effects have thus far been mostly unimodal (such as apparent motion), and the models for postdiction have accordingly been limited to early sensory regions of one modality. We have discovered two related multimodal illusions in which audition instigates postdictive changes in visual perception. In the first illusion (called the “Illusory Audiovisual Rabbit”), the location of an illusory flash is influenced by an auditory beep-flash pair that follows the perceived illusory flash. In the second illusion (called the “Invisible Audiovisual Rabbit”), a beep-flash pair following a real flash suppresses the perception of the earlier flash. Thus, we showed experimentally that these two effects are influenced significantly by postdiction. The audiovisual rabbit illusions indicate that postdiction can bridge the senses, uncovering a relatively-neglected yet critical type of neural processing underlying perceptual awareness. Furthermore, these two new illusions broaden the Double Flash Illusion, in which a single real flash is doubled by two sounds. Whereas the double flash indicated that audition can create an illusory flash, these rabbit illusions expand audition’s influence on vision to the suppression of a real flash and the relocation of an illusory flash. These new additions to auditory-visual interactions indicate a spatio-temporally fine-tuned coupling of the senses to generate perception."
https://openalex.org/W2894677813,"African American women in the state of Arkansas have high breast cancer mortality rates. Breast cancer risk assessment tools developed for African American underestimate breast cancer risk. Combining African American breast cancer associated single-nucleotide polymorphisms (SNPs) into breast cancer risk algorithms may improve individualized estimates of a woman’s risk of developing breast cancer and enable improved recommendation of screening and chemoprevention for women at high risk. The goal of this study was to confirm with an independent dataset consisting of Arkansas women of color, whether a genetic risk score derived from common breast cancer susceptibility SNPs can be combined with a clinical risk estimate provided by the Breast Cancer Risk Assessment Tool (BCRAT) to produce a more accurate individualized breast cancer risk estimate. A population-based cohort of African American women representative of Arkansas consisted of 319 cases and 559 controls for this study. Five-year and lifetime risks from the BCRAT were measured and combined with a risk score based on 75 independent susceptibility SNPs in African American women. We used the odds ratio (OR) per adjusted standard deviation to evaluate the improvement in risk estimates produced by combining the polygenic risk score (PRS) with 5-year and lifetime risk scores estimated using BCRAT. For 5-year risk OR per standard deviation increased from 1.84 to 2.08 with the addition of the polygenic risk score and from 1.79 to 2.07 for the lifetime risk score. Reclassification analysis indicated that 13% of cases had their 5-year risk increased above the 1.66% guideline threshold (NRI = 0.020 (95% CI -0.040, 0.080)) and 6.3% of cases had their lifetime risk increased above the 20% guideline threshold by the addition of the polygenic risk score (NRI = 0.034 (95% CI 0.000, 0.070)). Our data confirmed that discriminatory accuracy of BCRAT is improved for African American women in Arkansas with the inclusion of specific SNP breast cancer risk alleles."
https://openalex.org/W2895044267,"Skulls of 1,901 Eastern Atlantic harbor seals (Phoca vitulina vitulina) were systematically studied for externally visible dental anomalies and lesions. The sample comprised 927 males and 974 female individuals, with age at death ranging between 1 week and 25 years. Most of the skulls originated from animals collected in 1988, when the population suffered from a mass mortality event caused by the phocine distemper virus (PDV). Mean age (± SD) of females (6.7 ± 6.4 years) was higher (p = 0.002) than that of males (5.9 ± 5.2 years). In 264 individuals, one or more teeth were missing either congenitally (n = 26 animals, 1.4%) or due to intravital loss (n = 238 animals, 12.5%). One male exhibited congenital absence of all teeth (anodontia). As this animal had been reported to be almost hairless, the condition was tentatively diagnosed as a case of hypohidrotic ectodermal dysplasia. Males were more frequently (p = 0.002) affected by intravital tooth loss (15.0%) than females (10.2%). Supernumerary teeth were found in 3.4% of the skulls, with females (4.7%) showing hyperodontia more frequently (p < 0.001) than males (1.9%). Fifty-nine individuals (3.1%; 28 males, 31 females, p = 0.84) exhibited abnormal tooth morphology. Tooth fractures were noted in 40 seals (2.1%), with males being more frequently affected than females (p = 0.017). Periapical lesions were diagnosed in 143 skulls, with a tendency (p = 0.05) for males (8.7%) to be more frequently affected than females (6.4%). Enamel hypoplasia was not observed in the study sample. Analyzing the occurrence of dental anomalies and lesions in wild mammals can substantially contribute to an assessment of population health and thereby broaden the basis for effective species conservation and informed management decisions."
https://openalex.org/W2895065665,"Systemic inflammation is potentially associated with ocular diseases such as late age-related macular degeneration (AMD). Using the serum concentration of high-sensitive C-reactive protein (hs-CRP) as surrogate of systemic inflammation, we examined potential associations between the serum hs-CRP concentration and the presence and degree of eye diseases.The population-based Beijing Eye Study included 3468 Chinese individuals. The study participants underwent a standardized interview and a detailed ophthalmic examination. The serum concentration of hs-CRP was determined.Out of 3468 participants, 2452 (70.7%) individuals (mean age:63.4±9.4 year; range:50-91 years) had hs-CRP measurements (mean:1.96±4.07mg/L). In multivariate analysis, higher serum concentration of hs-CRP was significantly (regression coefficient r: 0.21) associated with a higher level of diabetic retinopathy (P = 0.007; standardized regression coefficient beta:0.06; non-standardized regression coefficient B:1.35; 95% confidence interval (CI):0.37,2.22) and polypoidal choroidal vasculopathy (P = 0.002;beta:0.06;B:6.22;95%CI:2.24,10.2) after adjusting for higher serum concentration of high-density lipoproteins (P<0.001;beta:-0.12;B:-1.31;95%CI:-1.77,-0.85), higher body mass index (P = 0.01;beta:0.06;B:0.06;95%CI:0.01, 0.11), lower level of education (P = 0.04;beta:-0.06;B:-0.22;95%CI:-0.42,-0.02), lower cognitive function score (P = 0.01;beta:-0.07;B:-0.08;95%CI:-0.13,-0.02). If the presences of other ocular diseases were added to the model, the presence of glaucoma (P = 0.99), open-angle glaucoma (P = 0.80), angle-closure glaucoma (P = 0.67), pseudoexfoliation (P = 0.18), nuclear cataract (P = 0.30), cortical cataract (P = 0.15), subcapsular cataract (P = 0.59), retinal vein occlusions (P = 0.33), central serous choroidopathy (P = 0.44), early stage of age-related macular degeneration (AMD) (P = 0.46), intermediate stage of AMD (P = 0.20) and late stage of AMD (P = 0.91) including geographic atrophy (P = 0.60) or neovascular AMD (P = 0.68) were not significantly associated with the serum concentration of hs-CRP.In Chinese aged 50+ years, higher serum concentration of hs-CRP was significantly associated with a higher level of diabetic retinopathy and higher frequency of polypoidal choroidal vasculopathy. Other major ocular disorders, namely glaucoma including open-angle glaucoma and angle-closure glaucoma, pseudoexfoliation, nuclear, cortical or subcapsular cataract, retinal vein occlusions, central serous choroidopathy, early, intermediate or late stage of AMD including geographic atrophy, were not significantly associated with hs-CRP serum concentrations. It suggests that these diseases, in contrast to diabetic retinopathy and polypoidal choroidal vasculopathy, were not associated with a major systemic inflammatory component."
