id,abstract
https://openalex.org/W2894807127,"Telomeres, the specialized dynamic structures at chromosome ends, regularly shrink with every replication. Thus, they function as an internal molecular clock counting down the number of cell divisions. However, most cancer cells escape this limitation by activating telomerase, which can maintain telomere length. Previous studies showed that the benzylisoquinoline alkaloid chelidonine stimulates multiple modes of cell death and strongly down-regulates telomerase. It is still unknown if down-regulation of telomerase by chelidonine boosts substantial telomere shortening. The breast cancer cell line MCF7 was sequentially treated with very low concentrations of chelidonine over several cell passages. Telomere length and telomerase activity were measured by a monochrome multiplex quantitative PCR and a q-TRAP assay, respectively. Changes in population size and doubling time correlated well with telomerase inhibition and telomere shortening. MCF7 cell growth was arrested completely after three sequential treatments with 0.1 μM chelidonine, each ending after 48 h, while telomere length was reduced to almost 10% of the untreated control. However, treatment with 0.01 μM chelidonine did not have any apparent consequence. In addition to dose and time dependent telomerase inhibition, chelidonine changed the splicing pattern of hTERT towards non-enzyme coding isoforms of the transcript. In conclusion, telomere length and telomere stability are strongly affected by chelidonine in addition to microtubule formation."
https://openalex.org/W2895197396,"Bodies are important social cues for animals. Body recognition in humans is deteriorated by inversion. This inversion effect suggests the configural processing of bodies, which is different from the processing used for other objects. However, it is not known if this type of body processing exists in non-human primates. We tested seven chimpanzees using upright and inverted chimpanzee body stimuli and other stimuli in matching-to-sample tasks to examine the body inversion effect and the body parts that invoke it. Our results reflected the body inversion effect for intact chimpanzee bodies, bodies with complete body contours, and bodies with clear faces but not for the objects and other conditions that did not present complete body contours and clear faces. The results show that chimpanzees share configural body processing with humans and that bodies are special to them compared with other objects. The results also revealed the functions of faces and body contours in configural processing by chimpanzees."
https://openalex.org/W2895541191,"Background Tuberculosis (TB) patients with human immunodeficiency virus (HIV) co-infection have worse TB treatment outcomes compared to patients with TB alone. The distribution of unfavourable treatment outcomes differs by socio-demographic and clinical characteristics, allowing for early identification of patients at risk. Objective To develop a statistical model that can provide individual probabilities of unfavourable outcomes based on demographic and clinical characteristics of TB-HIV co-infected patients. Methodology We used data from all TB patients with known HIV-positive test results (aged ≥15 years) registered for first-line anti-TB treatment (ATT) in 2015 under the Revised National TB Control Programme (RNTCP) in Delhi, India. We included variables on demographics and pre-treatment clinical characteristics routinely recorded and reported to RNTCP and the National AIDS Control Organization. Binomial logistic regression was used to develop a statistical model to estimate probabilities of unfavourable TB treatment outcomes (i.e., death, loss to follow-up, treatment failure, transfer out of program, and a switch to drug-resistant regimen). Results Of 55,260 TB patients registered for ATT in 2015 in Delhi, 928 (2%) had known HIV-positive test results. Of these, 816 (88%) had drug-sensitive TB and were ≥15 years. Among 816 TB-HIV patients included, 157 (19%) had unfavourable TB treatment outcomes. We developed a model for predicting unfavourable outcomes using age, sex, disease classification (pulmonary versus extra-pulmonary), TB treatment category (new or previously treated case), sputum smear grade, known HIV status at TB diagnosis, antiretroviral treatment at TB diagnosis, and CD4 cell count at ATT initiation. The chi-square p-value for model calibration assessed using the Hosmer-Lemeshow test was 0.15. The model discrimination, measured as the area under the receiver operator characteristic (ROC) curve, was 0.78. Conclusion The model had good internal validity, but should be validated with an independent cohort of TB-HIV co-infected patients to assess its performance before clinical or programmatic use."
https://openalex.org/W2894423688,"The Meaning Maintenance Model posits that individuals seek to resolve uncertainty by searching for patterns in the environment, yet little is known about how this is accomplished. Four studies investigated whether uncertainty has an effect on people's cognitive functioning. In particular, we investigated whether meaning threats lead to increased working memory capacity. In each study, we exposed participants to either an uncertain stimulus used to threaten meaning in past studies, or a control stimulus. Participants then completed a working memory measure, where they either had to recall lists of words (Studies 1, 2), or strings of digits (Studies 3, 4). We used both a frequentist approach and Bayesian analysis to evaluate our findings. Across the four studies, we find a small but consistent effect, where participants in the meaning threat condition show improved performance on the working memory tasks. Overall, our findings were consistent with the hypothesis that working memory capacity increases when people experience a meaning threat, which may help to explain improved pattern recognition. Additionally, our results highlight the value of using a Bayesian analytic approach, particularly when studying phenomena with high variance."
https://openalex.org/W2895315763,"RNA viruses replicate with a template-copying fidelity, which lies close to an extinction threshold. Increases of mutation rate by nucleotide analogues can drive viruses towards extinction. This transition is the basis of an antiviral strategy termed lethal mutagenesis. We have introduced a new diversity index, the rare haplotype load (RHL), to describe NS5B (polymerase) mutant spectra of hepatitis C virus (HCV) populations passaged in absence or presence of the mutagenic agents favipiravir or ribavirin. The increase in RHL is more prominent in mutant spectra whose expansions were due to nucleotide analogues than to multiple passages in absence of mutagens. Statistical tests for paired mutagenized versus non-mutagenized samples with 14 diversity indices show that RHL provides consistently the highest standardized effect of mutagenic treatment difference for ribavirin and favipiravir. The results indicate that the enrichment of viral quasispecies in very low frequency minority genomes can serve as a robust marker for lethal mutagenesis. The diagnostic value of RHL from deep sequencing data is relevant to experimental studies on enhanced mutagenesis of viruses, and to pharmacological evaluations of inhibitors suspected to have a mutagenic activity."
https://openalex.org/W2894892278,"To examine trends in the prevalence of wasting, stunting, overweight, and obesity among children in Luoding, a lower-middle-income city in southern China, we collected height, weight and other information on 65,908 pre-school children aged 2 to 7 years from 23 kindergartens, in which health examinations were conducted annually between 2004 and 2013. We used the growth standards of the World Health Organization (WHO) to calculate Z-scores for height and body mass index (BMI), and used the cut-offs recommended by WHO to define wasting, stunting, overweight, and obesity for each child. From 2004 to 2013, the prevalence of overweight increased from 3.70% to 7.27% and of obesity increased from 1.04% to 2.08%. Meanwhile, the prevalence of wasting decreased from 0.91% to 0.72% and of stunting decreased from 9.29% to 5.22%. These trends suggest there was still a double burden of nutritional status there. The nutritional interventions focusing on pre-school children should be comprehensively elaborated in lower-middle-income areas such as Luoding."
https://openalex.org/W2895007818,"Abnormal regulation of caspase-2-mediated neuronal cell death causes neurodegenerative diseases and defective brain development. PIDDosome is caspase-2 activating complex composed of PIDD, RAIDD, and caspase-2. Recent whole-exome sequencing study showed that the RAIDD mutations in the death domain (DD), including G128R, F164C, R170C, and R170H mutations, cause thin lissencephaly (TLIS) by reducing caspase-2-mediated neuronal apoptosis. Given that the molecular structure of the RAIDD DD:PIDD DD complex is available, in this study, we analyzed the molecular mechanisms underlying TLIS caused by the RAIDD TLIS variants by performing mutagenesis and biochemical assays."
https://openalex.org/W2895688273,"Cardiac autonomic neuropathy is a common but always overlooked. More convenient diagnostic methods are needed.Cardiac autonomic neuropathy risk score evaluated by SUDOSCAN has a fine diagnostic efficacy detecting cardiac autonomic neuropathy.This is a cross-sectional study among patients with diabetes mellitus. Subjects undertook SUDOSCAN tests and cardiac autonomic reflex tests, including heart rate variability due to Valsalva maneuver, heart rate response due to deep breathing and heart rate response due to standing up. Presenting 2 abnormal results was defined as cardiac autonomic neuropathy.Subjects with cardiac autonomic neuropathy has significantly higher cardiac autonomic neuropathy risk score (32.88±1.60 vs 27.64±1.24,P = 0.010). Cardiac autonomic neuropathy risk score was correlated significantly with the heart rate response due to deep breathing(P = 0.004). Multiple regression analysis including significant variables showed an independent association of cardiac autonomic neuropathy risk score and heart rate response due to deep breathing (P = 0.031) and age (P = 0.000). In receiver operating characteristic curve analysis evaluating the relationship between cardiac autonomic neuropathy risk score and cardiac autonomic neuropathy, The cut-off value was 20.5, with the sensitivity of 90.48%, the specificity of 29.5%, and the positive predictive value of 46.9%. In two-step diagnostic methods, Setting 20.5 as the cut-off value of cardiac autonomic neuropathy risk score and abnormal heart rate response due to standing up as the second diagnostic step's positive result, and setting 16.5 as the cut-off value of cardiac autonomic neuropathy risk score and abnormal heart rate response due to deep breathing as the second diagnostic step's positive result, both achieved good diagnostic efficacy.Cardiac autonomic neuropathy risk score evaluated by SUDOSCAN is a good screening test for cardiac autonomic neuropathy. The two-step diagnostic methods could be considered as surrogate diagnostic methods."
https://openalex.org/W2895052523,"Cardiac electrophysiological computational models are often developed from previously published models. The new models may incorporate additional features to adapt the model to a different species or may upgrade a specific ionic formulation based on newly available experimental data. A relevant challenge in the development of a new model is the estimation of certain ionic current conductances that cannot be reliably identified from experiments. A common strategy to estimate those conductances is by means of constrained non-linear least-squares optimization. In this work, a novel methodology is proposed for estimation of ionic current conductances of cardiac electrophysiological models by using a response surface approximation-based constrained optimization with trust region management. Polynomial response surfaces of a number of electrophysiological markers were built using statistical sampling methods. These markers included action potential duration (APD), triangulation, diastolic and systolic intracellular calcium concentration, and time constants of APD rate adaptation. The proposed methodology was applied to update the Carro et al. human ventricular action potential model after incorporation of intracellular potassium ([K+]i) dynamics. While the Carro et al. model was well suited for investigation of arrhythmogenesis, it did not allow simulation of [K+]i changes. With the methodology proposed in this study, the updated Carro et al. human ventricular model could be used to simulate [K+]i changes in response to varying extracellular potassium ([K+]o) levels. Additionally, it rendered values of evaluated electrophysiological markers within physiologically plausible ranges. The optimal values of ionic current conductances in the updated model were found in a notably shorter time than with previously proposed methodologies. As a conclusion, the response surface optimization-based approach proposed in this study allows estimating ionic current conductances of cardiac electrophysiological computational models while guaranteeing replication of key electrophysiological features and with an important reduction in computational cost with respect to previously published approaches. The updated Carro et al. model developed in this study is thus suitable for the investigation of arrhythmic risk-related conditions, including those involving large changes in potassium concentration."
https://openalex.org/W2895222534,"The present study was designed to investigate the influence of two distinct small-sided game (SSG) regimes on physiological, perceptual, and technical parameters in male elite lacrosse players.Data were collected in twelve elite male Austrian lacrosse players (25.8 ± 5.5 years; 80.1 ± 7.7 kg; 178.5 ± 6.2 cm). Players' were assigned to an intermittent (SSG-I) or a continuous (SSG-C) SSG regime, respectively. Regimes were equated for total practice time, but not active playing time. SSG data from eight sessions of 3 vs. 3 self-regulated match-play were collected along a 4-week pre-season period. Players' YoYo-Level 1 (YYL1) performance before and after the training intervention was recorded. Further, heart-rate (HR), rating of perceived exertion (RPE), physical activity enjoyment scale (PACES), and technical actions during and after SSG sessions were analyzed.Both SSG regimes showed improvement with medium to very large effect sizes (ES) in YYL1 total distance covered pre- to post-intervention (SSG-C mean-difference ± SD: 840 ± 299 m; p = 0.003; d = 1.08; CI = 0.60 to 1.56 and SSG-I: 607 ± 274 m; p = 0.003; d = 1.25; CI = 0.66 to 1.85 respectively). Higher %HRmax values with very large ES (92 ± 0.6%; p = 0.002; d = 5.33; CI = 2.78 to 7.88) and time spent in HR zone 4 (1248.0 ± 122.7 s; p = 0.000; d = 3.43; CI = 2.31 to 4.55) were observed for SSG-C. No differences between regimes were found for any of the assessed technical actions, global RPE, and PACES scores.Both SSG regimes investigated in this study were effective in improving YYL1 performance. Further, findings indicate that the regime does not influence players' subjective feelings and technical actions in SSG play. However, SSG-I in lacrosse specific training could have additional benefits such as lower signs of fatigue. Further, breaks can be used to give technical and tactical inputs by coaches."
https://openalex.org/W2895317690,"Studies on the behavioural function of sounds are very rare within heterospecific interactions. John Dory (Zeus faber) is a solitary, predatory fish that produces sound when captured, but has not been documented to vocalize under natural conditions (i.e. in the wild). The present study provides the first in-situ recordings of John Dory vocalisations and correlates them to behavioural response of snapper (Pagrus auratus) a common species found through New Zealand. Vocalisations or 'barks', ranged between 200-600 Hz, with a peak frequency of 312 ± 10 Hz and averaged 139 ± 4 milliseconds in length. Baited underwater video (BUV) equipped with hydrophones determined that under natural conditions a John Dory vocalization induced an escape response in snapper present, causing them to exit the area opposite to the position of the John Dory. We speculate that the John Dory vocalisation may be used for territorial display towards both conspecifics and heterospecifics, asserting dominance in the area or heightening predatory status."
https://openalex.org/W2895294823,"The ability of aquatic insects to colonize Earth's most remote freshwater habitats, such as those of islands and deserts, is limited to select taxa. Among black flies, the premiere colonization specialist is Simulium ruficorne Macquart, the only species known from both the Afrotropical and Palearctic regions. We investigated the cytogenetics of S. ruficorne to gain insight into its wide geographic distribution and ability to colonize oceanic islands and deserts. On the basis of larval polytene chromosomes from 14 locations, we documented 17 novel and previously known chromosomal rearrangements and established five cytoforms (A1, A2, B, C, and D), of which probably four (A1/A2, B, C, and D) are distinct species and two (A1 and A2) represent sex-chromosome polymorphism involving a heteroband in the long arm of chromosome III. The chromosome restructuring phenomena associated with the five cytoforms are consistent with the trend in the Simuliidae that one and the same rearrangement can assume different functions in the various descendants of a common ancestor in which the rearrangement was polymorphic. The most widely distributed cytoforms are A1 and A2, which are found in North Africa, the Canary Islands, and Majorca. Simulium ruficorne, the only known black fly in the Hoggar Mountains of the central Sahara Desert, represents a cohesive population of cytoform A1 little differentiated from other North African populations of A1 and A2. Cytoform B inhabits the West African mainland, cytoform C is on Tenerife, and cytoform D is on Cape Verde. We suggest that dispersal and colonization specialists, such as S. ruficorne, are multivoltine inhabitants of temporary streams, and must relocate as their habitats deteriorate. Simulium ruficorne, therefore, should have adaptations that contribute to successful dispersal and colonization, perhaps largely physiological in nature, such as tolerance of high temperatures and droughts."
https://openalex.org/W2895607736,"The vascular endothelium is considered as a key cell compartment for the response to ionizing radiation of normal tissues and tumors, and as a promising target to improve the differential effect of radiotherapy in the future. Following radiation exposure, the global endothelial cell response covers a wide range of gene, miRNA, protein and metabolite expression modifications. Changes occur at the transcriptional, translational and post-translational levels and impact cell phenotype as well as the microenvironment by the production and secretion of soluble factors such as reactive oxygen species, chemokines, cytokines and growth factors. These radiation-induced dynamic modifications of molecular networks may control the endothelial cell phenotype and govern recruitment of immune cells, stressing the importance of clearly understanding the mechanisms which underlie these temporal processes. A wide variety of time series data is commonly used in bioinformatics studies, including gene expression, protein concentrations and metabolomics data. The use of clustering of these data is still an unclear problem. Here, we introduce kernels between Gaussian processes modeling time series, and subsequently introduce a spectral clustering algorithm. We apply the methods to the study of human primary endothelial cells (HUVECs) exposed to a radiotherapy dose fraction (2 Gy). Time windows of differential expressions of 301 genes involved in key cellular processes such as angiogenesis, inflammation, apoptosis, immune response and protein kinase were determined from 12 hours to 3 weeks post-irradiation. Then, 43 temporal clusters corresponding to profiles of similar expressions, including 49 genes out of 301 initially measured, were generated according to the proposed method. Forty-seven transcription factors (TFs) responsible for the expression of clusters of genes were predicted from sequence regulatory elements using the MotifMap system. Their temporal profiles of occurrences were established and clustered. Dynamic network interactions and molecular pathways of TFs and differential genes were finally explored, revealing key node genes and putative important cellular processes involved in tissue infiltration by immune cells following exposure to a radiotherapy dose fraction."
https://openalex.org/W2895309425,"Understanding the molecular pathways regulating cardiogenesis is crucial for the early diagnosis of heart diseases and improvement of cardiovascular disease. During normal mammalian cardiac development, collagen and calcium-binding EGF domain-1 (Ccbe1) is expressed in the first and second heart field progenitors as well as in the proepicardium, but its role in early cardiac commitment remains unknown. Here we demonstrate that during mouse embryonic stem cell (ESC) differentiation Ccbe1 is upregulated upon emergence of Isl1- and Nkx2.5- positive cardiac progenitors. Ccbe1 is markedly enriched in Isl1-positive cardiac progenitors isolated from ESCs differentiating in vitro or embryonic hearts developing in vivo. Disruption of Ccbe1 activity by shRNA knockdown or blockade with a neutralizing antibody results in impaired differentiation of embryonic stem cells along the cardiac mesoderm lineage resulting in a decreased expression of mature cardiomyocyte markers. In addition, knockdown of Ccbe1 leads to smaller embryoid bodies. Collectively, our results show that CCBE1 is essential for the commitment of cardiac mesoderm and consequently, for the formation of cardiac myocytes in differentiating mouse ESCs."
https://openalex.org/W2895467536,"Autophagy and phagocytosis are cellular immune mechanisms for internalization and elimination of intracellular and extracellular pathogens. Some pathogens have evolved the ability to inhibit or manipulate these processes, raising the prospect of adaptive reciprocal co-evolution by the host. We performed population genetic analyses on phagocytosis and autophagy genes in Drosophila melanogaster and D. simulans to test for molecular evolutionary signatures of immune adaptation. We found that phagocytosis and autophagy genes as a whole exhibited an elevated level of haplotype homozygosity in both species. In addition, we detected signatures of recent selection, notably in the Atg14 and Ykt6 genes in D. melanogaster and a pattern of elevated sequence divergence in the genderblind (gb) gene on the D. simulans lineage. These results suggest that the evolution of the host cellular immune system as a whole may be shaped by a dynamic conflict between Drosophila and its pathogens even without pervasive evidence of strong adaptive evolution at the individual gene level."
https://openalex.org/W2894848385,"One of the major obstacles to the full implementation of the World Health Organization (WHO) Framework Convention of Tobacco Control (FCTC) tobacco control measures is the lack of sustainable financing resources.To update and simulate country-specific indicators that are highly relevant to the costs and financial resources of the treaty policy implementation. We also developed an Excel tool for simulation and assessed the aggregated-level indicators by the 2016 World Bank income groups.Using mostly 2016 data or 2014-15 data if 2016 one are not available, we updated five indicators relevant to the treaty implementation, which are the gap between current and desirable policy implementation, cigarette affordability, the costs of implementing best- buy tobacco control policies, the number of smoking-attributable deaths, and the simulated tax revenue resulting from a $1 tax increase. We also aggregated indicators and simulation results by the World Bank income groups, encompassing the five indicators and the reduction in smoking and in attributable deaths due to a hypothetical 1I$ tax increase. Finally, the policy implementation cost was compared with tax revenue and revenue increases.As of 2016, smoking remains one of the leading causes of premature deaths worldwide while the implementation of best-buy tobacco control policies was below the recommended levels. Meanwhile, there was room to further increase cigarette taxes and prices, as cigarettes remained affordable in many countries. The total costs of implementing best-buy policies in the next 15 years merely account for 8.3% of the 2016 excise tax revenue, indicating that a small proportion of annual tax revenue could fund the implementation of tobacco control policies recommended by the WHO FCTC.Increasing taxes could have a multiplier impact on curbing tobacco use through aiding the implementation of the WHO FCTC."
