id,abstract
https://openalex.org/W1882328483,"Background Dysfunctional innate responses of alveolar macrophages to nontypeable Haemophilus influenzae, Moraxella catarrhalis and Streptococcus pneumoniae contribute to morbidity in chronic obstructive pulmonary disease (COPD). Our earlier studies discovered impaired COPD alveolar macrophage responses to Toll-like receptor (TLR) ligands of nontypeable H. influenzae and provide rationale for further evaluation of TLR signaling. While the role of TLR single nucleotide polymorphisms is increasingly recognized in inflammatory diseases, TLR single nucleotide polymorphisms in COPD have only recently been explored. We hypothesized that specific TLR polymorphisms are associated with dysfunctional innate immune COPD alveolar macrophage responses and investigated polymorphisms of TLR2(Arg753Gln), TLR4(Thr399Ile; Asp299Gly), and TLR9(T1486C; T1237C). Methods DNA was purified from cells of 1) healthy nonsmokers (n = 20); 2) COPD ex-smokers (n = 83); 3) COPD active smokers (n = 93). DNA amplifications (polymerase chain reaction) were performed for each SNP. Alveolar macrophages from each group were incubated with nontypeable H. influenzae, M. catarrhalis and S. pneumoniae. Cytokine induction of macrophage supernatants was measured and the association with TLR single nucleotide polymorphism expression was determined. Results No significant inter-group differences in frequency of any TLR SNP existed. However both TLR9 single nucleotide polymorphisms were expressed in high frequency. Among COPD ex-smokers, diminished IL-8 responsiveness to nontypeable H. influenzae, M. catarrhalis and S. pneumoniae was strongly associated with carriage of TLR9(T1237C) (p = 0.02; p = 0.008; p = 0.02), but not TLR9(T1486C). Carriage of TLR9(T1237C), but not TLR9(T1486C), correlated with diminished FEV1%predicted (p = 0.037). Conclusion Our results demonstrate a notable association of TLR9(T1237C) expression with dysfunctional innate alveolar macrophage responses to respiratory pathogens and with severity of COPD."
https://openalex.org/W2173937079,"An endo-β-1,4-glucanase gene, cel7A, was cloned from the thermophilic cellulase-producing fungus Neosartorya fischeri P1 and expressed in Pichia pastoris. The 1,410-bp full-length gene encodes a polypeptide of 469 amino acids consisting of a putative signal peptide at residues 1-20, a catalytic domain of glycoside hydrolase family 7 (GH7), a short Thr/Ser-rich linker and a family 1 carbohydrate-binding module (CBM 1). The purified recombinant Cel7A had pH and temperature optima of pH 5.0 and 60°C, respectively, and showed broad pH adaptability (pH 3.0-6.0) and excellent stability at pH3.0-8.0 and 60°C. Belonging to the group of nonspecific endoglucanases, Cel7A exhibited the highest activity on barley β-glucan (2020 ± 9 U mg-1), moderate on lichenan and CMC-Na, and weak on laminarin, locust bean galactomannan, Avicel, and filter paper. Under simulated mashing conditions, addition of Cel7A (99 μg) reduced the mash viscosity by 9.1% and filtration time by 24.6%. These favorable enzymatic properties make Cel7A as a good candidate for applications in the brewing industry."
https://openalex.org/W2340747851,"Amino acid transporters (AATers) in the brush border of the apical plasma membrane (APM) of renal proximal tubule (PT) cells mediate amino acid transport (AAT). We found that the membrane-associated class I myosin myosin 1b (Myo1b) localized at the apical brush border membrane of PTs. In opossum kidney (OK) 3B/2 epithelial cells, which are derived from PTs, expressed rat Myo1b-GFP colocalized in patched microvilli with expressed mouse V5-tagged SIT1 (SIT1-V5), which mediates neutral amino acid transport in OK cells. Lentivirus-mediated delivery of opossum Myo1b-specific shRNA resulted in knockdown (kd) of Myo1b expression, less SIT1-V5 at the APM as determined by localization studies, and a decrease in neutral AAT as determined by radioactive uptake assays. Myo1b kd had no effect on Pi transport or noticeable change in microvilli structure as determined by rhodamine phalloidin staining. The studies are the first to define a physiological role for Myo1b, that of regulating renal AAT by modulating the association of AATers with the APM."
https://openalex.org/W2172500600,"Regular physical activity is essential for older adults to stay healthy and independent. However, daily physical activity is generally low among older adults and mainly consists of activities such as standing and shuffling around indoors. Accurate measurement of this low-energy expenditure daily physical activity is crucial for stimulation of activity. The objective of this study was to assess the validity of a necklace-worn sensor-based method for detecting time-on-legs and daily life mobility related postures in older adults. In addition user opinion about the practical use of the sensor was evaluated. Twenty frail and non-frail older adults performed a standardized and free movement protocol in their own home. Results of the sensor-based method were compared to video observation. Sensitivity, specificity and overall agreement of sensor outcomes compared to video observation were calculated. Mobility was assessed based on time-on-legs. Further assessment included the categories standing, sitting, walking and lying. Time-on-legs based sensitivity, specificity and percentage agreement were good to excellent and comparable to laboratory outcomes in other studies. Category-based sensitivity, specificity and overall agreement were moderate to excellent. The necklace-worn sensor is considered an acceptable valid instrument for assessing home-based physical activity based upon time-on-legs in frail and non-frail older adults, but category-based assessment of gait and postures could be further developed."
https://openalex.org/W2179178678,"This study aimed to describe the epidemiology and risk factors of cholelithiasis and nephrolithiasis among HIV-positive patients in the era of combination antiretroviral therapy.We retrospectively reviewed the medical records of HIV-positive patients who underwent routine abdominal sonography for chronic viral hepatitis, fatty liver, or elevated aminotransferases between January 2004 and January 2015. Therapeutic drug monitoring of plasma concentrations of atazanavir was performed and genetic polymorphisms, including UDP-glucuronosyltransferase (UGT) 1A1*28 and multidrug resistance gene 1 (MDR1) G2677T/A, were determined in a subgroup of patients who received ritonavir-boosted or unboosted atazanavir-containing combination antiretroviral therapy. Information on demographics, clinical characteristics, and laboratory testing were collected and analyzed.During the 11-year study period, 910 patients who underwent routine abdominal sonography were included for analysis. The patients were mostly male (96.9%) with a mean age of 42.2 years and mean body-mass index of 22.9 kg/m2 and 85.8% being on antiretroviral therapy. The anchor antiretroviral agents included non-nucleoside reverse-transcriptase inhibitors (49.3%), unboosted atazanavir (34.4%), ritonavir-boosted lopinavir (20.4%), and ritonavir-boosted atazanavir (5.5%). The overall prevalence of cholelithiasis and nephrolithiasis was 12.5% and 8.2%, respectively. Among 680 antiretroviral-experienced patients with both baseline and follow-up sonography, the crude incidence of cholelithiasis and nephrolithiasis was 4.3% and 3.7%, respectively. In multivariate analysis, the independent factors associated with incident cholelithiasis were exposure to ritonavir-boosted atazanavir for >2 years (adjusted odds ratio [AOR], 6.29; 95% confidence interval [CI], 1.12-35.16) and older age (AOR, 1.04; 95% CI, 1.00-1.09). The positive association between duration of exposure to ritonavir-boosted atazanavir and incident cholelithiasis was also found (AOR, per 1-year exposure, 1.49; 95% CI, 1.05-2.10). The associated factors with incident nephrolithiasis were hyperlipidemia (AOR, 3.97; 95% CI, 1.32-11.93), hepatitis B or C coinfection (AOR, 3.41; 95% CI, 1.09-10.62), and exposure to abacavir (AOR, 12.01; 95% CI, 1.54-93.54). Of 180 patients who underwent therapeutic drug monitoring of plasma atazanavir concentrations and pharmacogenetic investigations, we found that the atazanavir concentrations and UGT 1A1*28 and MDR1 G2677T/A polymorphisms were not statistically significantly associated with incident cholelithiasis and nephrolithiasis.In HIV-positive patients in the era of combination antiretroviral therapy, a high prevalence of cholelithiasis and nephrolithiasis was observed, and exposure to ritonavir-boosted atazanavir for >2 years was associated with incident cholelithiasis."
https://openalex.org/W2181178606,"Scientific and religious thinking compete with each other on several levels. For example, activating one generally weakens the other. Since priming religion is known to increase moral behaviour and moral sensitivity, priming science might be expected to have the opposite effect. However, it was recently demonstrated that, on the contrary, science priming increases moral sensitivity as well. The present set of studies sought to replicate this effect and test two explanations for it. Study 1 used a sentence unscrambling task for implicitly priming the concept of science but failed to replicate its effect on moral sensitivity, presumably due to a ceiling effect. Study 2 replicated the effect with a new measure of moral sensitivity. Study 3 tested whether science-related words create this effect by activating the idea of secular authority or by activating analytic thinking. It was demonstrated that words related to secular authority, but not words related to analytic thinking, produced a similar increase in moral sensitivity. Religiosity level of the participants did not influence this basic finding. The results are consistent with the hypothesis that science as a secular institution has overtaken some of the functions of religion in modern societies."
https://openalex.org/W2172608749,"Rationale Smoking during pregnancy increases the risk of bronchopulmonary dysplasia (BPD) and, in mice, gestational exposure to sidestream cigarette smoke (SS) induces BPD-like condition characterized by alveolar simplification, impaired angiogenesis, and suppressed surfactant protein production. Normal fetal development occurs in a hypoxic environment and nicotinic acetylcholine receptors (nAChRs) regulate the hypoxia-inducible factor (HIF)-1α that controls apoptosis and angiogenesis. To understand SS-induced BPD, we hypothesized that gestational SS affected alveolar development through HIF-1α. Methods Pregnant BALB/c mice were exposed to air (control) or SS throughout the gestational period and the 7-day-old lungs of the progeny were examined. Results Gestational SS increased apoptosis of alveolar and airway epithelial cells. This response was associated with increased alveolar volumes, higher levels of proapoptotic factors (FOXO3a, HIPK2, p53, BIM, BIK, and BAX) and the antiangiogenic factor (GAX), and lower levels of antiapoptotic factors (Akt-PI3K, NF-κB, HIF-1α, and Bcl-2) in the lung. Although gestational SS increased the cells containing the proangiogenic bombesin-like-peptide, it markedly decreased the expression of its receptor GRPR in the lung. The effects of SS on apoptosis were attenuated by the nAChR antagonist mecamylamine. Conclusions Gestational SS-induced BPD is potentially regulated by nAChRs and associated with downregulation of HIF-1α, increased apoptosis of epithelial cells, and increased alveolar volumes. Thus, in mice, exposure to sidestream tobacco smoke during pregnancy promotes BPD-like condition that is potentially mediated through the nAChR/HIF-1α pathway."
https://openalex.org/W1506970750,"Previously we isolated migracin A from a Streptomyces culture filtrate as an inhibitor of cancer cell migration. In the present research, we found that migracin A inhibited migration and invasion of ovarian clear cell carcinoma ES-2 cells. In the course of our mechanistic study, migracin A was shown to enhance vasohibin-1 expression in an angiogenesis array. We also confirmed that it increased the mRNA expression of this protein. Moreover, overexpression of vasohibin-1 lowered the migration but not the invasion of ES-2 cells. Then, we looked for another target protein employing a motility array, and found that migracin A lowered the IGF-1 expression. Knockdown of IGF-1 by siRNA decreased the migration and invasion of ES-2 cells. Migracin A also decreased Akt phosphorylation involved in the downstream signaling. Crosstalk analysis indicated that overexpression of vasohibin-1 decreased the IGF-1 expression. On the other hand, it showed no direct anticancer activity in terms of the ES-2 growth in agar. Migracin A inhibited the migration and IGF-1 expression in not only ES-2 but also another ovarian clear cell carcinoma JHOC-5 cells. In addition, it also inhibited capillary tube formation of human umbilical vein endothelial cells. Since its cytotoxicity is very low, migracin A may be a candidate for an anti-metastasis agent not exhibiting prominent toxicity."
https://openalex.org/W2177160696,"Activation of the immune system affects the circadian clock. Tumor necrosis factor (TNF) and Interleukin (IL)-1β inhibit the expression of clock genes including Period (Per) genes and the PAR-bZip clock-controlled gene D-site albumin promoter-binding protein (Dbp). These effects are due to cytokine-induced interference of E-box mediated transcription of clock genes. In the present study we have assessed the two E-box binding transcriptional regulators Twist1 and Twist2 for their role in cytokine induced inhibition of clock genes.The expression of the clock genes Per1, Per2, Per3 and of Dbp was assessed in NIH-3T3 mouse fibroblasts and the mouse hippocampal neuronal cell line HT22. Cells were treated for 4h with TNF and IL-1β. The functional role of Twist1 and Twist2 was assessed by siRNAs against the Twist genes and by overexpression of TWIST proteins. In luciferase (luc) assays NIH-3T3 cells were transfected with reporter gene constructs, which contain a 3xPer1 E-box or a Dbp E-box. Quantitative chromatin immunoprecipitation (ChIP) was performed using antibodies to TWIST1 and CLOCK, and the E-box consensus sequences of Dbp (CATGTG) and Per1 E-box (CACGTG).We report here that siRNA against Twist1 protects NIH-3T3 cells and HT22 cells from down-regulation of Period and Dbp by TNF and IL-1β. Overexpression of Twist1, but not of Twist2, mimics the effect of the cytokines. TNF down-regulates the activation of Per1-3xE-box-luc, the effect being prevented by siRNA against Twist1. Overexpression of Twist1, but not of Twist2, inhibits Per1-3xE-box-luc or Dbp-E-Box-luc activity. ChIP experiments show TWIST1 induction by TNF to compete with CLOCK binding to the E-box of Period genes and Dbp.Twist1 plays a pivotal role in the TNF mediated suppression of E-box dependent transactivation of Period genes and Dbp. Thereby Twist1 may provide a link between the immune system and the circadian timing system."
https://openalex.org/W2177930200,"Functional RNAi based screening is affected by large numbers of false positive and negative hits due to prevalent sequence based off-target effects. We performed a druggable genome targeting siRNA screen intended to identify novel regulators of E-cadherin (CDH1) expression, a known key player in epithelial mesenchymal transition (EMT). Analysis of primary screening results indicated a large number of false-positive hits. To address these crucial difficulties we developed an analysis method, SENSORS, which, similar to published methods, is a seed enrichment strategy for analyzing siRNA off-targets in RNAi screens. Using our approach, we were able to demonstrate that accounting for seed based off-target effects stratifies primary screening results and enables the discovery of additional screening hits. While traditional hit detection methods are prone to false positive results which are undetected, we were able to identify false positive hits robustly. Transcription factor MYBL1 was identified as a putative novel target required for CDH1 expression and verified experimentally. No siRNA pool targeting MYBL1 was present in the used siRNA library. Instead, MYBL1 was identified as a putative CDH1 regulating target solely based on the SENSORS off-target score, i.e. as a gene that is a cause for off-target effects down regulating E-cadherin expression."
https://openalex.org/W2179655127,"Despite an established link between epilepsy and sleep behavior, it remains unclear how specific epileptogenic mutations affect sleep and subsequently influence seizure susceptibility. Recently, Sun et al. (2012) created a fly knock-in model of human generalized epilepsy with febrile seizures plus (GEFS+), a wide-spectrum disorder characterized by fever-associated seizing in childhood and lifelong affliction. GEFS+ flies carry a disease-causing mutation in their voltage-gated sodium channel (VGSC) gene and display semidominant heat-induced seizing, likely due to reduced GABAergic inhibitory activity at high temperature. Here, we show that at room temperature the GEFS+ mutation dominantly modifies sleep, with mutants exhibiting rapid sleep onset at dusk and increased nighttime sleep as compared to controls. These characteristics of GEFS+ sleep were observed regardless of sex, mating status, and genetic background. GEFS+ mutant sleep phenotypes were more resistant to pharmacologic reduction of GABA transmission by carbamazepine (CBZ) than controls, and were mitigated by reducing GABAA receptor expression specifically in wake-promoting pigment dispersing factor (PDF) neurons. These findings are consistent with increased GABAergic transmission to PDF neurons being mainly responsible for the enhanced nighttime sleep of GEFS+ mutants. Additionally, analyses under other light conditions suggested that the GEFS+ mutation led to reduced buffering of behavioral responses to light on and off stimuli, which contributed to characteristic GEFS+ sleep phenotypes. We further found that GEFS+ mutants had normal circadian rhythms in free-running dark conditions. Interestingly, the mutants lacked a homeostatic rebound following mechanical sleep deprivation, and whereas deprivation treatment increased heat-induced seizure susceptibility in control flies, it unexpectedly reduced seizure activity in GEFS+ mutants. Our study has revealed the sleep architecture of a Drosophila VGSC mutant that harbors a human GEFS+ mutation, and provided unique insight into the relationship between sleep and epilepsy."
https://openalex.org/W2281817376,"The evolution and development of the three-dimensional (3D) architectural landscape is the basis of proper urban planning, eco-environment construction and the improvement of environmental quality. This paper presents the spatiotemporal characteristics of the 3D architectural landscape of the Shinan and Shibei districts in Qingdao, China, based on buildings’ 3D information extracted from Quickbird images from 2003 to 2012, supported by Barista, landscape metrics and GIS. The results demonstrated that: (1) Shinan and Shibei districts expanded vertically and urban land use intensity increased noticeably from year to year. (2) Significant differences in the 3D architectural landscape existed among the western, central and eastern regions, and among the 26 sub-districts over the study period. The differentiation was consistent with the diverse development history, function and planning of the two districts. Finally, we found that population correlates positively with the variation in the 3D architectural landscape. This research provides an important reference for related studies, urban planning and eco-city construction."
https://openalex.org/W2176107695,"In an admittance-controlled haptic device, input forces are used to calculate the movement of the device. Although developers try to minimize delays, there will always be delays between the applied force and the corresponding movement in such systems, which might affect what the user of the device perceives. In this experiment we tested whether these delays in a haptic human-robot interaction influence the perception of mass. In the experiment an admittance-controlled manipulator was used to simulate various masses. In a staircase design subjects had to decide which of two virtual masses was heavier after gently pushing them leftward with the right hand in mid-air (no friction, no gravity). The manipulator responded as quickly as possible or with an additional delay (25 or 50 ms) to the forces exerted by the subject on the handle of the haptic device. The perceived mass was ~10% larger for a delay of 25 ms and ~20% larger for a delay of 50 ms. Based on these results, we estimated that the delays that are present in nowadays admittance-controlled haptic devices (up to 20ms) will give an increase in perceived mass which is smaller than the Weber fraction for mass (~10% for inertial mass). Additional analyses showed that the subjects' decision on mass when the perceptual differences were small did not correlate with intuitive variables such as force, velocity or a combination of these, nor with any other measured variable, suggesting that subjects did not have a consistent strategy during guessing or used other sources of information, for example the efference copy of their pushes."
https://openalex.org/W2180433860,"Metastases in the bone marrow (BM) in form of disseminated tumor cells (DTCs) are frequent events at diagnosis and also at relapse in high-risk neuroblastoma patients. The frequently highly diluted occurrence of DTCs requires adequate enrichment strategies to enable their detailed characterization. However, to avoid methodical artifacts we tested whether pre-analytical processing steps-including transport duration, temperature and, importantly, tumor cell enrichment techniques-are confounding factors for gene expression analysis in DTCs.LAN-1 neuroblastoma cells were spiked into tumor free BM and/or peripheral blood and: i) kept at room temperature or at 4°C for 24, 48 and 72 hours; ii) frozen down at -80°C and thawed; iii) enriched via magnetic beads. The effect on the gene expression signature of LAN-1 cells was analyzed by qPCR arrays and gene expression microarrays.Neither storage at -80°C in DMSO and subsequent thawing nor enrichment of spiked-in neuroblastoma cells changed the expression of the analyzed genes significantly. Whereas storage at 4°C altered the expression of analyzed genes (14.3%) only at the 72h-timepoint in comparison to the 0h-timepoint, storage at room temperature had a much more profound effect on gene expression by affecting 20% at 24h, 26% at 48h and 43% at 72h of the analyzed genes.Using neuroblastoma as a model, we show that tumor cell enrichment by magnetic bead separation has virtually no effect on gene expression in DTCs. However, transport time and temperature can influence the expression profile remarkably. Thus, the expression profile of routinely collected BM samples can be analyzed without concern as long as the transport conditions are monitored."
https://openalex.org/W2175054223,"We report our findings from a preclinical safety study designed to assess potential side effects of corneal ultraviolet femtosecond laser treatment on lens and retina.Refractive lenticules (-5 dpt) with a diameter of 6 mm were created in the right cornea of eight Dutch Belted rabbits. Radiant exposure was 0.5 J/cm² in two animals and 18 J/cm² in six animals. The presence of lens opacities was assessed prior to and up to six months following laser application using Scheimpflug images (Pentacam, Oculus) and backscatter analysis (Opacity Lensmeter 702, Interzeag). Ganzfeld flash and flicker electroretinogram (ERG) recordings were obtained from both eyes prior to and up to six weeks following laser application. At the study endpoint, retinas were examined by light microscopy.Independent of energy dose applied, no cataract formation could be observed clinically or with either of the two objective methods used. No changes in ERG recordings over time and no difference between treated and untreated eye were detected. Histologically, retinal morphology was preserved and retinal pigment epithelium as well as photoreceptor inner and outer segments appeared undamaged. Quantitative digital image analysis did not reveal cell loss in inner or outer nuclear layers.Our analysis confirms theoretical considerations suggesting that ultraviolet femtosecond laser treatment of the cornea is safe for intraocular tissues. Transmitted light including stray light induces no photochemical effects in lens or retina at energy levels much higher than required for the clinical purpose. These conclusions cannot be applied to eyes with pre-existing retinal damage, as these may be more vulnerable to light."
