id,abstract
https://openalex.org/W2803274949,"This study outlines the biodiversity of mushrooms of India. It reveals the molecular biodiversity and divergence time estimation of basidiomycetes from Gujarat, India. A total of 267 mushrooms were collected from 10 locations across the state. 225 ITS sequences were generated belonging to 105 species, 59 genera and 29 families. Phylogenetic analysis of Agaricaceae reveals monophyletic clade of Podaxis differentiating it from Coprinus. Further, the ancient nature of Podaxis supports the hypothesis that gasteroid forms evolved from secotioid forms. Members of Polyporaceae appeared polyphyletic. Further, our results of a close phylogenetic relationship between Trametes and Lenziteslead us to propose that the genera Trametes may by enlarged to include Lenzites. The tricholomatoid clade shows a clear demarcation for Entolomataceae. However, Lyophyllaceae and Tricholomataceae could not be distinguished clearly. Distribution studies of the mushrooms showed omnipresence of Ganoderma and Schizophyllum. Further, divergence time estimation shows that Dacrymycetes evolved in the Neoproterozoic Era and Hymenochaetales diverged from Agaricomycetes during the Silurian period."
https://openalex.org/W2803408029,"The hydrography and dynamics of NW Iberian margin were explored for July 2009, based on a set of in situ and remote sensing observations. Zonal sections of standard CTD casts, towed CTD (SeaSoar), Acoustic Doppler Current Profilers (ADCP) and Lagrangian surveys were made to characterize cycles of upwelling and relaxation in this region. Two periods of northerly winds, bounded by relaxation periods, were responsible for the formation of an upwelling front extending to the shelf edge. An equatorward flow was quickly set up on the shelf responding to the northerly wind pulses. South of Cape Silleiro, the development and subsequent relaxation of an upwelling event was intensively surveyed in the shelf, following a Lagrangian drifter transported by the upwelling jet. This region is part of an upwelling center extending from Cape Silleiro to Porto, where the surface temperature was colder than the neighboring regions, under upwelling favorable winds. As these winds relaxed, persistent poleward flow developed, originating south of the upwelling center and consisting in an inner-shelf tongue of warm waters. During an event of strong southerly wind, the poleward flow was observed to extend to the whole continental shelf. Although the cruise was executed during summertime, the presence of river-plumes was observed over the shelf. The interaction of the plumes with the circulation on the shelf was also described in terms of coastal convergence and offshore advection. The sampling of the offshore and slope regions showed the presence of the Iberian poleward current offshore and a persistent equatorward flow over the upper slope."
https://openalex.org/W2803590513,"Hybridization events are frequently demonstrated in natural butterfly populations. One interesting butterfly complex species is the Enantia jethys complex that has been studied for over a century; many debates exist regarding the species composition of this complex. Currently, three species that live sympatrically in the Gulf slope of Mexico (Enantia jethys, E. mazai, and E. albania) are recognized in this complex (based on morphological and molecular studies). Where these species live in sympatry, some cases of interspecific mating have been observed, suggesting hybridization events. Considering this, we employed a multilocus approach (analyses of mitochondrial and nuclear sequences: COI, RpS5, and Wg; and nuclear dominant markers: inter-simple sequence repeat (ISSRs) to study hybridization in sympatric populations from Veracruz, Mexico. Genetic diversity parameters were determined for all molecular markers, and species identification was assessed by different methods such as analyses of molecular variance (AMOVA), clustering, principal coordinate analysis (PCoA), gene flow, and PhiPT parameters. ISSR molecular markers were used for a more profound study of hybridization process. Although species of the Enantia jethys complex have a low dispersal capacity, we observed high genetic diversity, probably reflecting a high density of individuals locally. ISSR markers provided evidence of a contemporary hybridization process, detecting a high number of hybrids (from 17% to 53%) with significant differences in genetic diversity. Furthermore, a directional pattern of hybridization was observed from E. albania to other species. Phylogenetic study through DNA sequencing confirmed the existence of three clades corresponding to the three species previously recognized by morphological and molecular studies. This study underlines the importance of assessing hybridization in evolutionary studies, by tracing the lineage separation process that leads to the origin of new species. Our research demonstrates that hybridization processes have a high occurrence in natural populations."
https://openalex.org/W2803655843,"Endothelial cells (EC) frequently undergo primary or secondary injury during kidney disease such as thrombotic microangiopathy or glomerulonephritis. Renin Lineage Cells (RLCs) serve as a progenitor cell niche after glomerular damage in the adult kidney. However, it is not clear whether RLCs also contribute to endothelial replenishment in the glomerulus following endothelial injury. Therefore, we investigated the role of RLCs as a potential progenitor niche for glomerular endothelial regeneration. We used an inducible tet-on triple-transgenic reporter strain mRen-rtTAm2/LC1/LacZ to pulse-label the renin-producing RLCs in adult mice. Unilateral kidney EC damage (EC model) was induced by renal artery perfusion with concanavalin/anti-concanavalin. In this model glomerular EC injury and depletion developed within 1 day while regeneration occurred after 7 days. LacZ-labelled RLCs were restricted to the juxtaglomerular compartment of the afferent arterioles at baseline conditions. In contrast, during the regenerative phase of the EC model (day 7) a subset of LacZ-tagged RLCs migrated to the glomerular tuft. Intraglomerular RLCs did not express renin anymore and did not stain for glomerular endothelial or podocyte cell markers, but for the mesangial cell markers α8-integrin and PDGFRβ. Accordingly, we found pronounced mesangial cell damage parallel to the endothelial injury induced by the EC model. These results demonstrated that in our EC model RLCs are not involved in endothelial regeneration. Rather, recruitment of RLCs seems to be specific for the repair of the concomitantly damaged mesangium."
https://openalex.org/W2804946139,"The spatial pattern of soil organic carbon (SOC) and total nitrogen (TN) densities plays a profound important role in estimating carbon and nitrogen budgets. Naiman Banner located in northern China was chosen as research site, a total of 332 soil samples were taken in a depth of 100 cm from the low hilly land in the southern part, sandy land in the middle part and an alluvial plain in the northern part of the county. The results showed that SOC and TN density initially decreased and then increased from the north to the south, The highest densities, were generally in the south, with the lowest generally in the middle part. The SOC and TN densities in cropland were significantly greater than those in woodland and grassland in the alluvial plains and for Naiman as a whole. The woodland SOC and TN density were higher than those of grassland in the low hilly land, and higher densities of SOC and TN in grassland than woodland in the sandy land and low hilly land. There were significant differences in SOC and TN densities among the five soil types of Cambisols, Arenosols, Gleysols, Argosols, and Kastanozems. In addition, SOC and TN contents generally decreased with increasing soil depth, but increased below a depth of 40 cm in the Cambisols and became roughly constant at this depth in the Kastanozems. There is considerable potential to sequester carbon and nitrogen in the soil via the conversion of degraded sandy land into woodland and grassland in alluvial plain, and more grassland should be established in sandy land and low hilly land."
https://openalex.org/W2803670523,"Annexin A6 (AnxA6) is expressed in articular chondrocytes at levels higher than in other mesenchymal cell types. However, the role of AnxA6 in articular chondrocytes is not known. Here we show that complete lack of AnxA6 functions resulted in increased ß-catenin activation in Wnt3a-treated murine articular chondrocytes, whereas AnxA6 expressing articular chondrocytes showed decreased ß-catenin activation. High expression of AnxA6 in human articular chondrocytes showed the highest inhibition of Wnt/ß-catenin signaling. Inhibition of Wnt/ß-catenin signaling activity by AnxA6 together with cytosolic Ca2+ was achieved by interfering with the plasma membrane association of the Wnt signaling complex. AnxA6 also affected the cross-talk between Wnt/ß-catenin signaling and NF-κB signaling by decreasing ß-catenin activity and increasing NF-κB activity in Wnt3a-, interleukin-1beta (IL-1ß)-, and combined Wnt3a/IL-1ß-treated cells. Wnt3a treatment increased the mRNA levels of catabolic markers (cyclooxygenase-2, interleukin-6, inducible nitric oxide synthase) to a much lesser degree than IL-1ß treatment in human articular chondrocytes, and decreased the mRNA levels of matrix metalloproteinase-13 (MMP-13) and articular cartilage markers (aggrecan, type II collagen). Furthermore, Wnt3a decreased the mRNA levels of catabolic markers and MMP-13 in IL-1ß-treated human articular chondrocytes. High expression of AnxA6 resulted in decreased mRNA levels of catabolic markers, and increased MMP-13 and articular cartilage marker mRNA levels in Wnt3a-treated human articular chondrocytes, whereas leading to increased mRNA levels of catabolic markers and MMP-13 in human articular chondrocytes treated with IL-1ß, or combined Wnt3a and IL-1ß. Our findings define a novel role for AnxA6 in articular chondrocytes via its modulation of Wnt/ß-catenin and NF-κB signaling activities and the cross-talk between these two signaling pathways."
https://openalex.org/W2804417387,"Domestic violence (DV) is prevalent in low-income and slum-dwelling communities in India. To date, the focus of DV prevention in resource-poor settings has largely been with women. We herein aim to identify correlates of DV perpetration to help inform future primary prevention efforts that focus on behavioral change in men. Utilizing a cross-sectional design, potential correlates of DV perpetration were explored among a geographically-clustered random sample of 100 recently-married men residing in slums in Pune, India. In multivariable regression, DV perpetration was associated with less time spent alone in the relationship post-marriage (standardized β = -0.230, p<0.01), not attaining the ""husband ideal"" (standardized β = -0.201, p<0.05), poor resilience (standardized β = -0.304, p < .01), having limited definitions of behaviors constituting DV (standardized β = -0.217, p<0.05), and reporting greater jealousy if the participant's spouse were to talk to men outside the family (standardized β = 0.272, p<0.01). The identified correlates should inform components of future DV primary prevention interventions that target men as potential perpetrators or the couple as a unit."
https://openalex.org/W2803715376,"Whether γδ T cells inhibit or enhance the Foxp3 T cell response depends upon their activation status. The critical enhancing effector in the supernatant is adenosine. Activated γδ T cells express adenosine receptors at high levels, which enables them to deprive Foxp3+ T cells of adenosine, and to inhibit their expansion. Meanwhile, cell-free supernatants of γδ T cell cultures enhance Foxp3 T cell expansion. Thus, inhibition and enhancement by γδ T cells of Foxp3 T cell response are a reflection of the balance between adenosine production and absorption by γδ T cells. Non-activated γδ T cells produce adenosine but bind little, and thus enhance the Foxp3 T cell response. Activated γδ T cells express high density of adenosine receptors and have a greatly increased ability to bind adenosine. Extracellular adenosine metabolism and expression of adenosine receptor A2ARs by γδ T cells played a major role in the outcome of γδ and Foxp3 T cell interactions. A better understanding of the functional conversion of γδ T cells could lead to γδ T cell-targeted immunotherapies for related diseases."
https://openalex.org/W2803924772,"TMEM230 has been associated with autosomal dominant Parkinson's disease (PD). Subsequent studies have remained negative, and none of previous described mutation has been reported anymore. We investigated the implication of this gene in the PD in a population of 703 PD patients and 695 unrelated healthy controls from southern Spain. Thirteen variants were found, twelve of them observed only in controls or in patients and controls, and one (c.190A>G) observed only in one patient. Subsequent analysis of this variant indicates that probably it is not pathogenic. In addition, we found a variation in the 3'-UTR (rs183551373) and related with the miRNA hsa-miR-4299 but it was observed only in healthy controls. Our results suggest that variants in TMEM230 gene are not associated with the development of PD."
https://openalex.org/W2804019495,"Dimethoate, a systemic insecticide, has been used extensively in vegetable production. Insecticide residues in treated vegetables, however, pose a potential risk to consumers. Photocatalytic degradation is a new alternative to managing pesticide residues. In this study, the degradation of dimethoate in Bok choy was investigated under the field conditions using cerium-doped nano titanium dioxide (TiO2/Ce) hydrosol as a photocatalyst. The results show that TiO2/Ce hydrosol can accelerate the degradation of dimethoate in Bok choy. Specifically, the application of TiO2/Ce hydrosol significantly increased the reactive oxygen species (ROS) contents in the treated Bok choy, which speeds up the degradation of dimethoate. Ultra-performance liquid chromatography coupled with mass spectrometry (UPLC-MS) analysis detected three major degradation products, including omethoate, O,O,S-trimethyl thiophosphorothioate, and 1,2-Bis (acetyl-N-methyl-) methane disulfide. Two potential photodegradation pathways have been proposed based on the intermediate products. To understand the relationship between photodegradation and the molecular structure of target insecticides, we investigated the bond length, Mulliken atomic charge and frontier electron density of dimethoate using ab initio quantum analysis. These results suggest the P = S, P-S and S-C of dimethoate are the initiation sites for the photocatalytic reaction in Bok choy, which is consistent with our empirical data."
https://openalex.org/W2804476541,"With the evolution of treatments for neurological diseases, the contents of core neurological examinations (NEs) for medical students may need to be modified. We aimed to establish a consensus on the core NE items for neurology clerks and compare viewpoints between different groups of panelists.First, a pilot group proposed the core contents of NEs for neurology clerks. The proposed core NE items were then subject to a modified web-based Delphi process using the online software ""SurveyMonkey"". A total of 30 panelists from different backgrounds (tutors or learners, neurologists or non-neurologists, community hospitals or medical centers, and different academic positions) participated in the modified Delphi process. Each panelist was asked to agree or disagree on the inclusion of each item using a 9-point Likert scale and was encouraged to provide feedback. We also compared viewpoints between different groups of panelists using the Mann-Whitney U test.Eighty-three items were used for the first round of the Delphi process. Of them, 18 without consensus of being a core NE item for the neurology clerks in the first round and another 14 items suggested by the panelists were further discussed in the second round. Finally, 75 items with different grades were included in the recommended NE items for neurology clerks.Our findings provide a reference regarding the core NE items for milestone development for neurology clerkships. We hope that prioritizing the NE items in this order can help medical students to learn NE more efficiently."
https://openalex.org/W2804573640,"Introduction Thailand recommends influenza vaccination for children aged 6 months to <36 months, but investment in vaccine purchase is limited. To inform policy decision with respect to influenza disease burden and associated cost in young children and to support the continued inclusion of children as the recommended group for influenza vaccination, we conducted a prospective cohort study of children in Bangkok hospital to estimate and compare influenza incidence and cost between healthy and high-risk children. Methods Caregivers of healthy children and children with medical conditions (‘high-risk’) aged <36 months were called weekly for two years to identify acute respiratory illness (ARI) episodes and collect illness-associated costs. Children with ARI were tested for influenza viruses by polymerase chain reaction. Illnesses were categorized as mild or severe depending on whether children were hospitalized. Population-averaged Poisson models were used to compare influenza incidence by risk group. Quantile regression was used to examine differences in the median illness expenses. Results During August 2011-September 2015, 659 healthy and 490 high-risk children were enrolled; median age was 10 months. Incidence of mild influenza-associated ARI was higher among healthy than high-risk children (incidence rate ratio [IRR]: 1.67; 95% confidence interval [CI]: 1.13–2.48). Incidence of severe influenza-associated ARI did not differ (IRR: 0.40; 95% CI: 0.11–1.38). The median cost per mild influenza-associated ARI episode was $22 among healthy and $25 among high-risk children (3–4% of monthly household income; difference in medians: -$1; 95% CI for difference in medians: -$9 to $6). The median cost per severe influenza-associated ARI episode was $232 among healthy and $318 among high-risk children (26–40% and 36–54% of monthly household income, respectively; difference in medians: 110; 95% CI for difference in medians: -$352 to $571). Conclusions Compared to high-risk children, healthy children had higher incidence of mild influenza-associated ARI but not severe influenza-associated ARI. Costs of severe influenza-associated ARI were substantial. These findings support the benefit of annual influenza vaccination in reducing the burden of influenza and associated cost in young children."
https://openalex.org/W2803371726,"Venn diagrams are used to provide an intuitive understanding of multiple regression analysis and these diagrams work well with two variables. The area of overlap of the two variables has a one-to-one relationship to the squared correlation between them. This approach breaks down, however, with three-variables. Making the overlap between the pairs of variables consistent with their squared bivariate correlations often results in the overlap of two of these variables with the third variable that is not the same as the variance of the third variable accounted for by the other two variables. I introduce a modified Venn diagram approach that examines the relationships in multiple regression by using only two circles at a time, provides a new and consistent reason why the circles need to be of the same size, and designates a ""target variable"" whose overlap with the other circle corresponds to the variance accounted for by the other variable or variables. This approach allows the visualization of the components involved in multiple regression coefficients, their standard errors, and the F-test and t-test associated with these coefficients as well as other statistics commonly reported in the output of multiple regression programs."
https://openalex.org/W2804321346,"Recent studies in coastal wetlands have indicated that consumers may play an important role in regulating large-scale ecosystem processes. Predator removal experiments have shown significant differences in above-ground biomass production in the presence of higher level consumers, or predators. These results indicate that predators play an important role in regulating biomass production, but the extent to which this regulation impacts additional ecosystem functions, such as nutrient cycling and organic matter accumulation, is unclear. This study evaluated the impact that consumers have on large-scale ecosystem processes within southern New England tidal wetlands and contributes to the general understanding of trophic control in these systems. I established enclosure cages within three coastal wetlands and manipulated the presence of green crab predators to assess how trophic interactions affect ecosystem functions. Findings suggest that although these consumers may exert some top-down effects, other environmental factors, such as other consumers not studied here or bottom-up interactions, may variably play a larger role in the maintenance of ecosystem processes within the region. These results indicate that the loss of top-down control as an important mechanism influencing ecosystem functions may not hold for all wetlands along the full extent of the New England coastline."
https://openalex.org/W2803624873,"Approximately 90% of the structures in the Protein Data Bank (PDB) were obtained by X-ray crystallography or electron microscopy. Whereas the overall quality of structure is considered high, thanks to a wide range of tools for structure validation, uncertainties may arise from density maps of small molecules, such as organic ligands, ions or water, which are non-covalently bound to the biomolecules. Even with some experience and chemical intuition, the assignment of such disconnected electron densities is often far from obvious. In this study, we suggest the use of molecular dynamics (MD) simulations and free energy calculations, which are well-established computational methods, to aid in the assignment of ambiguous disconnected electron densities. Specifically, estimates of (i) relative binding affinities, for instance between an ion and water, (ii) absolute binding free energies, i.e., free energies for transferring a solute from bulk solvent to a binding site, and (iii) stability assessments during equilibrium simulations may reveal the most plausible assignments. We illustrate this strategy using the crystal structure of the fluoride specific channel (Fluc), which contains five disconnected electron densities previously interpreted as four fluoride and one sodium ion. The simulations support the assignment of the sodium ion. In contrast, calculations of relative and absolute binding free energies as well as stability assessments during free MD simulations suggest that four of the densities represent water molecules instead of fluoride. The assignment of water is compatible with the loss of these densities in the non-conductive F82I/F85I mutant of Fluc. We critically discuss the role of the ion force fields for the calculations presented here. Overall, these findings indicate that MD simulations and free energy calculations are helpful tools for modeling water and ions into crystallographic density maps."
https://openalex.org/W2804072724,"A bacterial artificial chromosome (BAC) library for G. mustelinum Miers ex G. Watt (AD4) was constructed. Intact nuclei from G. mustelinum (AD4) were used to isolate high molecular weight DNA, which was partially cleaved with Hind III and cloned into pSMART BAC (Hind III) vectors. The BAC library consisted of 208,182 clones arrayed in 542 384-microtiter plates, with an average insert size of 121.72 kb ranging from 100 to 150 kb. About 2% of the clones did not contain inserts. Based on an estimated genome size of 2372 Mb for G. mustelinum, the BAC library was estimated to have a total coverage of 10.50 × genome equivalents. The high capacity library of G. mustelinum will serve as a giant gene resource for map-based cloning of quantitative trait loci or genes associated with important agronomic traits or resistance to Verticillium wilt, physical mapping and comparative genome analysis."
https://openalex.org/W2804387526,"The aim of the project was to find new catalysts capable of chlorolactone biotransformation. Three bicyclic chlorolactones with structures possessing one or two methyl groups in their cyclohexane ring were subjected to screening biotransformation using seven bacterial strains and one fungal strain from a salt mine. Three strains of bacteria (Micrococcus luteus Pb10, Micrococcus luteus WSP45, Gordonia alkanivorans Pd25) and one fungal strain (Aspergillus sydowii KGJ10) were able to catalyse hydrolytic dehalogenation of one substrate. The classification of the strains that were effective biocatalysts was confirmed by 16S rDNA analysis. The best result (76%) was obtained using Aspergillus sydowii KGJ10. All strains catalysed hydrolytic dehalogenation without changing the conformation. The equatorial position of the chlorine atom in the substrate turned out to be warrant of the positive result of the biotransformation process."
