id,abstract
https://openalex.org/W1508958720,"Rat liver glutathione S-transferases have been purified to apparent electrophoretic homogeneity by S-hexylglutathione-linked Sepharose 6B affinity chromatography and CM-cellulose column chromatography. At least 11 transferase activity peaks can be resolved including five Yb size homodimeric isozymes, two Yc size homodimeric isozymes, one Ya homodimeric isozyme, one Y alpha homodimeric isozyme, and two Ya-Yc heterodimeric isozymes. Distribution of the GSH peroxidase activity among the CM-cellulose column fractions suggests the existence of further multiplicity in this isozyme family. Substrate specificity patterns of the Yb subunit isozymes revealed a possibility that each of the five Yb-containing isozymes is composed of a different homodimeric Yb size subunit composition. Our findings on the increasing multiplicity of glutathione S-transferase isozymes are consistent with the notion that multiple isozymes of overlapping substrate specificities are required to detoxify a multitude of xenobiotics in addition to serving other important physiological functions."
https://openalex.org/W2044547779,"The activity of the Ultrabithorax (Ubx+) gene is necessary for the characteristic development of a particular anatomical domain of the body of Drosophila. Mutant alleles at the abx, bx, bxd, and pbx loci eliminate specific functions of Ubx+ since their phenotype is part of that of Ubx mutants. We have characterized several abx and bx alleles and found that their effect extends to the same anatomical subdomain. This suggests that they inactivate the same genetic subunit within Ultrabithorax. Also, their wild-type activity is required for two distinct functions: postprothorax, acting early in the embryonic period, and bithorax, acting through embryonic and larval periods. Our results suggest that the Ultrabithorax gene contains two genetic subunits and that each subunit may include two separate functions."
https://openalex.org/W1494497302,"In buffer containing 50 mM KCl, 1 mM MgCl2, 1 mM EGTA, 5 mM imidazole, pH 7.5, 0.1 mM CaCl2, 0.2 mM dithiothreitol, 0.01% NaN3, and 0.2 mM ATP, the KD for the formation of the 1:1 complex between Acanthamoeba actin and Acanthamoeba profilin was about 5 microM. When the actin was modified by addition of a pyrenyl group to cysteine 374, the KD increased to about 40 microM but the critical concentration (0.16 microM) was unchanged. The very much lower affinity of profilin for modified actin explains the anomalous critical concentrations curves obtained for 5-10% pyrenyl-labeled actin in the presence of profilin and the apparently weak inhibition by profilin of the rate of filament elongation when polymerization is quantified by the increase in fluorescence of pyrenyl-labeled actin. Light-scattering assays of the polymerization of unmodified actin in the absence and presence of profilin gave a similar value for the KD (about 5-10 microM) when determined by the increase in the apparent critical concentration of F-actin at steady state at all concentrations of actin up to 20 microM and by the inhibition of the initial rates of polymerization of actin nucleated by either F-actin or covalently cross-linked actin dimer. In the same buffer, but with ADP instead of ATP, the critical concentration of actin was higher (4.9 microM) and the KD of the profilin-actin complex was lower for both unmodified (1-2 microM) and 100% pyrenyl-labeled actin (4.9 microM)."
https://openalex.org/W1567440722,"The functional molecular weight of rat liver 3-hydroxy-3-methylglutaryl-CoA reductase was determined by radiation inactivation. Both isolated hepatic microsomes and primary hepatocytes were irradiated with high energy electrons at -135 degrees C, and the residual microsomal enzyme activity was subsequently determined. The loss of enzyme activity in both irradiated microsomes and microsomes isolated from irradiated hepatocytes followed a single exponential decay which corresponded to a molecular mass of 200 kDa. This minimal molecular size of the functional enzyme was unaffected by either addition of cholestyramine to the rat diet or addition of 25-hydroxycholesterol plus mevalonate to the isolated rat hepatocytes. In addition, surviving enzyme protein was determined by immunoprecipitation of radiolabeled enzyme from hepatocytes that had been incubated with [35S]methionine before irradiation. The target size for loss of the monomer subunits was 98 kDa. The simplest interpretation of these results is that rat liver 3-hydroxy-3-methylglutaryl-CoA reductase in situ is a noncovalently linked dimer of the Mr = 97,200 enzyme subunit."
https://openalex.org/W1548173171,"Diethyl pyrocarbonate inhibits pig kidney holo-3,4-dihydroxyphenylalanine decarboxylase with a second-order rate constant of 1170 M-1 min-1 at pH 6.8 and 25 degrees C, showing a concomitant increase in absorbance at 242 nm due to formation of carbethoxyhistidyl derivatives. Activity can be restored by hydroxylamine, and the pH curve of inactivation indicates the involvement of a residue with a pKa of 6.03. Complete inactivation of 3,4-dihydroxyphenylalanine decarboxylase requires the modification of 6 histidine residues/mol of enzyme. Statistical analysis of the residual enzyme activity and of the extent of modification shows that, among 6 modifiable residues, only one is critical for activity. Protection exerted by substrate analogues, which bind to the active site of the enzyme, suggests that the modification occurs at or near the active site. The modified inactivated 3,4-dihydroxyphenylalanine decarboxylase still retains most of its ability to bind substrates. Thus, it may be suggested that the inactivation of enzyme by diethyl pyrocarbonate is not due to nonspecific steric or conformational changes which prevent substrate binding. However, the modified enzyme fails to produce at high pH either an enzyme-substrate complex or an enzyme-product complex absorbing at 390 nm. Considerations on this peculiar feature of the modified enzyme consistent with a catalytic role for the modified histidyl residue are discussed. The overall conclusion of this study may be that the modification of only one histidyl residue of 3,4-dihydroxyphenylalanine decarboxylase inactivates the enzyme and that this residue plays an essential role in the mechanism of action of the enzyme."
https://openalex.org/W1547860040,"The phosphorylation patterns of proteins were examined during the cell cycle of Chinese hamster ovary cells. This was accomplished by labeling synchronized cells at various times with [32P]orthophosphate and separating the proteins by both isoelectric focusing and nonequilibrium pH gradient two-dimensional gel electrophoresis. The most dramatic changes occurred during late G2/M when approximately eight proteins (including vimentin, lamin B, and histones 1 and 3) showed increased phosphorylation. Ten other proteins appeared to be uniquely phosphorylated during late G2/M. Of these 10 proteins, seven were no longer phosphorylated shortly after mitosis. There is also at least one protein which showed a relative decrease in phosphorylation during late G2/M."
https://openalex.org/W1563738835,"The activation of pyruvate dehydrogenasea kinase activity by CoA esters has been further characterized. Half-maximal activation of kinase activity was achieved with about 1.0 microM acetyl-CoA after a 20-s preincubation in the presence of NADH. More than 80% of the acetyl-CoA was consumed during this period in acetylating sites in the pyruvate dehydrogenase complex as a result of the transacetylation reaction proceeding to equilibrium. At 1.0 microM acetyl-CoA, this resulted in more than a 4-fold higher level of CoA than residual acetyl-CoA. Activation of kinase activity could result either from acetylation of specific sites in the complex or tight binding of acetyl-CoA. Removal of CoA enhanced both acetylation and activation, suggesting acetylation mediates activation. For allosteric binding of acetyl-CoA to elicit activation, an activation constant, Ka, less than 50 nM would be required. To further distinguish between those mechanisms, the effects of other CoA esters as well as the reactivity of most of the effective CoA esters were characterized. Several short-chain CoA esters enhanced kinase activity including (in decreasing order of effectiveness) malonyl-CoA, acetoacetyl-CoA, propionyl-CoA, and methylmalonyl-CoA. Butyryl-CoA inhibited kinase activity as did high concentrations of long-chain acyl-CoAs. Inhibition by long-chain acyl-CoAs may result, in part, from detergent-like properties of those esters. Malonyl-CoA, propionyl-CoA, butyryl-CoA, and methylmalonyl-CoA, obtained with radiolabeled acyl groups, were shown to acylate sites in the complex. Propionyl-CoA and butyryl-CoA were tested, in competition with acetyl-CoA or pyruvate, as alternative substrates for acylation of sites in the complex and as competitive effectors of kinase activity. Propionyl-CoA alone rapidly acylated sites in the complex at low concentrations, and low concentrations of propionyl-CoA were effective in activating kinase activity although only a relatively small activation was observed. When an equivalent level (20 microM) of acetyl-CoA and propionyl-CoA was used, marked activation of kinase activity due to a dominant effect of acetyl-CoA was associated with acetylation of a major portion of sites in the complex and with a small portion undergoing acylation with propionyl-CoA. Those results were rapidly achieved in a manner independent of the order of addition of the two CoA esters. That indicates that tight slowly reversible binding of acetyl-CoA is not involved in kinase activation. High levels of propionyl-CoA greatly reduced acetylation by acetyl-CoA and nearly prevented activation of kinase activity by acetyl-CoA.(ABSTRACT TRUNCATED AT 400 WORDS)"
https://openalex.org/W1480983598,"The interaction of high mobility group protein 1 (HMG 1) isolated from chicken erythrocytes with DNA has been characterized using the intrinsic tryptophan fluorescence of the protein as a probe. It was found that the fluorescence is quenched approximately 30% upon binding to either single- or double-stranded DNA. Fluorescent titrations indicate that the physical site size for HMG 1 binding on native DNA is approximately 14 base pairs (or 14 bases for binding to single-stranded DNA). Binding to single-stranded poly(dA) is only slightly dependent on ionic strength, although the affinity for double-stranded DNA is strongly ionic strength-dependent and has an optimum at approximately 100-120 mM Na+. Above this range, binding to native DNA is virtually all electrostatic in nature. Although the affinity of HMG 1 for single-stranded DNA is higher than that for double-stranded DNA at the extremes of the ionic range studied, no clear evidence for a helix-destabilizing activity was obtained. At low ionic strength, the protein actually stabilized DNA against thermal denaturation, while at high ionic strength, HMG 1 appears to undergo denaturation below the Tm of the DNA. Studies of the environment of the tryptophan fluorophores using collisional quenchers iodide, cesium, and acrylamide suggest that the predominant fluorophore is relatively exposed but constrained in a rigid, positively charged environment."
https://openalex.org/W1503960820,"As is the case for cytochrome P-450c, arene 1,2-oxides have been identified as initial metabolites when naphthalene and anthracene are oxidized by cytochrome P-450b in a highly purified, reconstituted system. Overall rates of metabolism by cytochrome P-450b are greater than 3-fold and greater than 50-fold lower than the respective rates of metabolism by cytochrome P-450c. For both hydrocarbons, the (-)-(1S,2R)-oxide predominates (74%) with cytochrome P-450b as the terminal oxidant, based on trapping the labile arene oxides as N-acetyl-L-cysteine S-conjugates of known absolute configuration. This result is in marked contrast to data obtained with cytochrome P-450c where the (+)-(1R,2S)-oxides predominate (73-greater than 95%). In the absence of added epoxide hydrolase, the metabolically formed arene oxides rapidly isomerize to phenols. Addition of increasing amounts of epoxide hydrolase to the incubation medium results in the formation of trans-1,2-dihydrodiols at the expense of phenols from the common arene oxide intermediates. Evaluation of the kinetic parameters (Km and kcat) for the hydration of the (+)- and (-)-enantiomers of both arene oxides by epoxide hydrolase has indicated that the (+)-(1R,2S)-enantiomers exhibit lower values of Km (approximately 1 microM) whereas the values of kcat are similar for both enantiomers of a given arene oxide. These parameters have allowed construction of a mathematical model which predicts the enantiomer composition of the dihydrodiols formed from naphthalene in reconstituted systems containing specific epoxide hydrolase concentrations. The data reported argue against a selective functional coupling mechanism between cytochrome P-450c and epoxide hydrolase in the metabolism of naphthalene and anthracene to the 1,2-dihydrodiols."
https://openalex.org/W2017699118,"The structure of a T = 1 icosahedral particle (where T is the triangulation number), assembled from southern bean mosaic virus coat protein fragments that lacked the amino-terminal arm, was solved by means of model building procedures with the use of 6-angstrom resolution x-ray diffraction data. The icosahedral five-, three-, and twofold contacts were found to be similar, at this resolution, to the analogous contacts (icosahedral five-, quasi-three-, and quasi-twofolds) found in the parent T = 3 southern bean mosaic virus. However, the icosahedral fivefold contacts of the T = 3 structure are the most conserved in the T = 1 capsid. These results are consistent with a mechanism in which pentameric caps of dimers are the building blocks for the assembly of T = 1 and T = 3 icosahedral viruses."
https://openalex.org/W1602678826,"The 31-kDa domain of human plasma fibronectin has been completely characterized. This fragment is located at the COOH-terminal end of the molecule immediately preceding the 3-kDa interchain disulfide-containing peptide. The 31-kDa domain was obtained after trypsin digestion of fibronectin and purified by affinity chromatography on gelatin- and heparin-Sepharose columns. The fragment eluted in the heparin-unbound fraction and was further purified by DEAE-cellulose and high performance liquid chromatography. The 31-kDa fragment contained a fibrin-binding site (fibrin II site) which was only active at physiological NaCl concentrations and therefore differed from that located in the NH2-terminal domain which also bound at lower NaCl concentrations. The 31-kDa domain bound to thiopropyl-Sepharose and was shown to contain a free sulfhydryl group located at position 35 in the sequence. To determine the complete amino acid sequence of this fragment, a trypsin digestion was performed on the reduced and alkylated 31-kDa domain, and the 17 resulting peptides were isolated by high performance liquid chromatography; their amino acid compositions and amino acid sequences have been determined, and the arrangement of peptides was achieved by comparison with the sequences deduced from human and rat cDNA clones and with a related plasmic fragment from bovine fibronectin. Comparison of these three sequences showed 23 amino acid differences between human and rat fibronectin and 16 between human and bovine fibronectin. This represents a 91 and 94% homology, respectively. An interesting finding is that the 31-kDa fragment contains a deletion of 31 residues when compared to the rat cDNA sequence. This deletion appears to represent a species difference since it is due to a shorter mRNA in the case of human fibronectin."
https://openalex.org/W2073147618,"Tissue factor (tissue thromboplastin, coagulation factor III), a protein component of cell membranes, is an essential cofactor for factor VII-dependent initiation of blood coagulation. Since no tissue factor-deficient condition has been described, it is one of only a few proteins of the coagulation system for which the pattern of inheritance has not been ascertained. Because of the species-specificity of tissue factor activity and the availability of a very sensitive chromogenic assay, it was possible in the present study to use somatic cell hybrids to assign the chromosomal location of the tissue factor structural gene (F3) to human chromosome 1 (1pter----1p21)."
https://openalex.org/W2056130500,
https://openalex.org/W1596785386,"Neurosecretory granule lysate from bovine posterior pituitary was shown to contain both carboxypeptidase B and amidating activities. The former sequentially releases COOH-terminal basic residues from the oxytocin biosynthetic precursor fragment oxytocinyl-GKR (CYIQNCPLGKR) to form oxytocinyl-GK and then oxytocinyl-G. The amidating enzyme converts the resulting oxytocinyl-G into oxytocin (CYIQNCPLG-NH2). The carboxypeptidase B was separated from a less specific carboxypeptidase present in granule lysate by gel filtration on Sephacryl S-300. Percoll density gradient centrifugation (after preliminary differential centrifugation) also yielded granule fractions enriched in the specific carboxypeptidase B activity. The carboxypeptidase B which converts the oxytocinyl peptides showed a fairly sharp pH dependence with an optimum of 5.5-6, was activated by cobalt ion, and was inhibited by cupric ion, EDTA, and a thiol protease inhibitor, p-chloromercuribenzoate. The amidating activity which converts oxytocinyl-G to oxytocin was competed by degradation due to proteases and/or peptidases present in lysate of Percoll gradient-derived granules. Oxytocinyl-GKR was shown by analytical affinity chromatography to bind noncovalently to neurophysin with an affinity close to that of mature oxytocin. This binding activity and the observation of carboxypeptidase B activity in the presence of large concentrations of neurophysin are consistent with the view that the exoproteolytic processing and amidation steps which occur after initial endoproteolysis of pro-oxytocin/neurophysin likely take place on oxytocin intermediate peptides which are bound in noncovalent complexes with the neurophysin domain from the precursor."
https://openalex.org/W2059374085,"The intermediate-sized filaments of vimentin-type (Mr = 57,000) have been identified biochemically and immunochemically as a major cytoskeleton component in the ciliary epithelium of the mammalian eye. When human or rabbit ciliary processes, or cultured ciliary epithelial-derived cells were incubated in serum-free medium containing [32P]orthophosphate and any of the following agents: 1) beta-adrenergic agonists (isoproterenol or epinephrine), 2) direct activators of adenylate cyclase (cholera toxin or forskolin), 3) analogs of cyclic AMP (8-Br-cAMP), or 4) prostaglandin E1, the phosphorylation of vimentin was significantly enhanced. The maximal enhancement ranged, in vivo and in vitro, from about 3-fold in human to 5-fold in rabbit, with either 1 mM 8-Br-cAMP or 0.1 microM forskolin. Phosphorylation of vimentin increased in the presence of beta-adrenergic agonists and could be blocked by the antiglaucoma beta-adrenergic antagonist timolol. The alpha-adrenergic agonist phenylephrine had no effect on phosphorylation of vimentin. Indirect immunofluorescence microscopy using a monoclonal antibody, anti-vimentin, allowed the localization of vimentin filaments in cultured ciliary epithelial cells. Treatment of these cells in culture with the catecholamine hormone, isoproterenol (1 microM), resulted in a profound reorganization of vimentin filaments. This may be correlated with the enhanced levels of phosphorylated vimentin observed upon increasing cellular cyclic AMP."
https://openalex.org/W1486267530,"In isolated rat adipocytes, epinephrine rapidly stimulates the transport of long chain fatty acid across the plasma membrane. At a concentration of unbound oleate of 0.1 microM ([fatty acid]/[albumin] = 1) and 5 min exposure to the hormone, the minimal effective concentration of epinephrine is 0.03 and the optimal concentration 0.3 microM (0.01 and 0.1 microgram/ml). The stimulated rates are 5-10-fold the basal rate of influx or efflux. The hormone effect is on the transport process specifically as shown by isolation of the product of transport in either direction as unesterified fatty acid and inhibition by the transport inhibitors phloretin and 4,4'-diisothiocyanostilbene-2,2'-disulfonic acid. This effect of epinephrine on transport coordinates physiologically with lipase activation to bring about fatty acid release from adipose tissue."
https://openalex.org/W1605705832,"Mannitol-1-phosphate dehydrogenase (EC 1.1.1.17) has been purified from Aspergillus parasiticus, a filamentous fungus which produces the polyketide mycotoxin, versicolorin A. Its kinetic properties have been compared with those of mannitol-1-phosphate dehydrogenase from the related non-toxin-producing fungus, A. niger. Both enzymes are inhibited by divalent transition metals, especially Zn2+ and Cd2+, but only the enzyme from A. parasiticus exhibits inhibitor-induced cooperative binding of the substrate, fructose-6 phosphate. Double reciprocal plots (1/v versus 1/Fru-6-P) are linear in the absence of Zn2+ but in the presence of Zn2+ are concave upward, with Hill coefficients of 1.5. The extent of cooperativity is inversely related to ionic strength, disappearing at 100 mM KCl. The enzymes from both organisms are relatively stable to incubation at 30 degrees C, but only the enzyme from A. parasiticus is rendered thermally unstable by the addition of divalent transition metals. A model is proposed to explain how binding of transition metal ions affects substrate binding and thermal stability of the enzyme."
https://openalex.org/W1496275808,"We report on the preparation, crystallization, and preliminary x-ray crystallographic study of the Fab fragments of two monoclonal anti-2-phenyloxazolone antibodies obtained from the secondary response to this hapten. The Fab fragment from one of these (NQ10/12.5) has been crystallized from polyethylene glycol 8000 solutions in a form suitable for high-resolution x-ray crystallographic studies. These crystals are monoclinic, space group C2, with a = 129.2 A, b = 79.4 A, c = 57.7 A, beta = 96.2 degrees, and one Fab/asymmetric unit. Determination of the three-dimensional structure of Fab NQ10/12.5 should help clarify the role of somatic mutation in the maturation of an immune response. This antibody and an anti-lysozyme antibody also under study apparently use the same germ-line encoded VK and a similar VH gene, respectively, as the idiotypic anti-oxazolone antibodies characteristic of the primary response. A comparative study of the two structures should shed light on the role of the pairing of heavy and light chains in the antigen-binding function of antibodies."
https://openalex.org/W1592105204,"Androgen receptors were attached covalently in situ to their nuclear acceptor sites with the contact site cross-linker, formaldehyde. Chromatin, prepared from sonicated nuclei of rat prostate, was labeled by isotope exchange with [3H]dihydrotestosterone and found to contain 19,000 +/- 900 (mean +/- S.E.) salt-extractable androgen receptors/nucleus which sedimented in the 3-4 S region of 7.6-76% (v/v) glycerol gradients and at a density of approximately 1.28-1.35 g/ml in CsCl gradients. After incubation of the chromatin with 0.5% (w/v) formaldehyde for 1 h at 4 degrees C, there was a 90% reduction in the concentration of free androgen receptors and an increase in the density of the androgen binding sites recovered from CsCl gradients. Extensive digestion of the cross-linked chromatin with micrococcal nuclease liberated 18% of the androgen receptors as 3-4 S entities and caused an overall decrease in the density of the receptor-acceptor complexes. Ribonuclease digestions had no effect on the androgen receptors cross-linked to chromatin. Mild digestion of the cross-linked preparations with trypsin, alone or in combination with micrococcal nuclease, resulted in the release of 74% and 97% of the androgen receptors, respectively. Together, these findings imply that two classes of receptor-acceptor complexes are present in prostatic chromatin--one, containing about 20% of the androgen receptors in which the receptors are in direct contact with DNA but not with proteins and the other, containing most of the androgen receptors in which the receptors are adjacent to acceptor proteins but not to DNA."
