id,abstract
https://openalex.org/W2042819884,"Fray is a serine/threonine kinase expressed by the peripheral glia of Drosophila, whose function is required for normal axonal ensheathment. Null fray mutants die early in larval development and have nerves with severe swelling and axonal defasciculation. The phenotype is associated with a failure of the ensheathing glia to correctly wrap peripheral axons. When the fray cDNA is expressed in the ensheathing glia of fray mutants, normal nerve morphology is restored. Fray belongs to a novel family of Ser/Thr kinases, the PF kinases, whose closest relatives are the PAK kinases. Rescue of the Drosophila mutant phenotype with PASK, the rat homolog of Fray, demonstrates a functional homology among these proteins and suggests that the Fray signaling pathway is widely conserved."
https://openalex.org/W2039103451,"Shc proteins possess SH2 and PTB domains and serve a scaffolding function in signaling by a variety of receptor tyrosine kinases. There are three known mammalian Shc genes, of which ShcB and ShcC are primarily expressed in the nervous system. We have generated null mutations in ShcB and ShcC and have obtained mice lacking either ShcB or ShcC or both gene products. ShcB-deficient animals exhibit a loss of peptidergic and nonpeptidergic nociceptive sensory neurons, which is not enhanced by additional loss of ShcC. Mice lacking both ShcB and ShcC exhibit a significant loss of neurons within the superior cervical ganglia, which is not observed in either mutant alone. The results indicate that these Shc family members possess both unique and overlapping functions in regulating neural development and suggest physiological roles for ShcB/ShcC in TrkA signaling."
https://openalex.org/W2016084984,"Pheromonal activation of the vomeronasal organ (VNO) elicits genetically preprogrammed behaviors and physiological changes in mammals. We have identified a novel gene family encoding over one hundred VNO specific receptors, the V3Rs. V3R sequences are highly similar to each other and appear distantly related to the putative pheromone receptors, V1Rs, and the taste receptors, T2Rs. Within the VNO, V3R-positive neurons are distinct from neurons expressing the pheromone receptor families V1R and V2R. The V3Rs are likely to represent a new large family of pheromone receptors in mammals. Multiple V3R-related human sequences have been identified, including one clone retaining the capacity to create a complete and functional transcript. Our data uncover a striking complexity in the molecular and cellular organization of the VNO and provide an essential framework for the study of pheromone signaling in mammals."
https://openalex.org/W1979057802,"We have shown that nitric oxide (NO) regulates c-fos gene expression via cGMP-dependent protein kinase (G-kinase), but NO's precise mechanism of action is unclear. We now demonstrate that: (1) NO targets two transcriptional elements in the fos promoter, i.e., the fos AP-1 binding site and the cAMP-response element (CRE); (2) NO activation of these two enhancer elements requires the CRE binding protein CREB because a dominant negative CREB fully inhibits NO transactivation of reporter genes whereas dominant negative Fos or CCAAT enhancer binding proteins have no effect; (3) CREB is phosphorylated by G-kinase in vitro and its phosphorylation increases in vivo when G-kinase is activated either directly by cGMP or indirectly by NO via soluble guanylate cyclase; (4) NO activation of fos promoter elements requires nuclear translocation of G-kinase but not activation of mitogen-activated protein kinases."
https://openalex.org/W2074989782,"The structure of the pore region of the alpha subunit of the bovine rod cyclic nucleotide-gated channel was probed using cysteine-scanning mutagenesis and hydrophilic sulfhydryl-reactive methanethiosulfonate (MTS) reagents. A region homologous to the pore helix in the X-ray crystal structure of the KcsA K(+) channel showed a helical pattern of reactivity with externally applied MTS reagents. Surprisingly, three out of four of the reactive residues, all on one face of the pore helix, only reacted with MTS reagents in the closed state. A residue on the opposite face of the helix only reacted with MTS reagents in the open state. These results indicate that the pore helix (or its surroundings) undergoes a change in conformation, perhaps involving a rotation around its long axis, that opens a gate localized to the selectivity filter of the channel."
https://openalex.org/W2043901673,"We have developed a variant of functional magnetic resonance imaging (fMRI) designed to be sensitive to static neuronal function. This method is based on resting instead of dynamic changes in oxygen-dependent signal and therefore allows for a spatial resolution that can detect signal from different hippocampal subregions in human subjects as well as in mice. We found that hippocampal signal was significantly diminished in elderly subjects with memory decline compared to age-matched controls, and different subjects showed dysfunction in different subregions. Among healthy elders, signal intensity from the subiculum was correlated selectively with memory performance. This method does not require an activation task; it can be used in anesthetized normal and in genetically modified and cognitively impaired mice. In mice the signal was found to be sufficiently sensitive to detect functional changes in the absence of underlying anatomical changes."
https://openalex.org/W1966987832,"Cell adhesion molecules (CAMs) implement the process of axon guidance by promoting specific selection and attachment to substrates. We show that, in Drosophila, loss-of-function conditions of either the Neuroglian CAM, the FGF receptor coded by the gene heartless, or the EGF receptor coded by DER display a similar phenotype of abnormal substrate selection and axon guidance by peripheral sensory neurons. Moreover, neuroglian loss-of-function phenotype can be suppressed by the expression of gain-of-function conditions of heartless or DER. The results are consistent with a scenario where the activity of these receptor tyrosine kinases is controlled by Neuroglian at choice points where sensory axons select between alternative substrates for extension."
https://openalex.org/W2021546905,
https://openalex.org/W2322220262,
https://openalex.org/W2318318177,"In a previous study, loss of heterozygosity (LOH) of 28 chromosome 9 microsatellite markers was assessed on 139 Ta/T1 bladder tumors. LOH at one or more loci was detected in 67 tumors, 62 presenting subchromosomal deletions. One hundred and thirty-three of these patients have now been followed for up to 8 years. The purpose of the present study was to evaluate the potential biological significance of chromosome 9 deletions in superficial bladder tumors at initial diagnosis. High grade was associated with LOH (P=0.004). Large tumors carried more frequently 9p deletions (P=0.022). Female patients had more chromosome 9q LOH than male patients did (P=0.010). Chromosome 9 LOH at all loci was associated with an elevated risk of recurrence but four regions were associated with a particularly high risk of recurrence. Multivariate analysis taking into account grade, stage, size and number of tumors showed that tumors deleted in the regions 9ptr-p22, 9q22.3, 9q33, and 9q34 recurred significantly more rapidly than those without deletions (Recurrence rate ratio=2.32, 2.53, 2.52 and 2.43 respectively). Log-rank statistics comparing Kaplan-Meier survival curves for the same chromosomal regions confirmed the correlation (P=0.0002, 0.010, 0.002 and 0.009 respectively). Only four patients progressed to muscle-invasive disease. They all had extensive deletions on 9q but none had deletions at 9ptr-p22. This study suggests a link between chromosome 9 anomalies and recurrence of superficial bladder cancer."
https://openalex.org/W2078790300,"PKC is activated on the cell membrane by phospholipids, thereby transducing signals to intracellular pathways. We provide here another function of PKC, namely, regulating cell cycle by interaction with the cyclin E/cdk2/p21 complex. Among the 10 isoforms of PKC, PKCη is predominantly expressed in squamous cell epithelia and induces terminal differentiation of keratinocytes. PKCη that is endogenously expressed or overexpressed was found to associate with the cyclin E/cdk2/p21 complex in keratinocytes of mice and humans. Requirement of a possible adaptor protein to the binding was suggested by the reconstitution of PKCη and the cyclin E/cdk2/p21 complex which were prepared from human keratinocytes or Sf9 insect cells. Colocalization of PKCη with cdk2 and cyclin E was observed in the cytoplasm, particularly in the perinuclear region. p21 was phosphorylated in the complex in a PKC-activator dependent manner. Association of PKCη with cdk2 resulted in marked inhibition of cdk2-kinase activity when measured by phosphorylation of Rb. Dominant negative PKCη associated with the cyclin E/cdk2/p21 complex, but caused a little inhibition of cdk2 kinase activity. Among the known regulatory mechanisms of cdk2 activity, dephosphorylation of Thr160 was demonstrated."
https://openalex.org/W2003595804,"Mechanisms by which chemotherapeutic agents induce apoptosis are not completely understood. Current knowledge of the actual pharmacologic effects of chemotherapy and their biochemical mechanisms are better understood than the downstream events, which initiate the apoptotic cascade. The chemotherapeutic agent cisplatin causes DNA damage and can induce apoptosis in several types of human cancers. We found the formation of previously unreported nuclear complexes between the tumor suppressor protein p53 and the pro-apoptotic protein Bax, in human melanoma cell lines induced into apoptosis following cisplatin exposure. These detergent resistant complexes were detected: after wild type (wt) p53 and Bax increased in the nucleus; at the same time when active cytoplasmic apoptosis related protease, caspase 3/CPP32 appeared; and prior to the detection of apoptotic DNA fragmentation. Three channel fluorescence laser scanning confocal image microscopy revealed that the nuclear Bax/p53 complexes remained in the nucleus and localized proximal to DNA fragmentation sites as assayed by TUNEL after cisplatin exposure. Two human melanoma cell lines, expressing wt p53, were induced into apoptosis after cisplatin exposure, however they differed in the timing of this induction. In both cell lines the formation of nuclear Bax/p53 co-immunoprecipitable complexes correlated with the timing of the induction of apoptosis. The degree of apoptosis induced by different concentrations of cisplatin correlated with the amount of nuclear Bax/p53 complexes. The co-immunoprecipitation of Bax and p53 was found regardless of the antibodies tested and was specific since Bcl-xL/p53 complexes were not detected. Additionally, the human prostate cancer cell line, LNCaP, also formed nuclear Bax/p53 complexes only after apoptosis was induced by paclitaxel."
https://openalex.org/W2064790766,
https://openalex.org/W1981780095,"Primates with long-standing therapeutic amputations of a limb at a young age were used to investigate the possibility that deefferented motor nerves sprout to new muscle targets. Injections of anatomical tracers into the muscles proximal to the amputated stump labeled a larger extent of motoneurons than matched injections on the intact side or in normal animals, including motoneurons that would normally supply only the missing limb muscles. Although the total numbers of distal limb motoneurons remained normal, some distal limb motoneurons on the amputated side were smaller in size and simpler in form. These results suggest that deprived motoneurons survive and retain function by reinnervating new muscle targets. The sprouted motor efferents may account for some of the reorganization of primary motor cortex that follows long-standing amputation."
https://openalex.org/W1971581466,
https://openalex.org/W2040601638,
https://openalex.org/W1999314540,"ErbB2 can be activated by its own overexpression or be transactivated by the heregulin polypeptide growth factor. Activation of ErbB2 leads to breast cancer cell proliferation, presumably by inducing the activation of extracellular signal-regulated kinases 1,2 (Erk1,2) and Akt. We have previously reported that the growth factor receptor bound protein-2 (Grb2) is required for the proliferation of ErbB2-overexpressing breast cancer cells. We investigated here whether Grb2 protein plays a role in heregulin-stimulated proliferation. Grb2 protein inhibition led to growth inhibition of heregulin-stimulated breast cancer cells, but not Erk1,2 inactivation. These findings are similar to our earlier observations in ErbB2-overexpressing cells. Since Akt can also be activated by heregulin, the effects of Grb2 inhibition on Akt were examined. Akt was inactivated following Grb2 downregulation in heregulin-stimulated breast cancer cells. We then examined the effects of Grb2 downregulation on Akt in ErbB2-overexpressing cells in the absence of heregulin. Similar to heregulin-stimulated cells, Grb2 inhibition also led to Akt inactivation in ErbB2-overexpressing breast cancer cells. Our results indicate that the activation of ErbB2 by heregulin or by its overexpression requires Grb2 to stimulate the Akt pathway to propagate mitogenic signals."
https://openalex.org/W2020084538,"GP125/CD98 is a heterodimeric 125-kDa glycoprotein, which consists of an 85-kDa heavy chain (hc) and a 40-kDa light chain (lc), and is strongly expressed on the cell surface of various tumor cells, irrespective of their tissue of origin. We have recently demonstrated that overexpression of the CD98hc cDNA causes malignant transformation of NIH3T3 cells. To investigate the function of the extracellular domain of CD98hc in cell proliferation and malignant transformation, we established two NIH3T3-derived clones transfected with human truncated CD98hc cDNAs, and compared their characteristics with parental NIH3T3 and clones transfected with full-length CD98hc cDNA. Truncated as well as full-length CD98hc-transfected clones grew to a higher saturation density than control cells. Efficiency of colony formation in soft agar was augmented in all CD98hc-transfected clones, and the degrees of augmented colony formation of the transfectants expressing full-length CD98hc of 529 a.a. or truncated CD98hc of 418 a.a. were reduced by anti-human CD98hc antibodies, while that of the transfectant expressing truncated CD98hc of 237 a.a. lacking the epitopes recognized by anti-human CD98hc antibodies was not affected by the addition of antibodies. CD98hc-transfected clones developed tumors in athymic mice, and tumor growth of truncated CD98hc-transfected clones was faster than that of full-length CD98hc-transfected clones."
https://openalex.org/W2328205394,"Polyomavirus large T-antigen (PyLT-Ag), a nucleophosphoprotein essential for regulating viral gene expression, modulates the cell cycle by binding to the Rb tumor suppressor gene product. PyLT-Ag/Rb binding is essential for in vitro immortalization. However, the effect of PyLT-Ag on apoptosis has not been extensively studied. We have previously reported that FasR agonist antibodies (FasR(Ab)) treatment of Sertoli cells derived from transgenic mice expressing PyLT-Ag induces the growth arrest of these cells without concomitant apoptosis. Here we show that stable expression of PyLT-Ag in murine Sertoli TM4 and hybridoma NSO cell lines confers protection from FasR(Ab)-induced apoptosis. The protection was maintained up to 48 h when cells were grown continuously in the presence of FasR(Ab). Removal of the death stimulus after 24 h exposure was sufficient to allow full recovery of the PyLT-Ag expressing cells. The protective effect conferred by PyLT-Ag was associated with a delay in the sequential activation of caspase-8 and -3 after FasR(Ab) treatment. PyLT-Ag co-precipitated following immunoprecipitation of caspase-8 or FADD, both components of the DISC. Based on these results we suggest that PyLT-Ag directly impedes the recruitment or activation of caspase-8 by the FasR. PyLT-Ag expression in TM4 cells was also associated with protection from TNF-alpha- and taxol-induced apoptosis. In contrast, PyLT-Ag expression was not sufficient to confer protection from captothecin-induced apoptosis. Taken together, these results indicate that PyLT-Ag can be a potent inhibitor of Fas(R)(Ab)-, TNF-alpha- and taxol-induced apoptosis."
https://openalex.org/W2104055072,
