id,abstract
https://openalex.org/W1882600323,"Eyelid opening stretches mechanoreceptors in the supratarsal Müller muscle to activate the proprioceptive fiber supplied by the trigeminal mesencephalic nucleus. This proprioception induces reflex contractions of the slow-twitch fibers in the levator palpebrae superioris and frontalis muscles to sustain eyelid and eyebrow positions against gravity. The cell bodies of the trigeminal proprioceptive neurons in the mesencephalon potentially make gap-junctional connections with the locus coeruleus neurons. The locus coeruleus is implicated in arousal and autonomic function. Due to the relationship between arousal, ventromedial prefrontal cortex, and skin conductance, we assessed whether upgaze with trigeminal proprioceptive evocation activates sympathetically innervated sweat glands and the ventromedial prefrontal cortex. Specifically, we examined whether 60° upgaze induces palmar sweating and hemodynamic changes in the prefrontal cortex in 16 subjects. Sweating was monitored using a thumb-mounted perspiration meter, and prefrontal cortex activity was measured with 45-channel, functional near-infrared spectroscopy (fNIRS) and 2-channel NIRS at Fp1 and Fp2. In 16 subjects, palmar sweating was induced by upgaze and decreased in response to downgaze. Upgaze activated the ventromedial prefrontal cortex with an accumulation of integrated concentration changes in deoxyhemoglobin, oxyhemoglobin, and total hemoglobin levels in 12 subjects. Upgaze phasically and degree-dependently increased deoxyhemoglobin level at Fp1 and Fp2, whereas downgaze phasically decreased it in 16 subjects. Unilateral anesthetization of mechanoreceptors in the supratarsal Müller muscle used to significantly reduce trigeminal proprioceptive evocation ipsilaterally impaired the increased deoxyhemoglobin level by 60° upgaze at Fp1 or Fp2 in 6 subjects. We concluded that upgaze with strong trigeminal proprioceptive evocation was sufficient to phasically activate sympathetically innervated sweat glands and appeared to induce rapid oxygen consumption in the ventromedial prefrontal cortex and to rapidly produce deoxyhemoglobin to regulate physiological arousal. Thus, eyelid opening with trigeminal proprioceptive evocation may activate the ventromedial prefrontal cortex via the mesencephalic trigeminal nucleus and locus coeruleus."
https://openalex.org/W1910107126,"How do the feedbacks between tectonics, sediment transport and climate work to shape the topographic evolution of the Earth? This question has been widely addressed via numerical models constrained with thermochronological and geomorphological data at scales ranging from local to orogenic. Here we present a novel numerical model that aims at reproducing the interaction between these processes at the continental scale. For this purpose, we combine in a single computer program: 1) a thin-sheet viscous model of continental deformation; 2) a stream-power surface-transport approach; 3) flexural isostasy allowing for the formation of large sedimentary foreland basins; and 4) an orographic precipitation model that reproduces basic climatic effects such as continentality and rain shadow. We quantify the feedbacks between these processes in a synthetic scenario inspired by the India-Asia collision and the growth of the Tibetan Plateau. We identify a feedback between erosion and crustal thickening leading locally to a <50% increase in deformation rates in places where orographic precipitation is concentrated. This climatically-enhanced deformation takes place preferentially at the upwind flank of the growing plateau, specially at the corners of the indenter (syntaxes). We hypothesize that this may provide clues for better understanding the mechanisms underlying the intriguing tectonic aneurisms documented in the Himalayas. At the continental scale, however, the overall distribution of topographic basins and ranges seems insensitive to climatic factors, despite these do have important, sometimes counterintuitive effects on the amount of sediments trapped within the continent. The dry climatic conditions that naturally develop in the interior of the continent, for example, trigger large intra-continental sediment trapping at basins similar to the Tarim Basin because they determine its endorheic/exorheic drainage. These complex climatic-drainage-tectonic interactions make the development of steady-state topography at the continental scale unlikely."
https://openalex.org/W1096260436,"Highly pathogenic avian influenza (HPAI) H5N1 is endemic in Vietnamese poultry and has caused sporadic human infection in Vietnam since 2003. Human infections with HPAI H5N1 are of concern due to a high mortality rate and the potential for the emergence of pandemic viruses with sustained human-to-human transmission. Viruses isolated from humans in southern Vietnam have been classified as clade 1 with a single genome constellation (VN3) since their earliest detection in 2003. This is consistent with detection of this clade/genotype in poultry viruses endemic to the Mekong River Delta and surrounding regions. Comparison of H5N1 viruses detected in humans from southern Vietnamese provinces during 2012 and 2013 revealed the emergence of a 2013 reassortant virus with clade 1.1.2 hemagglutinin (HA) and neuraminidase (NA) surface protein genes but internal genes derived from clade 2.3.2.1a viruses (A/Hubei/1/2010-like; VN12). Closer analysis revealed mutations in multiple genes of this novel genotype (referred to as VN49) previously associated with increased virulence in animal models and other markers of adaptation to mammalian hosts. Despite the changes identified between the 2012 and 2013 genotypes analyzed, their virulence in a ferret model was similar. Antigenically, the 2013 viruses were less cross-reactive with ferret antiserum produced to the clade 1 progenitor virus, A/Vietnam/1203/2004, but reacted with antiserum produced against a new clade 1.1.2 WHO candidate vaccine virus (A/Cambodia/W0526301/2012) with comparable hemagglutination inhibition titers as the homologous antigen. Together, these results indicate changes to both surface and internal protein genes of H5N1 viruses circulating in southern Vietnam compared to 2012 and earlier viruses."
https://openalex.org/W1875456436,"Reverse transcriptase-quantitative polymerase chain reaction (RT-qPCR) is a reliable technique for measuring and evaluating gene expression during variable biological processes. To facilitate gene expression studies, normalization of genes of interest relative to stable reference genes is crucial. The western flower thrips Frankliniella occidentalis (Pergande) (Thysanoptera: Thripidae), the main vector of tomato spotted wilt virus (TSWV), is a destructive invasive species. In this study, the expression profiles of 11 candidate reference genes from nonviruliferous and viruliferous F. occidentalis were investigated. Five distinct algorithms, geNorm, NormFinder, BestKeeper, the ΔCt method, and RefFinder, were used to determine the performance of these genes. geNorm, NormFinder, BestKeeper, and RefFinder identified heat shock protein 70 (HSP70), heat shock protein 60 (HSP60), elongation factor 1 α, and ribosomal protein l32 (RPL32) as the most stable reference genes, and the ΔCt method identified HSP60, HSP70, RPL32, and heat shock protein 90 as the most stable reference genes. Additionally, two reference genes were sufficient for reliable normalization in nonviruliferous and viruliferous F. occidentalis. This work provides a foundation for investigating the molecular mechanisms of TSWV and F. occidentalis interactions."
https://openalex.org/W1106153875,"Lung cancer is caused by combinations of diverse genetic mutations. Here, to understand the relevance of nuclear receptors (NRs) in the oncogene-associated lung cancer pathogenesis, we investigated the expression profile of the entire 48 NR members by using QPCR analysis in a panel of human bronchial epithelial cells (HBECs) that included precancerous and tumorigenic HBECs harboring oncogenic K-rasV12 and/or p53 alterations. The analysis of the profile revealed that oncogenic alterations accompanied transcriptional changes in the expression of 19 NRs in precancerous HBECs and 15 NRs according to the malignant progression of HBECs. Amongst these, peroxisome proliferator-activated receptor gamma (PPARγ), a NR chosen as a proof-of-principle study, showed increased expression in precancerous HBECs, which was surprisingly reversed when these HBECs acquired full in vivo tumorigenicity. Notably, PPARγ activation by thiazolidinedione (TZD) treatment reversed the increased expression of pro-inflammatory cyclooxygenase 2 (COX2) in precancerous HBECs. In fully tumorigenic HBECs with inducible expression of PPARγ, TZD treatments inhibited tumor cell growth, clonogenecity, and cell migration in a PPARγ-sumoylation dependent manner. Mechanistically, the sumoylation of liganded-PPARγ decreased COX2 expression and increased 15-hydroxyprostaglandin dehydrogenase expression. This suggests that ligand-mediated sumoylation of PPARγ plays an important role in lung cancer pathogenesis by modulating prostaglandin metabolism."
https://openalex.org/W1831247947,"Mechanisms enabling men to identify women likely to engage in extra-pair copulations (EPCs) would be advantageous in avoiding cuckoldry. Men’s judgments of female sexual faithfulness often show high consensus, but accuracy appears poor. We examined whether accuracy of these judgments made to images of women could be improved through i) employing a forced choice task, in which men were asked to select the more faithful of two women and/or ii) providing men with full person images. In Experiment 1, men rated 34 women, for whom we had self-reported EPC behavior, on faithfulness, trustworthiness or attractiveness from either face or full person photographs. They then completed a forced choice task, selecting the more faithful of two woman from 17 pairs of images, each containing one woman who had reported no EPCs and one who had reported two or more EPCs. Men were unable to rate faithfulness with any accuracy, replicating previous findings. However, when asked to choose the more faithful of two women, they performed significantly above chance, although the ability to judge faithfulness at above-chance levels did not generalize to all pairs of women. Although there was no significant difference in accuracy for face and full person image pairs, only judgments from faces were significantly above chance. In Experiment 2, we showed that this accuracy for faces was repeatable in a new sample of men. We also showed that individual variation in accuracy was unrelated to variation in preferences for faithfulness in a long-term partner. Overall, these results show that men’s judgments of faithfulness made from faces of unfamiliar women may contain a kernel of truth."
https://openalex.org/W1032632289,"Conflict can arise when bats roost in human dwellings and householders are affected adversely by their presence. In the United Kingdom, the exclusion of bats from roosts can be licensed under exceptional circumstances to alleviate conflict, but the fate of excluded bats and the impact on their survival and reproduction is not well understood. Using radio-tracking, we investigated the effects of exclusion on the soprano pipistrelle Pipistrellus pygmaeus, a species that commonly roosts in buildings in Europe. Exclusions were performed under licence at five roosts in England in spring, when females were in the early stages of pregnancy. Following exclusion, all bats found alternative roosts and colonies congregated in nearby known roosts that had been used by radio-tagged bats prior to exclusion. We found no difference in roosting behaviour before and after exclusion. Both the frequency of roost switching and the type of roosts used by bats remained unchanged. We also found no change in foraging behaviour. Bats foraged in the same areas, travelled similar distances to reach foraging areas and showed similar patterns of habitat selection before and after exclusion. Population modelling suggested that any reduction in survival following exclusion could have a negative impact on population growth, whereas a reduction in productivity would have less effect. While the number of soprano pipistrelle exclusions currently licensed each year is likely to have little effect on local populations, the cumulative impacts of licensing the destruction of large numbers of roosts may be of concern."
https://openalex.org/W1951444136,"An investigation of a questionable orchid led to the discovery of a new genus and species Thuniopsis cleistogama, endemic to Yunnan province, China. It is characterized by having a subglobose corm, a spike-like (racemose) inflorescence, half opened and spurless flowers, a collar-shaped stigma and subglobose capsules. Based on DNA sequence data from three gene regions (nuclear ribosomal ITS, chloroplast matK and trnL), we investigated its phylogenetic position within the tribe Arethuseae. Phylogenies using maximum likelihood and Bayesian inference support the recognition of Thuniopsis as a distinct genus, and suggest its close relationship to the genera Bletilla, Dilochia, and Thunia. The new genus is circumscribed and a description and illustrations of the new species are provided. The phylogenetic relationships among the genera in Arethuseae are accessed. Moreover, our phylogeny also shed light on the phylogenetic positions of several genera which, to date, remain uncertain."
https://openalex.org/W1950364966,"Moose (Alces americanus ) vehicle collisions (MVCs) are an issue throughout the distribution of moose. Many mitigation strategies have been tested and implemented to reduce the number of MVCs, but there have been few empirical analyses of the effectiveness of roadside vegetation cutting. The goal of this study was to determine if roadside vegetation cutting attracted moose into roadside areas to browse on the vegetation regrowth. We hypothesized that moose would be attracted to roadside areas with cut vegetation. Consequently, we predicted that there would be higher levels of browsing in cut areas compared to uncut areas. To determine if moose were browsing more in cut or uncut areas, we measured the number of plants browsed by moose in paired treatment (cut on or after 2008) and control (not cut since at least 2008) sites, along with a suite of potential environmental covariates. Using a model selection approach, we fit generalized linear mixed-effects models to determine the most parsimonious set of environmental variables to explain variation in the proportion of moose browse among sites. In contrast to our hypothesis, our results show that the proportion of moose browse in the uncut control areas was significantly higher than in the cut treatment areas. The results of this study suggest that recently cut roadside areas (7 years or less based on our work) may create a less attractive foraging habitat for moose. The majority of the variance in the proportion of moose browse among sites was explained by treatment type and nested plot number within site identification (34.16%), with additional variance explained by traffic region (5.00%) and moose density (4.35%). Based on our study, we recommend that vegetation cutting be continued in roadside areas in Newfoundland as recently cut areas may be less attractive browsing sites for moose."
https://openalex.org/W2263375418,"The swelling that occurs in uranium dioxide as a result of radiation-induced defect ingrowth is not fully understood. Experimental and theoretical groups have attempted to explain this phenomenon with various complex theories. In this study, experimental lattice expansion and lattice super saturation were accurately reproduced using a molecular dynamics simulation method. Based on their resemblance to experimental data, the simulation results presented here show that fission induces only oxygen Frenkel pairs while alpha particle irradiation results in both oxygen and uranium Frenkel pair defects. Moreover, in this work, defects are divided into two sub-groups, obstruction type defects and distortion type defects. It is shown that obstruction type Frenkel pairs are responsible for both fission- and alpha-particle-induced lattice swelling. Relative lattice expansion was found to vary linearly with the number of obstruction type uranium Frenkel defects. Additionally, at high concentrations, some of the obstruction type uranium Frenkel pairs formed diatomic and triatomic structures with oxygen ions in their octahedral cages, increasing the slope of the linear dependence."
https://openalex.org/W1927288480,"Experimental models implicate protease activated receptors (PARs) as important sensors of the proteolytic tumor microenvironment during breast cancer development. However, the role of the major PARs, PAR-1 and PAR-2, in human breast tumors remains to be elucidated. Here, we have investigated how PAR-1 and PAR-2 protein expression correlate with established clinicopathological variables and patient outcome in a well-characterized cohort of 221 breast cancer patients. Univariable and multivariable hazard ratios (HR) were estimated by the Cox proportional hazards model, distant disease-free survival (DDFS) and overall survival by the Kaplan-Meier method, and survival in different strata was determined by the log-rank test. Associations between PARs and clinicopathological variables were analyzed using Pearson's χ2-test. We find that PAR-2 associates with DDFS (HR = 3.1, P = 0.003), whereas no such association was found with PAR-1 (HR = 1.2, P = 0.6). Interestingly, the effect of PAR-2 was confined to the ER-positive sub-group (HR = 5.5, P = 0.003 vs. HR = 1.2 in ER-negative; P = 0.045 for differential effect), and PAR-2 was an independent prognostic factor specifically in ER-positive tumors (HR = 3.9, P = 0.045). On the contrary, PAR-1 correlated with worse prognosis specifically in the ER-negative group (HR = 2.6, P = 0.069 vs. HR = 0.5, P = 0.19 in ER-positive; P = 0.026 for differential effect). This study provides novel insight into the respective roles of PAR-1 and PAR-2 in human breast cancer and suggests a hitherto unknown association between PARs and ER signaling that warrants further investigation."
https://openalex.org/W1956086079,"Rapid reduction of anthropogenic greenhouse gas emissions is required to mitigate disastrous impacts of climate change. The Kyoto Protocol introduced international emissions trading (IET) to accelerate the reduction of carbon dioxide (CO2) emissions. The IET controls CO2 emissions through the allocation of marketable emission permits to sovereign countries. The costs for acquiring additional permits provide buyers with an incentive to reduce their CO2 emissions. However, permit price has declined to a low level during the first commitment period (CP1). The downward trend in permit price is attributed to deficiencies of the Kyoto Protocol: weak compliance enforcement, the generous allocation of permits to transition economies (hot air), and the withdrawal of the US. These deficiencies created a buyer's market dominated by price-making buyers. In this paper, I develop a coalitional game of the IET, and demonstrate that permit buyers have dominant bargaining power. In my model, called cooperative emissions trading (CET) game, a buyer purchases permits from sellers only if the buyer forms a coalition with the sellers. Permit price is determined by bargaining among the coalition members. I evaluated the demand-side and supply-side bargaining power (DBP and SBP) using Shapley value, and obtained the following results: (1) Permit price is given by the product of the buyer's willingness-to-pay and the SBP (= 1 - DBP). (2) The DBP is greater than or equal to the SBP. These results indicate that buyers can suppress permit price to low levels through bargaining. The deficiencies of the Kyoto Protocol enhance the DBP, and contribute to the demand-side dominance in the international permit market."
https://openalex.org/W1812020060,"Pre-therapeutic pathological diagnosis is a crucial step of the management of pulmonary nodules suspected of being non small cell lung cancer (NSCLC), especially in the frame of currently implemented lung cancer screening programs in high-risk patients. Based on a human ex vivo model, we hypothesized that an embedded device measuring endogenous fluorescence would be able to distinguish pulmonary malignant lesions from the perilesional lung tissue.Consecutive patients who underwent surgical resection of pulmonary lesions were included in this prospective and observational study over an 8-month period. Measurements were performed back table on surgical specimens in the operative room, both on suspicious lesions and the perilesional healthy parenchyma. Endogenous fluorescence signal was characterized according to three criteria: maximal intensity (Imax), wavelength, and shape of the signal (missing, stable, instable, photobleaching).Ninety-six patients with 111 suspicious lesions were included. Final pathological diagnoses were: primary lung cancers (n = 60), lung metastases of extra-thoracic malignancies (n = 27) and non-tumoral lesions (n = 24). Mean Imax was significantly higher in NSCLC targeted lesions when compared to the perilesional lung parenchyma (p<0,0001) or non-tumoral lesions (p<0,0001). Similarly, photobleaching was more frequently found in NSCLC than in perilesional lung (p<0,0001), or in non-tumoral lesions (p<0,001). Respective associated wavelengths were not statistically different between perilesional lung and either primary lung cancers or non-tumoral lesions. Considering lung metastases, both mean Imax and wavelength of the targeted lesions were not different from those of the perilesional lung tissue. In contrast, photobleaching was significantly more frequently observed in the targeted lesions than in the perilesional lung (p≤0,01).Our results demonstrate that endogenous fluorescence applied to the diagnosis of lung nodules allows distinguishing NSCLC from the surrounding healthy parenchyma and from non-tumoral lesions. Inconclusive results were found for lung metastases due to the heterogeneity of this population."
https://openalex.org/W2178132536,"Thermal effects such as conduction, convection and viscous dissipation are important to lubrication performance, and they vary with the friction conditions. These variations have caused some inconsistencies in the conclusions of different researchers regarding the relative contributions of these thermal effects. To reveal the relationship between the contributions of the thermal effects and the friction conditions, a steady-state THD analysis model was presented. The results indicate that the contribution of each thermal effect sharply varies with the Reynolds number and temperature. Convective effect could be dominant under certain conditions. Additionally, the accuracy of some simplified methods of thermo-hydrodynamic analysis is further discussed."
https://openalex.org/W2244725246,"We have previously demonstrated that hair follicles contain nestin-expressing pluripotent stem cells that can effect nerve and spinal cord repair upon transplantation. In the present study, isolated whisker follicles from nestin-driven green fluorescent protein (ND-GFP) mice were histocultured on Gelfoam for 3 weeks for the purpose of transplantation to the spinal cord to heal an induced injury. The hair shaft was cut off from Gelfoam-histocultured whisker follicles, and the remaining part of the whisker follicles containing GFP-nestin expressing pluripotent stem cells were transplanted into the injured spinal cord of nude mice, along with the Gelfoam. After 90 days, the mice were sacrificed and the spinal cord lesion was observed to have healed. ND-GFP expression was intense at the healed area of the spinal cord, as observed by fluorescence microscopy, demonstrating that the hair follicle stem cells were involved in healing the spinal cord. Unexpectedly, the transplanted whisker follicles sprouted out remarkably long hair shafts in the spinal cord during the 90 days after transplantation of Gelfoam whisker histocultures to the injured spine. The pigmented hair fibers, grown from the transplanted whisker histocultures, curved and enclosed the spinal cord. The unanticipated results demonstrate the great potential of hair growth after transplantation of Gelfoam hair follicle histocultures, even at an ectopic site."
