id,abstract
https://openalex.org/W2034906407,"The enormous sequence diversity of HIV remains a major roadblock to the development of a prophylactic vaccine and new approaches to induce protective immunity are needed. Endogenous retrotransposable elements (ERE) such as endogenous retrovirus K (ERV)-K and long interspersed nuclear element-1 (LINE-1) are activated during HIV-1-infection and could represent stable, surrogate targets to eliminate HIV-1-infected cells. Here, we explored the hypothesis that vaccination against ERE would protect macaques from acquisition and replication of simian immunodeficiency virus (SIV). Following vaccination with antigens derived from LINE-1 and ERV-K consensus sequences, animals mounted immune responses that failed to delay acquisition of SIVsmE660. We observed no differences in acute or set point viral loads between ERE-vaccinated and control animals suggesting that ERE-specific responses were not protective. Indeed, ERE-specific T cells failed to expand anamnestically in vivo following infection with SIVsmE660 and did not recognize SIV-infected targets in vitro, in agreement with no significant induction of targeted ERE mRNA by SIV in macaque CD4+ T cells. Instead, lower infection rates and viral loads correlated significantly to protective TRIM5α alleles. Cumulatively, these data demonstrate that vaccination against the selected ERE consensus sequences in macaques did not lead to immune-mediated recognition and killing of SIV-infected cells, as has been shown for HIV-infected human cells using patient-derived HERV-K-specific T cells. Thus, further research is required to identify the specific nonhuman primate EREs and retroviruses that recapitulate the activity of HIV-1 in human cells. These results also highlight the complexity in translating observations of the interplay between HIV-1 and human EREs to animal models."
https://openalex.org/W2057472598,"Chagas disease develops upon infection with the protozoan parasite Trypanosoma cruzi and undergoes an acute phase characterized by massive parasite replication and the presence of parasites in the blood. This condition is known as acute phase parasitemia. This initial stage may result in a cure, in the development of the chronic stages of the disease or in the death of the infected host. Despite intensive investigation related to the characterization of the acute and chronic phases of the disease, the cause-effect relationship of acute phase parasitemia to the outcome of the disease is still poorly understood. In this study, we artificially generated a heterogeneously controlled mouse population by intercrossing F1 mice obtained from a parental breeding of highly susceptible A/J with highly resistant C57BL/6 mouse strains. This F2 population was infected and used to assess the correlation of acute phase parasitemia with the longevity of the animals. We used nonparametric statistical analyses and found a significant association between parasitemia and mortality. If males and females were evaluated separately, we found that the former were more susceptible to death, although parasitemia was similar in males and females. In females, we found a strong negative correlation between parasitemia and longevity. In males, however, additional factors independent of parasitemia may favor mouse mortality during the development of the disease. The correlations of acute phase parasitemia with mortality reported in this study may facilitate an appropriate prognostic approach to the disease in humans. Moreover, these results illustrate the complexity of the mammalian genetic traits that regulate host resistance during Chagas disease."
https://openalex.org/W2027580492,"To further understand the pharmacological properties of N-oleoylethanolamine (OEA), a naturally occurring lipid that activates peroxisome proliferator-activated receptor alpha (PPARα), we designed sulfamoyl analogs based on its structure. Among the compounds tested, N-octadecyl-N'-propylsulfamide (CC7) was selected for functional comparison with OEA. The performed studies include the following computational and biological approaches: 1) molecular docking analyses; 2) molecular biology studies with PPARα; 3) pharmacological studies on feeding behavior and visceral analgesia. For the docking studies, we compared OEA and CC7 data with crystallization data obtained with the reference PPARα agonist GW409544. OEA and CC7 interacted with the ligand-binding domain of PPARα in a similar manner to GW409544. Both compounds produced similar transcriptional activation by in vitro assays, including the GST pull-down assay and reporter gene analysis. In addition, CC7 and OEA induced the mRNA expression of CPT1a in HpeG2 cells through PPARα and the induction was avoided with PPARα-specific siRNA. In vivo studies in rats showed that OEA and CC7 had anorectic and antiobesity activity and induced both lipopenia and decreases in hepatic fat content. However, different effects were observed when measuring visceral pain; OEA produced visceral analgesia whereas CC7 showed no effects. These results suggest that OEA activity on the PPARα receptor (e.g., lipid metabolism and feeding behavior) may be dissociated from other actions at alternative targets (e.g., pain) because other non cannabimimetic ligands that interact with PPARα, such as CC7, do not reproduce the full spectrum of the pharmacological activity of OEA. These results provide new opportunities for the development of specific PPARα-activating drugs focused on sulfamide derivatives with a long alkyl chain for the treatment of metabolic dysfunction."
https://openalex.org/W2093020037,"Background Systemic thrombolysis in acute ischemic stroke is restricted to the 4.5 h time window. Many patients are excluded from this treatment because symptom onset is unknown. Magnetic resonance imaging (MRI) studies have shown that stroke patients presenting with acute supra-tentorial diffusion-weighted imaging (DWI) lesions that do not have matching lesions on fluid attenuated inversion recovery (FLAIR) are likely to be within a 4.5 hour time window. This study examines the DWI-FLAIR mismatch in infra-tentorial stroke. Methods This was a retrospectively conducted substudy of the “1000+” study; a prospective, single-center observational study (http://clinicaltrials.gov; NCT00715533). Fifty-six patients with infra-tentorial stroke confirmed by MRI and known symptom onset who underwent the scan within 24 h after symptom onset were analysed. Two neurologists blinded to clinical information separately rated the DWI lesion visibility on FLAIR. Lesion volume, relative signal intensities of DWI and relative apparent diffusion coefficient values were determined. Results Regarding baseline characteristics our study population had a median age of 66 years, a median time from symptom onset to MRI of 616.5 minutes, a median NIHSS of 3 and a median DWI lesion volume of 0.26 ml. A negative FLAIR allocated patients to a time window under 4.5 h correctly with a sensitivity of 55% and a specificity of 61%, a positive predictive value of 44% and a negative predictive value of 71%. FLAIR positivity decreased with age (p = 0.018), and showed no significant correlation to lesion volume (p = 0.145). Conclusions In our study the DWI-FLAIR-Mismatch does not help to reliably identify patients within 4.5 h of symptom onset in acute ischemic infra-tentorial stroke. Thus therapeutical decisions based on the DWI-FLAIR mismatch estimation of time from onset cannot be recommended in patients with infra-tentorial stroke."
https://openalex.org/W2089178971,"Enterovirus A71 (EV-A71) has recently become an important public health threat, especially in South-East Asia, where it has caused massive outbreaks of Hand, Foot and Mouth disease every year, resulting in significant mortality. Rapid detection of EV-A71 early in outbreaks would facilitate implementation of prevention and control measures to limit spread. Real-time RT-PCR is the technique of choice for the rapid diagnosis of EV-A71 infection and several systems have been developed to detect circulating strains. Although eight genogroups have been described globally, none of these PCR techniques detect all eight. We describe, for the first time, a SYBR Green real-time RT-PCR system validated to detect all 8 EV-A71 genogroups. This tool could permit the early detection and shift in genogroup circulation and the standardization of HFMD virological diagnosis, facilitating networking of laboratories working on EV-A71 in different regions."
https://openalex.org/W1980838903,"Liver transplantation for hepatocellular carcinoma (HCC) results in a specific condition where the immune response is potentially directed against both allogeneic and cancer antigens. We have investigated the level of anti-cancer immunity during allogeneic immune response. Dark Agouti-to-Lewis and Lewis-to-Lewis rat liver transplantations were performed and the recipients anti-cancer immunity was analysed at the time of alloimmune activation. The occurrence of rejection in the allogeneic recipients was confirmed by a shorter survival (p<0.01), increased liver function tests (p<0.01), the presence of signs of rejection on histology, and a donor-specific ex vivo mixed lymphocyte reaction. At the time of alloimmune activation, blood mononuclear cells of the allogeneic group demonstrated increased anti-cancer cytotoxicity (p<0.005), which was related to an increased natural killer (NK) cell frequency (p<0.05) and a higher monocyte/macrophage activation level (p<0.01). Similarly, liver NK cell anti-cancer cytotoxicity (p<0.005), and liver monocyte/macrophage activation levels (p<0.01) were also increased. The alloimmune-associated cytotoxicity was mediated through the NKG2D receptor, whose expression was increased in the rejected graft (p<0.05) and on NK cells and monocyte/macrophages. NKG2D ligands were expressed on rat HCC cells, and its inhibition prevented the alloimmune-associated cytotoxicity. Although waiting for in vivo validation, alloimmune-associated cytotoxicity after rat liver transplantation appears to be linked to increased frequencies and levels of activation of NK cells and monocyte/macrophages, and is at least in part mediated through the NKG2D receptor."
