id,abstract
https://openalex.org/W2134562578,"The PAH1-encoded phosphatidate (PA) phosphatase in Saccharomyces cerevisiae is a pivotal enzyme that produces diacylglycerol for the synthesis of triacylglycerol (TAG) and simultaneously controls the level of PA used for phospholipid synthesis. Quantitative lipid analysis showed that the pah1Δ mutation caused a reduction in TAG mass and an elevation in the mass of phospholipids and free fatty acids, changes that were more pronounced in the stationary phase. The levels of unsaturated fatty acids in the pah1Δ mutant were unaltered, although the ratio of palmitoleic acid to oleic acid was increased with a similar change in the fatty acid composition of phospholipids. The pah1Δ mutant exhibited classic hallmarks of apoptosis in stationary phase and a marked reduction in the quantity of cytoplasmic lipid droplets. Cells lacking PA phosphatase were sensitive to exogenous fatty acids in the order of toxicity palmitoleic acid > oleic acid > palmitic acid. In contrast, the growth of wild type cells was not inhibited by fatty acid supplementation. In addition, wild type cells supplemented with palmitoleic acid exhibited an induction in PA phosphatase activity and an increase in TAG synthesis. Deletion of the DGK1-encoded diacylglycerol kinase, which counteracts PA phosphatase in controlling PA content, suppressed the defect in lipid droplet formation in the pah1Δ mutant. However, the sensitivity of the pah1Δ mutant to palmitoleic acid was not rescued by the dgk1Δ mutation. Overall, these findings indicate a key role of PA phosphatase in TAG synthesis for protection against fatty acid-induced toxicity."
https://openalex.org/W2021395106,"Six1 is a critical regulator of embryonic development that requires interaction with the Eya family of proteins (Eya1-4) to activate the transcription of genes involved in neurogenesis, myogenesis and nephrogenesis. Although expression of Six1 and Eya family members is predominantly observed in development, their overexpression is observed in numerous cancers. Importantly, both Six1 and Eya have independently been shown to mediate breast cancer metastasis, but whether they functionally interact during tumor progression has not been explored. Herein, we demonstrate that knockdown of Eya2 in MCF7 mammary carcinoma cells reverses the ability of Six1 to induce transforming growth factor-β signaling, as well as to induce characteristics associated with epithelial–mesenchymal transition and cancer stem cells, suggesting that Six1 is dependent on Eya2 to mediate numerous pro-metastatic characteristics. The importance of the Six1–Eya interaction in human breast cancer is underscored by the finding that high levels of Six1 correlate with shortened time to relapse and metastasis as well as decreased survival only when co-expressed with high levels of Eya2. Overall, these data implicate Eya2 as a necessary co-factor for many of the metastasis promoting functions of Six1, suggesting that targeting the Six1–Eya interaction may inhibit breast cancer progression. As Six1 and Eya2 are not highly expressed in most adult tissues, the Six1–Eya interaction may be a valuable future therapeutic target whose inhibition would be expected to impair breast cancer progression while conferring limited side effects."
https://openalex.org/W2073973669,"Tumor endothelial markers (TEMs) that are highly expressed in human tumor vasculature compared with vasculature in normal tissue hold clear therapeutic potential. We report that the C-type lectin CLEC14A is a novel TEM. Immunohistochemical and immunofluorescence staining of tissue arrays has shown that CLEC14A is strongly expressed in tumor vasculature when compared with vessels in normal tissue. CLEC14A overexpression in tumor vessels was seen in a wide range of solid tumor types. Functional studies showed that CLEC14A induces filopodia and facilitates endothelial migration, tube formation and vascular development in zebrafish that is, CLEC14A regulates pro-angiogenic phenotypes. CLEC14A antisera inhibited cell migration and tube formation, suggesting that anti-CLEC14A antibodies may have anti-angiogenic activity. Finally, in endothelial cultures, expression of CLEC14A increased at low shear stress, and we hypothesize that low shear stress due to poor blood flow in the disorganized tumor vasculature induces expression of CLEC14A on tumor vessels and pro-angiogenic phenotypes."
https://openalex.org/W2073580257,"Loss of E-cadherin is associated with acquisition of metastatic capacity. Numerous studies suggest that histone deacetylation and/or hypermethylation of CpG islands in E-cadherin gene (CDH1) are major mechanisms responsible for E-cadherin silencing in different tumors and cancer cell lines. The hepatitis B virus (HBV)-encoded X antigen, HBx, contributes importantly to the development of hepatocellular carcinoma using multiple mechanisms. Experiments were designed to test if in addition to CDH1 hypermethylation HBx promotes epigenetic modulation of E-cadherin transcriptional activity through histone deacetylation and miR-373. The relationships between HBx, E-cadherin, mSin3A, Snail-1 and miR-373 were evaluated in HBx expressing (HepG2X) and control (HepG2CAT) cells by western blotting, immunoprecipitation (IP), chromatin IP as well as by immunohistochemical staining of liver and tumor tissue sections from HBV-infected patients. In HepG2X cells, decreased levels of E-cadherin and elevated levels of mSin3A and Snail-1 were detected. Reciprocal IP with anti-HBx and anti-mSin3A demonstrated mutual binding. Furthermore, HBx–mSin3A colocalization was detected by immunofluorescent staining. HBx downregulated E-cadherin expression by the recruitment of the mSin3A/histone deacetylase complex to the Snail-binding sites in human CDH1. Histone deacetylation inhibition by Trichostatin-A treatment restored E-cadherin expression. Mir-373, a positive regulator of E-cadherin expression, was downregulated by HBx in HepG2X cells and tissue sections from HBV-infected patients. Thus, histone deacetylation of CDH1 and downregulation of miR-373, together with the previously demonstrated hypermethylation of CDH1 by HBx, may be important for the understanding of HBV-related carcinogenesis."
https://openalex.org/W1995763372,"Co-repressor histone deacetylase 9 (HDAC9) plays a key role in the development and differentiation of many types of cells, including regulatory T cells. However, the biological function of HDAC9 in T effector cells is unknown. Systemic autoimmune diseases like lupus, diabetes, and rheumatoid arthritis have dysfunctional effector T cells. To determine the role of HDAC9 in systemic autoimmunity, we created MRL/lpr mice with HDAC9 deficiency that have aberrant effector T cell function. HDAC9 deficiency led to decreased lympho-proliferation, inflammation, autoantibody production, and increased survival in MRL/lpr mice. HDAC9-deficient mice manifested Th2 polarization, decreased T effector follicular cells positive for inducible co-stimulator, and activated T cells in vivo compared with HDAC9-intact MRL/lpr mice. HDAC9 deficiency also resulted in increased GATA3 and roquin and decreased BCL6 gene expression. HDAC9 deficiency was associated with increased site-specific lysine histone acetylation at H3 (H3K9, H3K14, and H3K18) globally that was localized to IL-4, roquin, and peroxisome proliferator-activated receptor-γ promoters with increased gene expression, respectively. In kidney and spleen, HDAC9 deficiency decreased inflammation and cytokine and chemokine production due to peroxisome proliferator-activated receptor γ overexpression. These findings suggest that HDAC9 acts as an epigenetic switch in effector T cell-mediated systemic autoimmunity. Co-repressor histone deacetylase 9 (HDAC9) plays a key role in the development and differentiation of many types of cells, including regulatory T cells. However, the biological function of HDAC9 in T effector cells is unknown. Systemic autoimmune diseases like lupus, diabetes, and rheumatoid arthritis have dysfunctional effector T cells. To determine the role of HDAC9 in systemic autoimmunity, we created MRL/lpr mice with HDAC9 deficiency that have aberrant effector T cell function. HDAC9 deficiency led to decreased lympho-proliferation, inflammation, autoantibody production, and increased survival in MRL/lpr mice. HDAC9-deficient mice manifested Th2 polarization, decreased T effector follicular cells positive for inducible co-stimulator, and activated T cells in vivo compared with HDAC9-intact MRL/lpr mice. HDAC9 deficiency also resulted in increased GATA3 and roquin and decreased BCL6 gene expression. HDAC9 deficiency was associated with increased site-specific lysine histone acetylation at H3 (H3K9, H3K14, and H3K18) globally that was localized to IL-4, roquin, and peroxisome proliferator-activated receptor-γ promoters with increased gene expression, respectively. In kidney and spleen, HDAC9 deficiency decreased inflammation and cytokine and chemokine production due to peroxisome proliferator-activated receptor γ overexpression. These findings suggest that HDAC9 acts as an epigenetic switch in effector T cell-mediated systemic autoimmunity."
https://openalex.org/W2089496934,"Resveratrol, a naturally occurring phytoalexin, is known to induce apoptosis in multiple cancer cell types, but the underlying molecular mechanisms remain unclear. Here, we show that resveratrol induced p53-independent, X-linked inhibitor of apoptosis protein (XIAP)-mediated translocation of Bax to mitochondria where it underwent oligomerization to initiate apoptosis. Resveratrol treatment promoted interaction between Bax and XIAP in the cytosol and on mitochondria, suggesting that XIAP plays a critical role in the activation and translocation of Bax to mitochondria. This process did not involve p53 but required accumulation of Bim and t-Bid on mitochondria. Bax primarily underwent homo-oligomerization on mitochondria and played a major role in release of cytochrome c to the cytosol. Bak, another key protein that regulates the mitochondrial membrane permeabilization, did not interact with p53 but continued to associate with Bcl-xL. Thus, the proapoptotic function of Bak remained suppressed during resveratrol-induced apoptosis. Caspase-9 silencing inhibited resveratrol-induced caspase activation, whereas caspase-8 knockdown did not affect caspase activity, suggesting that resveratrol induces caspase-9-dependent apoptosis. Together, our findings characterize the molecular mechanisms of resveratrol-induced caspase activation and subsequent apoptosis in cancer cells."
https://openalex.org/W1971032467,"The ROP5 family is a closely related set of polymorphic pseudokinases that are critical to the ability of Toxoplasma to cause disease. Polymorphisms in ROP5 also make it a major determinant of strain-specific differences in virulence. ROP5 possesses all of the major kinase motifs required for catalysis except for a substitution at the catalytic Asp. We show that this substitution in the catalytic loop of ROP5 is part of a motif conserved in other pseudokinases of both Toxoplasma and human origin, and that this motif is required for the full activity in vivo of ROP5. This suggests evolutionary selection at this site for a biochemical function, rather than simple drift away from catalysis. We present the crystal structures of a virulent isoform of ROP5 both in its ATP-bound and -unbound states and have demonstrated that despite maintaining the canonical ATP-binding motifs, ROP5 binds ATP in a distorted conformation mediated by unusual magnesium coordination sites that would not be predicted from the primary sequence. In addition, we have mapped the polymorphisms spread throughout the primary sequence of ROP5 to two major surfaces, including the activation segment of ROP5. This suggests that the pseudoactive site of this class of pseudokinases may have evolved to use the canonical ATP-binding motifs for non-catalytic signaling through allostery."
https://openalex.org/W2013997037,"LKB1 is a tumor susceptibility gene for the Peutz-Jeghers cancer syndrome and is a target for mutational inactivation in sporadic human malignancies. LKB1 encodes a serine/threonine kinase that has critical roles in cell growth, polarity and metabolism. A novel and important function of LKB1 is its ability to regulate the phosphorylation of CREB-regulated transcription co-activators (CRTCs) whose aberrant activation is linked with oncogenic activities. However, the roles and mechanisms of LKB1 and CRTC in the pathogenesis of esophageal cancer have not been previously investigated. In this study, we observed altered LKB1-CRTC signaling in a subset of human esophageal cancer cell lines and patient samples. LKB1 negatively regulates esophageal cancer cell migration and invasion in vitro. Mechanistically, we determined that CRTC signaling becomes activated because of LKB1 loss, which results in the transcriptional activation of specific downstream targets including LYPD3, a critical mediator for LKB1 loss-of-function. Our data indicate that de-regulated LKB1-CRTC signaling might represent a crucial mechanism for esophageal cancer progression."
https://openalex.org/W1981888168,"Plutonium is a toxic synthetic element with no natural biological function, but it is strongly retained by humans when ingested. Using small-angle X-ray scattering, receptor binding assays and synchrotron X-ray fluorescence microscopy, we find that rat adrenal gland (PC12) cells can acquire plutonium in vitro through the major iron acquisition pathway--receptor-mediated endocytosis of the iron transport protein serum transferrin; however, only one form of the plutonium-transferrin complex is active. Low-resolution solution models of plutonium-loaded transferrins derived from small-angle scattering show that only transferrin with plutonium bound in the protein's C-terminal lobe (C-lobe) and iron bound in the N-terminal lobe (N-lobe) (Pu(C)Fe(N)Tf) adopts the proper conformation for recognition by the transferrin receptor protein. Although the metal-binding site in each lobe contains the same donors in the same configuration and both lobes are similar, the differences between transferrin's two lobes act to restrict, but not eliminate, cellular Pu uptake."
https://openalex.org/W2088012829,"Transcription factor RUNX3 is inactivated in a number of malignancies, including breast cancer, and is suggested to function as a tumor suppressor. How RUNX3 functions as a tumor suppressor in breast cancer remains undefined. Here, we show that about 20% of female Runx3+/− mice spontaneously developed ductal carcinoma at an average age of 14.5 months. Additionally, RUNX3 inhibits the estrogen-dependent proliferation and transformation potential of ERα-positive MCF-7 breast cancer cells in liquid culture and in soft agar and suppresses the tumorigenicity of MCF-7 cells in severe combined immunodeficiency mice. Furthermore, RUNX3 inhibits ERα-dependent transactivation by reducing the stability of ERα. Consistent with its ability to regulate the levels of ERα, expression of RUNX3 inversely correlates with the expression of ERα in breast cancer cell lines, human breast cancer tissues and Runx3+/− mouse mammary tumors. By destabilizing ERα, RUNX3 acts as a novel tumor suppressor in breast cancer."
https://openalex.org/W2054948499,"Semaphorins are implicated in glioma progression, although little is known about the underlying mechanisms. We have reported plexin-B3 expression in human gliomas, which upon stimulation by Sema5A causes significant inhibition of cell migration and invasion. The concomitant inactivation of Rac1 is of mechanistic importance because forced expression of constitutively active Rac1 abolishes these inhibitory effects. Furthermore, Sema5A induces prominent cell collapse and ramification of processes reminiscent of astrocytic morphology, which temporally associate with extensive disassembly of actin stress fibers and disruption of focal adhesions, followed by accumulation of actin patches in protrusions. Mechanistically, Sema5A induces transient protein kinase C (PKC) phosphorylation of fascin-1, which can reduce its actin-binding/bundling activities and temporally parallels its translocation from cell body to extending processes. PKC inhibition or fascin-1 knockdown is sufficient to abrogate Sema5A-induced morphological differentiation, whereas the process is hastened by forced expression of fascin-1. Intriguingly, Sema5A induces re-expression of glial fibrillary acidic protein (GFAP), which when silenced restricts differentiation of glioma cells to bipolar instead of multipolar morphology. Therefore, we hypothesize complementary functions of fascin-1 and GFAP in the early and late phases of Sema5A-induced astrocytic differentiation of gliomas, respectively. In summary, Sema5A and plexin-B3 impede motility but promote differentiation of human gliomas. These effects are plausibly compromised in high-grade human astrocytomas in which Sema5A expression is markedly reduced, hence leading to infiltrative and anaplastic characteristics. This is evident by increased invasiveness of glioma cells when endogenous Sema5A is silenced. Therefore, Sema5A and plexin-B3 represent potential novel targets in counteracting glioma progression."
https://openalex.org/W2069318858,"The nuclear factor (NF)-κB transcription factor has essential roles in inflammation and oncogenesis. Its ubiquitous RelA subunit is regulated by several post-translational modifications, including phosphorylation, ubiquitination and acetylation. Ubiquitination promotes the termination of RelA-dependent transcription, but its regulation is incompletely understood. Through mass spectrometry analysis of ubiquitinated RelA, we identified seven lysines that were attached to degradative and non-degradative forms of polyubiquitin. Interestingly, lysines targeted for acetylation were among the residues identified as ubiquitin acceptor sites. Mutation of these particular sites resulted in decreased polyubiquitination. Acetylation and ubiquitination were found to inhibit each other, consistent with their use of overlapping sites. Reconstitution of rela(-/-) fibroblasts with wild-type and mutant forms of RelA revealed that modifications at these residues can have activating and inhibitory functions depending on the target gene context. Altogether, this study elucidates that ubiquitination and acetylation can modulate each other and regulate nuclear NF-κB function in a gene-specific manner."
