id,abstract
https://openalex.org/W4306194420,"High-impact temporomandibular disorder (TMD) pain may involve brain mechanisms related to maladaptive central pain modulation. We investigated brain responses to stimulation of trigeminal sites not typically associated with TMD pain by applying noxious dentoalveolar pressure to high- and low-impact TMD pain cases and pain-free controls during functional magnetic resonance imaging (fMRI). Fifty female participants were recruited and assigned to one of three groups based on the Diagnostic Criteria for Temporomandibular Disorders (DC/TMD) and Graded Chronic Pain Scale: controls (n = 17), low-impact (n = 17) and high-impact TMD (n = 16). Multimodal whole-brain MRI was acquired following the Human Connectome Project Lifespan protocol, including stimulus-evoked fMRI scans during which painful dentoalveolar pressure was applied to the buccal gingiva of participants. Group analyses were performed using non-parametric permutation tests for parcellated cortical and subcortical neuroimaging data. There were no significant between-group differences for brain activations/deactivations evoked by the noxious dentoalveolar pressure. For individual group mean activations/deactivations, a gradient in the number of parcels surviving thresholding was found according to the TMD pain grade, with the highest number seen in the high-impact group. Among the brain regions activated in chronic TMD pain groups were those previously implicated in sensory-discriminative and motivational-affective pain processing. These results suggest that dentoalveolar pressure pain evokes abnormal brain responses to sensory processing of noxious stimuli in high-impact TMD pain participants, which supports the presence of maladaptive brain plasticity in chronic TMD pain."
https://openalex.org/W4306194445,"The Renal Healthcare Program Uruguay (NRHP-UY) is a national, multidisciplinary program that provides care to chronic kidney disease (CKD) patients. In this study, we report the global results of CKD patient outcomes and a comparison between those treated at the NRHP-UY Units, with those patients who were initially included in the program but did not adhere to follow up.A cohort of not-on dialysis CKD patients included prospectively in the NRHP-UY between October 1st 2004 and September 30th 2017 was followed-up until September 30th 2019. Two groups were compared: a) Nephrocare Group: Patients who had at least one clinic visit during the first year on NRHP-UY (n = 11174) and b) Non-adherent Group: Patients who were informed and accepted to be included but had no subsequent data registered after admission (n = 3485). The study was approved by the Ethics Committee and all patients signed an informed consent. Outcomes were studied with Logistic and Cox´s regression analysis, Fine and Gray competitive risk and propensity-score matching tests.14659 patients were analyzed, median age 70 (60-77) years, 56.9% male. The Nephrocare Group showed improved achievement of therapeutic goals, ESKD was more frequent (HR 2.081, CI 95%1.722-2.514) as planned kidney replacement therapy (KRT) start (OR 2.494, CI95% 1.591-3.910), but mortality and the combined event (death and ESKD) were less frequent (HR 0.671, CI95% 0.628-0.717 and 0.777, CI95% 0.731-0.827) (p = 0.000) compared to the Non-adherent group. Results were similar in the propensity-matched group: ESKD (HR 2.041, CI95% 1.643-2.534); planned kidney replacement therapy (KRT) start (OR 2.191, CI95% 1.322-3.631) death (HR 0.692, CI95% 0.637-0.753); combined event (HR 0.801, CI95% 0.742-0.865) (p = 0.000).Multidisciplinary care within the NRHP-UY is associated with timely initiation of KRT and lower mortality in single outcomes, combined analysis, and propensity-matched analysis."
https://openalex.org/W4306194483,"Background The introduction of human immunodeficiency virus (HIV) antibody rapid testing (RT) in resource-limited settings has proven to be a successful intervention to increase access to prevention measures and improve timely linkage to care. However, the quality of testing has not always kept pace with the scale-up of this testing strategy. To monitor the accuracy of HIV RT test results, a national proficiency testing (PT) program was rolled out at selected testing sites in Ghana using the dried tube specimen (DTS) approach. Methods Between 2015 and 2018, 635 HIV testing sites, located in five regions and supported by the U.S. President’s Emergency Plan for AIDS Relief (PEPFAR), were enrolled in the HIV PT program of the Ghana Health Service National AIDS/STI Control Programme. These sites offered various services: HIV Testing and Counselling (HTC), prevention of mother-to-child transmission (PMTCT) and Antiretroviral Treatment (ART). The PT panels, composed of six DTS, were prepared by two regional laboratories, using fully characterized plasma obtained from the regional blood banks and distributed to the testing sites. The results were scored by the PT providers according to the predefined acceptable performance criteria which was set at ≥ 95%. Results Seven rounds of PT panels were completed successfully over three years. The number of sites enrolled increased from 205 in round 1 (June 2015) to 635 in round 7 (December 2018), with a noticeable increase in Greater Accra and Eastern regions. The average participation rates of enrolled sites ranged from 88.0% to 98.0% across the PT rounds. By round 7, HTC (257/635 (40.5%)) and PMTCT (237/635 (37.3%)) had a larger number of sites that participated in the PT program than laboratory (106/635 (16.7%)) and ART (12/635 (1.9%)) sites. The average testing performance rate improved significantly from 27% in round 1 to 80% in round 7 (p &lt; 0.001). The highest performance rate was observed for ART (100%), HTC (92%), ANC/PMTCT (90%) and Laboratory (89%) in round 5. Conclusion The DTS PT program showed a significant increase in the participation and performance rates during this period. Sub-optimal performances observed was attributed to non-compliance to the national testing algorithm and testing technique. However, the implementation of review meetings, peer-initiated corrective action, supportive supervisory training, and mentorship proved impactful. The decentralized approach to preparing the PT panels ensured ownership by the region and districts."
https://openalex.org/W4306194500,"Syrian refugees living in Jordan have many chronic conditions and use many medications. Pharmacists delivering the Medication Management Review (MMR) service can have a role in improving this growing global refugees' problem.To assess the effect of the MMR service on adherence to treatment therapy and knowledge of chronic medications for Syrian refugees residing in Jordan.This randomized intervention control single-blinded study was conducted in Jordan. Syrian refugees were recruited and randomized into intervention and control groups. Two home visits were delivered to each participant, at baseline and three months later. All participants completed questionnaires regarding adherence and knowledge. As a part of the MMR service, treatment-related problems (TRPs) were recognized for all patients; recommendations to resolve these TRPs were only delivered to intervention group refugees' physicians; TRPs were corrected. At follow-up, TRPs assessment, adherence and medication knowledge were assessed for all refugee participants.Participants (n = 106; intervention n = 53, control n = 53) had a number of medications and diagnosed chronic diseases of 5.8 ± 2.1 and 2.97 ± 1.16 per participant respectively. A significant improvement in the adherence and knowledge scores were noted in the intervention (P < 0.001 for both) but not the control group (P = 0.229, P = 0.07 respectively).The MMR service can significantly improve refugees' TRPs, adherence to therapy and knowledge of chronic medications. If this approach was extended to the large scale, many refugees in need would be able to access a quality essential health-care service; a step towards achieving universal health coverage.Registry: ClinicalTrials.gov Identifier: NCT04554810."
https://openalex.org/W4306194540,"Background Like other countries in sub-Saharan Africa, Madagascar has a high burden of stroke. The Malagasy population is unique in sharing both African and Asian ancestry. The proportion of ischemic and hemorrhagic stroke types is unknown for this population. Aim Our aim was to establish the proportion of stroke types and known risk factors for the Malagasy population. Methods We conducted a single-center, tertiary-level hospital-based case series. We included all patients with a CT-imaging confirmed stroke who presented at the emergency ward of the study hospital between January 1, 2017, and November 20, 2018. Results Of 223 patients with CT-confirmed stroke, 57.4% (128/223, 95% CI: 51–64%) had an ischemic stroke and 42.6% (95/223, 95% CI: 36–49%) had an intracranial hemorrhage. The majority (89.5%; 85/95, 95% CI: 83–96%) of intracranial hemorrhages were intracerebral; 4.2% (4/95, 95% CI: 0–8%) had a subdural hematoma, 5.3% (5/95, 95% CI: 1–10%) had a subarachnoid hemorrhage, there was one isolated intraventricular hemorrhage (1.1%; 1/95, 95% CI: -1-3%). The prevalence of hypertension among stroke patients was high (86.6%; 187/216, 95% CI: 82–91%). Conclusions Our study is the first to report the proportion of stroke types and known risk factors in Madagascar. We find that the proportion of hemorrhagic strokes was unexpectedly higher than that reported from other countries in sub-Saharan Africa. Our findings highlight the need for a country-specific approach to stroke prevention, treatment, and rehabilitation and provide guidance on public health resource allocation in Madagascar."
https://openalex.org/W4306194553,"In sex determination of the crustacean Daphnia magna , male-specific expression of DM-domain transcription factor Doublesex1 (Dsx1) orchestrates the male developmental program triggered by environmental stimuli. We previously identified the CELF1 ortholog as a candidate of proteins associated with the 5’ UTR of the Dsx1α isoform. Here we report the CELF1-dependent suppression of Dsx1 expression in D . magna . During embryogenesis, CELF1 expression was not sexually dimorphic. Silencing of CELF1 led to the activation of Dsx1 expression both in female and male embryos. Overexpression of CELF1 in male embryos resulted in a reduction of Dsx1 expression. By these manipulations of CELF1 expression, the Dsx1 transcript level was not significantly changed. To investigate whether the CELF1 controls Dsx1 expression via its 5’ UTR, we injected the GFP reporter mRNA having intact Dsx1α 5’ UTR or mutated one lacking the GU-rich element (GRE) that is known as a binding site of the CELF1 ortholog. We found that deletion of the GRE significantly increased the reporter gene expression. These results indicate that CELF1 suppresses Dsx1 expression both in females and males, possibly at the post-transcriptional level. We speculate that CELF1 may avoid unintended Dsx1 expression and generation of sexual ambiguity by setting a threshold of Dsx1 expression."
https://openalex.org/W4306194640,"Purpose Obstructive sleep apnea (OSA) is a common, prevalent, and underdiagnosed disorder. Its lack of diagnosis and treatment is associated with increased morbidity and mortality. Previous screening questionnaires investigated parameters including body mass index, age, neck circumference, and sex, in addition to symptoms. This study aimed to validate a new Italian, self-administered, and easy-to-use six-item questionnaire that evaluates only subjective symptoms. Patients and methods The present study included 2622 patients (male, 2011; female, 611). Patients who were at least 18 years old, spoke Italian, referred to our sleep clinic for possible OSA, and completed the self-administered SANReSP questionnaire were recruited for the study. The predictive performance of the questionnaire was also evaluated. Results Nocturnal study showed 89.9% of OSA patients had apnea-hypopnea index (AHI) ≥ 5/h; 68.7%, AHI ≥ 15/h; and 48.2%, AHI ≥ 30/h. The optimal SANReSP score for AHI ≥ 5/h was &gt;3 with a sensitivity and specificity of 74.76% and 67.92%, respectively, and an area under receiver operating characteristic curve (ROC) of 0.76. For moderate–severe OSA, the optimal SANReSP score was &gt;3 (sensitivity, 78.18%; specificity, 46.53%; ROC, 0.66). For severe OSA, the optimal SANReSP score was &gt;4 (sensitivity, 59.10%; specificity, 64.73%; ROC, 0.65). The probability of OSA increased with higher SANReSP scores (98.7% and 97.9% in men and women, respectively). Conclusion The SANReSP questionnaire is a short, easy-to-use, and self-administered screening tool for OSA. Its performance is similar to that of other widely used questionnaires; furthermore, it is advantageous in that it does not require anthropometric measurements."
https://openalex.org/W4306194649,"Learning techniques involve unraveling regression structures, which aim to analyze in a probabilistic frame the associations across variables of interest. Thus, analyzing fraction and/or proportion data may not be adequate with standard regression procedures, since the linear regression models generally assume that the dependent (outcome) variable is normally distributed. In this manner, we propose a statistical model called unit-Lindley regression model, for the purpose of Statistical Process Control (SPC). As a result, a new control chart tool was proposed, which targets the water monitoring dynamic, as well as the monitoring of relative humidity, per minute, of Copiapó city, located in Atacama Desert (one of the driest non-polar places on Earth), north of Chile. Our results show that variables such as wind speed, 24-hour temperature variation, and solar radiation are useful to describe the amount of relative humidity in the air. Additionally, Information Visualization (InfoVis) tools help to understand the time seasonality of the water particle phenomenon of the region in near real-time analysis. The developed methodology also helps to label unusual events, such as Camanchaca , and other water monitoring-related events."
https://openalex.org/W4306247621,"Background Corona Virus Disease 2019 is a novel respiratory disease commonly transmitted through respiratory droplets. The disease has currently expanded all over the world with differing epidemiologic trajectories. This investigation was conducted to determine the basic clinical and epidemiological characteristics of the disease in Ethiopia. Methods A prospective case-ascertained study of laboratory-confirmed COVID-19 cases and their close contacts were conducted. The study included 100 COVID-19 laboratory-confirmed cases reported from May 15, 2020 to June 15, 2020 and 300 close contacts. Epidemiological and clinical information were collected using the WHO standard data collection tool developed first-few cases and contacts investigation. Nasopharyngeal and Oropharyngeal samples were collected by using polystyrene tipped swab and transported to the laboratory by viral transport media maintaining an optimal temperature. Clinical and epidemiological parameters were calculated in terms of ratios, proportions, and rates with 95% CI. Result A total of 400 participants were investigated, 100 confirmed COVID-19 cases and 300 close contacts of the cases. The symptomatic proportion of cases was 23% (23) (95% CI: 15.2%-32.5%), the proportion of cases required hospitalization were 8% (8) (95%CI: 3.5%-15.2%) and 2% (95%CI: 0.24% - 7.04%) required mechanical ventilation. The secondary infection rate, secondary clinical attack rate, median incubation period and median serial interval were 42% (126) (95% CI: 36.4%-47.8%), 11.7% (35) (95% CI: 8.3%-15.9%), 7 days (IQR: 4–13.8) and 11 days (IQR: 8–11.8) respectively. The basic reproduction number (R O ) was 1.26 (95% CI: 1.0–1.5). Conclusion The proportion of asymptomatic infection, as well as secondary infection rate among close contacts, are higher compared to other studies. The long serial interval and low basic reproduction number might contribute to the observed slow progression of the pandemic, which gives a wide window of opportunities and time to control the spread. Testing, prevention, and control measures should be intensified."
https://openalex.org/W4306247733,"Urbanization is a comprehensive process of mutual influence among the population, economy, society and living environment, and it depends on the synergy of a series of factors. This paper uses the statistical data of 76 counties in Xinjiang from 1996 to 2018 to construct a comprehensive urbanization evaluation system. Based on the entropy method, comprehensive evaluation model and coupling coordination model, from the scales of time and space, this paper discusses the current situation of the coordinated development of population, economy, society and living environment factors in counties in Xinjiang in the process of urbanization. Local spatial autocorrelation analysis is used to further study the spatial agglomeration effect of the coupling and coordination of urbanization development in the counties. The results show the following: (1) The comprehensive urbanization level of 76 counties in Xinjiang has the characteristics of ""center-periphery"" development, and high-level counties are clustered on the northern slopes of the Tian Mountains. (2) Most counties are in a serious state of imbalance; notably, the degree of population-economy-society-living environment coupling and coordination in the border counties and towns is in an unsatisfactory state. (3) The county-level cities in Northern Xinjiang belong to the diffusion and spillover areas, the county-level cities in southern Xinjiang belong to the polarization benefit areas, and most other counties are in the state of no spillover effect."
https://openalex.org/W4306247736,"In recent years, China’s “lottery culture” has developed vigorously. Moreover, the investment participation rate of Chinese families in the formal financial market is low, whereas that in the informal financial market is high. Is there a certain relationship between “lottery culture” and family financial decision-making? If so, what is the underlying mechanism? Based on the 2017 CHFS data and lottery sales data of provinces, this study explores the impact of “lottery culture” on household participation in the formal and informal financial markets and the diversity of household financial portfolios. Results show that “lottery culture” can impede household participation in the formal financial market and the diversity of household financial portfolios while promoting household participation in the informal financial market in China. Furthermore, we analyze two channels of “lottery culture” impacts on household financial decisions: (1) risk attitude and (2) human capital. Results illustrate that “lottery culture” can influence household financial decisions by increasing risk tolerance and reducing the human capital of households."
https://openalex.org/W4306247762,"Learning to sequence movements is necessary for skillful interaction with the environment. Neuroplasticity, particularly long-term potentiation (LTP), within sensorimotor networks underlies the acquisition of motor skill. Short-term immobilization of the arm, even less than 12 hours, can reduce corticospinal excitability and increase the capacity for LTP-like plasticity within the contralateral primary motor cortex. However, it is still unclear whether short-term immobilization influences motor skill acquisition. The current study aimed to evaluate the effect of short-term arm immobilization on implicit, sequence-specific motor skill acquisition using a modified Serial Reaction Time Task (SRTT). Twenty young, neurotypical adults underwent a single SRTT training session after six hours of immobilization of the non-dominant arm or an equivalent period of no immobilization. Our results demonstrated that participants improved SRTT performance overall after training, but there was no evidence of an effect of immobilization prior to task training on performance improvement. Further, improvements on the SRTT were not sequence-specific. Taken together, motor skill acquisition for sequential, individuated finger movements improved following training but the effect of six hours of immobilization was difficult to discern."
https://openalex.org/W4306247831,"Hemodynamic assessment is crucial after heart transplantation (HTX) or left ventricular assist device (LVAD) implantation. Gold-standard is invasive assessment via thermodilution (TD). Noninvasive pulse contour analysis (NPCA) is a new technology that is supposed to determine hemodynamics completely noninvasive. We aimed to validate this technology in HTX and LVAD patients and conducted a prospective single-center cohort study.Patients after HTX or LVAD implantation underwent right heart catheterization including TD. NPCA using the CNAP Monitor (V.5.2.14; CNSystems Medizintechnik AG, Graz, Austria) was performed simultaneously. Three TD measurements were compared with simultaneous NPCA measurements for hemodynamic assessment. To describe the agreement between TD and NPCA, Bland-Altman analysis was done.In total, 28 patients were prospectively enrolled (HTX: n = 10, LVAD: n = 18). Bland-Altman analysis revealed a mean bias of +1.05 l/min (limits of agreement ± 4.09 l/min, percentage error 62.1%) for cardiac output (CO). In LVAD patients, no adequate NPCA signal could be obtained. In 5 patients (27.8%), any NPCA signal could be detected, but was considered as low signal quality.In conclusion, according to our limited data in a small cohort of HTX and LVAD patients, NPCA using the CNAP Monitor seems not to be suitable for noninvasive evaluation of the hemodynamic status."
https://openalex.org/W4306247896,"In some situations, e.g., when filling out lottery tickets, it can be advantageous to select random locations. However, people usually have difficulties with this, because they are biased by preferences for certain regions, such as the center of an area. According to ideas from art theory, the preferred regions reflect the hidden structure of perceptual forces within an area. In the present study, these structures were investigated and modeled under different conditions for areas with square and rectangular shape. The general task was to sequentially place a number of dots at random locations in an area by clicking with the computer mouse at corresponding positions on the screen. Whereas in a single-dot condition each dot had to be placed in an empty area, the previously placed dots remained visible in a multiple-dots condition. In three experiments it was found that dots were preferentially placed at the center, the diagonals, and the principal axes. This preference was more pronounced in the single than in the multiple-dot condition. Moreover, sequential analyses revealed that dot placing was not only planned in advance, but that the participants also agreed to some extent in their sequential selections, which produced surprisingly similar sequential spatial patterns across participants, at least for the first dots. Altogether, the results indicate that people have great difficulties with the random selection of locations. Their selections are strongly affected by the attraction of specific regions, by previous selections, and by sequential habits."
https://openalex.org/W4306247936,Breast cancer survivors may experience spinal deformity following breast cancer surgery. This study investigated the long-term effects of breast cancer surgery on whole-spine alignment. This retrospective study included 200 patients who underwent breast cancer surgery and ≥2 anteroposterior standing whole-spine X-rays. The curvature of the spine was measured using the Cobb angle; changes in Cobb angle between X-rays were compared among three groups according to breast cancer surgery type. The mean interval between initial and follow-up X-ray was 28.46 ± 13.39 months. The change in Cobb angle was 0.40 ± 1.65 degrees and the absolute value of that change was 1.25 ± 1.15 degrees in all patients with breast cancer. There were no significant differences in angular change among groups according to breast cancer surgery type. Most patients showed minimal changes in spinal alignment after breast cancer surgery. Our findings indicate that breast cancer surgery does not negatively affect spinal alignment.
