id,abstract
https://openalex.org/W2065288511,"It is conventional in labor economics to treat all workers who are seeking new jobs as belonging to a labor pool, and all firms that have job vacancies as an employer pool, and then match workers to jobs. Here we develop a new approach to study labor and firm dynamics. By combining the emerging science of networks with newly available employment micro-data, comprehensive at the level of whole countries, we are able to broadly characterize the process through which workers move between firms. Specifically, for each firm in an economy as a node in a graph, we draw edges between firms if a worker has migrated between them, possibly with a spell of unemployment in between. An economy's overall graph of firm-worker interactions is an object we call the labor flow network (LFN). This is the first study that characterizes a LFN for an entire economy. We explore the properties of this network, including its topology, its community structure, and its relationship to economic variables. It is shown that LFNs can be useful in identifying firms with high growth potential. We relate LFNs to other notions of high performance firms. Specifically, it is shown that fewer than 10% of firms account for nearly 90% of all employment growth. We conclude with a model in which empirically-salient LFNs emerge from the interaction of heterogeneous adaptive agents in a decentralized labor market."
https://openalex.org/W2090525377,"Sex differences in spontaneous sleep amount are largely dependent on reproductive hormones; however, in mice some sex differences in sleep amount during the active phase are preserved after gonadectomy and may be driven by non-hormonal factors. In this study, we sought to determine whether or not these sex differences are driven by sex chromosome complement. Mice from the four core genotype (FCG) mouse model, whose sex chromosome complement (XY, XX) is independent of phenotype (male or female), were implanted with electroencephalographic (EEG) and electromyographic (EMG) electrodes for the recording of sleep-wake states and underwent a 24-hr baseline recording followed by six hours of forced wakefulness. During baseline conditions in mice whose gonads remained intact, males had more total sleep and non-rapid eye movement sleep than females during the active phase. Gonadectomized FCG mice exhibited no sex differences in rest-phase sleep amount; however, during the mid-active-phase (nighttime), XX males had more spontaneous non-rapid eye movement (NREM) sleep than XX females. The XY mice did not exhibit sex differences in sleep amount. Following forced wakefulness there was a change in the factors regulating sleep. XY females slept more during their mid-active phase siestas than XX females and had higher NREM slow wave activity, a measure of sleep propensity. These findings suggest that the process that regulates sleep propensity is sex-linked, and that sleep amount and sleep propensity are regulated differently in males and females following sleep loss."
https://openalex.org/W2031106132,"High-amplitude, MV/m, nanosecond pulsed electric fields (nsPEF) have been hypothesized to cause nanoporation of the plasma membrane. Phosphatidylserine (PS) externalization has been observed on the outer leaflet of the membrane shortly after nsPEF exposure, suggesting local structural changes in the membrane. In this study, we utilized fluorescently-tagged Annexin V to observe the externalization of PS on the plasma membrane of isolated Chinese Hamster Ovary (CHO) cells following exposure to nsPEF. A series of experiments were performed to determine the dosimetric trends of PS expression caused by nsPEF as a function of pulse duration, τ, delivered field strength, ED, and pulse number, n. To accurately estimate dose thresholds for cellular response, data were reduced to a set of binary responses and ED50s were estimated using Probit analysis. Probit analysis results revealed that PS externalization followed the non-linear trend of (τ*ED2)−1 for high amplitudes, but failed to predict low amplitude responses. A second set of experiments was performed to determine the nsPEF parameters necessary to cause observable calcium uptake, using cells preloaded with calcium green (CaGr), and membrane permeability, using FM1-43 dye. Calcium influx and FM1-43 uptake were found to always be observed at lower nsPEF exposure parameters compared to PS externalization. These findings suggest that multiple, higher amplitude and longer pulse exposures may generate pores of larger diameter enabling lateral diffusion of PS; whereas, smaller pores induced by fewer, lower amplitude and short pulse width exposures may only allow extracellular calcium and FM1-43 uptake."
https://openalex.org/W2007346133,"Accurate estimates of recombination rates are of great importance for understanding evolution. In an experimental genetic cross, recombination breaks apart and rejoins genetic material, such that the genomes of the resulting isolates are comprised of distinct blocks of differing parental origin. We here describe a method exploiting this fact to infer genome-wide recombination profiles from sequenced isolates from an advanced intercross line (AIL). We verified the accuracy of the method against simulated data. Next, we sequenced 192 isolates from a twelve-generation cross between West African and North American yeast Saccharomyces cerevisiae strains and inferred the underlying recombination landscape at a fine genomic resolution (mean segregating site distance 0.22 kb). Comparison was made with landscapes inferred for a similar cross between four yeast strains, and with a previous single-generation, intra-strain cross (Mancera et al., Nature 2008). Moderate congruence was identified between landscapes (correlation 0.58-0.77 at 5 kb resolution), albeit with variance between mean genome-wide recombination rates. The multiple generations of mating undergone in the AILs gave more precise inference of recombination rates than could be achieved from a single-generation cross, in particular in identifying recombination cold-spots. The recombination landscapes we describe have particular utility; both AILs are part of a resource to study complex yeast traits (see e.g. Parts et al., Genome Res 2011). Our results will enable future applications of this resource to take better account of local linkage structure heterogeneities. Our method has general applicability to other crossing experiments, including a variety of experimental designs."
https://openalex.org/W2062451863,"Detecting protein complexes from protein-protein interaction (PPI) networks is a challenging task in computational biology. A vast number of computational methods have been proposed to undertake this task. However, each computational method is developed to capture one aspect of the network. The performance of different methods on the same network can differ substantially, even the same method may have different performance on networks with different topological characteristic. The clustering result of each computational method can be regarded as a feature that describes the PPI network from one aspect. It is therefore desirable to utilize these features to produce a more accurate and reliable clustering. In this paper, a novel Bayesian Nonnegative Matrix Factorization(NMF)-based weighted Ensemble Clustering algorithm (EC-BNMF) is proposed to detect protein complexes from PPI networks. We first apply different computational algorithms on a PPI network to generate some base clustering results. Then we integrate these base clustering results into an ensemble PPI network, in the form of weighted combination. Finally, we identify overlapping protein complexes from this network by employing Bayesian NMF model. When generating an ensemble PPI network, EC-BNMF can automatically optimize the values of weights such that the ensemble algorithm can deliver better results. Experimental results on four PPI networks of Saccharomyces cerevisiae well verify the effectiveness of EC-BNMF in detecting protein complexes. EC-BNMF provides an effective way to integrate different clustering results for more accurate and reliable complex detection. Furthermore, EC-BNMF has a high degree of flexibility in the choice of base clustering results. It can be coupled with existing clustering methods to identify protein complexes."
https://openalex.org/W2089485752,"Immune responses to current rubella vaccines demonstrate significant inter-individual variability. We performed mRNA-Seq profiling on PBMCs from high and low antibody responders to rubella vaccination to delineate transcriptional differences upon viral stimulation. Generalized linear models were used to assess the per gene fold change (FC) for stimulated versus unstimulated samples or the interaction between outcome and stimulation. Model results were evaluated by both FC and p-value. Pathway analysis and self-contained gene set tests were performed for assessment of gene group effects. Of 17,566 detected genes, we identified 1,080 highly significant differentially expressed genes upon viral stimulation (p<1.00E−15, FDR<1.00E−14), including various immune function and inflammation-related genes, genes involved in cell signaling, cell regulation and transcription, and genes with unknown function. Analysis by immune outcome and stimulation status identified 27 genes (p≤0.0006 and FDR≤0.30) that responded differently to viral stimulation in high vs. low antibody responders, including major histocompatibility complex (MHC) class I genes (HLA-A, HLA-B and B2M with p = 0.0001, p = 0.0005 and p = 0.0002, respectively), and two genes related to innate immunity and inflammation (EMR3 and MEFV with p = 1.46E−08 and p = 0.0004, respectively). Pathway and gene set analysis also revealed transcriptional differences in antigen presentation and innate/inflammatory gene sets and pathways between high and low responders. Using mRNA-Seq genome-wide transcriptional profiling, we identified antigen presentation and innate/inflammatory genes that may assist in explaining rubella vaccine-induced immune response variations. Such information may provide new scientific insights into vaccine-induced immunity useful in rational vaccine development and immune response monitoring."
https://openalex.org/W2102194988,"Staphylococcus aureus is a major human pathogen and a leading cause of nosocomial and community-acquired infections. Development of a vaccine against this pathogen is an important goal. While S. aureus protective antigens have been identified in the literature, the majority have only been tested in a single animal model of disease. We wished to evaluate the ability of one S. aureus vaccine antigen to protect in multiple mouse models, thus assessing whether protection in one model translates to protection in other models encompassing the full breadth of infections the pathogen can cause. We chose to focus on genetically inactivated alpha toxin mutant HlaH35L. We evaluated the protection afforded by this antigen in three models of infection using the same vaccine dose, regimen, route of immunization, adjuvant, and challenge strain. When mice were immunized with HlaH35L and challenged via a skin and soft tissue infection model, HlaH35L immunization led to a less severe infection and decreased S. aureus levels at the challenge site when compared to controls. Challenge of HlaH35L-immunized mice using a systemic infection model resulted in a limited, but statistically significant decrease in bacterial colonization as compared to that observed with control mice. In contrast, in a prosthetic implant model of chronic biofilm infection, there was no significant difference in bacterial levels when compared to controls. These results demonstrate that vaccines may confer protection against one form of S. aureus disease without conferring protection against other disease presentations and thus underscore a significant challenge in S. aureus vaccine development."
https://openalex.org/W1966144302,"The medial ganglionic eminence (MGE) is an embryonic forebrain structure that generates the majority of cortical interneurons. MGE transplantation into specific regions of the postnatal central nervous system modifies circuit function and improves deficits in mouse models of epilepsy, Parkinson's disease, pain, and phencyclidine-induced cognitive deficits. Herein, we describe approaches to generate MGE-like progenitor cells from mouse embryonic stem (ES) cells. Using a modified embryoid body method, we provided gene expression evidence that mouse ES-derived Lhx6(+) cells closely resemble immature interneurons generated from authentic MGE-derived Lhx6(+) cells. We hypothesized that enhancers that are active in the mouse MGE would be useful tools in detecting when ES cells differentiate into MGE cells. Here we demonstrate the utility of enhancer elements [422 (DlxI12b), Lhx6, 692, 1056, and 1538] as tools to mark MGE-like cells in ES cell differentiation experiments. We found that enhancers DlxI12b, 692, and 1538 are active in Lhx6-GFP(+) cells, while enhancer 1056 is active in Olig2(+) cells. These data demonstrate unique techniques to follow and purify MGE-like derivatives from ES cells, including GABAergic cortical interneurons and oligodendrocytes, for use in stem cell-based therapeutic assays and treatments."
https://openalex.org/W1972622142,"Background Peer review is the mainstay of editorial decision making for medical journals. There is a dearth of evaluations of journal peer review with regard to reliability and validity, particularly in the light of the wide variety of medical journals. Studies carried out so far indicate low agreement among reviewers. We present an analysis of the peer review process at a general medical journal, Deutsches Ärzteblatt International. Methodology/Principal Findings 554 reviewer recommendations on 206 manuscripts submitted between 7/2008 and 12/2009 were analyzed: 7% recommended acceptance, 74% revision and 19% rejection. Concerning acceptance (with or without revision) versus rejection, there was a substantial agreement among reviewers (74.3% of pairs of recommendations) that was not reflected by Fleiss' or Cohen's kappa (<0.2). The agreement rate amounted to 84% for acceptance, but was only 31% for rejection. An alternative kappa-statistic, however, Gwet's kappa (AC1), indicated substantial agreement (0.63). Concordance between reviewer recommendation and editorial decision was almost perfect when reviewer recommendations were unanimous. The correlation of reviewer recommendations and citations as counted by Web of Science was low (partial correlation adjusted for year of publication: −0.03, n.s.). Conclusions/Significance Although our figures are similar to those reported in the literature our conclusion differs from the widely held view that reviewer agreement is low: Based on overall agreement we consider the concordance among reviewers sufficient for the purposes of editorial decision making. We believe that various measures, such as positive and negative agreement or alternative Kappa values are superior to the application of Cohen's or Fleiss' Kappa in the analysis of nominal or ordinal level data regarding reviewer agreement. Also, reviewer recommendations seem to be a poor proxy for citations because, for example, manuscripts will be changed considerably during the revision process."
https://openalex.org/W2053652885,"Survivin is a unique member of the inhibitor of apoptosis (IAP) proteins that is overexpressed in numerous cancers through poorly defined mechanisms. One such mechanism may be through constitutive activation of the insulin-like growth factor-I (IGF-I) signaling pathway, implicated in the development and progression of prostate cancer. Using the pre-neoplastic NRP-152 rat prostate cell line as a model, we showed that IGF-I induces Survivin expression, and that silencing Survivin by lentiviral-mediated small hairpin RNA (shRNA) represses IGF-I-stimulated cell growth, implicating Survivin as a mediator of this growth response. Moreover, our data support that the induction of Survivin by IGF-I occurs through a transcriptional mechanism that is mediated in part by the PI3K/Akt/mTORC1 pathway. Use of various Survivin promoter-luciferase constructs revealed that the CDE and CHR response elements in the proximal region of the Survivin promoter are involved in this IGF-I response. Transforming growth factor (TGF-β) signaling antagonists similarly activated the Surivin promoter and rendered cells refractory to further promoter activation by IGF-I. IGF-I suppressed levels of phospho-Smads 2 and 3 with kinetics similar to that of Survivin induction. Suppression of TGF-β signaling, either by TGF-β receptor kinase inhibitors or by silencing Smads 2 and 3, induced Survivin expression and promoted cell growth similar to that induced by IGF-I. TGF-β receptor antagonists also rescued cells from down-regulation of Survivin expression and growth suppression by pharmacological inhibitors of PI3K, Akt, MEK and mTOR. Sh-RNA gene silencing studies suggest that mTORC1 induces while mTORC2 represses the expression of Survivin by IGF-I. Taken together, these results suggest that IGF-I signaling through a PI3K/Akt/mTORC1 mechanism elevates expression of Survivin and promotes growth of prostate epithelial cells by suppressing Smad-dependent autocrine TGF-β signaling."
https://openalex.org/W1965485246,"Over the last decades there has been an explosion of new methodologies to study protein complexes. However, most of the approaches currently used are based on in vitro assays (e.g. nuclear magnetic resonance, X-ray, electron microscopy, isothermal titration calorimetry etc). The accurate measurement of parameters that define protein complexes in a physiological context has been largely limited due to technical constrains. Here, we present PICT (Protein interactions from Imaging of Complexes after Translocation), a new method that provides a simple fluorescence microscopy readout for the study of protein complexes in living cells. We take advantage of the inducible dimerization of FK506-binding protein (FKBP) and FKBP-rapamycin binding (FRB) domain to translocate protein assemblies to membrane associated anchoring platforms in yeast. In this assay, GFP-tagged prey proteins interacting with the FRB-tagged bait will co-translocate to the FKBP-tagged anchor sites upon addition of rapamycin. The interactions are thus encoded into localization changes and can be detected by fluorescence live-cell imaging under different physiological conditions or upon perturbations. PICT can be automated for high-throughput studies and can be used to quantify dissociation rates of protein complexes in vivo. In this work we have used PICT to analyze protein-protein interactions from three biological pathways in the yeast Saccharomyces cerevisiae: Mitogen-activated protein kinase cascade (Ste5-Ste11-Ste50), exocytosis (exocyst complex) and endocytosis (Ede1-Syp1)."
https://openalex.org/W1986788912,"Metastasis occurs in a series of discrete steps involving invasion, angiogenesis, lymphovascular space permeation, and establishment of secondary tumors. Malignant pleural effusion (MPE), a type of tumor metastasis, is usually a poor prognostic sign for patients with pulmonary adenocarcinoma, although its underlying mechanism has received less attention than other types of metastases have. The objective of the current study was to confirm whether cancer stem cells (CSCs) in MPE contribute to the ""metastatic cascade"" through the epithelial - mesenchymal transition (EMT), anoikis, and adaptation in the microenvironment.Pulmonary tissue and corresponding cell blocks of MPE samples from 20 patients with primary adenocarcinoma were analyzed by immunohistochemical staining with CSC-representative markers (CD133, Nanog, and OCT-4) and EMT-associated markers (E-cadherin and vimentin). Correlations between these variables and clinico-pathological parameters were analyzed. Primary cultures from eight cases of MPE were investigated to characterize the CSC properties, including marker expression, sphere formation, and differentiation.Expressions of CSC-representative markers for 20 cases of MPE cell blocks were quite diverse and variable ranging from 15% to 90%. Stronger expression of CSC-representative markers and alteration of EMT-associated markers were found at the invasive fronts and in MPEs compared with the expression in primary pulmonary tumor tissues. The expression of OCT-4 in MPEs significantly related to distant metastasis and stage, as well as inversely correlated with patient survival. Primary cultures confirmed the CSC properties in MPE. Five of eight cases of MPE yielded adequate cell clusters, which also showed variable expressions of CSC markers in addition to sphere formation and the ability for differentiation and metastasis.This pilot study offers a better understanding of the metastatic cascade. Establishing a model of MPE will provide further insight into the role of CSCs in metastasis and may explain the high therapeutic failure rates for patients with MPE."
https://openalex.org/W2006653902,"Three experiments investigated the predictions of the biased competition theory of selective attention in a computer based sport task. According to this theory objects held in the circuitry of working memory (WM) automatically bias attention to objects in a visual scene that match or are related to the WM representation. Specifically, we investigated whether certain players that are activated in the circuitry of WM automatically draw attention and receive a competitive advantage in a computer based sport task. In all three experiments participants had to hold an image of a certain player in WM while engaged in a speeded sport task. In Experiment 1 participants had to identify as quickly as possible which player was in possession of the ball. In Experiment 2 and 3 participants had to decide to which player they would pass to in a cartoon team handball situation and a photo picture basketball situation. The results support the biased competition theory of selective attention and suggest that certain decision options receive a competitive advantage if they are associated with the activated contents in the circuitry of WM and that this effect is more pronounced when more decision options compete for attention. A further extension compared to previous research was that the contents of working memory not only biased attention but also actual decisions that can lead to passing errors in sport. We critically discuss the applied implications of the findings."
https://openalex.org/W2100453507,"Relationships between six calcifying plankton groups and pH are explored in a highly biologically productive and data-rich area of the central North Sea using time-series datasets. The long-term trends show that abundances of foraminiferans, coccolithophores, and echinoderm larvae have risen over the last few decades while the abundances of bivalves and pteropods have declined. Despite good coverage of pH data for the study area there is uncertainty over the quality of this historical dataset; pH appears to have been declining since the mid 1990s but there was no statistical connection between the abundance of the calcifying plankton and the pH trends. If there are any effects of pH on calcifying plankton in the North Sea they appear to be masked by the combined effects of other climatic (e.g. temperature), chemical (nutrient concentrations) and biotic (predation) drivers. Certain calcified plankton have proliferated in the central North Sea, and are tolerant of changes in pH that have occurred since the 1950s but bivalve larvae and pteropods have declined. An improved monitoring programme is required as ocean acidification may be occurring at a rate that will exceed the environmental niches of numerous planktonic taxa, testing their capacities for acclimation and genetic adaptation."
