id,abstract
https://openalex.org/W2644050750,"Non-symmetric internal alkenes are selectively converted into allylic functionalized products with high stereoselectivity and regioselectivity. Allylic functionalization has long been used in organic chemistry to install new chiral centres. These 'ene' reactions have been well studied, but general methods for using internal alkenes and activation with heteroatom-based electrophiles are largely unprecedented. Here, Uttam Tambar and colleagues report the application of a sulfur-based electrophile to incorporate heteroatoms at the allylic position of internal cis-alkenes via a chiral-Lewis-acid-catalysed hetero-ene reaction. Symmetric and non-symmetric internal alkenes can be functionalized with high regio-, E/Z- and stereoselectivity to a multifunctional building block, from which a series of products including alcohols, amines and thiols can be derived in a stereospecific manner. The stereoselective oxidation of hydrocarbons is one of the most notable advances in synthetic chemistry over the past fifty years1,2,3. Inspired by nature, enantioselective dihydroxylations, epoxidations and other oxidations of unsaturated hydrocarbons have been developed. More recently, the catalytic enantioselective allylic carbon–hydrogen oxidation of alkenes has streamlined the production of pharmaceuticals, natural products, fine chemicals and other functional materials4,5,6,7. Allylic functionalization provides a direct path to chiral building blocks with a newly formed stereocentre from petrochemical feedstocks while preserving the olefin functionality as a handle for further chemical elaboration. Various metal-based catalysts have been discovered for the enantioselective allylic carbon–hydrogen oxidation of simple alkenes with cyclic or terminal double bonds8,9,10,11,12,13,14,15,16. However, a general and selective allylic oxidation using the more common internal alkenes remains elusive. Here we report the enantioselective, regioselective and E/Z-selective allylic oxidation of unactivated internal alkenes via a catalytic hetero-ene reaction with a chalcogen-based oxidant. Our method enables non-symmetric internal alkenes to be selectively converted into allylic functionalized products with high stereoselectivity and regioselectivity. Stereospecific transformations of the resulting multifunctional chiral building blocks highlight the potential for rapidly converting internal alkenes into a broad range of enantioenriched structures that can be used in the synthesis of complex target molecules."
https://openalex.org/W2718067945,"Ribosomes have the capacity to selectively control translation through changes in their composition that enable recognition of specific RNA elements. However, beyond differential subunit expression during development, evidence for regulated ribosome specification within individual cells has remained elusive. Here we report that a poxvirus kinase phosphorylates serine/threonine residues in the human small ribosomal subunit protein, receptor for activated C kinase (RACK1), that are not phosphorylated in uninfected cells or cells infected by other viruses. These modified residues cluster in an extended loop in RACK1, phosphorylation of which selects for translation of viral or reporter mRNAs with 5' untranslated regions that contain adenosine repeats, so-called polyA-leaders. Structural and phylogenetic analyses revealed that although RACK1 is highly conserved, this loop is variable and contains negatively charged amino acids in plants, in which these leaders act as translational enhancers. Phosphomimetics and inter-species chimaeras have shown that negative charge in the RACK1 loop dictates ribosome selectivity towards viral RNAs. By converting human RACK1 to a charged, plant-like state, poxviruses remodel host ribosomes so that adenosine repeats erroneously generated by slippage of the viral RNA polymerase confer a translational advantage. Our findings provide insight into ribosome customization through trans-kingdom mimicry and the mechanics of species-specific leader activity that underlie poxvirus polyA-leaders."
https://openalex.org/W2648083391,"Cellular potassium import systems play a fundamental role in osmoregulation, pH homeostasis and membrane potential in all domains of life. In bacteria, the kdp operon encodes a four-subunit potassium pump that maintains intracellular homeostasis, cell shape and turgor under conditions in which potassium is limiting. This membrane complex, called KdpFABC, has one channel-like subunit (KdpA) belonging to the superfamily of potassium transporters and another pump-like subunit (KdpB) belonging to the superfamily of P-type ATPases. Although there is considerable structural and functional information about members of both superfamilies, the mechanism by which uphill potassium transport through KdpA is coupled with ATP hydrolysis by KdpB remains poorly understood. Here we report the 2.9 Å X-ray structure of the complete Escherichia coli KdpFABC complex with a potassium ion within the selectivity filter of KdpA and a water molecule at a canonical cation site in the transmembrane domain of KdpB. The structure also reveals two structural elements that appear to mediate the coupling between these two subunits. Specifically, a protein-embedded tunnel runs between these potassium and water sites and a helix controlling the cytoplasmic gate of KdpA is linked to the phosphorylation domain of KdpB. On the basis of these observations, we propose a mechanism that repurposes protein channel architecture for active transport across biomembranes."
https://openalex.org/W2634748590,"Resistance to fluoroquinolones (FQ) is being increasingly reported and found to be mediated by efflux pumps, plasmid-mediated quinolone resistance genes (PMQR) and mutations in gyrA, gyrB, parC and parE. However, studies reporting on FQ resistance mechanisms (FQRM), particularly in Africa, are focused mostly on Salmonella. This study used a whole-genome-based approach to describe FQRM in forty-eight clinical Enterobacteriaceae isolates comprising of Klebsiella pneumoniae (n = 21), Serratia marcescens (n = 12), Enterobacter spp. (n = 10), Citrobacter freundii (n = 3), Escherichia coli (n = 1), and Klebsiella michiganensis (n = 1) with reduced susceptibility to FQ in Enterobacteriaceae. All the isolates exhibited exceptionally high-level resistance (MIC of 4-512mg/L) to all three FQs, which could not be reversed by carbonyl cyanide m-chlorophenyl hydrazine (CCCP), verapamil (VRP) or reserpine (RSP). PMQR genes such as oqxAB (n = 43), aac(6’)-Ib-cr (n = 28), and qnr(S1, B1, B2, B9, B49, B66) (n = 23) were identified without transposons or integrons in their immediate environments. Multiple and diverse mutations were found in gyrA (including S83I/Y and T/I83I/T), gyrB, parC and parE, which were clonally specific. There were vertical and horizontal transmission of high-level FQ resistance in Enterobacteriaceae in hospitals in Durban, South Africa, which are mediated by efflux, PMQR genes, and gyrA, gyrB, parC and parE mutations."
https://openalex.org/W2718091346,"Changes in maternal innate immunity during healthy human pregnancy are not well understood. Whether basal immune status in vivo is largely unaffected by pregnancy, is constitutively biased towards an inflammatory phenotype (transiently enhancing host defense) or exhibits anti-inflammatory bias (reducing potential responsiveness to the fetus) is unclear. Here, in a longitudinal study of healthy women who gave birth to healthy infants following uncomplicated pregnancies within the Canadian Healthy Infant Longitudinal Development (CHILD) cohort, we test the hypothesis that a progressively altered bias in resting innate immune status develops. Women were examined during pregnancy and again, one and/or three years postpartum. Most pro-inflammatory cytokine expression, including CCL2, CXCL10, IL-18 and TNFα, was reduced in vivo during pregnancy (20–57%, p<0.0001). Anti-inflammatory biomarkers (sTNF-RI, sTNF-RII, and IL-1Ra) were elevated by ~50–100% (p<0.0001). Systemic IL-10 levels were unaltered during vs. post-pregnancy. Kinetic studies demonstrate that while decreased pro-inflammatory biomarker expression (CCL2, CXCL10, IL-18, and TNFα) was constant, anti-inflammatory expression increased progressively with increasing gestational age (p<0.0001). We conclude that healthy resting maternal immune status is characterized by an increasingly pronounced bias towards a systemic anti-inflammatory innate phenotype during the last two trimesters of pregnancy. This is resolved by one year postpartum in the absence of repeat pregnancy. The findings provide enhanced understanding of immunological changes that occur in vivo during healthy human pregnancy."
https://openalex.org/W2678799679,"Melatonin therapy or prolonged exposure to complete darkness reduces biliary hyperplasia and liver fibrosis in bile-duct-ligated (BDL) rats; however, no information exists in primary sclerosing cholangitis (PSC). Thus, we aimed to determine the therapeutic effects of prolonged dark therapy or melatonin administration on hepatic fibrosis in the multidrug resistance gene 2-knockout (Mdr2-/-) mouse model of PSC. Melatonin levels, biliary mass, liver fibrosis, angiogenesis and miR-200b expression were evaluated in wild-type and Mdr2-/- mice exposed to darkness or melatonin treatment or in male patients with PSC and healthy controls. Mdr2-/- mice were also treated with miR-200b inhibitor or control before evaluating biliary mass, liver fibrosis, and angiogenesis. After overexpression of arylalkylamine N-acetyltransferase (AANAT; the enzyme regulating melatonin synthesis) or inhibition of miR-200b in cholangiocytes and hepatic stellate cells in vitro, we evaluated angiogenesis and fibrosis gene expression. After exposure to darkness or administration of melatonin, Mdr2-/- mice show elevated serum melatonin levels and inhibition of biliary mass, along with reduction of liver fibrosis and angiogenesis. MicroRNA PCR analysis demonstrated that miR-200b expression increased in Mdr2-/- mice and patients with PSC compared with controls and decreased in Mdr2-/- mice subjected to dark exposure or melatonin treatment. Inhibition of miR-200b in Mdr2-/- ablates biliary proliferation, liver fibrosis, and angiogenesis. In vitro, overexpression of AANAT or inhibition of miR-200b in cholangiocytes and hepatic stellate cells decreased the expression of miR-200b, angiogenesis, and fibrosis genes. Dark therapy or targeting melatonin/miR-200b axis may be important in the management of biliary damage and liver fibrosis in cholangiopathies including PSC.-Wu, N., Meng, F., Zhou, T., Han, Y., Kennedy, L., Venter, J., Francis, H., DeMorrow, S., Onori, P., Invernizzi, P., Bernuzzi, F., Mancinelli, R., Gaudio, E., Franchitto, A., Glaser, S., Alpini G. Prolonged darkness reduces liver fibrosis in a mouse model of primary sclerosing cholangitis by miR-200b down-regulation."
https://openalex.org/W2634423591,"MicroRNAs (miRNAs) are small noncoding nucleotides that play major roles in the response of host immune cells. Autophagy plays a key role in activating the antimicrobial host defense against Mycobacterium tuberculosis (M. tuberculosis). Whether miRNAs specifically influence the activation of macrophage autophagy during M. tuberculosis infection is largely unknown. In the present study, we demonstrate that Mycobacterium bovis Bacillus Calmette-Guérin (BCG) infection of macrophages leads to increased expression of miR-144-3p, which targets autophagy-related gene 4a (ATG4a), to inhibit autophagy activation and antimicrobial responses to BCG. Overexpression of miR-144-3p significantly decreased both mRNA and protein levels of ATG4a, inhibited the formation of autophagosomes in RAW264.7 cells and increased intracellular survival of BCG. However, transfection with miR-144-3p inhibitor led to an increase in ATG4a levels, accelerated the autophagic response in macrophages, and decreased BCG survival in macrophages. The experimental results of this study reveal a novel role of miR-144-3p in inhibiting autophagy activation by targeting ATG4a and enhancing BCG infection, and provide potential targets for developing improved treatment."
https://openalex.org/W2710170885,"The histidine-phosphorylatable phosphocarrier protein (HPr) is an essential component of the sugar-transporting phosphotransferase system (PTS) in many bacteria. Recent interactome findings suggested that HPr interacts with several carbohydrate-metabolizing enzymes, but whether HPr plays a regulatory role was unclear. Here, we provide evidence that HPr interacts with a large number of proteins in Escherichia coli We demonstrate HPr-dependent allosteric regulation of the activities of pyruvate kinase (PykF, but not PykA), phosphofructokinase (PfkB, but not PfkA), glucosamine-6-phosphate deaminase (NagB), and adenylate kinase (Adk). HPr is either phosphorylated on a histidyl residue (HPr-P) or non-phosphorylated (HPr). PykF is activated only by non-phosphorylated HPr, which decreases the PykF Khalf for phosphoenolpyruvate by 10-fold (from 3.5 to 0.36 mm), thus influencing glycolysis. PfkB activation by HPr, but not by HPr-P, resulted from a decrease in the Khalf for fructose-6-P, which likely influences both gluconeogenesis and glycolysis. Moreover, NagB activation by HPr was important for the utilization of amino sugars, and allosteric inhibition of Adk activity by HPr-P, but not by HPr, allows HPr to regulate the cellular energy charge coordinately with glycolysis. These observations suggest that HPr serves as a directly interacting global regulator of carbon and energy metabolism and probably of other physiological processes in enteric bacteria."
https://openalex.org/W2701182017,"Atrial fibrillation (AF) is a major risk factor for ischemic stroke and associated with a 5-fold higher risk of stroke. In this retrospective cohort study, the incidence of and risk factors for ischemic stroke in patients with AF were identified. All patients (≥30 years old) without previous stroke who were diagnosed with AF in 2007–2013 were selected from the National Health Insurance Service-National Sample Cohort. To identify factors that influenced ischemic stroke risk, Cox proportional hazard regression analysis was conducted. During a mean follow-up duration of 3.2 years, 1022 (9.6%) patients were diagnosed with ischemic stroke. The overall incidence rate of ischemic stroke was 30.8/1000 person-years. Of all the ischemic stroke that occurred during the follow-up period, 61.0% occurred within 1-year after AF diagnosis. Of the patients with CHA2DS2-VASc score of ≥2, only 13.6% were receiving warfarin therapy within 30 days after AF diagnosis. Relative to no antithrombotic therapy, warfarin treatment for >90 days before the index event (ischemic stroke in stroke patients and death/study end in non-stroke patients) associated with decreased ischemic stroke risk (Hazard Ratio = 0.41, 95%confidence intervals = 0.32–0.53). Heart failure, hypertension, and diabetes mellitus associated with greater ischemic stroke risk. AF patients in Korea had a higher ischemic stroke incidence rate than patients in other countries and ischemic stroke commonly occurred at early phase after AF diagnosis. Long-term (>90 days) continuous warfarin treatment may be beneficial for AF patients. However, warfarin treatment rates were very low. To prevent stroke, programs that actively detect AF and provide anticoagulation therapy are needed."
https://openalex.org/W2657409977,"People who inject drugs (PWID) are historically viewed as having ""difficult to treat"" hepatitis C disease, with perceived inferior treatment adherence and outcomes, and concerns regarding reinfection risk. We evaluated for differences in treatment adherence and response to Peginterferon-alfa-2a/Ribavirin (Peg-IFNα/RBV) in a large urban cohort with and without a history of remote or recent injection drug use.Patient data was retrospectively reviewed for 1000 consecutive patients-608 former (no injecting drug use for 6 months of therapy), 85 recent (injecting drug use within 6 months) PWID, and 307 non-drug users who were treated for chronic hepatitis C with Peg-IFNα/RBV. The groups were compared for baseline characteristics, treatment adherence, and outcome.There was no significant difference in treatment non-adherence between the groups (8.4% in PWID vs 6.8% in non-PWIDs; RR = 1.23, CI 0.76-1.99). The overall SVR rate in PWID (64.2%) was not different from non-PWIDs (60.9%) [RR = 1.05, 95% CI 0.95-1.17]. There was no significant difference in SVR rates between the groups controlling for genotype (48.4% vs 48.4% for genotype 1; 74.9 vs 73.3% for genotype 3). Former and recent PWID had similar adherence rates.PWID have comparable treatment adherence and SVR rates when compared to non-drug users treated with Peg-IFNα/RBV. These data support a public health strategy of HCV treatment and eradication in PWID in the DAA era."
https://openalex.org/W2666399940,"To evaluate if plasma kisspeptin concentrations are associated with insulin secretion, as suggested by recent in vitro studies, independently of confounders. 261 nondiabetic subjects were stratified into tertiles according to kisspeptin values. Insulin secretion was assessed using indexes derived from oral glucose tolerance test (OGTT). After adjusting for age, gender, and BMI, subjects in the highest (tertile 3) kisspeptin group exhibited significantly lower values of insulinogenic index, corrected insulin response (CIR30), and Stumvoll indexes for first-phase and second-phase insulin release as compared with low (tertile 1) or intermediate (tertile 2) kisspeptin groups. Univariate correlations between kisspeptin concentration and metabolic variables showed that kisspeptin concentration was significantly and positively correlated with age, blood pressure, and 2-h post-load glucose, and inversely correlated with BMI, and waist circumference. There was an inverse relationship between kisspeptin levels and OGTT-derived indexes of glucose-stimulated insulin secretion. A multivariable regression analysis in a model including all the variables significantly correlated with kisspeptin concentration showed thar age (β = -0.338, P<0.0001), BMI (β = 0.272, P<0.0001), 2-h post-load glucose (β = -0.229, P<0.0001), and kisspeptin (β = -0.105, P = 0.03) remained associated with insulinogenic index. These factors explained 34.6% of the variance of the insulinogenic index. In conclusion, kisspeptin concentrations are associated with insulin secretion independently of important determinants of glucose homeostasis such as gender, age, adiposity, 2-h post-load glucose, and insulin sensitivity."
https://openalex.org/W2712981630,"Excessive smartphone use causes personal and social problems. To address this issue, we sought to derive usage patterns that were directly correlated with smartphone dependence based on usage data. This study attempted to classify smartphone dependence using a data-driven prediction algorithm. We developed a mobile application to collect smartphone usage data. A total of 41,683 logs of 48 smartphone users were collected from March 8, 2015, to January 8, 2016. The participants were classified into the control group (SUC) or the addiction group (SUD) using the Korean Smartphone Addiction Proneness Scale for Adults (S-Scale) and a face-to-face offline interview by a psychiatrist and a clinical psychologist (SUC = 23 and SUD = 25). We derived usage patterns using tensor factorization and found the following six optimal usage patterns: 1) social networking services (SNS) during daytime, 2) web surfing, 3) SNS at night, 4) mobile shopping, 5) entertainment, and 6) gaming at night. The membership vectors of the six patterns obtained a significantly better prediction performance than the raw data. For all patterns, the usage times of the SUD were much longer than those of the SUC. From our findings, we concluded that usage patterns and membership vectors were effective tools to assess and predict smartphone dependence and could provide an intervention guideline to predict and treat smartphone dependence based on usage data."
https://openalex.org/W2629048428,"Three experiments were conducted separately to estimate the digestible Lys (dig. Lys) requirements of Cobb × Cobb 500 male broilers using different statistical models. For each experiment, 1,200 chicks were housed in 48 floor pens in a completely randomized design with 6 treatments and 8 replicates. Broilers were fed diets with increasing dig. Lys levels from 1 to 12 d (Exp. 1), from 12 to 28 d (Exp. 2), and 28 to 42 d (Exp. 3). Increasing dig. Lys levels were equally spaced from 0.97 to 1.37% in Exp. 1, 0.77 to 1.17% in Exp. 2, and 0.68 to 1.07% in Exp. 3. The lowest dig. Lys diets were not supplemented with L-Lysine and all other essential AA met or exceeded recommendations. In Exp. 3, six birds per pen were randomly selected from each replication to evaluate carcass and breast yields. Digestible Lys requirements were estimated by quadratic polynomial (QP), linear broken-line (LBL), quadratic broken-line (QBL), and exponential asymptotic (EA) models. Overall, dig. Lys requirements varied among response variables and statistical models. Increasing dietary dig. Lys had a positive effect on BW, carcass and breast yields. Levels of dig. Lys that optimized performance using QP, LBL, QBL, and EA models were 1.207, 1.036, 1.113, and 1.204% for BWG and 1.190, 1.027, 1.100, and 1.172% for FCR in Exp. 1; 1.019, 0.853, 0.944; 1.025% for BWG and 1.050, 0.879, 1.032, and 1.167% for FCR in Exp. 2; and 0.960, 0.835, 0.933, and 1.077% for BWG, 0.981, 0.857, 0.963, and 1.146% for FCR in Exp. 3. The QP, LBL, QBL, and EA also estimated dig. Lys requirements as 0.941, 0.846, 0.925, and 1.070% for breast meat yield in Exp. 3. In conclusion, Lys requirements vary greatly according to the statistical analysis utilized; therefore, the origin of requirement estimation must be taken into account in order to allow adequate comparisons between references."
https://openalex.org/W2663228963,"Hepatitis B virus (HBV) infection remains a major public health concern worldwide with 240 million individuals chronically infected and at risk of developing cirrhosis and hepatocellular carcinoma. Current treatments rarely cure chronic hepatitis B infection, highlighting the need for new anti-HBV drugs. Nucleic acid polymers (NAPs) are phosphorothioated oligonucleotides that have demonstrated a great potential to inhibit infection with several viruses. In chronically infected human patients, NAPs administration lead to a decline of blood HBsAg and HBV DNA and to HBsAg seroconversion, the expected signs of functional cure. NAPs have also been shown to prevent infection of duck hepatocytes with the Avihepadnavirus duck hepatitis B virus (DHBV) and to exert an antiviral activity against established DHBV infection in vitro and in vivo. In this study, we investigated the specific anti-HBV antiviral activity of NAPs in the HepaRG human hepatoma cell line and primary cultures of human hepatocytes. NAPs with different chemical features (phosphorothioation, 2'O-methyl ribose, 5-methylcytidine) were assessed for antiviral activity when provided at the time of HBV inoculation or post-inoculation. NAPs dose-dependently inhibited HBV entry in a phosphorothioation-dependent, sequence-independent and size-dependent manner. This inhibition of HBV entry by NAPs was impaired by 2'O-methyl ribose modification. NAP treatment after viral inoculation did not elicit any antiviral activity."
https://openalex.org/W2631256751,"Macrophages (Mϕs) of patients with Alzheimer's disease and mild cognitive impairment (MCI) are defective in amyloid-β1-42 (Aβ) phagocytosis and have low resistance to apoptosis by Aβ. Omega-3 fatty acids (ω-3s) in vitro and in vivo and the ω-3 mediator, resolvin D1, in vitro increase Aβ phagocytosis by Mϕs of patients with MCI. We have investigated the unfolded protein response (UPR) to endoplasmic reticulum (ER) stress by Mϕs in a longitudinal study of fish-derived, ω-3-supplemented patients with MCI. Patients in the apolipoprotein E (ApoE)e3/e3 subgroup over time exhibited an increase of protein kinase RNA-like ER kinase (PERK) expression, Aβ phagocytosis, intermediate M1-M2 Mϕ type, and a Mini-Mental State Examination (MMSE) rate of change of +1.8 points per year, whereas patients in the ApoEe3/e4 subgroup showed individually divergent results with an MMSE rate of change of -3.2 points per year. In vitro treatment of Mϕs by fish-derived ω-3 emulsion increased Aβ phagocytosis, PERK expression, and UPR RNA signature, and decreased ER stress signature. Augmented genes in the UPR signature included chaperones, lectins, foldases, and N-linked glycosylation enzymes. In summary, fish-derived ω-3s increase cytoprotective genes and decrease proapoptotic genes, improve immune clearance of Aβ, and are associated with an improved MMSE rate of change in ApoEe3/e3 vs. ApoEe3/e4 patients.-Olivera-Perez, H. M., Lam, L., Dang, J., Jiang, W., Rodriguez, F., Rigali, E., Weitzman, S., Porter, V., Rubbi, L., Morselli, M., Pellegrini, M., Fiala, M. Omega-3 fatty acids increase the unfolded protein response and improve amyloid-β phagocytosis by macrophages of patients with mild cognitive impairment."
