id,abstract
https://openalex.org/W2050717506,"Two new methods were used to establish a rapid and highly sensitive prenatal diagnostic test for sickle cell anemia. The first involves the primer-mediated enzymatic amplification of specific beta-globin target sequences in genomic DNA, resulting in the exponential increase (220,000 times) of target DNA copies. In the second technique, the presence of the beta A and beta S alleles is determined by restriction endonuclease digestion of an end-labeled oligonucleotide probe hybridized in solution to the amplified beta-globin sequences. The beta-globin genotype can be determined in less than 1 day on samples containing significantly less than 1 microgram of genomic DNA."
https://openalex.org/W2159363679,"A novel potential cell surface receptor of the tyrosine kinase gene family has been identified and characterized by molecular cloning. Its primary sequence is very similar to that of the human epidermal growth factor receptor and the v-erbB oncogene product; the chromosomal location of the gene for this protein is coincident with the neu oncogene, which suggests that the two genes may be identical."
https://openalex.org/W2000247756,"This study provides evidence that the alpha 2-adrenergic receptor agonist clonidine ameliorates the cognitive deficits exhibited by aged nonhuman primates through drug actions at alpha 2 receptors. Furthermore, pharmacological profiles in animals with lesions restricted to the dorsolateral prefrontal cortex indicate that this area may be the site of action for some of clonidine's beneficial effects. These results demonstrate that alpha-adrenergic systems contribute to cognitive function and suggest a new strategy for treating memory disorders in aged humans."
https://openalex.org/W2025049903,
https://openalex.org/W2048180296,"In several bursal lymphoma cell lines in which c-myc transcription is regulated by avian leukosis virus (ALV) long terminal repeat (LTR) sequences, protein synthesis inhibition decreases the transcriptional activity of c-myc as well as other LTR driven viral genes. This decrease in transcription is associated with a change in the chromatin structure of c-myc, as measured by deoxyribonuclease I (DNase I) hypersensitivity, and a shift of transcription from the LTR to the normal c-myc promoter. In contrast, cycloheximide had little or no effect on the transcription of LTR driven genes in infected chicken embryo fibroblasts treated with the drug. These results suggest that a labile, cell type-specific protein may interact with the retroviral LTR and regulate transcription of genes under LTR control. Further, the results demonstrate that the increase in intracellular concentration of c-myc RNA induced by cycloheximide treatment of normal cells is the result of stabilization of this message."
https://openalex.org/W1998562271,
https://openalex.org/W2052561020,"We show that dam- mutants are a major class of E. coli mutants with increased IS10 activity. IS10 has two dam methylation sites, one within the transposase promoter and one within the inner terminus where transposase presumably binds. Absence of methylation results in increased activity of both promoter and terminus, and completely accounts for increased transposition in dam- strains. Transposition of Tn903 and Tn5 are also increased in dam- strains, probably for analogous reasons. Transposition is also increased when IS10 is hemimethylated. One hemimethylated species is much more active than the other and is estimated to be at least 1000 times more active than a fully methylated element. Evidence is presented that the promoter and inner terminus of IS10 are coordinately activated in a dam-dependent fashion, presumably because they are hemimethylated at the same time. Thus, in dam+ strains, IS10 will transpose preferentially when DNA is hemimethylated. We suggest specifically that IS10 transposition may preferentially occur immediately after passage of a chromosomal replication fork."
https://openalex.org/W1990167868,
https://openalex.org/W1998451617,
https://openalex.org/W1513078811,"We have identified cDNAs clones for several cold-inducible mRNAs from the brown adipose tissue of mice. pCIN-1, a plasmid with a 900-base pair insert, encoded the mitochondrial uncoupling protein (UCP) as determined by the ability of the cDNA insert to select, by hybridization, an mRNA that could be translated into a 32,000-Da protein immunoprecipitable with anti-UCP antibodies. Nine tissues were analyzed; however, UCP cDNA hybridized to an mRNA species of 1.6 and 2.0 kilobase pairs only in brown adipose tissue. A maximum induction of 10-fold occurred within 6 h of exposure to cold (5 degrees C). A BamHI restriction fragment polymorphism detected by Southern blot analysis of genomic DNA in recombinant inbred mouse strains allowed us to map the UCP gene to Chromosome 8. The analysis of the UCP gene expression in diabetic (db) and obese (ob) mice maintained at 27 degrees C for 3 days followed by cold exposure for 4 h at 5 degrees C indicated that UCP mRNA levels in mutant mice were unaffected at 27 degrees C and only slightly reduced at 5 degrees C. Accordingly, the inability of diabetic and obese mice to thermoregulate is not associated with a lack of UCP mRNA induction."
https://openalex.org/W2168697593,"A retroviral expression vector (N2) containing the selectable gene, neoR, has been used to determine the optimal conditions for infecting murine hematopoietic progenitor cells at high efficiency. After infected bone marrow cells were introduced into lethally irradiated mice, the presence, stability, and expression of the vector DNA sequences were analyzed either in individual spleen foci 10 days later or in the blood, bone marrow, and spleens of mice 4 months later. When bone marrow cells were cultured in medium containing virus with titers of more than 10(6) colony-forming units per milliliter in the presence of purified murine interleukin-3, more than 85 percent of the resulting foci contained vector DNA. This proviral vector DNA was intact. Efficient expression of the neoR gene was demonstrated in most of the DNA-positive foci examined. The spleens of reconstituted animals (over a long term) contained intact ""vector DNA"" and the blood and bone marrow expressed the neoR gene in some animals. Thus, a retroviral vector can be used to introduce intact exogenous DNA sequences into hematopoietic stem cells with high efficiency and with substantial expression."
https://openalex.org/W1667874699,"Leader peptidase cleaves the amino-terminal leader sequences of many secreted and membrane proteins. We have examined the function of leader peptidase by constructing an Escherichia coli strain where its synthesis is controlled by the arabinose B promoter. This strain requires arabinose for growth. When the synthesis of leader peptidase is repressed, protein precursors accumulate, including the precursors of M13 coat protein (an inner membrane protein), maltose binding protein (a periplasmic protein), and OmpA protein (an outer membrane protein). These precursors are translocated across the plasma membrane, as judged by their sensitivity to added proteinase K. However, pro-OmpA and pre-maltose binding protein are retained at the outer surface of the inner membrane. Thus, leader peptides anchor translocated pre-proteins to the outer surface of the plasma membrane and must be removed to allow their subsequent release into the periplasm or transit to the outer membrane."
https://openalex.org/W1533126363,"R 59 022 (6-[2-[4-[(4-fluorophenyl) phenylmethylene)-1-piperidinyl]ethyl]-7-methyl-5H-thiazolo[3,2-alpha] pyrimidin-5-one) was found to inhibit diacylglycerol kinase in human red blood cell membranes at concentrations where polyphosphoinositide phosphodiesterase, phosphatidylinositol kinase, and phosphatidylinositol 4-phosphate kinase activity remained unaffected. The concentration needed for half-maximal inhibition (IC50) was 2.8 +/- 1.5 X 10(-6) M for the kinase acting on endogenous diacylglycerol and 3.3 +/- 0.4 X 10(-6) M when 1-oleoyl-2-acetylglycerol (OAG) was added exogenously as substrate. In intact platelets, R 59 022 inhibits the phosphorylation of OAG to 1-oleoyl-2-acetylglyceryl-3-phosphoric acid (OAPA) (IC50: 3.8 +/- 1.2 X 10(-6) M); concomitantly the stimulation of protein kinase C activity by OAG was amplified. When in platelets inositol lipid turnover is accelerated by thrombin, further addition of R 59 022 results in a marked elevation of diacylglycerol levels, a decreased formation of phosphatidic acid and an increased protein kinase C activity as compared with the controls. It is concluded that in studies on the signal-transducing system coupled to inositol lipid metabolism R 59 022 might occupy a role comparable to cyclic AMP phosphodiesterase inhibitors, since it potentiates the effect of the putative second messenger diacylglycerol by preventing its rapid metabolism."
https://openalex.org/W2072973218,"Human granulocyte-macrophage colony-stimulating factor (GM-CSF) is a 22,000-dalton glycoprotein that stimulates the growth of myeloid progenitor cells and acts directly on mature neutrophils. A full-length complementary DNA clone encoding human GM-CSF was used as a probe to screen a human genomic library and isolate the gene encoding human GM-CSF. The human GM-CSF gene is approximately 2.5 kilobase pairs in length with at least three intervening sequences. The GM-CSF gene was localized by somatic cell hybrid analysis and in situ hybridization to human chromosome region 5q21-5q32, which is involved in interstitial deletions in the 5q- syndrome and acute myelogenous leukemia. An established, human promyelocytic leukemia cell line, HL60, contains a rearranged, partially deleted GM-CSF allele and a candidate 5q- marker chromosome, indicating that the truncated GM-CSF allele may reside at the rejoining point for the interstitial deletion on the HL60 marker chromosome."
https://openalex.org/W1510671746,"Receptors for a chemotactic peptide (fMet-Leu-Phe) in guinea pig neutrophils were primarily coupled to phospholipase C catalyzing breakdown of phosphatidylinositol 4,5-bisphosphate to inositol 1,4,5-trisphosphate, which was in turn responsible for intracellular Ca2+ mobilization. These early responses of neutrophils to fMet-Leu-Phe, eventually leading to O2- generation, were abolished by prior exposure of cells to islet-activating protein (IAP), pertussis toxin, which had been reported to bring about ADP-ribosylation of a membrane Mr = 41,000 protein (Okajima, F., and Ui, M. (1984) J. Biol. Chem. 259, 13863-13871). The IAP substrate, probably the inhibitory guanine nucleotide-binding regulatory component of adenylate cyclase (Ni) or an analogous protein, is hence proposed to mediate fMet-Leu-Phe receptor-linked activation of the phospholipase C. In support of this proposal, A23187 and phorbol myristate acetate which stimulate arachidonate release or O2- generation by-passing these early processes of signaling were effective in IAP-treated cells as well. Release of arachidonic acid and accumulation of inositol 1-monophosphate in delayed response to fMet-Leu-Phe were also abolished by the IAP treatment of cells, despite the fact that slowly-onset inflow of Ca2+ which must be responsible for these delayed responses was observed in these IAP-treated cells. Thus, the IAP substrate may play an additional role in Ca2+-dependent activation of somehow compartmentalized phospholipases."
https://openalex.org/W2016167564,"Regulation of transcription of members of the ras gene family undoubtably plays an important role in controlling cellular growth. Examination of this level of regulation requires identification of the promoter regions of the ras proto-oncogenes. Four major transcriptional start sites were detected in the human Harvey ras 1 proto-oncogene. The promoter region contains neither a TATA box nor a CAAT box in their characteristic upstream positions, has an extremely high G+C content (80 percent), and contains multiple GC boxes including seven CCGCCC repeats and three repeats of the inverted complement, GGGCGG. This region has strong promoter activity when placed upstream from the chloramphenicol acetyl transferase gene and transfected into monkey CV1 cells. In these ways the Harvey ras 1 proto-oncogene promoter resembles the promoter of the gene encoding the epidermal growth factor (EGF) receptor. The similarity between the two proto-oncogene promoters may be relevant to the mechanism by which the expression of such ""growth control"" genes is regulated."
https://openalex.org/W2050795594,"The products of the adenovirus-2 (Ad2) immortalizing oncogene E1A repress the activity of the SV40, polyoma virus and E1A enhancers. Evidence is presented that Ad2 infection of MPC11 plasmocytoma cells results in an inhibition of transcription of both the γ2b heavy chain (IgH) and the kappa light chain immunoglobulin genes. This inhibition is caused by the Ad2 E1A products. Furthermore, the Ad2 E1A products repress transcription activated by the immunoglobulin heavy chain enhancer in chimeric recombinants, which are either stably integrated in the genome of lymphoid cells or are present as episomes. The implications of negative regulation of cellular enhancers are discussed."
https://openalex.org/W1985979064,
https://openalex.org/W1982604639,
https://openalex.org/W1970255533,
https://openalex.org/W2089796770,"Biochemical components (splicing factors) interact with specific intron regions during pre-mRNA splicing in vitro. The pre-mRNA specifically associates with factors at both the branch point and the 5' splice site and these RNA-factor interactions are maintained in the intron-containing RNA processing products. The first detectable event, the ATP-dependent association of a factor (or factors) with the branch point, is mediated by at least one factor containing an essential nucleic acid component. Mutant RNA substrates that lack either the 5' splice site or the vast majority of exon sequences can still associate with the branch point binding factor(s). However, this branch point-factor interaction does not occur with a mutant RNA substrate that contains the branch point but that lacks the 3' splice site consensus sequence. These results suggest that selection of the 3' splice site accompanied by the association of a factor with the branch point may be the initial step in mammalian pre-mRNA splicing."
https://openalex.org/W1578045006,"The expression of insulin-like growth factor (IGF) receptors at the cell surface and the changes in IGF responsiveness during differentiation were studied in the L6 skeletal muscle cell line. Throughout the entire developmental sequence, distinct receptors for IGF I and IGF II that differed in structure and peptide specificity could be demonstrated. During differentiation, both 125I-IGF I and 125I-IGF II binding to the L6 cells decreased as a result of a 3-4-fold reduction in receptor number, whereas 125I-insulin binding increased. Under nonreducing conditions, disuccinimidyl suberate cross-linked 125I-IGF I and 125I-IGF II to two receptor complexes with apparent Mr greater than 300,000 (type I) and 220,000 (type II). Under reducing conditions, the apparent molecular weight of the type I receptor changed to Mr 130,000 (distinct from the 120,000 insulin receptor) and the type II receptor changed to 250,000. IGF I and IGF II both stimulated 2-deoxy-D-glucose and alpha-aminoisobutyric acid uptake in the L6 cells with a potency close to that of insulin, apparently through interaction with their own receptors. The stimulatory effects of IGF II correlated with its affinity for the type II but not the type I IGF receptor, as measured by inhibition of affinity labeling, whereas the effects of IGF I correlated with its ability to inhibit labeling of the type I receptor. In spite of the decrease in type I and type II receptor number, stimulation of 2-deoxy-glucose and alpha-aminoisobutyric acid uptake by the two IGFs increased during differentiation."
https://openalex.org/W2133293608,"beta-Adrenergic receptors, the GTP-binding regulatory protein that stimulates adenylate cyclase (Gs), and adenylate cyclase were each purified and reconstituted into unilamellar vesicles composed of phosphatidylethanolamine and phosphatidylserine (3:2, w/w). The molar ratio of receptor:Gs:adenylate cyclase was estimated to be about 1:10:1. Adenylate cyclase activity in the vesicles was stimulated up to 2.6-fold by beta-adrenergic agonists. Stimulation was dependent on the presence of guanine nucleotide, displayed appropriate beta-adrenergic selectivity and stereoselectivity for agonists, and was blocked appropriately by beta-adrenergic antagonists. Therefore, while additional proteins may modulate adenylate cyclase activity in native membranes, these results show that these three proteins are sufficient for the expression of hormone-stimulated adenylate cyclase."
https://openalex.org/W2166236008,"In order to circumvent problems associated with direct chemical analysis of the phase-1 flagellar filament protein (flagellin) of Salmonella typhimurium, the covalent structure was determined by recombinant DNA procedures. The corresponding structural gene (H-1i) was cloned into plasmid pBR322 in a 4.3-kilobase fragment produced by EcoRI digestion of chromosomal DNA, and the nucleotide sequence of the region specifying the flagellar protein was determined. Comparison of the data obtained with the limited information available for other salmonellar flagellins supported the concept that both ends of the molecule are conserved in this genus. Additionally, a conservation of base sequence in the region of H-1 genes coding for the N-terminal end of flagellins was apparent, suggesting that this area may have an additional regulatory role. The i flagellin was found to be unrelated to proteins in the NBRF data base with the exception of other flagellins. The three flagellins which have been sequenced to date (those produced by Bacillus subtilis, Caulobacter crescentis, and phase-1 S. typhimurium) show homologies in amino acid sequence at both the N-terminal and C-terminal ends despite large differences in their total molecular weight, and comparison suggests that B. subtilis and Salmonella are more closely related to each other than either is to Caulobacter."
https://openalex.org/W1919115463,"Angiotensin II can inhibit glucagon-stimulated cyclic AMP production in hepatocytes and adenylate cyclase activity in hepatic membranes. Pertussis toxin, an exotoxin produced by Bordetella pertussis, was used to investigate the role of the inhibitory guanine nucleotide-binding regulatory protein of adenylate cyclase (Ni) in coupling angiotensin receptors to the adenylate cyclase system. An assay was developed using [32P] NAD+ to quantitate the amount of Ni protein in the membrane and the extent of its ADP-ribosylation catalyzed by toxin. The ability of angiotensin to inhibit adenylate cyclase and interact with its receptor was compared with the degree of modification of Ni in membranes prepared from isolated hepatocytes. In control membranes angiotensin II inhibited basal adenylate cyclase by 35%. When all of the Ni molecules in the membrane were ADP-ribosylated, angiotensin did not inhibit adenylate cyclase. However, the attenuation of angiotensin's effect on cyclase was not linearly correlated with the degree of modification of Ni; ADP-ribosylation of greater than 80% of the Ni was required before a reduction of the angiotensin effect was observed. A possible explanation for this finding is an excess of Ni molecules in the membrane (approximately 3.4 pmol/mg of membrane protein) over angiotensin II receptors (approximately 1.2 pmol/mg of membrane protein). 125I-angiotensin bound to sites in the membrane with two affinities. Computer fitting of the binding isotherms yielded parameters of N1 = 279 fmol/mg protein, Kd1 = 0.2 nM; N2 = 904 fmol/mg protein, Kd2 = 1.4 nM. When all of the Ni molecules in the membrane were ADP-ribosylated, angiotensin bound to only one site with binding parameters of N = 349 fmol/mg protein, Kd = 0.4 nM. GTP-gamma-S caused a 7-fold increase in the Kd of this site to 2.7 nM. Overall, the data indicate that the Ni protein mediates the effect of angiotensin on adenylate cyclase. The observation that GTP-gamma-S can markedly decrease the affinity of angiotensin receptors when all Ni molecules are ADP-ribosylated suggests that angiotensin receptors may couple to other GTP-binding proteins which may mediate the effects of angiotensin in other signal transduction systems."
https://openalex.org/W1533101741,"Four members of a family of GTP-binding proteins (G-proteins) which translate stimulation of extracellular receptors into regulation of intracellular enzymes were isolated from the bovine central nervous system. These proteins were examined for functional similarities and cross-reactivity with antibodies to the G-protein (transducin, Gt) from the photoreceptor system. Two proteins, Gs and Gi, can be distinguished by their respective abilities to stimulate or inhibit adenylate cyclase. The activated alpha subunits of Gt and a fourth member of the family, Go, did not affect this enzyme. Gt was shown to be unique in its ability to stimulate cGMP-dependent phosphodiesterase. While functionally diverse, the G-proteins were shown to have some common antigenic properties. Antibodies directed against the beta subunit of Gt recognize the beta 36 subunits of all preparations but not a putative second beta 35 subunit. Antibodies specific for the alpha subunit of Gt did not recognize other alpha subunits when immune blots from sodium dodecyl sulfate gels were examined. However, Go alpha, but not Gs alpha or Gi alpha, reacted strongly with the antibodies when the native subunit was spotted directly. This suggests that Go alpha and Gt alpha have homologous structural determinants. An antiserum that recognized Gt gamma did not recognize gamma subunits from other sources. These data support the proposed diversity of function and similarity of structure among the four G-proteins. The alpha and potentially gamma subunits appear to be responsible for the specificity of function."
https://openalex.org/W2013674606,
https://openalex.org/W1981168001,
https://openalex.org/W2023349831,"The B subunit of cholera toxin, which is multivalent and binds exclusively to a specific ganglioside, GM1, was mitogenic for rat thymocytes. When exposed to the B subunit, the cells proliferated, as measured by 3H-labeled thymidine incorporation. Mitogenesis depended on the direct interaction of the B subunit with GM1 on the surface of the cells. This demonstrates that endogenous plasma membrane gangliosides can mediate proliferation in lymphocytes."
https://openalex.org/W1981914096,
https://openalex.org/W1574301078,"Although insulin effectively blocked hormone-stimulated glycerol output in adipocytes or phosphorylase activation in hepatocytes, the inhibitory effect of insulin on cAMP analog-stimulated cells depended on the cAMP analog used. Of the 20 analogs tested in adipocytes and 13 tested in hepatocytes, the effects of about half of them were effectively blocked by insulin, whereas the effects of many of them were not inhibited at all. In order to approach the explanation for this discriminative insulin action, the inhibitory effects of insulin on the responses to the analogs in the intact cells were correlated with the in vitro cAMP analog specificity for the hepatocyte cAMP-dependent protein kinase isozymes and the low Km, hormone-sensitive phosphodiesterases from both cell types. No correlation was found between insulin resistance of analog-stimulated hepatocyte phosphorylase and the concentration of analog required in vitro for half-maximal activation of either type I or type II cAMP-dependent protein kinase from hepatocytes. However, a good correlation was found between insulin resistance of cAMP analog-stimulated responses and the analog I50 values for the phosphodiesterase from both cell types. Using a new method capable of measuring hydrolysis at low analog concentrations, several of those analogs which had relatively low, but not high, phosphodiesterase I50 values were shown to be directly hydrolyzed by the low Km adipocyte phosphodiesterase. The insulin inhibition of cell responses when stimulated by hydrolyzable analogs, but not by poorly hydrolyzable analogs, is best explained by insulin stimulation of the low Km phosphodiesterases from both cell types."
https://openalex.org/W1885787573,"A comparison of the DNA and protein sequences of a group of zein cDNA clones reveals that they share extensive sequence homology and probably originated from a common ancestral gene. A comparison of clones corresponding to Mr 22,000 polypeptides shows they are 92% homologous, while five clones corresponding to the Mr 19,000 zeins vary in homology from 75 to 95%. The clones corresponding to the Mr 22,000 proteins are 60-65% homologous to clones encoding the Mr 19,000 zein proteins. A clone corresponding to the Mr 15,000 zein has little homology to either the Mr 22,000 or 19,000 zeins. Clones corresponding to both the Mr 22,000 and 19,000 zeins have two putative polyadenylation signals. S1 nuclease mapping indicates that the first polyadenylation signal following the stop codon is utilized by the Mr 22,000 sequences, while primarily the second polyadenylation signal is utilized by the Mr 19,000 sequences."
