id,abstract
https://openalex.org/W2066972000,"μ-opioid receptors (MORs) are necessary for the analgesic and addictive effects of opioids such as morphine, but the MOR-expressing neuronal populations that mediate the distinct opiate effects remain elusive. Here we devised a new conditional bacterial artificial chromosome rescue strategy to show, in mice, that targeted MOR expression in a subpopulation of striatal direct-pathway neurons enriched in the striosome and nucleus accumbens, in an otherwise MOR-null background, restores opiate reward and opiate-induced striatal dopamine release and partially restores motivation to self administer an opiate. However, these mice lack opiate analgesia or withdrawal. We used Cre-mediated deletion of the rescued MOR transgene to establish that expression of the MOR transgene in the striatum, rather than in extrastriatal sites, is needed for the restoration of opiate reward. Our study demonstrates that a subpopulation of striatal direct-pathway neurons is sufficient to support opiate reward-driven behaviors and provides a new intersectional genetic approach to dissecting neurocircuit-specific gene function in vivo."
https://openalex.org/W2062370602,"Inhibition sculpts neural activity through various cell types and circuits, but, unlike excitation, it is not self-propagating and must be locally recruited with a temporal delay. Here the authors show a fast, feedforward inhibitory mechanism that bypasses synaptic delay through ephaptic coupling of an interneuron to the axon initial segment of a projection cell. Excitatory synaptic activity in the brain is shaped and balanced by inhibition. Because inhibition cannot propagate, it is often recruited with a synaptic delay by incoming excitation. Cerebellar Purkinje cells are driven by long-range excitatory parallel fiber inputs, which also recruit local inhibitory basket cells. The axon initial segment of each Purkinje cell is ensheathed by basket cell axons in a structure called the pinceau, which is largely devoid of chemical synapses. In mice, we found at the single-cell level that the pinceau mediates ephaptic inhibition of Purkinje cell firing at the site of spike initiation. The reduction of firing rate was synchronous with the presynaptic action potential, eliminating a synaptic delay and allowing granule cells to inhibit Purkinje cells without a preceding phase of excitation. Axon-axon ephaptic intercellular signaling can therefore mediate near-instantaneous feedforward and lateral inhibition."
https://openalex.org/W2062573403,
https://openalex.org/W2021409414,"HP1(Hsα)-containing heterochromatin is located near centric regions of chromosomes and regulates DNA-mediated processes such as DNA repair and transcription. The higher-order structure of heterochromatin contributes to this regulation, yet the structure of heterochromatin is not well understood. We took a multidisciplinary approach to determine how HP1(Hsα)-nucleosome interactions contribute to the structure of heterochromatin. We show that HP1(Hsα) preferentially binds histone H3K9Me3-containing nucleosomal arrays in favor of non-methylated nucleosomal arrays and that nonspecific DNA interactions and pre-existing chromatin compaction promote binding. The chromo and chromo shadow domains of HP1(Hsα) play an essential role in HP1(Hsα)-nucleosome interactions, whereas the hinge region appears to have a less significant role. Electron microscopy of HP1(Hsα)-associated nucleosomal arrays showed that HP1(Hsα) caused nucleosome associations within an array, facilitating chromatin condensation. Differential sedimentation of HP1(Hsα)-associated nucleosomal arrays showed that HP1(Hsα) promotes interactions between arrays. These strand-to-strand interactions are supported by in vivo studies where tethering the Drosophila homologue HP1a to specific sites promotes interactions with distant chromosomal sites. Our findings demonstrate that HP1(Hsα)-nucleosome interactions cause chromatin condensation, a process that regulates many chromosome events."
https://openalex.org/W2066522201,"IL-6 is a secreted cytokine that functions through binding two cell surface receptors, IL-6Rα and gp130. Because of its involvement in the progression of several chronic inflammatory diseases, IL-6 is a target of pharmacologic interest. We have recently identified a novel class of ligands called SOMAmers (S low Off-rate Modified Aptamers) that bind IL-6 and inhibit its biologic activity. SOMAmers exploit the chemical diversity of protein-like side chains assembled on flexible nucleic acid scaffolds, resulting in an expanded repertoire of intra- and intermolecular interactions not achievable with conventional aptamers. Here, we report the co-crystal structure of a high affinity SOMAmer (Kd = 0.20 nm) modified at the 5-position of deoxyuridine in a complex with IL-6. The SOMAmer, comprised of a G-quartet domain and a stem-loop domain, engages IL-6 in a clamp-like manner over an extended surface exhibiting close shape complementarity with the protein. The interface is characterized by substantial hydrophobic interactions overlapping the binding surfaces of the IL-6Rα and gp130 receptors. The G-quartet domain retains considerable binding activity as a disconnected autonomous fragment (Kd = 270 nm). A single substitution from our diversely modified nucleotide library leads to a 37-fold enhancement in binding affinity of the G-quartet fragment (Kd = 7.4 nm). The ability to probe ligand surfaces in this manner is a powerful tool in the development of new therapeutic reagents with improved pharmacologic properties. The SOMAmer·IL-6 structure also expands our understanding of the diverse structural motifs achievable with modified nucleic acid libraries and elucidates the nature with which these unique ligands interact with their protein targets."
https://openalex.org/W2143808146,"Generation of human induced pluripotent stem cells from patient fibroblasts containing ring chromosomes with large deletions reveals that reprogrammed cells lose the abnormal chromosome and duplicate the wild-type homologue through compensatory uniparental disomy, suggesting that cellular reprogramming may hold potential for ‘chromosome therapy’. Ring chromosomes are structural aberrations that are often associated with birth defects, mental disabilities and growth retardation. Shinya Yamanaka and colleagues derived human induced pluripotent stem (iPS) cells from patient fibroblasts containing ring chromosomes with large deletions, and found that reprogrammed cells lose the abnormal chromosome and duplicate the wild-type homologue through the compensatory uniparental disomy mechanism. Thus, iPS cells have an intrinsic capacity to purge very damaged chromosomes that have ring structures and deletions spanning hundreds of megabases of DNA. The authors propose that cellular reprogramming might serve a very different function to the familiar one, acting as a means of 'chromosome therapy' that reverses combined loss-of-function across many genes in cells with large-scale aberrations involving ring structures. Ring chromosomes are structural aberrations commonly associated with birth defects, mental disabilities and growth retardation1,2. Rings form after fusion of the long and short arms of a chromosome, and are sometimes associated with large terminal deletions2. Owing to the severity of these large aberrations that can affect multiple contiguous genes, no possible therapeutic strategies for ring chromosome disorders have been proposed. During cell division, ring chromosomes can exhibit unstable behaviour leading to continuous production of aneuploid progeny with low viability and high cellular death rate3,4,5,6,7,8,9. The overall consequences of this chromosomal instability have been largely unexplored in experimental model systems. Here we generated human induced pluripotent stem cells (iPSCs)10,11,12 from patient fibroblasts containing ring chromosomes with large deletions and found that reprogrammed cells lost the abnormal chromosome and duplicated the wild-type homologue through the compensatory uniparental disomy (UPD) mechanism. The karyotypically normal iPSCs with isodisomy for the corrected chromosome outgrew co-existing aneuploid populations, enabling rapid and efficient isolation of patient-derived iPSCs devoid of the original chromosomal aberration. Our results suggest a fundamentally different function for cellular reprogramming as a means of ‘chromosome therapy’13 to reverse combined loss-of-function across many genes in cells with large-scale aberrations involving ring structures. In addition, our work provides an experimentally tractable human cellular system for studying mechanisms of chromosomal number control, which is of critical relevance to human development and disease."
https://openalex.org/W2105073325,"Mdm2 is a critical negative regulator of the tumor suppressor protein p53. Mdm2 is an E3 ligase whose overexpression leads to functional inactivation of p53. Mdm2 protein stability is regulated by several mechanisms including RING (Really Interesting New Gene) domain-mediated autoubiquitination. Here we report biochemical identification of NEDD4-1 as an E3 ligase for Mdm2 that contributes to the regulation of Mdm2 protein stability in cells. NEDD4-1 was identified from Jurkat cytosolic fractions using an enzyme-dead Mdm2 mutant protein as a substrate for in vitro E3 ligase assays. We show that lysates from Nedd4-1 knockout (KO) mouse embryonic fibroblasts (MEFs) have significantly diminished E3 ligase activity toward Mdm2 compared with lysates from wild-type (WT) MEFs. Recombinant NEDD4-1 promotes Mdm2 ubiquitination in vitro in a concentration- and time-dependent manner. In cells, NEDD4-1 physically interacts with Mdm2 via the RING domain of Mdm2. Overexpression of NEDD4-1, but not an enzyme-dead NEDD4-1CS mutant, increases ubiquitination of Mdm2. NEDD4-1 catalyzes the formation of K63-type polyubiquitin chains on Mdm2 that are distinct from K48-type polyubiquitination chains mediated by the Mdm2/MdmX complex. Importantly, K63-type polyubiquitination by NEDD4-1 competes with K48-type polyubiquitination on Mdm2 in cells. As a result, NEDD4-1-mediated ubiquitination stabilizes Mdm2. NEDD4-1 knockdown reduces the t1/2 (half-life) of endogenous Mdm2 from 20 to 12 min in U2OS cells. Nedd4-1 KO MEFs manifest increased p53 levels and activity, a more robust DNA damage response and increased G1 arrest compared with WT MEFs. Similarly, NEDD4-1 knockdown in WT-p53-bearing cells increases basal p53 levels and activity in an Mdm2-dependent manner, causes stronger p53 responses to DNA damage and results in p53-dependent growth inhibition compared with corresponding NEDD4-1-proficient control cells. This study identifies NEDD4-1 as a novel component of the p53/Mdm2 regulatory feedback loop that controls p53 activity during stress responses."
https://openalex.org/W2024665579,"In eukaryotes, heat shock protein 90 (Hsp90) is an essential ATP-dependent molecular chaperone that associates with numerous client proteins. HtpG, a prokaryotic homolog of Hsp90, is essential for thermotolerance in cyanobacteria, and in vitro it suppresses the aggregation of denatured proteins efficiently. Understanding how the non-native client proteins bound to HtpG refold is of central importance to comprehend the essential role of HtpG under stress. Here, we demonstrate by yeast two-hybrid method, immunoprecipitation assays, and surface plasmon resonance techniques that HtpG physically interacts with DnaJ2 and DnaK2. DnaJ2, which belongs to the type II J-protein family, bound DnaK2 or HtpG with submicromolar affinity, and HtpG bound DnaK2 with micromolar affinity. Not only DnaJ2 but also HtpG enhanced the ATP hydrolysis by DnaK2. Although assisted by the DnaK2 chaperone system, HtpG enhanced native refolding of urea-denatured lactate dehydrogenase and heat-denatured glucose-6-phosphate dehydrogenase. HtpG did not substitute for DnaJ2 or GrpE in the DnaK2-assisted refolding of the denatured substrates. The heat-denatured malate dehydrogenase that did not refold by the assistance of the DnaK2 chaperone system alone was trapped by HtpG first and then transferred to DnaK2 where it refolded. Dissociation of substrates from HtpG was either ATP-dependent or -independent depending on the substrate, indicating the presence of two mechanisms of cooperative action between the HtpG and the DnaK2 chaperone system."
https://openalex.org/W1986141384,"Dendritic cells (DC) play a critical role in modulating antigen-specific immune responses elicited by T cells via engagement of the prototypic T cell costimulatory receptor CD28 by the cognate ligands CD80/CD86, expressed on DC. Although CD28 signaling in T cell activation has been well characterized, it has only recently been shown that CD80/CD86, which have no demonstrated binding domains for signaling proteins in their cytoplasmic tails, nonetheless also transduce signals to the DC. Functionally, CD80/CD86 engagement results in DC production of the pro-inflammatory cytokine IL-6, which is necessary for full T cell activation. However, ligation of CD80/CD86 by CTLA4 also induces DC production of the immunosuppressive enzyme indoleamine 2,3-dioxygenase (IDO), which depletes local pools of the essential amino acid tryptophan, resulting in blockade of T cell activation. Despite the significant role of CD80/CD86 in immunological processes and the seemingly opposing roles they play by producing IL-6 and IDO upon their activation, how CD80/CD86 signal remains poorly understood. We have now found that cross-linking CD80/CD86 in human DC activates the PI3K/AKT pathway. This results in phosphorylation/inactivation of its downstream target, FOXO3A, and alleviates FOXO3A-mediated suppression of IL-6 expression. A second event downstream of AKT phosphorylation is activation of the canonical NF-κB pathway, which induces IL-6 expression. In addition to these downstream pathways, we unexpectedly found that CD80/CD86-induced PI3K signaling is regulated by previously unrecognized cross-talk with NOTCH1 signaling. This cross-talk is facilitated by NOTCH-mediated up-regulation of the expression of prolyl isomerase PIN1, which in turn increases enzyme activity of casein kinase II. Subsequently, phosphatase and tensin homolog (which suppresses PI3K activity) is inactivated via phosphorylation by casein kinase II. This results in full activation of PI3K signaling upon cross-linking CD80/CD86. Similar to IL-6, we have found that CD80/CD86-induced IDO production by DC at late time points is also dependent upon the PI3K → AKT → NF-κB pathway and requires cross-talk with NOTCH signaling. These data further suggest that the same signaling pathways downstream of DC CD80/CD86 cross-linking induce early IL-6 production to enhance T cell activation, followed by later IDO production to self-limit this activation. In addition to characterizing the pathways downstream of CD80/CD86 in IL-6 and IDO production, identification of a novel cross-talk between NOTCH1 and PI3K signaling may provide new insights in other biological processes where PI3K signaling plays a major role."
https://openalex.org/W2083022228,"ATP-dependent chromatin remodeling complexes such as SWI/SNF (SWItch/Sucrose NonFermentable) have been implicated in DNA double-strand break (DSB) repair and damage responses. However, the regulatory mechanisms that control the function of chromatin remodelers in DNA damage response are largely unknown. Here, we show that ataxia telangiectasia mutated (ATM) mediates the phosphorylation of BRG1, the catalytic ATPase of the SWI/SNF complex that contributes to DSB repair by binding γ-H2AX-containing nucleosomes via interaction with acetylated histone H3 and stimulating γ-H2AX formation, at Ser-721 in response to DNA damage. ATM-mediated phosphorylation of BRG1 occurs rapidly and transiently after DNA damage. Phosphorylated BRG1 binds γ-H2AX-containing nucleosomes to form the repair foci. The Ser-721 phosphorylation of BRG1 is critical for binding γ-H2AX-containing nucleosomes and stimulating γ-H2AX formation and DSB repair. BRG1 binds to acetylated H3 peptides much better after phosphorylation at Ser-721 by DNA damage. However, the phosphorylation of Ser-721 does not significantly affect the ATPase and transcriptional activities of BRG1. These results, establishing BRG1 as a novel and functional ATM substrate, suggest that the ATM-mediated phosphorylation of BRG1 facilitates DSB repair by stimulating the association of this remodeler with γ-H2AX nucleosomes via enhancing the affinity to acetylated H3. Our work also suggests that the mechanism of BRG1 stimulation of DNA repair is independent of the remodeler's enzymatic or transcriptional activities."
https://openalex.org/W2044829994,"Tumor cell invasion is a major contributor to cancer morbidity, and is of particular importance in patients with glioblastoma multiforme (GBM), the highest grade and most aggressive primary brain tumor. Tumor cell invasion and the expression of matrix metalloproteinases (MMPs), which are required for GBM invasion, are enhanced by inhibitor of DNA binding (Id) gene family members, Id1, Id2 and Id3, which can be highly expressed in glioma. Id4 is expressed in GBM at more variable levels than these other family members and we sought to determine its role in invasion. We found, unexpectedly, that invasion was dramatically inhibited in cells expressing Id4 as a result of decreased MMP2, a secreted proteinase key for brain tumor invasion. We demonstrate that Id4 decreased MMP2 expression by a direct inhibitory interaction with Twist1, a basic helix-loop-helix transcription factor known to increase MMP2 expression. Importantly, using data from The Cancer Genome Atlas, we show that Id4 expression correlates with survival of glioblastoma patients and inversely correlates with MMP2 expression. These data suggest that the upregulation of MMP2 resulting from decreased Id4 expression in GBM may contribute to the morbidity and mortality of GBM patients."
https://openalex.org/W2146747189,"Invadopodia are actin-rich protrusions arising through the orchestrated regulation of precursor assembly, stabilization, and maturation, endowing cancer cells with invasive properties. Using nanobodies (antigen-binding domains of Camelid heavy-chain antibodies) as perturbators of intracellular functions and/or protein domains at the level of the endogenous protein, we examined the specific contribution of fascin and cortactin during invadopodium formation in MDA-MB-231 breast and PC-3 prostate cancer cells. A nanobody (Kd~35 nM, 1:1 stoichiometry) that disrupts fascin F-actin bundling emphasizes the importance of stable actin bundles in invadopodium array organization and turnover, matrix degradation, and cancer cell invasion. Cortactin-SH3 dependent WIP recruitment toward the plasma membrane was specifically inhibited by a cortactin nanobody (Kd~75 nM, 1:1 stoichiometry). This functional domain is shown to be important for formation of properly organized invadopodia, MMP-9 secretion, matrix degradation, and cancer cell invasion. Notably, using a subcellular delocalization strategy to trigger protein loss of function, we uncovered a fascin-bundling-independent role in MMP-9 secretion. Hence, we demonstrate that nanobodies enable high resolution protein function mapping in cells.—Van Audenhove, I., Boucherie, C., Pieters, L., Zwaenepoel, O., Vanloo, B., Martens, E., Verbrugge, C., Hassanzadeh-Ghassabeh, G., Vandekerckhove, J., Cornelissen, M., De Ganck, A., Gettemans, J. Stratifying fascin and cortactin function in invadopodium formation using inhibitory nanobodies and targeted subcellular delocalization. FASEB J. 28, 1805–1818 (2014). www.fasebj.org"
https://openalex.org/W2056831929,
https://openalex.org/W2053756154,"Metabolic reprogramming facilitates cancer cell growth, so quantitative metabolic flux measurements could produce useful biomarkers. However, current methods to analyze flux in vivo provide either a steady-state overview of relative activities (infusion of (13)C and analysis of extracted metabolites) or a dynamic view of a few reactions (hyperpolarized (13)C spectroscopy). Moreover, although hyperpolarization has successfully quantified pyruvate-lactate exchanges, its ability to assess mitochondrial pyruvate metabolism is unproven in cancer. Here, we combined (13)C hyperpolarization and isotopomer analysis to quantify multiple fates of pyruvate simultaneously. Two cancer cell lines with divergent pyruvate metabolism were incubated with thermally polarized [3-(13)C]pyruvate for several hours, then briefly exposed to hyperpolarized [1-(13)C]pyruvate during acquisition of NMR spectra using selective excitation to maximize detection of H[(13)C]O3(-) and [1-(13)C]lactate. Metabolites were then extracted and subjected to isotopomer analysis to determine relative rates of pathways involving [3-(13)C]pyruvate. Quantitation of hyperpolarized H[(13)C]O3(-) provided a single definitive metabolic rate, which was then used to convert relative rates derived from isotopomer analysis into quantitative fluxes. This revealed that H[(13)C]O3(-) appearance reflects activity of pyruvate dehydrogenase rather than pyruvate carboxylation followed by subsequent decarboxylation reactions. Glucose substantially altered [1-(13)C]pyruvate metabolism, enhancing exchanges with [1-(13)C]lactate and suppressing H[(13)C]O3(-) formation. Furthermore, inhibiting Akt, an oncogenic kinase that stimulates glycolysis, reversed these effects, indicating that metabolism of pyruvate by both LDH and pyruvate dehydrogenase is subject to the acute effects of oncogenic signaling on glycolysis. The data suggest that combining (13)C isotopomer analyses and dynamic hyperpolarized (13)C spectroscopy may enable quantitative flux measurements in living tumors."
https://openalex.org/W2011154374,"Recent studies support the role of cysteine oxidation in actin cytoskeleton reorganization during cell adhesion. The aim of this study was to explain whether protein disulfide isomerase (PDI) is responsible for the thiol-disulfide rearrangement in the β-actin molecule of adhering cells. First, we showed that PDI forms a disulfide-bonded complex with β-actin with a molecular mass of 110 kDa. Specific interaction of both proteins was demonstrated by a solid phase binding assay, surface plasmon resonance analysis, and immunoprecipitation experiments. Second, using confocal microscopy, we found that both proteins colocalized when spreading MEG-01 cells on fibronectin. Colocalization of PDI and β-actin could be abolished by the membrane-permeable sulfhydryl blocker, N-ethylmaleimide, by the RGD peptide, and by anti-αIIbβ3 antibodies. Consequently, down-regulation of PDI expression by antisense oligonucleotides impaired the spreading of cells and initiated reorganization of the cytoskeleton. Third, because of transfection experiments followed by immunoprecipitation and confocal analysis, we provided evidence that PDI binds to the β-actin Cys(374) thiol. Formation of the β-actin-PDI complex was mediated by integrin-dependent signaling in response to the adhesion of cells to the extracellular matrix. Our data suggest that PDI is released from subcellular compartments to the cytosol and translocated toward the periphery of the cell, where it forms a disulfide bond with β-actin when MEG-01 cells adhere via the αIIbβ3 integrin to fibronectin. Thus, PDI appears to regulate cytoskeletal reorganization by the thiol-disulfide exchange in β-actin via a redox-dependent mechanism."
https://openalex.org/W1992027132,"Mutations in succinate dehydrogenase (SDH) subunits and assembly factors cause a range of clinical conditions. One such condition, hereditary paraganglioma 2 (PGL2), is caused by a G78R mutation in the assembly factor SDH5. Although SDH5G78R is deficient in its ability to promote SDHA flavinylation, it has remained unclear whether impairment to its import, structure, or stability contributes to its loss of function. Using import-chase analysis in human mitochondria isolated from HeLa cells, we found that the import and maturation of human SDH5G78R was normal, while its stability was reduced significantly, with ~25% of the protein remaining after 180 min compared to ~85% for the wild-type protein. Notably, the metabolic stability of SDH5G78R was restored to wild-type levels by depleting mitochondrial LON (LONM). Degradation of SDH5G78R by LONM was confirmed in vitro; however, in contrast to the in organello analysis, wild-type SDH5 was also rapidly degraded by LONM. SDH5 instability was confirmed in SDHA-depleted mitochondria. Blue native PAGE showed that imported SDH5G78R formed a transient complex with SDHA; however, this complex was stabilized in LONM depleted mitochondria. These data demonstrate that SDH5 is protected from LONM-mediated degradation in mitochondria by its stable interaction with SDHA, a state that is dysregulated in PGL2.—Bezawork-Geleta, A., Saiyed, T., Dougan, D. A., Truscott, K. N. Mitochondrial matrix proteostasis is linked to hereditary paraganglioma: LON-mediated turnover of the human flavinylation factor SDH5 is regulated by its interaction with SDHA. FASEB J. 28, 1794–1804 (2014). www.fasebj.org"
