id,abstract
https://openalex.org/W1986147729,"The RNA-binding protein Tristetraprolin (TTP, ZFP36) functions as a tumor suppressor that impairs the development and disables the maintenance of MYC-driven lymphoma. In addition, other human cancers expressed reduced levels of TTP, suggesting that it may function as a tumor suppressor in several malignancies. To identify genes that may be associated with TTP tumor suppressor functions in human cancer, we analyzed The Cancer Genome Atlas (TCGA) breast cancer, lung adenocarcinoma, lung squamous cell carcinoma, and colon adenocarcinoma datasets. These analyses defined a signature of 50 genes differentially regulated between high and low TTP-expressing tumors. Notably, patients with low TTP-expressing breast cancer and lung adenocarcinoma had decreased survival rates and more aggressive tumors with increased necrosis. In addition, analysis across non-TCGA tumor gene expression databases identified a broad spectrum of human cancers having similarities with the TTP-low tumor gene signature, including pancreatic, bladder, and prostate cancer. TTP has documented roles in regulating mRNAs encoding inflammatory proteins, and pathway analysis identified several inflammatory pathways that are altered in tumors with low TTP expression. Surprisingly, the TTP-low tumor gene signature includes a core component of 20 under-expressed CREB target genes, suggesting that the regulation of CREB activity may be related to the tumor suppressor function of TTP. Thus, reduced levels of TTP are a potential biomarker for human cancers with poor outcome, and targeting the CREB pathway may be a therapeutic route for treating aggressive TTP-low tumors."
https://openalex.org/W2092993321,"Recent evidence has indicated the presence of novel plastoquinone-binding sites, QC and QD, in photosystem II (PSII). Here, we investigated the potential involvement of loosely bound plastosemiquinones in superoxide anion radical (O2-) formation in spinach PSII membranes using electron paramagnetic resonance (EPR) spin-trapping spectroscopy. Illumination of PSII membranes in the presence of the spin trap EMPO (5-(ethoxycarbonyl)-5-methyl-1-pyrroline N-oxide) resulted in the formation of O2-, which was monitored by the appearance of EMPO-OOH adduct EPR signal. Addition of exogenous short-chain plastoquinone to PSII membranes markedly enhanced the EMPO-OOH adduct EPR signal. Both in the unsupplemented and plastoquinone-supplemented PSII membranes, the EMPO-OOH adduct EPR signal was suppressed by 50% when the urea-type herbicide DCMU (3-(3,4-dichlorophenyl)-1,1-dimethylurea) was bound at the QB site. However, the EMPO-OOH adduct EPR signal was enhanced by binding of the phenolic-type herbicide dinoseb (2,4-dinitro-6-sec-butylphenol) at the QD site. Both in the unsupplemented and plastoquinone-supplemented PSII membranes, DCMU and dinoseb inhibited photoreduction of the high-potential form of cytochrome b559 (cyt b559). Based on these results, we propose that O2- is formed via the reduction of molecular oxygen by plastosemiquinones formed through one-electron reduction of plastoquinone at the QB site and one-electron oxidation of plastoquinol by cyt b559 at the QC site. On the contrary, the involvement of a plastosemiquinone formed via the one-electron oxidation of plastoquinol by cyt b559 at the QD site seems to be ambiguous. In spite of the fact that the existence of QC and QD sites is not generally accepted yet, the present study provided more spectroscopic data on the potential functional role of these new plastoquinone-binding sites."
https://openalex.org/W2026965866,"Objective To appraise the immediate and long-term outcomes of bronchial arterial embolization for life-threatening hemoptysis secondary to tuberculosis. Methods 112 patients with life-threatening hemoptysis due to tuberculosis underwent bronchial artery embolization from January 2004 to February 2014. Life-threatening hemoptysis was defined as expectoration of at least 400 ml of blood in 24 hour. The median follow-up is 20 months, ranging from 2 to 52 months. Results The hemoptysis control rate was 86.6% at 14 days, 84.8% at 30 days, 78.6% at 240 days, 75.9% at 360 days, respectively. None of these characteristics, including gender, age and tuberculosis status, was significantly associated with immediate control of bleeding. Patients with active tuberculosis had a significantly longer recurrence-free duration than did patients with inactive tuberculosis (P = 0.040), which was further confirmed by Cox regression hazards model (P = 0.046). There was no spinal cord complication or mortality related to bronchial artery embolization. The most common complication was transient chest pain. Conclusion Bronchial arterial embolization is an effective and safe technique in the management of life-threatening hemoptysis secondary to tuberculosis. Active tuberculosis may be associated with a lower rate of recurrence of hemoptysis."
https://openalex.org/W1989421372,"A link between Tau phosphorylation and aggregation has been shown in different models for Alzheimer disease, including yeast. We used human Tau purified from yeast models to generate new monoclonal antibodies, of which three were further characterized. The first antibody, ADx201, binds the Tau proline-rich region independently of the phosphorylation status, whereas the second, ADx215, detects an epitope formed by the Tau N terminus when Tau is not phosphorylated at Tyr18. For the third antibody, ADx210, the binding site could not be determined because its epitope is probably conformational. All three antibodies stained tangle-like structures in different brain sections of THY-Tau22 transgenic mice and Alzheimer patients, and ADx201 and ADx210 also detected neuritic plaques in the cortex of the patient brains. In hippocampal homogenates from THY-Tau22 mice and cortex homogenates obtained from Alzheimer patients, ADx215 consistently stained specific low order Tau oligomers in diseased brain, which in size correspond to Tau dimers. ADx201 and ADx210 additionally reacted to higher order Tau oligomers and presumed prefibrillar structures in the patient samples. Our data further suggest that formation of the low order Tau oligomers marks an early disease stage that is initiated by Tau phosphorylation at N-terminal sites. Formation of higher order oligomers appears to require additional phosphorylation in the C terminus of Tau. When used to assess Tau levels in human cerebrospinal fluid, the antibodies permitted us to discriminate patients with Alzheimer disease or other dementia like vascular dementia, indicative that these antibodies hold promising diagnostic potential. A link between Tau phosphorylation and aggregation has been shown in different models for Alzheimer disease, including yeast. We used human Tau purified from yeast models to generate new monoclonal antibodies, of which three were further characterized. The first antibody, ADx201, binds the Tau proline-rich region independently of the phosphorylation status, whereas the second, ADx215, detects an epitope formed by the Tau N terminus when Tau is not phosphorylated at Tyr18. For the third antibody, ADx210, the binding site could not be determined because its epitope is probably conformational. All three antibodies stained tangle-like structures in different brain sections of THY-Tau22 transgenic mice and Alzheimer patients, and ADx201 and ADx210 also detected neuritic plaques in the cortex of the patient brains. In hippocampal homogenates from THY-Tau22 mice and cortex homogenates obtained from Alzheimer patients, ADx215 consistently stained specific low order Tau oligomers in diseased brain, which in size correspond to Tau dimers. ADx201 and ADx210 additionally reacted to higher order Tau oligomers and presumed prefibrillar structures in the patient samples. Our data further suggest that formation of the low order Tau oligomers marks an early disease stage that is initiated by Tau phosphorylation at N-terminal sites. Formation of higher order oligomers appears to require additional phosphorylation in the C terminus of Tau. When used to assess Tau levels in human cerebrospinal fluid, the antibodies permitted us to discriminate patients with Alzheimer disease or other dementia like vascular dementia, indicative that these antibodies hold promising diagnostic potential."
https://openalex.org/W2016293532,"Wheat (Triticum aestivum L.)/faba bean (Vicia faba L.) intercropping shows significant overyielding and high nitrogen (N)-use efficiency, but the dynamics of plant interactions have rarely been estimated. The objective of the present study was to investigate the temporal dynamics of competitive N acquisition between intercropped wheat and faba bean with the logistic model. Wheat and faba bean were grown together or alone with limited N supply in pots. Data of shoot and root biomass and N content measured from 14 samplings were fitted to logistic models to determine instantaneous rates of growth and N uptake. The superiority of instantaneous biomass production and N uptake shifted from faba bean to wheat with their growth. Moreover, the shift of superiority on N uptake occurred 7–12 days earlier than that of biomass production. Interspecific competition stimulated intercropped wheat to have a much earlier and stronger superiority on instantaneous N uptake compared with isolated wheat. The modeling methodology characterized the temporal dynamics of biomass production and N uptake of intercropped wheat and faba bean in different planting systems, which helps to understand the underlying process of plant interaction for intercropping plants."
https://openalex.org/W2033549736,"Background High mobility group box 1 (HMGB1) plays important roles in a large variety of diseases; glycyrrhizin (GL) is recognized as an HMGB1 inhibitor. However, few studies have focused on whether glycyrrhizin can potentially improve the outcome of traumatic pancreatitis (TP) by inhibiting HMGB1. Methods A total of 60 male Wistar rats were randomly divided into three groups (n = 20 in each): Control group, TP group and TP-GL group. Pancreatic trauma was established with a custom-made biological impact machine-III, and GL was administered at 15 minutes after the accomplishment of operation. To determine survival rates during the first 7 days after injury, another 60 rats (n = 20 in each) were grouped and treated as mentioned above. At 24 hours of induction of TP, the histopathological changes in pancreas were evaluated and serum amylase levels were tested. Serum tumor necrosis factor α (TNF-α), interleukin 6 (IL-6), and HMGB1 were measured using enzyme linked immunosorbent assay. HMGB1 expressions in pancreas were measured using immunohistochemical staining, Western blot and Real-Time PCR analysis. Results Serum levels of HMGB1, TNF-α and IL-6 were increased dramatically in TP group at 24 hours after induction of TP. However, these indicators were reduced significantly by GL administration in TP-GL group comparing with TP group (P<0.05). Meanwhile, survival analysis showed that the seven-day survival rate in TP-GL group was significantly higher than that in TP group (85% versus 65%, P<0.05). GL treatment significantly decreased the pancreatic protein and mRNA expressions of HMGB1 and ameliorated the pancreatic injury in rats with TP. Conclusions Glycyrrhizin might play an important role in improving survival rates and ameliorating pancreatic injury of TP by suppression of the expressions of HMGB1 and other proinflammatory cytokine."
https://openalex.org/W1989740486,"One of the biggest challenges in the study of biological regulatory mechanisms is the integration, americanmodeling, and analysis of the complex interactions which take place in biological networks. Despite post transcriptional regulatory elements (i.e., miRNAs) are widely investigated in current research, their usage and visualization in biological networks is very limited. Regulatory networks are commonly limited to gene entities. To integrate networks with post transcriptional regulatory data, researchers are therefore forced to manually resort to specific third party databases. In this context, we introduce ReNE, a Cytoscape 3.x plugin designed to automatically enrich a standard gene-based regulatory network with more detailed transcriptional, post transcriptional, and translational data, resulting in an enhanced network that more precisely models the actual biological regulatory mechanisms. ReNE can automatically import a network layout from the Reactome or KEGG repositories, or work with custom pathways described using a standard OWL/XML data format that the Cytoscape import procedure accepts. Moreover, ReNE allows researchers to merge multiple pathways coming from different sources. The merged network structure is normalized to guarantee a consistent and uniform description of the network nodes and edges and to enrich all integrated data with additional annotations retrieved from genome-wide databases like NCBI, thus producing a pathway fully manageable through the Cytoscape environment. The normalized network is then analyzed to include missing transcription factors, miRNAs, and proteins. The resulting enhanced network is still a fully functional Cytoscape network where each regulatory element (transcription factor, miRNA, gene, protein) and regulatory mechanism (up-regulation/down-regulation) is clearly visually identifiable, thus enabling a better visual understanding of its role and the effect in the network behavior. The enhanced network produced by ReNE is exportable in multiple formats for further analysis via third party applications. ReNE can be freely installed from the Cytoscape App Store (http://apps.cytoscape.org/apps/rene) and the full source code is freely available for download through a SVN repository accessible at http://www.sysbio.polito.it/tools_svn/BioInformatics/Rene/releases/. ReNE enhances a network by only integrating data from public repositories, without any inference or prediction. The reliability of the introduced interactions only depends on the reliability of the source data, which is out of control of ReNe developers."
https://openalex.org/W1995301302,"Purpose The quadrivalent HPV vaccination was approved for use in males ages 9 to 26 in 2009 and recommended for routine administration in 2011. The purpose of this study was to uncover predictable commonalities amongst parents who chose to vaccinate their 11–17 year old sons against HPV. Methods We compiled data from a U.S. national sample of 779 parents with sons 11–17 years old using a web-based survey to gather information about behavioral and sociodemographic factors which predicted receipt of 1 or more HPV vaccine doses based on parental report. Predictors were first modeled individually for univariable associations. Significant predictors (p<0.10) were combined in a multivariable model. Results In the adjusted model, independent predictors included receipt of flu vaccination, health insurance coverage and sexual health topic discussions with sons. Sons who had received a flu shot in the last two years more frequently received at least one dose of the vaccine (OR 1.82; 95% CI 1.45–2.26). Sons covered by private health insurance had decreased odds of HPV vaccination (OR 0.56 95% CI 0.37–0.83). Lastly, parents who had discussed sexual health topics with their sons were more likely to vaccinate (OR 1.61; 95% CI 1.37–1.89). Conclusions Male vaccination rates in the U.S. have increased, but males continue to be under-immunized. Utilization of health care is an important factor in HPV vaccine uptake; therefore, health care providers should use every contact as an opportunity to vaccinate. Communication about sexual health topics may provide a forum for parents and health care providers to have conversations about HPV vaccination as those more comfortable discussing these topics may also be more comfortable discussing HPV vaccination."
https://openalex.org/W2154091572,"Retaining patients with HIV infection in care is still a major challenge in sub- Saharan Africa, particularly in the Democratic Republic of Congo (DRC) where the antiretroviral treatment (ART) coverage is low. Monitoring retention is an important tool for evaluating the quality of care.A review of medical records of HIV-infected children was performed in three health facilities in the DRC: the Amo-Congo Health center, the Monkole Clinic in Kinshasa, and the HEAL Africa Clinic in Goma. Medical records of 720 children were included. Kaplan Meier curves were constructed with the probability of retention at 6 months, 1 year, 2 years and 3 years. Retention rates were: 88.2% (95% CI: 85.1%-90.8%) at 6 months; 85% (95% CI: 81.5%-87.6%) at one year; 79.4% (95%CI: 75.5%-82.8%) at two years and 74.7% (95% CI: 70.5%-78.5%) at 3 years. The retention varied across study sites: 88.2%, 66.6% and 92.5% at 6 months; 84%, 59% and 90% at 12 months and 75.7%, 56.3% and 85.8% at 24 months respectively for Amo-Congo/Kasavubu, Monkole facility and HEAL Africa. After multivariable Cox regression four variables remained independently associated with attrition: study site, CD4 cell count <350 cells/µL, children younger than 2 years and children whose caregivers were member of an independent church.Attrition remains a challenge for pediatric HIV positive patients in ART programs in DRC. In addition, the low coverage of pediatric treatment exacerbates the situation of pediatric HIV/AIDS."
https://openalex.org/W1972994475,"The effectiveness of a vaccine is determined not only by the immunogenicity of its components, but especially by how widely it covers the disease-causing strains circulating in a given region. Because vaccine coverage varies over time, this study aimed to detect possible changes that could affect vaccine protection during a specific period in a southern European region. The 4CMenB vaccine is licensed for use in Europe, Canada, and Australia and is mainly directed against Neisseria meningitidis serogroup B. This vaccine contains four main immunogenic components: three recombinant proteins, FHbp, Nhba and NadA, and an outer membrane vesicle [PorA P1.4]. The allelic distribution of FHbp, Nhba, NadA, and PorA antigens in 82 invasive isolates (B and non-B serogroups) isolated from January 2008 to December 2013 were analyzed. 4CMenB was likely protective against 61.8% and 50% of serogroup B and non-B meningococci, respectively, in the entire period, but between 2012 and 2013, the predicted protection fell below 45% (42.1% for serogroup B isolates).The observed decreasing trend in the predicted protection during the 6 years of the study (Χ2 for trend = 4.68, p = 0.03) coincided with a progressive decrease of several clonal complexes (e.g., cc11, cc32 and cc41/44), which had one or more antigens against which the vaccine would offer protection."
