id,abstract
https://openalex.org/W2003981623,"Green algae offer sustainable, clean and eco-friendly energy resource. However, production efficiency needs to be improved. Increasing cellular lipid levels by nitrogen depletion is one of the most studied strategies. Despite this, the underlying physiological and biochemical mechanisms of this response have not been well defined. Algae species adapted to hypersaline conditions can be cultivated in salty waters which are not useful for agriculture or consumption. Due to their inherent extreme cultivation conditions, use of hypersaline algae species is better suited for avoiding culture contamination issues. In this study, we identified a new halophilic Dunaliella salina strain by using 18S ribosomal RNA gene sequencing. We found that growth and biomass productivities of this strain were directly related to nitrogen levels, as the highest biomass concentration under 0.05 mM or 5 mM nitrogen regimes were 495 mg/l and 1409 mg/l, respectively. We also confirmed that nitrogen limitation increased cellular lipid content up to 35% under 0.05 mM nitrogen concentration. In order to gain insight into the mechanisms of this phenomenon, we applied fluorometric, flow cytometric and spectrophotometric methods to measure oxidative stress and enzymatic defence mechanisms. Under nitrogen depleted cultivation conditions, we observed increased lipid peroxidation by measuring an important oxidative stress marker, malondialdehyde and enhanced activation of catalase, ascorbate peroxidase and superoxide dismutase antioxidant enzymes. These observations indicated that oxidative stress is accompanied by increased lipid content in the green alga. In addition, we also showed that at optimum cultivation conditions, inducing oxidative stress by application of exogenous H2O2 leads to increased cellular lipid content up to 44% when compared with non-treated control groups. Our results support that oxidative stress and lipid overproduction are linked. Importantly, these results also suggest that oxidative stress mediates lipid accumulation. Understanding such relationships may provide guidance for efficient production of algal biodiesels."
https://openalex.org/W2021993898,"Fusarium graminearum causes Fusarium head blight (FHB), a devastating disease that leads to extensive yield and quality loss of wheat and barley. Bacteria isolated from wheat kernels and plant anthers were screened for antagonistic activity against F. graminearum. Based on its in vitro effectiveness, strain SG6 was selected for characterization and identified as Bacillus subtilis. B. subtilis SG6 exhibited a high antifungal effect on the mycelium growth, sporulation and DON production of F. graminearum with the inhibition rate of 87.9%, 95.6% and 100%, respectively. In order to gain insight into biological control effect in situ, we applied B. subtilis SG6 at anthesis through the soft dough stage of kernel development in field test. It was revealed that B. subtilis SG6 significantly reduced disease incidence (DI), FHB index and DON (P≤0.05). Further, ultrastructural examination shows that B. subtilis SG6 strain induced stripping of F. graminearum hyphal surface by destroying the cellular structure. When hypha cell wall was damaged, the organelles and cytoplasm inside cell would exude, leading to cell death. The antifungal activity of SG6 could be associated with the coproduction of chitinase, fengycins and surfactins."
https://openalex.org/W1992223383,"Precision-recall curves are highly informative about the performance of binary classifiers, and the area under these curves is a popular scalar performance measure for comparing different classifiers. However, for many applications class labels are not provided with absolute certainty, but with some degree of confidence, often reflected by weights or soft labels assigned to data points. Computing the area under the precision-recall curve requires interpolating between adjacent supporting points, but previous interpolation schemes are not directly applicable to weighted data. Hence, even in cases where weights were available, they had to be neglected for assessing classifiers using precision-recall curves. Here, we propose an interpolation for precision-recall curves that can also be used for weighted data, and we derive conditions for classification scores yielding the maximum and minimum area under the precision-recall curve. We investigate accordances and differences of the proposed interpolation and previous ones, and we demonstrate that taking into account existing weights of test data is important for the comparison of classifiers."
https://openalex.org/W2046820148,"Aims Although there is still no clear definition of “adipose tissue dysfunction” or ATD, the identification of a clinical marker of altered fat distribution and function may provide the needed tools for early identification of a condition of cardiometabolic risk. Our aim was to evaluate the correlations among various anthropometric indices [BMI, Waist Circumference (WC), Hip Circumference (HC), Waist/Hip ratio (WHR), Body Adiposity Index (BAI) and Visceral adiposity Index (VAI)] and several adipocytokines [Visfatin, Resistin, Leptin, Soluble leptin receptors (sOB-R), Adiponectin, Ghrelin, Adipsin, PAI-1, vascular endothelial growth factor (VEGF), Hepatocyte growth factor (HGF) TNF-α, hs-CRP, IL-6, IL-18] in patients with type 2 diabetes (DM2). Materials and Methods Ninety-one DM2 patients (age: 65.25±6.38 years; 42 men and 49 women) in stable treatment for the last six months with metformin in monotherapy (1.5–2 g/day) were cross-sectionally studied. Clinical, anthropometric, and metabolic parameters were evaluated. Serum adipocytokine levels were assayed with Luminex based kits. Results At the Pearson’s correlation, among all the indices investigated, VAI showed a significant correlation with almost all adipocytokines analyzed [Visfatin, Resistin and hsCRP (all p<0.001); Adiponectin, sOb-R, IL-6, IL-18, HGF (all p<0.010); Ghrelin and VEGF (both p<0.05)]. Through a two-step cluster analysis, 55 patients were identified with the most altered adipocytokine profile (patients with ATD). At a ROC analysis, VAI showed the highest C-statistic [0.767 (95% CI 0.66–0.84)] of all the indices. Conclusions Our study suggests that the VAI, among the most common indexes of adiposity assessment, shows the best correlation with the best known adipocytokines and cardiometabolic risk serum markers. Although to date we are still far from clearly identifying an ATD, the VAI would be an easy tool for clearly mirroring a condition of cardiometabolic risk, in the absence of an overt metabolic syndrome."
https://openalex.org/W2142259843,"The chromatin remodeling protein ATRX, which targets tandem repetitive DNA, has been shown to be required for expression of the alpha globin genes, for proliferation of a variety of cellular progenitors, for chromosome congression and for the maintenance of telomeres. Mutations in ATRX have recently been identified in tumours which maintain their telomeres by a telomerase independent pathway involving homologous recombination thought to be triggered by DNA damage. It is as yet unknown whether there is a central underlying mechanism associated with ATRX dysfunction which can explain the numerous cellular phenomena observed. There is, however, growing evidence for its role in the replication of various repetitive DNA templates which are thought to have a propensity to form secondary structures. Using a mouse knockout model we demonstrate that ATRX plays a direct role in facilitating DNA replication. Ablation of ATRX alone, although leading to a DNA damage response at telomeres, is not sufficient to trigger the alternative lengthening of telomere pathway in mouse embryonic stem cells."
https://openalex.org/W2004693107,"Background Increasingly, countries have introduced female vaccination against human papillomavirus (HPV), causally linked to several cancers and genital warts, but few have recommended vaccination of boys. Declining vaccine prices and strong evidence of vaccine impact on reducing HPV-related conditions in both women and men prompt countries to reevaluate whether HPV vaccination of boys is warranted. Methods A previously-published dynamic model of HPV transmission was empirically calibrated to Norway. Reductions in the incidence of HPV, including both direct and indirect benefits, were applied to a natural history model of cervical cancer, and to incidence-based models for other non-cervical HPV-related diseases. We calculated the health outcomes and costs of the different HPV-related conditions under a gender-neutral vaccination program compared to a female-only program. Results Vaccine price had a decisive impact on results. For example, assuming 71% coverage, high vaccine efficacy and a reasonable vaccine tender price of $75 per dose, we found vaccinating both girls and boys fell below a commonly cited cost-effectiveness threshold in Norway ($83,000/quality-adjusted life year (QALY) gained) when including vaccine benefit for all HPV-related diseases. However, at the current market price, including boys would not be considered ‘good value for money.’ For settings with a lower cost-effectiveness threshold ($30,000/QALY), it would not be considered cost-effective to expand the current program to include boys, unless the vaccine price was less than $36/dose. Increasing vaccination coverage to 90% among girls was more effective and less costly than the benefits achieved by vaccinating both genders with 71% coverage. Conclusions At the anticipated tender price, expanding the HPV vaccination program to boys may be cost-effective and may warrant a change in the current female-only vaccination policy in Norway. However, increasing coverage in girls is uniformly more effective and cost-effective than expanding vaccination coverage to boys and should be considered a priority."
https://openalex.org/W1993445335,"DNA microarray technologies are used extensively to profile the expression levels of thousands of genes under various conditions, yielding extremely large data-matrices. Thus, analyzing this information and extracting biologically relevant knowledge becomes a considerable challenge. A classical approach for tackling this challenge is to use clustering (also known as one-way clustering) methods where genes (or respectively samples) are grouped together based on the similarity of their expression profiles across the set of all samples (or respectively genes). An alternative approach is to develop biclustering methods to identify local patterns in the data. These methods extract subgroups of genes that are co-expressed across only a subset of samples and may feature important biological or medical implications. In this study we evaluate 13 biclustering and 2 clustering (k-means and hierarchical) methods. We use several approaches to compare their performance on two real gene expression data sets. For this purpose we apply four evaluation measures in our analysis: (1) we examine how well the considered (bi)clustering methods differentiate various sample types; (2) we evaluate how well the groups of genes discovered by the (bi)clustering methods are annotated with similar Gene Ontology categories; (3) we evaluate the capability of the methods to differentiate genes that are known to be specific to the particular sample types we study and (4) we compare the running time of the algorithms. In the end, we conclude that as long as the samples are well defined and annotated, the contamination of the samples is limited, and the samples are well replicated, biclustering methods such as Plaid and SAMBA are useful for discovering relevant subsets of genes and samples."
https://openalex.org/W2040434799,"Daily interactions naturally define social circles. Individuals tend to be friends with the people they spend time with and they choose to spend time with their friends, inextricably entangling physical location and social relationships. As a result, it is possible to predict not only someone's location from their friends' locations but also friendship from spatial and temporal co-occurrence. While several models have been developed to separately describe mobility and the evolution of social networks, there is a lack of studies coupling social interactions and mobility. In this work, we introduce a new model that bridges this gap by explicitly considering the feedback of mobility on the formation of social ties. Data coming from three online social networks (Twitter, Gowalla and Brightkite) is used for validation. Our model reproduces various topological and physical properties of these networks such as: i) the size of the connected components, ii) the distance distribution between connected users, iii) the dependence of the reciprocity on the distance, iv) the variation of the social overlap and the clustering with the distance. Besides numerical simulations, a mean-field approach is also used to study analytically the main statistical features of the networks generated by the model. The robustness of the results to changes in the model parameters is explored, finding that a balance between friend visits and long-range random connections is essential to reproduce the geographical features of the empirical networks."
https://openalex.org/W1981476255,"After committing to an action, a decision-maker can change their mind to revise the action. Such changes of mind can even occur when the stream of information that led to the action is curtailed at movement onset. This is explained by the time delays in sensory processing and motor planning which lead to a component at the end of the sensory stream that can only be processed after initiation. Such post-initiation processing can explain the pattern of changes of mind by asserting an accumulation of additional evidence to a criterion level, termed change-of-mind bound. Here we test the hypothesis that physical effort associated with the movement required to change one's mind affects the level of the change-of-mind bound and the time for post-initiation deliberation. We varied the effort required to change from one choice target to another in a reaching movement by varying the geometry of the choice targets or by applying a force field between the targets. We show that there is a reduction in the frequency of change of mind when the separation of the choice targets would require a larger excursion of the hand from the initial to the opposite choice. The reduction is best explained by an increase in the evidence required for changes of mind and a reduced time period of integration after the initial decision. Thus the criteria to revise an initial choice is sensitive to energetic costs."
https://openalex.org/W2006816519,"Objective Autonomic dysfunction is an important mechanism that could explain many symptoms observed in fibromyalgia (FM). Exercise is an effective treatment, with benefits potentially mediated through changes in autonomic modulation. Strengthening is one of the less studied exercises in FM, and the acute and chronic effects of strengthening on the autonomic system remain unknown. The objective of this study was to assess the chronic effects of strengthening exercises (STRE) on autonomic modulation, pain perception and the quality of life (QOL) of FM patients. Methods Eighty sedentary women with FM (ACR 1990) were randomly selected to participate in STRE or flexibility (FLEX) exercises in a blinded controlled trial. The intensity of STRE was set at 45% of the estimated load of 1 Repetition Maximum (RM) in 12 different exercises. Outcomes were Visual Analog Scale (VAS) for pain, Heart Rate Variability (HRV) analysis, treadmill test, the sit and reach test (Wells and Dillon’s Bench), maximal repetitions test and handgrip dynamometry; and quality of life by the Fibromyalgia Impact Questionnaire (FIQ), the Beck and Idate Trait-State Inventory (IDATE), a short-form health survey (SF-36). Results The STRE group was more effective to strength gain for all muscles and pain control after 4 and 16 weeks (p<0.05). The FLEX group showed higher improvements in anxiety (p<0.05). Both groups showed improvements in the QOL, and there was no significant difference observed between the groups. There was no change in the HRV of the STRE and FLEX groups. Conclusions Strengthening exercises show greater and more rapid improvements in pain and strength than flexibility exercises. Despite the benefits in fitness, pain, depression, anxiety and quality of life, no effect was observed on the autonomic modulation in both groups. This observation suggests that changes in autonomic modulation are not a target tobe clinically achieved in fibromyalgia. Trial Registration ClinicalTrials.gov NCT02004405"
https://openalex.org/W2129741039,"Quantification of kappa free light chains (KFLC) in cerebrospinal fluid shows high diagnostic sensitivity in multiple sclerosis and clinically isolated syndrome patients. However, a clearly defined threshold value is still missing and a possible prognostic value of the KFLC levels in these patients remains undefined.Results of KFLC quantification in 420 controls were used to set an upper limit of normal KFLC concentration in CSF under different blood-CSF-barrier conditions. Additionally, KFLC values of MS and CIS patients were assessed and results were evaluated with reference to the patients corresponding disease courses.The calculated upper limit of normal KFLC-concentration covers 98% of these control patients. Using this cut-off, plasma cell activity in CSF can be detected in 97% of MS patients and in 97% of CIS patients. However, there is no evidence that the extent of KFLC elevation provides prognostic value in MS and CIS patients in this study.KFLC determination should become a first line screen in the diagnostic algorithms of MS and CIS. The extent of elevation of intrathecal KFLC has no prognostic value on the disease course in MS and CIS patients."
https://openalex.org/W2029480896,"The T-cell immunoglobulin and mucin domain (TIM) family is a relatively newly described group of molecules with a conserved structure and important immunological functions. Identification of Galectin-9 as a ligand for TIM-3 has established the Galectin-9/TIM-3 pathway as an important negative regulator of Th1 immunity and tolerance induction. Data about the TIM-3/Gal-9 pathway in the pathogenesis of human diseases is emerging, but their possible role during human pregnancy is not precisely known. The aim of our study was to investigate the number, phenotype and functional activity of TIM-3+ peripheral blood mononuclear cells during healthy human pregnancy.57 healthy pregnant women [first trimester (n = 16); second trimester (n = 19); third trimester (n = 22)] and 30 non-pregnant controls were enrolled in the study. We measured the surface expression of TIM-3 by cytotoxic T cells, NK cells and NK cell subsets as well as Galectin-9 expression by regulatory T cells by flow cytometry. We analyzed the cytokine production and cytotoxicity of TIM3+ and TIM3- CD8 T and NK cells obtained from non-pregnant and healthy pregnant women at different stages of pregnancy by flow cytometry. Serum Galectin-9 levels were measured by ELISA.Our results show that the numbers of peripheral NK and cytotoxic T cells and their TIM-3 expression do not change between the first, second and third trimesters of pregnancy. Compared to non-pregnant individuals, regulatory T cells show higher level of Galectin-9 expression as pregnancy proceeds, which is in line with the level of Galectin-9 in the patients sera. Cytotoxic T cells, NK cells and NK cell subsets expressing TIM-3 molecule show altered cytokine production and cytotoxicity during pregnancy compared to non-pregnant individuals.Our results indicate that Galectin-9 expressing regulatory T cells, TIM-3+ cytotoxic T cells and NK cells could play an important role in the maintenance of healthy pregnancy."
https://openalex.org/W2049610548,"High seed vigor is important for agricultural production due to the associated potential for increased growth and productivity. However, a better understanding of the underlying molecular mechanisms is required because the genetic basis for seed vigor remains unknown. We used single-nucleotide polymorphism (SNP) markers to map quantitative trait loci (QTLs) for four seed vigor traits in two connected recombinant inbred line (RIL) maize populations under four treatment conditions during seed germination. Sixty-five QTLs distributed between the two populations were identified and a meta-analysis was used to integrate genetic maps. Sixty-one initially identified QTLs were integrated into 18 meta-QTLs (mQTLs). Initial QTLs with contribution to phenotypic variation values of R2>10% were integrated into mQTLs. Twenty-three candidate genes for association with seed vigor traits coincided with 13 mQTLs. The candidate genes had functions in the glycolytic pathway and in protein metabolism. QTLs with major effects (R2>10%) were identified under at least one treatment condition for mQTL2, mQTL3-2, and mQTL3-4. Candidate genes included a calcium-dependent protein kinase gene (302810918) involved in signal transduction that mapped in the mQTL3-2 interval associated with germination energy (GE) and germination percentage (GP), and an hsp20/alpha crystallin family protein gene (At5g51440) that mapped in the mQTL3-4 interval associated with GE and GP. Two initial QTLs with a major effect under at least two treatment conditions were identified for mQTL5-2. A cucumisin-like Ser protease gene (At5g67360) mapped in the mQTL5-2 interval associated with GP. The chromosome regions for mQTL2, mQTL3-2, mQTL3-4, and mQTL5-2 may be hot spots for QTLs related to seed vigor traits. The mQTLs and candidate genes identified in this study provide valuable information for the identification of additional quantitative trait genes."
https://openalex.org/W2093715724,"Boreal forests are characterized by spatially heterogeneous soils with low N availability. The decomposition of coniferous litter in these systems is primarily performed by basidiomycete fungi, which often form large mycelia with a well-developed capacity to reallocate resources spatially- an advantageous trait in heterogeneous environments. In axenic microcosm systems we tested whether fungi increase their biomass production by reallocating N between Pinus sylvestris (Scots pine) needles at different stages of decomposition. We estimated fungal biomass production by analysing the accumulation of the fungal cell wall compound chitin. Monospecific systems were compared with systems with interspecific interactions. We found that the fungi reallocated assimilated N and mycelial growth away from well-degraded litter towards fresh litter components. This redistribution was accompanied by reduced decomposition of older litter. Interconnection of substrates increased over-all fungal C use efficiency (i.e. the allocation of assimilated C to biomass rather than respiration), presumably by enabling fungal translocation of growth-limiting N to litter with higher C quality. Fungal connection between different substrates also restricted N-mineralization and production of dissolved organic N, suggesting that litter saprotrophs in boreal forest ecosystems primarily act to redistribute rather than release N. This spatial integration of different resource qualities was hindered by interspecific interactions, in which litters of contrasting quality were colonised by two different basidiomycete species. The experiments provide a detailed picture of how resource reallocation in two decomposer fungi leads to a more efficient utilisation of spatially separated resources under N-limitation. From an ecosystem point of view, such economic fungal behaviour could potentially contribute to organic matter accumulation in the litter layers of boreal forests."
