id,abstract
https://openalex.org/W4306247792,"Background Hepatitis B virus (HBV) infection can be prevented by vaccination. Exposure to blood or body fluids poses a high risk of transmission of HBV in health care workers (HCWs). This study aimed to determine the prevalence of markers of exposure, susceptibility, and protection to HBV infection in HCWs in Beira, Mozambique. Methods A cross-sectional study was conducted between June and August 2020 in Beira City, Mozambique, in HCWs based on self-administered questionnaires and blood samples. Plasma samples were tested for HBV surface antigen (HBsAg), antibodies to HBV core antigen (anti-HBc), antibodies to HBsAg (anti-HBs) and HBV viral load (HBV DNA). Results Most of the 315 HCWs in the study were nurses (125; 39.7%). Of the HCWs, 5.1% (16; 95% Confidence Interval (CI): 2.9 to 8.1%) were infected by HBV (HBsAg and/or HBV DNA positive). Occult HBV infection (OBI) (HBV DNA positive and HBsAg negative) was found in 0.3% (1; 95% CI: 0.0 to 1.8%) of participants; 27.9% (88; 95% CI: 23.1 to 33.2%) were susceptible (negative for all markers), 6.3% (20; 95% CI: 3.9 to 9.6) were immune due to natural infection (anti-HBs and anti-HBc positive only), while 60% (189; 95% CI: 54.4 to 65.5) were immune due to vaccination (anti-HBs positive only). Conclusion This study showed a high intermediate prevalence of chronic hepatitis B among healthcare workers in Beira City, Central Mozambique, and one-third of healthcare workers were susceptible to HBV infection. There is a need to implement a national hepatitis B screening and vaccination strategy among healthcare workers in Mozambique."
https://openalex.org/W4306247932,"To evaluate certain two-dimensional (2D) ultrasound signs as predictors of massive peri-operative blood loss (PBL) in pregnant women with placenta previa suspicious of PAS disorder.A single center retrospective study was done in pregnant women who had undergone prenatal diagnosis with 2D ultrasound grey scale and color Doppler using the EW-AIP (which has been changed to IS-PAS (International Society for the Placenta Accreta Spectrum)) criteria between January 2007 and May 2021. The patients were divided into 2 groups, non-massive hemorrhage with PBL ≤ 2500 mL and massive PBL >2500 mL. All PAS cases had pathological confirmation. Ultrasound signs and hemorrhagic outcomes were compared between the two groups. A PAS scoring system to predict massive PBL was constructed and a receiver operating characteristic (ROC) curve was calculated to evaluate the efficacy of the scoring system.Of 534 women, 146 (28.3%) had PBL > 2500 mL and 388 (71.7%) had PBL ≤ 2500 mL. In the massive PBL group, 101 (69.2%) were diagnosed as PAS and 45 (30.8%) as placenta previa alone. From 10 evaluated 2D ultrasound signs, 3 had the highest odds ratios (ORs) associated with massive PBL, 'focal exophytic mass' OR 8.17 (p = 0.024), 'placental bulge' OR 2.47 (p = 0.011), and 'placental lacunae feeder vessels' OR 2.38 (p = 0.01). When using the PAS scoring system, the AUC to predict massive PBL was 0.80 (95% CI, 0.76-0.85,).Our PAS scoring system based on 2-dimensional ultrasound signs combined with grey scale and color Doppler is useful to predict massive PBL and can help optimize pre-operative management in cases of previa suspicious of PAS."
https://openalex.org/W4306180625,"Salmonella is an intracellular pathogen causing significant morbidity and mortality. Its ability to grow inside macrophages is important to virulence, and is dependent on the activation state of the macrophages. Classically activated M1 macrophages are non-permissive for Salmonella growth, while alternatively activated M2 macrophages are permissive for Salmonella growth. Here we showed that endotoxin-primed macrophages (M EP ), such as those associated with sepsis, showed similar levels of Salmonella resistance to M1 macrophages after 2 hr of intracellular infection, but at the 4 hr and 24 hr time points were susceptible like M2 macrophages. To understand this mechanistically, transcriptomic sequencing, RNA-Seq, was performed. This showed that M1 and M EP macrophages that had not been exposed to Salmonella , demonstrated a process termed here as primed activation, in expressing relatively higher levels of particular anti-infective genes and pathways, including the JAK-STAT (Janus kinase-signal transducer and activator of transcription) pathway. In contrast, in M2 macrophages these genes and pathways were largely expressed only in response to infection. Conversely, in response to infection, M1 macrophages, but not M EP macrophages, modulated additional genes known to be associated with susceptibility to Salmonella infection, possibly contributing to the differences in resistance at later time points. Application of the JAK inhibitor Ruxolitinib before infection reduced resistance in M1 macrophages, supporting the importance of early JAK-STAT signalling in M1 resistance to Salmonella ."
https://openalex.org/W4306180639,"This study explores how the US stock market reacted to the news of a successful development of vaccine by Pfizer and Biontech on November 9, 2020. In particular, the study analyses the effect of the vaccine announcement on 11 sector indices and 79 subsector indices. A key contribution of the present study is to provide a deeper subsector level of analysis lacking in existing literature. An event study approach is applied in identifying abnormal returns due to the November 9th vaccine announcement. Several event periods (-1, 0, 1, 2, 3, 0-1, 0-3) are analysed to provide a more complete picture of the effects. Based on analysis, it is established that there are considerable inter and intra sectoral variations in the impact of the vaccine news. The results show that the impact follows a clear pattern. The sectors that were hit hardest by the pandemic such as energy, financials, as well as subsectors like hotels and casinos, benefited the most from positive vaccine news. Subsectors that gained from the pandemic such as airfreight, household appliances and computers and electronics retail were depressed the most by the news. These findings suggest that while the availability of vaccines is expected to help steer economies gradually to normalcy, the re-adjustment is likely to be asymmetric across subsectors. While some subsectors expect to expand as these industries recover from the contraction inflicted by the COVID-19 environment, other subsectors expect adjustment losses as these industries shed off the above average gains driven by the COVID-19 environment."
https://openalex.org/W4306180647,"Tendons are composed of a heterogeneous cell environment, with Scleraxis-lineage (ScxLin) cells being the predominant population. Although ScxLin cells are required for maintenance of tendon homeostasis, their functions during tendon healing are unknown. To this end, we first characterized the spatiotemporal dynamics of ScxLin cells during tendon healing, and identified that the overall ScxLin pool continuously expands up to early remodeling healing phase. To better define the function of ScxLin cells during the late proliferative phase of healing, we inducibly depleted ScxLin cells from day 14-18 post-surgery using the Scx-Cre; Rosa-DTR mouse model, with local administration of diphtheria toxin inducing apoptosis of ScxLin cells in the healing tendon. At D28 post-surgery, ScxLin cell depleted tendons (DTRScxLin) had substantial impairments in structure and function, relative to WT, demonstrating the importance of ScxLin cells during tendon healing. Next, bulk RNAseq was utilized to identify the underlying mechanisms that were impaired with depletion and revealed that ScxLin depletion induced molecular and morphological stagnation of the healing process at D28. However, this stagnation was transient, such that by D56 tendon mechanics in DTRScxLin were not significantly different than wildtype repairs. Collectively, these data offer fundamental knowledge on the dynamics and roles of ScxLin cells during tendon healing."
https://openalex.org/W4306180744,"What is the relation between seed quality and food security? Here we built a summary diagram that links the development stages of the seeds with their potential of providing grain yield. This idea was tested using cowpea as a model crop, grown in a tropical environment. Initially, seed quality attributes such as water content, dry weight, germination, vigor, and longevity were characterized during seed development. With this, we were able to elucidate at which point the late maturation phase and the acquisition of seed with superior physiological quality starts. From these data, the proposed summary diagram highlighted the seed quality as a technological basis for generating a more productive plant community. It also showed that only seeds with a high-quality profile have a better chance to establishment in an increasingly challenging agricultural environment. Overall, we bring the concept that cowpea seeds with superior quality besides being the essential input for tropical agriculture is also a strategy that can contribute food security."
https://openalex.org/W4306194373,"Serum amyloid A (SAA) is an acute phase protein, which undergoes structural changes and deposits in the extracellular matrix, causing organ damage. Systemic AA amyloidosis is a relatively common amyloid subtype among the more than 30 amyloid subtypes, but the mechanism of amyloid fibril formation remains unclear. In this study, we investigated the tissue distribution of SAA derived peptides in formalin-fixed paraffin embedded (FFPE) specimens of human myocardium with amyloidosis using matrix-assisted laser desorption/ionization imaging mass spectrometry (MALDI-IMS). In the whole SAA protein, four trypsin-digested peptides in the range of SAA2-67 were visualized and the N-terminal peptide; SAA2-15, was selectively localized in the Congo red-positive region. The C-terminal peptides; SAA47-62, SAA48-62, and SAA63-67 were detected not only in the Congo red-positive region but also in the surrounding negative region. Our results demonstrate that the N-terminal SAA2-15 plays a critical role in the formation of AA amyloid fibril, as previously reported. Roles of the C-terminal peptides require further investigation."
https://openalex.org/W4306194487,"Burns are physically debilitating and potentially fatal injuries. The most common etiology of burn wound infections in the US is methicillin-resistant Staphylococcus aureus (MRSA), which is particularly recalcitrant when biofilms form. The current standard of care, silver sulfadiazine (SSD) is effective in reducing bacterial load, but less effective in improving burn wound healing. New treatments that can manage infection while simultaneously improving healing would provide a benefit in the treatment of burns. Porcine models are frequently used as a model for human wound healing but can be expensive due to the need to separate wounds to avoid cross contamination. The porcine model developed in this study offers the capability to study multiple partial thickness burn wound (PTBW) sites on a single animal with minimal crosstalk to study wound healing, infection, and inflammation. The current study evaluates a wound rinse and a wound gel formulated with a non-toxic, polycationic chitosan derivative that is hypothesized to manage infection while also promoting healing, providing a potential alternate to SSD. Studies in vitro and in this PTBW porcine model compare treatment with the chitosan derivative formulations to SSD. The wound rinse and wound gel are observed to disrupt mature MRSA biofilms in vitro and reduce the MRSA load in viv o when compared to that of the standard of care. In vivo data further show increased re-epithelialization and faster healing in burns treated with wound rinse/gel as compared to SSD. Taken together, the data demonstrate the potential of the wound rinse/gel to significantly enhance healing, promote re-epithelialization, and reduce bacterial burden in infected PTBW using an economical porcine model."
https://openalex.org/W4306194497,"While there is evidence of urban/rural disparities in COVID-19 vaccination coverage, there is limited data on the influence of other place-based variables. In this cross-sectional study, we analyzed population-based linked administrative health data (publicly-funded health insurance database and province-wide immunization repository) to examine vaccination coverage for 3,945,103 residents aged 12 years and above in Alberta, Canada. We used multilevel logistic regression to examine the association of vaccination coverage with various place-based variables. Furthermore, we combined information on vaccine coverage and neighborhood level COVID-19 risk to categorize forward sortation areas (FSAs) into six categories. After 4 months of widely available COVID-19 vaccine, coverage varied widely between rural and urban areas (58% to 73%) and between geographic health authority zones (55.8% to 72.8%). Residents living in neighborhoods with lower COVID-19 disease incidence had the lowest vaccination coverage (63.2%), while coverage in higher incidence neighborhoods ranged from 68.3% to 71.9%. The multilevel logistic regression model indicated that residence in metro (adjusted odds ratio [aOR] 1.37; 95% CI: 1.31–1.42) and urban areas (aOR 1.11; 95% CI: 1.08–1.14) was associated with higher vaccine coverage than residence in rural areas. Similarly, residence in Edmonton, Calgary, and South health zones was associated with higher vaccine coverage compared to residence in Central zone. Higher income neighborhoods reported higher vaccine coverage than the lowest-income neighborhoods, and the highest COVID-19 risk neighborhoods reported higher vaccine coverage than the lowest risk neighborhoods (aOR 1.52; 95% CI: 1.12–2.05). In the first four months of wider vaccine availability in Alberta, COVID-19 vaccine coverage varied according to various place-based characteristics. Vaccine distribution strategies need to consider place-based variables for program prioritization and delivery."
https://openalex.org/W4306247656,"Leishmaniasis is endemic in Morocco where both cutaneous and visceral forms coexist. To date, anthroponotic cutaneous leishmaniasis (ACL) determinants remain poorly investigated in Morocco. However, the disease risk factors identification is vital to determine the specific preventive process. In this aim, a case-control study was conducted in the main active ACL foci in central Morocco. Epidemiological data were extracted from bulletins, registers and annual reports of the regional direction of Health offices. The socioeconomic and environmental data were collected from epidemiological surveys, completed by a questionnaire intended for accessible positive population and control people selected from the cases' entourage. The study included 258 cases and 395 controls. Our results showed that many socioeconomic factors were associated with ACL in Morocco such as the rural habitation (OR = 4.163; 95% CI: 2.91-5.96), movement to endemic area (OR = 4.53; 95% CI: 3.03-6.77), provenance from leishmaniasis foci (in Essaouira focus OR = 5.34; 95% CI: 1.19-24.03) and poverty. In addition, environmental factors like proximity of vegetation (OR = 2.45; 95% CI: 1.14-5.25), poor domestic hygiene, particularly the absence of sewage system/waste management (OR = 1.63; 95% CI: 1.35-1.96), and presence of animals (OR = 2.67; 95% CI: 1.14-5.25) increase the risk of ACL in Morocco. Except for Matrimonial status (married people, OR = 4.11; 95% CI: 1.80-9.41), there is however no significant association of the disease with the other socio-demographic factors in the study area (p>0.05). These several risk factors must be taken in consideration to prevent this disease through multidisciplinary collaboration and community participation."
https://openalex.org/W4306247975,"Objectives In England, Electronic Palliative Care Coordination Systems (EPaCCS) were introduced in 2008 to support care coordination and delivery in accordance with patient preferences. Despite policy supporting their implementation, there has been a lack of rigorous evaluation of EPaCCS and it is not clear how they have been translated into practice. This study sought to examine the current national implementation of EPaCCS, including their intended impact on patient and service outcomes, and barriers and facilitators for implementation. Methods We conducted a national cross-sectional online survey of end-of-life care commissioning leads for Clinical Commissioning Groups (CCGs) in England. We enquired about the current implementation status of EPaCCS, their role in information sharing and intended impact, and requested routine patient-level data relating to EPaCCS. Results Out of 135 CCGs, 85 (63.0%) responded, with 57 (67.1%) having operational EPaCCS. Use of EPaCCS were confined to healthcare providers with most systems (67%) not supporting information sharing with care homes and social care providers. Most systems (68%) sought to facilitate goal concordant care, although there was inconsonance between intended impacts and monitoring measures used. Common challenges to implementation included healthcare professionals’ limited engagement. Only one-third of patients had an EPaCCS record at death with limited recording of patient preferences. Conclusions Critical gaps exist in engagement with EPaCCS and their ability to facilitate information sharing across care providers. The limited alignment between stated goals of EPaCCS and their monitoring impedes efforts to understand which characteristics of systems can best support care delivery."
https://openalex.org/W4306180604,"Background Accurate breath detection is essential for the computation of outcomes in the multiple-breath washout (MBW) technique. This is particularly important in young children, where irregular breathing is common, and the designation of inspirations and expirations can be challenging. Aim To investigate differences between a commercial and a novel breath-detection algorithm and to characterize effects on MBW outcomes in children. Methods We replicated the signal processing and algorithms used in Spiroware software (v3.3.1, Eco Medics AG). We developed a novel breath detection algorithm (custom) and compared it to Spiroware using 2,455 nitrogen (N 2 ) and 325 sulfur hexafluoride (SF 6 ) trials collected in infants, children, and adolescents. Results In 83% of N 2 and 32% of SF 6 trials, the Spiroware breath detection algorithm rejected breaths and did not use them for the calculation of MBW outcomes. Our custom breath detection algorithm determines inspirations and expirations based on flow reversal and corresponding CO 2 elevations, and uses all breaths for data analysis. In trials with regular tidal breathing, there were no differences in outcomes between algorithms. However, in 10% of pre-school children tests the number of breaths detected differed by more than 10% and the commercial algorithm underestimated the lung clearance index by up to 21%. Conclusion Accurate breath detection is challenging in young children. As the MBW technique relies on the cumulative analysis of all washout breaths, the rejection of breaths should be limited. We provide an improved algorithm that accurately detects breaths based on both flow reversal and CO 2 concentration."
https://openalex.org/W4306180662,"Emotion lexicons became a popular method for quantifying affect in large amounts of textual data (e.g., social media posts). There are multiple independently developed emotion lexicons which tend to correlate positively with one another but not entirely. Such differences between lexicons may not matter if they are just unsystematic noise, but if there are systematic differences this could affect conclusions of a study. The goal of this paper is to examine whether two extensively used, apparently domain-independent lexicons for emotion analysis would give the same answer to a theory-driven research question. Specifically, we use the Linguistic Inquiry and Word Count (LIWC) and NRC Word-Emotion Association Lexicon (NRC). As an example, we investigate whether older people have more positive expression through their language use. We examined nearly 5 million tweets created by 3,573 people between 18 to 78 years old and found that both methods show an increase in positive affect until age 50. After that age, however, according to LIWC, positive affect drops sharply, whereas according to NRC, the growth of positive affect increases steadily until age 65 and then levels off. Thus, using one or the other method would lead researchers to drastically different theoretical conclusions regarding affect in older age. We unpack why the two methods give inconsistent conclusions and show this was mostly due to a particular class of words: those related to politics. We conclude that using a single lexicon might lead to unreliable conclusions, so we suggest that researchers should routinely use at least two lexicons. If both lexicons come to the same conclusion then the research evidence is reliable, but if not then researchers should further examine the lexicons to find out what difference might be causing inconclusive result."
https://openalex.org/W4306180667,"Acacia (Leguminosae, Caesalpinioideae, mimosoid clade) is the largest and most widespread genus of plants in the Australian flora, occupying and dominating a diverse range of environments, with an equally diverse range of forms. For a genus of its size and importance, Acacia currently has surprisingly few genomic resources. Acacia pycnantha, the golden wattle, is a woody shrub or tree occurring in south-eastern Australia and is the country's floral emblem. To assemble a genome for A. pycnantha, we generated long-read sequences using Oxford Nanopore Technology, 10x Genomics Chromium linked reads, and short-read Illumina sequences, and produced an assembly spanning 814 Mb, with a scaffold N50 of 2.8 Mb, and 98.3% of complete Embryophyta BUSCOs. Genome annotation predicted 47,624 protein-coding genes, with 62.3% of the genome predicted to comprise transposable elements. Evolutionary analyses indicated a shared genome duplication event in the Caesalpinioideae, and conflict in the relationships between Cercis (subfamily Cercidoideae) and subfamilies Caesalpinioideae and Papilionoideae (pea-flowered legumes). Comparative genomics identified a suite of expanded and contracted gene families in A. pycnantha, and these were annotated with both GO terms and KEGG functional categories. One expanded gene family of particular interest is involved in flowering time and may be associated with the characteristic synchronous flowering of Acacia. This genome assembly and annotation will be a valuable resource for all studies involving Acacia, including the evolution, conservation, breeding, invasiveness, and physiology of the genus, and for comparative studies of legumes."
https://openalex.org/W4306194418,"Background Studies on medication safety in pregnancy are increasingly focusing on child neurodevelopmental outcomes. Establishing neurodevelopmental safety is complex due to the range of neurodevelopmental outcomes and the length of follow-up needed for accurate assessment. The aim of this study was to provide an inventory of European data sources for use in pharmacoepidemiologic studies investigating neurodevelopment following maternal medication exposure. Method The EUROmediSAFE inventory of data sources in Europe for evaluating perinatal and long-term childhood risks associated with in-utero exposure to medication was updated by contacting colleagues across 31 European countries, literature review and internet searches. Included data sources must record at least one neurodevelopmental outcome and maternal medication use in pregnancy must be available, either in the data source itself or through linkage with another data source. Information on the domain of neurodevelopment, measure/scale used and the approach to measurement were recorded for each data source. Results Ninety data sources were identified across 14 countries. The majority (63.3%) were created for health surveillance and research with the remaining serving administrative purposes (21.1% healthcare databases,15.6% other administrative databases). Five domains of neurodevelopment were identified—infant development (36 data sources,13 countries), child behaviour (27 data sources, 10 countries), cognition (29 data sources, 12 countries), educational achievement (20 data sources, 7 countries), and diagnostic codes for neurodevelopmental disorders (42 data sources, 11 countries). Thirty-nine data sources, in 12 countries, had information on more than one domain of neurodevelopment. Conclusion This inventory is invaluable to future studies planning to investigate the neurodevelopmental impact of medication exposures during pregnancy. Caution must be used when combining varied approaches to neurodevelopment outcome measurement, the age of children in the data source, and the sensitivity and specificity of the outcome measure selected should be borne in mind."
