id,abstract
https://openalex.org/W2106572080,"Tenascin C is an extracellular matrix protein previously linked to breast cancer metastasis. Here the authors uncover how tenascin C promotes the fitness of metastasis-initiating cells by sustaining the stem and survival signaling pathways NOTCH and Wnt through specific regulation of Msi1 and Lgr5, respectively. We report that breast cancer cells that infiltrate the lungs support their own metastasis-initiating ability by expressing tenascin C (TNC). We find that the expression of TNC, an extracellular matrix protein of stem cell niches, is associated with the aggressiveness of pulmonary metastasis. Cancer cell–derived TNC promotes the survival and outgrowth of pulmonary micrometastases. TNC enhances the expression of stem cell signaling components, musashi homolog 1 (MSI1) and leucine-rich repeat–containing G protein–coupled receptor 5 (LGR5). MSI1 is a positive regulator of NOTCH signaling, whereas LGR5 is a target gene of the WNT pathway. TNC modulation of stem cell signaling occurs without affecting the expression of transcriptional enforcers of the stem cell phenotype and pluripotency, namely nanog homeobox (NANOG), POU class 5 homeobox 1 (POU5F1), also known as OCT4, and SRY-box 2 (SOX2). TNC protects MSI1-dependent NOTCH signaling from inhibition by signal transducer and activator of transcription 5 (STAT5), and selectively enhances the expression of LGR5 as a WNT target gene. Cancer cell–derived TNC remains essential for metastasis outgrowth until the tumor stroma takes over as a source of TNC. These findings link TNC to pathways that support the fitness of metastasis-initiating breast cancer cells and highlight the relevance of TNC as an extracellular matrix component of the metastatic niche."
https://openalex.org/W2038866304,"Direct editing of disease-causing mutations has obvious attractions for the treatment of genetic disorders if the many practical obstacles to the technique can be overcome. One promising line of research centres on the development of zinc finger nucleases (ZFNs) produced by fusing an engineered zinc finger DNA-binding domain to an endonuclease. These artificial enzymes induce efficient gene correction in cultured cells. Li et al. now report that zinc finger nucleases induce double-strand breaks in specifically selected locations on the genome and stimulate genome editing at a clinically meaningful level in vivo. In a proof-of-principle experiment, ZFNs delivered to the liver in a mouse model of haemophilia B achieved a level of gene replacement that was sufficient to correct the clotting defect, and the effect persisted following liver regeneration. Editing of the human genome to correct disease-causing mutations is a promising approach for the treatment of genetic disorders. Genome editing improves on simple gene-replacement strategies by effecting in situ correction of a mutant gene, thus restoring normal gene function under the control of endogenous regulatory elements and reducing risks associated with random insertion into the genome. Gene-specific targeting has historically been limited to mouse embryonic stem cells. The development of zinc finger nucleases (ZFNs) has permitted efficient genome editing in transformed and primary cells that were previously thought to be intractable to such genetic manipulation1. In vitro, ZFNs have been shown to promote efficient genome editing via homology-directed repair by inducing a site-specific double-strand break (DSB) at a target locus2,3,4, but it is unclear whether ZFNs can induce DSBs and stimulate genome editing at a clinically meaningful level in vivo. Here we show that ZFNs are able to induce DSBs efficiently when delivered directly to mouse liver and that, when co-delivered with an appropriately designed gene-targeting vector, they can stimulate gene replacement through both homology-directed and homology-independent targeted gene insertion at the ZFN-specified locus. The level of gene targeting achieved was sufficient to correct the prolonged clotting times in a mouse model of haemophilia B, and remained persistent after induced liver regeneration. Thus, ZFN-driven gene correction can be achieved in vivo, raising the possibility of genome editing as a viable strategy for the treatment of genetic disease."
https://openalex.org/W1985450720,
https://openalex.org/W1996931025,"Cells that are deficient in homologous recombination, such as those that lack functional breast cancer-associated 1 (BRCA1) or BRCA2, are hypersensitive to inhibition of poly(ADP-ribose) polymerase (PARP). However, BRCA-deficient tumors represent only a small fraction of adult cancers, which might restrict the therapeutic utility of PARP inhibitor monotherapy. Cyclin-dependent kinase 1 (Cdk1) phosphorylates BRCA1, and this is essential for efficient formation of BRCA1 foci. Here we show that depletion or inhibition of Cdk1 compromises the ability of cells to repair DNA by homologous recombination. Combined inhibition of Cdk1 and PARP in BRCA-wild-type cancer cells resulted in reduced colony formation, delayed growth of human tumor xenografts and tumor regression with prolonged survival in a mouse model of lung adenocarcinoma. Inhibition of Cdk1 did not sensitize nontransformed cells or tissues to inhibition of PARP. Because reduced Cdk1 activity impaired BRCA1 function and consequently, repair by homologous recombination, inhibition of Cdk1 represents a plausible strategy for expanding the utility of PARP inhibitors to BRCA-proficient cancers."
https://openalex.org/W2092915328,"Current approaches used to identify protein-binding small molecules are not suited for identifying small molecules that can bind emerging RNA drug targets. By docking small molecules onto an RNA dynamic ensemble constructed by combining NMR spectroscopy and computational molecular dynamics, we virtually screened small molecules that target the entire structure landscape of the transactivation response element (TAR) from HIV type 1 (HIV-1). We quantitatively predict binding energies for small molecules that bind different RNA conformations and report the de novo discovery of six compounds that bind TAR with high affinity and inhibit its interaction with a Tat peptide in vitro (K(i) values of 710 nM-169 μM). One compound binds HIV-1 TAR with marked selectivity and inhibits Tat-mediated activation of the HIV-1 long terminal repeat by 81% in T-cell lines and HIV replication in an HIV-1 indicator cell line (IC(50) ∼23.1 μM)."
https://openalex.org/W2009006896,"Non-small cell lung cancer (NSCLC) accounts for ∼80% of all lung cancers. Although some advances in lung cancer therapy have been made, patient survival is still quite poor. Two microRNAs, miR-221 and miR-222, upregulated by the MET proto-oncogene, have been already described to enhance cell survival and to induce TNF-related apoptosis-inducing ligand (TRAIL) resistance in NSCLC cell lines, through the downregulation of p27(kip1), PTEN and TIMP3. Here, we further investigated this pathway and showed that miR-130a, expressed at low level in lung cancer cell lines, by targeting MET was able to reduce TRAIL resistance in NSCLC cells through the c-Jun-mediated downregulation of miR-221 and miR-222. Moreover, we found that miR-130a reduced migratory capacity of NSCLC. A better understanding of MET-miR-221 and 222 axis regulation in drug resistance is the key in developing new strategies in NSCLC therapy."
https://openalex.org/W2012063163,"Hydroxy fatty acids are critical lipid mediators involved in various pathophysiologic functions. We cloned and identified GPR31, a plasma membrane orphan G protein-coupled receptor that displays high affinity for the human 12-lipoxygenase-derived product 12-(<i>S</i>)-hydroxy-5,8,10,14-eicosatetraenoic acid (HETE). Thus, GPR31 is named 12-(<i>S</i>)-HETE receptor (12-HETER) in this study. The cloned 12-HETER demonstrated high affinity binding for 12-(<i>S</i>)-[<sup>3</sup>H]HETE (<i>K<sub>d</sub></i> = 4.8 ± 0.12 nm). Also, 12-(<i>S</i>)-HETE efficiently and selectively stimulated GTPγS coupling in the membranes of 12-HETER-transfected cells (EC<sub>50</sub> = 0.28 ± 1.26 nm). Activating GTPγS coupling with 12-(<i>S</i>)-HETE proved to be both regio- and stereospecific. Also, 12-(<i>S</i>)-HETE/12-HETER interactions lead to activation of ERK1/2, MEK, and NFκB. Moreover, knocking down 12-HRTER specifically inhibited 12-(<i>S</i>)-HETE-stimulated cell invasion. Thus, 12-HETER represents the first identified high affinity receptor for the 12-(<i>S</i>)-HETE hydroxyl fatty acids."
