id,abstract
https://openalex.org/W2639758751,"A host of animals build architectural constructions. Such constructions frequently vary with environmental and individual/colony conditions, and their architecture directly influences behavior and fitness. The nests of ant colonies drive and enable many of their collective behaviors, and as such are part of their 'extended phenotype'. Since ant colonies have been recently shown to differ in behavior and life history strategy, we ask whether colonies differ in another trait: the architecture of the constructions they create. We allowed Temnothorax rugatulus rock ants, who create nests by building walls within narrow rock gaps, to repeatedly build nest walls in a fixed crevice but under two environmental conditions. We find that colonies consistently differ in their architecture across environments and over nest building events. Colony identity explained 12-40% of the variation in nest architecture, while colony properties and environmental conditions explained 5-20%, as indicated by the condition and marginal R2 values. When their nest boxes were covered, which produced higher humidity and lower airflow, colonies built thicker, longer, and heavier walls. Colonies also built more robust walls when they had more brood, suggesting a protective function of wall thickness. This is, to our knowledge, the first study to explicitly investigate the repeatability of nestbuilding behavior in a controlled environment. Our results suggest that colonies may face tradeoffs, perhaps between factors such as active vs. passive nest defense, and that selection may act on individual construction rules as a mechanisms to mediate colony-level behavior."
https://openalex.org/W2722982242,"Prompted by the recent growing evidence of oscillatory behavior involving MAPK cascades we present a systematic approach of analyzing models and elucidating the nature of biochemical oscillations based on reaction network theory. In particular, we formulate a minimal biochemically consistent mass action subnetwork of the Huang-Ferrell model of the MAPK signalling that provides an oscillatory response when a parameter controlling the activation of the top-tier kinase is varied. Such dynamics are either intertwined with or separated from the earlier found bistable/hysteretic behavior in this model. Using the theory of stability of stoichiometric networks, we reduce the original MAPK model, convert kinetic to convex parameters and examine those properties of the minimal subnetwork that underlie the oscillatory dynamics. We also use the methods of classification of chemical oscillatory networks to explain the rhythmic behavior in physicochemical terms, i.e., we identify of the role of individual biochemical species in positive and negative feedback loops and describe their coordinated action leading to oscillations. Our approach provides an insight into dynamics without the necessity of knowing rate coefficients and thus is useful prior the statistical evaluation of parameters."
https://openalex.org/W2698451293,"Hendra virus is a zoonotic paramyxovirus, which causes severe respiratory and neurological disease in horses and humans. Since 2012, the Hendra virus sub-unit G vaccine has been available for horse vaccination in Australia. Uptake of the vaccine has been limited and spill-over events of Hendra virus infection in horses continue to occur. We conducted an online, questionnaire-based cross-sectional study of 376 horse owners belonging to a variety of different equestrian clubs in Queensland, Australia, to identify risk factors for non-vaccination against Hendra virus. A total of 43.1% (N = 162) of horse owners indicated that they currently did not vaccinate against Hendra virus infection, while 56.9% (N = 214) currently vaccinated against Hendra virus infection. A total of 52 risk factors were evaluated relating to equestrian activities, horse management, perceived risk and severity of horse and human infection with Hendra virus, side effects of Hendra vaccination, other vaccinations conducted by horse owners and horse owners' attitudes towards veterinarians. The final multivariable logistics regression model identified the following risk factors associated with increased odds of non-vaccination against Hendra virus: 1) perceived low risk (compared to high) of Hendra virus infection to horses (considering the horse owners' location and management practices) or horse owners were unsure about the risk of infection, 2) perceived moderate severity (compared to very severe or severe) of Hendra virus infection in humans, 3) horse owners non-vaccination of their pets, 4) horse owners non-vaccination against strangles disease in horses, 5) handling of more than three horses per week (compared to one horse only) and 6) perceived attitude that veterinarians had a high motivation of making money from Hendra virus vaccination (compared to veterinarians having a low motivation of making money from Hendra virus vaccination). Horse owners were more likely to vaccinate against Hendra virus if horses were used for dressage, show jumping or eventing. The study also identified horse owners' concerns about side-effects and about the lack of evidence on vaccine efficacy."
https://openalex.org/W2708010316,"Because sweat secretion is facilitated by mechanical contraction of sweat gland structures, understanding their structure-function relationship could lead to more effective treatments for patients with sweat gland disorders such as heat stroke. Conventional histological studies have shown that sweat glands are three-dimensionally coiled tubular structures consisting of ducts and secretory portions, although their detailed structural anatomy remains unclear. To better understand the details of the three-dimensional (3D) coiled structures of sweat glands, a whole-mount staining method was employed to visualize 3D coiled gland structures with sweat gland markers for ductal luminal, ductal basal, secretory luminal, and myoepithelial cells. Imaging the 3D coiled gland structures demonstrated that the ducts and secretory portions were comprised of distinct tubular structures. Ductal tubules were occasionally bent, while secretory tubules were frequently bent and formed a self-entangled coiled structure. Whole-mount staining of complex coiled gland structures also revealed the detailed 3D cellular arrangements in the individual sweat gland compartments. Ducts were composed of regularly arranged cuboidal shaped cells, while secretory portions were surrounded by myoepithelial cells longitudinally elongated along entangled secretory tubules. Whole-mount staining was also used to visualize the spatial arrangement of blood vessels and nerve fibers, both of which facilitate sweat secretion. The blood vessels ran longitudinally parallel to the sweat gland tubules, while nerve fibers wrapped around secretory tubules, but not ductal tubules. Taken together, whole-mount staining of sweat glands revealed the 3D cell shapes and arrangements of complex coiled gland structures and provides insights into the mechanical contraction of coiled gland structures during sweat secretion."
https://openalex.org/W2664782742,"This study examined longitudinal changes in physical activity, sedentary behavior and body mass index in adolescents, specifically their migrations towards a different weight cluster. A cohort of 755 adolescents participated in a three-year study. A clustering Self-Organized Maps Analysis was performed to visualize changes in subjects' characteristics between the first and second assessment, and how adolescents were grouped. Also a classification tree was used to identify the behavioral characteristics of the groups that changed their weight cluster. Results indicated that boys were more active and less sedentary than girls. Boys were especially keen to technological-based activities while girls preferred social-based activities. A moderate competing effect between sedentary behaviors and physical activities was observed, especially in girls. Overweight and obesity were negatively associated with physical activity, although a small group of overweight/obese adolescents showed a positive relationship with vigorous physical activity. Cluster migrations indicated that 22.66% of adolescents changed their weight cluster to a lower category and none of them moved in the opposite direction. The behavioral characteristics of these adolescents did not support the hypothesis that the change to a lower weight cluster was a consequence of an increase in time devoted to physical activity or a decrease in time spent on sedentary behavior. Physical activity and sedentary behavior does not exert a substantial effect on overweight and obesity. Therefore, there are other ways of changing to a lower-weight status in adolescents apart from those in which physical activity and sedentary behavior are involved."
https://openalex.org/W2964150844,"Transmission electron microscopy (TEM) can be used to successfully determine the structures of proteins. However, such studies are typically done ex situ after extraction of the protein from the cellular environment. Here we describe an application for nanodiamonds as targeted intensity contrast labels in biological TEM, using the nuclear pore complex (NPC) as a model macroassembly. We demonstrate that delivery of antibody-conjugated nanodiamonds to live mammalian cells using maltotriose-conjugated polypropylenimine dendrimers results in efficient localization of nanodiamonds to the intended cellular target. We further identify signatures of nanodiamonds under TEM that allow for unambiguous identification of individual nanodiamonds from a resin-embedded, OsO4-stained environment. This is the first demonstration of nanodiamonds as labels for nanoscale TEM-based identification of subcellular protein assemblies. These results, combined with the unique fluorescence properties and biocompatibility of nanodiamonds, represent an important step toward the use of nanodiamonds as markers for correlated optical/electron bioimaging."
https://openalex.org/W2629863205,"In many Gram-negative bacteria, including Rhodobacter capsulatus, cytochrome c maturation (Ccm) is carried out by a membrane-integral machinery composed of nine proteins (CcmA to I). During this process, the periplasmic thiol-disulfide oxidoreductase DsbA is thought to catalyze the formation of a disulfide bond between the Cys residues at the apocytochrome c heme-binding site (CXXCH). Subsequently, a Ccm-specific thioreductive pathway involving CcmG and CcmH reduces this disulfide bond to allow covalent heme ligation. Currently, the sequence of thioredox reactions occurring between these components and apocytochrome c and the identity of their active Cys residues are unknown. In this work, we first investigated protein–protein interactions among the apocytochrome c, CcmG, and the heme-ligation components CcmF, CcmH, and CcmI. We found that they all interact with each other, forming a CcmFGHI–apocytochrome c complex. Using purified wild-type CcmG, CcmH, and apocytochrome c, as well as their respective Cys mutant variants, we determined the rates of thiol-disulfide exchange reactions between selected pairs of Cys residues from these proteins. We established that CcmG can efficiently reduce the disulfide bond of apocytochrome c and also resolve a mixed disulfide bond formed between apocytochrome c and CcmH. We further show that Cys-45 of CcmH and Cys-34 of apocytochrome c are most likely to form this mixed disulfide bond, which is consistent with the stereo-specificity of the heme–apocytochrome c ligation reaction. We conclude that CcmG confers efficiency, and CcmH ensures stereo-specificity during Ccm and present a comprehensive model for thioreduction reactions that lead to heme–apocytochrome c ligation. In many Gram-negative bacteria, including Rhodobacter capsulatus, cytochrome c maturation (Ccm) is carried out by a membrane-integral machinery composed of nine proteins (CcmA to I). During this process, the periplasmic thiol-disulfide oxidoreductase DsbA is thought to catalyze the formation of a disulfide bond between the Cys residues at the apocytochrome c heme-binding site (CXXCH). Subsequently, a Ccm-specific thioreductive pathway involving CcmG and CcmH reduces this disulfide bond to allow covalent heme ligation. Currently, the sequence of thioredox reactions occurring between these components and apocytochrome c and the identity of their active Cys residues are unknown. In this work, we first investigated protein–protein interactions among the apocytochrome c, CcmG, and the heme-ligation components CcmF, CcmH, and CcmI. We found that they all interact with each other, forming a CcmFGHI–apocytochrome c complex. Using purified wild-type CcmG, CcmH, and apocytochrome c, as well as their respective Cys mutant variants, we determined the rates of thiol-disulfide exchange reactions between selected pairs of Cys residues from these proteins. We established that CcmG can efficiently reduce the disulfide bond of apocytochrome c and also resolve a mixed disulfide bond formed between apocytochrome c and CcmH. We further show that Cys-45 of CcmH and Cys-34 of apocytochrome c are most likely to form this mixed disulfide bond, which is consistent with the stereo-specificity of the heme–apocytochrome c ligation reaction. We conclude that CcmG confers efficiency, and CcmH ensures stereo-specificity during Ccm and present a comprehensive model for thioreduction reactions that lead to heme–apocytochrome c ligation."
https://openalex.org/W2705620916,"Access to facilities, services and socio-economic opportunities plays a critical role in the growth and decline of cities and human settlements. Previous attempts to explain changes in socio-economic indicators by differences in accessibility have not been convincing as countries with highly developed transport infrastructure have only seen marginal benefits of infrastructure improvements. Australia offers an ideal case for investigating the effects of accessibility on development since it is seen as home to some of the most liveable cities in the world while, at the same time, it also has some of the most isolated settlements. We investigate herein the connectivity and accessibility of all 1814 human settlements (population centers exceeding 200 persons) in Australia, and how they relate to the socio-economic characteristics of, and opportunities in, each population center. Assuming population as a proxy indicator of available opportunities, we present a simple ranking metric for a settlement using the number of population and the distance required to access all other settlements (and the corresponding opportunities therein). We find a strikingly unequal distribution of access to opportunities in Australia, with a marked prominence of opportunities in capital cities in four of the eight states. The two largest cities of Sydney and Melbourne have a dominant position across all socio-economic indicators, compared to all the other cities. In general, we observe across all the settlements that a decrease in access to opportunities is associated with relatively greater socio-economic disadvantage including increased median age and unemployment rate and decreased median household income. Our methodology can be used to better understand the potential benefits of improved accessibility based on infrastructure development, especially for remote areas and for cities and towns with many socio-economically disadvantaged population."
https://openalex.org/W2661482340,"Mayflies (Ephemeroptera) display many primitive characters and a unique type of metamorphosis (Prometabola). However, information on the genomes and transcriptomes of this insect group is limited. The RNA sequencing study presented here generated the first de novo transcriptome assembly of Cloeon viridulum (Ephemeroptera: Baetidae), and compared gene expression signatures among the young larva (YL), mature larva (ML), subimago (SI), and imago (IM) stages of this mayfly. The transcriptome, based on 88 Gb of sequence data, comprised a set of 81,185 high quality transcripts. The number of differentially expressed genes (DEGs) in YL vs. ML, ML vs. SI, and SI vs. IM, was 4,825, 1,584, and 1,278, respectively, according to the reads per kilobase of transcript per million mapped reads analysis, assuming a false discovery rate <0.05 and a fold change >2. Gene enrichment analysis revealed that these DEGs were enriched in the “chitin metabolic process”, “germ cell development”, “steroid hormone biosynthesis”, and “cutin, suberine, and wax biosynthesis” pathways. Finally, the expression pattern of a selected group of candidate signature genes for Prometabola, including vestigial, methoprene-tolerant, wingless, and broad-complex were confirmed by quantitative real time-PCR analysis. The Q-PCR analysis of larval, subimaginal, and imaginal stages of C. viridulum suggests that the development of mayflies more closely resembles hemimetamorphosis than holometamorphosis."
https://openalex.org/W2638240441,"Foodborne Enteropathogenic Escherichia coli (EPEC) infections of the small intestine cause diarrhea especially in children and are a major cause of childhood death in developing countries. EPEC infects the apical membrane of the epithelium of the small intestine by attaching, effacing the microvilli under the bacteria and then forming microcolonies on the cell surface. We first asked the question where on epithelial cells EPEC attaches and grows. Using models of polarized epithelial monolayers, we evaluated the sites of initial EPEC attachment to the apical membrane and found that EPEC preferentially attached over the cell-cell junctions and formed microcolonies preferentially where three cells come together at tricellular tight junctions. The ability of EPEC to adhere increased when host cell polarity was compromised yielding EPEC access to basolateral proteins. EPEC pedestals contain basolateral cytoskeletal proteins. Thus, we asked if attached EPEC causes reorganization the protein composition of the host cell plasma membrane at sites of microcolony formation. We found that EPEC microcolony growth at the apical membrane resulted in a local accumulation of basolateral plasma membrane proteins surrounding the microcolony. Basolateral marker protein aquaporin-3 localized to forming EPEC microcolonies. Components of the basolateral vesicle targeting machinery were re-routed. The Exocyst (Exo70) was recruited to individual EPEC as was the basolateral vesicle SNARE VAMP-3. Moreover, several Rab variants were also recruited to the infection site, and their dominant-negative equivalents were not. To quantitatively study the recruitment of basolateral proteins, we created a pulse of the temperature sensitive basolateral VSVG, VSVG3-SP-GFP, from the trans-Golgi Network. We found that after release from the TGN, significantly more VSVG3-SP-GFP accumulated at the site of microcolony growth than on equivalent membrane regions of uninfected cells. This suggests that trafficking of vesicles destined for the basolateral membrane are redirected to the apical site of microcolony growth. Thus, in addition to disrupting host cell fence function, local host cell plasma membrane protein composition is changed by altered protein trafficking and recruitment of basolateral proteins to the apical microcolony. This may aid EPEC attachment and subsequent microcolony growth."
https://openalex.org/W2721547336,"The impact of choroid plexus with its blood-cerebrospinal fluid barrier in the ischemic stroke pathology is poorly explored. Transthyretin (TTR) is a protein synthesized in liver and just in choroid plexus.The current study was designed to assess the prognostic value of serum TTR for functional outcome (at the time of hospital discharge) and long-term (one-year) overall mortality in ischemic stroke patients.We conducted a prospective observational study. Patients (n = 81) with acute (< 24 hours of symptoms onset) ischemic stroke consecutively admitted to Stroke Unit were included. An unfavorable outcome was defined as a modified Rankin Scale (mRS) score ≥ 3. The relationships between serum TTR levels and clinical outcome were analyzed using multivariate analysis. One-year mortality was analyzed by Kaplan-Meier survival curves stratified by mean value of TTR.Compared with patients with mRS <3, patients with an unfavorable outcome at hospital discharge had significantly lower TTR levels on admission (P < 0.0001). In non-survivals serum TTR levels were significantly lower compared with patients who survive one year of observation (P = 0.009). Using multivariate analysis, transthyretin emerged as an independent predictor for unfavorable outcome at the day of hospital discharge (adjusted odds ratio = 0.96; 95% CI: 0.9-0.99, P <0.05). A one-year mortality of patients with the lower TTR levels was significantly higher than in patients with TTR levels above mean value (P = 0.02).Serum level of TTR at admission was a predictor of functional outcome after ischemic stroke and was also associated with one-year mortality in stroke survivals."
https://openalex.org/W2702057538,"The risk of colorectal adenoma (CRA), an important precursor of colorectal cancer, is largely unknown among obese individuals without obesity-related metabolic abnormalities, a condition described as metabolically-healthy obese (MHO). The aim of this study was to examine the association among metabolic status, the different categories of body mass index (BMI), and CRA in a large cohort of adults.We analyzed the association among metabolic status, BMI categories and CRA in asymptomatic adults who underwent a first-time colonoscopy as part of the comprehensive health check-up program at the Health Promotion Center of Samsung Medical Center, from January 2005 to December 2012. Being metabolically healthy was defined as lacking any metabolic syndrome components and having a homeostasis model assessment of insulin resistance <2.5.The prevalence of ""any,"" ""multiple,"" and ""high-risk"" CRA was 25.6%, 8.3%, and 4.4% among 9,182 metabolically-healthy participants, and 35.9%, 12.5%, and 7.0% among 17,407 metabolically-unhealthy participants, respectively. Increased BMI showed a significant dose-dependent relationship with the prevalence of ""any,"" ""multiple,"" and ""high-risk"" CRA, in both metabolically-healthy and unhealthy participants. In multivariable-adjusted models that accounted for potential confounders including age, sex, smoking, alcohol, first-degree family history of colorectal cancer, and aspirin use, the odds ratio (OR) for any CRA comparing MHO with metabolically-healthy normal-weight (MHNW) participants was 1.25 (95% confidence interval (CI), 1.09-1.43). Further adjustment for metabolic components associated with obesity did not significantly change the association. Similarly, the ORs for multiple CRAs and high risk CRA were higher in MHO participants than MHNW participants [ORs (95% CI), 1.63 (1.31-2.04) and 1.53 (1.14-2.04), respectively].The MHO phenotype was closely associated with higher prevalence of CRA, including high-risk adenoma. This finding supports the conclusion that MHO increases the risk of colorectal cancer."
https://openalex.org/W2720156116,"Some parasites have an ability to fabricate the behavior of their host and impel the host to guard parasites' offspring, which is popularly called as bodyguard manipulation. Psalis pennatula larva parasitized by a braconid parasitoid wasp Microplitis pennatula exhibits some behavioral changes including the guarding of the parasitoid pupa from its natural enemies. We hypothesized that these behavioral change exhibited by the parasitized host larva are induced by the parasitoid and can be considered as an example of bodyguard manipulation. Even though hyperparasitoids are the more specialized natural enemy of parasitoids than predators, very few studies tested the success of guarding parasitoid pupa against hyperparasitoids. This study analyzed the success of guarding behavior of the parasitized host against hyperparasitoids. The onsets of parasite-induced phenotypic alterations (PIPAs) in the parasitized host were inspected to analyze whether these behavioral changes in the host larva manifests gradually or abruptly. The study concludes that parasitized host larva defends the parasitoid pupa from hyperparasitoids and the PIPAs in the parasitized host develops abruptly only after the egression of parasitoid prepupa."
