id,abstract
https://openalex.org/W1978295098,"Phagocytosis is a complex process that involves membranelipid remodeling and the attraction and retention of key effector proteins. Phagosome phenotype depends on the type of receptor engaged and can be influenced by extracellular signals. Interleukin 4 (IL-4) is a cytokine that induces the alternative activation of macrophages (MΦs) upon prolonged exposure, triggering a different cell phenotype that has an altered phagocytic capacity. In contrast, the direct effects of IL-4 during phagocytosis remain unknown. Here, we investigate the impact of short-term IL-4 exposure (1 hour) during phagocytosis of IgG-opsonized yeast particles by MΦs. By time-lapse confocal microscopy of GFP-tagged lipid-sensing probes, we show that IL-4 increases the negative charge of the phagosomal membrane by prolonging the presence of the negatively charged second messenger PI(3,4,5)P3. Biochemical assays reveal an enhanced PI3K/Akt activity upon phagocytosis in the presence of IL-4. Blocking the specific class I PI3K after the onset of phagocytosis completely abrogates the IL-4-induced changes in lipid remodeling and concomitant membrane charge. Finally, we show that IL-4 direct signaling leads to a significantly prolonged retention profile of the signaling molecules Rac1 and Rab5 to the phagosomal membrane in a PI3K-dependent manner. This protracted early phagosome phenotype suggests an altered maturation, which is supported by the delayed phagosome acidification measured in the presence of IL-4. Our findings reveal that molecular differences in IL-4 levels, in the extracellular microenvironment, influence the coordination of lipid remodeling and protein recruitment, which determine phagosome phenotype and, eventually, fate. Endosomal and phagosomal membranes provide topological constraints to signaling molecules. Therefore, changes in the phagosome phenotype modulated by extracellular factors may represent an additional mechanism that regulates the outcome of phagocytosis and could have significant impact on the net biochemical output of a cell."
https://openalex.org/W2041749367,"Background Progress in clinical trials in infectious disease, autoimmunity, and cancer is stymied by a dearth of successful whole cell biomarkers for peripheral blood lymphocytes (PBLs). Successful biomarkers could help to track drug effects at early time points in clinical trials to prevent costly trial failures late in development. One major obstacle is the inaccuracy of Ficoll density centrifugation, the decades-old method of separating PBLs from the abundant red blood cells (RBCs) of fresh blood samples. Methods and Findings To replace the Ficoll method, we developed and studied a novel blood-based magnetic separation method. The magnetic method strikingly surpassed Ficoll in viability, purity and yield of PBLs. To reduce labor, we developed an automated platform and compared two magnet configurations for cell separations. These more accurate and labor-saving magnet configurations allowed the lymphocytes to be tested in bioassays for rare antigen-specific T cells. The automated method succeeded at identifying 79% of patients with the rare PBLs of interest as compared with Ficoll's uniform failure. We validated improved upfront blood processing and show accurate detection of rare antigen-specific lymphocytes. Conclusions Improving, automating and standardizing lymphocyte detections from whole blood may facilitate development of new cell-based biomarkers for human diseases. Improved upfront blood processes may lead to broad improvements in monitoring early trial outcome measurements in human clinical trials."
https://openalex.org/W2049768824,"Although immunoregulation of alloreactive human CTLs has been described, the direct influence of CD4+ Tregs on CD8+ cytotoxicity and the interactive mechanisms have not been well clarified. Therefore, human CD4+CD127−CD25+FOXP3+ Tregs were generated in MLR, immunoselected and their allospecific regulatory functions and associated mechanisms were then tested using modified 51Chromium release assays (Micro-CML), MLRs and CFSE-based multi-fluorochrome flow cytometry proliferation assays. It was observed that increased numbers of CD4+CD127−CD25+FOXP3+ cells were generated after a 7 day MLR. After immunoselection for CD4+CD127−CD25+ cells, they were designated as MLR-Tregs. When added as third component modulators, MLR-Tregs inhibited the alloreactive proliferation of autologous PBMC in a concentration dependent manner. The inhibition was quasi-antigen specific, in that the inhibition was non-specific at higher MLR-Treg modulator doses, but non-specificity disappeared with lower numbers at which specific inhibition was still significant. When tested in micro-CML assays CTL inhibition occurred with PBMC and purified CD8+ responders. However, antigen specificity of CTL inhibition was observed only with unpurified PBMC responders and not with purified CD8+ responders or even with CD8+ responders plus Non-T “APC”. However, allospecificity of CTL regulation was restored when autologous purified CD4+ T cells were added to the CD8+ responders. Proliferation of CD8+ cells was suppressed by MLR-Tregs in the presence or absence of IL-2. Inhibition by MLR-Tregs was mediated through down-regulation of intracellular perforin, granzyme B and membrane-bound CD25 molecules on the responding CD8+ cells. Therefore, it was concluded that human CD4+CD127−CD25+FOXP3+ MLR-Tregs down-regulate alloreactive cytotoxic responses. Regulatory allospecificity, however, requires the presence of cognate responding CD4+ T cells. CD8+ CTL regulatory mechanisms include impaired proliferation, reduced expression of cytolytic molecules and CD25+ activation epitopes."
https://openalex.org/W2132485291,"Background Human papillomavirus (HPV) is the main causative agent of cervical cancer, particularly high risk strains such us HPV-16, -18 and -31. The viral encoded E2 protein acts as a transcriptional modulator and exerts a key role in viral DNA replication. Thus, E2 constitutes an attractive target for developing antiviral agents. E2 is a homodimeric protein that interacts with the DNA target through an α-helix of each monomer. However, a peptide corresponding to the DNA recognition helix of HPV-16 E2 binds DNA with lower affinity than its full-length DNA binding domain. Therefore, in an attempt to promote the DNA binding of the isolated peptide, we have designed a conjugate compound of the E2 α-helix peptide and a derivative of the antibiotic distamycin, which involves simultaneous minor- and major-groove interactions. Methodology/Principal Findings An E2 α-helix peptide-distamycin conjugate was designed and synthesized. It was characterized by NMR and CD spectroscopy, and its DNA binding properties were investigated by CD, DNA melting and gel shift experiments. The coupling of E2 peptide with distamycin does not affect its structural properties. The conjugate improves significantly the affinity of the peptide for specific DNA. In addition, stoichiometric amounts of specific DNA increase meaningfully the helical population of the peptide. The conjugate enhances the DNA binding constant 50-fold, maintaining its specificity. Conclusions/Significance These results demonstrate that peptide-distamycin conjugates are a promising tool to obtain compounds that bind the E2 target DNA-sequences with remarkable affinity and suggest that a bipartite major/minor groove binding scaffold can be a useful approach for therapeutic treatment of HPV infection."
https://openalex.org/W2071628606,"Understanding the processes that determine the distribution of populations is a fundamental goal in ecology. In this study, I determined the relative contribution of space and the biotic and abiotic environment to the distribution of the palm-leaf skeletonizer Homaledra sabalella (PLS; Lepidoptera: Coleophoridae) among patchily distributed dwarf palmettos (Sabal minor; Arecaceae). Based on surveys conducted at two sites in the Sherburne Wildlife Management Area, Louisiana, I found that the distribution of the PLS was primarily related to local environmental conditions--number of PLS increased with palmetto height, was greater in dry versus wet habitats, and varied in an inconsistent way with the type of understory cover. Spatial structure of the forest and isolation of the host plant were of minor importance to the distribution of the PLS. Based on a series of experiments, the mechanisms underlying the effects of these environmental variables on PLS abundance were elucidated. Tall palmettos have a greater abundance of PLS because they are 2.5 times more likely to be colonized than small palmettos. Tall palmettos do not represent better hosts (in terms of PLS survival to pupation, pupal length, or risk of parasitism). Similarly, an open understory increased colonization by two-fold, relative to a shrub understory, but understory type had no effect on host quality. Wet soils greatly reduced palmetto quality as a host (survival and pupal length), but only for the smallest palmettos (<0.75 m height). Finally, corroborating the survey data, my dispersal experiment revealed that the PLS is a strong flier and that local PLS populations (i.e., infested palmettos) are likely well connected by dispersal. I conclude by discussing how landscape-level changes at Sherburne Wildlife Management Area, owing to recent hurricane activity, could affect the risk of palmetto infestation by the PLS."
