id,abstract
https://openalex.org/W2805301067,"Theoretical models of critical mass have shown how minority groups can initiate social change dynamics in the emergence of new social conventions. Here, we study an artificial system of social conventions in which human subjects interact to establish a new coordination equilibrium. The findings provide direct empirical demonstration of the existence of a tipping point in the dynamics of changing social conventions. When minority groups reached the critical mass-that is, the critical group size for initiating social change-they were consistently able to overturn the established behavior. The size of the required critical mass is expected to vary based on theoretically identifiable features of a social setting. Our results show that the theoretically predicted dynamics of critical mass do in fact emerge as expected within an empirical system of social coordination."
https://openalex.org/W3100573113,"Making silicon shine bright Silicon is the workhorse of the semiconductor electronics industry, but its lack of optical functionality is a barrier to developing a truly integrated silicon-based optoelectronics platform. Although there are several ways of exploiting nonlinear light-matter interactions to coax silicon into optical functionality, the effects tend to be weak. Otterstrom et al. used a suspended silicon waveguide racetrack structure to stimulate the stronger nonlinear effect of Brillouin scattering and achieve lasing from silicon. The ability to engineer the nonlinearity and tune the optical response through the design of the suspended cavity provides a powerful and flexible route for developing silicon-based optoelectronic circuits and devices. Science , this issue p. 1113"
https://openalex.org/W2805446519,"Plants regulate photosynthetic light harvesting to maintain balanced energy flux into photosystems I and II (PSI and PSII). Under light conditions favoring PSII excitation, the PSII antenna, light-harvesting complex II (LHCII), is phosphorylated and forms a supercomplex with PSI core and the PSI antenna, light-harvesting complex I (LHCI). Both LHCI and LHCII then transfer excitation energy to the PSI core. We report the structure of maize PSI-LHCI-LHCII solved by cryo-electron microscopy, revealing the recognition site between LHCII and PSI. The PSI subunits PsaN and PsaO are observed at the PSI-LHCI interface and the PSI-LHCII interface, respectively. Each subunit relays excitation to PSI core through a pair of chlorophyll molecules, thus revealing previously unseen paths for energy transfer between the antennas and the PSI core."
https://openalex.org/W2805660420,"Understanding zero It has been said that the development of an understanding of zero by society initiated a major intellectual advance in humans, and we have been thought to be unique in this understanding. Although recent research has shown that some other vertebrates understand the concept of the “empty set,” Howard et al. now show that an understanding of this concept is present in untrained honey bees (see the Perspective by Nieder). This finding suggests that such an understanding has evolved independently in distantly related species that deal with complexity in their environments, and that it may be more widespread than previously appreciated. Science , this issue p. 1124 ; see also p. 1069"
https://openalex.org/W2807251817,"Trust is undermined when scientists make overblown promises about disease prevention, warn Edward C. Holmes, Andrew Rambaut and Kristian G. Andersen. Trust is undermined when scientists make overblown promises about disease prevention, warn Edward C. Holmes, Andrew Rambaut and Kristian G. Andersen."
https://openalex.org/W2806911568,"Target degradation of Type I CRISPR The CRISPR adaptive immune systems defend bacteria against invaders. Type I CRISPR-Cas systems, the most prevalent type, use a Cascade complex to search the target DNA that is then degraded by Cas3 protein. Xiao et al. report cryo–electron microscopy structures of the Type I-E Cascade/Cas3 complex in the pre– and post–DNA-nicking states. These structures reveal how Cas3 captures Cascade only in its correct conformation to reduce off-targeting and how Cas3 switches from the initial DNA-nicking mode to the processive DNA degradation mode. Science , this issue p. eaat0839"
https://openalex.org/W2807387893,"Surface antibody maturation Affinity maturation in B cells generates antibodies with increasingly enhanced antigen-binding properties. Imkeller et al. investigated the maturation of human B cells that express protective antibodies against the circumsporozoite protein of the malaria-causing parasite Plasmodium falciparum (PfCSP). The repetitive structure of PfCSP induces mutations in B cells, facilitating direct interactions between two repeat-bound antibodies against PfCSP, which enhance antigen affinity and B cell activation. Such interactions may optimize binding and promote clustering of surface antibodies in general. Science , this issue p. 1358"
https://openalex.org/W2805240286,"Sterility in rice via toxin and antidote Crossing wild and domestic rice often results in hybrid sterility. Such genetic barriers can prevent the movement of potentially beneficial genes from wild rice into domestic varieties. To understand the barriers preventing gene flow, Yu et al. mapped a quantitative trait locus (QTL) that determines sterility between wild-type and domestic rice. This QTL encodes two open reading frames (ORFs) that are both expressed during gametogenesis. The ORFs encode a toxin, which affects the development of pollen, and an antidote, which is required for pollen viability. Thus, selfish genetic elements can underlie evolutionary strategies that facilitate reproductive isolation. Science , this issue p. 1130"
https://openalex.org/W2807353008,"Dysregulated bile acid (BA) synthesis is accompanied by dysbiosis, leading to compromised metabolism. This study analyzes the effect of epigallocatechin-3-gallate (EGCG) on diet-induced obesity through regulation of BA signaling and gut microbiota. The data revealed that EGCG effectively reduced diet-increased obesity, visceral fat, and insulin resistance. Gene profiling data showed that EGCG had a significant impact on regulating genes implicated in fatty acid uptake, adipogenesis, and metabolism in the adipose tissue. In addition, metabolomics analysis revealed that EGCG altered the lipid and sugar metabolic pathways. In the intestine, EGCG reduced the FXR agonist chenodeoxycholic acid, as well as the FXR-regulated pathway, suggesting intestinal FXR deactivation. However, in the liver, EGCG increased the concentration of FXR and TGR-5 agonists and their regulated signaling. Furthermore, our data suggested that EGCG activated Takeda G protein receptor (TGR)-5 based on increased GLP-1 release and elevated serum PYY level. EGCG and antibiotics had distinct antibacterial effects. They also differentially altered body weight and BA composition. EGCG, but not antibiotics, increased Verrucomicrobiaceae, under which EGCG promoted intestinal bloom of Akkermansia muciniphila. Excitingly, A. muciniphila was as effective as EGCG in treating diet-induced obesity. Together, EGCG shifts gut microbiota and regulates BA signaling thereby having a metabolic beneficial effect.—Sheng, L., Jena, P. K., Liu, H.-X., Hu, Y., Nagar, N., Bronner, D. N., Settles, M. L., Baumler, A. J., Wan, Y.-J. Y. Obesity treatment by epigallocatechin-3-gallate−regulated bile acid signaling and its enriched Akkermansia muciniphila. FASEB J. 32, 6371–6384 (2018). www.fasebj.org"
https://openalex.org/W2805118301,"Macrolide or fluoroquinolone-resistant Mycoplasma genitalium is spreading worldwide. We aimed to determine the influence of single nucleotide polymorphisms (SNPs) in the quinolone resistance determining regions (QRDR) of parC and gyrA in cultured M. genitalium strains. In addition, we examined the prevalence of macrolide- and fluoroquinolone resistance mediating mutations in specimens collected from Japanese male patients with urethritis in two time-periods between 2005-2009 and 2010-2017, respectively, by sequencing the QRDR of parC and gyrA and domain V of the 23S rRNA gene. The minimum inhibitory concentrations (MIC) of moxifloxacin, sitafloxacin, ciprofloxacin, levofloxacin, doxycycline, minocycline, azithromycin and clarithromycin were determined in 23 M. genitalium strains. Three cultured strains had elevated MICs for moxifloxacin at 16, 4 and 2 mg/L and had SNPs with the amino-acid change Ser83→Ile in ParC (p<0.001) and 3 kinds of SNPs with amino-acid changes Asp99→Asn, Gly93→Cys and Met95→Ile in GyrA, respectively. Among a total of 148 M. genitalium positive urine specimens, the prevalence of A2058G and A2059G SNPs in the 23S rRNA gene and any SNPs in ParC increased from 4.8% and 22.6% in 2005-2009 to 42.2% and 53.1% in 2010-2017, respectively. If M. genitalium is considered multi-drug resistant in clinical specimens carrying SNPs in the 23S rRNA gene and Ser83→Ile in ParC, the prevalence of multi-drug resistance is 12.5% in 2010-2017 in Japan. In conclusion, the SNP resulting in Ser83→Ile in ParC is closely related to moxifloxacin resistance even though other factors may also affect treatment outcomes by moxifloxacin. The prevalence of circulating multi-drug resistant M. genitalium strains with macrolide- and fluoroquinolone-resistance is dramatically increasing in Japan."
https://openalex.org/W2806274529,"Overexpression of the androgen receptor (AR) characterizes a distinct molecular subset of triple negative breast carcinomas (TNBC). The role of AR as a prognostic/predictive biomarker in TNBC is controversial, but increasing evidence suggests that this subset may respond to therapeutic agents targeting AR. Evaluation of AR has not been standardized, and criteria for selection of patients for antiandrogen therapy remain controversial. In this study we determine the appropriate threshold of AR immunoreactivity to define AR positive (AR+) TNBC, describe the clinicopathologic features of AR+ TNBC, and discuss the utility of AR positivity as a prognostic and predictive marker in TNBC.135 invasive TNBC processed in accordance with ASCO/CAP guidelines, were immunostained for AR. Clinicopathologic features of AR+ TNBC were analyzed and compared to AR negative (AR-) TNBC. Patients' age, tumor size, tumor grade, lymph node status, proliferation rate, immunopositivity for EGFR, CK5/6, Ki-67, and disease free survival (DFS) were evaluated statistically.A 1% cutpoint was confirmed as the appropriate threshold for AR positivity. Using this cutpoint 41% of 135 TNBC were AR+. AR+ TNBC occurred in older women, were larger, had lower mean proliferation rate and increased incidence of axillary metastasis than AR- TNBC. 76% of TNBC with apocrine morphology were AR+. A subset of AR+TNBC expressed basal markers (EGFR and CK5/6). A prognostic model was created.AR identifies a heterogeneous group of TNBC. Additional evaluation of EGFR expression allowed us to stratify TNBCs into 3 risk groups with significant differences in DFS and therapeutic implications: low-risk (AR+ EGFR-) which represents the LAR molecular subtype with the best prognosis and may benefit the most from anti-androgen therapies; high-risk (AR- EGFR+) which represents the basal molecular subtype with the worst prognosis and may benefit the most from chemotherapy regimens; intermediate-risk (AR+EGFR+ and AR-EGFR-) TNBC with an intermediate prognosis. Prospective trials are required to further validate this prognostic and predictive grouping."
https://openalex.org/W2805704277,"This study investigated the epidemiology and risk factors associated with invasive fungal infections (IFIs) during induction chemotherapy in a cohort of Taiwanese patients with newly-diagnosed acute myeloid leukemia (AML). IFIs are a significant complication in the management of immunocompromised cancer patients; such infections are associated with a high incidence of morbidity and mortality, particularly in many South-Asian countries, where IFI rates are increasing. We retrospectively analyzed IFI incidence data from 105 patients with newly diagnosed AML at a single center undergoing their first course of induction chemotherapy without primary antifungal prophylaxis between November 2008 and December 2014. Of 21 cases documented as proven/provable IFIs 16 (76%) were invasive aspergillosis, 2 (10%) were mucormycosis infections, and 3 (14%) were proven yeast infections. The lung was the most commonly affected site (n = 16; 76%); 2 patients (10%) developed fungal sinusitis. IFI cases were more often males (P = 0.020). In multivariate analysis, patients with neutropenia lasting>30 days were more than twice as likely to develop IFI (OR, 2.24 [95% CI, 2.81–31.11], P<0.001). We also confirmed patients with smoker and receiving parenteral nutrition during chemotherapy were significant associated with IFIs. Our findings suggest that antifungal prophylaxis should be considered for patients with AML during induction chemotherapy, particularly in patients from Southeastern Asia, an area of potentially high IFI rates. We recommend that clinicians determine which patients receiving induction chemotherapy for AML are at high risk of developing IFI, to allow for targeted therapeutic prophylaxis."
https://openalex.org/W2807439722,"Introduction Berardinelli-Seip Congenital Lipodystrophy (BSCL) is a rare autosomal recessive disease that affects the development of adipocytes and leads to an inability to store fat in adipocytes. This study aimed to evaluate the life expectancy and the causes of death of patients with BSCL. Method We analyzed death certificates, and medical records of BSCL patients who died between 1997 and 2017. If the death certificate was incomplete or unavailable, we reviewed the medical records, and if they were not available too, we collected information from the patient's relatives to understand how the death happened. We calculated the potential years of life lost as a result of premature death. Results Twenty patients (12 female and 8 male) died between 1997 and 2017. The mean age at the time of death was 27.1±12.4 years (women 25.2±12.5 vs. men 29.9±12.6 years, p = 0.41). Life expectancy for the study population was 62.9±4.8 years. The potential number of years of life lost was 35.6±16.6 years. The causes of deaths were divided into three major groups: infections (7 patients, 35%), liver disease (7 patients, 35%), and other causes (acute pancreatitis, one patient; renal failure, three patients; sudden death/myocardial infarction, two patients). Three patients had pulmonary fibrosis. Conclusion BSCL led to premature death, cutting the patients’ lifespan by 30 or more years. The majority of these young patients died of liver disease or infection. Other studies are needed to understand better the mechanisms that predispose to infections, as well as to assess whether new therapies can alter the natural history of this disease."
https://openalex.org/W2805693375,"Sliding at the base Predictions of sea level rise caused by dynamic ice sheet loss rely on a good understanding of what controls how fast the sheets slide over the ground below. The standard approach is to model motion on the basis of an assumed frictional stress between the base of the glacier and a hard underlying bed. Now, however, Stearns and van der Veen show that this method is incorrect. Instead, they suggest that net pressure at the glacier bed controls flow. Science , this issue p. 273"
https://openalex.org/W2807693231,"Background Toll-like receptors (TLRs) play essential role in innate and acquired immunity, are expressed in various cell types, and are associated with altered susceptibility to many diseases, and cancers. The aim of this study was to investigate TLR2 (-196 to-174del), TLR4 (Asp299Gly and Thr399Ile) and TLR9 (T1237C and T1486C) gene polymorphisms at risk of colorectal cancer (CRC) development and progression. Methods Peripheral blood was obtained from 397 patients with adjuvant (stage II/III, n = 202) and metastatic (n = 195) CRC. Moreover, blood samples from 50 healthy volunteers and 40 patients with adenomatous polyps were also included as control groups. DNA from patients and controls was analyzed using PCR and PCR-RFLP for genotyping functional polymorphism within TLR2, TLR4 and TLR9 genotypes. Results TLR2–196 to-174del/del genotype was detected in 76.6% of the patients and was significantly higher that the controls groups (p<0.001). TLR4 Asp299Gly, TLR4 Thr399Ile, TLR9 T1237C and T1486C homozygous genotypes were detected in 70.5%, 70.5%, 61.5% and 61.5% of the patients respectively, and were also significantly higher than that in the control groups (p<0.001). All polymorphisms detected were also significantly associated with the metastatic disease (p<0.001) leading to shorter overall survival (p<0.001); whereas, TLR4 Asp299Gly and Thr399Ile polymorphisms were significantly associated with KRAS mutations. Conclusions The detection of higher frequencies of the TLR2, TLR4 and/or TLR9 polymorphisms in CRC patients compared with the control groups highlight the role of these polymorphism in CRC development and cancer progression."
https://openalex.org/W2805050726,"Lysosomal dysfunction is associated with a number of age-related pathologies that affect all organ systems. While much research has focused on neurodegenerative diseases and aging-induced changes in neurons, much less is known about the impact that aging has on lower urinary tract function. Our studies explored age-dependent changes in the content of endo-lysosomal organelles (i.e., multivesicular bodies, lysosomes, and the product of their fusion, endolysosomes) and age-induced effects on lysosomal degradation in the urothelium, the epithelial tissue that lines the inner surface of the bladder, ureters, and renal pelvis. When examined by transmission electron microscopy, the urothelium from young adult rats (~3 months), mature adult rats (~12 months), and aged rats (~26 months old) demonstrated a progressive age-related accumulation of aberrantly large endolysosomes (up to 7μm in diameter) that contained undigested content, likely indicating impaired degradation. Stereological analysis confirmed that aged endolysosomes occupied approximately 300% more volume than their younger counterparts while no age-related change was observed in multivesicular bodies or lysosomes. Consistent with diminished endolysosomal degradation, we observed that cathepsin B activity was significantly decreased in aged versus young urothelial cell lysates as well as in live cells. Further, the endolysosomal pH of aged urothelium was higher than that of young adult (pH 6.0 vs pH 4.6). Our results indicate that there is a progressive decline in urothelial endolysosomal function during aging. How this contributes to bladder dysfunction in the elderly is discussed."
https://openalex.org/W2805313167,
https://openalex.org/W2805852937,"The aim of this study was to present a novel analytical quality by design (AQbD) approach for developing an HPLC method to analyze herbal extracts. In this approach, critical method attributes (CMAs) and critical method parameters (CMPs) of the analytical method were determined using the same data collected from screening experiments. The HPLC-ELSD method for separation and quantification of sugars in Codonopsis Radix extract (CRE) samples and Astragali Radix extract (ARE) samples was developed as an example method with a novel AQbD approach. Potential CMAs and potential CMPs were found with Analytical Target Profile. After the screening experiments, the retention time of the D-glucose peak of CRE samples, the signal-to-noise ratio of the D-glucose peak of CRE samples, and retention time of the sucrose peak in ARE samples were considered CMAs. The initial and final composition of the mobile phase, flow rate, and column temperature were found to be CMPs using a standard partial regression coefficient method. The probability-based design space was calculated using a Monte-Carlo simulation method and verified by experiments. The optimized method was validated to be accurate and precise, and then it was applied in the analysis of CRE and ARE samples. The present AQbD approach is efficient and suitable for analysis objects with complex compositions."
https://openalex.org/W2806725828,"The Bag-of-Visual-Words (BoVW) model is widely used for image classification, object recognition and image retrieval problems. In BoVW model, the local features are quantized and 2-D image space is represented in the form of order-less histogram of visual words. The image classification performance suffers due to the order-less representation of image. This paper presents a novel image representation that incorporates the spatial information to the inverted index of BoVW model. The spatial information is added by calculating the global relative spatial orientation of visual words in a rotation invariant manner. For this, we computed the geometric relationship between triplets of identical visual words by calculating an orthogonal vector relative to each point in the triplets of identical visual words. The histogram of visual words is calculated on the basis of the magnitude of these orthogonal vectors. This calculation provides the unique information regarding the relative position of visual words when they are collinear. The proposed image representation is evaluated by using four standard image benchmarks. The experimental results and quantitative comparisons demonstrate that the proposed image representation outperforms the existing state-of-the-art in terms of classification accuracy."
https://openalex.org/W2806040421,"Despite the identification of MYCN amplification as an adverse prognostic marker in neuroblastoma, MYCN inhibitors have yet to be developed. Here, by integrating evidence from a whole-genome shRNA library screen and the computational inference of master regulator proteins, we identify transcription factor activating protein 4 (TFAP4) as a critical effector of MYCN amplification in neuroblastoma, providing a novel synthetic lethal target. We demonstrate that TFAP4 is a direct target of MYCN in neuroblastoma cells, and that its expression and activity strongly negatively correlate with neuroblastoma patient survival. Silencing TFAP4 selectively inhibits MYCN-amplified neuroblastoma cell growth both in vitro and in vivo, in xenograft mouse models. Mechanistically, silencing TFAP4 induces neuroblastoma differentiation, as evidenced by increased neurite outgrowth and upregulation of neuronal markers. Taken together, our results demonstrate that TFAP4 is a key regulator of MYCN-amplified neuroblastoma and may represent a valuable novel therapeutic target."
https://openalex.org/W2806497304,"Over the past decade there has been increasing enthusiasm in the cognitive neurosciences around using network science to understand the system-level changes associated with brain disorders. A growing literature has used whole-brain fMRI analysis to examine changes in the brain’s subnetworks following traumatic brain injury (TBI). Much of network modeling in this literature has focused on static network mapping, which provides a window into gross inter-nodal relationships, but is insensitive to more subtle fluctuations in network dynamics, which may be an important predictor of neural network plasticity. In this study, we examine the dynamic connectivity with focus on state-level connectivity (state) and evaluate the reliability of dynamic network states over the course of two runs of intermittent task and resting data. The goal was to examine the dynamic properties of neural networks engaged periodically with task stimulation in order to determine: 1) the reliability of inter-nodal and network-level characteristics over time and 2) the transitions between distinct network states after traumatic brain injury. To do so, we enrolled 23 individuals with moderate and severe TBI at least 1-year post injury and 19 age- and education-matched healthy adults using functional MRI methods, dynamic connectivity modeling, and graph theory. The results reveal several distinct network “states” that were reliably evident when comparing runs; the overall frequency of dynamic network states are highly reproducible (r-values>0.8) for both samples. Analysis of movement between states resulted in fewer state transitions in the TBI sample and, in a few cases, brain injury resulted in the appearance of states not exhibited by the healthy control (HC) sample. Overall, the findings presented here demonstrate the reliability of observable dynamic mental states during periods of on-task performance and support emerging evidence that brain injury may result in diminished network dynamics."
