id,abstract
https://openalex.org/W1599906338,"We provide here the first direct evidence that D-aspartyl residues in peptides are substrates for the L-isoaspartyl/D-aspartyl protein carboxyl methyltransferase (EC 2.1.1.77). We do this by showing that D-aspartic acid beta-methyl ester can be isolated from carboxypeptidase Y digests of enzymatically methylated D-aspartyl-containing synthetic peptides. The specificity of this reaction is supported by the lack of methylation of L-aspartyl-containing peptides under similar conditions. Methylation of D-aspartyl residues in synthetic peptides was not observed previously because with Km values ranging from 2.5 to 4.8 mM, these peptides are recognized by the methyltransferase with 700-10,000-fold lower affinity than are their L-isoaspartyl-containing counterparts. The physiological significance of D-aspartyl methylation was investigated in two ways. First, analysis of in situ methylated human erythrocyte proteins showed that at least 22% of the methyl groups associated with the proteins ankyrin and band 4.1 are on D-aspartyl residues, suggesting that D-aspartyl methylation is an important function of the methyltransferase in vivo. Second, mathematical modeling of the protein aging and methylation reactions occurring in intact erythrocytes indicated that the accumulation of D-aspartyl residues can be reduced as much as 2-5-fold by the methyltransferase activity. Although this reduction is much less than that predicted for L-isoaspartyl residues, it may be significant in maintaining functional proteins throughout the 120-day life span of these cells."
https://openalex.org/W1624763535,"The mitochondrial DNA polymerase of HeLa cells was purified 18,000-fold to near homogeneity. The purified polymerase cofractionated with two polypeptides that had molecular mass of 140 and 54 kDa. The 140-kDa subunit was specifically radiolabeled in a photoaffinity cross-linking assay and is most likely the catalytic subunit of the mitochondrial DNA polymerase. The purified enzyme exhibited properties that have been attributed to DNA polymerase gamma and shows a preference for replicating primed poly(pyrimidine) DNA templates in the presence of 0.5 mM MgCl2. As in the case of mitochondrial DNA polymerases from other animal cells, human DNA polymerase gamma cofractionated with a 3'----5' exonuclease activity. However, it has not been possible to determine if the two enzymatic activities reside in the same polypeptide. The exonuclease activity preferentially removes mismatched nucleotides from the 3' end of a duplex DNA and is not active toward DNA with matched 3' ends. These properties are consistent with the notion that the exonuclease activity plays a proofreading function in the replication of the organelle genome."
https://openalex.org/W1519843687,"Activation of human neutrophils involves the degranulation of specific and azurophil granules. This process is GTP-dependent and the presence of small GTP-binding proteins (SGBPs) has been detected in the two granule populations. At present, none of these SGBPs has been definitely identified. In order to characterize some of these proteins and obtain further insights as to their potential role in degranulation processes, we have used specific antibodies directed against the ras-related rap1 and rap2 proteins. By immunoblot analysis, we observed that rap2p is predominantly located in specific granules, whereas rap1p is detected both in specific granules and a fraction enriched in plasma membranes. Neither rap1p nor rap2p was found in the cytosol or in azurophil granules. Similarly, by indirect immunofluorescence, we observed that cytoplasmic granules were stained with anti-rap1p antibodies and anti-rap2p antibodies, and the plasma membrane was labeled with both antibodies but more distinctly with anti-rap1p than with anti-rap2p antibodies. rap1p and rap2p are tightly bound to the membrane of specific granules since they cannot be extracted by high salt or alkaline buffers. In addition, treatment of intact specific granules with pronase induced the degradation of rap proteins suggesting that they are exposed to the cytoplasmic face of the granules. Degranulation of neutrophils consists of the translocation and subsequent fusion of granules with the plasma membrane. Activation of this process induced the accumulation of rap proteins in the plasma membrane as observed by subcellular fractionation and indirect immunofluorescence experiments; this was not associated with the appearance of a soluble form of these proteins, showing that they remain membrane-bound during this process. The identification and subcellular localization of rap1p and rap2p at the surface of specific granules and the observation that they translocate to the plasma membrane upon cell stimulation without appearance of soluble forms constitute an important step toward the understanding of their physiological functions in human neutrophils."
https://openalex.org/W2128900810,"Biosynthesis of the phytohormone ethylene in higher plants proceeds via the following pathway: S-adenosylmethionine—-1-aminocyclopropane-1-carboxylic acid (ACC)—-ethylene. Ethylene-forming enzyme (EFE), the enzyme responsible for the oxidation of ACC to ethylene, has been only partially characterized in vitro. We have obtained authentic EFE activity in vitro from extracts of avocado fruit (Persea americana Mill. cv Hass). Ammonium sulfate fractionation revealed the presence of two EFE activities, which we designate as EFE1 and EFE2. EFE1 activity utilizes ACC and O2 as substrates and requires Fe(II) and ascorbate as cofactors. The enzyme has a relatively low Km (32 microM) for ACC, discriminates diastereomers of 1-amino-2-ethyl-cyclopropane-1-carboxylic acid, and is inhibited competitively by 2-aminoisobutyric acid, thus confirming its identity with authentic EFE. Activity is retained in a 100,000 x g supernatant and has a pH optimum of 7.5-8.0, suggesting a cytosolic localization."
https://openalex.org/W1550760583,"Shark cartilage proteoglycans bear predominantly chondroitin 6-sulfate. After exhaustive protease digestion, reductive beta-elimination, and subsequent chondroitinase ABC digestion, 13 hexasaccharide alditols, which are nonsulfated, sulfated, and/or phosphorylated, were obtained from the carbohydrate-protein linkage region. Six compounds, containing 0 or 1 sulfate and/or phosphate residue, represent approximately 40% of the isolated linkage hexasaccharide alditols. They were analyzed by chondroitinase ACII or alkaline phosphatase digestion in conjunction with high performance liquid chromatography, and by 500 MHz one- and two-dimensional 1H NMR spectroscopy. All six compounds have the conventional structure in common. Delta 4,5-GlcA beta 1-3GalNAc beta 1-4GlcA beta 1-3Gal beta 1-3Gal beta 1-4Xyl-ol One compound has no sulfate nor phosphate. Two of the monosulfated compounds have a O-sulfate on C-6 or on C-4 of the GalNAc residue. The third monosulfated compound has a novel O-sulfate on C-6 of the Gal residue attached to xylitol. The two phosphorylated compounds have O-phosphate on C-2 of Xyl-ol, and one of them has in addition sulfate on C-6 of GalNAc."
https://openalex.org/W251422572,"We showed in an earlier study (Arita, H., Hanasaki, K., Nakano, T., Oka, S., Teraoka, H., and Matsumoto, K. (1991) J. Biol. Chem. 266, 19139-19141) that there is a high affinity and specific binding site for mammalian group I phospholipase A2 (PLA2-I) in Swiss 3T3 fibroblast cells. Analysis of the cellular distribution in rat using 125I-PLA2-I as a radioligand indicated the presence of this site in various cells, including vascular smooth muscle cells (VSMC), vascular endothelial cells, synovial cells, chondrocytes, and gastric mucosal cells. Scatchard analysis of rat VSMC revealed the existence of a single class of binding site with a Kd value of 1.60 nM and a Bmax value of 51.0 fmol/10(6) cells. The mammalian mature type of PLA2s-I derived from several animal species specifically recognized the same site in cells and stimulated DNA synthesis, whereas its inactive zymogen, mammalian group II PLA2s, and snake and bee venom PLA2s showed much lesser activities. 125I-PLA2-I bound to VSMC was rapidly internalized and subsequently released from the cells as trichloroacetic acid-soluble radioactivity. Down-regulation of the PLA2-I site was observed in the treatment of VSMC with cAMP-elevating agents, as well as glucocorticoids. Affinity labeling experiments indicated that PLA2-I binds to a single polypeptide with a mass of approximately 200,000 daltons. These results suggest a novel PLA2-I action on the cellular function via its specific binding site."
https://openalex.org/W2017423522,"We previously documented a greater than 100-fold rostrocaudal gradient of chloramphenicol acetyltransferase (CAT) expression in the muscles of adult mice that bear a myosin light chain-CAT transgene: successively more caudal muscles express successively higher levels of CAT. Here we studied the development and maintenance of this positional information in vitro. CAT levels reflect the rostrocaudal positions of the muscles from which the cells are derived in cultures established from adult muscles, in clones derived from individual adult myogenic (satellite) cells, in cultures prepared from embryonic myoblasts, and in cell lines derived by retrovirus-mediated transfer of an oncogene to satellite cells. Our results suggest that myoblasts bear a positional memory that is established in embryos, retained in adults, cell autonomous, heritable, stable to transformation, and accessible to study in clonal cell lines."
https://openalex.org/W1547494165,"We have determined the complete sequence of chick brain alpha-actinin (892 amino acids; 107,644 Da). The sequence differs from that of smooth muscle alpha-actinin only in the region of the first EF-hand calcium-binding motif, where 27 residues in brain alpha-actinin are replaced by just 22 residues in the smooth muscle isoform. This probably accounts for the different calcium sensitivities of the two isoforms with respect to actin binding. Analysis of the gene structure showed that this region of sequence divergence is encoded by two separate exons whose incorporation is mutually exclusive. We have determined the proportion of the two transcripts in various tissues and cell lines using poly(A)+ RNA and a quantitative assay based on the polymerase chain reaction. MRC-5 fibroblasts and HeLa cells express mRNAs encoding both isoforms, whereas Namalwa lymphoblastoid cells, which lack actin stress fibers, express only the non-muscle mRNA. Both isoforms of alpha-actinin became incorporated into stress fibers and cell-matrix junctions when full-length chick alpha-actinin cDNAs were expressed in monkey COS cells. The levels of chick alpha-actinin mRNAs were found to be serum-inducible, suggesting that alpha-actinin may be an early response gene."
https://openalex.org/W1604930697,"The relationship between maturation of lipoprotein lipase (LPL) and its translocation from the endoplasmic reticulum (ER) to the Golgi complex was determined by measuring lipolytic activity under conditions preventing transport of the enzyme from the ER to the Golgi compartment. In the presence of brefeldin A, a reagent that inhibits movement of proteins from the ER and causes the disassembly of the Golgi complex, pro-5 Chinese hamster ovary cells accumulated catalytically active LPL, while secretion of the enzyme was effectively blocked. LPL retained intracellularly by brefeldin A treatment possessed oligosaccharide chains that were processed to the complex form by the Golgi enzymes redistributed into the ER. At 16 degrees C, a condition disrupting protein transport to the cis-Golgi, the retained enzyme again remained catalytically active although the oligosaccharides remained in the high mannose form. Lastly, attachment of the specific ER retention signal KDEL (Lys-Asp-Glu-Leu) to the carboxyl terminus of LPL also resulted in intracellularly retained enzyme that was fully active. The importance of oligosaccharide processing for attainment of LPL catalytic activity in vitro was also determined. LPL was active and secreted when trimming of the mannose residues was inhibited by deoxymannojirimycin and when addition of complex sugars was blocked using Chinese hamster ovary mutants (lec1 and lec2), indicating that these processing events are not necessary for the expression of a functional enzyme. However, blocking glucose removal by glucosidase inhibitors (castanospermine and N-methyl-deoxynojirimycin) resulted in a significant reduction in LPL specific activity and secretion. Thus, glucose trimming of LPL oligosaccharides is essential for enzyme activation; however, further oligosaccharide processing or translocation of the enzyme to the cis-Golgi is not required for full expression of lipolytic activity in vitro."
https://openalex.org/W1574848670,"Shark cartilage proteoglycans bear predominantly chondroitin 6-sulfate. After exhaustive protease digestion, reductive beta-elimination and subsequent chondroitinase ABC digestion, 13 hexasaccharide alditols were obtained from the carbohydrate-protein linkage region and six of them contain 0 or 1 sulfate and/or 1 phosphate residue (Sugahara, K., Ohi, Y., Harada, T., de Waard, P., and Vliegenthart, J. F. G. (1992) J. Biol. Chem. 267, 6027-6035). The other seven compounds, which represent approximately 60% of the isolated linkage hexasaccharides, were analyzed by chondroitinase ACII digestion in conjunction with high performance liquid chromatography and by 500-MHz one- and two dimensional 1H NMR spectroscopy. All seven compounds have the following conventional structure in common. [formula: see text] Two disulfated compounds have an O-sulfate on C-6 of the Gal-2 residue attached to xylitol in combination with an O-sulfate on C-4 or on C-6 of the GalNAc residue. The third disulfated compound has O-sulfate on C-6 of Gal-2, and also on C-6 of Gal-3. Two of the trisulfated compounds also have O-sulfate on C-6 of both Gal-2 and Gal-3 with in addition sulfate on C-6 or C-4 of GalNAc. The other two trisulfated compounds have O-sulfate on C-6 of Gal-2 and on C-4 of Gal-3 in conjunction with sulfate on C-6 or C-4 of GalNAc."
https://openalex.org/W1606333544,"Abstract Unfolded (inactive) rhodanese (thiosulfate:cyanide sulfurtransferase, EC 2.8.1.1) can be reactivated in the presence of detergents, e.g. lauryl maltoside (LM). Here, we report the reactivation of urea-unfolded rhodanese in the presence of mixed micelles containing LM and the anionic mitochondrial phospholipid, cardiolipin (CL). Reactivation times increased as the number of CL molecules/micelle was increased. A maximum of 94% of the activity was recovered at 2.2 CL/micelle. Only 71% of the activity was recovered in the absence of CL. The major zwitterionic mitochondrial phospholipid, phosphatidylcholine (PC), had no effect on the LM-assisted reactivation of rhodanese. Size exclusion chromatography showed that denatured, but not native, rhodanese apparently binds to micellar amounts of LM and CL/LM, but not to PC/LM micelles. The lifetime of the enzyme-micelle complex increased with the number of CL molecules/micelle. Furthermore, chromatographic fractions containing micelle-bound enzyme had no activity, while renatured rhodanese-containing fractions were active. These results suggest that transient complexes form between enzyme and both LM and CL/LM micelles, and that this complex formation may be necessary for reactivation. For CL/LM micelles, interactions may occur between the positively charged amino-terminal sequence of rhodanese and the negatively charged CL phosphate. Finally, this work shows that there are similarities between micelle-assisted and chaperonin-assisted rhodanese refolding."
https://openalex.org/W1479680693,"Human selenium-dependent glutathione peroxidase (hGPx1) (EC 1.11.1.9) is thought to be involved in many critical cellular functions as a result of its role in glutathione-mediated reduction of toxic peroxides, and it is implicated as a mechanism of resistance against oxygen free radicals. Previous studies have demonstrated that the gene encoding hGPx1 (hgpx1) is more highly expressed in multidrug-resistant AdrR MCF-7 human breast cancer cells than in the parental WT MCF-7 cell line. In order to further study the transcriptional regulation of hgpx1, we have cloned the genomic hgpx1 gene and determined its nucleotide sequence. The 2550-base pair (bp) 5'-flanking sequence of hgpx1 contained the terminal 511 bp of the 3' end of a previously reported rhoH12 cDNA (Yeramian, P., Chardin, P., Madaule, P., and Tavitian, A. (1987) Nucleic Acids Res. 15, 1989), a ras-related oncogene. Further downstream from rhoH12, but before the start of transcription of hgpx1, RNase protection analysis revealed a transcribed sequence of at least 270 bp which we have called mid. RNA transcripts homologous to both rhoH12 (1.8 and 1.5 kilobase pairs (kb)) and mid (1.8 kb) are also more highly expressed in AdrR MCF-7 cells than in WT MCF-7 cells. We screened an AdrR MCF-7 cDNA library with the mid sequence and isolated a partial cDNA clone which contains both mid and rhoH12 sequences and is colinear with the genomic sequence which extends from 10 bp 3' to the rhoH12 stop codon to 810 bp 5' to the start of transcription of hgpx1. The start of transcription of hgpx1 in AdrR MCF-7 cells was determined by primer extension analysis. The promoter and 2 kb of the 5'-flanking sequence of hgpx1 was fused to the bacterial chloramphenicol acetyltransferase gene (hGPx1-CAT1). Analysis of deletion constructs of hGPx1-CAT1 revealed three possible cis-acting regulatory regions. The transcriptional regulation of hgpx1 was examined using the hGPx1-CAT hybrid genes and nuclear run-on studies. We found no evidence that increased mRNA transcript formation could account for different levels of hgpx1 RNA either in different breast cancer cell lines or in response to selenium."
https://openalex.org/W1578314153,"When Trypanosoma brucei procyclic trypomastigotes were permeabilized with digitonin in a reaction medium containing MgATP, succinate, and 3.5 microM free Ca2+, they lowered the medium Ca2+ concentration to the submicromolar level (0.05-0.1 microM), a range that correlates favorably with that detected in the intact cells with fura-2. The carbonyl cyanide p-trifluoromethoxyphenylhydrazone-insensitive Ca2+ uptake, certainly represented by the endoplasmic reticulum, was completely inhibited by 500 microM vanadate. When vanadate instead of carbonyl cyanide p-trifluoromethoxyphenylhydrazone was present, the Ca2+ set point was increased to 0.6-0.7 microM. The succinate dependence and carbonyl cyanide p-trifluoromethoxyphenylhydrazone sensitivity of the later Ca2+ uptake indicate that it may be exerted by the mitochondria. When bloodstream trypomastigotes were used, neither succinate nor alpha-glycerophosphate stimulated the mitochondrial Ca2+ uptake. The mitochondrial Ca2+ transport could be measured only in the presence of ATP and 500 microM vanadate to inhibit the endoplasmic reticulum uptake. Bloodstream trypomastigotes have a lower cytosolic Ca2+ concentration, as detected with fura-2 and a smaller extramitochondrial Ca2+ pool than procyclic trypomastigotes. Despite the presence of inositol phosphates, as determined by [3H]inositol incorporation, and the large extramitochondrial Ca2+ pool of procyclic trypomastigotes (61.7 nmol of Ca2+/mg of protein), no inositol 1,4,5-trisphosphate-sensitive Ca2+ release could be detected in these parasites."
https://openalex.org/W1603019965,"Each subunit of the nicotinic acetylcholine receptor (AChR) contains two conserved cysteine residues, which are known to form a disulfide bond, in the N-terminal extracellular domain. The role of this retained structural feature in the biogenesis of the AChR was studied by expressing site-directed mutant alpha and beta subunits together with other normal subunits from Torpedo californica AChR in Xenopus oocytes. Mutation of the cysteines at position 128 or 142 in the alpha subunit, or in the beta subunit, did not prevent subunit assembly. All Cys128 and Cys142 mutants of the alpha and beta subunits were able to associate with coexpressed other normal subunits, although associational efficiency of the mutant alpha subunits with the delta subunit was reduced. Functional studies of the mutant AChR complexes showed that the mutations in the alpha subunit abolished detectable 125I-alpha-bungarotoxin (alpha-BuTX) binding in whole oocytes, whereas the mutations in the beta subunit resulted in decreased total binding of 125I-alpha-BuTX and no detectable surface 125I-alpha-BuTX binding. Additionally, all mutant subunits, when co-expressed with the other normal subunits in oocytes, produced small acetylcholine-activated membrane currents, suggesting incorporation of only small numbers of functional mutant AChRs into the plasma membrane. The functional acetylcholine-gated ion channel formed with mutant alpha subunits, but not mutant beta subunits, could not be blocked by alpha-BuTX. Thus, a disulfide bond between Cys128 and Cys142 of the AChR alpha or beta subunits is not needed for acetylcholine-binding. However, this disulfide bond on the alpha subunit is necessary for formation of the alpha-BuTX-binding site. These results also suggest that the most significant effect caused by disrupting the conserved disulfide loop structure is intracellular retention of most of the assembled AChR complexes."
https://openalex.org/W1604147470,"We have previously provided evidence that laminin assembly occurs by the specific interaction of the alpha-helical domains of the A, B1, and B2 chains, located within the long arm of the molecule (Hunter, I., Schulthess, T., Bruch, M., Beck, K., and Engel, J. (1990) Eur. J. Biochem. 188, 205-211). Recent evidence for noncoordinate synthesis of the laminin chains, and in particular, the absence of the 400-kDa A chain from laminins produced by a number of cell types, has led us to examine the molecular mechanism of laminin assembly using the isolated A and B1-B2 chains of laminin fragment E8. E8A shows little tendency to self-associate, and when renatured from urea forms globular structures with little detectable alpha-helix. In contrast, E8B1-B2 renatures to form rod-like molecules, 30 nm in length. The rod-like structure, high alpha-helix content, and sharp thermal transition indicate that they are double stranded coiled coils. When mixed in equimolar amounts, E8A and E8B1-B2 renature to form molecules which are biochemically and ultrastructurally indistinguishable from native E8. If E8A and E8B1-B2 are renatured separately and mixed at a 1:1 molar ratio, they also form E8 molecules. These results suggest a mechanism of laminin assembly which involves the formation of a double coiled-coil B1-B2 intermediate with which the A chain subsequently interacts to form a triple coiled-coil laminin molecule. In addition, our results indicate that isoforms consisting of the B1 and B2 chains only would form stable laminin-like structures."
https://openalex.org/W1671275184,"We have investigated the dissociation, internalization, and degradation of 125I-interleukin-6 (125I-IL-6) by primary rat hepatocytes. Temperature shift experiments following saturation binding of 125I-IL-6 to cell surface receptors in hepatocytes showed a rapid loss of surface-bound 125I-IL-6 (t1/2 = 15 min), concomitant with a rapid rise in internalized radiolabeled ligand. After reaching a maximum by 30 min at 37 degrees C, the level of internalized 125I-IL-6 decreased with time and appeared in the culture media in a non-trichloroacetic acid-precipitable (degraded) state. The addition of the lysosomotropic agent chloroquine inhibited this receptor-mediated degradation of IL-6 without affecting ligand internalization. Polyacrylamide gel electrophoresis analysis of internalized 125I-IL-6 confirms these results. Additionally, we show that the IL-6.IL-6 receptor complex is stable, and dissociation of these two molecular species occurs at a pH below 5.0. In contrast to published results, data presented in this study clearly indicate that IL-6 is rapidly internalized and degraded within hepatocytes by a receptor-mediated mechanism."
https://openalex.org/W287067515,"We have determined the half-lives and amounts per hepatocyte of the polymeric IgA receptor (pIgA-R) and four rat hepatocyte plasma membrane proteins and subsequently have predicted their rates of synthesis and possible routes of degradation. Using in vivo pulse-chase metabolic labeling with L-[35S]cysteine, we found that the pIgA-R had an apparent half-life of 1.1 h. Additional metabolic labeling experiments showed that CE9, HA4, and HA321 had apparent half-lives of 4-5 days, and dipeptidyl peptidase IV had an apparent half-life of 9 days. To quantify the amount of each protein per hepatocyte, homogenates and a standard curve of purified protein were compared by immunoblotting. We found that these proteins were present at 1-8 x 10(6) molecules/hepatocyte. The calculated rate of synthesis for pIgA-R was 1.6 x 10(6) molecules/hepatocyte/h, whereas the others were synthesized at much lower rates (0.9-5 x 10(4) molecules/hepatocyte/h). Using immunoblot analysis, we found that pIgA-R was released into bile at a rate of 30%/h (700%/day), whereas dipeptidyl peptidase IV and HA4 were released at a rate of 2-3%/day. While the majority of the loss of pIgA-R from hepatocytes occurred by release into the bile, less than 30% of the degradation of dipeptidyl peptidase IV and HA4 could be accounted for by this pathway, suggesting that the remaining molecules must be retrieved from the apical surface before degradation."
