id,abstract
https://openalex.org/W1602357967,"Escherichia coli kgtP which maps at 56.5 min codes for alpha-ketoglutarate permease (KgtP). This protein, expressed from the cloned gene using the T7 polymerase system and [35S]methionine labeling, fractionated with cell membranes. Right-side-out (RSO) membrane vesicles prepared from a kgtP negative mutant strain did not transport alpha-ketoglutarate, but RSO vesicles from the same strain expressing KgtP from a transforming plasmid transported alpha-ketoglutarate effectively as measured by uptake of the 14C-labeled substrate. E. coli JC7623 strain grown in M9 minimal medium with glucose, glycerol, or alpha-ketoglutarate as carbon source contained a 1.3-kilobase RNA which hybridized to nick-translated kgtP probe. In addition, strain MC1061 cultures grown under these same conditions were all capable of transporting alpha-ketoglutarate, demonstrating that KgtP is constitutively expressed. The Km and Vmax of KgtP assayed in strain MC1061 vesicles were 13-46 microM and 8 nmol/min/mg protein, respectively. Uncouplers that permeabilized the membrane to protons inhibited alpha-ketoglutarate transport into energized vesicles, and the addition of alpha-ketoglutarate to vesicle suspensions under non-energized conditions resulted in an increase in pH. These results indicate that KgtP is an alpha-ketoglutarate-proton symporter."
https://openalex.org/W1502758571,"Cosmid clones containing the 5' region of the human alpha 2(VI) collagen gene have been isolated and characterized. DNA sequencing indicates that the signal peptide and the amino-globular domain are encoded by four exons of 142, 596, 21, and 66 base pairs (bp). However, S1 nuclease and primer extension analyses show that the transcription start site is not present in the 142-bp exon. Two different 5' cDNA clones are generated by the anchored polymerase chain reaction. Using the 5' cDNA clones as probes, two untranslated exons (1, 1A) are found 12 kilobase pairs upstream of the first coding exon. These two exons are alternatively used in human fibroblasts, and most transcripts contain exon 1 sequence. Exon 1 shows, by primer extension and S1 nuclease protection assay, two major and several minor transcription start sites. The promoter region contains a canonical TATA box, seven GGGCGG sequences, two possible CAAT boxes, and two sequences resembling AP2 binding sites. Exon 1A contains three alternative splice donor sites and is located 650 bp downstream of exon 1. The most 3' splice donor site of exon 1A is found within an Alu repeat sequence. Exon 1A is preceded by five GGGCGG sequences and one resembling the AP2 binding site although neither TATA or CAAT boxes are found. Two additional GGGCGG sequences are located at the beginning of exon 1A. This study establishes that the human alpha 2(VI) collagen gene is 36 kilobase pairs long and contains 30 exons. The 5'-untranslated and promoter regions are significantly different from the corresponding segments of the chicken gene. The human gene produces by alternative processing multiple mRNAs differing in the 5'-untranslated region as well as the 3'-coding and noncoding sequences."
https://openalex.org/W1512981737,"The sequence-specific binding pattern of mammary nuclear proteins to the 545-base pair (bp) 5'-flanking region of the mouse beta-casein gene was compared between pregnant and lactating mice by a gel mobility shift assay. By using appropriate probes, two complexes were detected only during pregnancy, whereas an additional four complexes were detected during both pregnancy and lactation. The two pregnancy-specific complexes showed identical electrophoretic mobility and were cross-competed with two unlabeled DNA fragments used to generate the probes. Methylation interference experiments indicated that the two binding regions involved guanosine residues at nucleotides -350 and -8, and the sequences around each guanosine residue have a common palindromic sequence, 5'-TGAT/ATCA-3'. This binding factor is termed pregnancy-specific mammary nuclear factor. In gene transfection experiments, expression of the chimeric beta-casein-CAT gene linked to the 545 bp of mouse beta-casein gene promoter region was maximally induced when transfected mammary epithelial cells were cultured with the lactogenic hormones prolactin, hydrocortisone, and insulin, whereas it was very low when insulin alone was added. The addition of progesterone together with the lactogenic hormones inhibited the hormonal induction of the chimeric gene, whereas co-transfection with an oligonucleotide containing the pregnancy-specific mammary nuclear factor binding site substantially overcome the progesterone-mediated repression of transcription. Furthermore, mutation of the pregnancy-specific mammary nuclear factor binding sites of the chimeric beta-casein-CAT gene resulted in attenuation of the inhibitory effect of progesterone without blocking the stimulatory effect of the lactogenic hormones. These results indicate the presence of a pregnancy-specific mammary nuclear factor(s) that bind to two separate sites of the beta-casein gene promoter and suggest that it may serve as a repressor that mediates the inhibitory action of progesterone on beta-casein gene transcription."
https://openalex.org/W1609959936,"An extracellular phosphoglycan (exPG), present in the culture medium of the promastigote form of Leishmania donovani, was purified and structurally characterized. The purification scheme included ethanol precipitation of the culture medium, anion exchange chromatography, hydrophobic chromatography on phenyl-Sepharose, and preparative polyacrylamide gel electrophoresis. Structural analysis by 1H-1H NMR, methylation linkage analysis, and glycosidase digestion revealed that the exPG consisted of the following structure: (CAP)----[PO4-6Galp beta 1-4Manp alpha 1]10-11-PO4-6Galp beta 1-4Man. The cap was found to be one of several small, neutral oligosaccharides, the most abundant of which was the trisaccharide Galp beta 1-4(Manp alpha 1-2)Man. The results indicated structural analogy to the cellular-derived lipophosphoglycan (LPG) from L. donovani. The important exceptions are a lack of the lipid anchor, the entire phosphosaccharide core, and several of the repeating disaccharide units. Although the function of exPG is presently unknown, it may play a protective role for the promastigote in the insect vector or during infection of a mammalian host."
https://openalex.org/W2331065494,"BACKGROUND: Tuberculous meningitis is the most severe manifestation of tuberculosis. The diagnostic approach of tuberculous meningitis is difficult. Combination of clinical, laboratory and radiological criteria were used in diagnostic approach of tuberculous meningitis. Urinary mycobacterial lipoarabinomannan (LAM) antigen detection is a promising diagnostic tool. Detection of mycobacterial antigen in concentrated urine sample is predicted to improve the positivity rate of the qualitative enzyme-linked immunosorbent assay (ELISA) diagnostic tool. The purpose of this study is to examine the detection ability of a monoclonal antibody qualitative ELISA in concentrated and unconcentrated urine of tuberculous meningitis patients.METHODS: This research is a descriptive, crosssectionally designed. The study was conducted in the Clinical Pathology Department laboratory of Dr. Hasan Sadikin Hospital, in July-October 2014. A total of 27 patients diagnosed as tuberculous meningitis patients were included and the subjects were classified into possible and probable criteria according to consensus criteria. The subjects were classified as definite if the cerebrospinal fluid culture was positive for Mycobacterial tuberculosis growth. The subjects were examined for the presence of LAM in unconcentrated and concentrated urine with a monoclonal antibody qualitative ELISA method.RESULTS: Unconcentrated urinary LAM examination positivity was 0% while in concentrated urine was 14.8%. The positivity of concentrated urinary LAM were higher among the definite criteria group.CONCLUSION: Concentrating urine sample increase the positivity rate of urinary LAM detection with ELISA method as high as 14.8%. The urinary antigen detection is higher among the definite tuberculous meningitis patients.KEYWORDS: LAM, concentrated urine, tuberculous meningitis, qualitative ELISA"
https://openalex.org/W1506596889,"The template strand of the URA3 gene in the minichromosome YRpTRURAP is repaired of UV-induced cyclobutyl pyrimidine dimers (PD) much more efficiently than the nontemplate strand in growth-arrested Saccharomyces cerevisiae cells (Smerdon, M. J., and Thoma, F. (1990) Cell 61, 675). However, other regions of the plasmid are also efficiently repaired. We have examined the transcription and chromatin structure of these regions in growth-arrested cells to allow a more detailed comparison of transcription, nucleosome stability, and excision repair efficiency. Northern analysis, using strand-specific probes, indicates that four different transcripts are made from YRpTRURAP in addition to the URA3 mRNA in both growing and growth-arrested cells. The templates for these transcripts encompass all of the efficiently repaired regions outside of the URA3 gene. Nucleosome mapping indicates that the structure of the minichromosome in growth-arrested cells is indistinguishable from that of growing cells except for two nucleosomes in the region 500-800 base pairs 5' of the URA3 gene which become much less stable in growth-arrested cells. Comparison of the distribution of YRpTRURAP topoisomers in the two states, however, indicates that these nucleosomes are not lost from the majority of plasmid molecules. One of the four transcripts initiates in this region and increases by more than 5-fold in growth-arrested cells. Another transcript extends into a ""slowly repaired"" region which contains a very stable nucleosome. By determining the stability and relative amounts (at equilibrium) of the RNAs made from YRpTRURAP, transcription rates were determined and compared with the average PD repair rate for the different template regions. The results indicate that: 1) the rate of excision repair increases once a low, basal rate of transcription is achieved; 2) beyond this rate of transcription there is no simple correlation between the rates of transcription and PD repair; 3) nucleosome stability may ""override"" the coupling between transcription and repair if the transcription rate is low; and 4) at higher transcription rates, repair may be insensitive to nucleosome stability."
https://openalex.org/W1544094728,"An NAD(+)-dependent CDP-D-glucose oxidoreductase which catalyzes the first step of the biosynthesis of CDP-ascarylose (CDP-3,6-dideoxy-L-arabino-hexose), converting CDP-D-glucose to CDP-4-keto-6-deoxy-D-glucose, was isolated from Yersinia pseudotuberculosis. A protocol consisting of DEAE-cellulose, Matrex Blue-A, hydroxylapatite, DEAE-Sephadex, Sephadex G-100, and NAD(+)-agarose column chromatography was used to purify this enzyme 6000-fold to homogeneity. This enzyme consists of two identical subunits, each with a molecular weight of 42,500. Using CDP-D-glucose as the substrate, the Km and Vmax of this catalysis were determined to be 222 microM and 8.3 mumols mg-1 min-1, respectively. Unlike most other oxidoreductases of its class which have a tightly bound NAD+, this highly purified CDP-D-glucose oxidoreductase showed an absolute requirement of NAD+ for its activity. Using chemically synthesized (6S)- and (6R)-CDP-D-[4-2H,6-3H]glucose as substrates, a stereochemical analysis showed this enzymatic reaction involves an intramolecular hydrogen migration from C-4 to C-6, and the displacement of C-6 hydroxyl group by the C-4 hydrogen occurs with inversion. Thus, despite the low cofactor affinity, this enzyme undergoes a mechanism consistent with that followed by other members of its type. Such a mechanistic and stereochemical convergency found for all sugar oxidoreductases so far characterized suggests the presence of a common progenitor of this class of enzyme."
https://openalex.org/W1526100164,"Oligonucleotide-directed mutagenesis was used to produce a serine 89 to cysteine 89 substitution in the C-terminal globular domain of Escherichia coli ribosomal protein L7/L12. Cys-89 represented the only cysteine residue in the protein. L7/L12Cys89 was overproduced in E. coli and purified. An allele replacement strain was also constructed. Growth of this strain was indistinguishable from that of wild type. Ribosomes from the allele replacement strain were used to determine the location of the C-terminal domains of L7/L12 by disulfide cross-linking. A new homobifunctional cysteine-specific cross-linking reagent, 1,4-di[3'-(2'-pyridyldithio)-propionamido]butane, and diagonal gel electrophoresis were used to identify ribosomal proteins cross-linked to L7/L12Cys89. A cross-link between L7/L12 and the single cysteine in L10 was found, in addition to L7/L12 dimers. The L7/L12Cys89-L10 cross-link locates the C-terminal domain of at least one L7/L12 dimer on the body of the large subunit and supports our previous model (Olson, H. M., Sommer, A., Tewari, D. S., Traut, R. R., and Glitz, D. G. (1986) J. Biol. Chem. 261, 6924-6932) that depicts one of the two dimers of L7/L12 on the surface of the body of the 50 S subunit in a bent conformation with the C-terminal domain in close proximity to the N-terminal domain at the base of the stalk."
https://openalex.org/W149747824,"To elucidate the role of phospholipid asymmetry in calcium-phosphate-induced fusion of human erythrocytes, we examined the interaction of erythrocyte membranes with asymmetric and symmetric bilayer distributions of phospholipids. Fusion of human erythrocytes was monitored by light microscopy as well as spectrophotometrically by the octadecylrhodamine dequenching assay. Phospholipid translocation and distribution between the inner and the outer leaflet of intact red blood cells were determined with spin-labeled phosphatidylserine (PS), phosphatidylethanolamine (PE), and phosphatidylcholine (PC). Significant fusion of lipid-asymmetric red blood cells where PS and PE are predominantly oriented to the inner leaflet was only observed at Ca2+ concentrations greater than or equal to 10 mM (in the presence of 10 mM phosphate buffer) while fusion of lipid-symmetric erythrocyte membranes was established at greater than or equal to 1.5 mM Ca2+. The Ca2+ threshold of fusion of lipid-asymmetric red blood cells was significantly reduced (i) after exposure of PS to the outer layer but not after redistribution of PE alone, and (ii) upon incorporation of spin-labeled PS into the outer leaflet of red blood cells. Spin-labeled PE or PC did not affect fusion, suggesting that the serine headgroup is an important factor in calcium-phosphate-induced fusion."
https://openalex.org/W1578152976,"To analyze the mechanism of the cell type-specific expression of protein kinase C beta (PKC beta), we isolated the 5'-portion of the human gene for PKC beta and identified multiple positive and negative regulatory sequences that regulate its transcription. S1 nuclease mapping as well as primer extension analysis of the 5'-end of the PKC beta mRNA identified a putative transcriptional initiation site (position +1) 484 base pairs (bp) upstream of the first ATG codon. The 5'-upstream sequence contains a CCAAT sequence at position -110, but no TATA box. The transcriptional activities of various 5'-deletion mutants of the PKC beta gene upstream region, fused to the chloramphenicol acetyltransferase structural gene, were examined in terms of chloramphenicol acetyltransferase expression after transfection into three kinds of rodent cell lines: P19 and GH4C1, which are positive for the expression of PKC beta mRNA; and 3Y1, which is negative. Mutants containing a 5'-flanking sequence longer than 1.9 kilobases (kb) showed chloramphenicol acetyltransferase activities of the same order as the expression of the endogenous gene. This indicates that this region contains sequences regulating the cell-type specificity of PKC beta gene expression and that the specificity is determined at least partially at the level of transcription. The 1.9-kb sequence contains at least three positive elements: P1 (-56 to -234 bp), P2 (-234 to -411 bp), and PN (-1.4 to -1.9 kb). PN is active only in P19 cells, P1 in GH4C1 and P19 cells, and P2 in all three cell lines. In addition to these positive elements, there are negative elements: N1 (-411 to -674 bp), which is active in all three cell lines; and PN, which is active only in GH4C1 cells. These results suggest the presence of multiple trans-acting factors that act on these positive and negative cis-acting elements and regulate the cell type-specific expression of the PKC beta gene."
https://openalex.org/W178836386,"Possible involvement of protein phosphorylation in interferon (IFN)-mediated activation of IFN-stimulated gene factor 3 (ISGF3) was investigated. For this purpose, in vivo experiments with specific inhibitors of protein kinases and in vitro experiments with protein phosphatases were carried out. In HeLaM cells, 2-aminopurine, an inhibitor of double-stranded RNA-dependent protein kinase, blocked the induction of ISGF3 gamma subunit but not the activation of ISGF3 alpha subunit. A series of experiments using combinations of protein and RNA synthesis inhibitors and 2-aminopurine indicated that the block elicited by 2-aminopurine was at the level of ISGF3 gamma mRNA synthesis. Activation of ISGF3 alpha, although insensitive to 2-aminopurine, was completely blocked by 10 nM staurosporine, an inhibitor of protein kinase C. On the other hand, even 500 nM staurosporine did not block the induction of ISGF3 gamma. Incubation of cytoplasmic or nuclear extracts of IFN-treated HeLaM cells in vitro with alkaline phosphatase completely eliminated their ability to form the ISGF3 complex but not the ISGF1 complex. Treatment with acid phosphatase, on the other hand, changed the electrophoretic mobility of the ISGF3 complex but did not obliterate it. Complementation experiments revealed that ISGF3 alpha was the alkaline phosphatase-sensitive component of the complex. These results suggest that a protein kinase C-mediated phosphorylation step is involved in ISGF3 alpha activation and a 2-aminopurine-sensitive component is involved in ISGF3 gamma mRNA induction."
https://openalex.org/W218149522,"Three serine kinases which phosphorylate the CTD of RNA polymerase II have been identified in Aspergillus nidulans. The kinases (KI, KII, KIII) were identified using a synthetic peptide containing four copies of the CTD consensus heptamer repeat, and differ in chromatographic behavior, and apparent molecular mass (KI approximately 60kDa; KII approximately 82kDa; KIII approximately 43 kDa). KIII utilized, in addition to peptide, histone H1 as substrate, whereas casein was not phosphorylated by any of the three kinases. The kinases appear to be unrelated to the p34cdc2 kinase, as judged by Western blot analysis and the position of serine phosphorylation of the synthetic CTD peptide. KI was highly purified and renaturation experiments have shown that it consists of a single polypeptide of 57 kDa. KI also phosphorylated RNA polymerase II associated in a preinitiation complex."
https://openalex.org/W292782049,"Goat beta-mannosidase was purified 120,000-fold in 26% yield from kidney using concanavalin A-Sepharose chromatography followed by immunoaffinity and cation-exchange chromatography. When analyzed by sodium dodecyl sulfate-polyacrylamide gel electrophoresis and visualized by Coomassie Blue staining, the purified enzyme preparation consists of 90- and 100-kDa peptides. Both these peptides react with anti-beta-mannosidase monoclonal antibodies and produce similar electrophoretic peptide patterns when subjected to limited proteolysis. Deglycosylation reduces the size of the 90- and 100-kDa peptides to 86 and 91 kDa, respectively. Goat kidney tissues lacking beta-mannosidase activity, acquired from animals affected with beta-mannosidosis, do not contain detectable quantities of the 90- and 100-kDa peptides as judged by monoclonal antibody reactivity. We postulate that the 90- and 100-kDa peptides represent two related forms of beta-mannosidase."
https://openalex.org/W1511106643,"Calmodulin (CaM) mediates the Ca(2+)-dependent activation of many enzyme systems in accordance with its cellular localization. We have described previously a muscarinic receptor-mediated translocation of CaM from membranes into the cytosol of SK-N-SH human neuroblastoma cells. To explore the potential targets (CaM-binding proteins, CaMBP) for CaM upon translocation, a photoreactive CaM derivative was introduced into living SK-N-SH cells using a scrape-loading technique. Scrape-loading incorporated rhodamine isothiocyanate-labeled CaM with an efficiency of 38%. CaM-diazopyruvamide (CaM-DAP), a Ca(2+)-dependent and CaM-specific probe, was also introduced into the cells. The muscarinic agonist carbachol stimulated a translocation of CaM from membranes into cytosol in CaM-DAP-loaded SK-N-SH cells. Upon photochemical cross-linking, cross-linked adducts of CaM-CaMBP were detected by immunoblotting with anti-CaM antibody. Carbachol stimulated increased photoaffinity labeling of three proteins with relative adduct molecular masses of 70, 120, and 180 kDa. The time course of labeling for the 70- and 120-kDa adducts showed maximal increased by 15-30 min. The 180-kDa adduct displayed a slower time course of maximal labeling, with increases maintained for 2-4 h. Subtracting the molecular mass of CaM, carbachol stimulated binding to CaMBPs of 55, 105, and 163 kDa. Predominant cellular CaMBP were identified using a biotinylated CaM overlay procedure. Western blot analysis indicated the expression of specific CaM-dependent enzymes such as calcineurin, phosphodiesterase, the beta-isoform (rat brain) of CaM kinase II, and Ca(2+)-ATPase. Numerous cytoskeletal CaMBP were expressed such as microtubule-associated protein-2, spectrin, tubulin, caldesmon, adducin, and neuromodulin. Of the CaMBP expressed, phosphodiesterase, calcineurin, caldesmon, and adducin cross-linked with CaM-DAP in the loaded SK-N-SH cells. Carbachol stimulated the time-dependent CaM-DAP labeling of calcineurin and adducin. This study demonstrates the novel incorporation of a photoreactive CaM derivative into living cells, as well as muscarinic receptor-activated CaM-DAP interaction with several cellular CaMBP. We postulate that carbachol-stimulated CaM translocation in SK-N-SH cells may affect the activity of CaM-dependent enzymes and may alter aspects of cytoskeletal function."
