pmid,date,mesh,journal,affil,athrs,pt,gr
27368099,<DateCompleted>  <Year>2017</Year>  <Month>01</Month>  <Day>10</Day></DateCompleted>,"<MeshHeadingList>  <MeshHeading>    <DescriptorName UI=""D000818"" MajorTopicYN=""N"">Animals</DescriptorName>  </MeshHeading>  <MeshHeading>    <DescriptorName UI=""D047108"" MajorTopicYN=""N"">Embryonic Development</DescriptorName>  </MeshHeading>  <MeshHeading>    <DescriptorName UI=""D044127"" MajorTopicYN=""N"">Epigenesis, Genetic</DescriptorName>  </MeshHeading>  <MeshHeading>    <DescriptorName UI=""D058750"" MajorTopicYN=""Y"">Epithelial-Mesenchymal Transition</DescriptorName>  </MeshHeading>  <MeshHeading>    <DescriptorName UI=""D005355"" MajorTopicYN=""N"">Fibrosis</DescriptorName>    <QualifierName UI=""Q000473"" MajorTopicYN=""Y"">pathology</QualifierName>  </MeshHeading>  <MeshHeading>    <DescriptorName UI=""D006801"" MajorTopicYN=""N"">Humans</DescriptorName>  </MeshHeading>  <MeshHeading>    <DescriptorName UI=""D009369"" MajorTopicYN=""N"">Neoplasms</DescriptorName>    <QualifierName UI=""Q000473"" MajorTopicYN=""Y"">pathology</QualifierName>  </MeshHeading>  <MeshHeading>    <DescriptorName UI=""D014158"" MajorTopicYN=""N"">Transcription, Genetic</DescriptorName>  </MeshHeading></MeshHeadingList>","<Journal>  <ISSN IssnType=""Electronic"">1097-4172</ISSN>  <JournalIssue CitedMedium=""Internet"">    <Volume>166</Volume>    <Issue>1</Issue>    <PubDate>      <Year>2016</Year>      <Month>Jun</Month>      <Day>30</Day>    </PubDate>  </JournalIssue>  <Title>Cell</Title>  <ISOAbbreviation>Cell</ISOAbbreviation></Journal>","<AffiliationInfo>  <Affiliation>Instituto de Neurociencias CSIC-UMH, Avda. Ramón y Cajal s/n, 03550 San Juan de Alicante, Spain. Electronic address: anieto@umh.es.</Affiliation></AffiliationInfo>","<AuthorList CompleteYN=""Y"">  <Author ValidYN=""Y"">    <LastName>Nieto</LastName>    <ForeName>M Angela</ForeName>    <Initials>MA</Initials>    <AffiliationInfo>      <Affiliation>Instituto de Neurociencias CSIC-UMH, Avda. Ramón y Cajal s/n, 03550 San Juan de Alicante, Spain. Electronic address: anieto@umh.es.</Affiliation>    </AffiliationInfo>  </Author>  <Author ValidYN=""Y"">    <LastName>Huang</LastName>    <ForeName>Ruby Yun-Ju</ForeName>    <Initials>RY</Initials>    <AffiliationInfo>      <Affiliation>Department of Obstetrics &amp; Gynaecology, National University Hospital, Singapore 119228, Singapore; Cancer Science Institute of Singapore, National University of Singapore, Singapore 117599, Singapore.</Affiliation>    </AffiliationInfo>  </Author>  <Author ValidYN=""Y"">    <LastName>Jackson</LastName>    <ForeName>Rebecca A</ForeName>    <Initials>RA</Initials>    <AffiliationInfo>      <Affiliation>Department of Biochemistry, Yong Loo Lin School of Medicine, National University of Singapore, Singapore 117596, Singapore.</Affiliation>    </AffiliationInfo>  </Author>  <Author ValidYN=""Y"">    <LastName>Thiery</LastName>    <ForeName>Jean Paul</ForeName>    <Initials>JP</Initials>    <AffiliationInfo>      <Affiliation>Cancer Science Institute of Singapore, National University of Singapore, Singapore 117599, Singapore; Department of Biochemistry, Yong Loo Lin School of Medicine, National University of Singapore, Singapore 117596, Singapore; Institute of Molecular and Cell Biology, A-STAR, Singapore 138673, Singapore. Electronic address: bchtjp@nus.edu.sg.</Affiliation>    </AffiliationInfo>  </Author></AuthorList>","<PublicationTypeList>  <PublicationType UI=""D016428"">Journal Article</PublicationType>  <PublicationType UI=""D013485"">Research Support, Non-U.S. Gov't</PublicationType>  <PublicationType UI=""D016454"">Review</PublicationType></PublicationTypeList>",NA
27368100,<DateCompleted>  <Year>2017</Year>  <Month>01</Month>  <Day>10</Day></DateCompleted>,"<MeshHeadingList>  <MeshHeading>    <DescriptorName UI=""D000818"" MajorTopicYN=""N"">Animals</DescriptorName>  </MeshHeading>  <MeshHeading>    <DescriptorName UI=""D000954"" MajorTopicYN=""N"">Antigens, Surface</DescriptorName>    <QualifierName UI=""Q000378"" MajorTopicYN=""N"">metabolism</QualifierName>  </MeshHeading>  <MeshHeading>    <DescriptorName UI=""D001943"" MajorTopicYN=""N"">Breast Neoplasms</DescriptorName>    <QualifierName UI=""Q000378"" MajorTopicYN=""N"">metabolism</QualifierName>    <QualifierName UI=""Q000473"" MajorTopicYN=""Y"">pathology</QualifierName>  </MeshHeading>  <MeshHeading>    <DescriptorName UI=""D045744"" MajorTopicYN=""N"">Cell Line, Tumor</DescriptorName>  </MeshHeading>  <MeshHeading>    <DescriptorName UI=""D000070819"" MajorTopicYN=""N"">Discoidin Domain Receptor 1</DescriptorName>    <QualifierName UI=""Q000737"" MajorTopicYN=""N"">chemistry</QualifierName>    <QualifierName UI=""Q000378"" MajorTopicYN=""Y"">metabolism</QualifierName>  </MeshHeading>  <MeshHeading>    <DescriptorName UI=""D006801"" MajorTopicYN=""N"">Humans</DescriptorName>  </MeshHeading>  <MeshHeading>    <DescriptorName UI=""D008175"" MajorTopicYN=""N"">Lung Neoplasms</DescriptorName>    <QualifierName UI=""Q000556"" MajorTopicYN=""N"">secondary</QualifierName>  </MeshHeading>  <MeshHeading>    <DescriptorName UI=""D051379"" MajorTopicYN=""N"">Mice</DescriptorName>  </MeshHeading>  <MeshHeading>    <DescriptorName UI=""D009362"" MajorTopicYN=""Y"">Neoplasm Metastasis</DescriptorName>  </MeshHeading>  <MeshHeading>    <DescriptorName UI=""D009363"" MajorTopicYN=""N"">Neoplasm Proteins</DescriptorName>    <QualifierName UI=""Q000378"" MajorTopicYN=""N"">metabolism</QualifierName>  </MeshHeading>  <MeshHeading>    <DescriptorName UI=""D014411"" MajorTopicYN=""N"">Neoplastic Stem Cells</DescriptorName>    <QualifierName UI=""Q000473"" MajorTopicYN=""N"">pathology</QualifierName>  </MeshHeading>  <MeshHeading>    <DescriptorName UI=""D015398"" MajorTopicYN=""Y"">Signal Transduction</DescriptorName>  </MeshHeading></MeshHeadingList>","<Journal>  <ISSN IssnType=""Electronic"">1097-4172</ISSN>  <JournalIssue CitedMedium=""Internet"">    <Volume>166</Volume>    <Issue>1</Issue>    <PubDate>      <Year>2016</Year>      <Month>Jun</Month>      <Day>30</Day>    </PubDate>  </JournalIssue>  <Title>Cell</Title>  <ISOAbbreviation>Cell</ISOAbbreviation></Journal>","<AffiliationInfo>  <Affiliation>Metastasis Research Institute, Breast Cancer Center, Key Laboratory of Arrhythmias of the Ministry of Education of China, Research Center for Translational Medicine, Shanghai East Hospital, Tongji University, Shanghai 200092, China; Shanghai Key Laboratory of Signaling and Disease Research, School of Life Sciences and Technology, Tongji University, Shanghai 200092, China; Cell Biology Program and Center for Metastasis Research, Sloan Kettering Institute for Cancer Research, Memorial Sloan Kettering Cancer Center, New York, NY 10065, USA. Electronic address: gaoh@tongji.edu.cn.</Affiliation></AffiliationInfo>","<AuthorList CompleteYN=""Y"">  <Author ValidYN=""Y"">    <LastName>Gao</LastName>    <ForeName>Hua</ForeName>    <Initials>H</Initials>    <AffiliationInfo>      <Affiliation>Metastasis Research Institute, Breast Cancer Center, Key Laboratory of Arrhythmias of the Ministry of Education of China, Research Center for Translational Medicine, Shanghai East Hospital, Tongji University, Shanghai 200092, China; Shanghai Key Laboratory of Signaling and Disease Research, School of Life Sciences and Technology, Tongji University, Shanghai 200092, China; Cell Biology Program and Center for Metastasis Research, Sloan Kettering Institute for Cancer Research, Memorial Sloan Kettering Cancer Center, New York, NY 10065, USA. Electronic address: gaoh@tongji.edu.cn.</Affiliation>    </AffiliationInfo>  </Author>  <Author ValidYN=""Y"">    <LastName>Chakraborty</LastName>    <ForeName>Goutam</ForeName>    <Initials>G</Initials>    <AffiliationInfo>      <Affiliation>Cell Biology Program and Center for Metastasis Research, Sloan Kettering Institute for Cancer Research, Memorial Sloan Kettering Cancer Center, New York, NY 10065, USA.</Affiliation>    </AffiliationInfo>  </Author>  <Author ValidYN=""Y"">    <LastName>Zhang</LastName>    <ForeName>Zhanguo</ForeName>    <Initials>Z</Initials>    <AffiliationInfo>      <Affiliation>Cell Biology Program and Center for Metastasis Research, Sloan Kettering Institute for Cancer Research, Memorial Sloan Kettering Cancer Center, New York, NY 10065, USA.</Affiliation>    </AffiliationInfo>  </Author>  <Author ValidYN=""Y"">    <LastName>Akalay</LastName>    <ForeName>Intissar</ForeName>    <Initials>I</Initials>    <AffiliationInfo>      <Affiliation>Cell Biology Program and Center for Metastasis Research, Sloan Kettering Institute for Cancer Research, Memorial Sloan Kettering Cancer Center, New York, NY 10065, USA.</Affiliation>    </AffiliationInfo>  </Author>  <Author ValidYN=""Y"">    <LastName>Gadiya</LastName>    <ForeName>Mayur</ForeName>    <Initials>M</Initials>    <AffiliationInfo>      <Affiliation>Cell Biology Program and Center for Metastasis Research, Sloan Kettering Institute for Cancer Research, Memorial Sloan Kettering Cancer Center, New York, NY 10065, USA; Sloan Kettering Division, Weill Cornell Graduate School of Medical Sciences, Cornell University, New York, NY 10065, USA.</Affiliation>    </AffiliationInfo>  </Author>  <Author ValidYN=""Y"">    <LastName>Gao</LastName>    <ForeName>Yaquan</ForeName>    <Initials>Y</Initials>    <AffiliationInfo>      <Affiliation>Metastasis Research Institute, Breast Cancer Center, Key Laboratory of Arrhythmias of the Ministry of Education of China, Research Center for Translational Medicine, Shanghai East Hospital, Tongji University, Shanghai 200092, China; Shanghai Key Laboratory of Signaling and Disease Research, School of Life Sciences and Technology, Tongji University, Shanghai 200092, China.</Affiliation>    </AffiliationInfo>  </Author>  <Author ValidYN=""Y"">    <LastName>Sinha</LastName>    <ForeName>Surajit</ForeName>    <Initials>S</Initials>    <AffiliationInfo>      <Affiliation>Cell Biology Program and Center for Metastasis Research, Sloan Kettering Institute for Cancer Research, Memorial Sloan Kettering Cancer Center, New York, NY 10065, USA.</Affiliation>    </AffiliationInfo>  </Author>  <Author ValidYN=""Y"">    <LastName>Hu</LastName>    <ForeName>Jian</ForeName>    <Initials>J</Initials>    <AffiliationInfo>      <Affiliation>Shanghai Key Laboratory of Signaling and Disease Research, School of Life Sciences and Technology, Collaborative Innovation Center for Brain Science, Tongji University, Shanghai 200092, China.</Affiliation>    </AffiliationInfo>  </Author>  <Author ValidYN=""Y"">    <LastName>Jiang</LastName>    <ForeName>Cizhong</ForeName>    <Initials>C</Initials>    <AffiliationInfo>      <Affiliation>Shanghai Key Laboratory of Signaling and Disease Research, School of Life Sciences and Technology, Collaborative Innovation Center for Brain Science, Tongji University, Shanghai 200092, China.</Affiliation>    </AffiliationInfo>  </Author>  <Author ValidYN=""Y"">    <LastName>Akram</LastName>    <ForeName>Muzaffar</ForeName>    <Initials>M</Initials>    <AffiliationInfo>      <Affiliation>Department of Pathology, Memorial Hospital, Memorial Sloan Kettering Cancer Center, New York, NY 10065, USA.</Affiliation>    </AffiliationInfo>  </Author>  <Author ValidYN=""Y"">    <LastName>Brogi</LastName>    <ForeName>Edi</ForeName>    <Initials>E</Initials>    <AffiliationInfo>      <Affiliation>Department of Pathology, Memorial Hospital, Memorial Sloan Kettering Cancer Center, New York, NY 10065, USA.</Affiliation>    </AffiliationInfo>  </Author>  <Author ValidYN=""Y"">    <LastName>Leitinger</LastName>    <ForeName>Birgit</ForeName>    <Initials>B</Initials>    <AffiliationInfo>      <Affiliation>Molecular Medicine Section, National Heart and Lung Institute, Imperial College London, London SW7 2AZ, UK.</Affiliation>    </AffiliationInfo>  </Author>  <Author ValidYN=""Y"">    <LastName>Giancotti</LastName>    <ForeName>Filippo G</ForeName>    <Initials>FG</Initials>    <AffiliationInfo>      <Affiliation>Cell Biology Program and Center for Metastasis Research, Sloan Kettering Institute for Cancer Research, Memorial Sloan Kettering Cancer Center, New York, NY 10065, USA; Department of Cancer Biology and David H. Koch Center for Applied Research of Genitourinary Cancers, UT MD Anderson Cancer Center, Houston, TX 77054, USA. Electronic address: fggiancotti@mdanderson.org.</Affiliation>    </AffiliationInfo>  </Author></AuthorList>","<PublicationTypeList>  <PublicationType UI=""D016428"">Journal Article</PublicationType>  <PublicationType UI=""D052061"">Research Support, N.I.H., Extramural</PublicationType>  <PublicationType UI=""D013485"">Research Support, Non-U.S. Gov't</PublicationType></PublicationTypeList>","<GrantList CompleteYN=""Y"">  <Grant>    <GrantID>R35 CA197566</GrantID>    <Acronym>CA</Acronym>    <Agency>NCI NIH HHS</Agency>    <Country>United States</Country>  </Grant>  <Grant>    <GrantID>R35 CA197566</GrantID>    <Agency/>    <Country>International</Country>  </Grant>  <Grant>    <GrantID>P30 CA008748</GrantID>    <Acronym>CA</Acronym>    <Agency>NCI NIH HHS</Agency>    <Country>United States</Country>  </Grant>  <Grant>    <GrantID>P01 CA094060</GrantID>    <Acronym>CA</Acronym>    <Agency>NCI NIH HHS</Agency>    <Country>United States</Country>  </Grant>  <Grant>    <GrantID>R01 CA175712</GrantID>    <Acronym>CA</Acronym>    <Agency>NCI NIH HHS</Agency>    <Country>United States</Country>  </Grant></GrantList>"
27368101,<DateCompleted>  <Year>2017</Year>  <Month>01</Month>  <Day>10</Day></DateCompleted>,"<MeshHeadingList>  <MeshHeading>    <DescriptorName UI=""D027182"" MajorTopicYN=""N"">Amino Acid Transport System y+</DescriptorName>    <QualifierName UI=""Q000378"" MajorTopicYN=""N"">metabolism</QualifierName>  </MeshHeading>  <MeshHeading>    <DescriptorName UI=""D000818"" MajorTopicYN=""N"">Animals</DescriptorName>  </MeshHeading>  <MeshHeading>    <DescriptorName UI=""D001943"" MajorTopicYN=""N"">Breast Neoplasms</DescriptorName>    <QualifierName UI=""Q000378"" MajorTopicYN=""Y"">metabolism</QualifierName>  </MeshHeading>  <MeshHeading>    <DescriptorName UI=""D003545"" MajorTopicYN=""N"">Cysteine</DescriptorName>    <QualifierName UI=""Q000378"" MajorTopicYN=""Y"">metabolism</QualifierName>  </MeshHeading>  <MeshHeading>    <DescriptorName UI=""D018698"" MajorTopicYN=""N"">Glutamic Acid</DescriptorName>    <QualifierName UI=""Q000378"" MajorTopicYN=""N"">metabolism</QualifierName>  </MeshHeading>  <MeshHeading>    <DescriptorName UI=""D006801"" MajorTopicYN=""N"">Humans</DescriptorName>  </MeshHeading>  <MeshHeading>    <DescriptorName UI=""D051795"" MajorTopicYN=""N"">Hypoxia-Inducible Factor 1, alpha Subunit</DescriptorName>    <QualifierName UI=""Q000378"" MajorTopicYN=""Y"">metabolism</QualifierName>  </MeshHeading>  <MeshHeading>    <DescriptorName UI=""D064799"" MajorTopicYN=""N"">Hypoxia-Inducible Factor-Proline Dioxygenases</DescriptorName>    <QualifierName UI=""Q000378"" MajorTopicYN=""Y"">metabolism</QualifierName>  </MeshHeading>  <MeshHeading>    <DescriptorName UI=""D061986"" MajorTopicYN=""N"">MCF-7 Cells</DescriptorName>  </MeshHeading>  <MeshHeading>    <DescriptorName UI=""D051379"" MajorTopicYN=""N"">Mice</DescriptorName>  </MeshHeading>  <MeshHeading>    <DescriptorName UI=""D019899"" MajorTopicYN=""Y"">Paracrine Communication</DescriptorName>  </MeshHeading>  <MeshHeading>    <DescriptorName UI=""D064726"" MajorTopicYN=""N"">Triple Negative Breast Neoplasms</DescriptorName>    <QualifierName UI=""Q000378"" MajorTopicYN=""Y"">metabolism</QualifierName>  </MeshHeading></MeshHeadingList>","<Journal>  <ISSN IssnType=""Electronic"">1097-4172</ISSN>  <JournalIssue CitedMedium=""Internet"">    <Volume>166</Volume>    <Issue>1</Issue>    <PubDate>      <Year>2016</Year>      <Month>Jun</Month>      <Day>30</Day>    </PubDate>  </JournalIssue>  <Title>Cell</Title>  <ISOAbbreviation>Cell</ISOAbbreviation></Journal>","<AffiliationInfo>  <Affiliation>Department of Medical Oncology, Dana-Farber Cancer Institute and Brigham and Women's Hospital, Boston, MA 02215, USA.</Affiliation></AffiliationInfo>","<AuthorList CompleteYN=""Y"">  <Author ValidYN=""Y"">    <LastName>Briggs</LastName>    <ForeName>Kimberly J</ForeName>    <Initials>KJ</Initials>    <AffiliationInfo>      <Affiliation>Department of Medical Oncology, Dana-Farber Cancer Institute and Brigham and Women's Hospital, Boston, MA 02215, USA.</Affiliation>    </AffiliationInfo>  </Author>  <Author ValidYN=""Y"">    <LastName>Koivunen</LastName>    <ForeName>Peppi</ForeName>    <Initials>P</Initials>    <AffiliationInfo>      <Affiliation>Biocenter Oulu, Faculty of Biochemistry and Molecular Medicine, Oulu Center for Cell-Matrix Research, University of Oulu, FIN-90014 Oulu, Finland.</Affiliation>    </AffiliationInfo>  </Author>  <Author ValidYN=""Y"">    <LastName>Cao</LastName>    <ForeName>Shugeng</ForeName>    <Initials>S</Initials>    <AffiliationInfo>      <Affiliation>Department of Biological Chemistry and Molecular Pharmacology, Harvard Medical School, Boston, MA 02115, USA.</Affiliation>    </AffiliationInfo>  </Author>  <Author ValidYN=""Y"">    <LastName>Backus</LastName>    <ForeName>Keriann M</ForeName>    <Initials>KM</Initials>    <AffiliationInfo>      <Affiliation>The Department of Chemical Physiology, The Scripps Research Institute, La Jolla, CA 92037, USA.</Affiliation>    </AffiliationInfo>  </Author>  <Author ValidYN=""Y"">    <LastName>Olenchock</LastName>    <ForeName>Benjamin A</ForeName>    <Initials>BA</Initials>    <AffiliationInfo>      <Affiliation>Division of Cardiovascular Medicine, Department of Medicine, The Brigham and Women's Hospital, Harvard Medical School, Boston, MA 02115, USA.</Affiliation>    </AffiliationInfo>  </Author>  <Author ValidYN=""Y"">    <LastName>Patel</LastName>    <ForeName>Hetalben</ForeName>    <Initials>H</Initials>    <AffiliationInfo>      <Affiliation>Department of Physiology and Biophysics, Albert Einstein College of Medicine, Bronx, NY 10461, USA.</Affiliation>    </AffiliationInfo>  </Author>  <Author ValidYN=""Y"">    <LastName>Zhang</LastName>    <ForeName>Qing</ForeName>    <Initials>Q</Initials>    <AffiliationInfo>      <Affiliation>Department of Pathology and Laboratory Medicine, University of North Carolina, Chapel Hill, NC 27599, USA.</Affiliation>    </AffiliationInfo>  </Author>  <Author ValidYN=""Y"">    <LastName>Signoretti</LastName>    <ForeName>Sabina</ForeName>    <Initials>S</Initials>    <AffiliationInfo>      <Affiliation>Department of Pathology, Brigham and Women's Hospital, Harvard Medical School, Boston, MA 02115, USA.</Affiliation>    </AffiliationInfo>  </Author>  <Author ValidYN=""Y"">    <LastName>Gerfen</LastName>    <ForeName>Gary J</ForeName>    <Initials>GJ</Initials>    <AffiliationInfo>      <Affiliation>Department of Physiology and Biophysics, Albert Einstein College of Medicine, Bronx, NY 10461, USA.</Affiliation>    </AffiliationInfo>  </Author>  <Author ValidYN=""Y"">    <LastName>Richardson</LastName>    <ForeName>Andrea L</ForeName>    <Initials>AL</Initials>    <AffiliationInfo>      <Affiliation>Department of Pathology, Brigham and Women's Hospital, Harvard Medical School, Boston, MA 02115, USA.</Affiliation>    </AffiliationInfo>  </Author>  <Author ValidYN=""Y"">    <LastName>Witkiewicz</LastName>    <ForeName>Agnieszka K</ForeName>    <Initials>AK</Initials>    <AffiliationInfo>      <Affiliation>Department of Pathology, University of Texas Southwestern Medical Center, Dallas, TX 75235, USA.</Affiliation>    </AffiliationInfo>  </Author>  <Author ValidYN=""Y"">    <LastName>Cravatt</LastName>    <ForeName>Benjamin F</ForeName>    <Initials>BF</Initials>    <AffiliationInfo>      <Affiliation>The Department of Chemical Physiology, The Scripps Research Institute, La Jolla, CA 92037, USA.</Affiliation>    </AffiliationInfo>  </Author>  <Author ValidYN=""Y"">    <LastName>Clardy</LastName>    <ForeName>Jon</ForeName>    <Initials>J</Initials>    <AffiliationInfo>      <Affiliation>Department of Biological Chemistry and Molecular Pharmacology, Harvard Medical School, Boston, MA 02115, USA.</Affiliation>    </AffiliationInfo>  </Author>  <Author ValidYN=""Y"">    <LastName>Kaelin</LastName>    <ForeName>William G</ForeName>    <Initials>WG</Initials>    <Suffix>Jr</Suffix>    <AffiliationInfo>      <Affiliation>Department of Medical Oncology, Dana-Farber Cancer Institute and Brigham and Women's Hospital, Boston, MA 02215, USA; Howard Hughes Medical Institute, Chevy Chase, MD 20815, USA. Electronic address: william_kaelin@dfci.harvard.edu.</Affiliation>    </AffiliationInfo>  </Author></AuthorList>","<PublicationTypeList>  <PublicationType UI=""D016428"">Journal Article</PublicationType>  <PublicationType UI=""D052061"">Research Support, N.I.H., Extramural</PublicationType></PublicationTypeList>","<GrantList CompleteYN=""Y"">  <Grant>    <GrantID>R37 CA087660</GrantID>    <Acronym>CA</Acronym>    <Agency>NCI NIH HHS</Agency>    <Country>United States</Country>  </Grant>  <Grant>    <GrantID>R01 CA068490</GrantID>    <Acronym>CA</Acronym>    <Agency>NCI NIH HHS</Agency>    <Country>United States</Country>  </Grant>  <Grant>    <GrantID>P50 CA058223</GrantID>    <Acronym>CA</Acronym>    <Agency>NCI NIH HHS</Agency>    <Country>United States</Country>  </Grant>  <Grant>    <Acronym>HHMI</Acronym>    <Agency>Howard Hughes Medical Institute</Agency>    <Country>United States</Country>  </Grant>  <Grant>    <Acronym>HHMI</Acronym>    <Agency>Howard Hughes Medical Institute</Agency>    <Country>United States</Country>  </Grant></GrantList>"
